,author_id,tweet_id,created_at,text
216,1086374720994504710,1630931609791627266,2023-03-01,"@MeireTrabbold @MessiasAlvees @77_frota Aqui em casa todos tomaram e ninguém pegou, nem crianças e nem os dois idosos. Graças a Deus e à ciência!"
217,1241910014513684480,1630924691719241730,2023-03-01,@yosoyzarpado Eu quero
218,96411421,1630908037593530369,2023-03-01,@PortalGavassi @festivalgrls Aiii que tudo. Estava preocupado  pois no mesmo dia  tenho apresentação do meu sobrinho
219,2516966574,1630793879497719808,2023-03-01,I'm at Lincoln's House in São Paulo https://t.co/9yV0z6AXx7
220,2516966574,1630793808643338240,2023-03-01,"I'm at C.D.H.U. Perus in Sao Paulo, sp https://t.co/sGybmq5myf"
221,2516966574,1630793764259221504,2023-03-01,"I'm at Rua Felipe Cardoso de Campos in São Paulo, SP https://t.co/3SoMNsPfNv"
222,2516966574,1630793538744078336,2023-03-01,I'm at Rua Gastone Lúcia De C. Beltrão in São Paulo https://t.co/zoEp0w3b8r
223,2516966574,1630793459048095744,2023-03-01,I'm at Rua Almofada in São Paulo https://t.co/zEz45lCkI9
224,2516966574,1630793286968389632,2023-03-01,I'm at Rua Estevam Ribeiro Resende in São Paulo https://t.co/kPSysA3k8j
225,2516966574,1630793251224444929,2023-03-01,"I'm at Rua Antônio de Pádua Dias in São Paulo, SP https://t.co/qcPbfwAUmv"
226,2516966574,1630793170093998080,2023-03-01,I'm at Rua Dona Rosina in São Paulo https://t.co/3IlEHfqd9f
227,1536545711948541953,1630785886135672832,2023-03-01,Eu te amo sério
228,2516966574,1630785511760510976,2023-03-01,"I'm at Avenida Comendador Fiorelli Peccicacco in São Paulo, SP https://t.co/PlNaOKO3xQ"
229,1536545711948541953,1630782546928623616,2023-03-01,Eu até mandaria msg pra ela agr mas provavelmente ela ta dormindo
230,1536545711948541953,1630782466813198337,2023-03-01,Pensando seriamente em passar meu twitter pra minha psicologa
231,2516966574,1630777376685666305,2023-03-01,I'm at Rua Crispim do Amaral in São Paulo https://t.co/MjouibgYbE
232,2516966574,1630777222863765505,2023-03-01,"I'm at Praça Inácio Dias in Sao Paulo, SP https://t.co/5IHuIzkaRj"
233,1536545711948541953,1630777203670515713,2023-03-01,Ele foi dormir mas eu n to com sono
234,2516966574,1630777183605071875,2023-03-01,"I'm at Passarela de Perus in São Paulo, SP https://t.co/ssmffWP9kh"
235,1536545711948541953,1630775802655653889,2023-03-01,Eu qria só Sla
236,1536545711948541953,1630775725341933568,2023-03-01,E fica nesse ciclo infinito
237,1536545711948541953,1630775692878049281,2023-03-01,Eu passo 2 horas na escola e fico triste pra cacete e só fico feliz quando acordo
238,1536545711948541953,1630775616151617536,2023-03-01,Eu acho incrível que eu tô acordando a pessoa mais feliz desse mundo
239,1536545711948541953,1630775549827207168,2023-03-01,Eu simplesmente n aguento mais
240,2516966574,1630773603850412035,2023-03-01,"I'm at Estação Perus (CPTM) - @cptm_oficial in São Paulo, SP https://t.co/8HNiPOG01Y"
241,1241910014513684480,1630773390708547585,2023-03-01,"Já usaram o flingster?? 

Aquela gozada na Cia antes de dormir https://t.co/pnImD9rUwk"
242,1536545711948541953,1630770651177836545,2023-03-01,Sério vão se fuder
243,1536545711948541953,1630770597125844993,2023-03-01,Dps de hoje eu n quero mais ir pra aql escola
244,1536545711948541953,1630770533896732673,2023-03-01,Que vontade de simplesmente faltar pra sempre
245,212384083,1630763795139244037,2023-03-01,Mais uma vez um homem preto e gay com a autoestima em dia saindo pra um branco sem graça e inseguro pq pro Brasil ele é arrogante.
246,1500625452645457920,1630762398880497667,2023-03-01,"@gleisi Esqueceu de comparar, se estudar um pouco verá que com a Dilma a presi anta o juros passou dos 414 ao ano"
247,1241910014513684480,1630759784675672065,2023-03-01,Ganhei caralhoooooo
248,212384083,1630758762733531137,2023-03-01,"O Black choramingando justiça parece meus alunos do 6° ano tentando justificar o erro apontando o outro, vou falar como falo pra eles... QUAL SUA RESPONSABILIDADE NO QUE TÁ ACONTECENDO? O QUE O OUTRO FAZ NÃO É PROBLEMA TEU, SE RESPONSABILIZE PELO O QUE VOCÊ FAZ!"
249,212384083,1630753937702756352,2023-03-01,"Quando a dor é tua, no fundo ninguém se importa..."
250,212384083,1630753636065198085,2023-03-01,@faahlso Kkkkkkkk
251,1462965745651011587,1630736001248243718,2023-03-01,Me sinto com 80 anos de tão cansada q eu to 😫
252,989531687724945408,1630728748180942848,2023-03-01,@RTdaFlaTT @armando_heck @GuilhermeBoulos Acharam o que eles queriam! 🤣🤣🤣
253,989531687724945408,1630721709329330176,2023-03-01,@opilhado 🤣🤣🤣🤣🤡🤡🤡🤡🤡
254,1241910014513684480,1630721374103691264,2023-03-01,@FelipinhoSouzao Sim https://t.co/RPazBqPacx
255,989531687724945408,1630721359398436864,2023-03-01,@diegomuguetrj 🤣🤣🤣🤡🤡🤡🤡🤡
256,989531687724945408,1630721222391603200,2023-03-01,🤡🤡🤡🤡🤡🤣🤣🤣🤣🤣 https://t.co/3SRW3I3GHc
257,1093584991731306497,1630719451732557824,2023-02-28,"Atuesta é o assunto do dia! Vamos pra live? Imagem exclusiva (e mais detalhada) da lesão do colombiano e muito mais! 

Clica no link 👇🏻 e vem!

https://t.co/B8gdB5UmXl https://t.co/Ke2RQN4EZM"
258,1462965745651011587,1630698669178601474,2023-02-28,"Malhei braço e perna hj, perna na academia e braço no trabalho guardando 2 palete de mercadoria, estou destruída 😮‍💨😫"
259,1536545711948541953,1630683521936179200,2023-02-28,Ainda bem q me afastei
260,1536545711948541953,1630683307993182209,2023-02-28,Caitlyn e xayah nerfada vsfd https://t.co/S3RPubACfk
261,2516966574,1630663069041827846,2023-02-28,"I'm at Estação Perus (CPTM) - @cptm_oficial in São Paulo, SP https://t.co/yKpUAaPi7j"
262,2516966574,1630662925852483602,2023-02-28,"I'm at Praça Inácio Dias in Sao Paulo, SP https://t.co/fyMoBjFwbv"
263,2516966574,1630662861587378176,2023-02-28,"I'm at Avenida Comendador Fiorelli Peccicacco in São Paulo, SP https://t.co/FC9ccBIUme"
264,2516966574,1630661994352091138,2023-02-28,"I'm at Felipe Cardoso de Campos - 8015/10, 8194/10 in São Paulo https://t.co/HLqUh2uuSQ"
265,2516966574,1630661839200591875,2023-02-28,"I'm at Rua Felipe Cardoso de Campos in São Paulo, SP https://t.co/8myd1fy5GN"
266,2516966574,1630661738084311055,2023-02-28,"I'm at C.D.H.U. Perus in Sao Paulo, sp https://t.co/7xrh9Trora"
267,936290099368734721,1630654718434332674,2023-02-28,@fbcjr @somosaopaulinos Kkkkkkkkkkkkkk
268,289408600,1630642035966263296,2023-02-28,Acabei de ter a certeza que sou uma pessoa mt descartável kkkkkkk 🥲
269,1093584991731306497,1630631420740681734,2023-02-28,"E como podem ver, ele deixou o gramado mancando na sequência. https://t.co/UxT5OLOQHk"
270,1093584991731306497,1630631074156912641,2023-02-28,Atuesta sendo atendido logo quando caiu no gramado e a atividade (famoso coletivo) terminou no mesmo instante. https://t.co/WWrODRFS1d
271,1093584991731306497,1630625709763772430,2023-02-28,"O exato momento da lesão de Atuesta - registrado pelo Tá Lá Dentro na atividade entre os reservas no último domingo após a vitória do Palmeiras sobre a Ferroviária 

🎥 @th9lopes https://t.co/HAQGidkWoz"
272,1093584991731306497,1630622097708924948,2023-02-28,"Registramos aqui em primeira mão, hoje o Palmeiras informou: 

O meio-campista Atuesta sofreu uma lesão no joelho direito no domingo (26) e passará por exames complementares na tarde desta terça-feira (28). https://t.co/WWrODRFS1d"
273,96411421,1630601683402096641,2023-02-28,@grupomaitepb Meu Deus.
274,3226266760,1630588498716553216,2023-02-28,"Pedro Henrique, ativista baiano de direitos humanos, foi assassinado por três homens encapuzados em 2018. Após anos sem resposta, a investigação ainda não foi concluída.

https://t.co/BqpycNjcJf"
275,289408600,1630532868651864065,2023-02-28,Ontem fui pro futvôlei e depois pra academia ainda.. pai tá mt atleta pqp
276,234832661,1630441981087293440,2023-02-28,#ForaFredNicacio https://t.co/SJvxJZkX1d
277,2516966574,1630422643408003078,2023-02-28,I'm at Lincoln's House in São Paulo https://t.co/LyX4I1k9Gh
278,2516966574,1630422604870721536,2023-02-28,"I'm at C.D.H.U. Perus in Sao Paulo, sp https://t.co/u3fyQuVepL"
279,2516966574,1630422571563794432,2023-02-28,"I'm at Rua Felipe Cardoso de Campos in São Paulo, SP https://t.co/RoMmBCF5bu"
280,2516966574,1630421287485964290,2023-02-28,"I'm at Crispim Do Amaral - 8015/10, 8194/10 in São Paulo https://t.co/TXl8rbaEcV"
281,2516966574,1630421228744847363,2023-02-28,I'm at Rua Crispim do Amaral in São Paulo https://t.co/cDCn0n4EtQ
282,2516966574,1630421142379872260,2023-02-28,"I'm at Praça Inácio Dias in Sao Paulo, SP https://t.co/ZE2WKYDZeH"
283,2516966574,1630421041397784576,2023-02-28,"I'm at Passarela de Perus in São Paulo, SP https://t.co/Hbx98E52tf"
284,2516966574,1630420919242960898,2023-02-28,"I'm at Estação Perus (CPTM) - @cptm_oficial in São Paulo, SP https://t.co/B4qXRS61rF"
285,1536545711948541953,1630408303774769152,2023-02-28,Sério  vsfdkkkkm https://t.co/AbO2f9fjZ2
286,1536545711948541953,1630404313125208068,2023-02-28,Se eu realmente tiver bordeline eu paro de tentar ter contato com QUALQUER pessoa
287,212384083,1630400746922418177,2023-02-28,Chega uma hora que a gente precisa reavaliar as coisas...
288,1536545711948541953,1630399198800560132,2023-02-28,Vai flopar mas ok https://t.co/EgGpLr1D1a
289,1536545711948541953,1630396975790039042,2023-02-28,Eu percebi agora o quão incrível minha família e
290,1536545711948541953,1630396082990510089,2023-02-28,Walking like a dog https://t.co/0ZJ0fGpjSA
291,1536545711948541953,1630395787631837184,2023-02-28,Eles são incríveis
292,1536545711948541953,1630395721693253636,2023-02-28,É você estava certo
293,630651688,1630392036024098817,2023-02-28,"Esperava nada da bomba de Fumaça,  mas ela entregou tudo! 🤣🤣🤣🤣🤣

#RedeBBB https://t.co/2QzQewRm7q"
294,1500625452645457920,1630382314868940800,2023-02-28,"@LulaOficial Me fale seu plano de governo sobre tudo plano econômico!!!
Plano ambiental já vimos, né a máfia das ONG na Amazônia comendo solto!

E é ainda fevereiro  de 2023 teve o maior número de desmatamento nos últimos anos, se estão explodindo máquinas de garanpireiro, tem algo errado!"
295,1288929620717457409,1630381454193565696,2023-02-28,carinha de quem não tava aguentando o treino de pernas e voltou mais cedo pq tava com enjoo https://t.co/zbdxrcOsJA
296,1500625452645457920,1630381439215624196,2023-02-28,"@brom_elisa Não me importo com o preço da gasolina,  na verdade nunca me importei, primeiro porque eu trabalho e graças a meu esforço só bem remunerado!
Quem deve estar se importando é a turma da esquerda que o câncer do país,o povinho futuro!"
297,1500625452645457920,1630380216282501120,2023-02-28,@CharlesDCunha @joicehasselmann Quem elegeu os ex-presidiário foi o STF
298,1500625452645457920,1630379487459246081,2023-02-28,@joicehasselmann Vai cassar um trabalho!
299,1462965745651011587,1630357555045097472,2023-02-28,@bbygirlxzx Não sou não amorrrrr
