,author_id,tweet_id,created_at,text
0,767510186277867521,1546643394251968513,2022-07-11,Acabou de publicar uma foto em Passadaaaa https://t.co/erS8UdQglt
1,702298153366773760,1546634518861324290,2022-07-11,"nós hoje de manhã ""tudo que aconteceu, foi na amizade né? ok""

eu agora chorando pq tô com sdd e ela me chamando pra ir dormir lá dnv"
2,702298153366773760,1546633913598091275,2022-07-11,https://t.co/YCc3SIrfsK
3,1514627447936978944,1546629632614535169,2022-07-11,Aguardem... @sbtthenoite com @danilogentili obrigado @anacarolinakotacho ela cia e @cristofoli_fagner 👏🏽👏🏽👏🏽🔥🔥🔥📺📺📺 #TV #thenoitecomdanilogentili #sbt em SBT - Sistema Brasileiro De Televisão https://t.co/mvinbp2SsE
4,1519066762528047104,1546616615235735552,2022-07-11,"@OnBelinha Como bem todos os dias graças a Deus e minha disposição para trabalhar..pode não ter emprego, mas tem vários trabalhos remunerados. 
Sou pedreiro e Presiso de ajudante. 
Aí ninguém que."
5,1519066762528047104,1546614752612388866,2022-07-11,"@OnBelinha @Brasil8128 Nada justifica o ocorrido...porem todos armados e regado de cachaça, só para lembrar os dois são de farda."
6,1500625452645457920,1546608063578357760,2022-07-11,"@LulaSilvaLivre Também não tem vergonha na cara quem vota em ex presidiário, ligado ao narcotráfico!"
7,1311370120577548288,1546608039075217420,2022-07-11,Acabou de publicar uma foto em SBT - Sistema Brasileiro De Televisão https://t.co/cjQSgiqWbK
8,1425466161689473026,1546602756017897472,2022-07-11,@AlvesHelena22 Parabéns. Que Deus te abençoe sempre
9,92319897,1546601165848285187,2022-07-11,Acabou de publicar uma foto em Cantareira Norte Shopping https://t.co/To4RMObfHT
10,69958390,1546566145125261315,2022-07-11,Literalmente uhsauhsauhsa https://t.co/BKyEJSCZJF
11,1134868257343770630,1546563681055494144,2022-07-11,"Bora é hj em Perus, Sao Paulo, Brazil https://t.co/Pq4fLWVVDz"
12,45675709,1546562500639981570,2022-07-11,3kg de filtro pra uma foto emburrado que eu vou apagar eventualmente em Caieiras https://t.co/leE83MA7C4
13,1024409454077505536,1546558166804070400,2022-07-11,@edimaraaaa Eu por isso q eh bom sair...
14,1024409454077505536,1546557834212610049,2022-07-11,"@rodolfo1975 @UOLEsporte @UOL Itaquerão eh o seu butico

O nome do estádio eh Neo Química Arena"
15,1024409454077505536,1546555895953358848,2022-07-11,"@mouraul Eu daria fim no Luan, Xavier, Ramiro e Vital e traria um ponta bom e um volante"
16,1024409454077505536,1546555206187552770,2022-07-11,@TiagoSalazar Maycon Du e Renato
17,900191191760818177,1546553712348483585,2022-07-11,tô indo embora de são paulo chorando e num misto de tristeza profunda com realização e felicidade
18,900191191760818177,1546552844819603456,2022-07-11,"eu tô tão feliz meu deus do céu
não tenho palavras pra descrever esse final de semana e o quanto ele significou na minha vida"
19,1426144142720131077,1546551051108712453,2022-07-11,"Enquanto você temer o diabo, satanás ou as forças do mal, ainda haverá muito o que trabalhar sobre o fortalecimento da sua personalidade ✨✨✨💋 em Caieiras https://t.co/rgUBTxF7d0"
20,1530649753108742147,1546542056767619072,2022-07-11,Eu bebada viro atriz pornô https://t.co/5KJp7ZLiBR
21,38436784,1546534172235218944,2022-07-11,"Triste a notícia da morte do vereador  Uruguaio, de Santa Bárbara d’Oeste. Em seu quinto mandato, Uruguaio nos deixa aos 68 anos, vítima de câncer. Que Deus conforte a família nesse momento de luto. https://t.co/Gjd4ay5OaQ"
22,82245238,1546524265406574597,2022-07-11,Meu lugar é aqui ❤️ em Onde Deus Está Presente https://t.co/2Hf7OC96VR
23,128741723,1546500493970915328,2022-07-11,Sem fé tudo é absurdo
24,1024409454077505536,1546500137312129030,2022-07-11,"@portadosfundos @oedgama @LeandroRamos @thatilopes @jaoseupimenta @opedrobenevides O começo eh bem minha casa e termina comigo na casa dos outros...

Me identifiquei pra caralho kkkk"
25,60131952,1546499966390222848,2022-07-11,"#Mae Janaína e #filha Letícia
🌺💐🌷💮🌸 em Perus, Sao Paulo, Brazil https://t.co/czlF402yvV"
26,60131952,1546498253562081280,2022-07-11,#selfies em Parada De Taipas Zona Norte https://t.co/ytCoBecN3r
27,96411421,1546485532263424000,2022-07-11,"A QUE PONTOS  CHEGAMOS???
QUAL A NECESSIDADE  DE UM ANESTESISTA  ESTUPRAR UMA PACIENTE  CEDADA? https://t.co/UYJmQHKgsQ"
28,930458238042214401,1546472762667020288,2022-07-11,"#ObreirosEmFoco RESPONDE!

Gostaria de saber o que significa a queda da Babilônia em Apocalipse 17? 

#ObreiroDeveSaber em Universal Taipas - SP https://t.co/lyNTXDEcEb"
29,96411421,1546471300939538432,2022-07-11,O Feat vem. https://t.co/o6jalW2oam
30,1461666037838098432,1546459438093148160,2022-07-11,Acabou de publicar uma foto em SBT - Sistema Brasileiro De Televisão https://t.co/j2Fz3W6jXj
31,930458238042214401,1546453499587723267,2022-07-11,Acabou de publicar uma foto em Universal Taipas - SP https://t.co/pgyvQ8xJC8
32,170497442,1546453403580203012,2022-07-11,"Pedal a Longa Distância.
Qth de destino Jaguariúna SP. 
Recordação. em Rodovia dos Bandeirantes https://t.co/vm4EcC2MUO"
33,222268948,1546447087545597960,2022-07-11,"Você sabia que durante o inverno, também é uma época boa pra fazer uma tattoo?"
34,1103694269745938433,1546440193556766720,2022-07-11,"@leandroruschel Que coisa vergonhosa, Cristovam Buarque…é falta do que fazer? Na procura de algo, achou “sarna para se coçar”?  Vai se catar!"
35,1103694269745938433,1546439051372363776,2022-07-11,"@jairbolsonaro Tabet, TÁ BEm Tonto né Tabet… sempre na ironia de bestices ou idiotices… vai te catar!"
36,1103694269745938433,1546437642144944128,2022-07-11,"@lordivan22 Cadê a “debilsinha” da Greta e o “artista” metido Di Caprio, além de outros imbecís falando desses incêndio na California???"
37,1397347768209915906,1546415593972277248,2022-07-11,"Tomar café de ontem, parado na garrafa, sem açúcar, só p sentir o gosto da segunda"
38,1397347768209915906,1546414903447240704,2022-07-11,Mood eh manjar cada vez mais de politica p se frustrar ainda mais c a vida
39,1397347768209915906,1546414353150521344,2022-07-11,"E aí tio, eh normal acordar c saudade da crush?"
40,853505977,1546410960642080768,2022-07-11,Acabou de publicar uma foto em Caieiras https://t.co/Ccqq5DyzKn
41,853505977,1546405261224472577,2022-07-11,Acabou de publicar uma foto em Caieiras https://t.co/qV8FsmKEny
42,1471651837724045314,1546401565464055808,2022-07-11,"eu só n tô com a pessoa q eu amo pq, ela ainda n esqueceu a pessoa q ela amou, ou ama."
43,1123954088528494592,1546350237723381763,2022-07-11,@livmandri https://t.co/tAFVJftj1v
44,1123954088528494592,1546345699528380416,2022-07-11,@naclara_27 beija o @rushadornato por favor eu te imploro
45,1123954088528494592,1546344228925706241,2022-07-11,o cara me pega uma elu eu to chorando por ele meu deus do céu
46,2217467531,1546319913710718976,2022-07-11,@accessbear BRASIL BEAR ACESS BRASIL https://t.co/BJ9C83WkjS
47,2217467531,1546319809662550017,2022-07-11,KKKKKKKKKKKKKKKKKKKKKKKKKKKKKKKKKKKKKKKKKKKKKKKKKKKK JUR
48,2217467531,1546319807699714048,2022-07-11,Você ganha a comida e uma reflexão de sobremesa 🤣K https://t.co/7dqPTaRH1k
49,2217467531,1546319240021549057,2022-07-11,@sunburstsky 🚩🚩🚩🚩🚩🚩
50,2217467531,1546318811862896640,2022-07-11,@nelmustdie VOU DEIXAR EM ABERTO SOU MISTERIOSO
51,2217467531,1546314561669709824,2022-07-11,@sunburstsky KENTICRITICA. APOIA INCESTO?
52,2217467531,1546314448784314368,2022-07-11,GOD IT'S ME AGAIN https://t.co/tb2M9ZKAX7
53,2217467531,1546314090787766272,2022-07-11,BEAR COME TO BRAZIL https://t.co/84L2Jf0Ake https://t.co/tb2M9ZKAX7
54,2217467531,1546313830376038404,2022-07-11,@iamblackbear IS BRAZIL ON TOUR? TELL US I'LL NOT TELL ANYONE
55,2217467531,1546313315332268037,2022-07-11,Tem 60 pessoas no meu cf então se liguem ele eu quero beijar vcs
56,2217467531,1546313313734238209,2022-07-11,Meu deus fui atacado pera aí https://t.co/wTKG1CTM3U
57,2217467531,1546312862209134597,2022-07-11,@danielaoliveirz No telegram é grátis !
58,2217467531,1546311727456952323,2022-07-11,@Imaginedragors https://t.co/wRTo3C59B2
59,2217467531,1546311247439826945,2022-07-11,@Imaginedragors NÃO SÉRIO KKKKKKKKKKKKKKKKKKKKKKKKKKKKKKKKKKKKKKKKKKKKKKKKKKKK
60,93458966,1546301724331220998,2022-07-11,"pronto, agora posso ver coisas sobre Stranger Things"
61,612187552,1546300255842492417,2022-07-11,Te amo Corinthians @corinthians https://t.co/PN9zX66GAh
62,2796688251,1546295785393881089,2022-07-11,"@adv_bianca 😔
👉🏾👈🏾
  sim"
63,336585493,1546295203119747072,2022-07-11,"Estamos em Julho, quase na metade do ano"
64,1500625452645457920,1546294397569998848,2022-07-11,"@floras_s @vanessasoaresc4 Acho sim da mesma maneira que Acho racismo dar privilégio a uma pessoa por sua cor, sou de família negra sou preto e não concordo e ponto minha opinião que tem competência trabalha, e paga seus estudos ou senta estuda e passa em universidade pública!"
65,1500625452645457920,1546284967432523776,2022-07-11,"@vanessasoaresc4 Pobre preto?
 Vim de família pobre, mãe doméstica e sou negro, e nem a sim sou vítimista  não precisei de cota nem fies, trabalhei estudei em universidade privada!
 Estudo infelizmente  ao e para todos, temos Cuba como exemplo!"
66,69958390,1546283504396341250,2022-07-11,Estou oficialmente velha
67,69958390,1546283502521487361,2022-07-11,Acabei de fazer uma palavra cruzada.
68,128741723,1546281461397028864,2022-07-10,"Vai na raça que ganhamos. 

Corinthians 1 x Flamengo 
#rodada16 https://t.co/Ggk8LepJWC"
69,503910942,1546279748648800257,2022-07-10,https://t.co/TrIb0HX08G
70,503910942,1546279629312466947,2022-07-10,https://t.co/ahuj9QMvPZ
71,1496563025079414788,1546267550568390656,2022-07-10,@spfcpicss Chorão da po...@
72,115420009,1546247691889434627,2022-07-10,Acabou de publicar uma foto em Aliança De Misericordia - Botuquara https://t.co/FtWfLD7F3r
73,1206210482824237057,1546232478624530432,2022-07-10,Ligação pra dizer que me ama 🥹 (mesmo não fazendo nada pra provar) https://t.co/5gU9oVbEAA
74,1206210482824237057,1546229980719464454,2022-07-10,Por isso que me dou o direito de ser imatura as vezes e ajo como uma garota que 15 anos https://t.co/rWkv0tBcD2
75,1373126305001127936,1546229783050305541,2022-07-10,@JhonyHot8 🔥 https://t.co/iHgSCkD27C
76,1123954088528494592,1546227751241351169,2022-07-10,agora que o corinthians ja tirou os argentino que percam de goleada amem 🗿🍷
77,2149085621,1546222465659150338,2022-07-10,Acabou de publicar uma foto em Condomínio Green Hill https://t.co/nfGFCxCPMs
78,1461666037838098432,1546216554307543040,2022-07-10,Acabou de publicar uma foto em SBT - Sistema Brasileiro De Televisão https://t.co/1Oi2NLPrgu
79,1206210482824237057,1546207184836591618,2022-07-10,@pedagobiia Pior que as pessoas que tem essa opinião normalmente não tem filhos também e quando tem ensinam os filhos usando o medo... É natural que crianças façam birra e malcriação. Não é só porque eu não bato e grito com ela que eu não estou educando
80,69958390,1546200700581036035,2022-07-10,"Cada vez mais, acho que o problema sou eu"
81,73503309,1546194239935094784,2022-07-10,"um dos maiores e melhores apresentadores do Brasil: @celsoportiolli ! ele é o melhor! obrigado! do seu fã, muito obrigado! asa: Luquinhas. @ SBT - Sistema Brasileiro De Televisão https://t.co/Z8SIUhA6Br"
82,215596444,1546192139419357188,2022-07-10,#porraí #amizade https://t.co/VoaA1WEsv2
83,36738756,1546187052122836992,2022-07-10,"Aí me perguntam pq eu não vou pra rua em passeata... Nosso encontro é na urna, na rua eu é que não mostro a minha cara. É questão de sobrevivência e de conhecer com o que estamos lidando. https://t.co/SPW5PWDSQA"
84,3157625183,1546171970164858880,2022-07-10,Acabou de publicar uma foto em São Paulo https://t.co/omwJSxF3cJ
85,42395056,1546171677976961027,2022-07-10,#domingouu 💕 em Onde Deus Está Presente https://t.co/JjzcSyrfwj
86,1351173937770725382,1546171296261849088,2022-07-10,On feet em Estação Pirituba https://t.co/DIWvCnhVuQ
87,839012378,1546165706273718274,2022-07-10,eu amei o fecho que a @eutainacosta deu no menino que tava de costa pra ela no show
88,1106149186444107776,1546151702876901378,2022-07-10,termina cmg antes
89,930458238042214401,1546151354426486784,2022-07-10,Acabou de publicar uma foto em Universal Taipas - SP https://t.co/iURUcFhCim
90,1500625452645457920,1546146212033794050,2022-07-10,"@cirogomes Ciro vc já me convenceu tem meu voto, mais vê se não se alia a esses vagabundos ligado ao narcotráfico do país"
91,1500625452645457920,1546145716720091137,2022-07-10,"@izanildo_sabino Cara vocês petista para com descurso de reconstruir o Pais, cara foram vocês que ficaram 16 anos no poder, o resultado de hoje é a colheita do que plantaram, bando de hipócrita!"
92,73891134,1546144607532191744,2022-07-10,Minha mãe conhecendo a mãe da Ana ontem ::::::::::: ❤️🤏🥹
93,853505977,1546134633141657601,2022-07-10,Confira o vídeo de @MeuDinheiroAtivo! #TikTok https://t.co/yckykiiD7e
94,853505977,1546125883215417350,2022-07-10,Confira o vídeo de @OnlineTradersBR #TikTok https://t.co/3eJmcngY6u
95,73503309,1546120350626357253,2022-07-10,"Bom dia, Sr. Silvio!!! @ SBT - Sistema Brasileiro De Televisão https://t.co/j302HwQJID"
96,1460268652440301574,1546118956666261504,2022-07-10,@andress91495135 https://t.co/qg8zJ7RIU8
97,1206210482824237057,1546118688356679681,2022-07-10,Exatamente https://t.co/DJUnodqtxM
98,1206210482824237057,1546118390766526464,2022-07-10,@jesseont123 @veras_alvaro Mas o bem feito não precisa ser refeito e também não é perfeito
99,1287032192351297537,1546118297409691648,2022-07-10,"Acabou de publicar uma foto em Jaraguá, Sao Paulo, Brazil https://t.co/NC6A6lLdPv"
100,1206210482824237057,1546117965833281537,2022-07-10,"Então para pelo amor de Deus, não aguento mais https://t.co/MhOIh9yHT0"
101,930458238042214401,1546102797002608642,2022-07-10,Acabou de publicar uma foto em Universal Taipas - SP https://t.co/dPgjfwqrhl
102,2190032778,1546101050956029953,2022-07-10,"Acabou de publicar uma foto em BRASIL, São Paulo - SP https://t.co/Q4Y36UI4Rf"
103,157849290,1546098912347525120,2022-07-10,https://t.co/Ed33oTTtcB
104,2149085621,1546074689818312704,2022-07-10,Bom dia! em Condomínio Green Hill https://t.co/gcBiyRGbxB
105,69958390,1546057851373850625,2022-07-10,Talvez seja a hora.
106,69958390,1546057666266554368,2022-07-10,Preciso aprender que eu sou mais que o número de curtidas nas redes sociais.
107,930458238042214401,1546044183508549633,2022-07-10,Acabou de publicar uma foto em Universal Taipas - SP https://t.co/MV0hd6CPmQ
108,1008070411899277312,1545999104530173952,2022-07-10,sp poluído pra caralho
109,1536051315029250049,1545998054070910976,2022-07-10,Tem cabaré essa noite? 🤨 🤷🏼‍♂️ https://t.co/VdHRypY3Uu
110,1206210482824237057,1545965240290086912,2022-07-10,Não aceito menos https://t.co/zchlrXXfTx
111,1206210482824237057,1545964023761494017,2022-07-10,"Ainda recebo de pelo menos 2 e os filhos delas vivem correndo atrás de mim kkkkk (ee é só pra transar não sei, porque normalmente não dou moral kkkk) https://t.co/zv4lEugFsm"
112,1206210482824237057,1545963065300115460,2022-07-10,Tomara que ele pare de tentar me dar golpe https://t.co/pFKZJ3tmyM
113,1346605239940624387,1545953062715592708,2022-07-10,"@Pedro_Wane @LuConstantine2 @Lesixel38 @Cgugli19 @EdsonRo71751767 @TatianeFeitos @Sambolso @YamadaDenis @anavieira8_v @Jacques54507480 @profeborto Que ótimo ter recordações assim. Bjo 
😎😘"
114,4187982797,1545951853476814849,2022-07-10,"@jrdnmrts @kirigawa_krw @leviackkrm Enfim, minha namorada vai assistir one piece cmg né mo?"
115,69958390,1545951731158228999,2022-07-10,"Gente que namora, me respondam uma coisa, se você não estiver em contato pele a pele com seu cônjuge nem que seja por um segundo, algum de vocês morre?"
116,69958390,1545950997964537856,2022-07-10,"Minha família no canto, separados de todo mundo..."
117,702298153366773760,1545949400798740481,2022-07-10,"eu e a vitória discutimos no trabalho, fui grossa com ela
10min depois fui pedir desculpas
ela - Caroline você levantou a sobrancelha pra mim"
118,262382382,1545948679617617920,2022-07-10,"@CustodioDias Parabéns à todos, Família 💚... Juntos somos mais fortes... Juntos somos UM!

@SERGIOSEPSEP2 você é gigante, prazer te conhecer pessoalmente!"
119,842172199314329600,1545936884391870464,2022-07-10,Domingo te Esperamos! em Despertar https://t.co/oVLO0pE9jQ
120,1535401440704974848,1545932378597724161,2022-07-10,@archivdob ❤❤❤❤❤
121,69958390,1545929517256024065,2022-07-10,"Estou voltando pra você, Todos os dias me pergunto, Onde estou?, Por que tudo está assim?, Não sei, Tudo está distante, Meus momentos são sempre iguais, Tão distantes, sempre distantes, Eu continuo usando as mesmas palavras, Estou voltando pra você, estou voltando pra você..."""
122,69958390,1545929515016364035,2022-07-10,""" Por que deu tudo errado outra vez? Sinto você ainda mas ao mesmo tempo, Prefiro não mexer, no pó do passado outra vez, Estou realmente triste, Pensei, E tudo gira na minha cabeça, Porque penso tanto em você, Eu continuo usando as mesmas palavras, Estou voltando pra você..."
123,113622541,1545929154654191616,2022-07-10,Acabou de publicar uma foto em Comunidade Povo Livre Igreja Em Células https://t.co/GddV5LX3ZM
124,69958390,1545918135617961984,2022-07-09,Preciso aprender que eu não sou o número de curtidas das minhas fotos
125,69958390,1545911644102053889,2022-07-09,Minha maquiagem tá muito bonitinha
126,69958390,1545911641170219013,2022-07-09,"Eu tô muito cansada disso, mas me recuso a chorar."
127,69958390,1545911090718072832,2022-07-09,"Dizem que quando você horários iguais, o universo quer te dizer alguma coisa... O universo será que dá pra falar logo por favor porque tá foda"
128,69958390,1545907125280448514,2022-07-09,Já me arrependi de todas minhas escolhas nos últimos 8 anos
129,69958390,1545907015758872576,2022-07-09,@Sanjonees Já estou me fodendo
130,69958390,1545905002186686473,2022-07-09,Então que você se foda.
131,213112031,1545894591823368193,2022-07-09,Neste sábado estou com vcs no SBT BRASIL - 19h45. E durante toda a semana também espero a companhia de todos!! @gabrielacdallacqua @alesalvat @elizangelalilihair @sbt @central_raick @motivosliviaraick https://t.co/cDIpUKHR6g
132,930458238042214401,1545882731569184774,2022-07-09,Acabou de publicar uma foto em Universal Taipas - SP https://t.co/uNff8YUQXh
133,4539107115,1545882728821833728,2022-07-09,"Forbass &amp; Tendence hoje
Mais uma vez eu apoiando a cena DnB 😆"
134,113622541,1545877150124867584,2022-07-09,Acabou de publicar uma foto em CDC Vila Malvina https://t.co/856WM1mh51
135,842172199314329600,1545874630875168768,2022-07-09,Acabou de publicar uma foto em Despertar https://t.co/wFezzn89Bq
136,1530649753108742147,1545873323464265731,2022-07-09,@GiseliaSouza6 O que foi cão?
137,69958390,1545831238048555010,2022-07-09,@JackQuaid92 @TheBoysTV I soo happy too kkk
138,69958390,1545827344870408192,2022-07-09,"Todas as pessoas que eu conheço que assistem The Boys, concordam que a Annie é uma inútil"
139,1397347768209915906,1545817447424565251,2022-07-09,"@Julioneryy Oia o pico, tirada de um Galaxy J7 prime https://t.co/JEkGGD88I1"
140,1206210482824237057,1545809538670100482,2022-07-09,@imbiaben Até eu quero!!!!
141,1311370120577548288,1545802185040367616,2022-07-09,Acabou de publicar uma foto em SBT - Sistema Brasileiro De Televisão https://t.co/Q64SPT5E32
142,90466127,1545785966572584961,2022-07-09,@ECantanhede Vc realmente acredita no que fala ou apenas está sendo muito bem paga pra falar esses absurdos?
143,1500625452645457920,1545762850194456577,2022-07-09,@centralreality Redicula!!!!
144,58639811,1545761698048798720,2022-07-09,#Bomdia #revolução1932 #MMDC https://t.co/CkPHMMZZC7
145,1206210482824237057,1545747678063169536,2022-07-09,Presente dos meus pais que são assim até hoje https://t.co/xRb7nGJghM
146,1206210482824237057,1545745891553845248,2022-07-09,@pretademaiss Minha filha tem 1 ano e qualquer pessoa que me dá 5min de atenção eu já começo a falar cheia de orgulho o que ela faz kkkkkk imagina quando ela passar na federal??? Vou fazer um outdoor pra cada conquista dela kkkk https://t.co/8RjTjQ4n4B
147,15949716,1545743318893699072,2022-07-09,Just posted a photo @ Jardim Santa Fe https://t.co/fJQ8fIQMYs
148,853505977,1545741913504075776,2022-07-09,Acabou de publicar uma foto em Caieiras https://t.co/0Pnbaauv0r
149,240814091,1545732894039195648,2022-07-09,"Drop 🎬

#professorkauesimioni #educacaofisica #sindronemetabolica #exerciciofisico #atividadefisica #hipertensão #resistenciaainsulina #diabetestipo2 #dislipidemia #obesidade https://t.co/urUu45QHjT"
150,930458238042214401,1545727134311653380,2022-07-09,Acabou de publicar uma foto em Universal Taipas - SP https://t.co/1bM8Yoveob
151,930458238042214401,1545725347525808132,2022-07-09,Acabou de publicar uma foto em Universal Taipas - SP https://t.co/s8hxowPqDW
152,839012378,1545634284345720832,2022-07-09,Deus é maravilhoso
153,4187982797,1545628815124201474,2022-07-09,"Se você é meu amigo de verdade, me fala um rock maneiro que você escuta aí"
154,3671076502,1545618636626399232,2022-07-09,Um fato.. https://t.co/Cz73Tt2lF9
155,2681382623,1545608828565311488,2022-07-09,Horrível sentir essa falta de amizades de verdade pqp
156,318534967,1545607188227448833,2022-07-09,@Intellimen27 DesafioIntelliMen#1: Sou inteligente e aceito o desafio de melhorar a cada dia. Meu Parceiro Oficial é o @endrewsaraujo7 https://t.co/S7ZxQmquZD
157,325726192,1545605651950440448,2022-07-09,"Pelo Corinthians, com muito amor, até o fim! https://t.co/zFSiCKtDKu"
158,1526302886933798913,1545605495188234241,2022-07-09,@Intellimen27 DesafioIntelliMen#1: Sou inteligente e aceito o desafio de melhorar a cada dia. Meu Parceiro Oficial é o @Holodek_brasil https://t.co/gwG8NqmDVx
159,2217467531,1545583031397883904,2022-07-09,@xxxibjl Deixe isso de lado vamos para a bienal do livro
160,596894572,1545578419928420354,2022-07-09,Acabou de publicar uma foto em Pedra Da Baleia Jaraguá https://t.co/3DJmQ1Bqxy
161,2217467531,1545578315502731265,2022-07-09,@hlovszx Sou assim quase fui de base junto com ele
162,1206210482824237057,1545575527326564354,2022-07-09,Vai voltar pro gado que sempre aceita!!!!! https://t.co/KW8mxbGMF0
163,2217467531,1545573018075799556,2022-07-09,"@hlovszx NOSSA EU AMAVA ELE MTO TBM 
porém nunca consegui ouvir o álbum postumo mais de uma vez pois fiquei mto maur"
164,1425466161689473026,1545572553011478529,2022-07-09,@randolfeap @RevistaISTOE Vcs são ridículos.E vergonhoso essa esquerda. Já foi melhor
165,2217467531,1545568895771213826,2022-07-09,"@hlovszx Isso foi de um evento do Avicii que teve aqui em sp!!! Eles espalharam várias caixas com prévias de música do álbum postumo dele pelo mundo, (e uma em sp) aí vc colocava a mão na tela e ouvia a mesma música que outra pessoa tava ouvindo em outra parte do mundo"
166,2217467531,1545567364116369410,2022-07-09,AMORES https://t.co/XTzHQLRLXZ
167,2217467531,1545567339554430976,2022-07-09,@stateofweekes VOU EXPLODIR
168,1173307540177899531,1545562944154607619,2022-07-09,❤️🐼😜❤️🙊🙉🙈🥁🌹🧿♥️❤️‍🩹♥️❤️🌈♥️ https://t.co/POgOiN1fYd
169,1412174999738277888,1545560603347107842,2022-07-09,Hehehe tô indo viajar
170,69958390,1545558986023395328,2022-07-09,"A cara do Butcher enquanto o #SoldierBoy falava pro Homelander que ele era uma decepção, fraca, carente por atenção uhsauhsauhsa ele amou tanto o momento #TheBoys https://t.co/ldAwDVcnWC"
171,2217467531,1545554544930734082,2022-07-08,"Reject modernity
Embrace tradition

De volta com a skin de topete https://t.co/XaBhV6z8b9"
172,69958390,1545551991342043137,2022-07-08,"Quero saber qual a marca do fone da Kimiko, porque ela deu várias cambalhotas no ar, matou geral, tudo isso e o fone nada... Se eu me mexo meu fone cai #TheBoys"
173,69958390,1545548863314006021,2022-07-08,Pegaram a química do Marcelo com a Mariana e enfiaram no c* nessa novela #CaraECoragem
174,1206210482824237057,1545546453598277632,2022-07-08,Alguém pode me explicar o que tá acontecendo pra vir um monte de fake solicitar pra seguir no Instagram?? Qual fofoca tão espalhando de mim? Nudes sei que não é porque eu não mando nudes kkkkkk
175,2217467531,1545542158966525952,2022-07-08,@blubellion https://t.co/BJWw6HLLBV
176,2613720980,1545522234046939140,2022-07-08,"Hoje, um dia histórico na minha vida como artista, estive nesta sexta-feira, 8 de julho de 2022 na Pinacoteca de São Paulo - Brasil. E lá, pude apreciar e observar inúmeros trabalhos artísticos, entre eles, o de Tarsila de Aguiar do Amaral. @pinacotecasp 

Gratidão!

#pinacoteca https://t.co/999tg9huHV"
177,69958390,1545521789635383304,2022-07-08,"As vezes eu peço ajuda, de um jeito diferente, mas eu peço... Eu nunca recebo."
178,69958390,1545521107398262784,2022-07-08,Eu e a @Sanjonees https://t.co/jxfLPBO99V
179,69958390,1545515216716324866,2022-07-08,"Acho que vou lixar minha unha mais curta, porque eu vou encontrar aquela invejosa de unha torta..."
180,69958390,1545514540133224449,2022-07-08,"Foda que o único que manteve o acordo foi exatamente quem o pessoal não confiava que era o #SoldierBoy ele não seria um risco para mais ninguém se deixassem ele matar o Homelander. Mas o doido tinha que vir com papo de família e enfiar o Ryan no meio, aí ferrou tudo #TheBoys"
181,1412174999738277888,1545514391227056129,2022-07-08,@brusouza00 Amiga me deixe
182,2405282319,1545502448323903493,2022-07-08,"Missão CALEBE parte 2 sábado passado, é uma Benção estar levando o evangelho aos sedentos! 🙌🏻🙏🏻❤️🖐🏻🖐🏻🖐🏻🖐🏻 em Onde Deus Está Presente https://t.co/A57ih6x2YU"
