,author_id,tweet_id,created_at,text
0,1536545711948541953,1632611739261870081,2023-03-06,Linda amo você https://t.co/GljJHTfOZ5
1,360918234,1632599885751959554,2023-03-06,O pico mais alto de São Paulo. ❤️✨🫶🏻 https://t.co/1RJcvwgOwg https://t.co/W0cv0U5ugo
2,2516966574,1632598114765885440,2023-03-06,I'm at Lincoln's House in São Paulo https://t.co/CDfk8dmqQS
3,2516966574,1632598085204426752,2023-03-06,"I'm at C.D.H.U. Perus in Sao Paulo, sp https://t.co/mOdHav2lfF"
4,2516966574,1632598057165496320,2023-03-06,"I'm at Rua Felipe Cardoso de Campos in São Paulo, SP https://t.co/K995MPuDQN"
5,1536545711948541953,1632597600015720449,2023-03-06,Preciso de figurinhas de gatinho no zap
6,1536545711948541953,1632597240328908800,2023-03-06,Foi o pior dia da minha vida https://t.co/UXHkI085Zw
7,2516966574,1632593197032505344,2023-03-06,"I'm at Crispim Do Amaral - 8015/10, 8194/10 in São Paulo https://t.co/FS38TfG0tH"
8,2516966574,1632593117013499904,2023-03-06,I'm at Rua Crispim do Amaral in São Paulo https://t.co/l277OGPqpa
9,2516966574,1632593054803566592,2023-03-06,"I'm at Praça Inácio Dias in Sao Paulo, SP https://t.co/ttQBRlqqA4"
10,2516966574,1632593014060208129,2023-03-06,"I'm at Passarela de Perus in São Paulo, SP https://t.co/xRt8EogpVy"
11,2516966574,1632592925254098945,2023-03-06,"I'm at Estação Perus (CPTM) - @cptm_oficial in São Paulo, SP https://t.co/r8FzKxn3JN"
12,1536545711948541953,1632591860081229825,2023-03-06,Já arrumei algm obg https://t.co/HiYM0XAQw2
13,1536545711948541953,1632590993286475779,2023-03-06,Algm me passa O pix pra eu dar 41 centavos tw me dando agunia esse quebrado pfv
14,96411421,1632583286127054849,2023-03-06,@uhlerelei Pior que não viu.
15,96411421,1632583190547185666,2023-03-06,"Paredão formado!!! Vocês são foram quem? 

#ForaKeyAlves #foradomitila #ForaSarahAline  #BBB23

#TimeGuime @mcguime"
16,1713446305,1632570679294918658,2023-03-06,A Larissa é insuportável e o Fred Boco Roso é uma planta que acha que está numa colônia de férias. Que Líder é esse que pretende indicar alguém pro paredão que ele não quer que saia?! 🤡 #RedeBBB #BBB23
17,1381249476321550342,1632560385885708289,2023-03-06,Estou apaixonadaaaa! 🥰🥰🥰 https://t.co/N5vhuEZQuF
18,1448674555044810759,1632555200505425921,2023-03-06,É os D vida 🤯😎 https://t.co/GHaznX91PS
19,96411421,1632549535074471937,2023-03-06,Quando eu morrer quem sabe vire genial!!  @festivalgrls  @manugavassi https://t.co/twHg46XCrZ
20,96411421,1632548809585618944,2023-03-06,@tamancogavassi Claro. Estávamos ali por ela.
21,936290099368734721,1632530292723294208,2023-03-05,@goleada_info Mas é claro 😃
22,1462965745651011587,1632525550412611584,2023-03-05,Eu preciso urgentemente de férias 😫
23,96411421,1632517902162186240,2023-03-05,@csisdamanu Que momento 💙🥺😭
24,989531687724945408,1632517842842075136,2023-03-05,@cappellarianton 🤣🤣🤣🤣🤡🤡🤡🤡🤡 https://t.co/JvIgQDsVhr
25,96411421,1632517685400551428,2023-03-05,Muito cadelinho  da @manugavassi !!! https://t.co/Q1oSc7jtF7
26,96411421,1632517050466697217,2023-03-05,"@leocanszz @PortalGavassi @primadonnr1 Eu mesmo fui apenas pela manu, apesar de tudo.  Fiquei feliz pelo show  e nitidamente quando tocou Bossa  nova, todos cantaram com ela"
27,96411421,1632516659721170947,2023-03-05,@brilharanu @manugavassi https://t.co/GpaewrzDg1
28,989531687724945408,1632515292382343169,2023-03-05,"@SamoelMaia123 5,30 a 6,00"
29,1629571411055370242,1632504026842509312,2023-03-05,@rapalert6 Gostei vc canta muito parabéns pelo seu talento princesa 😍👌
30,1559666163302408192,1632484317883400192,2023-03-05,"De Itapevi para o SBT, É logo menos para o mundo! ✨🥹❤️ https://t.co/fpin5oAoWU https://t.co/8sxiEbuXLy"
31,2516966574,1632475696051240964,2023-03-05,"I'm at Estação Pirituba (CPTM) - @cptm_oficial in São Paulo, SP https://t.co/uiz7bsmMBt"
32,936290099368734721,1632472044171304960,2023-03-05,@PorcoVerso O jailson foi expulso no Itaquera por menis que isso
33,2516966574,1632467494173548545,2023-03-05,"I'm at Estação Perus (CPTM) - @cptm_oficial in São Paulo, SP https://t.co/RQnyMpcnkU"
34,2516966574,1632467455896436736,2023-03-05,"I'm at Praça Inácio Dias - 888P, 8015/10, 8055/10, 8194/10 in São Paulo https://t.co/l9it78IWOO"
35,2516966574,1632467348459343873,2023-03-05,"I'm at Praça Inácio Dias in Sao Paulo, SP https://t.co/AZGORHEDDm"
36,2516966574,1632467278951219200,2023-03-05,"I'm at Rua Doutor Oscar Cunha Correia in São Paulo, SP https://t.co/RgGJm0DMDe"
37,2516966574,1632467191114129411,2023-03-05,I'm at Rua Dona Rosina in São Paulo https://t.co/FE0zSfh69T
38,2516966574,1632467096582930433,2023-03-05,I'm at Rua Olimpio Francisco Pedreiro in São Paulo https://t.co/JdxOnsXpfx
39,2516966574,1632466730155950083,2023-03-05,"I'm at Rua Antônio de Pádua Dias in São Paulo, SP https://t.co/vRP1WTAApg"
40,2516966574,1632466667899953152,2023-03-05,I'm at Rua Estevam Ribeiro Resende in São Paulo https://t.co/Q38GCPRaip
41,2516966574,1632466553529671681,2023-03-05,I'm at Rua Almofada in São Paulo https://t.co/LDK01Y5581
42,2516966574,1632466466707582979,2023-03-05,"I'm at Rua Felipe Cardoso de Campos in São Paulo, SP https://t.co/r369LCxAEu"
43,2516966574,1632466178244214787,2023-03-05,"I'm at C.D.H.U. Perus in Sao Paulo, sp https://t.co/7MJB9vt3GO"
44,936290099368734721,1632421469622874114,2023-03-05,"@delaurentiis_br Kkkkkkkkkkkkkk
E nem foi big house que fez as contas"
45,440456318,1632418489834131459,2023-03-05,@tinashebr aaaaaaaa
46,440456318,1632418323974483968,2023-03-05,@grabielpinho tull4 franja
47,936290099368734721,1632414607317843969,2023-03-05,@chefdangalhardo Isso é uma obra de arte
48,212384083,1632384317883072512,2023-03-05,Faço o L sim!!!! https://t.co/qXXX54pQbw
49,212384083,1632383700112486400,2023-03-05,"Questionar algumas estruturas é uma faca de dois gumes, é sobre avançar em consciência, mas também sobre abrir mão de privilégios..."
50,2516966574,1632379048784527361,2023-03-05,I'm at Lincoln's House in São Paulo https://t.co/4KdYxOO2a4
51,2516966574,1632379017549496321,2023-03-05,"I'm at C.D.H.U. Perus in Sao Paulo, sp https://t.co/9PVFEZHZRx"
52,2516966574,1632378988524961795,2023-03-05,"I'm at Rua Felipe Cardoso de Campos in São Paulo, SP https://t.co/ScUanEHjUN"
53,2516966574,1632378763068551168,2023-03-05,"I'm at Padaria Adrimar in São Paulo, SP https://t.co/ZB4bva8bgW"
54,2516966574,1632378689684905984,2023-03-05,"I'm at Rua Felipe Cardoso de Campos in São Paulo, SP https://t.co/GuxREmDqE3"
55,2516966574,1632378656445067269,2023-03-05,"I'm at C.D.H.U. Perus in Sao Paulo, sp https://t.co/PcPRfKJTXJ"
56,1536545711948541953,1632229954267037697,2023-03-05,Me matar https://t.co/9gsGn7duwn
57,1536545711948541953,1632229933832458240,2023-03-05,Me matar https://t.co/a90YdKGy0d
58,1536545711948541953,1632229914421129218,2023-03-05,Shenlan https://t.co/6Ze7O4r4Up
59,1536545711948541953,1632229885979549697,2023-03-05,Me mata https://t.co/nDH8o8NkqO
60,1536545711948541953,1632229860243283969,2023-03-05,Xingyun https://t.co/scUkDNESdt
61,1536545711948541953,1632229821928427522,2023-03-05,Ganking https://t.co/R41XG8z8MG
62,1536545711948541953,1632229793147109377,2023-03-05,Me matar https://t.co/kheRe6GgRx
63,1536545711948541953,1632229769176645638,2023-03-05,Me matar tb https://t.co/pL6K6czYeK
64,1536545711948541953,1632229703036682242,2023-03-05,Eulamber https://t.co/5jn5ijYaZ5
65,1536545711948541953,1632229676386074625,2023-03-05,eimiko https://t.co/fRJOFwy19M
66,936290099368734721,1632203338405105665,2023-03-05,@CustodioDias A cara do Jorge jesus
67,936290099368734721,1632203264790872065,2023-03-05,@brunomassa Nada mais que isso
68,771943792702283776,1632173601607540739,2023-03-05,Vai Corinthians !!! https://t.co/6Nw9bSsqq1
69,1500625452645457920,1632167991897907202,2023-03-04,@mariadorosario Bandido
70,1427079618021011462,1632102670860267521,2023-03-04,Tédio .... https://t.co/4B4nMT761o
71,1464294075402797060,1632079510072877058,2023-03-04,"20 segundos de introdução https://t.co/2ElCNiiP6G
adoro a complecidade das peças de bach, ele consegue colocar tantas ""vozes"" em uma música só
e é como se fosse uma sequência, conforme a mao direita faz a esquerda vem fazendo um pouco mais atrasado a msm coisa
bach genio 👏🏻👏🏻👏🏻👏🏻"
72,212384083,1632056144758702080,2023-03-04,"Análise da Domitila tá corretíssima, o problema é que o Black é um ""aí preto"" que não tem consciência de porra nenhuma!"
73,3298162567,1632052537447657476,2023-03-04,@GaloComents Aprecie esta resposta. https://t.co/X7JaH5UGUB
74,3351074567,1632042478604890114,2023-03-04,hoje é com o tio silvio https://t.co/6TD0XcNqwY
75,1462965745651011587,1631958978333663240,2023-03-04,"Indo trabalhar com uma sensação horrível no peito e com vontade de chorar, crise de ansiedade 7h da manhã q legal 👍👍"
76,1462965745651011587,1631958043276525568,2023-03-04,Perfeita demais! https://t.co/4Nda4LvEeG
77,1462965745651011587,1631957764946681857,2023-03-04,As vezes eu tenho medo da minha mente
78,2516966574,1631916954033303555,2023-03-04,I'm at Lincoln's House in São Paulo https://t.co/VS5V5zZfIy
79,2516966574,1631916922848653312,2023-03-04,"I'm at C.D.H.U. Perus in Sao Paulo, sp https://t.co/7yfDo7U8jO"
80,2516966574,1631916871602651138,2023-03-04,"I'm at Rua Felipe Cardoso de Campos in São Paulo, SP https://t.co/66MO6AXyvl"
81,2516966574,1631916824878018562,2023-03-04,"I'm at C.D.H.U. Perus in Sao Paulo, sp https://t.co/fzdX4dAxTg"
82,2516966574,1631894916082155521,2023-03-04,I'm at Lincoln's House in São Paulo https://t.co/c9d8MM8iY5
83,2516966574,1631894879914565632,2023-03-04,"I'm at C.D.H.U. Perus in Sao Paulo, sp https://t.co/ow4VuHbbUe"
84,2516966574,1631894849707208705,2023-03-04,"I'm at Rua Felipe Cardoso de Campos in São Paulo, SP https://t.co/sG5Cy38DtY"
85,2516966574,1631867532779958275,2023-03-04,"I'm at Crispim Do Amaral - 8015/10, 8194/10 in São Paulo https://t.co/bUr8PTScBS"
86,2516966574,1631867473023598599,2023-03-04,I'm at Rua Crispim do Amaral in São Paulo https://t.co/t67oFT3Ivz
87,2516966574,1631867432552869888,2023-03-04,"I'm at Praça Inácio Dias in Sao Paulo, SP https://t.co/9OFbGUV4oK"
88,2516966574,1631867402966138880,2023-03-04,"I'm at Passarela de Perus in São Paulo, SP https://t.co/RuHwlwv4Gf"
89,2516966574,1631862794743332864,2023-03-04,"I'm at Estação Perus (CPTM) - @cptm_oficial in São Paulo, SP https://t.co/yDeQzCBM73"
90,1536545711948541953,1631846962004742144,2023-03-04,Eu preciso parar de pensar que as pessoas vão responder igual eu respondo
91,1462965745651011587,1631832443685576706,2023-03-04,"Queria tanto ter ido, meu sonho cada vez mais distante 🥺😮‍💨 https://t.co/wJI0NuErEg"
92,1462965745651011587,1631832261153660929,2023-03-04,em qualquer lugar q eu encosto!
93,1462965745651011587,1631832002893676544,2023-03-04,Eu durmo literalmente com o celular na mão
94,1462965745651011587,1631831921016598528,2023-03-04,"Depois q comecei a trabalhar de domingo a domingo, me sinto uma idosa de 90 anos q encosta em qualquer lugar e já cochila."
95,1462965745651011587,1631831562269409283,2023-03-04,Oq eu tenho vontade de falar pra minha mãe! https://t.co/4Bd3lhZdlY
96,1464294075402797060,1631822180014063618,2023-03-04,nao aguento mais isso
97,3178633468,1631816016740114432,2023-03-04,"@ErlanJesus7 O Ronny é a versão humana do Maito Gai, ele é a prova  de que treino e dedicação supera o talento."
98,1462965745651011587,1631802352322727936,2023-03-03,@bbygirlxzx 😑😑😑
99,1462965745651011587,1631802187595542528,2023-03-03,@bbygirlxzx Com oq???
100,1462965745651011587,1631799556370202624,2023-03-03,"@bbygirlxzx vdd, eu morro de medo dessa mulher. e nem e brincadeira!"
101,96411421,1631789005850148869,2023-03-03,@RBDTour23 16/11. https://t.co/tBWHFxCn5p
102,1464294075402797060,1631773755776159745,2023-03-03,"@Remasalternas65 @shitpostverdade 😭😭😭😭😭😭😭
cada dia cai mais..."
103,1464294075402797060,1631768503156965377,2023-03-03,@Remasalternas65 @chicorinha_ magia https://t.co/S5xOlxugmD
104,1462965745651011587,1631759752819515394,2023-03-03,@bbygirlxzx simm 🥺🥺🥺
105,289408600,1631750367376539670,2023-03-03,"Programando uma viagem de Tour.. pra passar pro Fox do Iguaçu, Paraguai e Argentina 💆🏽‍♂️"
106,2516966574,1631743866515718151,2023-03-03,"I'm at Estação Perus (CPTM) - @cptm_oficial in São Paulo, SP https://t.co/2iPFcB7p82"
107,2516966574,1631743815345225729,2023-03-03,"I'm at Praça Inácio Dias - 888P, 8015/10, 8055/10, 8194/10 in São Paulo https://t.co/hRJbWuYsf1"
108,2516966574,1631743759833526272,2023-03-03,"I'm at Praça Inácio Dias in Sao Paulo, SP https://t.co/AyCW1V1RLU"
109,2516966574,1631743706536476673,2023-03-03,"I'm at Avenida Comendador Fiorelli Peccicacco in São Paulo, SP https://t.co/bTrIBJbaUL"
110,2516966574,1631737500002648075,2023-03-03,"I'm at Felipe Cardoso de Campos - 8015/10, 8194/10 in São Paulo https://t.co/NE0xnE7LUo"
111,2516966574,1631737144992493568,2023-03-03,"I'm at Rua Felipe Cardoso de Campos in São Paulo, SP https://t.co/BuYizq2xgZ"
112,2516966574,1631736963261669378,2023-03-03,"I'm at C.D.H.U. Perus in Sao Paulo, sp https://t.co/jjG0zLVFeC"
113,2471984529,1631708292165533719,2023-03-03,"@bonaroti @Infos_palestra Muito obrigado Marcelo, nos emocionamos muito também. Foi um dia especial, inexplicável... Tudo junto o nascimento do meu primeiro filho e esse carinho do pessoal da globo e do Palmeiras. 🐷💚"
114,1464294075402797060,1631691999727190021,2023-03-03,@Monkeypiec3 @hange_Zzz igual tu
115,233517586,1631679640854036482,2023-03-03,prefiro a morte do que volta pra esse lixo de cidade
116,289408600,1631676984160841731,2023-03-03,@__jootaa Kkkkkk você paga um pau pro cara e tá aí nessa conversa mole
117,289408600,1631675059583479809,2023-03-03,"@__jootaa Respeita o cara J, só em vcs esse ano.. ele brocou dois, ele é brabo🙅🏽‍♂️ hahaha"
118,289408600,1631658765760987139,2023-03-03,Gosto do Arthur porque ele tenta me motivar numas coisas improváveis kkkkkkkkk abençoa Deus 🙌🏼
119,1463333145671987200,1631585608882700290,2023-03-03,@Marcelomelop @brom_elisa Pergunta pra essa jornalista se as terras fossem dela.
120,2516966574,1631549252026392576,2023-03-03,I'm at Lincoln's House in São Paulo https://t.co/h4TpW92Lyc
121,2516966574,1631549212620996608,2023-03-03,"I'm at C.D.H.U. Perus in Sao Paulo, sp https://t.co/WwWNP1982r"
122,2516966574,1631549184288358401,2023-03-03,"I'm at Rua Felipe Cardoso de Campos in São Paulo, SP https://t.co/m5e6eVsc1x"
123,2516966574,1631532471199080448,2023-03-03,"I'm at C.D.H.U. Perus in Sao Paulo, sp https://t.co/JfKretQ0nV"
124,2516966574,1631528553492750337,2023-03-03,I'm at Lincoln's House in São Paulo https://t.co/MMDpyiWiFW
125,2516966574,1631528527228018688,2023-03-03,"I'm at C.D.H.U. Perus in Sao Paulo, sp https://t.co/eMebq3iqgG"
126,2516966574,1631528501189771264,2023-03-03,"I'm at Rua Felipe Cardoso de Campos in São Paulo, SP https://t.co/jrJTENpCTl"
127,2516966574,1631528466184126464,2023-03-03,I'm at Rua Guilherme Correia de Melo in São Paulo https://t.co/gHNstGzUFX
128,2516966574,1631528423406305281,2023-03-03,"I'm at Rua Presidente Vargas in São Paulo, SP https://t.co/MU3oEGi14j"
129,2516966574,1631528388266532864,2023-03-03,I'm at Rua Hamilton de Araújo in São Paulo https://t.co/ACw4nxMEhp
130,2516966574,1631528323254722560,2023-03-03,"I'm at Rua Clóvis Cavalcanti in São Paulo, SP https://t.co/0pu1pGgbcR"
131,2516966574,1631528292493795330,2023-03-03,"I'm at Rua Bananal do Rio in São Paulo, Sp https://t.co/UZF3VboaHr"
132,2516966574,1631527895414845442,2023-03-03,"I'm at Rua Clóvis Cavalcanti in São Paulo, SP https://t.co/xSiLjVlktO"
133,2516966574,1631527762874826752,2023-03-03,"I'm at Rua Antônio de Pádua Dias in São Paulo, SP https://t.co/vF6j3vNSVR"
134,2516966574,1631527728393469952,2023-03-03,"I'm at Crispim Do Amaral - 8015/10, 8194/10 in São Paulo https://t.co/Djw1VKneJO"
135,2516966574,1631527592498012160,2023-03-03,I'm at Rua Crispim do Amaral in São Paulo https://t.co/FlB16AfLiX
136,2516966574,1631527560759713795,2023-03-03,"I'm at Praça Inácio Dias in Sao Paulo, SP https://t.co/i5R8J1i16I"
137,2516966574,1631527493961236480,2023-03-03,"I'm at Passarela de Perus in São Paulo, SP https://t.co/4xHgKqB3nJ"
138,1536545711948541953,1631512100873940992,2023-03-03,Eu amo tenho essa foto q coloquei de fundo https://t.co/vQrEHxfqpw
139,2516966574,1631500136420368386,2023-03-03,"I'm at Estação Perus (CPTM) - @cptm_oficial in São Paulo, SP https://t.co/5BQawWmXGc"
140,1536545711948541953,1631496269582462977,2023-03-03,@peripatones eu tenho zero
141,1462965745651011587,1631488091163688964,2023-03-03,@bbygirlxzx Eu amo sim!
142,1462965745651011587,1631488048717352961,2023-03-03,@bbygirlxzx Ihhhh tá doida????
143,212384083,1631484942692626433,2023-03-03,Faz toda diferença quando a gente passa a olhar pro espelho e não há mais dores... A autoestima começa primeiro na consciência
144,212384083,1631483577044017153,2023-03-03,"Não exonerar meu cargo de professor é um ato de resistência, afinal... Se eu saio periga dar meu lugar pra professores Bolsonarista..."
145,212384083,1631483225569632256,2023-03-03,A gente vai cansando... E um dia qualquer se dá conta que coisas grandiosas se tornaram minúsculas...
146,1500625452645457920,1631476557922418690,2023-03-03,@te_comuniquei E esse lulista não vi ninguém postar infatizando o lado político https://t.co/f6VVh3l7J0
147,1536545711948541953,1631475165249822720,2023-03-03,"Já fui

gustafr._
Rionilou
Diwuh
Dinuh
GustaSemTavi https://t.co/n7gTY5cNhX"
148,1500625452645457920,1631473764134268928,2023-03-03,"@gleisi O chacota de bandido não fala merda, comecem a atacar a petrus que veram os mais de 40% dos assionistas derreter essa empresa!"
149,749001017937817600,1631473288122707969,2023-03-03,Te amo Justin https://t.co/us8JnqaxXh
150,1462965745651011587,1631468168618078210,2023-03-03,Vem pro abate mor! https://t.co/KCMAmdUFVA
151,936290099368734721,1631462500762898436,2023-03-03,Muito top https://t.co/MThv66Ljyl
152,1536545711948541953,1631453761397747718,2023-03-03,Não vou mais mandar MSG
153,1532719415543873536,1631445884201230337,2023-03-03,Simplesmente Música 🎶 @ailtonrios  #gaita #harp #harmonica #realejo #gaitista #harmonicista  #gaitablues #musico #aulasdemusica #musica https://t.co/Rwo0YY8hDl
154,2471984529,1631433809647337472,2023-03-02,@Infos_palestra Ahhhhh esse dia está sendo incrível! 🐷💚
155,1536545711948541953,1631431880758243330,2023-03-02,falei pros meus pais que eu queria ficar em casa no meu aniversário e eles reclamaram
156,1462965745651011587,1631431447524278272,2023-03-02,o bolo da vitória kkkkkkkk https://t.co/a6bLwdqk2I
157,1462965745651011587,1631431111237681157,2023-03-02,@bbygirlxzx vou te dar um desses kkkkkkkk 🫶
158,1462965745651011587,1631431019042676737,2023-03-02,@bbygirlxzx 🥺🥺🥺
159,1462965745651011587,1631430947974381568,2023-03-02,@bbygirlxzx Ele vai fciar bem amor
160,1536545711948541953,1631427846630518785,2023-03-02,Vou parar de encomodar
161,1462965745651011587,1631415706506895361,2023-03-02,Queria estar com a minha namorada 🥺
162,1462965745651011587,1631396328449122333,2023-03-02,Meu psicológico não aguenta mais
163,1462965745651011587,1631395899170496526,2023-03-02,To com tanta raiva
164,1462965745651011587,1631395464879788033,2023-03-02,Vsf
165,1462965745651011587,1631395413621088257,2023-03-02,Nada q eu faço ta bom ou tá certo nessa merda
166,1462965745651011587,1631395333665071118,2023-03-02,"Não aguento mais fica nessa casa, pqp"
167,2516966574,1631373668679819265,2023-03-02,"I'm at Estação Perus (CPTM) - @cptm_oficial in São Paulo, SP https://t.co/ICKJjuSy99"
168,2516966574,1631373618130067471,2023-03-02,"I'm at Praça Inácio Dias - 888P, 8015/10, 8055/10, 8194/10 in São Paulo https://t.co/cAl56pmmmw"
169,2516966574,1631373555152592916,2023-03-02,"I'm at Praça Inácio Dias in Sao Paulo, SP https://t.co/xNspelfbne"
170,2516966574,1631373505328455684,2023-03-02,"I'm at Avenida Comendador Fiorelli Peccicacco in São Paulo, SP https://t.co/oNFJHM2TqT"
171,2516966574,1631370417242791937,2023-03-02,"I'm at Felipe Cardoso de Campos - 8015/10, 8194/10 in São Paulo https://t.co/wfgdac9NzH"
172,2516966574,1631370383453462552,2023-03-02,"I'm at Rua Felipe Cardoso de Campos in São Paulo, SP https://t.co/lyLlxl1xNo"
173,2516966574,1631370335743254555,2023-03-02,"I'm at C.D.H.U. Perus in Sao Paulo, sp https://t.co/lzn9lmVLF1"
174,289408600,1631308545755938822,2023-03-02,"@HR_1914 @__jootaa Cola J, pra você ter umas aulas c pai.. vem que te ensino 🤪"
175,1322920716883447810,1631267694774218754,2023-03-02,"Só vamos ver a melhor dupla do mundo,amo sem fronteiras 
@MaiaraMeM e @Maraisa https://t.co/nusOop9DHV"
176,732767855184338944,1631232277396037635,2023-03-02,@rrobinhopkk Que isso mlk
177,1462965745651011587,1631223633338068992,2023-03-02,@bbygirlxzx Mas eu querooo
178,2516966574,1631146214392569856,2023-03-02,I'm at Lincoln's House in São Paulo https://t.co/SDDWqwxeQT
179,2516966574,1631146180603260929,2023-03-02,"I'm at C.D.H.U. Perus in Sao Paulo, sp https://t.co/CffNseG2uK"
180,2516966574,1631146144104345602,2023-03-02,"I'm at Rua Felipe Cardoso de Campos in São Paulo, SP https://t.co/wnZdoUhbEz"
181,2516966574,1631142953216356352,2023-03-02,"I'm at Crispim Do Amaral - 8015/10, 8194/10 in São Paulo https://t.co/ufzHgdQetR"
182,2516966574,1631142556116328451,2023-03-02,I'm at Rua Crispim do Amaral in São Paulo https://t.co/oQKvCSJNRv
183,2516966574,1631142475204001795,2023-03-02,"I'm at Praça Inácio Dias in Sao Paulo, SP https://t.co/56VQfzQPmf"
184,2516966574,1631142429846847489,2023-03-02,"I'm at Passarela de Perus in São Paulo, SP https://t.co/nVGvVl2JZh"
185,2516966574,1631137500742799361,2023-03-02,"I'm at Estação Perus (CPTM) - @cptm_oficial in São Paulo, SP https://t.co/ymgdlzjmBU"
186,1462965745651011587,1631123803127283713,2023-03-02,@bbygirlxzx pq não morr??
187,1587501470836002816,1631121419642761218,2023-03-02,"Valeu @HulkOficiaI7  por dar a bola do pênalti pro Vargas. 
Era só fazer, que seríamos todos felizes. https://t.co/qmK1SGIm2p"
188,1462965745651011587,1631121334062260225,2023-03-02,@bbygirlxzx ajudar com oq??
189,1462965745651011587,1631119746845270022,2023-03-02,@bbygirlxzx Oq????
190,3109287471,1631110873019195392,2023-03-02,@brooocklynclows Kkkkkkkkkk
191,1509504922097786880,1631099275370274816,2023-03-02,Existe tinder para gostosas????
192,749001017937817600,1631098216320991232,2023-03-02,Me apaixonar por Santista vai ser sacanagem
193,96411421,1631067892451094528,2023-03-01,@Gyselle_Soares  aí como eu  estava com saudades.
194,96411421,1631066193476960256,2023-03-01,@_CamilaVilelaa @rbdplace Que maravilha.
195,96411421,1631066069057011712,2023-03-01,"(..) aonde quem é branco acha como deve tratar as pessoas, ainda pessoas negras. Pedidos de desculpas não resolvem em nada!! 

Da próxima vez que passarmos  por esse constrangimento, eu perco meu direito..mas eu vou agredir.. seja lá quem for. 

#racismo @LiveNationBR"
196,96411421,1631065493279834114,2023-03-01,"(..) show estava espeficando  se era local apenas para Brancos, porque se uma pessoa Negra, estava bem vestida, estava visivelmente nítido que estava ali por conta do show, e ainda um Filha da Puta, vira e pergunta se estava ali para recolher latinhas..esse é o nosso Brasil (..)"
197,96411421,1631064143728967685,2023-03-01,@festivalgrls Tem modelo do palco não?
198,1506615865386622977,1631062114117844993,2023-03-01,"Lindo apartamento a venda em Pirituba, com quintal 
https://t.co/qePc3yB6cu"
199,96411421,1631059912678682628,2023-03-01,"@rbdplace Sim.. por isso preferi evitar  porque se na fila sofri, imagina no show."
200,96411421,1631059699687669760,2023-03-01,@jessimleo @rbdplace Olha eu tenho 1.74. https://t.co/UAaHE856Vx
201,96411421,1631059693643677696,2023-03-01,"@jessimleo @rbdplace No show do RBD eu peguei Cadeira, porque vai ser um show muito humilhante, ainda mais conhecendo os fãs."
202,934442394497507329,1631025779902500875,2023-03-01,Com todo respeito ao twenty one pilots mas é banda pra toca de graça no réveillon da Paulista. Pra demover os fãs do Blink a permanecerem com o ingresso só o My Chemical Romance e olhe lá.
203,1536545711948541953,1631025001024442368,2023-03-01,Sempre achei que só me toleravam
204,1536545711948541953,1631018117131370496,2023-03-01,N aguento mais deserto https://t.co/Otf6gxs5P3
205,2516966574,1631011265710546944,2023-03-01,"I'm at Estação Perus (CPTM) - @cptm_oficial in São Paulo, SP https://t.co/yE49XWyMLY"
206,2516966574,1631010688385572865,2023-03-01,"I'm at Praça Inácio Dias - 888P, 8015/10, 8055/10, 8194/10 in São Paulo https://t.co/Umlq9z85Mz"
207,2516966574,1631010645469548568,2023-03-01,"I'm at Praça Inácio Dias in Sao Paulo, SP https://t.co/SEJsGpHeLX"
208,2516966574,1631010604566605826,2023-03-01,"I'm at Avenida Comendador Fiorelli Peccicacco in São Paulo, SP https://t.co/pGljJPRUNq"
209,2516966574,1631007009960087557,2023-03-01,"I'm at Felipe Cardoso de Campos - 8015/10, 8194/10 in São Paulo https://t.co/JGjFnlD46P"
210,2516966574,1631006584385032194,2023-03-01,"I'm at Rua Felipe Cardoso de Campos in São Paulo, SP https://t.co/LwfwqOjsoE"
211,2516966574,1631006514507927576,2023-03-01,"I'm at C.D.H.U. Perus in Sao Paulo, sp https://t.co/4O2PWXqeWD"
212,1536545711948541953,1630998174243455002,2023-03-01,Vontade de faltar toda aula de matemática até trocar o bimestre
213,1536545711948541953,1630997143430352897,2023-03-01,Não posso deixar os sentimentos superarem a razão
214,289408600,1630946149262606336,2023-03-01,"@HR_1914 É isso irmão, foco no futuro que tem mt coisa boa pra vir"
215,289408600,1630941659784421379,2023-03-01,@_lhramos Carai o carinha lá te zuou mesmo em mano
