,author_id,tweet_id,created_at,text
0,1172915028,1553482933725532171,2022-07-30,Sem filho…opa filtro!🤣🤣 em Vila Marari https://t.co/sNZWHi3pWx
1,3025072047,1553436576914542593,2022-07-30,"E ontem foi dia de presencial da @liga.nfa na UCCONX e estamos aí firmes e fortes, mamãe e bebê na atividade. em Pavilhão de Exposições Anhembi https://t.co/QLGIyYuE2g"
2,15410917,1553406397190217728,2022-07-30,"I'm at Frutah! in São Paulo, SP https://t.co/YS1C2DoXV6"
3,1172915028,1553066358664986625,2022-07-29,Eu amo esse garoto daqui até o céu! Mas tem noites que eu só queria dormir 😴 em Vila Marari https://t.co/ie0hehxwZ3
4,32130620,1552637716004847616,2022-07-28,Acabou de publicar uma foto em Ambrosia Doces Artesanais por Aline Sartor https://t.co/RweW0FOHGS
5,1305989017096388614,1552058433779769347,2022-07-26,#tweter https://t.co/orpnIO0THn
6,32130620,1552014558818193413,2022-07-26,"✨ Fazer sobremesas gostosas...

Essa arte eu domino. ❤️

Qual arte você domina, me conta aí 👇🏽

#DocesArtesanais #DocesPersonalizados #Brigadeiros #CompreDeQuemFaz #MulheresEmpreendedoras https://t.co/wbK2SrrBDQ"
7,1470957015619014660,1551991859614027778,2022-07-26,Acabou de publicar uma foto em Gui  Bolos &amp; Tortas https://t.co/12Hcb8K8fc
8,1538988627245637633,1551979336059785217,2022-07-26,Como trabalhar assim? https://t.co/fqMwKqO62Q
