,author_id,tweet_id,created_at,text
0,1075679019176263680,1566563413576278023,2022-09-04,Acabou de publicar uma foto em País Das Maravilhas https://t.co/hqDFAKYnSa
1,36748548,1566223536649289728,2022-09-04,"I'm at Shopping Interlagos - @shop_interlagos in São Paulo, SP w/ @_ponkitz https://t.co/KEe8DNFWOA"
2,53535856,1566222415918731264,2022-09-04,"I'm at @StarbucksBrasil in São Paulo, SP w/ @kdu3142 https://t.co/5Gv9hy6Gro"
3,53535856,1566222357785706496,2022-09-04,"I'm at Shopping Interlagos - @shop_interlagos in São Paulo, SP w/ @kdu3142 https://t.co/CxKHMLIEm5"
4,1541564249847250945,1565817609760677888,2022-09-02,"Juro, como tem gente que não gosta do pãozinho do Outback???????? https://t.co/U0hh4lr5YD"
5,15410917,1565469329839325186,2022-09-01,"I'm at @VivoEmrede in SÃ£o Paulo, SP https://t.co/KY9Yxc9Bb2"
6,3601029388,1565387163503583232,2022-09-01,Viva lá vida 🔥💫 em Capital Gastro Bar https://t.co/mRwmm1yVu7
7,32130620,1565360391177347077,2022-09-01,Acabou de publicar uma foto em Ambrosia Doces Artesanais por Aline Sartor https://t.co/3fp8Jgtu55
8,56807544,1564738130061967360,2022-08-30,"Aquele cuidado com as mãos e pés! Valeu amiga Andreza!!
#carpediem em Jardim Consórcio https://t.co/pP5GCVsbA2"
