,author_id,tweet_id,created_at,text
0,27566436,1527744967191547905,2022-05-20,Pôr do sol 🌇 em Sesc Belenzinho https://t.co/87NxxBhWOl
1,1206003149137498113,1527708919086436354,2022-05-20,Meu dois extremos hoje https://t.co/El5TMfK4jD
2,1031612925885276161,1527664367235321859,2022-05-20,"Mercedes Benz Sprinter 416 Simples Remoção 
2 Macas 
#mercedesbenz #ambulância #homecare #sprinter #simplesremoção em Radial Leste https://t.co/VG53lqitpT"
3,20169107,1527415779448262656,2022-05-19,"Mano, metrozao lotado na linha vermelha. Uma tia catarrenta, gripada, toda lascada espirrando e com a porra da máscara abaixada. 🤦🏻‍♀️ Deus me ajude a não cometer um crime aqui"
4,60949873,1527409590140383232,2022-05-19,"Mocidade visitando o @coraldobelem para um café com pão de queijo. em Novo Templo, Assembleia De Deus, Belém https://t.co/CCojxFjBMK"
5,161715299,1527063659935158273,2022-05-18,Acabou de publicar uma foto em Fofinho Rock Club https://t.co/kMfCYcKASz
6,2800826889,1527062446149718016,2022-05-18,Acabou de publicar uma foto em IBCC Oncologia https://t.co/W3e4fNVKd1
7,923007989430259713,1527051724288102400,2022-05-18,"electra, até agora (pag 42 v. 1065) eu te amo, mas a tragédia grega tem mais plot twist do que se pensa."
8,54623557,1526320662125719556,2022-05-16,Presente lindo que ganhei da prima @carolmarkess de aniversário em Belenzinho https://t.co/2BkUo80bs0
9,71581273,1526286028381769733,2022-05-16,Acabou de publicar uma foto em Salim Farah Maluf https://t.co/LRBwthTkxr
10,54623557,1525995569512173574,2022-05-16,Foi uma delícia ter todos vcs aqui hoje! #falei #primos #encintro em Belenzinho https://t.co/yOQ81uGjwg
11,781929521817722880,1525988575753297920,2022-05-15,A partir de amanhã às 23:58 já estaremos juntos na Oração da Meia Noite em Preparação para o dia 12/05 diretamente do Templo de Salomão. em Templo de Salomão https://t.co/EPVa7u8Ywt
