,author_id,tweet_id,created_at,text
0,1047614019509657602,1549501656185810944,2022-07-19,"Curtindo uma vista maravilhosa do mirante SESC Belenzinho depois de desfrutar de uma piscina aquecida, oh Benção em Sesc Belenzinho https://t.co/7pjxJYm2UL"
1,130326938,1549409939587829763,2022-07-19,"É oficial, Turnê Sorrir e Brincar vem aí! https://t.co/9PYSl1rhme"
2,1423574890406416392,1549247107969736704,2022-07-19,"COMPRE COM:
PIX
BNB
USDT
BUSD
USDC
CARTÃO DE CRÉDITO EM ATE 12X 
CARTÃO DE DÉBITO 

CORRE, PQ MUITOS IRÃO DIZER QUE PODERIA TER SE POSICIONADO MELHOR MAS NÃO  ACREDITOU..... OPORTUNIDADE COMO ESTÁ SÃO DE OURO GALERA!!!

Link para cadastro e compra

https://t.co/W5bB7ngUHz https://t.co/EGSZ7VMxRk"
3,94380351,1549218249090498564,2022-07-19,"Agora estarão abertos os meus olhos e atentos os meus ouvidos à oração deste lugar (II Crônicas 7:15).
#templodesalomão #universal #fé #saopaulo #sp #petropolis #rj em Templo de Salomão https://t.co/VOzgSwEy8z"
4,1076608878,1549196462759690241,2022-07-19,Acabou de publicar uma foto em Bloco Emo https://t.co/nrzhFCLzA6
5,3363253035,1549180274692370432,2022-07-18,Acabou de publicar uma foto em Aqui de boa https://t.co/IxRS9dSAY4
6,1969021752,1549142592557686785,2022-07-18,Minha pergunta ao Ministro Alexandre de Moraes do STF. em Radial Leste https://t.co/6UxT7IUBu8
7,781929521817722880,1549140938470985728,2022-07-18,Acabou de publicar uma foto em Templo de Salomão https://t.co/lWOshJphsD
8,781929521817722880,1549131843571781632,2022-07-18,Acabou de publicar uma foto em Templo de Salomão https://t.co/BmKLzSZz4Y
9,801099001,1549024687723782149,2022-07-18,Acabou de publicar uma foto em Templo de Salomão https://t.co/QOzYvENSXh
10,801099001,1548829821102325760,2022-07-18,Acabou de publicar uma foto em Templo de Salomão https://t.co/bXcYWsSdN8
11,166047048,1548820348673703937,2022-07-18,Levando minha sogra pra dar um rolezinho por aí… ❤️ em Templo de Salomão https://t.co/okQjv4Tl30
12,781929521817722880,1548775508137082882,2022-07-17,OS céus declaram a glória de Deus e o firmamento anuncia a obra das suas mãos. Salmos 19:1 em Templo de Salomão https://t.co/1Yzj19L1yl
13,1540591877191356416,1548567265959849984,2022-07-17,"Amor nao É oque falam pra você. 
É oque fazem por você. 💜 https://t.co/uOFLRwG1x7"
14,134935429,1548370419362643969,2022-07-16,Mutirão Carolina Maria de Jesus recebeu hoje @simaopedro_SP . Vamos juntos fazer as mudanças que o nosso país precisa. https://t.co/JioW7Kf32A
15,930458238042214401,1547712276739723264,2022-07-14,Antes da gravação do meu programa favorito #ObreirosEmFoco com o querido @bpjuliofreitas em Templo de Salomão https://t.co/FXhAPkUMaA
16,1979381528,1547435642283507712,2022-07-14,@alyssonbom Depois do último siso https://t.co/o2WUPZuEyg
17,1553897545,1547268458014035971,2022-07-13,🦄 em Credit Cash https://t.co/o4JXLSM2SC
