,author_id,tweet_id,created_at,text
0,964144491702734849,1531723142540013575,2022-05-31,Acabou de publicar uma foto em Fofinho Rock Club https://t.co/BC70aewOuQ
1,1527814337062129664,1531635002043158534,2022-05-31,Acabou de publicar uma foto em Tenda da Glória https://t.co/VLrZTJOaWO
2,60949873,1531451522487312385,2022-05-31,"Mais um canto para nossos ensaios e estudos no andar do @coraldobelem em Novo Templo, Assembleia De Deus, Belém https://t.co/pZR3E2Ju0f"
3,1422600060353794057,1531369350879449094,2022-05-30,Quem estar na zl Mooca
4,60174364,1531361702658334722,2022-05-30,"Gente bonita num rolê incrível!
@fofinhorockclub é com certeza novamente um dos melhores lugares pra curtir um som em SP

📸 - @edjuniorfoto

#fofinhorockbar #gothic #blutengel #chrispohl #angelofblood https://t.co/V77INGvkBE"
5,27412034,1531297007142322178,2022-05-30,Just posted a photo @ Sesc Belenzinho https://t.co/bE1wLg9yUR
6,1480278191835123725,1530744791536914433,2022-05-29,Circulador de Fulô!! Forró hj 😏!!! https://t.co/Q785jAvobe
7,64567564,1530671054569472000,2022-05-28,Acabou de publicar uma foto em Templo de Salomão https://t.co/JZ73v1tfQ0
8,9193332,1530659051931049990,2022-05-28,"Tem, mas acabou https://t.co/6udK2e3I2w"
9,56851995,1530561148856283136,2022-05-28,I'm at Redfit Carrefour Celso Garcia in São Paulo https://t.co/B8dVzFoCPo
10,18202406,1530498703013949441,2022-05-28,🙏
11,64567564,1530496710258171904,2022-05-28,"Congresso Renovação Santificação agora! 

Unigrejas Bloco Sul Diadema-SP em Templo de Salomão https://t.co/e8KtOLFTxh"
12,830118115652595716,1530350338322141186,2022-05-28,me encontra em
13,830118115652595716,1530347747664068610,2022-05-28,louis cabtando melhor cover de todos em solo brasileiro
14,64567564,1530297929981906944,2022-05-27,Vc é o nosso convidado! em Templo de Salomão https://t.co/2NzLchbnjx
15,1527814337062129664,1530266193495465987,2022-05-27,Acabou de publicar uma foto em Tenda da Glória https://t.co/IGL5ygZh9L
16,18202406,1530261577752055808,2022-05-27,🙏
17,1031612925885276161,1530183034405675008,2022-05-27,"Secretaria de Educação do Município de Capim Grosso 
Mercedes Benz Sprinter 516 
21 lugares 
Parabéns pela sua conquista. SUCESSO 
#mercedesbenz #sprinter #turismobrasil #turismo em Radial Leste https://t.co/ffM3WkLnzx"
18,56851995,1530130325426290692,2022-05-27,I'm at Redfit Carrefour Celso Garcia in São Paulo https://t.co/9dnqnno6ao
19,982015378816753665,1529900153855004672,2022-05-26,Um giro pela capital paulista em São Paulo / Capital https://t.co/BdfN04h68u
20,54623557,1529890197126754331,2022-05-26,Acabou de publicar uma foto em Belenzinho https://t.co/jnQvonTOlz
21,173957663,1529590296169914368,2022-05-25,Acabou de publicar uma foto em Pure Pilates https://t.co/FFFBgxROuK
