,author_id,tweet_id,created_at,text
0,787841792,1554939475658248192,2022-08-03,"Apenas gostei.🥰😋
#selfie #photo #gay #boy #gym #guy https://t.co/Ip5lcGpqYa"
1,564544247,1554882881188659205,2022-08-03,Acabou de publicar uma foto em São Paulo https://t.co/ofh0Yq4G3O
2,1434351578786541575,1554873122435866624,2022-08-03,Acabou de publicar uma foto em Vila Regente Feijó https://t.co/odKGeJS3tW
3,137207381,1554858131091595273,2022-08-03,🫣 vou jogar um mini-campeonato de #futvolei no domingo (não sei pq eu aceitei 🤡) então o jeito é treinar @arenatatuape 🏖❤️⚽️ #futvolei @ Arena Tatuapé https://t.co/JjH0RYX89j
4,56427931,1554834700450967556,2022-08-03,Just posted a photo @ Anália Franco https://t.co/WNmgsNJKLA
5,841475869,1554815218332704768,2022-08-03,Acabou de publicar uma foto em São Paulo https://t.co/1VNZt1AESk
6,1448106965599723524,1554811773622042624,2022-08-03,Hoje é dia de ??? https://t.co/V9dnfVp9sb
7,177423719,1554653570204672000,2022-08-03,Acabou de publicar uma foto em Dana Farida https://t.co/Sk5Cyf3Gg7
8,57203380,1554646934014418945,2022-08-03,Acabou de publicar uma foto em Tatuapé https://t.co/K8d7oBJywZ
9,956447000,1554634193442930688,2022-08-03,"I'm at Hannover in São Paulo, SP https://t.co/mw0Jv6FQtu"
10,1474013297980624897,1554575778456772609,2022-08-02,https://t.co/OUPRj1KS6D
11,1474013297980624897,1554575329402011649,2022-08-02,Acabou de publicar uma foto em Tatuapé https://t.co/z6uLk4kFEq
12,1474013297980624897,1554554922959441920,2022-08-02,Acabou de publicar uma foto em Tatuapé https://t.co/X3kNs6sXhC
13,1551264989868179456,1554498579754000384,2022-08-02,Acabou de publicar uma foto em Tatuapé https://t.co/WdnPaURs45
14,1445511583421984769,1554473601709080576,2022-08-02,"Bom dia!

Encontre-me no ( Meet me at) :
https://t.co/R2f0z6mIUt https://t.co/CpRkvu5hmD"
15,1969021752,1554415412145664002,2022-08-02,Acabou de publicar uma foto em Jardim Anália Franco https://t.co/T9dKkrtGmf
16,333632346,1554409643564310528,2022-08-02,"#Repost @vivatatuape with @let.repost 
• • • • • •
Terça Feira é dia de Feira Orgânica na Rua Valter Gazarra, Jardim Anália. 
#vivatatuape #tatuape #analiafranco em Radio Tatuape FM https://t.co/JucCsPjX5l"
17,64727308,1554409083448352771,2022-08-02,Bom dia ☕️ em Tatuapé Bairro https://t.co/XKY3E3djC1
18,275252257,1554399330148270080,2022-08-02,Acabou de publicar uma foto em Anália Franco https://t.co/ucWhOt9T18
19,333632346,1554393335581876226,2022-08-02,Acabou de publicar uma foto em Radio Tatuape FM https://t.co/yimafoHD8G
20,333632346,1554384361138622466,2022-08-02,Acabou de publicar uma foto em Radio Tatuape FM https://t.co/SCdaeFvgKH
21,333632346,1554382338964045825,2022-08-02,Acabou de publicar uma foto em Radio Tatuape FM https://t.co/sM7bNeCYF2
22,1969021752,1554274009575047168,2022-08-02,Acabou de publicar uma foto em Jardim Anália Franco https://t.co/TpxBZFSocU
23,177423719,1554264537146314754,2022-08-02,Acabou de publicar uma foto em Dana Farida https://t.co/sPHvxRgQD0
24,1268858277363843074,1554238679144620035,2022-08-01,"hoje tomei a terceira dose da astrazenica,  e a da meningite, cara meus dois braços está doendo para um crl."
25,15667275,1554228259755278337,2022-08-01,Acabou de publicar uma foto em São Paulo https://t.co/ZtqkKgEAg5
26,200729513,1554224180781912064,2022-08-01,Acabou de publicar uma foto em Tatuapé https://t.co/6KUR0640CV
27,333632346,1554136085332099072,2022-08-01,Acabou de publicar uma foto em Radio Tatuape FM https://t.co/hpFwUB5bMA
28,333632346,1554135761510752256,2022-08-01,"#Repost @liberationmcofficial with @let.repost 
• • • • • •
Atenção, Minas Gerais! 70% dos ingressos para o show do Black Label Society no @misterrockbar já foram vendidos! Teremos casa lotada! em Radio Tatuape FM https://t.co/6CDiiThsuj"
29,333632346,1554135409298399232,2022-08-01,"#Repost @liberationmcofficial with @let.repost 
• • • • • •
Bom dia, São Paulo! Estão acabando os ingressos de Camarote para o show do Exodus, no @cariocaclub , em dezembro! em Radio Tatuape FM https://t.co/UGJVZG87la"
30,333632346,1554134768484245506,2022-08-01,Acabou de publicar uma foto em Radio Tatuape FM https://t.co/ezjxddHoVx
31,333632346,1554134123496648704,2022-08-01,Acabou de publicar uma foto em Radio Tatuape FM https://t.co/i276mi1Cg2
32,333632346,1554133511853973506,2022-08-01,Acabou de publicar uma foto em Radio Tatuape FM https://t.co/AxCptX4Xgr
33,333632346,1554132830552195079,2022-08-01,Acabou de publicar uma foto em Radio Tatuape FM https://t.co/EpZKvubvKi
34,333632346,1554128230872907778,2022-08-01,Acabou de publicar uma foto em Radio Tatuape FM https://t.co/WbH77R0mIb
35,1264343123662196738,1554092538407124993,2022-08-01,Ela achou q era cantada kkkkkk https://t.co/DRoQm2PpcD
36,1969021752,1554057385718726658,2022-08-01,Acabou de publicar uma foto em Jardim Anália Franco https://t.co/ZB96nwI6uV
37,1554093162,1553946125698203649,2022-08-01,Vou ver minha confort série pro final do domingo.
38,2553177654,1553935513660317696,2022-08-01,Acabou de publicar uma foto em São Paulo https://t.co/pm9E3w5rBi
39,333632346,1553932803418513409,2022-08-01,Acabou de publicar uma foto em Radio Tatuape FM https://t.co/KWSnnrpj4z
40,333632346,1553923460577038336,2022-08-01,Acabou de publicar uma foto em Radio Tatuape FM https://t.co/KhauEE3bix
41,333632346,1553922835827101696,2022-08-01,Acabou de publicar uma foto em Radio Tatuape FM https://t.co/HCUAnGQC8J
42,64151080,1553921821321601024,2022-08-01,Cuidado com o preenchimento do laudo médico para pedir auxílio doença no INSS https://t.co/2lwF9053Aq
43,333632346,1553915709528444928,2022-08-01,Acabou de publicar uma foto em Radio Tatuape FM https://t.co/7Q5cIcKxms
44,19996223,1553885304016216065,2022-07-31,"No #diadoviralata, uma foto com meus sobrinhos caramelinhos ✨💛🐶 em Anália Franco https://t.co/g3uUm1U38a"
45,1272659069296431104,1553870272884887554,2022-07-31,💗🌸 https://t.co/PbuY8u47P9
46,218625907,1553868664931336192,2022-07-31,A vida é boa demais pra gente se privar de comer o que traz alegria!! 🎪🤹🏻‍♀️😜 em The Circus Bar e Kitchen https://t.co/wsxAeVyfDE
47,2669823832,1553867654519193603,2022-07-31,"Acabou de publicar uma foto em Lar, Doce Lar https://t.co/U8c2LVK5Vn"
48,1969021752,1553861773572427779,2022-07-31,Culpado! em Jardim Anália Franco https://t.co/sqc3OAIXY1
49,192399845,1553839252466810886,2022-07-31,"@carrefourbrasil , atendimento lixo como sempre. Filas enormes e a porrada de caixas fechados. Vocês são deprimentes. Loja Carrefour Anália Franco. https://t.co/v2Yj5ahxZF"
50,1288262450740068352,1553814778749108226,2022-07-31,"Raquel Tremembé participou online da Convenção Eleitoral, defendendo o direitos dos povos indígenas. @verapstu fala neste momento, sobre as condições de vida da classe trabalhadora e a necessidade de uma candidatura socialista e revolucionária
#Eleicoes2022 #eleições #pstu https://t.co/XB2SNLuN2h"
51,57203380,1553807380068057088,2022-07-31,Acabou de publicar uma foto em Tatuapé https://t.co/UUhYU2BCh0
52,195560839,1553774276880244736,2022-07-31,"I'm at DIA Supermercados in São Paulo, SP https://t.co/S3jpZf5xs5"
53,438473416,1553751666729652225,2022-07-31,Acabou de publicar uma foto em Gelada Adega e Churrasco https://t.co/DCNTiX2Zrk
54,38690166,1553751535783497733,2022-07-31,4 anos dessa brincadeira aqui https://t.co/fwmqDIe1vn
55,73181116,1553703079123484673,2022-07-31,Acabou de publicar uma foto em Juneck Assessoria https://t.co/0mxz5SsK6k
56,333632346,1553627836744974337,2022-07-31,Acabou de publicar uma foto em Radio Tatuape FM https://t.co/bTreVSQs36
57,333632346,1553621849698869248,2022-07-31,"#Repost @oficialguitarrero with @let.repost 
• • • • • •
#Repost @azeoluthieria with @let.repost 
• • • • • •
Faça a manutenção periódica no seu instrumento de cordas aqui na Azeo Luthieria. em Radio Tatuape FM https://t.co/Eql4NAHI1E"
58,261271624,1553617558435250177,2022-07-31,Acabou de publicar uma foto em Ceret https://t.co/mjXfPkbsR9
59,15410917,1553590910847516673,2022-07-31,I'm at Cornelius Burger in São Paulo https://t.co/dLHioCi0WY
60,177423719,1553558697154052097,2022-07-31,Acabou de publicar uma foto em Dana Farida https://t.co/Lp5u3wsswc
61,1458452998255005699,1553551949617938438,2022-07-31,Meu reino por uma massagem na lombar e pés ❤❤❤
62,585726008,1553528694920007680,2022-07-30,Aquele rolê @mzozino é Brunão em Tatuapé https://t.co/bDCSP5Z1Ia
63,15667275,1553508938900987904,2022-07-30,Acabou de publicar uma foto em São Paulo https://t.co/STa8tPGGww
64,83720016,1553491918524489735,2022-07-30,"I'm at Carrefour in São Paulo, SP w/ @fcterras https://t.co/ortm3GkuoP"
65,30603035,1553491099217326081,2022-07-30,"Revisitando a Selva de Pedra que é o centro de São Paulo. 02/2022
Fotos: @crisfaga

#sampa 
#sampacity 
#blackexistence 
#afro 
#afrohairstyles 
#black 
#afropunk em São Paulo https://t.co/0RiJ2CLD71"
66,49807229,1553488138110177283,2022-07-30,Drinking a Puro Malte by Dusza @ Condomínio Mont Serrat — https://t.co/c3fgJ0tN3p
67,19907731,1553481622116245505,2022-07-30,E estamos nos créditos https://t.co/ZHTscE1HuM
68,19996223,1553456801911255041,2022-07-30,Qual nota merece meu date de hj? ✨🫶🏻🥰🐻 em VILA DALÍ https://t.co/a5vTkjvHGF
69,19907731,1553452575097344000,2022-07-30,"4DX (@ UCI - @ucicinemas for DC League of Super-Pets in São Paulo, SP) https://t.co/N9EQpXI3au"
70,438473416,1553449299496894465,2022-07-30,"Já estamos na área 
Vem que dá tempo em Gelada Adega e Churrasco https://t.co/Vh0qm36O3W"
71,1915416307,1553422480785686531,2022-07-30,"A melhor maneira de ser feliz com alguém, e aprender a ser feliz sozinho !! Daí a companhia será uma questão de escolha e não de necessidade!!!!fred em Tatuapé https://t.co/nt5OwSnXIg"
72,1268858277363843074,1553408998539395073,2022-07-30,papo de cineminha hoje 😉
73,66571468,1553399343671119873,2022-07-30,I'm at Tati Barbi Balas Caramelizadas in São Paulo https://t.co/ZKv1lsgVob
74,438473416,1553379779553857537,2022-07-30,"Bom Dia Galera!!
Chegou o Dia, hoje a festa é no @geladaadega 
Contamos com a presença de todos, para curtir o melhor do Samba&amp;Pagode nesse Sábadão a partir das 15hs https://t.co/M3uOMLQ4k5"
75,438473416,1553378827522363392,2022-07-30,"Bom Dia Galera!!
Chegou o Dia, hoje a festa é no @geladaadega 
Contamos com a presença de todos, para curtir o melhor do Samba&amp;Pagode nesse Sábadão a partir das 15hs em Gelada Adega e Churrasco https://t.co/VCS9msyhhD"
76,333632346,1553369835412852738,2022-07-30,40 anos ♠️♠️♠️ em Radio Tatuape FM https://t.co/gWf9KuTPI6
77,185064519,1553275138375929856,2022-07-30,Acabou de publicar uma foto em Copacabana bar https://t.co/M5K9Te2XHq
78,1551264989868179456,1553197070579892226,2022-07-30,Acabou de publicar uma foto em Tatuapé https://t.co/EVyOXWi44B
79,75877617,1553193883579850753,2022-07-30,Acabou de publicar uma foto em Itallian Hairtech https://t.co/cF2W3d0Geu
80,1551264989868179456,1553188792974118914,2022-07-30,Acabou de publicar uma foto em Tatuapé https://t.co/0N2xzPyhmQ
81,1551264989868179456,1553186220863283201,2022-07-30,"Reforma completa das Cadeiras de Jantar 🪑✨
.
.
.
.
.
#cadeiras #cadeira #cadeiradejantar #tapecaria #reforma #tapecaria #courolegitimo #couro #tatuapé #saopaulo #mooca #brasil #saopaulo #likeforlikes #curte em Tatuapé https://t.co/lysqV6pEpQ"
82,39773060,1553175910987300864,2022-07-30,Tá no ponto @chefdangalhardo ? https://t.co/5lbTydpszf
83,337408358,1553164105166585862,2022-07-29,"Vale night com a minha gata, te amo @karen_guria em St John's Pub https://t.co/KyRAOhpPkG"
84,15667275,1553145420297158658,2022-07-29,Acabou de publicar uma foto em São Paulo https://t.co/pjxhOWGYbu
85,1013856467051479049,1553125787720622082,2022-07-29,acho lindo que meus dados móveis não funciona aqui mas tá pegando o Spotify normal e sem travar as músicas
86,55968440,1553082709450399745,2022-07-29,"Show na Loja.
Música ao vivo com a Trinca para comemorar os 35 anos da @thaisrodriguesbrand! 

#eventos #eventoscorporativos #acustico #musicaaovivo #trincaacustica em Thais Rodrigues - São Paulo https://t.co/f2NxhOSz5j"
87,1450162774819094535,1553058274643046400,2022-07-29,Acabou de publicar uma foto em Tatuapé https://t.co/4LJ1b5nmyJ
88,1546230475991171072,1553048189187592192,2022-07-29,"emotions on the surface 
#inkedgirl #altgirl #sgh #ａｅｓｔｈｅｔｉｃ em Tatuapé https://t.co/T529RYnjbd"
89,161696522,1553047147586748417,2022-07-29,"I'm at Vivenda do Camarão - @vivendacamarao in São Paulo, SP https://t.co/gg5jLO0ku8"
90,179264135,1553031789983109120,2022-07-29,Acabou de publicar uma foto em Anália Franco https://t.co/xYcmMUclmU
91,84063699,1552850564974874624,2022-07-29,"Das coisas que eu mais amo: Fe e São Paulo!  💖

#Tbt de #Aniversario

#SãoPaulo #SP em São Paulo https://t.co/EdMZulz6hf"
92,898755128567754752,1552845745170137090,2022-07-29,#Secret #bdayBia 🤍🎂 https://t.co/tqBCGkoyRa
93,136435677,1552841202763972608,2022-07-29,Acabou de publicar uma foto em Rong He https://t.co/WLmHmhbCEv
94,625166425,1552834372562288641,2022-07-29,Recebemos em nossa loja no #tatuape o capacete #hjx #rpha70 https://t.co/fVuYpSKtBq
95,78184731,1552806821420834816,2022-07-29,Night 🍕🥰 https://t.co/v8FHowOUbO
