,author_id,tweet_id,created_at,text
0,1003448783638843392,1622704302601928705,2023-02-06,Acabou de publicar uma foto em Arena Tatuapé https://t.co/w3wngrvWNk
1,705574651,1622697002445443072,2023-02-06,Acabou de publicar uma foto em São Paulo https://t.co/uTLff3cXkY
2,920597438439804928,1622662411466727426,2023-02-06,"Acabou de publicar uma foto em Tatuapé, São Paulo, SP https://t.co/KF0qDB7KZy"
3,155101846,1622650147443179527,2023-02-06,🚀 em Tatuapé https://t.co/zz9CPZ81N9
4,65138908,1622648368475275266,2023-02-06,Acabou de publicar uma foto em CEU Carrão https://t.co/sXewU5Btzy
5,287327316,1622583739929722880,2023-02-06,Acabou de publicar uma foto em São Paulo https://t.co/SWYK3z1i9u
6,1432388952489594884,1622566451554004993,2023-02-06,Acabou de publicar uma foto em Itu/SP https://t.co/MWD7FNRnlX
7,64727308,1622533164940804097,2023-02-06,Bom dia ☕️ em Tatuapé Bairro https://t.co/Bw9JwksUrW
8,1434351578786541575,1622409643212275712,2023-02-06,"Mais um culto abençoado em @adperusparadadetaipas , 1° dia da Conferência de Avivamento. em Vila Regente Feijó https://t.co/L9LFtTrwc8"
9,1434351578786541575,1622408979199541248,2023-02-06,Hoje foi dia da Vó Maria estar conosco aqui em casa com os netos e bisnetos. Muito bom criar memórias  para as crianças. em Vila Regente Feijó https://t.co/vNE8JtKRui
10,192120561,1622408808143134724,2023-02-06,"Como disse Seu Madruga: ""Não há nada mais trabalhoso do que viver sem trabalhar"" 😁

A filosofia desse tal madruga é algo sublime 🤌 kkkkkkkkk em Itu/SP https://t.co/g43e67ZRyb"
11,1405915938873020417,1622400296902168578,2023-02-06,🌒 em São Paulo https://t.co/Y5DElg0Xa6
12,294291766,1622338311774691328,2023-02-05,Acabou de publicar uma foto em Itu/SP https://t.co/rrcAUhL5oh
13,1432388952489594884,1622307005196009472,2023-02-05,Acabou de publicar uma foto em Itu/SP https://t.co/iq093vVF1z
14,1060318682780483584,1622289077646008324,2023-02-05,Acabou de publicar uma foto em Junkies Skate Shop https://t.co/A57I9v417m
15,344523098,1622244882931752963,2023-02-05,Momentos especiais... em Jerônimo Tatuapé https://t.co/5mKH8N5SbT
16,1268858277363843074,1622243393958023174,2023-02-05,desapontada aff
17,1622085861645946882,1622227758922203138,2023-02-05,https://t.co/xlfYk3MjDr
18,1268858277363843074,1622200830744006656,2023-02-05,aí que cólica 🥺
19,166995676,1622042570359508994,2023-02-05,"Minha maior conquista: 
Minha família! 
Amo vocês. @flaviazanao.lettering  @amanda_e_andressa em Shopping Anália Franco https://t.co/GJawRY5N7z"
20,36465828,1622029165925916672,2023-02-05,I'm at Don Miguel Mexicana Bar in São Paulo https://t.co/PNvzkJwmvo
21,183912074,1622028097330548736,2023-02-05,"Arrasta ⬅️➡️  Levamos 10 horas para concluir 😅 Mas valeu 😊 

Como preparamos!
Sessões de Desintoxicação + Tratamentos no salão e o nosso
Cronograma Capilar em casa.

Quer vídeo do Passo a Passo? Gostou do resultado? https://t.co/jnMjKh3bun"
22,83720016,1622021602220167170,2023-02-04,"I'm at UCI 4DX in São Paulo, SP w/ @fcterras https://t.co/dT38niSLKm"
23,83720016,1622021556963516421,2023-02-04,"I'm at Outback Steakhouse - @outbackbrasil in São Paulo, SP w/ @fcterras https://t.co/iJ1pkkmfsO"
24,808469030449332225,1621993675029872646,2023-02-04,Gigante Gentil @erasmocarlosbr ❤️ em Tatuapé https://t.co/dTHvOmJ8Yl
25,19907731,1621975731327614978,2023-02-04,"4DX (@ UCI - @ucicinemas for BTS: Yet To Come in Cinemas in São Paulo, SP) https://t.co/Fk7xf56SZk"
26,2947345888,1621958653455515651,2023-02-04,aqui no evento de rock fml 🤟🏼🤟🏼🤟🏼🤟🏼🤟🏼🤟🏼🤟🏼
27,201967553,1621949362187210752,2023-02-04,"Domingo dia bom de curtir um som e comer um churrasquinho, rever os amigos! Bora?? em Tatuapé https://t.co/NKN9nN3uyO"
28,16864622,1621926327627517953,2023-02-04,Drinking a Moo England IPA - Cows on Parade by @seasonsbeer @ Praça Sílvio Romero — https://t.co/vmbNzSMEXa
29,83720016,1621880813829734400,2023-02-04,I'm at Consultório Dentário Cascaperra in São Paulo https://t.co/8ZJWD6eTir
30,1616469276222803969,1621877770287464448,2023-02-04,Acabou de publicar uma foto em São Paulo https://t.co/yqgm8pFQh8
31,3400157771,1621803320540106753,2023-02-04,#web em São Paulo https://t.co/x3OqDqrDRv
32,145482892,1621674061058416641,2023-02-04,Acabou de publicar uma foto em Buffet Evento Perfeito https://t.co/v9hsXpLdHV
33,93988861,1621554171567636482,2023-02-03,"Foco na dieta. 
2023. em Anália Franco https://t.co/NhEFw7WJKW"
34,1586341876751339523,1621503819635990529,2023-02-03,📍🏙️ em Condominio Principado de Monaco https://t.co/K2c3akbm5g
35,51617816,1621462829751484416,2023-02-03,já na fila da psiquiatria
36,177423719,1621378338509164544,2023-02-03,Acabou de publicar uma foto em Dana Farida https://t.co/WaAKWDqNNJ
37,937078248273534976,1621318658281668608,2023-02-03,Bora curtir o carnaval https://t.co/HEDdwu3TOf
38,135722182,1621314984243339264,2023-02-03,Acaba de publicar una foto en São Paulo https://t.co/f1MmArujBB
39,16631711,1621285064595378177,2023-02-02,Foto dia não planejada. em Estação Carrão (Metrô) https://t.co/Ox4Q51vluz
40,38945063,1621273259479289857,2023-02-02,"02/02 - Groundhog Day ou dia da marmota 

🎶 I got you babe 🎶

#groundhogday #feitiçodotempo #billmurray #igotyoubabe em Tatuapé https://t.co/q8m0LSKP8m"
41,53569392,1621250862248038403,2023-02-02,Hoje é dia de #tbt ? Esse clique é de 2002. em Jardim Anália Franco https://t.co/V40eCEXXQT
42,44636743,1621186740181516290,2023-02-02,I'm at Zain in São Paulo https://t.co/oB05ma6g5H
43,137960258,1621160955668316161,2023-02-02,"E lá se foram 14 anos ...
Estou jovem. 
Em 2009, já lecionava há 7 anos. em UniDrummond https://t.co/Aopes34xAC"
44,454419733,1620978891446751232,2023-02-02,Jantinha em ótima companhia! ❤️❤️❤️ em Tatuapé https://t.co/xTb2FfLp8h
45,1268858277363843074,1620945093413994496,2023-02-02,queria tanto (dar)       certo com alguém
46,1268858277363843074,1620920419749601280,2023-02-01,"a única dor que podemos sentir é essa que estou sentindo hj do treino de perna, tô andando parecendo uma velha de 60 anos hahahaha socorro deus..... mas nada me para,😛 no foco de me tornar uma grande gostosa hehehe 2023 é meu ano🙏"
47,997643728918630401,1620871622185091073,2023-02-01,Espertinha comeu o meu  lanche 😁😁😁 https://t.co/EXC3BQkZZb https://t.co/rsV7WUC4VP
48,1434351578786541575,1620831493965713413,2023-02-01,Acabou de publicar uma foto em Vila Regente Feijó https://t.co/kJorRLs9G6
49,333632346,1620804028660699137,2023-02-01,Acabou de publicar uma foto em Radio Tatuape FM https://t.co/QF9d2dai9R
50,333632346,1620803690473963520,2023-02-01,Acabou de publicar uma foto em Radio Tatuape FM https://t.co/o2iJFwxmeM
51,333632346,1620803276143738880,2023-02-01,Acabou de publicar uma foto em Radio Tatuape FM https://t.co/1HTvRmuObm
52,1088888554988687360,1620780919627055104,2023-02-01,Toma https://t.co/YmpIvqCuta
53,1434351578786541575,1620627027047972865,2023-02-01,Feliz Aniversário Esdras em Vila Regente Feijó https://t.co/uYf8ykuMTQ
54,57203380,1620625524153253894,2023-02-01,Acabou de publicar uma foto em Tatuapé https://t.co/xRo0pyKIUQ
55,1434351578786541575,1620624504761516034,2023-02-01,Acabou de publicar uma foto em Vila Regente Feijó https://t.co/CroX6NbjD1
56,1600715860062126081,1620606550921609219,2023-02-01,Pré show 😮‍💨🍀 https://t.co/iWvQrM6MYO
57,300035280,1620597086130704384,2023-02-01,Foto appena pubblicata @ Tatuapé https://t.co/N7Q2tQIrPy
58,38945063,1620582304946049024,2023-02-01,Acabou de publicar uma foto em Tatuapé https://t.co/q4nauJvK4G
