,author_id,tweet_id,created_at,text
0,38020488,1554979544615899136,2022-08-03,Acabou de publicar uma foto em Estádio Alfredo Schürig https://t.co/PL4x1otJim
1,163312074,1554976109518897152,2022-08-03,"Dica para o jantar!
Alguém se arrisca 🤔?
#ailtonbolignari #casa #cozinheiro #chef #masterchef #masterchefbrasil #comidapratica #comidarapida #dicadecomida em Vila Maria Zona Norte https://t.co/iCtMVjYRCS"
2,1178112799853158400,1554965558734594049,2022-08-03,"O @BRFeminino voltou e nós voltamos aos estádios! ✨
Linda festa organizada pelo @SCCPFutFeminino para o retorno das brabas! https://t.co/CrLlW79Q1P"
3,1402804587229237252,1554961910042353664,2022-08-03,VAMO CARAIO https://t.co/QFEgjTivBE
4,355965437,1554884920983650309,2022-08-03,2 artes. Coll.😎🤙 em Edu BarberShop. https://t.co/inxCrIybTU
5,355965437,1554843572968505347,2022-08-03,2 artes raras.😎🤙 em Edu BarberShop. https://t.co/xMvYA25tih
6,355965437,1554841368459083776,2022-08-03,Acabou de publicar uma foto em Edu BarberShop. https://t.co/t4R2vb2x63
7,355965437,1554836826229194752,2022-08-03,Acabou de publicar uma foto em Edu BarberShop. https://t.co/HMsC968RdV
8,2494016282,1554634367296757762,2022-08-03,"Eu sempre serei Arbitragem 
CBF
Sub 17
1 rodada
Analista Arbitragem CBF. 
Um time só. 
Arbitragem em Estádio Alfredo Schürig https://t.co/LxsHH3oQRp"
9,2494016282,1554633918304894976,2022-08-03,Acabou de publicar uma foto em Estádio Alfredo Schürig https://t.co/2wc8z0RU5l
10,3298162567,1554620445567160324,2022-08-03,"O Corinthians foi com tudo pra cima e conseguiu o empate, merecido! Poucos minutos antes havia acertado o travessão. Excelente cruzamento do Léo Agostinho, que é lateral de origem, e gol de centroavante do baixinho Juninho. https://t.co/ItCNzBAS5q"
11,3298162567,1554611586588868608,2022-08-02,Segunda mexida do técnico André Rosa: o artilheiro Ricardo deixa o campo pra entrada de Guilherme Bahia. O camisa 9 foi cumprimentado pelos outros reservas que aquecem atrás do gol. https://t.co/uhRUQRUxbS
12,3298162567,1554606781761978369,2022-08-02,Primeira troca no Internacional: Kauan parece ter sentido algo e sai para a entrada do Anderson. https://t.co/MZGLlJZN6k
13,3298162567,1554590710749339654,2022-08-02,Posicionamento do Inter pra iniciar a construção. Esquema similar com o que foi divulgado na arte com a escalação escalação. A diferença em campo é que Rodriguinho e Vinícius Côrtes estão mais por dentro. https://t.co/J64RxO5k4K
14,3298162567,1554584934102274052,2022-08-02,"Inter escalado! Os dois artilheiros do time na temporada estão confirmados: o meia Vinícius Côrtes (2005) e o centrovante Ricardo Mathias (2006). Ambos com 8 gols marcados. E o líder em assistências é o atacante Wendel (2005) com 3, e ex-Corinthians. https://t.co/3YTXiCQjZt"
15,3298162567,1554581764131233792,2022-08-02,"Trio de arbitragem também no trabalho de aquecimento. Quem apita hoje é João Vitor Gobi, o árbitro que apitou o Gre-Nal na final da Copinha 2020 quando o Inter levantou a taça. Os auxiliares nesta noite são Daniel Luis Marques e
Diego de Oliveira. https://t.co/RA9wcANxxU"
16,3298162567,1554576922956423169,2022-08-02,"Goleiros do Corinthians aquecendo enquanto o Guilherme Dalla Déa, técnico do Timãozinho, atende ao Sportv. https://t.co/0GrA7wZ9XR"
17,3298162567,1554567762059616256,2022-08-02,Chegando no Parque São Jorge pra mais uma cobertura da base. Hoje começa o Campeonato Brasileiro Sub-17 para Corinthians x Inter. A delegação do Colorado já chegou aqui na Fazendinha. https://t.co/FIHZt5y2Xp
18,936006655288004608,1554539159393636352,2022-08-02,"Olá tudo bem?
Como muitas pessoas sabem, o cantor Caio Lima, teve todo seu equipamento de trabalho roubado na noite de sábado na Vila Maria zona norte, abrimos essa vakinha para ajudá-lo a reconquistar o sustento da sua família!!! Gratidão a todos!!!
https://t.co/D76o1hnCuU"
19,1279435111516299266,1554520803043057664,2022-08-02,Acabou de publicar uma foto em Rua Araritaguaba 1184 https://t.co/AJuS7TzA2z
20,355965437,1554518433651339264,2022-08-02,😎💈👍 em Edu BarberShop. https://t.co/rEHHcWHYK2
21,355965437,1554515478659452929,2022-08-02,Barba na régua. em Edu BarberShop. https://t.co/VPAUaXbmkH
22,207709088,1554485966806650880,2022-08-02,"Hoy estoy aquí, en la sede del @Corinthians, equipo donde brilló @Ronaldo en su última fase como jugador en Brasil. Y equipo de Sócrates, también. Marcia es la secretaria. 25 años cuidando del club por dentro. Un amor ❤️ https://t.co/QzGKj01kEZ"
23,355965437,1554222343957905408,2022-08-01,Só escolher  e vir ara a barbearia. para vc 💈 em Edu BarberShop. https://t.co/r9k2jfNZRF
24,355965437,1554219708768985089,2022-08-01,Nice!!!😎🤙 em Edu BarberShop. https://t.co/eJEznSYAss
25,2434380813,1554187215969861633,2022-08-01,Vient de publier une photo à BabyCats https://t.co/QKyY6RnIVm
26,1273073085994930178,1554141836285022210,2022-08-01,🫤 https://t.co/TFdBM9BIap
27,2669823832,1554098725085016064,2022-08-01,"Acabou de publicar uma foto em Villa Maria, Sao Paulo, Brazil https://t.co/rjvjE4TjO1"
28,163312074,1553933022956855296,2022-08-01,Acabou de publicar uma foto em Vila Maria Zona Norte https://t.co/0di0hHLQn7
29,3298162567,1553843094503702530,2022-07-31,"Gol do Corinthians! Arthur Sousa voltou voando. O Pimentel não tem mais sossego. O centroavante girou em cima do zagueiro, e mandou pra rede. Foi o 8° dele no campeonato, artilheiro isolado. Muita comemoração aqui na Fazendinha. https://t.co/ySDYFGRxdV"
30,3298162567,1553840477954269184,2022-07-31,"Primeiras trocas do Igor Guerra: saíram Tavares e Paixão (os dois muito discretos, totalmente apagados) para as entradas do gigante GB (05) e do Juan (03). https://t.co/3Ipv6q5HWd"
31,3298162567,1553838726404575235,2022-07-31,"Arthur Sousa vem aí. Recuperado de lesão muscular, o artilheiro do Corinthians com 7 gols volta a jogar depois de quase um mês. O último jogo dele foi dia 3/7 na vitória contra o Fluminense (com gol dele). Sai Felipe Augusto. Primeira troca do Danilo, no começo do 2T. https://t.co/WUJarG7A2r"
32,3298162567,1553825753627762690,2022-07-31,"Jogo bem morno nesses primeiros 25 minutos. Enquanto o Erick Marcus estava sendo atendido, Igor Guerra chamou Pimentel pra passar algumas orientações. O zagueiro deu um bom passe, em profundidade, pro Wesley, numa das únicas chegadas perigosas do Vasco até o momento. https://t.co/7F3Ex2oylu"
33,3298162567,1553804037635596288,2022-07-31,"Chegando no Parque São Jorge porque às 16:00 a bola rola pelo Brasileirão Sub-20. O Corinthians recebe o Vasco, que começou a 8° rodada como líder, mas ontem foi ultrapassado pelo Athlético-PR. Promessa de jogo bom! https://t.co/bCpBKmC8Kd"
34,163312074,1553557644241141761,2022-07-31,Acabou de publicar uma foto em Vila Medeiros https://t.co/nPievQOEUd
35,90000556,1553463817132277760,2022-07-30,"Que benção...

Que Deus nos guie, abençoe e ilumine.
Amém.
❤️🙏🙌 em Paróquia Nossa Senhora da Candelária https://t.co/DuxbRQaUOZ"
36,1273073085994930178,1553453794704474113,2022-07-30,🫠 https://t.co/MhdA9OhvEo
37,226338570,1553435492498259968,2022-07-30,"29/07/2022

CORINTHIANS 8 X 2 JUVENTUS - 2° JOGO - SEMIFINAL - CAMPEONATO PAULISTA DE FUTSAL 2022 🏴🏳️🦅⛓️✊🏼

Aniversário celebrado em preto e branco, no maior do mundo, apoiando o Coringão! https://t.co/YdJBlpEGYn"
38,245061177,1553396593403084800,2022-07-30,Bom dia amigos !!!! https://t.co/K9KBZCPgA9
39,187380751,1553377389618634755,2022-07-30,Ontem foi dia de ver o futsal e o @DeivesFutsal em quadra. A final é logo ali 😌 https://t.co/gP162cc4c3
40,163312074,1553192521643212800,2022-07-30,Acabou de publicar uma foto em Doutor Eco Planet https://t.co/CSNaNTNV0u
41,261801470,1553189687333986306,2022-07-30,O Baixinho bom de bola!! Ídolo demais! O Maior do nosso Futsal!! @DeivesFutsal @corinthiansftsl !! Valeu craque!!! https://t.co/BN40Zksn0C
42,261801470,1553172798755012608,2022-07-30,O Baixinho bom de bola é Brabo demais!!! @DeivesFutsal #VaiCorinthians https://t.co/wknuAVcGUh
43,38945063,1553161603155124226,2022-07-29,"VAI CORINTHIANS!!! 🖤🤍

#corinthians #corinthiansfutsal #sccp em Ginásio Poliesportivo Wlamir Marques https://t.co/uNI7fbblt6"
44,226338570,1553161179383488512,2022-07-29,Acabou de publicar uma foto em Ginásio Parque São Jorge https://t.co/pL1a5Uo2qC
45,112004896,1553154229052665856,2022-07-29,"Corinthians se sente, não se explica. em SC Corinthians Paulista https://t.co/oJx1ANHiH5"
46,163312074,1553149488168144899,2022-07-29,Acabou de publicar uma foto em Doutor Eco Planet https://t.co/ibsWVzBM4t
47,301620461,1553148071286120448,2022-07-29,https://t.co/hyaMnrmDID
48,1273073085994930178,1553134625513508875,2022-07-29,🤖 https://t.co/vl1Wwofq8O
49,2669823832,1552985724667977730,2022-07-29,"Acabou de publicar uma foto em Villa Maria, Sao Paulo, Brazil https://t.co/RMZwVYB98A"
50,355965437,1552847969707343873,2022-07-29,Acabou de publicar uma foto em Edu BarberShop. https://t.co/NNWUk9bAHC
51,3337940836,1552837885216231424,2022-07-29,Acabou de publicar uma foto em SC Corinthians Paulista https://t.co/jwXTHytRl0
52,131494231,1552813088591777804,2022-07-29,"Acabou de publicar uma foto em Villa Maria, Sao Paulo, Brazil https://t.co/xbAIjbGBGT"
