,author_id,tweet_id,created_at,text
0,27921417,1542469317769527296,2022-06-30,"Acabou de publicar uma foto em Iguatemi, São Paulo https://t.co/6FDEJj0ArT"
1,27921417,1542313472574234624,2022-06-30,"Acabou de publicar uma foto em Iguatemi, São Paulo https://t.co/C79j6vHBuB"
2,816929265245687808,1542218313052426240,2022-06-29,#arte #graffiti #sumadesapareçaobaixoastral #réplicas #saomateus #zonalestedesaopaulo #artederua https://t.co/KBmLUkILrp
3,1477665528445640708,1541936926554333184,2022-06-29,Acabou de publicar uma foto em Parque Boa Esperança https://t.co/XiGlflaRFQ
4,57220858,1541920683898421250,2022-06-28,Acabou de publicar uma foto em Cid Satelite Sta Barbara https://t.co/NpAqTzlohR
5,57220858,1541574434913411072,2022-06-28,"Esse é o verdadeiro Gustavo mantuano @zenit_spb ótimo jogador, raçudo, habilidoso, melhor que o Messi. em Cid Satelite Sta Barbara https://t.co/tJ3NSYABrY"
6,1424723868967649288,1540872539240632323,2022-06-26,https://t.co/HjFG7LKU8x
7,1917950784,1540868527892176896,2022-06-26,https://t.co/RMVY5bZ5Gt
