,author_id,tweet_id,created_at,text
0,57220858,1536831229479223298,2022-06-14,"Odeio o frio, tem gente que fala que frio é vida, e você que gosta do frio, estou torcendo para seu chuveiro queimar quando você estiver todo ensaboado,  vida é o calor de 35 graus, sol forte
#cadeoverao #sol #calor https://t.co/l53NV2nV2z"
1,1500151776271556613,1536793631759257602,2022-06-14,#NewPro2022filePic https://t.co/oq95rzjiPK
2,1513711168677892103,1536698899511095296,2022-06-14,Meu filho Samuel zaion 2 anos jA praticando um pouco de música https://t.co/HerTxvkAj5
3,139893632,1536648328825405440,2022-06-14,Acabou de publicar uma foto em Onde A Alegria Se Faz Presente https://t.co/Cy1vEi2Evl
4,262875011,1536545609158639616,2022-06-14,"Nessa campanha eu quero sempre estar ctg 🎶
#AvantiPalestra 👊🏻🐷 https://t.co/KTHYNGnytI"
5,57220858,1536163507481108480,2022-06-13,"Domingo a noite, e a florinha ligada nos 10 mil volts, como desliga essa ser humaninha para ir dormir em Cid Satelite Sta Barbara https://t.co/SsewdTcDWJ"
6,139893632,1536056012054089728,2022-06-12,Acabou de publicar uma foto em Onde A Alegria Se Faz Presente https://t.co/UkadC5lhhb
7,139893632,1536033939588009985,2022-06-12,Acabou de publicar uma foto em Onde A Alegria Se Faz Presente https://t.co/iRthXHpKfG
8,438473416,1535991341707997185,2022-06-12,"Bom dia!!
É Hoje dia dos Namorados com muito Samba&amp;Pagode em GuingasBar Av Sapopemba https://t.co/XU2WD1D5I1"
9,438473416,1535990256226512896,2022-06-12,"Bom dia!!
É Hoje dia dos Namorados com muito Samba&amp;Pagode em GuingasBar Av Sapopemba https://t.co/ssu3IsV2cw"
10,139893632,1535696734277488640,2022-06-11,Será ⁉️ em Onde A Alegria Se Faz Presente https://t.co/iU1kwLyATc
11,2505875096,1535399389203685377,2022-06-10,Na próxima vez que for buscar uma compra feita na Internet vou olhar com mais atenção o endereço 🗣
12,2446325420,1534962011171393538,2022-06-09,Terminal São Mateus e seus incontáveis pedintes incovenientes 🤦‍♀️
13,57220858,1534830599566917632,2022-06-09,#bandeirasdemastro #sinalizadores #torcidaorganizada #contraofutebolmoderno em Cid Satelite Sta Barbara https://t.co/BKIkodCiYx
