,author_id,tweet_id,created_at,text
0,2736444460,1544684594196348928,2022-07-06,Acabou de publicar uma foto em Nova Era Medley https://t.co/U4XS8XGU1L
1,756943753382858752,1544450102105972736,2022-07-05,🇩🇪⚽️🙏🏼 em Parque São Jorge Corinthians https://t.co/nLM2Ik2hiY
2,57220858,1544425839021924352,2022-07-05,"Já estamos prontos para o jogo de logo mais.
#corinthians #libertadores #éojogodavida em São Matheus , Lado Leste https://t.co/UPb92W0Dwx"
3,1367193082798694411,1544408141819006985,2022-07-05,Luxe Oil Erik kened Professional https://t.co/KuyQudUUNg
4,1543752723211902979,1543760687834480640,2022-07-04,#NewProfilePic #photocardtrend #TikTok https://t.co/JpcaQMmhVn
5,1513711168677892103,1543717254969364486,2022-07-03,Continuo trabalhando no social meus filhos já podem desfrutar do resultado do meu empenho dentro do São Mateus em movimento obrigado a nosso time do espaço 6 É forte 6 É  FODA unidos por um amanhã melhor https://t.co/fOXQaRSy6Q
6,57220858,1543588401210949632,2022-07-03,"Serviço de utilidade pública
#transportecoletivo #higiene em São Matheus , Lado Leste https://t.co/5NgvdoVlYc"
7,76802219,1543439872672681985,2022-07-03,"Minha princesa que eu amo.  💟😍 em São Matheus , Lado Leste https://t.co/UiBYdnpq3H"
8,57220858,1543368488689012741,2022-07-02,Acabou de publicar uma foto em Cid Satelite Sta Barbara https://t.co/cSVclW850u
9,3288782332,1543357584962363399,2022-07-02,Acabou de publicar uma foto em Castelo Ra-Tim-Bum https://t.co/CNKcixZ9II
10,1062668661847195648,1543230106918916100,2022-07-02,"Bom dia Seres de Luz.
A todas e todos novos amigos um abraço fraterno.
Sejam bem vindas e bem vindos.
Namastê. em Residencial Aricanduva https://t.co/nwxDENOmqq"
