,author_id,tweet_id,created_at,text
0,139893632,1534564464665759756,2022-06-08,Acabou de publicar uma foto em Onde A Alegria Se Faz Presente https://t.co/siakqWO0lR
1,57220858,1534113631503151109,2022-06-07,"Corinthians tem dois jogos relativamente fáceis na tabela, tem tudo para ampliar sua vantagem na primeira posição, mas se tratando de Corinthians nunca é fácil. #corinthians #campeonatobrasileiro https://t.co/o8xT30Z4Cu"
2,24546800,1533979662807748613,2022-06-07,Acabou de publicar uma foto em Parque São Jorge Corinthians https://t.co/G137RO13Ly
3,1640791956,1533593607831175169,2022-06-05,Melhor aquisição em Campos @badenbadenofc https://t.co/7fTDrgboUO
4,1440604975311122434,1533506101999812608,2022-06-05,Zl Paulista na área  .... nem tenta https://t.co/qEJIudwh73
5,2222189542,1533471369626890241,2022-06-05,https://t.co/ZDD6QjW1kI
6,115146921,1533211605110083584,2022-06-04,Acabou de publicar uma foto em Fábrica De Cultura Sapopemba https://t.co/dvidVWNR2G
7,56931404,1533154819606716416,2022-06-04,"Sábado de folga, e a gente está onde?😅 em Parque São Jorge Corinthians https://t.co/keorFHNSpb"
8,55433785,1532669989559353345,2022-06-03,Sexta-feira top para todos. em São Mateus https://t.co/EjcdQMKCw1
9,57220858,1532526223263408129,2022-06-03,Acabou de publicar uma foto em Cid Satelite Sta Barbara https://t.co/zLrMdQRLzD
