,author_id,tweet_id,created_at,text
0,57220858,1531566782200389632,2022-05-31,#ficaadica😉 em Cid Satelite Sta Barbara https://t.co/CmTNhoXYNW
1,1256252439952572418,1531399310117675008,2022-05-30,@CidadeDosHom3ns Meu pintinho amarelinho https://t.co/SEn1fCqWqZ
2,139893632,1531396922929401856,2022-05-30,Agenda aberta! Kkkk em Onde A Alegria Se Faz Presente https://t.co/npktTwK3JQ
3,721819798741610496,1531289409965858816,2022-05-30,Acabou de publicar uma foto em Cohab Team Jd Conquista https://t.co/jKY1DQ2KU4
4,2549182475,1531279143618465794,2022-05-30,eu adoro microeconomia
5,1417315922914824192,1531247271047835649,2022-05-30,Eu e o Kaiquinho https://t.co/NWfnRpYnNN
6,1256252439952572418,1531058650193739779,2022-05-29,https://t.co/3jHJZeweV8
7,1531056213810610178,1531058101885063172,2022-05-29,Manda um abraço pra  meu irmão Rafael
8,788294862,1531045566288826373,2022-05-29,Elas estão bem nessa edição são as melhores em São Mateus https://t.co/Wx2PcAbi2V
9,788294862,1531044590186336256,2022-05-29,Ela também é fã em São Mateus https://t.co/rzONLpaumF
10,270069773,1531031522077470720,2022-05-29,Bum bum bum! em Castelo Ra-Tim-Bum https://t.co/BXka85eAat
11,139893632,1531008716232962049,2022-05-29,Acabou de publicar uma foto em Onde A Alegria Se Faz Presente https://t.co/g9QrWd0itC
12,108674783,1530917053355401218,2022-05-29,"Mas o porteiro é novo, ele não me conhece 🎶😜

Nada mais divertido do que revisitar a infância assim. em Castelo Ra-Tim-Bum https://t.co/tQV7kk50bQ"
13,139893632,1530911811490525184,2022-05-29,Acabou de publicar uma foto em Onde A Alegria Se Faz Presente https://t.co/o2MC3pZfqp
14,1426609893243510787,1530673245736689664,2022-05-28,"Mais um sábado de jogo! Mais uma vitória, três pontos garantidos, uma goleada de 4x0 no estilo @corinthiansfutebolfeminino de ser! Parabéns meninas e obrigada pelas fotos!!! Vai Corinthians 🖤🤍 https://t.co/NyqqzEcuZg"
15,139893632,1530650783380807681,2022-05-28,Acabou de publicar uma foto em Onde A Alegria Se Faz Presente https://t.co/FtOWuwxhYO
16,57220858,1530491915627544576,2022-05-28,Hoje é dia de conhecer o adversário do @corinthians na final do #mundial desse ano em Cid Satelite Sta Barbara https://t.co/ja1aG9SI11
17,1256252439952572418,1530337803053281280,2022-05-27,https://t.co/r2ECg82p02
18,24546800,1530083034095140864,2022-05-27,Acabou de publicar uma foto em Parque São Jorge Corinthians https://t.co/cbUEuTcMbY
19,57220858,1530005815624597511,2022-05-27,"Aí vem esses torcedores modinhas, pedir para o #rogerguedes, FDP entrou sem vontade nenhuma, @rogerguedes23, você não sabe o que é o @corinthians, se não está a fim pede para sair seu fdp em Cid Satelite Sta Barbara https://t.co/9jXZ7roRRm"
20,57220858,1529769771289300993,2022-05-26,Acabou de publicar uma foto em Cid Satelite Sta Barbara https://t.co/7phdgheNFB
21,63815057,1529643094886555649,2022-05-26,Acabou de publicar uma foto em São Mateus https://t.co/98q9VclERI
22,1433506662334222336,1529520626343591937,2022-05-25,@uber99anjo São Mateus
23,718465305761214464,1529223204887470081,2022-05-24,Boa noite a todos
24,91478456,1529156826163556353,2022-05-24,"""Baila, baila como camina
Camina como baila"" 🎶🔥

📸 @thamymarins_

#ValnitaAnittaCover em Fábrica De Cultura Sapopemba https://t.co/aUFAwtYlIj"
25,910581641357258753,1529113535887945728,2022-05-24,https://t.co/Vba8NuQd8g
