,author_id,tweet_id,created_at,text
0,57220858,1536163507481108480,2022-06-13,"Domingo a noite, e a florinha ligada nos 10 mil volts, como desliga essa ser humaninha para ir dormir em Cid Satelite Sta Barbara https://t.co/SsewdTcDWJ"
1,139893632,1536056012054089728,2022-06-12,Acabou de publicar uma foto em Onde A Alegria Se Faz Presente https://t.co/UkadC5lhhb
2,139893632,1536033939588009985,2022-06-12,Acabou de publicar uma foto em Onde A Alegria Se Faz Presente https://t.co/iRthXHpKfG
3,438473416,1535991341707997185,2022-06-12,"Bom dia!!
É Hoje dia dos Namorados com muito Samba&amp;Pagode em GuingasBar Av Sapopemba https://t.co/XU2WD1D5I1"
4,438473416,1535990256226512896,2022-06-12,"Bom dia!!
É Hoje dia dos Namorados com muito Samba&amp;Pagode em GuingasBar Av Sapopemba https://t.co/ssu3IsV2cw"
5,139893632,1535696734277488640,2022-06-11,Será ⁉️ em Onde A Alegria Se Faz Presente https://t.co/iU1kwLyATc
6,2505875096,1535399389203685377,2022-06-10,Na próxima vez que for buscar uma compra feita na Internet vou olhar com mais atenção o endereço 🗣
7,2446325420,1534962011171393538,2022-06-09,Terminal São Mateus e seus incontáveis pedintes incovenientes 🤦‍♀️
8,57220858,1534830599566917632,2022-06-09,#bandeirasdemastro #sinalizadores #torcidaorganizada #contraofutebolmoderno em Cid Satelite Sta Barbara https://t.co/BKIkodCiYx
