,author_id,tweet_id,created_at,text
0,139893632,1556380774156451847,2022-08-07,😉🤣😂 em Onde A Alegria Se Faz Presente https://t.co/F6wsI1ethd
1,1462924952382976004,1556137517853843458,2022-08-07,"Corre ver meu novo som 
TRAP STYLE 🎖 https://t.co/gkr9FWAOxE"
2,163274935,1556085861481078784,2022-08-07,Acabou de publicar uma foto em IASD Fazenda da Juta https://t.co/21glqtAoLP
3,1062668661847195648,1555963628053987328,2022-08-06,"Já sabe quais são as próximas viagens da Orion?
Clica no link na bio
🌎
Escolha seu destino e tire suas dúvidas diretamente comigo pelo whats:
📱(11) 95308-4082 em Residencial Aricanduva https://t.co/5m3FHizyOg"
4,139893632,1555959119978323978,2022-08-06,Acabou de publicar uma foto em Onde A Alegria Se Faz Presente https://t.co/TsQS0BhCnO
5,1191808401325666305,1555689938808500224,2022-08-05,"tá f0d4, família 😔 em Plantao notícia urgente https://t.co/FmJghxElfN"
6,50282663,1555329062255599619,2022-08-04,@renanlisboaenf @kimpaim https://t.co/2fUghI7RRD
7,909136642216218626,1555320665942757381,2022-08-04,Acabou de publicar uma foto em Juta City https://t.co/kLcWHyZw3t
8,1260097627,1555272505673359361,2022-08-04,Acabou de publicar uma foto em Parque São Jorge Corinthians https://t.co/gn5BpgjBFw
9,100984363,1555113804001906689,2022-08-04,QUE PÊNALTI HEM MARCOS ROCHA !!!;! em São Mateus https://t.co/7PsVHyOUDw
10,100984363,1555024735947218944,2022-08-04,Acabou de publicar uma foto em São Mateus https://t.co/oq83P2PNXd
11,163274935,1555014640702132225,2022-08-04,Acabou de publicar uma foto em IASD Fazenda da Juta https://t.co/LoWuEbnGXz
12,1256252439952572418,1555004980632985601,2022-08-04,Outra de uns tempos atrás https://t.co/p1asRCJUv2
13,1256252439952572418,1554999602025299969,2022-08-04,De cueca pelo menos uma vez 🍆☺️ https://t.co/XkBDQUi1TO
14,217082300,1554911460853256193,2022-08-03,Acabou de publicar uma foto em São Mateus https://t.co/WVRHBQ5kDI
15,139893632,1554866444604686337,2022-08-03,Acabou de publicar uma foto em Onde A Alegria Se Faz Presente https://t.co/8bsJbmS4Vs
16,80157529,1554638431946416130,2022-08-03,"Maior satisfação, poder receber uma grande amigo @mcgp.oficial  na minha casa, @pier17loungebar  poucos sabem dos tombos, mas muitos vem a sua vitória… #pier17 em Pier 17 Lounge Bar https://t.co/Z09FC64FM4"
17,139893632,1554622905555755008,2022-08-03,Misericórdia 😉 em Onde A Alegria Se Faz Presente https://t.co/64JrenbaUK
18,2494016282,1554577442177695746,2022-08-02,"Sub 17 Brasileiro 
Corinthians x Internacional 
Avistar Arbitragem CBF em Parque São Jorge Corinthians https://t.co/EzjWnAEQSf"
