,author_id,tweet_id,created_at,text
0,81813407,1532277596746133504,2022-06-02,Acabou de publicar uma foto em Zazou Moda Gestante https://t.co/8YIDo5DMjj
1,4699948116,1532207311783186438,2022-06-02,Acabou de publicar uma foto em Castro Burger https://t.co/o9ioPQqcX6
2,1347077785,1532141643767369731,2022-06-01,"Claudia Di Moura é maravilhosa, né?? Deveria ser muito mais valorizada 😍😍😍 #CaraeCoragem"
3,1347077785,1532139764249501698,2022-06-01,Feliz de ver MalaPia de novo 😍😍😍😍😍😍😍😍😍😍 #CaraeCoragem
4,1347077785,1532137982777516032,2022-06-01,"#CaraeCoragem tá MUITO rápido mds, piscou, perdeu"
5,1373950792483414019,1532137181501849600,2022-06-01,"Exposição A Arte de Tim Burton: A Beleza Sombria dos Monstros.

📸: @pauloscorsa https://t.co/B3GyuYoTBR"
6,1347077785,1532123461677682688,2022-06-01,"Isso crescendo, quando cresce, 1% ao ano e olhe lá. Não há futuro decente aqui não https://t.co/LR0f2bfgZv"
7,1347077785,1532123207607767041,2022-06-01,"Meu pai ontem vindo comentar de suposta corrupção no comando da Eletrobrás sabe se lá de qual ano da era PT, que já acabou há 6 anos…..enquanto isso 12,5% de inflação OFICIAL HOJE https://t.co/QsRlJygopC"
8,1347077785,1532121144161091585,2022-06-01,"Gasolina R$ 8
Café R$ 20
Gás R$ 130
Orçamento secreto de R$ 16 BILHÕES Maior alta do desmatamento em 10 anos
Insegurança alimentar em 36% das famílias 
700k mortos de covid
Mais de R$ 5 milhões no cartão corporativo 
Pelo menos R$ 6 milhões gastos em motociatas https://t.co/qIRRZKXppt"
9,1347077785,1532118229417615361,2022-06-01,@GiovanniDeBiase Ainda acho que deveria ser igual aos jornais da Globo aberta
10,900895731166228480,1532114164751245317,2022-06-01,Just posted a photo @ Neverland https://t.co/TjvFFFuBrz
11,312610270,1532103969773957123,2022-06-01,Me encanta tudo aquilo que é de verdade e vem do coração. em Ibirapuera Park https://t.co/LzZsszgRow
12,90000556,1532092035603304455,2022-06-01,Caminhada fantástica com Patty e Luna... ♥️🙏🦮 em Cinemateca Brasileira https://t.co/YdPXotNArt
13,1347077785,1532083777459179523,2022-06-01,"@Fcrenatomeuamo Mas no caso do jornalismo o prédio é o mesmo, o microfone é igual e inclusive há intercâmbio de jornalistas, repórteres e apresentadores entre globo e GNews"
14,1049437974931406848,1532080322199883784,2022-06-01,🍁 https://t.co/MfDfHoL2kG
15,1347077785,1532079163603316736,2022-06-01,"Só não entendi o porquê não é só o selo debaixo, com ele abrindo pro logo em azul da globo. Não fez sentido https://t.co/UcM9OWPsAx"
16,1056021125753458689,1532054046130835456,2022-06-01,❄️☀️🤍 em Parque Ibirapuera https://t.co/WyzcQf34F2
17,144811662,1532044379468320773,2022-06-01,Acabou de publicar uma foto em Vila Clementino https://t.co/gKagitTSNs
18,2177060390,1532043206279540736,2022-06-01,Acabou de publicar uma foto em Parque Ibirapuera Conservação https://t.co/br8rye9lJK
19,923908208976187392,1532042622071721987,2022-06-01,Acabou de publicar uma foto em Itaipu Baterias Unidade Vila Mariana https://t.co/vNUoNniprT
20,923908208976187392,1532042518291963906,2022-06-01,Acabou de publicar uma foto em Itaipu Baterias Unidade Vila Mariana https://t.co/tUwwBlTDeI
21,923908208976187392,1532039710071308288,2022-06-01,Acabou de publicar uma foto em Itaipu Baterias Unidade Vila Mariana https://t.co/vouu7DyGAV
22,923908208976187392,1532039612817866753,2022-06-01,Acabou de publicar uma foto em Itaipu Baterias Unidade Vila Mariana https://t.co/7faGlqJQ60
23,923908208976187392,1532033879095246849,2022-06-01,Acabou de publicar uma foto em Itaipu Baterias Unidade Vila Mariana https://t.co/zqfDsbWcI0
24,923908208976187392,1532033780319494149,2022-06-01,Acabou de publicar uma foto em Itaipu Baterias Unidade Vila Mariana https://t.co/AGzxvyoRvk
25,1347077785,1532026945642307586,2022-06-01,Novo selo de encerramento da GNews veio ai???? 😮 #ConexaoGlobonews
26,1347077785,1532012225988280326,2022-06-01,É GROTESCO o creme de leite e o leite condensado que não têm leite e sim esse tal “composto lácteo”. NOJENTO REAL #ConexaoGlobonews
27,1347077785,1532011569328148480,2022-06-01,Isso que ovo NÃO é commodity….imagine se fosse https://t.co/Ei4zreydPt
28,1347077785,1532010755746299904,2022-06-01,Reduflação é só mais um sintoma do empobrecimento geral do país e perda brutal do poder de compra do brasileiro #ConexaoGlobonews
29,51778575,1532006649501736960,2022-06-01,"Acabou de publicar uma foto em Moema, Sāo Paulo, Brasil https://t.co/Z2oa1lVpHq"
30,1470857820316868608,1532005955336032261,2022-06-01,Acabou de publicar uma foto em Effemme Modas https://t.co/aanGqCKOfH
31,923908208976187392,1531998832573267974,2022-06-01,Acabou de publicar uma foto em Itaipu Baterias Unidade Vila Mariana https://t.co/V8i52uCxrr
32,923908208976187392,1531998707956207617,2022-06-01,Acabou de publicar uma foto em Itaipu Baterias Unidade Vila Mariana https://t.co/6wL4qJ32yo
33,1347077785,1531998257261555715,2022-06-01,@feltrinoficial @Splash_UOL @UOL Robô não vê tv
34,1347077785,1531998177989169152,2022-06-01,"E vai cortar o cara que, apesar de eu não gostar, tenho que reconhecer que deu ontem DEZOITO PONTOS em plena 15h com uma novela de 2000 que já foi reprisada 4x?? https://t.co/yqnC4reaxh"
35,115146921,1531997744541351938,2022-06-01,Acabou de publicar uma foto em Núcleo De Oncologia Prevent Senior https://t.co/eLug6d3nOi
36,1347077785,1531997607945453569,2022-06-01,Eita que não vai ter soja neon #RainhadaSoja #OvoFrito https://t.co/pW4W8NuV0T
37,16631711,1531996072305893377,2022-06-01,"Não acrescente dias à sua vida, mas vida aos seus dias. em Metrô SP https://t.co/OoYRhdkks0"
38,1470857820316868608,1531994875339620352,2022-06-01,Acabou de publicar uma foto em Vila Mariana https://t.co/fXIXrDWkYx
39,923908208976187392,1531994314959634434,2022-06-01,Acabou de publicar uma foto em Itaipu Baterias Unidade Vila Mariana https://t.co/66GIxq346j
40,923908208976187392,1531994194264346625,2022-06-01,Acabou de publicar uma foto em Itaipu Baterias Unidade Vila Mariana https://t.co/XSKiilcnU7
41,923908208976187392,1531989077414752258,2022-06-01,Acabou de publicar uma foto em Itaipu Baterias Unidade Vila Mariana https://t.co/LB0gQPeo57
42,923908208976187392,1531988909068062723,2022-06-01,Acabou de publicar uma foto em Itaipu Baterias Unidade Vila Mariana https://t.co/UqSdoRos3F
43,41934128,1531986244141555714,2022-06-01,"Confira o resultado!
Agora com o “antes” e o “depois” 😂!

Parabéns @balao.prafesta e @renatabaloes_ 
Sejam Bem-vindas! em Cenário Balões https://t.co/S6rGZ6fMdA"
44,1470857820316868608,1531983691894996997,2022-06-01,Acabou de publicar uma foto em Effemme Fashion store https://t.co/Fj7SJJF7Z0
45,923908208976187392,1531982252770459648,2022-06-01,Acabou de publicar uma foto em Itaipu Baterias Unidade Vila Mariana https://t.co/Pzt3yVyzTQ
46,41934128,1531975642111262722,2022-06-01,Contagem regressiva! 😃 em Cenário Balões https://t.co/v2JfDhsG9g
47,51502761,1531972164290809856,2022-06-01,Ótimo mês a todos ✈ ♥ 🍀 💼 🌎 💺🇧🇷 #airplane #airport #aviation #travel #travelphotography #travellers #travelgram #travelingram #travelblogger #traveler #trip #brasil #travelworld #travelwriter #wanderlust #aviao #aviacao #aronrizzo #YouTube #viagens #dicasdeviagem #turismo https://t.co/I8wbYPALDh
48,1500942453716795392,1531965325272657922,2022-06-01,@Sou_Direita1 https://t.co/GZIEk9sHKj
49,344523098,1531951328628551681,2022-06-01,#📚 #chocolatequente #Friends em Cafe das coisinhas https://t.co/63rgHsnt01
50,18222826,1531941443232841728,2022-06-01,Aquele encontro nacional que gera resultados exponenciais em Jojo Ramen https://t.co/Z3H6thOm5L
51,391478238,1531935905304428544,2022-06-01,#BomDia ☕ https://t.co/zSUGZhNBXM
52,47502733,1531929979839254528,2022-06-01,Luz e sombras para começar o hoje. em Instituto de Assistência Médica ao Servidor Público Estadual - Iamspe https://t.co/ZzPQ2QlqK0
53,95303457,1531911943577128960,2022-06-01,Acabou de publicar uma foto em Assembleia Legislativa de São Paulo https://t.co/4yrYoJL5jp
54,428993401,1531846386874040322,2022-06-01,Acampamento Vitória ! Polícia Penal Já! em Assembleia Legislativa de São Paulo https://t.co/Vorjc272zA
55,56610486,1531833762505424896,2022-06-01,Com o Pr. Odailson Fonseca ( União Central Brasileira- Comunicação da IGREJA ADVENTISTA DO SÉTIMO DIA). Que Deus abençoe muito pastor. #uniaocentralbradileira em Alesp Auditório Franco Montoro https://t.co/YpEY1QdyiV
56,69938974,1531833752107851777,2022-06-01,Exposição “A Beleza Sombria dos Monstros de Tim Burton” #TimBurton #Ibirapuera https://t.co/0KotZz8yzx
57,56610486,1531828170449915904,2022-06-01,Acabou de publicar uma foto em Alesp Auditório Franco Montoro https://t.co/raqLFVoTcW
58,56610486,1531818237607956482,2022-06-01,Um dia Especial. Como é maravilhoso usufruir de nosso direito de exercer nossa liberdade de escolha e prática religiosa. Um abraço pra todos. #liberdadereligiosa em Alesp Auditório Franco Montoro https://t.co/O9ngJc6Bjt
59,210258990,1531815436819607553,2022-06-01,"I'm at Radisson Hotel Paulista Sao Paulo in Jardins, São Paulo https://t.co/jzFOr05T4c"
60,1195407769,1531806263541104642,2022-06-01,Katsu Kare em Kinboshi Karaoke https://t.co/jbBZDmL25j
61,238771880,1531798110158086144,2022-06-01,♥️😍😮‍💨🥰❤️‍🔥🫶🏾✨ https://t.co/kEsGgUbw3g
62,215776349,1531796912973697025,2022-06-01,👄 em Vila Mariana https://t.co/H7zrDmFdgf
63,1347077785,1531793500617981952,2022-06-01,"@RickSouza @_reinaIdo Rick, quanto tava dando a Gnews?"
64,1347077785,1531791822892285952,2022-06-01,Saudades ouvir a trilha sonora de encerramento todo dia às 22h30 da noite https://t.co/w2ZUl2u2gl
65,35021879,1531780141671665664,2022-05-31,🌆❤ em Sesc Avenida Paulista https://t.co/j8ONB2XSXt
66,3895005683,1531774133599719425,2022-05-31,"Corte Masculino e barba 💇🏻 

#cortemasculino #barba #barbaseestilos #cortedisfarçado #cortemoderno #style #stylemen  #saopaulo #vilamariana #paraiso #chacarainglesa #pracadaarvore #sãopaulo em Vila Mariana https://t.co/l6ecEQ9Ytt"
67,3895005683,1531773627129110528,2022-05-31,"Ruivo 👩‍🦰 

#ruivo #ruivoescuro #red #hairstyle #wella #wellaprofessional #hair #hairdresser #beauty #cabelosruivos #vilamariana #saopaulo em Vila Mariana https://t.co/hOBOrecxzn"
68,75471043,1531762597753765890,2022-05-31,"Nem todos os dias são bons, mas há algo bom em cada dia. ☕️ em Coffeetown Vila Mariana https://t.co/Lc3BHBxl1D"
69,340611708,1531761842925756421,2022-05-31,Acabou de publicar uma foto em Gisele Albano Danças https://t.co/abquDHdQ2p
70,1347077785,1531749649651990528,2022-05-31,@ICepollina Por isso odeio!!!!
71,1347077785,1531744341156306948,2022-05-31,#BolsonaroVagabundo https://t.co/4b8z6i354k
72,1347077785,1531733781614297093,2022-05-31,Ficar em casa = sair da dieta
73,1347077785,1531733694611955712,2022-05-31,"Ainda dá tempo de voltar pro nome antigo!!! E outra, o que tem a ver bbb com fatiamento da novela? NADA https://t.co/QeF0o4VJNW"
74,1241132361741406208,1531721433159696385,2022-05-31,Quem vê a foto não imagina a tremedeira que foi pra encostar numa parede de vidro a 63 metros de altura https://t.co/Ln2jnutZRJ
75,124879030,1531719071997231112,2022-05-31,Acabou de publicar uma foto em Shopping Metrô Santa Cruz https://t.co/kg4lfD0Xz5
76,87171493,1531716903210733569,2022-05-31,Acabou de publicar uma foto em Papelaria Universitária https://t.co/ItgQdLgI3a
77,1347077785,1531716033391755266,2022-05-31,Imagina se ela vai ao Rio!!!! 🙏🙏🙏 https://t.co/bMue0ysQr8
78,188727812,1531713801334280193,2022-05-31,69a Asamblea Anual #FLAM ⁦@presidenciaflam⁩ ⁦@magistradosuy⁩ https://t.co/fmXpqsyAUm
79,90000556,1531708418746105856,2022-05-31,Caminhada épica com a Luna... ♥️🙏🦮 em Cinemateca Brasileira https://t.co/f6f45WtMmJ
80,1495232590340571137,1531708061873758208,2022-05-31,Quem se lembra desse pôster do Almanaque Tudum 2021 🥰🤭 em Tudum Festival Netflix https://t.co/0kTXNr1wdN
81,3092052842,1531687491224457216,2022-05-31,A temperatura cai e as crianças da escolinha somem🥲 https://t.co/sgg4DKL9yx
82,1347077785,1531675845319852034,2022-05-31,SUPER A FAVOR de um Estudio i B no gnt!!!!!!!!!! #Estudioi
83,249916641,1531664800975138818,2022-05-31,Drinking a Pilsen by Cevada Pura @ Little Beer — https://t.co/uesBGLI844
84,1347077785,1531661767427899393,2022-05-31,"Só lembrando que os casos de Covid estão aumentando ainda há MUITOS jovens na onda do “aiinnnn, sou saudável, to ótimo com 2 doses, não preciso de 3.” https://t.co/hvPZRduuw8"
85,249916641,1531657526625845248,2022-05-31,Drinking a Pacific Extra Pale Ale by @seasonsbeer @ Little Beer — https://t.co/5rOoa3KfAs
86,1470857820316868608,1531647637484711937,2022-05-31,Acabou de publicar uma foto em Effemme Modas https://t.co/yuVMDyD6eU
87,1458452998255005699,1531643422024540161,2022-05-31,"Postei uma foto de um vibrad8r porque vou fotografar os itens de um sex shop essa semana e teve uma galera espantada!!!
Enfim a hipocrisia.
Hahahahaha."
88,1470857820316868608,1531627663877623808,2022-05-31,Acabou de publicar uma foto em Vila Mariana https://t.co/NcOxa1b20h
89,1470857820316868608,1531622917963931649,2022-05-31,Acabou de publicar uma foto em Effemme Fashion store https://t.co/7Qu7yarJiW
90,15741733,1531609807945453568,2022-05-31,"Road to @maratonadoriooficial… 42,195 km

See you at the finish line!

#run #running #runner #correr #correre #courir #бегать #equipeludias @ludias2001 #beatyesterday #garmin https://t.co/Nq5wGQsQcI"
91,25574151,1531595690673160195,2022-05-31,"I'm at Pão de Açúcar - @paodeacucar in São Paulo, SP https://t.co/ZVtMPRbYi7"
92,78463094,1531589958493929473,2022-05-31,"Acabou de publicar uma foto em Moema, Sāo Paulo, Brasil https://t.co/cPjXhW6d9G"
93,81813407,1531584448596017154,2022-05-31,Acabou de publicar uma foto em Zazou Moda Gestante https://t.co/0IrFxe0cpC
94,22248152,1531519437609869314,2022-05-31,Acabou de publicar uma foto em Instituto da Voz Artística em Otorrinolaringologia - dr. Reinaldo Yazaki https://t.co/Soo2tUaUBK
95,1347077785,1531453624945082369,2022-05-31,"@chicobarney Nossa não, melhor reinstituir oficialmente a novela das 23h com esse nome (NADA da babaquice de ‘superserie’) e voltar com produções invernais de meio de ano, como foram os remakes de 2011 a 2014"
96,1347077785,1531449073961771010,2022-05-31,"@brunobbragac Problema não é esperar até dia 02/10, é o que o presidente pode e tentará fazer contra o país, as instituições e a democracia entre outubro e 01/01/23 caso ele perca"
97,129864698,1531446135860211714,2022-05-31,"Em todos os encontros que tive, só pude estar lá porque encontrei a mim!
.
#infinitodamanu em Tavolino Jardins https://t.co/Go6pyVorIU"
98,81813407,1531433845781934084,2022-05-31,Acabou de publicar uma foto em Zazou Moda Gestante https://t.co/DUa7XF0Mwj
99,1347077785,1531415940096790530,2022-05-30,Não que novela das 19h precise de nexo….mas não sei se me prende não
100,41934128,1531415919628627969,2022-05-30,Acabou de publicar uma foto em Cenário Balões https://t.co/HkHLkbyveM
101,1347077785,1531415796097994753,2022-05-30,To realmente achando a história de #CaraeCoragem totalmente sem pé nem cabeça
102,41934128,1531397447196483585,2022-05-30,Acabou de publicar uma foto em Cenário Balões https://t.co/gEGdEOJk3q
103,25574151,1531390972050956292,2022-05-30,"I'm at Dona Alexandrina Padaria Gourmet in São Paulo, SP https://t.co/1weet83kiT"
104,467626735,1531389904281804800,2022-05-30,#تصوير_اختي📱📸 #المملكة_المتحدة🇬🇧 #لندن #مدينة_الضباب #سفر #سياحة #تغيير_جو #العائلة #الأهل #خواتي #هايدبارك #بحيرة_البط #من_الأرشيف #الثلاثاء_31_مايو_2022 @ Hide Park-London https://t.co/f9w6WNPjC4
105,43470333,1531384916176318464,2022-05-30,Embicicletado e molhado em Metro Santa Cruz au BR https://t.co/byJtArrv0y
106,375925260,1531383354523693059,2022-05-30,Acabou de publicar uma foto em Superando O Lúpus https://t.co/boUbwdunKc
107,1347077785,1531377358950866948,2022-05-30,@Rodrigo_Caruso 🙏🙏🙏😍😍😍😍
108,1031200865531686919,1531369537865764869,2022-05-30,"Obrigado por ser luz na minha escuridão, eu te amo 🖤 https://t.co/eCQNihVKSL"
109,1241416484049518594,1531352009554935808,2022-05-30,Acaba de publicar una foto en Paraíso https://t.co/DMFv0Pu3kT
110,41934128,1531347834955522053,2022-05-30,"Inscrições:

Até 31/05/2022 com desconto de 10%

Pague em até 10 vezes sem juros! Fale conosco.

Link na Bio em Cenário Balões https://t.co/A5g5fmv11m"
111,213769407,1531346998175072257,2022-05-30,Mais uma semana de Advocacia! @leonepereiraadvogados #leonepereiraadvogados #drleonepereira em Leone Pereira Advogados https://t.co/WiMfkQW84C
112,1269813173135212549,1531340898314878982,2022-05-30,Nunca achei q me tornaria a pessoa q toma café sem açúcar
113,40265572,1531325698186551296,2022-05-30,Just posted a photo @ Outback Shopping Metrô Santa Cruz https://t.co/Sc1XA6PxVh
114,1347077785,1531317255895756801,2022-05-30,"Queremos @NatuzaNery PRESENCIALMENTE na Rua Von Martius, 22 nessa sexta!!! @GloboNews @Rodrigo_Caruso @beltraomaria https://t.co/OeY4IiV3n2"
115,1347077785,1531316902504673280,2022-05-30,@Noveleii Torcendo pra não ser uma Salve Jorge. Confesso que estou com medo por ser a retomada de uma novela dividida entre Brasil e outro país 🙏🙏🙏🙏🙏🙏
116,1157044974799794176,1531310026274418688,2022-05-30,"Curso Maravilhoso de Hipnose Não Verbal. 

Super indico.

#hnv #Hipnose #hipinosebrasil #hipnose #hipnoseemsaopaulo #saopaulocapital #sp em Grand Mercure Ibirapuera https://t.co/0RtjrRCuBT"
117,40125120,1531294139291209728,2022-05-30,"@eduardomartini 
Simplesmente Clô
Teatro União Cultural/SP
By CEPEDA Francisco em Teatro União Cultural https://t.co/o9wJxn023X"
118,56850119,1531291628278730752,2022-05-30,Acabou de publicar uma foto em Parque Ibirapuera Conservação https://t.co/GmsMxisSjm
119,53418338,1531291356764721154,2022-05-30,Acabou de publicar uma foto em Faculdade Fipecafi https://t.co/mAy48CCweE
120,134972054,1531291168385925120,2022-05-30,Acabou de publicar uma foto em Estudio Do Batata https://t.co/nkmAYwXZWb
121,3092453777,1531290896242814976,2022-05-30,"talk with friend — #35mm #analog

🎞 experimental b&amp;w — @festivaldefilmesvencidos
📷 praktica mtl 5b
🧪 @nanni_lab em Parque Ibirapuera https://t.co/ZA9vJ154Ws"
122,1470857820316868608,1531281770263588864,2022-05-30,Acabou de publicar uma foto em Effemme Modas https://t.co/Ik9I56qhHb
123,1470857820316868608,1531272501107560448,2022-05-30,Acabou de publicar uma foto em Vila Mariana https://t.co/fNqSanYvnT
124,1470857820316868608,1531269158607929345,2022-05-30,Acabou de publicar uma foto em Vila Mariana https://t.co/CCXauvxZaP
125,1470857820316868608,1531260413299531776,2022-05-30,Acabou de publicar uma foto em Effemme Fashion store https://t.co/XWzdzuOBsj
126,35344924,1531258354798014464,2022-05-30,Acabou de publicar uma foto em Oca Ibirapuera https://t.co/kc1aq0F2y2
127,41934128,1531252660828917760,2022-05-30,Acabou de publicar uma foto em Cenário Balões https://t.co/QCKHq4wGYE
128,45237004,1531251301853675521,2022-05-30,"Hora do solzinho 😍🤩 em Saúde, Sao Paulo, Brazil https://t.co/BkNQnmWtS4"
129,124879030,1531239382056935425,2022-05-30,Acabou de publicar uma foto em Shopping Metrô Santa Cruz https://t.co/QbKnFgPIw0
130,923908208976187392,1531236141369802753,2022-05-30,Acabou de publicar uma foto em Itaipu Baterias Unidade Vila Mariana https://t.co/1msQj1cwZn
131,923908208976187392,1531236012273422336,2022-05-30,Acabou de publicar uma foto em Itaipu Baterias Unidade Vila Mariana https://t.co/MT7Ekn8toa
132,81813407,1531230509627494401,2022-05-30,Acabou de publicar uma foto em Zazou Moda Gestante https://t.co/UNNsBmehlI
133,391478238,1531200028198445058,2022-05-30,"A Semeadura é livre, mais a Colheita é obrigatória..!!! Se a colheita não tá boa, troca de semente.

""Lei da Semeadura""

#BomDia #VáeVença #NextLevel 📊"
134,78463094,1531194373701980160,2022-05-30,"Acabou de publicar uma foto em Moema, Sāo Paulo, Brasil https://t.co/fW2o8yzJNl"
135,81013744,1531186293979467776,2022-05-30,"Bom Dia!☀️ 
Freestylizando mais um vídeo original Hip Hop Style, vários registros, várias lentes em ângulos diferentes.

#arthurfreestyle #hiphop #rap #freestyle #freestylizando #free #style #street #song #sp #show #ccsp #smc #mêsdohiphop https://t.co/wVmeluEHPW"
136,1117078613558476800,1531114411464839171,2022-05-30,Um por do sol https://t.co/FqjgPEsw76
137,704813885849772032,1531082680275767299,2022-05-30,"Ontem fomos ver mais da arte sobre a vida e obra do Burton (¹daisy achando que eu tava tirando foto do lugar mas na verdade eu tava tirando dela) (²era pra gente fazer um animal na parede com os ímãs, mas fizemos um crackudo) https://t.co/eVSjD97Cus"
138,58840546,1531066440412897280,2022-05-30,Acabou de publicar uma foto em Tim Burton na Oca https://t.co/OF5hEOH23U
139,624823904,1531062493090656257,2022-05-29,Acabou de publicar uma foto em Parque Ibirapuera https://t.co/7DccIEGppb
140,624823904,1531052893968662533,2022-05-29,Acabou de publicar uma foto em Parque Ibirapuera https://t.co/Olb0lS2V5F
141,41838450,1531051106461261824,2022-05-29,Acabou de publicar uma foto em Vista Restaurante Ibirapuera https://t.co/MbxREKy3qF
142,21091150,1531048385452691457,2022-05-29,Acabou de publicar uma foto em Japan House São Paulo https://t.co/P0Qpo19cjp
143,825337360292442116,1531034255819677696,2022-05-29,Rolê no parque 😬 https://t.co/RnYrDwd2AW
144,29353616,1531034110495449088,2022-05-29,Let's dance! https://t.co/6gWn32Jrh9
145,1855879927,1531031095327838210,2022-05-29,Just posted a photo @ Ibirapuera Park https://t.co/4khgxBMA6s
146,44376472,1531030461190967301,2022-05-29,Don't touch It's art em Oca Ibirapuera https://t.co/2oYySp8C4J
147,1855879927,1531027852547743748,2022-05-29,Just posted a photo @ Ibirapuera Park https://t.co/nZPo5LAJvj
148,1161961828219596800,1531024434630471682,2022-05-29,"São composições sóbrias e silenciosas nas quais o mar, a areia e céu são massas horizontais de cores com texturas e variações tonais, entremeadas por poucos elementos, como pescadores, redes e barcos.
#JosePancetti #AlmeidaeDale #Pancetti 
#PaisagensBrasileiras #ArteModerna https://t.co/Y9tLqgfrFp"
149,1161961828219596800,1531024424404656130,2022-05-29,"Únicas na longa história da pintura de paisagem no Brasil, as telas de José Pancetti exibem seu estilo inconfundível, em meio a uma tradição de rebuscamento e excesso de detalhes quando se trata de representar a natureza brasileira. 

José Pancetti
Sem título 1945
óleo sobre tela https://t.co/C5Fs6f1iDS"
150,1224280911061098497,1531016118545965062,2022-05-29,"E eu que já fui em dois restaurantes estrelados só esse mês?! 
Meu eu de 20 anos estaria muito orgulhoso 😂 https://t.co/TtquHKyOjg"
151,41934128,1531012370017013761,2022-05-29,Acabou de publicar uma foto em Cenário Balões https://t.co/Ey0JbWvyqQ
152,50443728,1530997320111771650,2022-05-29,Acabou de publicar uma foto em Vila Clementino https://t.co/WiDFb6rr2N
153,624823904,1530990942978822146,2022-05-29,Voltando a patinar depois de quase morrer por ter quebrado uma costela 😍 em Parque Ibirapuera https://t.co/8ptyEqfkqs
154,1165806361390845954,1530987071631937537,2022-05-29,SP é lindo demais https://t.co/32tvE0bHtz
155,1347077785,1530979470781431809,2022-05-29,"Velho picareta da empresa onde eu trabalhava, declarou um valor errado à Receita que em 1º lugar nem deveria ser declarado"
156,1347077785,1530965215722016769,2022-05-29,"Se estamos realmente com uma nova onda, que bom que já peguei agora, já me livro disso"
157,391478238,1530955313704321025,2022-05-29,Chegaremos lá kkk #BoaTarde 🍽 https://t.co/wIGn9ShfTP
158,38918230,1530946400766369792,2022-05-29,Ibirapuera na veia em Ibirapuera Park https://t.co/fadkeZBA46
159,90000556,1530942633119387648,2022-05-29,Aventura matinal com a Luna... ♥️🙏😘🦮 em Cinemateca Brasileira https://t.co/18vgQignmV
160,71581273,1530939068791529473,2022-05-29,#MuseuDeArteContemporânea em MAC USP https://t.co/4jKx0USGu1
161,70180456,1530935746315567105,2022-05-29,Acabou de publicar uma foto em Cinemateca Brasileira https://t.co/14MF8njAp3
162,41934128,1530933273609719808,2022-05-29,Acabou de publicar uma foto em Cenário Balões https://t.co/s0Ohf429AU
163,58264264,1530928107431018498,2022-05-29,E a descoberta que 🥊 e chutar me relaxam e deixam 🙂 #tapago em Spin'n Soul Aclimação https://t.co/QmUNbt58OG
164,68475360,1530927990737186818,2022-05-29,Culture-se! 🖤 en Tim Burton na Oca https://t.co/Bm9EELHd7N
165,361189054,1530922197757612032,2022-05-29,Soltando a musculatura https://t.co/jKwBkh0mX3
166,32411283,1530915184830726146,2022-05-29,Começando o dia. Exposição Artur Bispo do Rosário em Itaú Cultural https://t.co/cp1jgcqdEZ
167,45237004,1530914932497211392,2022-05-29,"Final da champions ✅
Churras✅
Breja✅
Amigos✅
2 meses do gaelzinho ✅✅✅ em Saúde, Sao Paulo, Brazil https://t.co/g0lpvI7uzt"
168,46611511,1530905863476678658,2022-05-29,"@rodrigogarcia_ @governosp @prefsp 
Mais e mais moradores de rua se abrigam no terminal de ônibus Vila Mariana. Quando isso vai mudar??? @rodrigobocardi 
#saopaulo #BDSP #Noticia #cidadania @cidadealerta @MinCidadania #homelessness #streetphotography https://t.co/i9KYPa8UF3"
169,41934128,1530900147403509761,2022-05-29,Acabou de publicar uma foto em Cenário Balões https://t.co/NbnXyEQIuR
170,15741733,1530872904207966210,2022-05-29,"Road to @maratonadoriooficial… 42,195 km

See you at the finish line!

#run #running #runner #correr #correre #courir #бегать #equipeludias @ludias2001 #beatyesterday #garmin https://t.co/4orPzj5a0F"
