,author_id,tweet_id,created_at,text
0,59426409,1637903569163526147,2023-03-20,#sp2 #g1sp #datena #BrasilUrgente https://t.co/IUM2BYJu9d
1,84166285,1637295275768270848,2023-03-19,"Houve um tempo em que não havia representatividade de princesas, heroínas e personagens da nossa cor. Mas isso mudou, e hoje podemos ser o que quiser...que as nossas crianças cresçam vendo a sua cor de pele em todos os lugares! Licença Ariel Preta tá On https://t.co/adB8XpZD4f"
2,67344026,1637155412263796738,2023-03-18,bota pra cortar no modo stone (@ Lena Cabeleireira) https://t.co/6ElO6epegJ https://t.co/wHnfXGC5s6
3,1382655284674445318,1636835112447795202,2023-03-17,"Esses tipos de mensagens que eles mandam. 

Não sou obrigada. 🤮🤮 https://t.co/8PN1tYgSKC"
4,1555023323444174848,1636779144171208705,2023-03-17,"O bom aqui do bairro é que tem sempre alguém querendo engolir tudo.

The good thing here in the neighborhood is that there's always someone wanting to swallow my dick. 😋 https://t.co/nBeJ1s7Srz"
5,710226548507410433,1636577968557371393,2023-03-17,Você se lembra de quando ingressou no Twitter? Eu me lembro! #MeuAniversárioNoTwitter https://t.co/Mwy5qB2y13
