,author_id,tweet_id,created_at,text
0,1272659069296431104,1553870272884887554,2022-07-31,💗🌸 https://t.co/PbuY8u47P9
1,438473416,1553751666729652225,2022-07-31,Acabou de publicar uma foto em Gelada Adega e Churrasco https://t.co/DCNTiX2Zrk
2,3043211619,1553750532023586817,2022-07-31,Acabou de publicar uma foto em Online Quadros https://t.co/d7zkxj7yGf
3,64727308,1553703993519513600,2022-07-31,Bom dia ☕️ em Vila Formosa Sp - ZL https://t.co/fj804pCSvY
4,3371399722,1553690402879856641,2022-07-31,Acabou de publicar uma foto em Vila Formosa https://t.co/KX60aIzOLm
5,261271624,1553617558435250177,2022-07-31,Acabou de publicar uma foto em Ceret https://t.co/mjXfPkbsR9
6,177423719,1553558697154052097,2022-07-31,Acabou de publicar uma foto em Dana Farida https://t.co/Lp5u3wsswc
7,1052735544344633344,1553520153933103104,2022-07-30,Viver já é uma vitória digna de toda gratidão. Agradeço a Deus por me conceder essa conquista todos os dias!!! https://t.co/H7788EuIuB
8,19907731,1553481622116245505,2022-07-30,E estamos nos créditos https://t.co/ZHTscE1HuM
9,19907731,1553452575097344000,2022-07-30,"4DX (@ UCI - @ucicinemas for DC League of Super-Pets in São Paulo, SP) https://t.co/N9EQpXI3au"
10,438473416,1553449299496894465,2022-07-30,"Já estamos na área 
Vem que dá tempo em Gelada Adega e Churrasco https://t.co/Vh0qm36O3W"
11,438473416,1553379779553857537,2022-07-30,"Bom Dia Galera!!
Chegou o Dia, hoje a festa é no @geladaadega 
Contamos com a presença de todos, para curtir o melhor do Samba&amp;Pagode nesse Sábadão a partir das 15hs https://t.co/M3uOMLQ4k5"
12,438473416,1553378827522363392,2022-07-30,"Bom Dia Galera!!
Chegou o Dia, hoje a festa é no @geladaadega 
Contamos com a presença de todos, para curtir o melhor do Samba&amp;Pagode nesse Sábadão a partir das 15hs em Gelada Adega e Churrasco https://t.co/VCS9msyhhD"
13,64727308,1553344576940916738,2022-07-30,Bom dia ☕️ em Edificio Residencial Monte Castell https://t.co/gRhzfAEmRs
14,3371399722,1553310093051060224,2022-07-30,Acabou de publicar uma foto em Vila Formosa https://t.co/SXbsFnXI8x
15,3043211619,1553202492086710272,2022-07-30,"Nossos Artistas bonfimarts

Obra ""Linhas Douradas"" para a @onlinequadros. 🖼️
.
Visite o site da Online Quadros e confira mais artes minhas para o seu lar. Link na Bio! 😉 em Online Quadros https://t.co/fdx7fMFrjg"
16,161696522,1553047147586748417,2022-07-29,"I'm at Vivenda do Camarão - @vivendacamarao in São Paulo, SP https://t.co/gg5jLO0ku8"
17,3371399722,1552945429691629568,2022-07-29,Acabou de publicar uma foto em Vila Formosa https://t.co/C4BM3gDU9n
18,1085470427886088193,1552931902956486657,2022-07-29,Acabou de publicar uma foto em Vila Formosa Sp - ZL https://t.co/xfVQU7VwQQ
19,136435677,1552841202763972608,2022-07-29,Acabou de publicar uma foto em Rong He https://t.co/WLmHmhbCEv
20,1085470427886088193,1552789500136407042,2022-07-28,#RecadoDado em Vila Formosa Sp - ZL https://t.co/7kazUNQ0ie
21,438473416,1552509782032109574,2022-07-28,"Sabadão a tarde vem pra Gelada Adega @geladaadega 💥💥💥💥
#sabadou🍻 #geladaadega #gruposambaentreamigos em Gelada Adega e Churrasco https://t.co/d5V5La6CS0"
22,438473416,1552500723430166528,2022-07-28,"Sabadão a tarde vem pra Gelada Adega @geladaadega 💥💥💥💥
#sabadou🍻 #geladaadega #gruposambaentreamigos em Gelada Adega e Churrasco https://t.co/I0UuP2VA3b"
23,260008425,1552404011751555072,2022-07-27,Não existe desafio impossível de superar. em Tatuapé ZL https://t.co/NBnCe31ltb
24,177423719,1552350722246729729,2022-07-27,Acabou de publicar uma foto em Dana Farida https://t.co/tj8cwt4v5m
25,1085470427886088193,1552318875168952321,2022-07-27,"O melhor de todos!
#PTdoPCC em Vila Formosa Sp - ZL https://t.co/qHvwi6qdnB"
26,1085470427886088193,1552316581195051008,2022-07-27,Acabou de publicar um vídeo em Vila Formosa Sp - ZL https://t.co/cZK115UqMY
27,1085470427886088193,1552289029701369857,2022-07-27,"Vai lá na cracolandia livrar seus viciados das drogas, vai seu filho da puta! em Vila Formosa Sp - ZL https://t.co/wgnNy2EBTi"
28,3043211619,1552259819767140352,2022-07-27,Acabou de publicar uma foto em Online Quadros https://t.co/7dtOCwkodM
29,64727308,1552241044065988608,2022-07-27,Bom dia ☕️ em Vila Formosa Sp - ZL https://t.co/JjV0L3JM9v
30,1085470427886088193,1552223688354721792,2022-07-27,Acabou de publicar uma foto em Vila Formosa Sp - ZL https://t.co/Qu4LOjE5Qp
31,3371399722,1552219226680729601,2022-07-27,Acabou de publicar uma foto em Vila Formosa https://t.co/nnBpA0ouSu
32,2288985993,1552117300664442880,2022-07-27,@laugonzalezz5 Nossa que foto feiaaaa
33,1279435111516299266,1552035533148266496,2022-07-26,Acabou de publicar uma foto em Shopping Anália Franco https://t.co/kaQlNsRWKt
34,328291829,1551945449803862017,2022-07-26,Meu melhor amigo e meu amor! 💙💞 em Jericoacoara- Ceará https://t.co/piS3MzU0Zp
35,143443643,1551869719245795328,2022-07-26,"Bom Dia! 

Conjunção da Lua e Vênus na manhã de hoje. 

#bomdia #goodmorning #lua #moon #venus #conjuncao #aurora #amanhecer #horizonte #vilaformosa #saopaulo #city #ceu #sky #estrela #star #astros em Vila Formosa https://t.co/KsBQuDlQYx"
36,190316221,1551731839278235648,2022-07-26,Acabou de publicar uma foto em Comunidade Cristã na Zona Leste https://t.co/LgsG6gbOYy
