,author_id,tweet_id,created_at,text
0,712098467699662849,1566533021855096832,2022-09-04,"Amor você completa o que falta em mim, eu preencho aqueles espaços vazios que existe em você. Juntas, transbordamos ♥️

♥️ Amo-Te ♥️

#lgbtqi #lesbianpride #lesbiancouple #lesbians #esposas #saopaulo https://t.co/ocEIHI0ey1"
1,1557257884370624512,1566511906889818118,2022-09-04,Acabou de publicar uma foto em Giovanni Gronchi Morumbi https://t.co/6CdYNUd421
2,712098467699662849,1566261976548147201,2022-09-04,"Você me dominou e agora eu só penso
Em te amar, te amar, te amar 💍 👩🏽‍❤️‍👩🏻 ♥️

#lesbians #lesbiancouple #saopaulofc #saopaulo #elenão #orgulholesbico em Zona Sul Da Capital Paulista https://t.co/BvFLkpLo7C"
3,1566186653001162757,1566204594643996672,2022-09-03,Ela veio me ver🤕❤️ https://t.co/KBIr5gOMBg
4,3255401848,1566184045519990784,2022-09-03,Caraca eu tô maluco 😎🥴🤫🤑🤪😜😝😛😋 minha namorada é pro player 🤝❤️ https://t.co/nwJrBAicpx
5,120505473,1566136382292197382,2022-09-03,"Meu dia de princeso rsrsrs na @cobasi obrigado a todos os profissionais pelo atendimento!
Até a próxima!
🐶🐕‍🦺 em Cobasi - O shopping do seu animal https://t.co/CV1qopqO8J"
6,1478874399386316805,1566103185839857665,2022-09-03,Acabou de publicar uma foto em Arkham Asylum https://t.co/SI8bjzbFCk
7,15716894,1566084910133268481,2022-09-03,Sábado…. ☺️ em Campo limpo Z/S https://t.co/a2DZw3SwXS
8,104938275,1566063786154291201,2022-09-03,"Meu rap nunca vai ser submisso! #cronicamendes #chronic420 #subsolohiphop 

fotos @joaoribeiro7art em BG Produções https://t.co/FdZS8Ums1K"
9,44810649,1566060001357172741,2022-09-03,O luxo de tomar cafezin logo cedo na padaria.. temos sim! https://t.co/WkDS11GHUd
10,1951827606,1565854273082122248,2022-09-03,🥵❤️‍🔥 em Euforia Bar https://t.co/qrBMrVyvCQ
11,1031610731379216384,1565764329479217153,2022-09-02,Acabou de publicar uma foto em AD Brás Pq Santo Antônio https://t.co/7VNvg4gzAP
12,747577257795985409,1565755853722075137,2022-09-02,"Apto de Locação R$ 1.500,00 Watts App 9 7643 7370 Luis Abbade em Jardim Umarizal https://t.co/RPdLoxY5Ql"
13,747577257795985409,1565755358395645952,2022-09-02,"Apto de Locação R$ 1.500,00 Watts App 9 7643 7370 Luis Abbade em Jardim Umarizal https://t.co/LIhjuhJZVl"
14,747577257795985409,1565753361982525444,2022-09-02,"Apto de Locação Jardim Umarizal R$ 1.500,00 Watts App 9 7643 7370 Luis Abbade em Jardim Umarizal https://t.co/HSX6fUcsJ5"
15,142325755,1565641488784048131,2022-09-02,"I'm at Padaria Nova Juliana in São Paulo, SP https://t.co/RZ9XdrcX5S"
16,1500767809701392384,1565521479613177858,2022-09-02,@mairamedeiros 😂 https://t.co/cS4SJGrUGi
17,747577257795985409,1565335723984965633,2022-09-01,"Sobrado de Locação Vila Maracanã R$ 2.100,00 Watts App 9 7643 7370 Luis Abbade em Shopping Campo Limpo https://t.co/ztB3N6D9Ij"
18,747577257795985409,1565334022607486976,2022-09-01,"Apto de Locação Jardim Germânia 1 Dormitório R$ 1.050,00 Watts App em Shopping Campo Limpo https://t.co/tpiuDCr05v"
19,747577257795985409,1565332697895292929,2022-09-01,"Apto de Locação Vila Maracanã R$ 2.500,00 Mobiliado Watts App 9 7643 7370 Luis Abbade em Hospital Municipal do Campo Limpo https://t.co/B3HTGNXVeJ"
20,747577257795985409,1565151052432900096,2022-09-01,"Apto de Locação Vila Andrade R$ 2.500,00 Watts app 9-7643-7370 Luis Abbade em Vila Andrade Morumbi SP https://t.co/ziTP9ZAKWn"
21,747577257795985409,1565139594059956225,2022-09-01,Apto de Locação Metro Capão Redondo 9-7643-7370 Luis Abbade em Shopping Campo Limpo https://t.co/sH1NY7dudA
22,747577257795985409,1565134240945405954,2022-09-01,Apto Locação Inocoop 9-7643-7370 Luis Abbade em Inocoop Campo Limpo https://t.co/TGxb5VM45x
23,495563042,1565046283055906817,2022-08-31,"Ontem particei desse encontro maravilhoso  com os companheiros de profissão....
a União faz a força
@clayton_le_moors @edielbezerra @aurelio.silva.5283166 @trincaprodutora 
#alexlobaoguitar https://t.co/VrbyEqU3H4"
24,142325755,1565027681305075714,2022-08-31,I'm at Descomplica SP Campo Limpo in São Paulo https://t.co/rQft7pGB5m
25,52544422,1564922651914735617,2022-08-31,"@SPSobreTrilhos  @L5lilas  
Em poucos minutos, surge algum problema, a fila fica enorme, ""um bolo"" de pessoas ficam na portaria da estação, e atrapalha tbm quem quer sair/entrar no terminal de ônibus.
Esta estação tbm precisa de mais uma entrada. https://t.co/1kNz9cxVXl"
26,1256397574636003328,1564783551308087296,2022-08-31,Esse vídeo me lembrou umas águas passadas https://t.co/iRUVPFBeLp
27,1525543797597282309,1564701958941933569,2022-08-30,Acabou de publicar uma foto em Campo Limpo https://t.co/7tgvfMistu
28,739951339053195264,1564604542188232704,2022-08-30,Ser liberada mais cedo é tão bom
29,120505473,1564376845889437699,2022-08-29,De boas 🐶 em Taboão da Serra - SP https://t.co/2wrzABVLQ8
