,author_id,tweet_id,created_at,text
0,332476743,1534616821424340992,2022-06-08,Acabou de publicar uma foto em Campo limpo Z/S https://t.co/hvpUH3fZWO
1,51938571,1534462459762843649,2022-06-08,"Aprendizagem significativa!
#Aprendizagem
#AprendizagemSignificativa
#Aprendizado
#Pedagogia
#Escola em Anglo Morumbi https://t.co/B00x2RryXg"
2,1453819205426503683,1534328393797406720,2022-06-08,"COM APRESENTAÇÕES DE DANÇA, COMIDAS TÍPICAS, CORREIO ELEGANTE, CADEIA, MÚSICAS E VAMOS TER SHOW DE ROCK NA NOSSA FESTA JUNINA 🤩 coisa diferente, é disso que eu gosto, a cultura de todo jeito para interagir com os pais e alunos
HORÁRIO DO SHOW: 16h às 17hs☇Banda ""NóiS"" https://t.co/GXB3yQVHNo"
3,1453811417279311873,1534324895169007617,2022-06-08,"COM APRESENTAÇÕES DE DANÇA, COMIDAS TÍPICAS, CORREIO ELEGANTE, CADEIA, MÚSICAS E VAMOS TER SHOW DE ROCK NA NOSSA FESTA JUNINA 🤩 coisa diferente, é disso que eu gosto, a cultura de todo jeito para interagir com os pais e alunos
HORÁRIO DO SHOW: 16h às 17hs☇Banda ""NóiS"" https://t.co/ivcn1M0TKE"
4,992025504344616960,1534307485644890113,2022-06-07,"Me tornei o que eu mais temia, a pessoa que dorme no metrô e tem que ser acordada na última estação, mds que vergonha! 🫥"
5,1530349922557501440,1534254937294655488,2022-06-07,"Fé , a Paz e o Sorriso inabalável. ✨
ㅤ
#matheuskadosh em A.D Ministério Ágape Unidos Em Cristo - Jd Rosana https://t.co/nRROmpvOKS"
6,138564368,1534164008038764544,2022-06-07,השלך עליו את כל חרדתך. 💛 em Taboão da Serra - SP https://t.co/dTmPZbJkYP
7,1477440766460977156,1533998210267611137,2022-06-07,Era para meu amor mas ela brigou comigo... então agora é meu. https://t.co/4J3X4hj3mc
8,162937441,1533893258568425478,2022-06-06,I'm at Habib's in São Paulo https://t.co/7ar9O0Qg9y
9,162937441,1533866821790617601,2022-06-06,I'm at Clinica Médica Amil - Unidade Morumbi https://t.co/yTkGxAu5RW
10,180858857,1533599672278949891,2022-06-06,"Competir com os melhores, te faz alguém melhor. 
Seguimos por mais… 🙏🏻⚽️🔥 em AABB São Paulo https://t.co/GYLnafayNe"
11,65547548,1533577625389527040,2022-06-05,Eu juro que era guaraná ✌🏼🥃 em Condomínio Edifício Morumbi Park https://t.co/3RdBsLU1In
12,747577257795985409,1533550638180737024,2022-06-05,Acabou de publicar uma foto em Condominio Saint Arthur https://t.co/DmcqDQoe2i
13,15716894,1533532943595016193,2022-06-05,"Dois anos depois, ela está de volta: a festa junina!!! #festajunina em Campo limpo Z/S https://t.co/qtEWOGM8CO"
14,705431315,1533514092622794753,2022-06-05,Acabou de publicar uma foto em Jardim Martinica https://t.co/7mrW7gOTBP
15,1485959546501844996,1533484909645414400,2022-06-05,Por hoje é isso https://t.co/93Jje1Pyzt
16,58655158,1533474729046298627,2022-06-05,MUITO FELIZ QUE MEU AMIGO @AraujoWedney  ENTROU PARA O TUITER COM VENDAS DE @stanley junto ao grande @JMLHadad https://t.co/rmeZipVaXK
17,332476743,1533249640195411969,2022-06-05,"Parabéns mano TMJ 
#13DaSul em Campo limpo Z/S https://t.co/fE4bqUaNlR"
18,747577257795985409,1533197299551281154,2022-06-04,Acabou de publicar uma foto em Vila Andrade Morumbi SP https://t.co/4oL1lLTeJu
19,747577257795985409,1533192428215222277,2022-06-04,Acabou de publicar uma foto em Vila Andrade Morumbi SP https://t.co/GN2I3CRfgH
20,747577257795985409,1533190852826255366,2022-06-04,Acabou de publicar uma foto em Vila Andrade Morumbi SP https://t.co/ips0M5F60T
21,747577257795985409,1533189968717291520,2022-06-04,Acabou de publicar uma foto em Vila Andrade Morumbi SP https://t.co/sy6rEFFifj
22,747577257795985409,1533188705770512384,2022-06-04,Acabou de publicar uma foto em Vila Andrade Morumbi SP https://t.co/jqXi9LS7QU
23,1320508572439109634,1533139876023259136,2022-06-04,de onti https://t.co/IbwVdtFbW3
24,39241133,1533124325955493888,2022-06-04,comendo tóxico com as crianças em Burguer King - Morumbi Av. Giovanni Gronchi https://t.co/W7GE9WmkyH
25,41958045,1533077503065088000,2022-06-04,Acabou de publicar uma foto em Casa Da Vivi https://t.co/9CRmfNgJwg
26,1484998722308169731,1533059048614023168,2022-06-04,Acabou de publicar uma foto em Condomínio Clube Atua Taboão https://t.co/1ss8J3yfED
27,1349507239686639616,1532906049069539328,2022-06-04,@seiqndsei https://t.co/IPVTzGJsro
28,123530548,1532864012622372865,2022-06-03,Advocacia Trabalhista e Previdenciária especializada. #dicasdodoutor em Rivaldo Emmerich Sociedade Individual de Advocacia https://t.co/8kiFrvg8ZM
29,33900482,1532849109450731520,2022-06-03,E eu me sinto abençoado 🏀🏀🏀 #nba #nbafinals #nbastore #nbabrasil #nbabasketball #boanoite #sp em NBA Store - Morumbi Town https://t.co/e1ZzXQkbCN
30,258113481,1532789540359790592,2022-06-03,Just posted a photo @ Shopping Campo Limpo https://t.co/3jYMEvTUij
31,33900482,1532772599037665283,2022-06-03,On e roteando #nbafinals #nbastore #basquete #aulascria #yessir 💥 em Morumbi Town Shopping https://t.co/KMiNJmmb8M
32,52363865,1532768577710739456,2022-06-03,"De gata selvagem à princesa da corte: my name is Samantha Sevilha Rodrigues II
#lovecats #lovecatsforever #livingwithcats #petsthatprotect #petshop #petswelove em Condomino Louisville &amp; Nashville https://t.co/IOVljPZGZt"
33,33900482,1532722736245645313,2022-06-03,Criança primeira vez na Disney #nba #nbabrasil #nbastore #nbafinals 🏀💪🏻 em Morumbi Town Shopping https://t.co/kCay8jIbaP
34,82896355,1532582928206659585,2022-06-03,"Atirando (@ G16 Unique (Campo limpo) in São Paulo, SP) https://t.co/VYcRN67eA2"
35,1485634520896446469,1532575642855870470,2022-06-03,@zemiakov @monark https://t.co/5xUS8MmHIJ
