,author_id,tweet_id,created_at,text
0,4222596388,1525996219851579393,2022-05-16,Aqui vendo a lua https://t.co/jkWE9A39qg
1,31959150,1525923276769337344,2022-05-15,Vivendo ... em Capão Redondo https://t.co/DZZlJrLpNN
2,1525818755942600704,1525823848607793152,2022-05-15,https://t.co/qXqnGhqb7U
3,56610486,1525760296689840129,2022-05-15,Acabou de publicar uma foto em Unasp Campus I https://t.co/bEyq3zcWSu
4,1477440766460977156,1525629370408349697,2022-05-15,"Até meu drink é vermelho hoje, pq o fogo no rabo é maior que o cansaço 🔥 🔥 🔥 #zenetoecristianovaitomarnocu https://t.co/rVB1xw6jW7"
5,1438826646396710913,1525616888050601984,2022-05-14,Seria tudo em vão sem oração. em Igreja Batista Jd. Maria Virginia https://t.co/cgWJMbF8JI
6,1438826646396710913,1525615021476171776,2022-05-14,Alegria em servir em missões. em Igreja Batista Jd. Maria Virginia https://t.co/zo1wLgYJ3C
7,1438826646396710913,1525610170809692160,2022-05-14,#mutirãodeemprego em #missõesurbanas na @igrejabatista.mv em Igreja Batista Jd. Maria Virginia https://t.co/yJPeTMmB6f
8,1438826646396710913,1525608647971295235,2022-05-14,"Hoje foi realizado #mutirãodeemprego na @igrejabatista.mv e estas fotos são do controle de acesso, oração @feroldirenato , palestras @jornalista_francesco_zavaglia e a palavra cantada pelo @mariounico https://t.co/jqJoNGQi8c"
9,130992691,1525598330805428227,2022-05-14,"Hum, 35? 🤣🤣🤣🤣🤣🤣 em Florada Ypè https://t.co/8P1mPALc0S"
10,747577257795985409,1525569284008775681,2022-05-14,alçapão Diferenciado Mobiliado e só entrar e Morar 9-7643-7370 Luis Abbade  2383 em Vila Andrade Morumbi SP https://t.co/uwsoyrSb2w
11,180382150,1525519042768928768,2022-05-14,✌️ em Jardim Aurélio https://t.co/u0lnX2dxNl
12,180382150,1525505079536758784,2022-05-14,Meu parceiro 💙 em Jardim Aurélio https://t.co/YazavAqVTp
13,747577257795985409,1525502801685753857,2022-05-14,Acabou de publicar uma foto em Vila Andrade Morumbi SP https://t.co/36CzIqOtn1
14,119941305,1525495585826127872,2022-05-14,Excelente fin de semana..🥰❤️ en Feliz Sábado https://t.co/1jR3cshYvm
15,162937441,1525484448107708416,2022-05-14,"Vem um filme na cabeça! 😔 (@ Drogasil in EMBU DAS ARTES, SP) https://t.co/37maS6hHGR"
16,2503077872,1525433181264039938,2022-05-14,Nino meu brother https://t.co/kr1lm8acYt
17,821412926410067968,1525245323890794500,2022-05-13,"@LMSimoes_ O susto foi muito grande eu poderia ser mais uma na estatística de latrocínio.Nem estou trabalhando, eu só tenho rendimentos se eu trabalhar, porém não condição nenhuma de trabalhar…Gratidão vida!!!Até 🤗🧘🏼‍♂️✌️"
18,821412926410067968,1525243732622200833,2022-05-13,"@LMSimoes_ Boa noite @LMSimoes_ não estou bem com pânico  tomando remédios controlados. A imagem do assaltante não me sai da cabeça.Já comprei o iPhone, o carro está em ordem porém o estrago maior foi na minha saúde mental.Estou a base de remédios.Como já tive depressão e fobias cai de vez."
19,43096142,1525208092509716482,2022-05-13,Amanhã Mutirão de Emprego @missaosemearnoconcreto no Campo Limpo - ZS de São Paulo na @igrejabatista.mv e os candidatos serão abrilhantados com palestras do @jornalista_francesco_zavaglia https://t.co/U7vtEjug0G
20,368476427,1525199698553778176,2022-05-13,Acabou de publicar uma foto em Mirari CAMPO LIMPO https://t.co/rvvwc3Yms6
21,2503077872,1525174778008592385,2022-05-13,"@cynaramenezes Cara, na moral, os canais Lulista/Petistas e outras fontes de informação/mídia que eu acompanho não dizem nada sobre o Lula não participar de debates então isso me cheira a jogo sujo..."
22,3332884438,1525128006062297088,2022-05-13,"#LuLLaDay Molusco 🦑 ladrão, seu lugar é na Prisão!! #fechadocombolsonaro em House of Mother Joanne https://t.co/W8vXnnsC5J"
23,127557268,1525110787127353344,2022-05-13,Viva a Virgem do Rosário de Fátima! https://t.co/HWDUYVnpt7
24,705431315,1525071014111191040,2022-05-13,Acabou de publicar uma foto em Jardim Martinica https://t.co/7Q4TyGWFG8
25,58612085,1525059332324335616,2022-05-13,"🔰G16 universidade do tiro e caça✅
@sargentolago @rb_fort @psp73oficial @ritabatista @jivaldo.santos_locutor @g16u.t.c @sinpoljud @szdudaaneiva @cufaembuguacu 
.
.
.
.
.
#canalkleberneiva #radiockn https://t.co/fdiRrOFpnZ"
26,1449752296930349060,1525049523793534976,2022-05-13,"5/5.
Devagar sem pressa, aos poucos voltando a disciplina.👊🏾🔥 https://t.co/zzkh54xVdk"
27,40125120,1524841942575632390,2022-05-12,"Silvio Santos
Est do Campo Limpo/SP
By CEPEDA Francisco/Press Brazil em Estrada do Campo Limpo, 5525 https://t.co/vFZj28m0eX"
28,2503077872,1524823293911519238,2022-05-12,🌿👀🌿 https://t.co/kYK0bXPuzY
29,40125120,1524796258853994497,2022-05-12,"Silvio Santos
Est do Campo Limpo/SP
By CEPEDA Francisco/Press Brazil em Estrada do Campo Limpo, 5525 https://t.co/tJPNGNbaiU"
30,40125120,1524783195429842944,2022-05-12,"Silvio Santos
Est do Campo Limpo/SP
By CEPEDA Francisco/Press Brazil em Estrada do Campo Limpo, 5525 https://t.co/aVpL8I8WnW"
31,180858857,1524781481272389632,2022-05-12,Acabou de publicar uma foto em AABB São Paulo https://t.co/0D64MgoPmm
32,40125120,1524772771909320708,2022-05-12,"Silvio Santos
Est do Campo Limpo/SP
By CEPEDA Francisco em Estrada do Campo Limpo, 5525 https://t.co/moXWibUhfH"
33,143107875,1524664234201825281,2022-05-12,Você se lembra de quando ingressou no Twitter? Eu me lembro! #MeuAniversárioNoTwitter https://t.co/7t5vhtq8vi
34,108995920,1524522586423672834,2022-05-11,Acabou de publicar uma foto em Igreja Batista Moriá https://t.co/QlRz5kZBpc
35,1477440766460977156,1524474240715661314,2022-05-11,"Olha cor do paninho que eu usei pra limpar o equipamento  antes de eu usar. Deus me free, ser pobre e feio ok mas tem que ser limpinho gente. https://t.co/XjcVnUONte"
36,760242512,1524467487684845572,2022-05-11,"Sem pretensão de ser o Hit do Monento ! 

É só papo de música 🎵🎶🎸 em Campo limpo Z/S https://t.co/5HPP6y4qTE"
37,1477440766460977156,1524464884951494664,2022-05-11,Era pra ser 10km mas 7km tá bom por hoje https://t.co/NY5k0IWKAR
38,1477440766460977156,1524460250686005250,2022-05-11,Puta que pariuuuu. Vim treinar na unidade do shopping Taboão e quanta gente feia. SP MARKET  nunca critiquei.
39,1438826646396710913,1524357751987707912,2022-05-11,Presença confirmada do @jornalista_francesco_zavaglia no #mutirãodeemprego neste próximo sábado na @igrejabatista.mv ; então chegue no horário para garantir a sua senha. em Igreja Batista Jd. Maria Virginia https://t.co/QAqKMkYUqz
40,142325755,1524330242625650689,2022-05-11,"I'm at Padaria Nova Juliana in São Paulo, SP https://t.co/jTMxLXHYwz"
41,747577257795985409,1524106918054268929,2022-05-10,"Moreno Que é A
Seu Prestação baixinhas igual a um aluguel me chama watts app 9 7643 7370 Luis Abbade em Vila Das Belezas Santo Amaro Sp https://t.co/VFDcB4LHZz"
42,747577257795985409,1524106237067022338,2022-05-10,"Apartamento a Venda Vila das Belezas ,Venha Morar No Seu Futuro Lar 9-7643-7370 Luis Abbade em Vila Das Belezas Santo Amaro Sp https://t.co/ctbNLnPB0F"
43,586314589,1524073098269675520,2022-05-10,"Saíram as fotos do último #Alternation que rolou em abril!!!

Fiquem ligados que sábado agora dia 14/05 tem mais hein!!!
@santabreja nos aguarde!!!

#SantaBreja #underground #zonasulsp #zonasul #capaoredondo #dj #fest https://t.co/ty9dFc0O9S"
