,author_id,tweet_id,created_at,text
0,389043807,1531943051509190656,2022-06-01,Acabou de publicar uma foto em Aura Terapias Naturais https://t.co/4mrfzKhcVQ
1,182387684,1531936819289509888,2022-06-01,Acabou de publicar uma foto em Pintar e Bordar https://t.co/mXCa5ANO61
2,58921547,1531860303662788609,2022-06-01,"Porpetas e copa do BR, e RBR fora que julgo bom ainda pro #AvantiPalestrinas 

É isso! Seguimos! Que doce é a liberdade! https://t.co/KE8IaPgD2o"
3,254050963,1531826977958764547,2022-06-01,Acabou de publicar uma foto em Teatro Vivo https://t.co/SiTlwmUnA8
4,76746144,1531813289126027264,2022-06-01,B  E  Y  O  N  D  • Van Gogh • em Beyond Van Gogh Brasil https://t.co/bE41udOtQF
5,49883959,1531810069138100224,2022-06-01,"Acabamos de ver Léo Dias entrando no Hotel Transamerica da Berrini em São Paulo… e tb vimos cantor Doble You - William 
Estamos no restaurante indiano!
Dessa vez eu quem entreguei tuuudo https://t.co/WvSUFhAvFd"
6,304730976,1531801440204767233,2022-06-01,"Quarta Rock, sportes Rock copa do Brasil para curtir tempo feio depois do temporal punk ontem. boas noites Rock friends and Rockers em Brooklin São Paulo Z.sul https://t.co/YwiYoCp1Xp"
7,111948040,1531797347553923072,2022-06-01,Just posted a photo @ Shopping Ibirapuera https://t.co/FF7GJTZhGh
8,111948040,1531794767100760066,2022-06-01,Just posted a photo @ Shopping Ibirapuera https://t.co/G7V5yxbXBF
9,1347077785,1531793500617981952,2022-06-01,"@RickSouza @_reinaIdo Rick, quanto tava dando a Gnews?"
10,1347077785,1531791822892285952,2022-06-01,Saudades ouvir a trilha sonora de encerramento todo dia às 22h30 da noite https://t.co/w2ZUl2u2gl
11,60743669,1531784010963243008,2022-05-31,"Acabou de publicar uma foto em Moema, SP https://t.co/MwYO3Lp7um"
12,15244021,1531779859822874628,2022-05-31,"O dia todo com ele! Como é bom estar com você, @PauloVieiraReal! Tô nem aí pra foto tremida! https://t.co/h9xQRZ6G2M"
13,1347077785,1531749649651990528,2022-05-31,@ICepollina Por isso odeio!!!!
14,82468496,1531749443686604812,2022-05-31,Acabou de publicar uma foto em Sheraton São Paulo WTC Hotel https://t.co/MSZFJcVSIF
15,1205428300568506368,1531745034546159621,2022-05-31,"Clínica Campo Belo 
OTORRINO- PEDIATRIA-ACUPUNTURA
Av. Vereador José Diniz, 3300, conj 201.
Atendemos convênios.
Entre em contato conosco:
(011) 94243-2619, (011) 5543-8457,(011) 5044-3201. https://t.co/cm7TTEK0fo"
16,1347077785,1531744341156306948,2022-05-31,#BolsonaroVagabundo https://t.co/4b8z6i354k
17,1511117622,1531740264074620928,2022-05-31,Van Gogh I @ Beyond Van Gogh https://t.co/t23F3Ud2Q3
18,1347077785,1531733781614297093,2022-05-31,Ficar em casa = sair da dieta
19,1347077785,1531733694611955712,2022-05-31,"Ainda dá tempo de voltar pro nome antigo!!! E outra, o que tem a ver bbb com fatiamento da novela? NADA https://t.co/QeF0o4VJNW"
20,1205428300568506368,1531732141918371842,2022-05-31,"Clínica especializada
Agende um check up em #otorrinolaringologia #drjoaomarcospiva  #clinicacampobelo #rinite #sinusite #gripe #faringite #otite #inverno https://t.co/sz1eORbTzm"
21,18066816,1531728903114575876,2022-05-31,Acabou de publicar um vídeo em https://t.co/0FW43GkbL9.Lab https://t.co/jvdj9E829n
22,1347077785,1531716033391755266,2022-05-31,Imagina se ela vai ao Rio!!!! 🙏🙏🙏 https://t.co/bMue0ysQr8
23,188727812,1531713801334280193,2022-05-31,69a Asamblea Anual #FLAM ⁦@presidenciaflam⁩ ⁦@magistradosuy⁩ https://t.co/fmXpqsyAUm
24,1526332829419831297,1531705797893410817,2022-05-31,💽 https://t.co/cA1s10fFK1
25,106590007,1531699438288359426,2022-05-31,Acabou de publicar uma foto em Bless Optical https://t.co/O5xKWQORsm
26,333760963,1531681898501652485,2022-05-31,CGH-&gt;SSA https://t.co/EnuzmWpFAS
27,1347077785,1531675845319852034,2022-05-31,SUPER A FAVOR de um Estudio i B no gnt!!!!!!!!!! #Estudioi
28,1347077785,1531661767427899393,2022-05-31,"Só lembrando que os casos de Covid estão aumentando ainda há MUITOS jovens na onda do “aiinnnn, sou saudável, to ótimo com 2 doses, não preciso de 3.” https://t.co/hvPZRduuw8"
29,3383629216,1531649095470833664,2022-05-31,"Será que estamos realmente vivendo de modo consciente a nossa identidade cristã e o propósito para o qual fomos chamados neste mundo onde Deus está trabalhando e nos convocando a trabalhar com Ele?

Pense seriamente! https://t.co/Buz3FZE5Wi"
30,181007933,1531645460380794880,2022-05-31,📸 #model #modeling @ Today Models BR https://t.co/aWoGHu0RfK
31,1458452998255005699,1531643422024540161,2022-05-31,"Postei uma foto de um vibrad8r porque vou fotografar os itens de um sex shop essa semana e teve uma galera espantada!!!
Enfim a hipocrisia.
Hahahahaha."
32,82468496,1531639906501595136,2022-05-31,Acabou de publicar uma foto em Estação Berrini -Linha 9 Esmeralda - CPTM https://t.co/vdzeyO5OZW
33,497159118,1531635267257475072,2022-05-31,Acabou de publicar uma foto em Clinique Eternité https://t.co/3wBaJBQtrW
34,106590007,1531627707582267392,2022-05-31,Acabou de publicar uma foto em Bless Optical https://t.co/SuQWMUanK4
35,96876429,1531602997846876162,2022-05-31,A vida dos Berriners 😏 https://t.co/EJzObaJvQL
36,2879809951,1531598410666614784,2022-05-31,E lá vou eu RIU DI XANEIRU https://t.co/KrrQSVg66u
37,857403643124998145,1531594644299079680,2022-05-31,"Comprei pão de queijo um café , e uma coca cola de lata 45,00 reais kkkkkkkkk mano tu não tem escolha"
38,1007930785,1531592912265482240,2022-05-31,"I'm at Aeroporto de São Paulo / Congonhas in São Paulo, SP https://t.co/35BTlQCLpt"
39,3354920057,1531592393732104192,2022-05-31,"O @InfinityAsset #DailyDrops, informação na velocidade do mercado financeiro - 31/05/2022 com @JasonVieira https://t.co/rgTaAUccZr"
40,81813407,1531584448596017154,2022-05-31,Acabou de publicar uma foto em Zazou Moda Gestante https://t.co/0IrFxe0cpC
41,1254791832,1531579076267454464,2022-05-31,Ontem foi dia de voltar a segunda casa... https://t.co/3cKYWniXhQ
42,1410706253563768833,1531518836725391360,2022-05-31,❄️🫧 https://t.co/DoQF6dQ5VR
43,66653237,1531499057696448513,2022-05-31,Just posted a photo @ Condomínio Edifício Roque Petroni 850 https://t.co/xElhczFqSm
44,889617957286027265,1531490773522333697,2022-05-31,❤❤ https://t.co/FDYmMhoSJO
45,28273980,1531488727868002305,2022-05-31,Acabou de publicar uma foto em Villa Glam https://t.co/dMkgqfzZTg
46,1347077785,1531453624945082369,2022-05-31,"@chicobarney Nossa não, melhor reinstituir oficialmente a novela das 23h com esse nome (NADA da babaquice de ‘superserie’) e voltar com produções invernais de meio de ano, como foram os remakes de 2011 a 2014"
47,324175715,1531451098338295808,2022-05-31,"Noite de segunda-feira acompanhando o moleque de ouro @PaulinhoPH7 no programa Bem, Amigos! https://t.co/kb1ZKFtjJT"
48,1347077785,1531449073961771010,2022-05-31,"@brunobbragac Problema não é esperar até dia 02/10, é o que o presidente pode e tentará fazer contra o país, as instituições e a democracia entre outubro e 01/01/23 caso ele perca"
49,16844419,1531447489143914496,2022-05-31,vou publicar em todas as minhas redes a fotona que eu tirei hoje com o patrão ♥️😍 #paz #Disney https://t.co/h8yjflCQKJ
50,40810733,1531438304918482944,2022-05-31,Vai gripado mesmo 🏋🏻‍♂️ https://t.co/dNqs4Gb9cn
51,81813407,1531433845781934084,2022-05-31,Acabou de publicar uma foto em Zazou Moda Gestante https://t.co/DUa7XF0Mwj
52,1241245173792886785,1531425482457096193,2022-05-31,chá de cadeira pela @azulinhasaereas
53,1084600726624583686,1531425380833402880,2022-05-31,"Acabou de publicar uma foto em Aeroporto De Congonhas, São Paulo - SP https://t.co/v4rAOJhFUx"
54,1347077785,1531415940096790530,2022-05-30,Não que novela das 19h precise de nexo….mas não sei se me prende não
55,1347077785,1531415796097994753,2022-05-30,To realmente achando a história de #CaraeCoragem totalmente sem pé nem cabeça
56,106590007,1531411725353992193,2022-05-30,#blessotical #blessoptical_brasil #blessoptical_brazil #bottega #independent #independenteyewear #conceito #independente #worldbrands #atelier #fattoamano #tecnologia #design em Bless Optical https://t.co/p4wf5SuaGL
57,44436075,1531408905594609664,2022-05-30,Acabou de publicar uma foto em Meet &amp; Eat https://t.co/h6y87RaVMN
58,721354011333521408,1531378544462467072,2022-05-30,https://t.co/6k79EPRqg5
59,1347077785,1531377358950866948,2022-05-30,@Rodrigo_Caruso 🙏🙏🙏😍😍😍😍
60,228978642,1531373848884658176,2022-05-30,Continuando com a sequência artística hahah 🖼🌀💙 em Exposição Van Gogh https://t.co/GnHO371iWF
61,44053466,1531366430276321280,2022-05-30,Acabou de publicar um vídeo em Beach 4 Fun https://t.co/aj6pc0DjxL
62,318056797,1531365851462619139,2022-05-30,I'm at Hardyfloor pisos e revestimentos a base de resinas 11 2364 8172 in São Paulo https://t.co/W1iTAym1nW https://t.co/AWdrYqBavh
63,57017730,1531357764462723072,2022-05-30,Job para Latam no espaço Gexperience hoje com teleprompter em mais uma parceria @carlosvicentefotoevideo e @wfernandeseventos em gexperience https://t.co/58Qgvz695t
64,829151811592474625,1531357589350584320,2022-05-30,"Você é a melhor esposa que eu poderia ter e espero conseguir retribuir todos os dias a felicidade que você me traz meu amor! Deus é maravilhoso! Te amo eternamente! em Aeroporto De Congonhas, São Paulo - SP https://t.co/RLWmMGV9cL"
65,494143650,1531356298868150272,2022-05-30,"Paz queridos hoje e amanhã na cidade #penha #santacatarina .

Orem por mim preciso de renovo rsrs . em Aeroporto De Congonhas, São Paulo - SP https://t.co/i8RE0x8gyT"
66,407723267,1531355189512388611,2022-05-30,"São Paulo, amanhã retorno pro frio que está se formando,  Até logo. em Aeroporto De Congonhas, São Paulo - SP https://t.co/orvZvl02Nu"
67,1403919346548809729,1531353746940346368,2022-05-30,tou mto mal
68,106590007,1531348298308673541,2022-05-30,Acabou de publicar uma foto em Bless Optical https://t.co/f6iJfjKkH6
69,3324267797,1531344024627466243,2022-05-30,🍃#desenho em Shopping Cidade Jardim https://t.co/NOFpFnjsr2
70,1313076252748722176,1531343566022266884,2022-05-30,Hj acordei com muito tesão omg🙈 🥵🥵🥵🥵 https://t.co/RqRWYku20l
71,1269813173135212549,1531340898314878982,2022-05-30,Nunca achei q me tornaria a pessoa q toma café sem açúcar
72,1067836967373758464,1531327426701189124,2022-05-30,onde vivem as peruas paulisters https://t.co/zTW9lfEyua
73,1347077785,1531317255895756801,2022-05-30,"Queremos @NatuzaNery PRESENCIALMENTE na Rua Von Martius, 22 nessa sexta!!! @GloboNews @Rodrigo_Caruso @beltraomaria https://t.co/OeY4IiV3n2"
74,395325346,1531316947866066947,2022-05-30,Meu cantinho preferido na hora do almoço longe dos prédios e gente andando de patinete com salto e bolsa gucci. https://t.co/oe33z5UFR9
75,1347077785,1531316902504673280,2022-05-30,@Noveleii Torcendo pra não ser uma Salve Jorge. Confesso que estou com medo por ser a retomada de uma novela dividida entre Brasil e outro país 🙏🙏🙏🙏🙏🙏
76,30404697,1531315201605128193,2022-05-30,Acabou de publicar uma foto em Campo Belo (district of São Paulo) https://t.co/QNuy7rHxIH
77,42722635,1531313149751840770,2022-05-30,"I'm at Eduardo's Restaurante in São Paulo, SP https://t.co/D5oCOa7HSH"
78,85777200,1531311831020470273,2022-05-30,"“Não tenho certeza de nada, mas a visão das estrelas me faz sonhar”. ✨💫

Vincent van Gogh

#beyondvangogh #vangogh #stars #blue #art #paints #sp #saopaulo #photooftheday #instagood #love #loveislove #exposition https://t.co/8Md80X85wa"
79,497159118,1531300197531373571,2022-05-30,Acabou de publicar uma foto em Clinique Eternité https://t.co/IZcDrOxMwm
80,3991671015,1531298308144173056,2022-05-30,Just posted a photo @ Itaim Bibi https://t.co/ykjJ6rYNF5
81,2405282319,1531293242221858817,2022-05-30,"Esse é o privilégio de trabalhar externamente, as vezes nos deparamos com vistas assim...🙌🏼🙏🏻❤️ Obrigado Deus por mais um dia! Que nosso Senhor Jesus Cristo abençoe a todos! Ótima semana!😎🚛 https://t.co/Vx7fqN58p5"
82,218114717,1531282142512271365,2022-05-30,Acabou de publicar uma foto em Quinta da Garrafeira https://t.co/BLYOZY2Egs
83,84912815,1531278827539902464,2022-05-30,Acabou de publicar uma foto em Bourbon Street Music Club https://t.co/qKszDAesFm
84,1529894649023934484,1531269660527804417,2022-05-30,https://t.co/Ns8itJMKmT
85,1918511930,1531248797707272195,2022-05-30,☕️
86,81813407,1531230509627494401,2022-05-30,Acabou de publicar uma foto em Zazou Moda Gestante https://t.co/UNNsBmehlI
87,3354920057,1531227793010352128,2022-05-30,"O @InfinityAsset #DailyDrops, informação na velocidade do mercado financeiro - 30/05/2022 com @JasonVieira https://t.co/JZosMHy7YE"
88,35620080,1531125418576728071,2022-05-30,Acabou de publicar uma foto em RM's H https://t.co/frDfvKAM1P
89,35620080,1531121943373651969,2022-05-30,"💝® Foto dia 10/12/2015 5f 3.8 🎯 BS JR 29/05/2016 domingo ®😉🙌🙏🏻👏🏻❤️😍🔝🎼🎧🎤📳🇧🇷♎️💎💙🌟😘 
30/05/2022 2f 44 quase 7a #remacedo #remacedo38 #remacedo44 #remacedo77 #remacedo2022 em RM's H https://t.co/K7LKPhHAPP"
90,1159065444319469568,1531100993781387264,2022-05-30,Acabou de publicar uma foto em BROCK BAR https://t.co/HFy8MMLJpX
91,91022159,1531096077209948161,2022-05-30,40 anos do @morumbishopping com a @biapultrini . 🥳💗 em Morumbi Shopping https://t.co/A2D8FhdsAJ
92,1041120710129676289,1531095844107214848,2022-05-30,"Prêmio Empresa Brasileira do Ano, BRAZIL QUALITY SUMMIT 2022.

#ConstrutoraEstilos 
#GalpãoPréFabricados 
#EngenhariaeGerenciamento 
#JuntosPorUmBrasilMelhor🇧🇷 em World Trade Center São Paulo https://t.co/k5AvD6cmp5"
93,1041120710129676289,1531093400157552641,2022-05-30,"Prêmio Empresa Brasileira do Ano, BRAZIL QUALITY SUMMIT 2022 em World Trade Center São Paulo https://t.co/bgRHH8vbKM"
94,71877526,1531087090074763264,2022-05-30,"Vamos Desejar o Bem, que esta semana seja cheia de Prosperidade e de Vitórias!!! Que assim seja Graças a Deus 🙌🏻🙌🏻🙌🏻 em Studios Laercio Da Costa https://t.co/mgC0BYx26e"
95,98392613,1531075276372852737,2022-05-30,Até Einstein já dizia: E = mc² (Energia = muito chocolate ao quadrado)😆🤭🍫🤎 #kitkat #createyourbreak #chocólatras #chocolovers #shoppingmorumbi #amomuitotudoisso #férias #domingou #maio #2022 https://t.co/mQTtT0EhyU
96,304730976,1531062913833832449,2022-05-30,Gallo Metal Rock sportes tudo a ver em Brooklin São Paulo Z.sul https://t.co/4uUkqtlqiB
97,76103370,1531055882011922432,2022-05-29,Acabou de publicar uma foto em Bourbon Street Music Club https://t.co/ETmfNlAkyu
98,76103370,1531055151858999296,2022-05-29,Acabou de publicar uma foto em Bourbon Street Music Club https://t.co/owhn9nBftJ
99,114816276,1531037792553291777,2022-05-29,🎨🖼👨🏼‍🎨 em Beyond Van Gogh Brasil https://t.co/pJLp28El58
100,24683934,1531029305173614597,2022-05-29,Acabou de publicar uma foto em Aielo Motors https://t.co/VKNkgx2r6p
101,318056797,1531009597577875460,2022-05-29,"I'm at Flash Car in São Paulo, SP https://t.co/lMriF9osPM https://t.co/xBkaClaHPb"
102,200896366,1531005772695580672,2022-05-29,Um evento pra ficar na história… um final de semana surpreendente! #evento #maxlove #lancamentos em Shopping Cidade Jardim https://t.co/P2MfAskekk
103,1521509225406607363,1530996088534089728,2022-05-29,"🍊 Orange em Ibirapuera, São paulo https://t.co/Ekqi8brrnq"
104,19760192,1530985510235254787,2022-05-29,"A5 Wagyu Japonês, Chu-toro e Vieiras com Foie Gras. https://t.co/tDiqF4iUUv"
105,1347077785,1530979470781431809,2022-05-29,"Velho picareta da empresa onde eu trabalhava, declarou um valor errado à Receita que em 1º lugar nem deveria ser declarado"
106,19383548,1530978756847869953,2022-05-29,"Bolo de frutas vermelhas 
#foodbullying @ Café Des Fleurs https://t.co/9si7sB5BLs"
107,19383548,1530972279395569664,2022-05-29,"Fish tacos 
#foodbullying @ Taco Bar e Cozinha Mexicana https://t.co/rNUfu7sxaU"
108,177423719,1530971519525871616,2022-05-29,"Sabia que temos uma linha exclusiva na nossa loja assinada pelo Atelier Sandra Magalhães? 

Encomende a sua diretamente em nossa loja física ou pelo WhatsApp 😻❤️

✨
✨
✨
#lookdodia #lookparaaulas #aulas #figurinos https://t.co/B2IJc73UKO"
109,161406010,1530967048402223105,2022-05-29,I'm at @TeatroSantander in São Paulo https://t.co/OQw1u6EhO9
110,3333176632,1530966001810030592,2022-05-29,Acabou de publicar uma foto em Teatro Claro SP https://t.co/u9n9wnH5aq
111,1347077785,1530965215722016769,2022-05-29,"Se estamos realmente com uma nova onda, que bom que já peguei agora, já me livro disso"
112,19383548,1530963796625342465,2022-05-29,"Ultimate Nachos 
#foodbullying @ Taco Bar e Cozinha Mexicana https://t.co/mPkT3aFrYi"
113,1319773515990564865,1530963720565936128,2022-05-29,Nos vemos hoje na Ópera de Arame. Ansiosa! @KamasiW xxx
114,191577392,1530948495472852992,2022-05-29,LCL Impo Craft ❤😊😍 em Outback Shopping Market Place https://t.co/wfXanZq8kl
115,106129983,1530938778629586945,2022-05-29,🌙 https://t.co/I3A1n1KIto
116,937049228404314112,1530937507273232384,2022-05-29,"Acabou de publicar uma foto em Aeroporto De Congonhas, São Paulo - SP https://t.co/1LTyjiwIVN"
117,81813407,1530935966638018560,2022-05-29,Acabou de publicar uma foto em Villa Glam https://t.co/n19UikvdAF
118,318056797,1530929108422623234,2022-05-29,"I'm at Paróquia Sagrado Coração de Jesus in São Paulo, SP https://t.co/6TqgVUYsQu https://t.co/Z44H1kdmV8"
119,318056797,1530926771935367168,2022-05-29,I'm at Hardyfloor pisos e revestimentos a base de resinas 11 2364 8172 in São Paulo https://t.co/1ZtAaq1NOx https://t.co/nrYjorZlFx
120,318056797,1530924767766884352,2022-05-29,"I'm at Pão de Açúcar - @paodeacucar in São Paulo, SP https://t.co/a4m39S94Kr https://t.co/XzWjdAL97D"
121,318056797,1530912463469924352,2022-05-29,"I'm at Companhia Athletica in São Paulo, SP https://t.co/TkPqNoHeLh https://t.co/NOZPrtdXtc"
122,76103370,1530907436076482562,2022-05-29,Acabou de publicar uma foto em Bourbon Street Music Club https://t.co/awLeV2F32M
123,69343364,1530893336113995778,2022-05-29,Acabou de publicar uma foto em Tv Globo https://t.co/m7feMh3ITD
124,18202406,1530878522499137537,2022-05-29,Um luxo fazer o primeiro café da manhã fora de casa depois da pandemia https://t.co/L1B3ksY3Z9
125,75058368,1530861789587578886,2022-05-29,"Haja inseticida… em Aeroporto De Congonhas, São Paulo - SP https://t.co/Cq6E6zgs97"
126,81813407,1530854063314817026,2022-05-29,Acabou de publicar uma foto em Villa Glam https://t.co/AyAHBqgT8I
127,131378013,1530852782575693824,2022-05-29,#TheExorcist https://t.co/SbtJfL4V9O
128,177423719,1530787936215638016,2022-05-29,"Desfile do @atelier_sandra_magalhaes 
 realizado no Mercado Persa 2022

Nossa Cia fez o encerramento do desfile juntamente com a nossa Diretora Artística Dana Farida ✨

Foi um momento muito lindo e emocionante 🤍 https://t.co/qwTosyPVBi"
129,591961954,1530753400798846976,2022-05-29,Baladinha 💙👏🏼🎈 #ale42 #sp em Limelight https://t.co/Ryp0NbL4UD
130,937049228404314112,1530751769852223490,2022-05-29,"Acabou de publicar uma foto em Aeroporto De Congonhas, São Paulo - SP https://t.co/PGSvET5KUn"
131,1427450113862078465,1530732124394950656,2022-05-29,"Role bom é aquele que você não esperando 
#coquetel #festa #inesperado https://t.co/gv7iqOY614 https://t.co/akTAcO6OqB"
132,335755549,1530704469469667328,2022-05-29,"Um brinde para todos os lugares que visitamos! E para todos os lugares que nós vamos visitar! E um brinde para mim, sussurrando em seu ouvido de novo e de novo: EU TE AMO! #8years https://t.co/1XHgEffSCT"
133,164776701,1530698015459135489,2022-05-28,"I'm at Eu, Tu, Eles in São Paulo https://t.co/9FAUcmg2pr https://t.co/SDLIddnev5"
134,111948040,1530675110625034242,2022-05-28,"Camisetas Volcom Deadly Stone. Modelagem Regular, estampa em silk frontal, assinatura Volcom na manga e viés contrastante. #americanino 
#volcom #volcombrasil #volcomoriginal
#shoppingibirapuera @ Shopping Ibirapuera https://t.co/oKOaH6CTcU"
135,11334252,1530673997733584897,2022-05-28,"I'm at Tower Bridge Corporate in São Paulo, SP w/ @tomtonirocha https://t.co/joqc2k5KdS https://t.co/TK7otceh5I"
136,111948040,1530659765193302017,2022-05-28,Just posted a photo @ Shopping Ibirapuera https://t.co/dJ8OYHiPpL
137,151978321,1530655195490926597,2022-05-28,🌿🍃🧗 em Parque Bruno Covas Novo Rio Pinheiros https://t.co/VR7Vtv3K85
138,97689547,1530652638773137410,2022-05-28,Drinking a Pilsen by Cervejaria BR-88 @ Brooklyn Paulista — https://t.co/ZL0pUBwkKG
139,2585001029,1530649205752094722,2022-05-28,"Que felicidade em encontrar de surpresa e no meio da correria de uma conexão em Congonhas o futuro Presidente @cirogomes! Uma honra apertar sua mão, Cirão! ✊🏻🌹

#PrefiroCiro #TurmaBoa #PND https://t.co/dLxzKHZdl0"
140,318056797,1530647625879388161,2022-05-28,"I'm at Padaria Colonial in São Paulo, SP https://t.co/AVcC1TlaiR https://t.co/qJvCgNEF8F"
141,73493771,1530637735354064898,2022-05-28,I'm at Fórmula Pet in São Paulo https://t.co/lj4x3leMCS
142,388030398,1530625868200128513,2022-05-28,Hoje é dia de assistir o Musical CINDERELLA no Teatro Claro em SP https://t.co/IydqQWP4kM
143,111948040,1530623119693684737,2022-05-28,"Modelagem Regular, estampa em silk frontal, assinatura Volcom na manga e viés contrastante. 
Confeccionada em meia malha 30/1
#volcom #volcombrasil #americanino 
#volcomoriginal #shoppingibirapuera @ Shopping Ibirapuera https://t.co/0v5M5ru0mW"
144,1347077785,1530616866875576320,2022-05-28,= Brasil https://t.co/rjLImv7zQQ
145,1347077785,1530610176755122178,2022-05-28,"@Vinetando E pegou entradas pro #JH com os repórteres devolvendo pro Alan Severiano, que estava à frente do #JH hoje, enquanto a Mari Queiroz só ignorava e chamava o próximo link ao vivo que também não estava falando diretamente com ela"
146,757928493711761412,1530598724723949569,2022-05-28,🚲 em Parque Bruno Covas Novo Rio Pinheiros https://t.co/wMQStOUSYS
147,8774132,1530594108007501827,2022-05-28,Comemorando o Dia Mundial do Hambúrguer @SevenKingsBgr https://t.co/evhaXTWd4m
148,249798348,1530593233910341635,2022-05-28,Acabou de publicar uma foto em Hangar82 Tattoo E Barbearia https://t.co/LMZXyypOr1
149,26484337,1530587465509179394,2022-05-28,Drinking a Witbier by Cervejaria Dádiva @ Praça São Lourenço — https://t.co/R49FI272Gd
150,1266512796797284352,1530585827260129280,2022-05-28,Comemorando meus 23 anos da melhor forma 💙 https://t.co/z6AyRbMUIG
151,964916587936534530,1530582709591896064,2022-05-28,Acabou de publicar uma foto em Cacau Show Mega Store https://t.co/sMjHgb6Qij
152,238682030,1530579193117003779,2022-05-28,"Prestigiando nossos atletas do @cearasc. Bate papo muito agradável. Que Deus sempre abençoe vcs, conte sempre com a @madeira_sports. #madeirasportssemfronteiras⚽🌍🔝🔝🙏🙏👏👏 https://t.co/bEoQ1rvXfT"
153,2935479502,1530572389448355841,2022-05-28,Acabou de publicar uma foto em Bourbon Street Music Club https://t.co/uJVI1zVnoy
154,261366155,1530571554249183233,2022-05-28,Acabou de publicar uma foto em Instituto da Cerveja Brasil https://t.co/5pHZa9P1BN
155,106590007,1530569156353040385,2022-05-28,#deolho #olhovivo #olhando #olha #olhar #olho #eye #occhio #blessoptical #blessotical_brazil #blessoptical_brasil #todeolho #deolho #sguardo em Bless Optical https://t.co/zEBzpPSdVw
156,85777200,1530564520900300800,2022-05-28,"“Não extingua sua inspiração e sua imaginação; não se torne o escravo do seu modelo”. 🎨

Vincent van Gogh

#vangogh #colours #paints #colourful #blue #yellow #photooftheday #instagood #love #loveislove #inspiration https://t.co/uC2G0jYszW"
157,318056797,1530542817675714562,2022-05-28,I'm at Hardyfloor pisos e revestimentos a base de resinas 11 2364 8172 in São Paulo https://t.co/l2AucaQLkw https://t.co/XCBYN0QQIn
158,797572357288263680,1530537542658957315,2022-05-28,Estou no espaço infantil do lab observando o comportamento das crianças conforme a idade que elas aparentam ter
159,1085534450723811329,1530535827742261249,2022-05-28,Aff  q #horror https://t.co/3Vy1rdPmuE
160,56610486,1530525858028474369,2022-05-28,Acabou de publicar uma foto em Campos Do Jordão - A Suíça Brasileira https://t.co/hQwirB5xQs
161,56610486,1530524520569884676,2022-05-28,Acabou de publicar um vídeo em Campos Do Jordão - A Suíça Brasileira https://t.co/ZfMq9VKzhz
162,56610486,1530524239647977479,2022-05-28,Acabou de publicar um vídeo em Campos Do Jordão - A Suíça Brasileira https://t.co/guEqDRUGY3
163,1103077752914219008,1530522125836206081,2022-05-28,Uma criança fã de Harry Potter feliz por aqui 🥰 https://t.co/55sPokGCZm
164,56610486,1530521451203272704,2022-05-28,"Amo essa paisagem de Campos do Jordão, ainda mais no frio, que lugar lindo. em Campos Do Jordão - A Suíça Brasileira https://t.co/Q15F9VxDFQ"
165,56610486,1530520963883880449,2022-05-28,"FELIZ SÁBADO pra todos vcs, que Deus abençoe muito. em Campos Do Jordão - A Suíça Brasileira https://t.co/7vd7P3QCWe"
166,233383596,1530504755851689984,2022-05-28,"Acabou de publicar uma foto em Aeroporto De Congonhas, São Paulo - SP https://t.co/RRyE2AjRkG"
167,474150555,1530482694748090368,2022-05-28,Acabou de publicar uma foto em Gran Estanplaza Berrini https://t.co/UFA6AxGVNW
168,876587651121508352,1530421530236268544,2022-05-28,cabide em Bar do Meio https://t.co/hWeXWUqbUr
169,907395692733374464,1530417341691219969,2022-05-28,Aniversário do @katoi20 https://t.co/npdrvALiOV
170,304730976,1530393791764512768,2022-05-28,Madrugada Rock friends and Rockers. Curta a brevê louca vida. O tempo não para. Rock forever Rock em Brooklin São Paulo Z.sul https://t.co/C6pOA37WkZ
171,304730976,1530392449314607105,2022-05-28,Rock friends and Rockers. House Rock night sextou Rock. Sempre em Brooklin São Paulo Z.sul https://t.co/DnjE6yScsM
