,author_id,tweet_id,created_at,text
0,1514360254737358850,1547362443818590209,2022-07-13,Dia mundial do rock e eu estou como ? Light... https://t.co/dCAOP1jki3
1,3416165079,1547357993821413379,2022-07-13,https://t.co/4XLTg6HNuK
2,1259191250500059138,1547353007997714432,2022-07-13,https://t.co/cPbCN5T0Xz
3,60621293,1547351250341138432,2022-07-13,"🍽🍽 (@ Olive Garden in São Paulo, SP) https://t.co/RDiumjhPhU"
4,245413920,1547348379142955008,2022-07-13,"O corre vai ser por aqui!!!

Dale @ConfutSuda .... #padraoconfut https://t.co/Dj6Z8cFBAA"
5,1114205219578163207,1547348120186634240,2022-07-13,alimentando a mídia desse sítio online https://t.co/AAPXyeWpL7
6,60721389,1547343619362885634,2022-07-13,Pelo menos 1x por ano tem essa reunião DE PESO! em Beco da Vila Olimpia https://t.co/GYzKvRcOYy
7,3895005683,1547335159254601729,2022-07-13,"Blond com técnica de esfumado 🫶🏽

#wella #wellaprofessional #brae #braehaircare #hair #hairdresser #hairstyle #beauty #espacodrinavieira #brooklindicaeindica #brooklin #campobelo #moema #vilamariana #saopaulo https://t.co/rssatNlybd"
8,76103370,1547334931726073861,2022-07-13,Acabou de publicar uma foto em Bourbon Street Music Club https://t.co/lPU2WylhB8
9,73493771,1547334360537468928,2022-07-13,"I'm at Pão de Açúcar - @paodeacucar in São Paulo, SP https://t.co/N8LeRLMGxk"
10,76103370,1547334193184706561,2022-07-13,Acabou de publicar uma foto em Bourbon Street Music Club https://t.co/tuQoO5XUac
11,65258191,1547318766572343296,2022-07-13,"Noite incrível! 
Comemorando o aniversário dessa amiga linda e querida @palomatocci ! 
.
Vaaiii, Palomaa! Te amamos 🥰! 
.
#palomatocci #aniver #djanaserroni #meetandeat #amigos #comemoração #livesax #dj em Meet &amp; Eat https://t.co/FTOpKVKEXv"
12,1020414994356342790,1547278427451006976,2022-07-13,Acabou de publicar uma foto em Escape60 https://t.co/Z1IZcaN43e
13,1020414994356342790,1547277179083448320,2022-07-13,Acabou de publicar uma foto em Escape60 https://t.co/182MnTzYNQ
14,1338558762240585729,1547263318053847044,2022-07-13,Boa tarde! https://t.co/LVeeocM9GI
15,24693100,1547261966988738562,2022-07-13,"Já que não rolou o amor em SP, seguimos no álcool 🥲 https://t.co/iw7gBeMhla"
16,164142088,1547258456377135104,2022-07-13,"AMANHÃ (14/7) eu e meus convidados @fabiozaganin, @gibafavery e @leo.mitrulis esperamos vocês no @steelbarsp para comemorar o “Dia do Rock”. Até lá 👊🏼💥

Abs! em Steel Bar SP https://t.co/a1Md3upodn"
17,1110639793350893570,1547257416064110592,2022-07-13,O nosso work é playá em Tv Globo https://t.co/llYUBUpR0o
18,25574151,1547257066242310144,2022-07-13,"I'm at Panelinhas do Brasil in São Paulo, SP https://t.co/NwZknnJvu7"
19,25574151,1547256940882960386,2022-07-13,"I'm at Shopping Vila Olímpia in São Paulo, SP https://t.co/ltUdOYRMXM"
20,110688963,1547244774020812800,2022-07-13,"Pasteeeeel (@ Feira Livre - @sp_prefeitura in São Paulo, SP) https://t.co/ICoJ3OXl5Y"
21,14827952,1547236618989338624,2022-07-13,FELIZ DIA DO ROQUE BEBÊ KKKKKKK #diadorock em Estação Moema https://t.co/scuuXn1rCJ
22,181639791,1547234869033390080,2022-07-13,"Não importa onde eu estiver, quero estar sempre sorrindo. É assim que encaro os problemas, é assim que levo e vejo a vida. em Mexicaníssimo https://t.co/7hoDpnirW3"
23,1509234946682109959,1547232729422512134,2022-07-13,Acabou de publicar uma foto em Blacklist Rooftop https://t.co/FqUggZCYy5
24,14827952,1547232696501420038,2022-07-13,ESFRIOU NE FIA !!! #frio ❤️ em Estação Moema https://t.co/Oxq90kL6O4
25,304730976,1547197291253174272,2022-07-13,Bom dia Rock em Brooklin São Paulo Z.sul https://t.co/MavuUxQc2B
26,167204068,1547197050474962944,2022-07-13,Happy Rock Day! Com todas essas feras ai! Yeah! ✌️😎🎤🎼🔥🎸🥁 #rockday #astrosdorock #top #yeah #instagram em Dia Mundial do Rock https://t.co/2v0mZwAYtC
27,304730976,1547191753085558785,2022-07-13,Salve dia Mundial do Rock em Brooklin São Paulo Z.sul https://t.co/BiXcZVpXUI
28,304730976,1547191563910086656,2022-07-13,Bom dia Rock friends and Rockers. Salve dia mundial do Rock para vocês em Brooklin São Paulo Z.sul https://t.co/EG0lq074DO
29,3354920057,1547183340788371456,2022-07-13,"O @InfinityAsset #DailyDrops, informação na velocidade do mercado financeiro - 13/07/2022 com @JasonVieira https://t.co/IyZJgp1S5d"
30,1347077785,1547175152953311233,2022-07-13,"Mais um dia, bom dia"
31,236950871,1547165522625794049,2022-07-13,Bom dia https://t.co/SC9nj1pWug
32,826229336,1547158980354605056,2022-07-13,Acabou de publicar uma foto em Terra Dourada Integração Ambiental https://t.co/hManzvrsCV
33,40385012,1547061863946616833,2022-07-13,COM LICENÇA!!! em Dia Mundial do Rock https://t.co/qisMG4eNfl
34,200994456,1547055036836024320,2022-07-13,Acabou de publicar uma foto em Morumbi Brasil São Paulo https://t.co/X0h8esJ4aU
35,45186452,1547039719237861381,2022-07-13,Acabou de publicar uma foto em Central 1926 https://t.co/D7fOD0xKKv
36,46478331,1547028007075946502,2022-07-13,Acabou de publicar uma foto em WTC Nações Unidas https://t.co/NlDyM04GJi
37,76103370,1547020028138119168,2022-07-13,Acabou de publicar uma foto em Bourbon Street Music Club https://t.co/FAjm9nvCjU
38,76103370,1547018156744577025,2022-07-13,Acabou de publicar uma foto em Bourbon Street Music Club https://t.co/wzfbfdumIr
39,1093633080286416899,1547012981602619396,2022-07-13,"@SF_Moro É isso aí Dr. Sérgio Moro, É bom que o senhor esclareça os pontos forte do presidente, porque a midia esquerdista só metem o pau e falam mentiras, não podemos deixar o PT volta ao poder, que atrasará novamente  o Brasil e à corrupção retornará!"
40,56541510,1547008613260075009,2022-07-13,Começou a ventar! 🌪️ em Vitrinni Lounge SP https://t.co/Tf1H3hXYe2
41,495467091,1547005650978357248,2022-07-12,"Sobre voltar aos poucos a correr 

#corrida #RUN https://t.co/R0sHmK1lNo"
42,182387684,1546992000980983815,2022-07-12,"Luva sem dedos.
Pronta em dois tempos! 🥰 em Pintar e Bordar https://t.co/6NTS3KYSfV"
43,76103370,1546991585329569793,2022-07-12,Acabou de publicar uma foto em Bourbon Street Music Club https://t.co/7IfDFrYMe6
44,76103370,1546990625714733056,2022-07-12,Acabou de publicar uma foto em Bourbon Street Music Club https://t.co/zSI2bkGIWt
45,76103370,1546989666435579905,2022-07-12,Acabou de publicar uma foto em Bourbon Street Music Club https://t.co/U0ecxDHWvW
46,60621293,1546987656214716417,2022-07-12,"🍽🍷🥩 (at @SalGastronomia in São Paulo, SP) https://t.co/zl50UvVrwf"
47,1691766446,1546973586048565251,2022-07-12,Acabou de publicar uma foto em AX4B https://t.co/X799DAe469
48,76103370,1546966866404544512,2022-07-12,Acabou de publicar uma foto em Bourbon Street Music Club https://t.co/CKXRY3lRyQ
49,76103370,1546964615136935936,2022-07-12,Acabou de publicar uma foto em Bourbon Street Music Club https://t.co/pfX3hjxJQT
50,1166901040589025282,1546958186661511168,2022-07-12,Mode executiva ✅ https://t.co/Aac3e3hHbN
51,67898559,1546932534788755456,2022-07-12,"Camarero, capitán, tío, hermano, presidente
Maestro, compañero, toda roda por la gente

📷: @julio.jotac em CLUB A Oficial https://t.co/XflAlRCsAs"
52,207123161,1546925365108412418,2022-07-12,Hoje resolvi ousar na cor do esmalte... adorei... https://t.co/PxMPYi6ufx
53,76103370,1546920674421542913,2022-07-12,Acabou de publicar uma foto em Bourbon Street Music Club https://t.co/6pJCAVf47r
54,3895005683,1546920475099643905,2022-07-12,Acabou de publicar uma foto em Espaço Drina Vieira https://t.co/rAPShsQoOJ
55,1509234946682109959,1546880030986231809,2022-07-12,Acabou de publicar uma foto em Blacklist Rooftop https://t.co/pa8pgRQ0Jr
56,173819903,1546879958944989186,2022-07-12,Acabou de publicar uma foto em Shopping Ibirapuera https://t.co/aFmkFFtdGM
57,81813407,1546867397776359426,2022-07-12,Venha aproveitar a promoção de descontos de até 30% na loja da @zazou_oficial ou pelo nosso WhatsApp: 11-99487-3649. em Zazou Moda Gestante https://t.co/FBTpykEqqB
58,2177060390,1546861478170357765,2022-07-12,"Acabou de publicar uma foto em Itatiba, SP https://t.co/4kMvFmk4n0"
59,20146388,1546850486334144512,2022-07-12,"Faz 15 minutos que estou em São Paulo.

Estava fumando e um segurança de Congonhas pediu para eu me dirigir ao fumódromo porque não era permitido fumar ali. 

Mas deixou um branco que estava ao meu lado lá, fumando tranquilamente.

15 minutos, porra."
60,3895005683,1546846564823572480,2022-07-12,Acabou de publicar uma foto em Espaço Drina Vieira https://t.co/Zedb0M2psz
61,71877526,1546821850260455425,2022-07-12,Acabou de publicar uma foto em Studios Laercio Da Costa https://t.co/W6bQePrNFX
62,3354920057,1546815115319705600,2022-07-12,"O @InfinityAsset #DailyDrops, informação na velocidade do mercado financeiro - 12/07/2022 com @JasonVieira https://t.co/hRkiY71kru"
63,1545132869558886403,1546792012984336384,2022-07-12,fé em Deus q tudo vai dar certo🙌🏻🕊️ https://t.co/nAjgQMmVz5
64,22817930,1546784695643508736,2022-07-12,Quando seu embarque parece uma cena de Stranger Things! 😱 https://t.co/GAQCbPqm8L
65,555352017,1546693228224815106,2022-07-12,Esse prime day virou um enterro 🤡
66,339333829,1546660429438533639,2022-07-12,Acabou de publicar uma foto em Villaggio JK https://t.co/bPpiXUutez
67,46478331,1546634268834762752,2022-07-11,Acabou de publicar uma foto em Coco Bambu Market Place https://t.co/49dhlEQeYn
68,46478331,1546633677580300289,2022-07-11,Acabou de publicar uma foto em Coco Bambu Market Place https://t.co/LGQN14z0zW
69,73493771,1546607239196188678,2022-07-11,"I'm at Pão de Açúcar - @paodeacucar in São Paulo, SP https://t.co/rqiBldQkHn"
70,30893561,1546566854319022080,2022-07-11,"Irmandade!
@silviopaciello @maurega 
Obs: Mais nerd que isso, eu não consigo! 🤪 em Liceu Eduardo Prado https://t.co/EESBFO9MRM"
71,137914828,1546552025659441155,2022-07-11,"Quando passo por aqui, só lembro o que aconteceu em 17 de julho de 2007. Não sabe? Chama no Google. em Congonhas https://t.co/iSPwVU1wFV"
72,106590007,1546550910666547202,2022-07-11,#blessoptical #blessoptical_brasil #blessoptical_brazil #handmadeinbrazil🇧🇷 #handmade #independentbrands #estilo #conceito #personalidade #nadaconvencional #descolado #acervo #curadoria em Bless Optical https://t.co/QCJYivVOW4
73,106590007,1546539571386765313,2022-07-11,#blessoptical #blessoptical_brasil #blessoptical_brazil #handmadeinitaly🇮🇹 #handmadeinbrazil🇧🇷 #handmade #independentbrands #estilo #conceito #personalidade #nadaconvencional #descolado #acervo #curadoria https://t.co/9auYJgN1i8
74,284543581,1546535428261523456,2022-07-11,"ESCOLHER MEUS PROBLEMAS é a minha definição de sucesso.
.
E para você, o que é?
.
#sucesso #foco #aeroporto #rafaelkraisch em Aeroporto De Congonhas, São Paulo - SP https://t.co/dAmhF4vgGF"
75,49370468,1546530364813869057,2022-07-11,I'm at @StarbucksBrasil in São Paulo https://t.co/ImZJAXhew9
76,110688963,1546521659343077377,2022-07-11,"Caos (at @DIASupermercado in São Paulo, SP) https://t.co/wGn9BQ5d0T"
77,102249429,1546516519978520576,2022-07-11,"DON’T TOUCH IT’S ART 🖼 em Memorial da América Latina, São Paulo https://t.co/v2GYXRcR0f"
78,1047977396903792641,1546503612087603200,2022-07-11,Mais um dia aqui ✨️ https://t.co/FyOEdUwxEG
79,14091312,1546494620732981249,2022-07-11,encontro de rainhas https://t.co/ZIgk8gWrqp
80,3246374325,1546483179514740736,2022-07-11,"Montem suas conexões com cuidado, crianças. 
Cuiabá - Brasília - Congonhas.. Rio Jajá. https://t.co/NpfRNnGc5R"
81,1495818188369584136,1546474640050094081,2022-07-11,tóxica ao ponto de https://t.co/jlSHLqiAZG
82,120556049,1546472348727087106,2022-07-11,Acabou de publicar uma foto em Hotel Hilton https://t.co/4tYSHyAdEx
83,120556049,1546472038113726466,2022-07-11,Acabou de publicar uma foto em Hotel Hilton https://t.co/6QUOrJLkDA
84,52833087,1546461239617921024,2022-07-11,"I'm at Aeroporto de São Paulo / Congonhas in São Paulo, SP https://t.co/7u0xMEgf89"
85,3354920057,1546455846133108736,2022-07-11,"O @InfinityAsset #DailyDrops, informação na velocidade do mercado financeiro - 11/07/2022 com @JasonVieira https://t.co/PxyxU1QdqX"
86,81813407,1546447765764546561,2022-07-11,Nossas clientes grávidas são nossas melhores modelos gestantes! ®️ Vejam só como ficou estilosa a Gravidinha @palomabgarcia_ do insta @picgarcia com este vestido estampado em P&amp;B da atual coleção da @zazou_oficial. https://t.co/BxAt5QfSNx
87,815100174284587008,1546325756044873729,2022-07-11,Retrato de um domingo feliz 🥰👩🏼‍🤝‍👨🏾💍🐙 https://t.co/OddZkVrzYZ
88,1539981504272539648,1546291299988508673,2022-07-11,"Dia de gravação para o GE SP! Que surreal. Mãe, to na Globo! #globoesporte #defrentecomoanti #Palmeiras #SaoPaulo #Santos https://t.co/fXHvzFLNE8"
89,20743783,1546287879629963264,2022-07-11,"Guapissima, SP. https://t.co/M4zxXZXmcx"
90,2435004096,1546287116090474497,2022-07-11,😋 https://t.co/BqIts6WaN8
91,17222399,1546275765565722624,2022-07-10,"Bar do Alemão, o melhor Parmegiana do Brasil. Conheci em Itú e hoje sou cliente deles aqui na  Av. Juriti, 651 em Moema. Não tem nada parecido e olha que é um dos meus pratos mais pedidos por mim. Parabéns! https://t.co/6zoV37K3gs"
92,72291647,1546272117058052098,2022-07-10,"Corrida Olga Kos Inclusão, em família. em IV Corrida Pela Inclusão A Toda Prova Do Instituto Olga Kos https://t.co/eylLmIM5MU"
93,58554913,1546269712505528322,2022-07-10,✨️ em Beyond Van Gogh - São Paulo - Brasil https://t.co/1yOAr8WRQ7
94,1241355525121626113,1546253092877901826,2022-07-10,🥰 https://t.co/PsvDLvyLy6
95,49836909,1546211499135434754,2022-07-10,"Por aí....
📷 🏙 ↗️↘️ 🇧🇷
.
#EscadariaSelaron #turismo #rio #RioDeJaneiro #RJ #falaceres em Escadaria da Lapa (Selarón) https://t.co/Cq9Lp8N5bo"
96,185791080,1546201362936909824,2022-07-10,"Minha conduta é pura e meus valores eu não coloco em disputa. 💋✨ em Vale Dos Dinossauros, Foz De Iguaçu https://t.co/W94fkBTWvA"
97,110688963,1546200796613820421,2022-07-10,"I'm at Paróquia Santo Ivo in São Paulo, SP https://t.co/Nubh143G0N"
98,1419054110570160134,1546199961188057088,2022-07-10,Gravei ontem antes do Anime Friends https://t.co/VYXzPBq67W
99,612220965,1546182095743209475,2022-07-10,"Sinto muito forte a seu lado @anacristinalatuf. Família é construída com muito amor, carinho, cumplicidade, compreensão e lealdade sou grato por estarmos juntos. #familia #amor #carinho #juntos #forever https://t.co/O7Is5QCUeh"
100,81813407,1546181269448708096,2022-07-10,Nossas clientes grávidas são nossas melhores modelos gestantes! Olhem a Gravidinha @palomabgarcia_ com um look da @zazou_oficial em Zazou Moda Gestante https://t.co/Bs1GhYjlLu
101,110688963,1546170741988757505,2022-07-10,"I'm at Piadina Tree in São Paulo, SP https://t.co/NQnvxBW4kv https://t.co/BHWDHTFWr3"
102,28273980,1546167079732125697,2022-07-10,Acabou de publicar uma foto em Teatro Vivo https://t.co/Axs0kDoL4z
103,120556049,1546111216719994884,2022-07-10,"#asaslivres  / voando através da arte!
@pintorescomabocaeospes em Hotel Hilton https://t.co/NhYhiWHgUG"
104,897612127766167552,1546110310792286209,2022-07-10,"Oi, São Paulo! 🇧🇷 @ Casainc https://t.co/xfm6sGurrc"
105,120556049,1546106213510823938,2022-07-10,#gratidão #família @janiceclalves @somelaicitel @nicolicasotti @jcbortolato8 em Hotel Hilton https://t.co/uoJ12vF5EK
106,81813407,1546095231321268224,2022-07-10,Vejam só como ficou linda a Gravidinha @palomabgarcia_ do insta @picgarcia com este look da @zazou_oficial. Perfeito para curtir este final de semana. em Zazou Moda Gestante https://t.co/pItwXWhQ01
107,27566436,1546087564016340993,2022-07-10,@chapadinhasdeendorfina em Itaim Bibi https://t.co/Ylwl3Y8Swn
108,15410917,1546052581818044416,2022-07-10,"Good night! (@ Chicohamburger in São Paulo, SP) https://t.co/lH5KYqizA8"
109,1038165420161818624,1546049990245728262,2022-07-10,Aeroporto de Congonhas https://t.co/PRivIiRk8b
110,17222399,1545987163719884800,2022-07-10,Sempre com meu amor. @camoguardia . Hoje fomos comprar os presentes do Dia dos Namorados. Estávamos com Covid na data certa. em Andiamo Ristorante https://t.co/7AQeNnkqer
111,1193012271900962816,1545983091591749633,2022-07-10,"Tédio noturno, porém, com preguiça de sair.. queria alguém aqui 🔥 https://t.co/KdB7T4kgOQ"
112,1360083179428798464,1545982791275679744,2022-07-10,Boa madrugadadinha ☯️🔥 https://t.co/h7oTuIzEOb
113,1193012271900962816,1545981572171681794,2022-07-10,@Jeffferreiira22 https://t.co/AKw9JhEljs
114,2628977602,1545971369808125953,2022-07-10,"Nééé ... pega meninaaadaaa .... ainda me lembro....dos bons momentos da "" São Bento""...
Da hora rever vc representação máxima do nosso Hip Hop ... @thaideoficial ...

#hiphop90s #sãobento em Roller Jam https://t.co/EQWZTlqR2y"
115,53179056,1545965889299914752,2022-07-10,Noite será longa …. em Trio Eventos e Gastronomia https://t.co/wJp8huC0Zm
116,20743783,1545965578048966657,2022-07-10,"Vila Olimpia, SP. https://t.co/HAcMH1IvSw"
117,120556049,1545957507037790209,2022-07-10,#entrevista @walchelala @samirchelala @abrasci_ @pintorescomabocaeospes em Hotel Hilton https://t.co/RYEW5tbMj4
118,120556049,1545955270668349440,2022-07-10,#exposição #gratidão @abrasci_ @pintorescomabocaeospes @artbymouthandfootpainters @jcbortolato8 @nicolicasotti @janiceclalves @somelaicitel @samirchelala @walchelala em Hotel Hilton https://t.co/DsJvaoJxLN
119,193927064,1545947857655676928,2022-07-10,"""I often think that the night is more alive and more richly colored than the day."" - Vincent van Gogh em Beyond Van Gogh Brasil https://t.co/bmLBWjMFOT"
120,1378383842,1545939819418861571,2022-07-10,Eu e ela …. em Meet &amp; Eat https://t.co/txEEphqxe7
121,120556049,1545931182109491201,2022-07-10,#exposição #gratidão @pintorescomabocaeospes @abrasci_ em Hotel Hilton https://t.co/ER8OrnB7UE
122,185791080,1545921662947844096,2022-07-10,"A vida não me deu o dom da síntese, por isso não me encaixo em qualquer lugar. 🌏 em Vale Dos Dinossauros, Foz De Iguaçu https://t.co/zCx8baw88r"
123,971911783744245760,1545918150679609344,2022-07-09,nojenta demais na sala vip do aeroporto rsrsrs https://t.co/VTYkX3bRHG
124,82958591,1545914825250856968,2022-07-09,"Hm 🤔 (at @Kinoplex Platinum in São Paulo, SP) https://t.co/CvPUGXDJ0p"
125,39267584,1545885295043919872,2022-07-09,"Amor e Trovão (at @Kinoplex Platinum in São Paulo, SP) https://t.co/syDNgwRBJC"
126,41709648,1545876702982701056,2022-07-09,Acabou de publicar uma foto em Brooklin https://t.co/3FzXUTZ4sE
127,1104610607540649984,1545874743995142144,2022-07-09,Era o Presidente @jairbolsonaro e sua comitiva nesse avião? ❤️ https://t.co/HktmhEDFRC
128,1426609893243510787,1545869818770907138,2022-07-09,O sábado esta como??? https://t.co/d6IPD8lI5T
129,95433357,1545860340705120262,2022-07-09,Bora levar parte da primada para para se divertir. em Varal 87 https://t.co/4lN4Y7595x
130,89544580,1545855611430223881,2022-07-09,relax.. @ Barbearia Corleone Vila Olímpia https://t.co/RA8vQT0sxj
131,48462578,1545842291432210433,2022-07-09,"eu achei que era amor, mas era tédio 🎶 em Aeroporto De Congonhas, São Paulo - SP https://t.co/NYGAhtwWYd"
132,71860557,1545833541786910721,2022-07-09,Trato na juba! em Brooklin São Paulo Z.sul https://t.co/I0QEfn7mFh
133,161406010,1545814867248037888,2022-07-09,"I'm at Trattoria Nacional in São Paulo, SP https://t.co/2YgSYNEQJN"
134,236421159,1545813799445430273,2022-07-09,"@kitkatbrasil I just loved your store!!! 

#kitkat #Kitkatbrasil #saopaulo #sampa #morumbi #brazil #meme #viral #explore #guy #men #boy #smile https://t.co/wMCXOGzVrZ"
135,110688963,1545810340625235971,2022-07-09,"Preço errado - um na gôndola e outro no caixa. (@ Gimba in São Paulo, SP) https://t.co/PM5IA4R2Ta"
136,1410633602354794508,1545796028481273859,2022-07-09,Chegamos em Ribeirão Preto! Tem alguém aqui do Twitter que mora em RP?
137,16310598,1545795935917203456,2022-07-09,Iik https://t.co/PwPVCbKcUn
138,76103370,1545795676709199880,2022-07-09,Acabou de publicar uma foto em Bourbon Street Music Club https://t.co/neS38m3Y7K
139,76103370,1545793352305606657,2022-07-09,Acabou de publicar uma foto em Bourbon Street Music Club https://t.co/wQzbh8dbbc
140,1419054110570160134,1545788445129428995,2022-07-09,1º nude em SP https://t.co/AaRaa7o1VA
141,33038572,1545787192458575874,2022-07-09,"I'm at Aeroporto de São Paulo / Congonhas (CGH) in São Paulo, SP https://t.co/5opLJJQwdu"
142,224648416,1545784990239268866,2022-07-09,"Acabei de chegar na terra da garoa, já estou em minha terra… em Aeroporto De Congonhas, São Paulo - SP https://t.co/mq8OCuJa0x"
143,81813407,1545780029501718528,2022-07-09,Acabou de publicar uma foto em Zazou Moda Gestante https://t.co/ne2K4aXRXH
144,56610486,1545776707302555648,2022-07-09,FELIZ SÁBADO em Campos Do Jordão - A Suíça Brasileira https://t.co/Gjbw4kupP9
145,106590007,1545759072338583552,2022-07-09,#blessoptical #blessotical_brazil #blessoptical_brasil #aconchego #estilo #conceito #personalidade #nadaconvencional #foradacurva em Bless Optical https://t.co/O4fi5gg8Dp
146,19498172,1545749176851603456,2022-07-09,"No evento Ao Vivo da @chinagatebrasil, China Gate Live em São Paulo."
147,144811662,1545733372651216897,2022-07-09,"Acabou de publicar uma foto em Aeroporto De Congonhas, São Paulo - SP https://t.co/lpXueuQwaJ"
148,53157331,1545731153533014016,2022-07-09,"No avião, nesse momento, enquanto as pessoas embarcam, toca uma versão bossa-nova-instrumental-de-elevador de Trem das Onze.

Devia ser crime, sério."
149,3237120995,1545729634737786882,2022-07-09,"tô todo fudido todo cara
 é incrivelmente bom ter 18"
150,81813407,1545716099198685184,2022-07-09,Acabou de publicar uma foto em Zazou Moda Gestante https://t.co/S4Hwkl90ex
151,76103370,1545620012576022528,2022-07-09,Acabou de publicar uma foto em Bourbon Street Music Club https://t.co/cq903kYkwE
152,164553734,1545615310488731649,2022-07-09,hummmm sorvetin https://t.co/xNdodBgRBX
153,304730976,1545603064907833344,2022-07-09,Rock night sextou Rock Friends and Rockers em Brooklin São Paulo Z.sul https://t.co/QUvwWdztxk
154,170798680,1545598156615946242,2022-07-09,Papai do Bernardo 👶🏻 modo ON na casinha 🏠 mais animada do 🌍 @limelightsp em Limelight https://t.co/r73DGbAk6Q
155,2363319738,1545595609608069122,2022-07-09,"ok talvez ter comido meia porção de coração, um xis strogonoff e tomar três frukis tenha saído um pouco da minha dieta"
156,304730976,1545590415746899969,2022-07-09,Rock chegando Dia Mundial do Rock 13 /07/1985 só nós temos. Rock mudou o mundo contra as ignorância e a salva vidas. salve Rock mais de 70 anos velhinhos Rockers em Brooklin São Paulo Z.sul https://t.co/8fCxCsmqdM
157,76103370,1545585117283856384,2022-07-09,Acabou de publicar uma foto em Bourbon Street Music Club https://t.co/xlorqx19Qr
158,76103370,1545581897878626305,2022-07-09,Acabou de publicar uma foto em Bourbon Street Music Club https://t.co/dR58onG9Y7
159,318056797,1545553784843157504,2022-07-08,I'm at Hardyfloor pisos e revestimentos a base de resinas 11 2364 8172 in São Paulo https://t.co/xjAQsiM5dQ https://t.co/Eyuft7qU0w
160,226621686,1545546404956864512,2022-07-08,A única pessoa responsável pela sua paz é você mesma! 🍃🤍 em São Bento do Sapucaí - SP https://t.co/5W9sLZn7b6
161,111948040,1545542035511328768,2022-07-08,"Encontre as novas coleções de Inverno na Americanino.
#americanino #shoppingibirapuera #sk8
#skateforever #skateboard #santacruz 
#screminghand #gnarly #gnarlyfoot 
#independent #creature @ Estação Eucaliptos https://t.co/9AtDaBlJu7"
162,3895005683,1545533272515661827,2022-07-08,Acabou de publicar uma foto em Espaço Drina Vieira https://t.co/0en8OQi1Yn
163,318056797,1545521329088172032,2022-07-08,"Returning (@ Bio Ritmo in São Paulo, SP) https://t.co/ZGCsPNhRC6 https://t.co/sOgAiGqTSl"
164,1483035612475179008,1545521139350372353,2022-07-08,"Já pode começar a beber? 

Sextooooou! https://t.co/8QuVn9gRu8"
165,1035311680195125250,1545520969334366214,2022-07-08,Open de chopp… hoje eu morro! https://t.co/BS373hZ02S
166,26992157,1545517633470185472,2022-07-08,"Mais que planners, friends. Lindos, resolvedores de BOs, cheirosos e, sobretudo, ridículos! 💚💜 em Vila Olímpia https://t.co/lfAXOboiOb"
167,84133951,1545517056958861313,2022-07-08,"P Vender Apartamento novo em MOEMA  - Ap studio 1 dorm., 24m2 - Av Chibarás - Moema - SP - R$ 424.900 - no contra piso, cozinha, 1 banh., varanda. Condomínio c lavand. coletiva, Portaria 24h, excelente localização, próximo ao metrô Moema. Cristina Madruga (11) 98412-9748. https://t.co/e6HwE4Citb"
168,1374846068391882761,1545516236876005377,2022-07-08,Enfim sextou https://t.co/CXV38ikJIK
169,81813407,1545514473322168320,2022-07-08,Acabou de publicar uma foto em Zazou Moda Gestante https://t.co/b5arUUqYY0
170,158481123,1545511933180366851,2022-07-08,Acabou de publicar uma foto em Morumbi Shopping https://t.co/Jkjl4MuuAR
171,601051201,1545510105189437440,2022-07-08,Acabou de publicar uma foto em Gansaral https://t.co/KfAjVmecbV
172,76103370,1545506649045028864,2022-07-08,Acabou de publicar uma foto em Bourbon Street Music Club https://t.co/7K0efZHXIu
173,984271782000644096,1545506208290951168,2022-07-08,"Já tomaram um cafezin, hoje?! https://t.co/oRtsgHGhT1"
174,135993620,1545503476557529090,2022-07-08,Hj minha passarinha conheceu o ninho que eu cresci! Cresci profissionalmente e mto mais que isso. Eu fiz amigos pra vida inteira. Tenho um amor tão grande por eles que meu coração acelerou qdo coloquei os pés ali de novo. Só quem já foi um Tweet sabe o quanto esse lugar é mágico. https://t.co/KGn56qGZ2u
175,266164723,1545499795984625664,2022-07-08,"É que esses caras imitam os gringos, eu sou brasileiro, funkeiro nato, coração e alma de maloqueiro 🎶 em Brooklin São Paulo Z.sul https://t.co/viMcNpiZ5j"
