,author_id,tweet_id,created_at,text
0,1627708764059992077,1649191977961832450,2023-04-20,Até que o meu dia foi legal 🥰 https://t.co/OMBJCGk5WX
1,110688963,1649188783198199808,2023-04-20,"Oi, férias (@ La Fraternité in São Paulo, SP) https://t.co/pKsESYIWn6 https://t.co/03VkPiLCkK"
2,337596942,1649172734872625152,2023-04-20,I'm at @TeatroSantander in São Paulo https://t.co/dU2Ti1TDDV
3,57717875,1649160517817098242,2023-04-20,"I'm at Aeroporto de São Paulo / Congonhas in São Paulo, SP https://t.co/OgkC4DnP0F https://t.co/7T2C4he068"
4,1245412682473377792,1649131856514760704,2023-04-20,Anestesia multimodal https://t.co/rwWbQR9dPf
5,25574151,1649073090901491715,2023-04-20,I'm at Kosho in São Paulo https://t.co/yP8NbB0xf9
6,110688963,1648845064376930305,2023-04-20,"Puta merda (@ Bio Ritmo in Sao Paulo, SP) https://t.co/o2327LtVAH"
7,35962917,1648827982297935873,2023-04-19,"Indo de volta pra casa... (@ Aeroporto de São Paulo / Congonhas in São Paulo, SP) https://t.co/fw4DzOTFxX"
8,50851280,1648822430851366913,2023-04-19,"I'm at Aeroporto de São Paulo / Congonhas in São Paulo, SP https://t.co/BWfjFSK4FC"
9,203809353,1648821869506711554,2023-04-19,I'm at Studio151 in São Paulo https://t.co/tTh4cfdZTN https://t.co/k1ThDcnzhP
10,1621457475160489984,1648789038147436547,2023-04-19,Ibirapuera 🌄 https://t.co/MuAHeN49QL
11,28274762,1648780760139153411,2023-04-19,"I'm at @StarbucksBrasil in São Paulo, SP https://t.co/HnRzBuKDGD"
12,28274762,1648780660864081920,2023-04-19,"I'm at Aeroporto de São Paulo / Congonhas in São Paulo, SP https://t.co/RFFb1Drp5g"
13,28274762,1648644468197801984,2023-04-19,"Bora trabalhar! (@ Aeroporto de São Paulo / Congonhas in São Paulo, SP) https://t.co/BvAeTHOKz9"
14,55886961,1648615708920561666,2023-04-19,"Voando ando! (@ Aeroporto de São Paulo / Congonhas in São Paulo, SP) https://t.co/lAEmbhTL6z"
15,1479078276865871876,1648510716218068992,2023-04-19,"@CentralRedeBBB @bbb , @tvglobo , @gshow , @boninho , @tadeuschmidt - #NADA #A #VER #ESSE #BBB23 !!!!
Números disfarçadamente manipulado!
Que issoooooo!
Absurdo total. Amanda, mosca morta e Larissa, boca aberta, NÃO saírem??!!! Parando hoje mesmo de assistir e acompanhar!!!!"
16,232582153,1648475810016395264,2023-04-18,"I'm at Cantón in São Paulo, SP https://t.co/idY3P30KuU"
17,110688963,1648462001696567296,2023-04-18,"Brrrlll (@ Bio Ritmo in Sao Paulo, SP) https://t.co/K4LAIbXiZT"
18,35962917,1648365714774937600,2023-04-18,"I'm at Aeroporto de São Paulo / Congonhas in São Paulo, SP https://t.co/kYtNOnRHqs"
19,318056797,1648358126763012097,2023-04-18,"I'm at Bio Ritmo in São Paulo, SP https://t.co/ypWkj4Xjdq https://t.co/VM2hMKZR2u"
20,138124859,1648351229788012552,2023-04-18,"RJ (@ São Paulo Airport / Congonhas in São Paulo, SP) https://t.co/QJgcSJobo4"
21,1217825834922381314,1648312983272017920,2023-04-18,Purple me https://t.co/Kf6QrHxks0
22,50851280,1648286825813868544,2023-04-18,"I'm at Aeroporto de São Paulo / Congonhas in São Paulo, SP https://t.co/ixxMgAK7js"
23,110688963,1648092095658295297,2023-04-17,"I'm at Bio Ritmo in Sao Paulo, SP https://t.co/SiHk6xGfvK"
24,1531444539814297600,1648030020701417484,2023-04-17,Boa tarde amores 💕 https://t.co/2HiwMu2rxI
25,1273795096706678784,1648012113103683584,2023-04-17,👺 https://t.co/iPuaCdIyRH
26,110688963,1647986317077229575,2023-04-17,"I'm at Ramos &amp; Ramos in São Paulo, SP https://t.co/yLe68zw2Ol"
27,1535300952869244928,1647944159443943426,2023-04-17,"De cheiro em cheiro, de beijo em beijo… https://t.co/TYo2ZkXmkv"
28,1293298786203316230,1647920282378575874,2023-04-17,shopito e eu no aguardo da recepcionista há quase 1h https://t.co/H4Sg9T1Q1m
29,1479078276865871876,1647798995962548225,2023-04-17,"@tvglobo É.... agora eu acredito o que já me falaram um dia.... que existe manipulação nos resultados de quem sai e de quem fica no programa!
Lutei e relutei para NÃO acreditar nisso!
Mas terei que acreditar nas pessoas, que um dia me disseram isso!
Aline, Bruna e Sara, e a Bruna NÃO sair"
30,1536708294533857280,1647721172715405313,2023-04-16,"O tempo em fiquei na Bahia tanto em Portugal ainda tinha um tom de pele mais escuro, inclusive na Europa eu sofria diversos tipos preconceito por conta da minha cor, então na escola eu tinha amizade mais com as meninas que vieram de Angola https://t.co/j7CwauFDdE"
31,1535300952869244928,1647715524967559172,2023-04-16,"Ei bbs, tudo bem? 
Finalmente em Moema, vcs pediram muito e aqui estou. 

- tirei umas fotos novas para meu site, vou postar no Only 😘

Venham me visitar safadinhos https://t.co/kOqXQU0ooH"
32,60350579,1647705858237710337,2023-04-16,#AHerança parte 2 https://t.co/Xq8jDIchVW
33,318056797,1647705104076750851,2023-04-16,"I'm at @CinemarkOficial for Dungeons &amp; Dragons: Honor Among Thieves in São Paulo, SP https://t.co/kRVJeggKEO https://t.co/A4PP7O4H35"
34,318056797,1647695837496049665,2023-04-16,"I'm at Shopping Market Place - @smarketplace in São Paulo, SP https://t.co/POPbnEtnld https://t.co/m573LixVWp"
35,318056797,1647695590539636740,2023-04-16,"I'm at Ponte Octávio Frias de Oliveira (Ponte Estaiada) in São Paulo, SP https://t.co/Omxs8xTqL9 https://t.co/GvnxHb7ykw"
36,151581569,1647641793658343424,2023-04-16,Wicked! (at @TeatroSantander in São Paulo w/ @muh_h) https://t.co/CXVZQ2qA2h
37,318056797,1647639257140305920,2023-04-16,"I'm at Bio Ritmo in São Paulo, SP https://t.co/GvUDIBXQl4 https://t.co/H8wtBRG5Bz"
38,196780891,1647383144092319746,2023-04-15,"I'm at MorumbiShopping in São Paulo, SP https://t.co/3tToRJIZlk"
39,151581569,1647366484648140802,2023-04-15,"I'm at Beco Hexagonal in São Paulo, SP w/ @muh_h https://t.co/JIlr2Kkw1T"
40,337596942,1647289233361584128,2023-04-15,I'm at @TeatroSantander in São Paulo https://t.co/H5rZwoKPvM
41,57074720,1647255567889465345,2023-04-15,"Enfim, tô com ideias de projetos. Tipo, podcast de livros de terror ou sci-fi, etc. 

Quero melhorar a ajuda aos autores nacionais independentes tbm. 

Vamos ver como me organizo e tento dar conta de colocar os projetos em prática nos próximos meses."
42,57074720,1647255564764758016,2023-04-15,"Mas voltando aos autores independentes que pedem divulgação, eu faço de forma natural, sem cobrar, pra ajudar mesmo. 

Pelo menos nos stories, já que pro feed eu leio antes de comentar, só que acabo lendo mais o que tá na minha lista infinita.+ E"
43,57074720,1647255553750474752,2023-04-15,"Outro problema é não ter nicho, mas quem me acompanha já está mais ou menos acostumado.

Amo terror, fantasia e sci-fi, mas não leio apenas isso. Aí não construo um público fiel ""nichado"".

Talvez devesse focar? Quem sabe...+"
44,57074720,1647255550248329222,2023-04-15,"Quero dizer, quando o algoritmo permite, né? Apesar de ter uns 7k seguidores, os posts flopam com frequência hahahah 

Talvez meu foco no mkt digital e mídias sociais seja fraco? Sim, é possível, mas como disse não é um trabalho, não sou influenciador, etc.+"
45,57074720,1647255546158784513,2023-04-15,"Tem gente + gabaritada q eu pra criticar livros.

Estudo literatura porque gosto. Até por isso minhas leituras são variadas, pois evito ler só um gênero. Sinto que estou na minha formação como leitor, ainda acumulando bagagem.

Meu IG é um canto onde não falo sozinho.+"
46,57074720,1647255541310271499,2023-04-15,"A ideia de forçar comentários positivos sobre livros não me agrada. 

Se eu não gostar de nada, o que é raro, evito até comentar qualquer coisa. 

Certa vez um colega me disse: ""gosto q você comenta muito mais sobre o q ama do q sobre aquilo q odeia"". 

É isso.+"
47,57074720,1647255537279553536,2023-04-15,"Alguns escritores independentes já me abordaram no IG sobre preços de divulgação de livros. 

Sempre recuso, porque não é e nem quero que seja o meu trabalho. 

Lá, eu apenas comento sobre o que leio. Com isso, dei sorte de viralizar uns reels e conseguir alguns seguidores.+"
48,110688963,1647244733922648065,2023-04-15,"I'm at Bio Ritmo in Sao Paulo, SP https://t.co/e0AdjFPddA"
49,73493771,1647237728793133061,2023-04-15,"I'm at Droga Raia - @draiaoficial in SAO PAULO, SP https://t.co/iLgcP06ZLD"
50,73493771,1647234322527559734,2023-04-15,"I'm at Pão de Açúcar - @paodeacucar in São Paulo, SP https://t.co/uy5cWGhWAa"
51,110688963,1647230324907167745,2023-04-15,I'm at Emporio Ouro Preto in São Paulo https://t.co/OG6hYfpzZP https://t.co/6aZsGVEUET
52,1284261394012082176,1647184480661061633,2023-04-15,"Booooom diaaa SP

Recuperada, começando o dia!!

Poderia ter sol? Sim!

Bora ser feliz! https://t.co/3tefiLeRRl"
53,1479078276865871876,1647145252015202305,2023-04-15,Evento online gratuito: A Revolução Possível com Cornel West - Uma aula histórica com o maior pensador negro da atualidade. (4 de MAIO às 20h)  https://t.co/O1ie8FgVjV
54,1479078276865871876,1647062812278116353,2023-04-15,"@CentralRedeBBB TCHAUUUUUUU.... @BrunaGriphaoo 
Já vai tardeeeeeee!!!!!
Imatura!!!! Arrogante!!! Boca Suja!  @tvglobo @gshow @boninho @tadeuschmidt @bbb"
55,1643083786127650816,1647049725475004416,2023-04-15,Você já viu dr tudo? https://t.co/dDASLuUJlQ
