,author_id,tweet_id,created_at,text
0,76103370,1562590128165363713,2022-08-24,Acabou de publicar uma foto em Bourbon Street Music Club https://t.co/8n7BCuWb0v
1,76103370,1562582887782043648,2022-08-24,Acabou de publicar uma foto em Bourbon Street Music Club https://t.co/YiMp7sn2ga
2,76103370,1562581697438560258,2022-08-24,Acabou de publicar uma foto em Bourbon Street Music Club https://t.co/2R35DlPlTt
3,76103370,1562581206184894466,2022-08-24,Acabou de publicar uma foto em Bourbon Street Music Club https://t.co/KPBGF9vwSR
4,110688963,1562575129305321475,2022-08-24,"I'm at Serato in São Paulo, SP https://t.co/vcrDrbRjkv"
5,50851280,1562575056525352962,2022-08-24,"I'm at Aeroporto de São Paulo / Congonhas in São Paulo, SP https://t.co/QCPiXduh8R"
6,57017730,1562551207658651648,2022-08-24,Hoje tem transmissão s/ fio no gimbal.. Parceria @carlosvicentefotoevideo e @wfernandeseventos em gexperience https://t.co/REfE8CzLYh
7,94150452,1562546656255840256,2022-08-24,Acabou de publicar uma foto em Multi Escape Serviços Automotivos https://t.co/LSGrzlN4EX
8,63588252,1562530974260334594,2022-08-24,Acabou de publicar uma foto em JPS studios https://t.co/bNlBFwl3ab
9,712803270155235328,1562509905335947270,2022-08-24,Acabou de publicar uma foto em O Melhor de  Moema Grand Vitralli https://t.co/Fd6UW0KR3g
10,73493771,1562508521261842432,2022-08-24,"I'm at Pão de Açúcar - @paodeacucar in São Paulo, SP https://t.co/zKdOsfCipC"
11,54715632,1562505594333933568,2022-08-24,"HISTÓRICO!
Confira a grade completa do @pokerbighit Suprema Big Hit, que começa AMANHÃ, dia 25 de agosto, no tradicional WTC Sheraton, em São Paulo. em Sheraton São Paulo WTC Hotel https://t.co/HQPDvBQNm2"
12,1489205371642261505,1562497233962291202,2022-08-24,"Nem uma senha na frete, nem um movimento dentro do banco mas aqui no @santander_br a demora pra um atendimento de 2 minutos a espera é  de 25, exatos 25, 5 minutos depois da foto eu fui atendido. Obg pelo descaso e mal funcionamento. https://t.co/6OGAfVfJ4k"
13,3895005683,1562491516966252544,2022-08-24,Acabou de publicar uma foto em Espaço Drina Vieira https://t.co/KQ9vcM8VMf
14,110688963,1562469870213537793,2022-08-24,"Pastel é lei quarta (@ Feira Livre - @sp_prefeitura in São Paulo, SP) https://t.co/WLFNGVPf6x"
15,218114717,1562438374652518400,2022-08-24,Acabou de publicar uma foto em Quinta da Garrafeira https://t.co/kuMV9h64cs
16,218114717,1562438103176196096,2022-08-24,Chegou !!!! em Quinta da Garrafeira https://t.co/LYGQslqeZj
17,143202757,1562434273969569795,2022-08-24,"And off to Curitiba …😁 @ Aeroporto De Congonhas, São Paulo - SP https://t.co/OaPiSsC7dD"
18,1431356038691819530,1562422197796638721,2022-08-24,to bem kkk
19,254216275,1562419862537904128,2022-08-24,Já é meio dia em algum lugar do mundo. https://t.co/AY8ydiWLJU
20,73493771,1562418316505120768,2022-08-24,I'm at Drogaria São Paulo in São Paulo https://t.co/Ly5F2VzxPL
21,54974415,1562414174260674560,2022-08-24,6 Filis - Abramed
22,73493771,1562412563572224002,2022-08-24,"I'm at Styllos Panificadora - @styllos_padaria in São Paulo, SP https://t.co/RDQuJWIv7O"
23,976185744443236352,1562383930690527232,2022-08-24,https://t.co/cdxz3ihDxR
24,55320035,1562283286826831872,2022-08-24,Meu presente de aniversário antecipado para o @Palmeiras.. Amor marcado na pele para sempre! #AvantiPalestra #Palmeiras108 https://t.co/fPGcgtj6tc
25,316072613,1562282526609063938,2022-08-24,Acabou de publicar uma foto em Campo Belo (district of São Paulo) https://t.co/hahgo0zcu3
26,41647014,1562257000138182658,2022-08-24,"@fuy.wines e @el.portazo no @guiavinau SP 2022 com a  @setwinesbr , belíssimo evento !! #vinhos em Praça São Lourenço https://t.co/nGoXJ63ymr"
27,110688963,1562237516505579521,2022-08-24,"Segundo round de quem mora sozinha (at @NaturaldaTerra_ in São Paulo, SP) https://t.co/EBKtggWerS"
28,1519709635623723008,1562228473128964096,2022-08-24,Acabou de publicar um vídeo em Rindo Muitooooo https://t.co/qTVXRriy7Q
29,1347077785,1562226293307047936,2022-08-23,Que entrevista chata #JN
30,8205502,1562224436220088321,2022-08-23,"Acabou de publicar uma foto em Memorial da América Latina, São Paulo https://t.co/kFZFIpgvAz"
31,2628977602,1562218791085699081,2022-08-23,Boa noite... em Maximus Art Tattoo https://t.co/Mt2zfvcmQ3
32,317562128,1562176333660258304,2022-08-23,Aquela foto perfeita que vc tira!! Parecendo paisagem! Até o pássaros  levantando voo consegui pegar!! Obrigada Senhor por tamanha perfeição!! #shopingibirapuera #trabalho #fé #benção #natureza🍃 em Shopping Ibirapuera https://t.co/4eqGJDBArd
33,47418016,1562175893883289600,2022-08-23,Acabou de publicar uma foto em Advise Propaganda https://t.co/Gybxl7vjdd
34,737805622293450754,1562160776433045505,2022-08-23,"é, Disney! os sonhos se realizam mesmo ❤️ https://t.co/f6q16NT5b0"
35,76103370,1562156877697298432,2022-08-23,Acabou de publicar uma foto em Bourbon Street Music Club https://t.co/RGYewCjFuD
36,76103370,1562155709713768448,2022-08-23,Acabou de publicar uma foto em Bourbon Street Music Club https://t.co/Ch0M8wHk1t
37,1376025164,1562148902790471681,2022-08-23,"A vida é um eterno “eu mereço” seguido de “eu que lute” 🥲 num ciclo infinito de merecimento e culpa, mas vamos que vamos! #tpm mode ON https://t.co/IGzHZMuDCL"
38,3348427727,1562143215154782211,2022-08-23,Mantenha a rotina e o foco no propósito! em Vila Olímpia - Zona Sul SP https://t.co/OQklS0xtkz
39,142325755,1562140863404335104,2022-08-23,"I'm at Aeroporto de São Paulo / Congonhas in São Paulo, SP https://t.co/NwCTFZuwws"
40,556283885,1562137715499565057,2022-08-23,A primeira parmegiana com historinha a gente nunca esquece em Lar Bianco Restaurante https://t.co/0RaEh9Pwbh
41,26042861,1562111779248930816,2022-08-23,Acabou de publicar uma foto em Lefevre Odontologia https://t.co/SHRuJZ2slI
42,782008051066925057,1562108297573974017,2022-08-23,Acabou de publicar uma foto em Teatro Vivo https://t.co/Z052BliZVI
43,389213606,1562079690952679424,2022-08-23,"Acabou de publicar uma foto em Memorial da América Latina, São Paulo https://t.co/WojP5ikAh6"
44,61187941,1562075684742258688,2022-08-23,"Só na Neoin, você investe em Cotas de Empreendimentos Imobiliários a partir de R$10 Mil e recebe lucros todo mês, livres de impostos. Entre em contato para saber mais. em Vila Olímpia https://t.co/NPUTkVZTL0"
45,61359473,1562074047705489410,2022-08-23,"Feliz aniversário para a melhor esposa, melhor mãe e melhor amiga que eu poderia ter! Te amo ♥️ @mariacssanchez em Campo Belo (district of São Paulo) https://t.co/srdU9RY2gE"
46,321236518,1562052242135474176,2022-08-23,"A meta é ser melhor q ontem e não melhor q ninguém.👊
+Um dia  #cuboitau #vilaolimbia em CUBO https://t.co/KSeBYg081b"
47,302798333,1562037327656263683,2022-08-23,Aproveitando esses leds da estação aqui https://t.co/jzEbaDcDz3
48,81813407,1562030869786742785,2022-08-23,Acabou de publicar uma foto em Zazou Moda Gestante https://t.co/t0w9OFGuTq
49,318056797,1562026981025140737,2022-08-23,"I'm at Campo Belo - @sp_prefeitura in São Paulo, SP https://t.co/00x4Q2i0fp https://t.co/x5WqjNZfB7"
50,50851280,1561984143898152962,2022-08-23,"I'm at Aeroporto de São Paulo / Congonhas in São Paulo, SP https://t.co/vBAJdQJwLH"
51,959723201566773248,1561915206346985473,2022-08-23,@FlavioBolsonaro Ta ai a prova. E lembrando que o papai foi obrigado a dar 600 de auxilio. Na verdade ele queria dar 200. https://t.co/ckTRCImceN
52,69117559,1561911910563741696,2022-08-23,"Muito boa entrevista do professor Jorge Sampaoli no Bem, Amigos. https://t.co/g5MIqPjL7g"
53,1347077785,1561907861004976128,2022-08-23,"Obviamente não teve panelaço aqui no bairro, afinal a elite está se lixando que tem 33 milhões passando fome. Que bom que eu fui pra academia, ganhei mais"
54,1347077785,1561907140821925890,2022-08-23,MEU DEUS ISSO É MUITO REAL https://t.co/FopMegvj2b
55,1347077785,1561905904961961985,2022-08-23,Tinha que pintar tudo de vermelho e puxar uma tarja. Esse urgente chama 0 a atenção @GloboNews https://t.co/fqUxubGITy
56,1347077785,1561900612874375170,2022-08-23,Ainda acho que o #JN perdeu a chance de atacar pela via inflacionária e custo de vida caro. O povão realmente liga para a falta de coerência de Bolsonaro com o Centrão? O povão sabe o que é Centrão? Se interessa por essa alcunha e os impactos dela? #BolsonaroNoJN
57,897612127766167552,1561861980599701504,2022-08-22,Will there be Six Stars?#brasil #seleçãobrasileira #worldcup #qatar2022 @ NYC Berrini https://t.co/ysPSJ9K9v7
58,1347077785,1561848565302951936,2022-08-22,Será que antes ele tomou um café na casa do Queiroz? É pertinho https://t.co/1XfpJ8FTkW
59,209570167,1561844509079748608,2022-08-22,Manda foto de agora… quase uma 3x4 https://t.co/r0oMb5IsMB
60,108637786,1561838437061238784,2022-08-22,"Domingo, 6:30h, 11• C e aquela disposição para correr 15Km

#trackandfield #trackandfieldrunseries #streetrunners #levantaeanda #88in11 #CEinSP @cuidaqueavidatapassando em Ponte Octávio Frias - Estaiada https://t.co/NmZbRF2DjK"
61,76103370,1561836973811048448,2022-08-22,Acabou de publicar uma foto em Bourbon Street Music Club https://t.co/DBc8Z6dCz3
62,76103370,1561835031101939719,2022-08-22,Acabou de publicar uma foto em Bourbon Street Music Club https://t.co/duAlzwrkzr
63,1251614178097483784,1561821178796429319,2022-08-22,Só tocantinense pra tomar sorvete com cabelo molhado e temperatura de 9 graus 😂😂 https://t.co/4BuE7opKfo
64,14407625,1561817220774334466,2022-08-22,"Mais um encontro de aniversário, com essa turma linda que saiu do trabalho para a vida. em Oguru Sushi &amp; Bar - Shopping Market Place https://t.co/WzvatLd94K"
65,48592235,1561811718736683009,2022-08-22,Acabou de publicar uma foto em SBD - Sociedade Brasileira de Diabetes https://t.co/22iiBDl2OW
66,316072613,1561809146487492608,2022-08-22,"Hoje tivemos uma tarde maravilhosa reunião de planejamento @exaltaoficial  2022/23

Muito boa projetos incríveis pra vocês meus queridos em Campo Belo (district of São Paulo) https://t.co/vhgTGi8jne"
67,1677721,1561797272312205315,2022-08-22,"A @SamsungBrasil me emprestou o lindo Galaxy Z Fold 4 pra testes, em breve sai o review. #GalaxyZFold4 #galaxyunpacked #SamsungUnpacked https://t.co/pTlznym9w2"
68,218114717,1561795173411078147,2022-08-22,"Mais um mês 
Com muitas novidades em Quinta da Garrafeira https://t.co/c6OFsTFEoa"
69,66858402,1561781478681362433,2022-08-22,Acabou de publicar uma foto em CQ Empresariamento https://t.co/OldoMejbn5
70,66858402,1561777742290485251,2022-08-22,"Vilão abusivo em ‘Cara e Coragem’, Bruno Fagundes (@bruno.fagundes ) diz ouvir relatos de mulheres: ‘Se identificam’
Ja viu essa matéria ? 
Link na bio em CQ Empresariamento https://t.co/bKjZpnVtwG"
71,266164723,1561743923642515456,2022-08-22,As mulheres da minha vida e o Harielzinho 💙🥰 em Brooklin São Paulo Z.sul https://t.co/fW2yi6FJwE
72,345216960,1561742679335047168,2022-08-22,Venha conferir pratos light nosso Melbourne Bowl  também nossa maravilhosa Aussie Cheese Fries em Outback Shopping Market Place https://t.co/7Cxw0bXo2R
73,127289216,1561736130009174018,2022-08-22,UM ORGULHO QUE NEM TODOS PODEM TER 🐳🤍🖤 em Vila Belmiro. O Templo Do Futebol! https://t.co/uxo6Qc3JMM
74,106590007,1561702201675771904,2022-08-22,#blessoptical #blessoptical_brazil #blessoptical_brasil #acessorios #descolados #exclusivo #estilo #conceito #personalidade #nadaconvention #independentbrands #handmade em Bless Optical https://t.co/4qEkAPdHId
75,106590007,1561701880966877185,2022-08-22,#blessoptical #blessoptical_brazil #blessoptical_brasil #acessorios #descolados #exclusivo #estilo #conceito #personalidade #nadaconvention #independentbrands #handmade em Bless Optical https://t.co/o3URopBXU7
76,106590007,1561701213153927168,2022-08-22,#blessoptical #blessoptical_brazil #blessoptical_brasil #acessorios #descolados #exclusivo #estilo #conceito #personalidade #nadaconvention #independentbrands #handmade em Bless Optical https://t.co/P2rw8jSTiP
77,66893795,1561696590578032641,2022-08-22,Acabou de publicar uma foto em Vila Belmiro. O Templo Do Futebol! https://t.co/o21uTIYAnc
78,44948170,1561695452852064259,2022-08-22,Abrindo caminhos. em Ciclovia Marginal Pinheiros https://t.co/BHfsnUftwR
79,60673769,1561690304109068290,2022-08-22,Acabou de publicar uma foto em Shopping Cidade Jardim https://t.co/kYhOuxJhM2
80,321236518,1561676002945802240,2022-08-22,"Bora pra luta! A vida é difícil, mas fica pior sem esforço 🙌
Bora lá começar + um aqui na Vila Olímpia #CuboItau em CUBO https://t.co/MH3LnYv5rl"
81,3354920057,1561669844528947200,2022-08-22,"O @InfinityAsset #DailyDrops, informação na velocidade do mercado financeiro - 22/08/2022 com @JasonVieira https://t.co/ug2D4LcqLY"
82,26894476,1561642757629911041,2022-08-22,Acabou de publicar uma foto em Soma Cervejaria https://t.co/sghmxDOpeC
83,1494745932746870790,1561537909492252672,2022-08-22,"Obrigado São Paulo!
#greaseomusicalbr em Teatro Claro SP https://t.co/VrEHiL9ZAa"
84,861695579151269888,1561533461818593280,2022-08-22,Acabou de publicar uma foto em Parque Bruno Covas Novo Rio Pinheiros https://t.co/89fWFRtBuJ
85,1251614178097483784,1561510284375822337,2022-08-22,Finalizar domingo 🤓🍿 https://t.co/sMixtyqVBK
86,143202757,1561500661484818435,2022-08-21,I am in Brazil for two days already… so it’s about time to have my first Caipirinha finally 🤪 @ Hilton Morumbi https://t.co/WW7nWeDp7E
87,1020414994356342790,1561495448539615234,2022-08-21,Acabou de publicar uma foto em Teatro Santander https://t.co/4twcKvGfaG
88,1545976955274727425,1561485360567394307,2022-08-21,O tesao pediu tive que sair do trampo pra obedecer! #PINTOSAWARDS #punhetaemlocalpublico #punhetaboa https://t.co/jv2oqCpmQ7
89,88957480,1561484272103473160,2022-08-21,"CHEGO JÁ, NATAL! https://t.co/Bfw8jyejTJ"
90,40125120,1561476753230442497,2022-08-21,"H.E. Dr. S. Jaishankar
External Affairs Minister of Índia 
By CEPEDA, Francisco em HT Berrini https://t.co/3EkcbBvxZV"
91,1283049054021341195,1561464284462432257,2022-08-21,Vontade de transar
92,309866009,1561463557509861377,2022-08-21,Embarque Azul 4008 25 BD SP CGH Gate 4 RJ Santos Dumont https://t.co/YV4o9vT3f9
93,26894476,1561462846285910017,2022-08-21,"Sexta teve a primeira SEXTA DO STAND UP NO BROCK BAR, muito obrigado a todos que aparecem apesar do frio de menos 10º.
Próxima sexta-feira tem mais uma noite de testes no @brockbar140 em BROCK BAR https://t.co/MTgzMz6ow1"
94,3601029388,1561441381603745792,2022-08-21,𝑄𝑢𝑒 𝑒𝑢 𝑠𝑎𝑖𝑏𝑎 𝑠𝑒𝑟 𝑙ú𝑧 𝑞𝑢𝑎𝑛𝑑𝑜 𝑡𝑢𝑑𝑜 𝑎𝑜 𝑚𝑒𝑢 𝑟𝑒𝑑𝑜𝑟 𝑓𝑜𝑟 𝑒𝑠𝑐𝑢𝑟𝑖𝑑ã𝑜 ❤️ em Itaim Bibi https://t.co/labLAUuEuM
95,1561381318130339841,1561434138250452995,2022-08-21,Eu amo o mundo paralelo em que eu vivo kkkkkkk do nada parei no altas horas em São Paulo em plena terça feira. A vida é irada irmão #altashorasnordeste #JulietteNoAltasHoras https://t.co/T4aR8APjHu
96,1519107112181411840,1561431108226621445,2022-08-21,Acabou de publicar uma foto em Plenitude Educação https://t.co/FjYcGpleFf
97,1162332787183144961,1561430366124232705,2022-08-21,meu touro no mapa ta bem feliz hoje https://t.co/S63GCjYdyR
98,322551079,1561422177726935042,2022-08-21,"#Chopinho nosso de #domingo
#saúde 🍺 em Shopping Morumbi https://t.co/0aGjQQxEIz"
99,40125120,1561405605541281792,2022-08-21,"H.E. Dr. S. Jaishankar
External Affairs Minister of Índia 
By CEPEDA, Francisco em HT Berrini https://t.co/CzQAH3kgiL"
100,1393983694080286725,1561400115067240448,2022-08-21,Curte um rolé de carro com mamada?
101,81593903,1561398487337631748,2022-08-21,Drinking a West Coast Terpeno Canabinoide SFV by SOMA Cervejaria @ Soma Cervejaria — https://t.co/rt4ZyEz65u
102,81593903,1561397477399736320,2022-08-21,Drinking a NewEngland IPA by SOMA Cervejaria @ Soma Cervejaria — https://t.co/l5yMsY3iOv
103,81593903,1561396975181914112,2022-08-21,Drinking a West Coast by SOMA Cervejaria @ Soma Cervejaria — https://t.co/AP9SioQkSM
104,3138934131,1561378703610888194,2022-08-21,Café da manhã de milhões @thiago_lobao https://t.co/UvAW05xTPJ
105,1347077785,1561377277547614210,2022-08-21,"To achando que vai ser bem suave pra ele, dado que o #JN deu uma bela amansada nas críticas nos últimos meses https://t.co/J8t1sJ1FnR"
106,1347077785,1561358637553123334,2022-08-21,QUE 😳 https://t.co/BsMvVuXSF5
107,318056797,1561358107443433480,2022-08-21,I'm at Feira Livre do Campo Belo in São Paulo https://t.co/e2QGQsInYY https://t.co/ToDQ4ww5lM
108,202808816,1561348524532502529,2022-08-21,"CHEGUEI 🔥🔥🔥
SET TIME 🕚"
109,73493771,1561340561931616258,2022-08-21,"I'm at Styllos Panificadora - @styllos_padaria in São Paulo, SP https://t.co/i9KpPYBMEW"
110,76481710,1561330865661267969,2022-08-21,Acabou de publicar uma foto em CLUB A Oficial https://t.co/MhTRuU6Inf
111,37749824,1561328774616006656,2022-08-21,"Que sua semana seja espetacular!

Arrebenta👊

@leandrobranquinho 

#vendas #vendedor #amovender #boravender #vamosvender #botapraquebrar #vendedores #representantes #corretores em Estanplaza Berrini https://t.co/3f2WfFltXR"
112,367270447,1561306562077114368,2022-08-21,"I'm at @HiltonHotels in São Paulo, SP https://t.co/YNkadyJ2cy"
113,421258780,1561233546852806656,2022-08-21,Acaba de publicar una foto en Central 1926 https://t.co/80fKg25zOS
114,837716664871497728,1561165424900833282,2022-08-21,Seja luz 💫 https://t.co/ms4jXvVl2n
115,2771780097,1561141585852735488,2022-08-21,Drinking a Pale Ale by @eisenbahn @ Seven Kings — https://t.co/DLn90TEaYs
116,35659206,1561132606040727552,2022-08-20,"Hoje fui em uma loja chamada Fan Lab no shopping Morumbi,vende itens relacionados a Cultura PoP.O vendedor comentou que eles estão procurando trazer para loja itens(camiseta, funko, etc..) relacionados a #DnD e os livros de RPG…diz que muita gente procura. Olha aí @hasbrobrasil"
117,3895005683,1561131340170350592,2022-08-20,Acabou de publicar uma foto em Espaço Drina Vieira https://t.co/faML2AhPzp
118,1513885897036607489,1561126529878343683,2022-08-20,"Boa Noite Punpun!

#editorajbc #mangás #coletivogeek #inioasano #boanoitepunpun #geek em Coletivo Geek https://t.co/QFQUn3aox5"
119,62008930,1561101499723399168,2022-08-20,Acabou de publicar uma foto em Abraccio - Cucina Italiana https://t.co/0Wn0TYIcpt
120,186936586,1561101358341791745,2022-08-20,Tudo pronto para a cerimônia!!! ❤️ https://t.co/Zx2vxAMQPH
121,631577596,1561095638137331712,2022-08-20,"🧳 
[…]na primeira oportunidade eu tô decolando… #existeamoremsp em Aeroporto De Congonhas, São Paulo - SP https://t.co/G5ZuBXdNPS"
122,304033251,1561082694875942912,2022-08-20,https://t.co/PIWnbV9kCm
123,53587588,1561077259699617792,2022-08-20,"Dia de Inauguração da Pose com o mascote Spike em Moema, SP https://t.co/1XCIdJGuET"
124,72955740,1561069554721345539,2022-08-20,"I'm at MorumbiShopping in São Paulo, SP https://t.co/MFMB1jHrBE"
125,56541510,1561062571242917888,2022-08-20,black is the new black 📸 @bruzzifotos em Tulum Bar &amp; Club https://t.co/SOsYIZtqMq
126,234000865,1561061371919405056,2022-08-20,"Acabou de publicar uma foto em Maresias, São Sebastião https://t.co/os5tKvMYNE"
127,130479094,1561057272079405056,2022-08-20,Acabou de publicar uma foto em Pobre Ruan Ristorante https://t.co/6GCUSTSXVq
128,1159065444319469568,1561055574607134722,2022-08-20,"Ontem teve a primeira SEXTA DO STAND UP NO BROCK BAR, muito obrigado a todos que aparecem apesar do frio de menos 10º.
Próxima sexta-feira tem mais uma noite de testes no @brockbar140 em BROCK BAR https://t.co/SJ7R93lRBg"
129,110688963,1561043843008679939,2022-08-20,I'm at AMARO Guide Shop Vila Olímpia - @amaromoda in São Paulo https://t.co/d1I3RdhhSg
130,1498453158967787528,1561039574671003649,2022-08-20,"LUTO: Morre no Rio de Janeiro atriz e humorista Claudia Jimenez, aos 63 anos. https://t.co/U97ZAoBJMu"
131,39789302,1561039250258378752,2022-08-20,"Dia de Globo Esporte (que eu já tava com saudade), mas neste friozin, só com casaquin mesmo, né, galera 🫠 em Tv Globo https://t.co/PSwkUkvWhq"
132,1347077785,1561031637957312519,2022-08-20,Adoroooo https://t.co/aEI4QK2ayu
133,115466354,1561030087960629249,2022-08-20,"Galera da madrugada em Sampa!!!

#livetorideridetolive #lifestyle #harleydavidsonbrasil #borgesmrdavidson #amigosdomrdavidson #hd #life #befree #bereal #vivendo #harleydavidson #harleysdesampa #venumteam https://t.co/QamCgodw2h"
134,115466354,1561027124244484096,2022-08-20,Acabou de publicar uma foto em Grand Mercure Vila Olimpia https://t.co/veOqcS5VtW
135,1347077785,1561023180558442496,2022-08-20,Dó https://t.co/kVs9crC8WG
136,316776058,1561021178780831744,2022-08-20,Acabou de publicar uma foto em Estadio Dos Aflitos https://t.co/gV535FBL4U
137,143202757,1561005435263389696,2022-08-20,"Hello, São Paulo…😁 @ Hilton Morumbi https://t.co/Mbev8pHd3H"
138,15165399,1560982772667269120,2022-08-20,pulinho no Rio. 🐼 em Congonhas https://t.co/iHNZOna842
139,81813407,1560974519996653570,2022-08-20,Acabou de publicar uma foto em Zazou Moda Gestante https://t.co/G6fzelp2EV
140,218114717,1560972793105158144,2022-08-20,Acabou de publicar uma foto em Quinta da Garrafeira https://t.co/nsrlqww5aQ
141,387274518,1560914664560775169,2022-08-20,Pq sábado também é dia! em Aéroport international de Congonhas https://t.co/N82rZRtRaj
142,46533542,1560906568983609344,2022-08-20,Aqui acabou. https://t.co/SHRJwBUxJR
143,304730976,1560823518765383681,2022-08-20,Boas noites Rock friends and Rockers. Depois do happy hour com a equipe Itaú ti que faço parte. Chegando agora e lógico uma parada para maís umas. Lógico Bar rock. em Louie Louie bar https://t.co/iAcPTMrp1Y
144,256966844,1560792079936151559,2022-08-20,https://t.co/n06FsDfkLM
145,76481710,1560783294249189378,2022-08-20,Acabou de publicar uma foto em CLUB A Oficial https://t.co/B4usL3KiZK
146,42486967,1560778338385412098,2022-08-19,"Começou o final de semana ! 

E não vai ser na cabine , 🧀🍷🧣🥶
😉

#music #dj #housemusic em Tulum Bar &amp; Club https://t.co/9ewU2TCusL"
147,36748548,1560769284996997125,2022-08-19,"I'm at Barak Culinária Árabe in São Paulo, SP w/ @_ponkitz https://t.co/epvsdHk5jz"
148,83903370,1560744479048343552,2022-08-19,Acabou de publicar uma foto em Tv Globo https://t.co/QVaBJxMCDz
149,848956139479998464,1560736303872081920,2022-08-19,Ingresso comprado para ver o Glorioso @Botafogo com fantástico desconto @Camisa7Botafogo. Vamos ultrapassar a barreira dos 50 mil sócios!!! https://t.co/Ctj9ffzKbN
150,192584779,1560718553346674689,2022-08-19,Acabou de publicar uma foto em Looke https://t.co/M4vsz8WaX8
151,106590007,1560688942424391687,2022-08-19,Acabou de publicar uma foto em Bless Optical https://t.co/3zGf72e7dk
152,106590007,1560688745652822016,2022-08-19,Acabou de publicar uma foto em Bless Optical https://t.co/5lng0Zzb0u
153,1002290698119467010,1560682965973274626,2022-08-19,Acabou de publicar uma foto em Mercado Persa Brasil https://t.co/FcjCRUXON7
154,106590007,1560677403961266176,2022-08-19,Acabou de publicar uma foto em Bless Optical https://t.co/iFz612fLmU
155,106590007,1560676989425557504,2022-08-19,Acabou de publicar uma foto em Bless Optical https://t.co/R1mlbdon1o
156,57785777,1560676291908669443,2022-08-19,"D E Z O I T O 
R E A I S https://t.co/jmFi66VGPT"
157,106590007,1560676134928400384,2022-08-19,Acabou de publicar uma foto em Bless Optical https://t.co/b0ujiBHKnK
158,305270814,1560675960806055938,2022-08-19,"Não se esqueça de aproveitar sua jornada enquanto persegue seus sonhos. 

#vrall #maisuma #friaca #famosasextouuuuuu #umdiadecadavez #foguetenãodáré em Vila Olímpia https://t.co/B4V2xvXZDm"
159,1222524285505495040,1560648259575726080,2022-08-19,"Obrigada pelo encontro, pelo mimo e pela energia magnifica que trocamos 😍

Adorei conhecê-lo, te relaxar com muita massagem e te apresentar a ""meleca nuru"" 🤣 @DOM_MELCHOR_74 💆🏻🔥 https://t.co/ZivTZ6bTZT"
160,3240827291,1560648253720276994,2022-08-19,Acabou de publicar uma foto em Carro 0 https://t.co/hyC9mWBFHo
161,1225960590574858241,1560646622584897536,2022-08-19,São Paulo - SP / MOEMA 🔥 https://t.co/uj586Qtj7e
162,66653237,1560635399487242240,2022-08-19,"Nova sede @pay4funp4f !
Obrigado pela visita e pela parceria de sempre @rgarrido8 ! 😎🍾 @ Condomínio Edifício Roque Petroni 850 https://t.co/F6WrNufZYp"
163,240295245,1560630845379321856,2022-08-19,SexTou ✅ @royalenfield #RoyalEnfield https://t.co/AmwDDlgL8T
164,23362781,1560628742778753029,2022-08-19,"I'm at São Paulo Airport / Congonhas (CGH) (Aeroporto de São Paulo / Congonhas) (São Paulo, SP) w/ 4 others https://t.co/eadhmJt8d8"
165,3895005683,1560625568030269443,2022-08-19,Acabou de publicar uma foto em Espaço Drina Vieira https://t.co/XlQfzY7Gm6
166,81813407,1560608627970387970,2022-08-19,Acabou de publicar uma foto em Zazou Moda Gestante https://t.co/0DdnnR0ICy
167,18639091,1560606044736348162,2022-08-19,"✅ No painel O valor da Democracia, Carlos Mello, docente responsável pela pesquisa, recebe Sérgio Abranches e Maria Hermínia.

💻 Para acompanhar as conversas, o link é este: https://t.co/qPovtHdVJW https://t.co/P1wrwaQGw6"
168,18639091,1560606038969171969,2022-08-19,"✅ No painel SUS: desafios e oportunidades, Letícia Nunes, docente responsável pela pesquisa, recebe Cássio Turra, Alexandre Kalache e Ricardo de Oliveira."
169,18639091,1560606037194854400,2022-08-19,"✅ No painel O desafio de expansão do agro com preservação ambiental, Marcos Jank, docente responsável pela pesquisa, recebe Paulo Hartung e Izabella Teixeira."
170,18639091,1560606035802472449,2022-08-19,"✅ No painel Reforma Tributária, Vanessa Canado, docente responsável pela pesquisa, recebe Rodrigo Maia, José Tostes e Marina Thiago."
