,author_id,tweet_id,created_at,text
0,177423719,1530787936215638016,2022-05-29,"Desfile do @atelier_sandra_magalhaes 
 realizado no Mercado Persa 2022

Nossa Cia fez o encerramento do desfile juntamente com a nossa Diretora Artística Dana Farida ✨

Foi um momento muito lindo e emocionante 🤍 https://t.co/qwTosyPVBi"
1,591961954,1530753400798846976,2022-05-29,Baladinha 💙👏🏼🎈 #ale42 #sp em Limelight https://t.co/Ryp0NbL4UD
2,937049228404314112,1530751769852223490,2022-05-29,"Acabou de publicar uma foto em Aeroporto De Congonhas, São Paulo - SP https://t.co/PGSvET5KUn"
3,1427450113862078465,1530732124394950656,2022-05-29,"Role bom é aquele que você não esperando 
#coquetel #festa #inesperado https://t.co/gv7iqOY614 https://t.co/akTAcO6OqB"
4,335755549,1530704469469667328,2022-05-29,"Um brinde para todos os lugares que visitamos! E para todos os lugares que nós vamos visitar! E um brinde para mim, sussurrando em seu ouvido de novo e de novo: EU TE AMO! #8years https://t.co/1XHgEffSCT"
5,164776701,1530698015459135489,2022-05-28,"I'm at Eu, Tu, Eles in São Paulo https://t.co/9FAUcmg2pr https://t.co/SDLIddnev5"
6,111948040,1530675110625034242,2022-05-28,"Camisetas Volcom Deadly Stone. Modelagem Regular, estampa em silk frontal, assinatura Volcom na manga e viés contrastante. #americanino 
#volcom #volcombrasil #volcomoriginal
#shoppingibirapuera @ Shopping Ibirapuera https://t.co/oKOaH6CTcU"
7,11334252,1530673997733584897,2022-05-28,"I'm at Tower Bridge Corporate in São Paulo, SP w/ @tomtonirocha https://t.co/joqc2k5KdS https://t.co/TK7otceh5I"
8,111948040,1530659765193302017,2022-05-28,Just posted a photo @ Shopping Ibirapuera https://t.co/dJ8OYHiPpL
9,151978321,1530655195490926597,2022-05-28,🌿🍃🧗 em Parque Bruno Covas Novo Rio Pinheiros https://t.co/VR7Vtv3K85
10,97689547,1530652638773137410,2022-05-28,Drinking a Pilsen by Cervejaria BR-88 @ Brooklyn Paulista — https://t.co/ZL0pUBwkKG
11,2585001029,1530649205752094722,2022-05-28,"Que felicidade em encontrar de surpresa e no meio da correria de uma conexão em Congonhas o futuro Presidente @cirogomes! Uma honra apertar sua mão, Cirão! ✊🏻🌹

#PrefiroCiro #TurmaBoa #PND https://t.co/dLxzKHZdl0"
12,318056797,1530647625879388161,2022-05-28,"I'm at Padaria Colonial in São Paulo, SP https://t.co/AVcC1TlaiR https://t.co/qJvCgNEF8F"
13,73493771,1530637735354064898,2022-05-28,I'm at Fórmula Pet in São Paulo https://t.co/lj4x3leMCS
14,388030398,1530625868200128513,2022-05-28,Hoje é dia de assistir o Musical CINDERELLA no Teatro Claro em SP https://t.co/IydqQWP4kM
15,111948040,1530623119693684737,2022-05-28,"Modelagem Regular, estampa em silk frontal, assinatura Volcom na manga e viés contrastante. 
Confeccionada em meia malha 30/1
#volcom #volcombrasil #americanino 
#volcomoriginal #shoppingibirapuera @ Shopping Ibirapuera https://t.co/0v5M5ru0mW"
16,1347077785,1530616866875576320,2022-05-28,= Brasil https://t.co/rjLImv7zQQ
17,1347077785,1530610176755122178,2022-05-28,"@Vinetando E pegou entradas pro #JH com os repórteres devolvendo pro Alan Severiano, que estava à frente do #JH hoje, enquanto a Mari Queiroz só ignorava e chamava o próximo link ao vivo que também não estava falando diretamente com ela"
18,757928493711761412,1530598724723949569,2022-05-28,🚲 em Parque Bruno Covas Novo Rio Pinheiros https://t.co/wMQStOUSYS
19,8774132,1530594108007501827,2022-05-28,Comemorando o Dia Mundial do Hambúrguer @SevenKingsBgr https://t.co/evhaXTWd4m
20,249798348,1530593233910341635,2022-05-28,Acabou de publicar uma foto em Hangar82 Tattoo E Barbearia https://t.co/LMZXyypOr1
21,26484337,1530587465509179394,2022-05-28,Drinking a Witbier by Cervejaria Dádiva @ Praça São Lourenço — https://t.co/R49FI272Gd
22,1266512796797284352,1530585827260129280,2022-05-28,Comemorando meus 23 anos da melhor forma 💙 https://t.co/z6AyRbMUIG
23,964916587936534530,1530582709591896064,2022-05-28,Acabou de publicar uma foto em Cacau Show Mega Store https://t.co/sMjHgb6Qij
24,238682030,1530579193117003779,2022-05-28,"Prestigiando nossos atletas do @cearasc. Bate papo muito agradável. Que Deus sempre abençoe vcs, conte sempre com a @madeira_sports. #madeirasportssemfronteiras⚽🌍🔝🔝🙏🙏👏👏 https://t.co/bEoQ1rvXfT"
25,2935479502,1530572389448355841,2022-05-28,Acabou de publicar uma foto em Bourbon Street Music Club https://t.co/uJVI1zVnoy
26,261366155,1530571554249183233,2022-05-28,Acabou de publicar uma foto em Instituto da Cerveja Brasil https://t.co/5pHZa9P1BN
27,106590007,1530569156353040385,2022-05-28,#deolho #olhovivo #olhando #olha #olhar #olho #eye #occhio #blessoptical #blessotical_brazil #blessoptical_brasil #todeolho #deolho #sguardo em Bless Optical https://t.co/zEBzpPSdVw
28,85777200,1530564520900300800,2022-05-28,"“Não extingua sua inspiração e sua imaginação; não se torne o escravo do seu modelo”. 🎨

Vincent van Gogh

#vangogh #colours #paints #colourful #blue #yellow #photooftheday #instagood #love #loveislove #inspiration https://t.co/uC2G0jYszW"
29,318056797,1530542817675714562,2022-05-28,I'm at Hardyfloor pisos e revestimentos a base de resinas 11 2364 8172 in São Paulo https://t.co/l2AucaQLkw https://t.co/XCBYN0QQIn
30,797572357288263680,1530537542658957315,2022-05-28,Estou no espaço infantil do lab observando o comportamento das crianças conforme a idade que elas aparentam ter
31,1085534450723811329,1530535827742261249,2022-05-28,Aff  q #horror https://t.co/3Vy1rdPmuE
32,56610486,1530525858028474369,2022-05-28,Acabou de publicar uma foto em Campos Do Jordão - A Suíça Brasileira https://t.co/hQwirB5xQs
33,56610486,1530524520569884676,2022-05-28,Acabou de publicar um vídeo em Campos Do Jordão - A Suíça Brasileira https://t.co/ZfMq9VKzhz
34,56610486,1530524239647977479,2022-05-28,Acabou de publicar um vídeo em Campos Do Jordão - A Suíça Brasileira https://t.co/guEqDRUGY3
35,1103077752914219008,1530522125836206081,2022-05-28,Uma criança fã de Harry Potter feliz por aqui 🥰 https://t.co/55sPokGCZm
36,56610486,1530521451203272704,2022-05-28,"Amo essa paisagem de Campos do Jordão, ainda mais no frio, que lugar lindo. em Campos Do Jordão - A Suíça Brasileira https://t.co/Q15F9VxDFQ"
37,56610486,1530520963883880449,2022-05-28,"FELIZ SÁBADO pra todos vcs, que Deus abençoe muito. em Campos Do Jordão - A Suíça Brasileira https://t.co/7vd7P3QCWe"
38,233383596,1530504755851689984,2022-05-28,"Acabou de publicar uma foto em Aeroporto De Congonhas, São Paulo - SP https://t.co/RRyE2AjRkG"
39,474150555,1530482694748090368,2022-05-28,Acabou de publicar uma foto em Gran Estanplaza Berrini https://t.co/UFA6AxGVNW
40,876587651121508352,1530421530236268544,2022-05-28,cabide em Bar do Meio https://t.co/hWeXWUqbUr
41,907395692733374464,1530417341691219969,2022-05-28,Aniversário do @katoi20 https://t.co/npdrvALiOV
42,304730976,1530393791764512768,2022-05-28,Madrugada Rock friends and Rockers. Curta a brevê louca vida. O tempo não para. Rock forever Rock em Brooklin São Paulo Z.sul https://t.co/C6pOA37WkZ
43,304730976,1530392449314607105,2022-05-28,Rock friends and Rockers. House Rock night sextou Rock. Sempre em Brooklin São Paulo Z.sul https://t.co/DnjE6yScsM
44,304730976,1530392002281480193,2022-05-28,Boas noites Rock friends and Rockers. Rock night in house tomando aquela gelada. Tears Rockers em Brooklin São Paulo Z.sul https://t.co/rp9YImFhEP
45,560797121,1530359971170377728,2022-05-28,"Excelente @Eleazardomini!

Dei um estudo bíblico e fui questionado sobre Sábado e Ellen White. A pessoa viu Tiago Arrais falar que o sábado poderia ser outro dia e a Sra. White era descartada.

Ele era o pastor.
Eu só alguém dando estudo.

Olha o perigo!

https://t.co/WZSYIDAODk"
46,1346503196215271425,1530356642092662784,2022-05-28,Virei fã de HP moress 🥰 https://t.co/ij8OEmPqb5
47,53091306,1530348147171635201,2022-05-28,"Viemos jantar com a family ❤️ Já já 00:00 é o aniversário da nossa princesa @sabrinacbviana estamos em contagem regressiva 🥂❤️
Ps.: papai e gabs vestidos iguais,  ainnnnn não guento! em Shopping Cidade Jardim https://t.co/Q1DtdfIv5x"
48,53114639,1530343886350163968,2022-05-28,Acabou de publicar uma foto em Jovem Pan https://t.co/vLpQp0JGvF
49,200896366,1530337233018015755,2022-05-27,Dos stories para o feed a entrega do look dessa noite incrível pra vcs! #lookdanoite #lookinpiracao #lookplussize em Shopping Cidade Jardim https://t.co/UoXCrkrmUo
50,1085534450723811329,1530329541582929920,2022-05-27,https://t.co/MQCMlowj3N
51,614455528,1530327161529413634,2022-05-27,"Bom demais.
@verillovanessa @marcelaverillo 
@hamburgueriatradi em Tradi Vila Nova Conceição https://t.co/vPTSm7UwGl"
52,614455528,1530326826177929217,2022-05-27,"Topzera total
#hamburgueriatradi em Tradi Vila Nova Conceição https://t.co/Le5IHWc2EA"
53,614455528,1530322659292102659,2022-05-27,"Maravilhosos 🤩🤩🤩🤩
@verillovanessa @marcelaverillo 
Melhor de Sampa fácil 
#tradihamburgueria 
@liersone em Tradi Vila Nova Conceição https://t.co/P0tRjbEBFP"
54,58921547,1530320003098091523,2022-05-27,E o buteco é tudo nosso. #AvantiPalestra https://t.co/7lSgpzeDVi
55,110688963,1530319596795871232,2022-05-27,"Em casa (@ Mullequinho's Burguer in São Paulo, SP) https://t.co/mOaROf01na https://t.co/oKGgCQZEfA"
56,51538765,1530319443271745536,2022-05-27,Acabou de publicar uma foto em 3 Telas Estúdios https://t.co/7QWdMvDTqy
57,1521722263694979072,1530308212611813376,2022-05-27,https://t.co/Kc9b7AeV13
58,73493771,1530302226933104642,2022-05-27,"I'm at Pizzaria Monte Vero in São Paulo, SP https://t.co/nFmOdtQ0Fx"
59,1515879410599092227,1530295875796344837,2022-05-27,Todo nosso amor por #SP em Parque Cidade Jardim https://t.co/mvnjs3XWli
60,52833087,1530294390853451777,2022-05-27,"I'm at Aeroporto de São Paulo / Congonhas in São Paulo, SP https://t.co/BtgZm1wGId"
61,127430417,1530286060244180992,2022-05-27,"Amanhã sai o papo completo e eu já estou apaixonada! Teve até um salve pra Tamiroca.
Preparem-se para rir e chorar com a Erikotinha! 💛

#Corinthians @SCCPFutFeminino #futebolfeminino https://t.co/u6MViBEPJh"
62,40071096,1530275088309829636,2022-05-27,Acabou de publicar uma foto em Shopping Market Place https://t.co/nbTFkmKwyq
63,1520599764701749248,1530270715756306434,2022-05-27,"Postar aqui meu Amigo palmeirense 
Pra deeixar registrado vou cobrar ele final de Ano 
Só observo 🙄🤔 https://t.co/h1xl1q9oz7"
64,164142088,1530263593974915072,2022-05-27,"HOJE!
Nos vemos lá galera 👊🏼👊🏼

#faiskaborges #faiska #steelbarsp #steelbar #sp #moemasp #marklambert em Steel Bar SP https://t.co/NJEstGMtd9"
65,15813125,1530258163605422084,2022-05-27,Uma coisa que acho legal no Van Gogh é que tem sempre uma melancolia bonita nos olhares que ele depositava nas coisas da natureza. Mesmo a incerteza e a loucura às vezes levam o sujeito por caminhos tão emocionantes e profundos https://t.co/28odxpFz9k
66,339265678,1530244294673674244,2022-05-27,🤝 https://t.co/7WzdHx4mGb
67,1269319782685388802,1530241936187174914,2022-05-27,Séculos que eu não pisava em São Paulo
68,84912815,1530216465340710913,2022-05-27,"HOT BLUES FEST
JAM SESSION
Campanha do agasalho para esquentar as noites de inverno das pessoas em situação de rua.

01/06/22
21h30
Bourbon Street Music Club

@bourbon_street 
@manoblues1971 em Bourbon Street Music Club https://t.co/bznmnS0C2Y"
69,820283184160141314,1530212242297331712,2022-05-27,Obrigado @BurguerKingBR por me provar que o drive de vcs pode ser muito pior que o do Mc. Apenas há 15 MINUTOS parado aqui
70,1316184874206756866,1530199307474837505,2022-05-27,"Ó senhor Deus, como o Senhor tem sido tão bom comigo!

Obrigado Deus maravilhoso! 🙏🏻🥺❤️ https://t.co/y1oThXKo8k"
71,19450758,1530196423907606529,2022-05-27,"Just posted a photo @ Aeroporto De Congonhas, São Paulo - SP https://t.co/w8yHE2yYup"
72,305270814,1530191917568471043,2022-05-27,"A nossa tranquilidade é o desespero de montão. 🔥
.
.
#sextoubb #estiloAgostinhacarrara #blackwhite #camisadebolinha #vamosquevamos #pracima #foguetenãodáré 💥🚀 em Vila Olímpia https://t.co/6M0enxjXdC"
73,41385276,1530188490520113154,2022-05-27,a CÂMARA aprovou ontem o Projeto de lei: dia da Harmonização Facial.  O frouxo eleitor assustadiçamente submete-se. em Brasília https://t.co/sj2aYaCs7M
74,41398742,1530170650379395072,2022-05-27,"Participe, compartilhe. em EMMP Escola Moderna de Música e Produções https://t.co/rgLB0eH4Yn"
75,1101575305,1530161884867047424,2022-05-27,Acabou de publicar uma foto em Hocca Bar - O Famoso do Mercadão https://t.co/JC6DZ3ahcv
76,380069148,1530158490811084805,2022-05-27,"Na hora H…vem aqui no JH que a gente te conta tudo.
As principais notícias do Brasil 🇧🇷 e do Mundo 🌍 sempre pra você. 

Bom dia 😃 
Bom almoço.
E até breve então…🙌🏻

@jornalhoje 
@tvglobo 
#jornalhoje em Tv Globo https://t.co/ATyYK741bC"
77,1246522340135129089,1530151180663508998,2022-05-27,Acabou de publicar uma foto em Vila Jk São Paulo https://t.co/NEI6krJsLp
78,3354920057,1530142983596679169,2022-05-27,"O @InfinityAsset #DailyDrops, informação na velocidade do mercado financeiro - 27/05/2022 com @JasonVieira https://t.co/MglGePUoiv"
79,1108157878836383749,1530142063076974592,2022-05-27,Acabou de publicar uma foto em Pedro Bomfim Advocacia https://t.co/Ebe8aVmNSv
80,80595718,1530140786750132224,2022-05-27,Acabou de publicar uma foto em Sheraton São Paulo WTC Hotel https://t.co/o6E5HcPlNM
81,455163611,1530132463346917376,2022-05-27,Acabou de publicar uma foto em Grupo Utah https://t.co/zLkiZHikAW
82,2761344034,1530126655280271362,2022-05-27,"Turma de teologia para leigos.
Instituto Itelse. São Paulo/SP
Preparando para servir nas pastorais. em Colégio Maria Imaculada https://t.co/GhULyaqdSb"
83,2230246254,1530124857890971650,2022-05-27,Minha lombar tá fudida bom dia 👍🏻
84,88499540,1530031929470369807,2022-05-27,Tudo ê Jazz!! #chicago #chicagoomusical #teatromusical #teatrosantander #musicaltheatre https://t.co/mYYfpI1gbO
85,230002540,1530007566125674496,2022-05-27,"alô @tatawerneck, tô disponível pra próxima temporada! #GExperience #VemViverAGlobo em gexperience https://t.co/O4phRP5WaY"
86,1347077785,1530003687510364160,2022-05-27,Amanhã tem que ter @NatuzaNery na despedida da @beltraomaria! Por favooor @Rodrigo_Caruso @GloboNews
87,1347077785,1530003511399878656,2022-05-27,@pabloabranches @beltraomaria Sin! 😰😰😰😰💔💔💔💔
88,1347077785,1529988998797709338,2022-05-27,Eu não estou NADA preparado pro último #Estudioi da @beltraomaria amanhã 💔💔💔💔💔
89,190288377,1529987200686997504,2022-05-27,"#tbt 
Deposite sua legenda feliz aqui :) 
.
.
#sp #cubo #experience #sdds em CUBO https://t.co/USrdr9O51g"
90,239765705,1529970653947912212,2022-05-26,"Seminário Empreendedorismo e Economia Azul em Memorial da América Latina, São Paulo https://t.co/xeSTQDzsoF"
91,17815099,1529953560049377280,2022-05-26,"Com vc minha vida é uma obra de arte 🖼 
.
.
.
#tbt #throwbackthursday #beyondvangogh @ Beyond Van Gogh - São Paulo - Brasil https://t.co/Q8cXYFsFuw"
92,18066816,1529952744445992961,2022-05-26,Acabou de publicar uma foto em https://t.co/0FW43GkbL9.Lab https://t.co/CSmTkYNmn1
93,65015218,1529948599035080704,2022-05-26,Comunicação é tudo 🙂 https://t.co/Y8nyeSlXge
94,1494745932746870790,1529947584189677586,2022-05-26,Acabou de publicar uma foto em Teatro Claro SP https://t.co/O4HPG0hh3o
95,203809353,1529947149072580645,2022-05-26,"QUE DIA SENHORES! Ver meu herói de infância @varedg de perto, é muita barriga senhor sorte (@ Patties in São Paulo) https://t.co/KgfmUqRUgJ https://t.co/Fuafzv1Icf"
96,25700962,1529940600715460632,2022-05-26,Acabou de publicar uma foto em Beyond Van Gogh Brasil https://t.co/fEUszLKW2i
97,169964377,1529933074745671680,2022-05-26,Acabou de publicar uma foto em Faculdade de Educação - USP https://t.co/76Bp6a5VQG
98,228978642,1529922098566660096,2022-05-26,✨🌞🌻💛✨ em Exposição Van Gogh https://t.co/epQ1bKRDX7
99,497159118,1529916419684585477,2022-05-26,Acabou de publicar uma foto em Clinique Eternité https://t.co/w0gKcWqSxz
100,1397359905082953731,1529909433110777858,2022-05-26,Você se lembra quando começou a fazer parte do Twitter? Eu me lembro! #MeuAniversárioDoTwitter https://t.co/OFqGBi4nq0
101,1269813173135212549,1529899126082744331,2022-05-26,Escutando baby da Gal só porque sempre lembro do Carlos
102,61766850,1529893027837190150,2022-05-26,Acabou de publicar uma foto em Grupo Utah https://t.co/v4s53jejsS
103,76103370,1529889168008138753,2022-05-26,Acabou de publicar uma foto em Bourbon Street Music Club https://t.co/Lstpq5yTTX
104,37987887,1529878943255343109,2022-05-26,"Hoje, em São Paulo... em Seven Kings Moema - SP https://t.co/XV2QhnwRpE"
105,1519879545511424006,1529874099425755137,2022-05-26,"Empreendedores devem existir,direitos e deveres de todos devem ser cumpridos!!! https://t.co/BkhLwHlwfW"
106,261366155,1529868040287961089,2022-05-26,Acabou de publicar uma foto em Instituto da Cerveja Brasil https://t.co/nVIrASZFxu
107,98392613,1529867358310899712,2022-05-26,"Fé…
caFÉ quente…
E Deus cuidando da gente❤️ #tbt #exposição #beyondvangogh #cafévônino #morumbishopping #arte #amomuitotudoisso #sãopaulo #sampa #essepê #férias #maio #2022 em Shopping Morumbi https://t.co/kqkhd95tmG"
108,851798584597020673,1529865287029383169,2022-05-26,"Perfeito 😍😋 @leandro_fvasconcellos 
#SamsungMembers
@samsungbrasil em Barbacoa Grill https://t.co/bRDjBK44DB"
109,145310619,1529863684067139584,2022-05-26,🏝🛬 Pra algum lugar em paz!
110,48795141,1529827684058120192,2022-05-26,Dia de conhecer o time ❤️ https://t.co/McxtGhTcxW
111,143130371,1529821318723649537,2022-05-26,Hora do café !Velha guarda ainda sobrevive !! em Tv Globo https://t.co/23pS37jqeI
112,1081903915816443904,1529818864472629249,2022-05-26,Acabou de publicar uma foto em Brasília https://t.co/4GNAmGrfqy
113,1494774540236427268,1529810317622054913,2022-05-26,"https://t.co/Q3yCGrBkGf
#vemprafatec #fatecitatiba #itatibasp #jarinú #morungaba #louveirasp #jundiaí #varzeapaulista #atibaia #varzeapaulista #valinhos #vinhedo #itupeva em Itatiba, SP https://t.co/YTDqOGUgyj"
114,3895005683,1529801686377762819,2022-05-26,Acabou de publicar uma foto em Vila Olímpia - Zona Sul SP https://t.co/AmPJWS5F8A
115,53353970,1529789233845747712,2022-05-26,"""Liberdade de voar num horizonte qualquer, liberdade de pousar onde o coração quiser.""

Cecília Meireles em Aéroport international de Congonhas https://t.co/9lwBwGuAua"
116,3354920057,1529782450569859073,2022-05-26,"O @InfinityAsset #DailyDrops, informação na velocidade do mercado financeiro - 26/05/2022 com @JasonVieira https://t.co/GKj8htOCzD"
117,3240827291,1529781048430710785,2022-05-26,Acabou de publicar uma foto em Carro 0 https://t.co/4PEWrJDMal
118,1133548983345930245,1529777434433921028,2022-05-26,"Esse perfil é patrocinado pelo SAVANA ,fazendo a felicidade dos Tripulantes desde 1967 https://t.co/hP3wnqxJlS"
119,3240827291,1529756761816694785,2022-05-26,Acabou de publicar uma foto em Carro 0 https://t.co/MgjXqZgkmx
120,1510990551344111617,1529678386724995072,2022-05-26,"It is a pleasure to share this journey in search of knowledge and construction together with you!  

It was amazing and a lot of fun lunch, already waiting for the next one haha https://t.co/V1vpOuSkBL"
121,10224712,1529638138209083392,2022-05-26,Última noite minha com o time do @PicPayDev 😢 (até mês que vem) https://t.co/FjcOErIQLL
122,1347077785,1529632776990908418,2022-05-26,@andrewmrls Essa semana tá bem pesada
123,1347077785,1529632563307978752,2022-05-26,"Isso que esse tipo de notícia não me afeta. Mas, olha…fazia tempo que não tinha uma convergência de tanta tragédia"
124,1347077785,1529632560753655809,2022-05-26,Essa semana tá bem violenta
125,53561273,1529629696304074753,2022-05-26,Encontro com amigos maravilhosos depois de muito tempo! @si_vilela_ @simon.gamboaa @the.stormblessed @ THERA Berrini https://t.co/NHNVX6W37x
126,67623216,1529629154412572672,2022-05-26,Acabou de publicar uma foto em Futuro https://t.co/czUmSD8tzy
127,1347077785,1529621049922445312,2022-05-26,Esse video é tudo ❤️❤️❤️ @beltraomaria https://t.co/syswQ4ExGd
128,233383596,1529590180180594691,2022-05-25,Acabou de publicar uma foto em Brooklin São Paulo Z.sul https://t.co/U4P6u9DLY3
129,73493771,1529577985073979393,2022-05-25,"I'm at Pão de Açúcar - @paodeacucar in São Paulo, SP https://t.co/FaxE1WfGLq"
130,92516483,1529565089518452737,2022-05-25,Acabou de publicar uma foto em La Nonna Di Lucca https://t.co/K6jvjh0Jtg
131,1320154946973650944,1529516531356520449,2022-05-25,"Bengal Original Petclube 
Lindo filhote macho, amoroso, brincalhão e muito inteligente. 
Informações somente por whatsap 11 984854545
#petclubeamigo #petclubecattery #bengal #bengalcat #bengalkitten em Petclube https://t.co/2lbBwt853C"
132,120556049,1529512709464760321,2022-05-25,Acabou de publicar uma foto em Apamagis - Associação Paulista dos Magistrados https://t.co/4K9aUdo927
133,1397525438906384384,1529508807184891904,2022-05-25,"Flash pouse, Flash close. 

#model #modelo #vibes #thismoment em Vila Olímpia - Zona Sul SP https://t.co/THCe2WwcbC"
134,2935479502,1529505903325716481,2022-05-25,Acabou de publicar uma foto em Bourbon Street Music Club https://t.co/OP1wyrij0f
135,63588252,1529502017822920706,2022-05-25,"Música nova chegando!
registro com nosso querido Maestro #picapau 💕
@velocetterock

@jpsproducoes @paulodavidsoares #velocette #jpsproducoes #rock #pop #maestro #picapau em JPS studios https://t.co/45OP9Rxo0I"
136,254050963,1529500246828539904,2022-05-25,Acabou de publicar uma foto em Teatro Vivo https://t.co/2ogtQkdO74
137,23260002,1529493449984057344,2022-05-25,Vitamina D na hora do almoço em Infracommerce https://t.co/IChDa888zN
138,76103370,1529489546240565250,2022-05-25,Acabou de publicar uma foto em Bourbon Street Music Club https://t.co/cbtqQNVom1
139,76103370,1529488493973491714,2022-05-25,Acabou de publicar uma foto em Bourbon Street Music Club https://t.co/yKTzEXjEz1
140,76103370,1529485653783629824,2022-05-25,"Por motivos alheios a nossa vontade, o show do @EdinhoSantaCruz &amp; Banda que ocorreria essa 5ª feira (26.5) foi adiado, e nova data será anunciada em breve.

Informações: 11.5095.6100 em Bourbon Street Music Club https://t.co/P3NrnuGyzD"
141,76103370,1529477410130956288,2022-05-25,Acabou de publicar uma foto em Bourbon Street Music Club https://t.co/6PPtLER3li
142,76103370,1529476670557765636,2022-05-25,Acabou de publicar uma foto em Bourbon Street Music Club https://t.co/xEk611kTxx
143,318056797,1529461878170198018,2022-05-25,"I'm at Bio Ritmo in São Paulo, SP https://t.co/T1jvo4WyKM https://t.co/oiZzguESuv"
144,218114717,1529453698648252416,2022-05-25,Plum ameixa japonesa em Quinta da Garrafeira https://t.co/khvSDsBq8D
145,218114717,1529444985610854402,2022-05-25,Ótimo vinho combinando com essa taça de cristal em Quinta da Garrafeira https://t.co/cjBmbEI5S0
146,218114717,1529444670392107009,2022-05-25,Um bom Puglia e Manduria em Quinta da Garrafeira https://t.co/awvyzZDXQf
147,1268949106371833857,1529427495929495553,2022-05-25,Lembranças cearenses ❤️ https://t.co/wPXqvJadjn
148,1284261394012082176,1529425618990944256,2022-05-25,"Últimos dias em SP! 
Ainda na dúvida se até dia 27 ou 30/05, mas logo me despeço e logo volto!!
@acompanhante_sp https://t.co/FyjotjDruA"
149,23260002,1529423350816284673,2022-05-25,muito frio em NYC em Infracommerce https://t.co/126PCqTRAM
150,3354920057,1529418885014880257,2022-05-25,"O @InfinityAsset #DailyDrops, informação na velocidade do mercado financeiro - 25/05/2022 com @JasonVieira https://t.co/UMc0NV6oG1"
151,81813407,1529412239706542081,2022-05-25,Acabou de publicar uma foto em Zazou Moda Gestante https://t.co/urRQRpR2f9
152,2761447893,1529313899194986497,2022-05-25,"Ibira park Basket em Ibirapuera, São paulo https://t.co/f6pwC97z4c"
153,177423719,1529295327580364801,2022-05-25,Acabou de publicar uma foto em Mercado Persa Brasil https://t.co/Al1hkpiLXS
154,1502034708665876482,1529289893196832768,2022-05-25,"✨Se expressarmos gratidão pelo que temos, teremos mais por que expressar gratidão✨

Ótima noite,meus Cafeínados☕️❤️

Amanhã será um excelente dia pra apreciar O café+Gostoso de Sp,te espero😘📱⬇️
https://t.co/u8LdMqtNlt https://t.co/mrtgvGzBDu"
155,18066816,1529260847998042116,2022-05-25,Acabou de publicar uma foto em https://t.co/0FW43GkbL9.Lab https://t.co/8RkpdoIgTe
156,80595718,1529260765714128896,2022-05-25,Acabou de publicar uma foto em Sheraton São Paulo WTC Hotel https://t.co/DezCHZqy9n
157,177423719,1529252829528850433,2022-05-25,Acabou de publicar uma foto em Mercado Persa Brasil https://t.co/ul0g7HUceo
158,76103370,1529236471932145666,2022-05-24,Acabou de publicar uma foto em Bourbon Street Music Club https://t.co/lo0w36BPC7
159,76103370,1529235987884347392,2022-05-24,Acabou de publicar uma foto em Bourbon Street Music Club https://t.co/xEiqs9WOIt
160,163581731,1529228055813799938,2022-05-24,Acabou de publicar uma foto em Edificio Wilson Mendes Caldeira https://t.co/oY6T5s8UGL
161,1397525438906384384,1529209063606714370,2022-05-24,"Existe 3 coisas que nunca se volta atrás, uma pedra lançada, uma palavra dita e uma oportunidade perdida. em Vila Olímpia - Zona Sul SP https://t.co/FUssHPO4Sg"
162,254050963,1529185520403767300,2022-05-24,Acabou de publicar uma foto em Teatro Vivo https://t.co/iv9ZS5KaDC
163,43022979,1529185310772453377,2022-05-24,"Essa porra da #Méquizice é uma bosta. Pedi para adicionar coisa no meu sundea e demorou 15 min para fazerem. Passaram todos os pedidos na frente. 
Nenhum funcionário quer sair do padrão, não."
164,1427787156571971588,1529182769619906561,2022-05-24,Agora tá tudo explicado!!!! https://t.co/E05nQR2fRJ
