,author_id,tweet_id,created_at,text
0,3990485894,1635469098984394757,2023-03-14,"Represa Billings
Pq Línea Cantinho do Céu https://t.co/bGAF1xqePB"
1,203973686,1635042585944154112,2023-03-12,"I'm at Estação Grajaú (CPTM) - @cptm_oficial in São Paulo, SP https://t.co/P8vLt2avBv"
2,72342367,1634997246344433665,2023-03-12,"Chuva destruindo o Grajaú em São Paulo-SP. As imagens foram gravadas agora a pouco na Rua Sinfonia Italiana, próximo à Estação Mendes-Bruno Covas. https://t.co/E52UbiQsrm"
3,203973686,1634969759207895045,2023-03-12,I'm at Jardim Itajaí https://t.co/cLiRIhvEfH
4,458120859,1634959252812087296,2023-03-12,"grêmio em todas as partes
@PostaiRodrigo @Gremio https://t.co/PBq6Ct1xxT"
5,203973686,1634939120534290433,2023-03-12,I'm at Jardim Itajaí https://t.co/PIKMV6pXMO
6,203973686,1634933816056860672,2023-03-12,I'm at 6061- 10 Jd. Marilda https://t.co/dzO1iNSCKN
7,203973686,1634928699886964742,2023-03-12,"I'm at Terminal Grajaú in São Paulo, SP https://t.co/kfUYu795jf"
8,203973686,1634926327861231618,2023-03-12,"I'm at Estação Grajaú (CPTM) - @cptm_oficial in São Paulo, SP https://t.co/0fVGGL0Cl3"
9,1343028976059621382,1634765169346609152,2023-03-12,Migo ou Vida? https://t.co/sLodOw8S4O
10,824616143495299072,1634602037110292480,2023-03-11,"À un feu rouge au carrefour des avenues Lima et Kubitschek, quatre caméras identiques, l’une par dessus l’autre, formant un totem paresseux. Tournées vers la même direction, gentiment parallèles, chacune déterminée à ne pas être la première à se considérer comme en trop https://t.co/TvW21x5Ome"
11,1493095291750395929,1634352339589951490,2023-03-11,🖤☯️. https://t.co/eRX9Jsk7FV
12,72342367,1634316348225404929,2023-03-10,Enchente na minha rua no Jd São Bernardo - Grajaú - São Paulo-SP. https://t.co/0UKuE2kolt
13,1178285100875882497,1634095363505152001,2023-03-10,Eu tinha que ter parado nesse 3 copo 😍 https://t.co/bzta1AtOdb
14,809785193473175552,1634051735474806789,2023-03-10,Cadê o pessoal da zs https://t.co/usKPvojnf8
15,604716918,1633959156360118272,2023-03-09,achei bem chique essa casa de show
16,3434902756,1633493835488583682,2023-03-08,@amjBarcelona https://t.co/1ukkCqx39O
