,author_id,tweet_id,created_at,text
0,74325248,1530325838285225986,2022-05-27,Resenha pesada hein... em Schettini Luthieria https://t.co/MggUAlX0jd
1,2781992405,1530297371472666626,2022-05-27,Gratidão por mais uma semana finalizada 🙏 Bora pra casa descansar que amanhã é dia de folga... Uhuuuu... 😉 em Galpão Teo https://t.co/JUL9boAY9s
2,1073932409035472896,1530294345282334720,2022-05-27,https://t.co/srNwnuDQ1h
3,16564364,1530263020517064704,2022-05-27,Hoje tem @odysseyfesta na @casadaaluz. Vou tocar com os amigos @malo_aka_bueno e @barbo_sergio. Bora ouvir anos 80 e 90 conosco? em Casa da Luz https://t.co/S37hM0vooN
4,82468496,1530236207166279681,2022-05-27,Término da atualização profissional!!! em Emforvigil S.A. https://t.co/FZCzYn8NFZ
5,20783135,1530215434192134147,2022-05-27,É... vou ter que assinar a @disneyplusbr em Estação da Luz https://t.co/rNN1QCOjNR
6,52058931,1530187532708741122,2022-05-27,https://t.co/XNEguqDFdX
7,1164167497,1530179596074684416,2022-05-27,Acabou de publicar uma foto em Sobral - CE https://t.co/EGV9XjW3Ic
8,1448969742367268879,1530169929135169538,2022-05-27,Acabou de publicar uma foto em Campos Elísios (bairro de São Paulo) https://t.co/vrITGcCJxr
9,1145008392295071744,1530160437311983616,2022-05-27,"📽️ vídeo 24

Contatinho do Grindr 😊.
(Já tinha postado esse vídeo, mas exclui para fazer uma alteração).

👉Apoio: 
@Otavio692x
@jf69hot
@hot_connection2
@xxx_men_pt
@new_gaywanking
@gwdobrasil
@brotheragensbr 
@opornstarbrasil https://t.co/oHIMsoLJ6T"
10,1504044626973540356,1530116599830695938,2022-05-27,Acabou de publicar uma foto em Sobral - CE https://t.co/Ord4H2QZ0x
11,1498413243215327235,1530016029157388288,2022-05-27,"O FLUMINENSE ESTÁ ELIMINADO DA SUL-AMERICANA ❌

#FutebolNaESPN em Eliminado https://t.co/r7iVOkaUaK"
12,1133183480186232832,1529970600063688746,2022-05-26,Acabou de publicar uma foto em Athelier das Noivas https://t.co/oqqrFTnLFu
13,1133183480186232832,1529967407288164353,2022-05-26,Acabou de publicar uma foto em Athelier das Noivas https://t.co/Dw8DeZcODs
14,1133183480186232832,1529966935282180123,2022-05-26,Acabou de publicar uma foto em Athelier das Noivas https://t.co/Pa3HBVxGLr
15,1133183480186232832,1529965241848709120,2022-05-26,Acabou de publicar uma foto em Athelier das Noivas https://t.co/pu3eIr5zUC
16,1133183480186232832,1529964995798261796,2022-05-26,Acabou de publicar uma foto em Athelier das Noivas https://t.co/RPOFqIyPyc
17,908072845443567616,1529959710153138178,2022-05-26,"Brainstrom, a estreia.

Hoje, às 22h, alí no Boteco Pratododia, eu faço o set de abertura do baile.
E lá vou estar ao lado de ninguém menos que @djnyack e @DevinJMorrison.

Entrada R$25 a noite toda, fechou?
Cheguem cedo, casa sujeito a lotação.

💜 https://t.co/6CDPgv7uH7"
18,1420869957609574401,1529936832376586247,2022-05-26,Privatizar nossas empresas públicas não vai diminuir o preço da gasolina nem resolver os problemas do Brasil. É preciso parar de mentir para o povo. #LulaNoPrimeiroTurno #Lula13Presidente https://t.co/xoNNu6jRkl
19,1420869957609574401,1529935399421984775,2022-05-26,"O professor vai dar aula de gestão!

Quem concorda, curte, comenta e compartilha 🔁

#TôComHaddad #TôComOProfessor #MudaSP https://t.co/vsIsgaH6wg"
20,1420869957609574401,1529934555821486081,2022-05-26,"O professor vai dar aula de gestão!

Quem concorda, curte, comenta e compartilha 🔁

#TôComHaddad #TôComOProfessor #MudaSP https://t.co/g5F9L4O5GJ"
21,1225416173749182467,1529899550739247138,2022-05-26,"Ela é marrom, dona de si mesma, tudo de bom 🎶 em Pinacoteca https://t.co/AQsbjgvlPQ"
22,920597438439804928,1529858416591654915,2022-05-26,Acabou de publicar uma foto em Prato Grego https://t.co/wAF9PAFfCS
23,69044546,1529857936511619074,2022-05-26,3ª 💣 ressurgiu já.. kkk graças cachaça mundial dourada 😜!! 4ª 🥥🌴 #Monstrinha29 5ª Pança caibra’s attacks again.. na feijuca #FridayNight Sabadão Samba de roda #Esperia #NiverParte2 &amp; DomingãoO na paulista ao som da @BandaCarlos_ 🔝zera 🎸🥰 passeio em família Bella Maria 🐶💜
24,1164167497,1529856305002958849,2022-05-26,Acabou de publicar uma foto em Sobral - CE https://t.co/qDD5Ay32A2
25,237344665,1529812782014767109,2022-05-26,#abrint2022 em Expor Center Imigrantes https://t.co/MujgomJmT0
26,52058931,1529798916526559234,2022-05-26,https://t.co/HNzz5cw4h7
27,1164167497,1529782736331886593,2022-05-26,Acabou de publicar uma foto em Sobral - CE https://t.co/7osMxZJMS1
28,1133183480186232832,1529612587373035520,2022-05-25,Acabou de publicar uma foto em Athelier das Noivas https://t.co/bt4PCio9xJ
29,1133183480186232832,1529612226319073283,2022-05-25,Acabou de publicar uma foto em Athelier das Noivas https://t.co/LLZ8TBZpUI
30,1133183480186232832,1529612028280770560,2022-05-25,Acabou de publicar uma foto em Athelier das Noivas https://t.co/CPiddTfygq
31,387053377,1529607940025491456,2022-05-25,Acabou de publicar uma foto em Smart Fit https://t.co/RbTQm7IC17
32,40812013,1529598407991513093,2022-05-25,"O meu exemplar do ""Troféu Raça Negra"", da @universidadezumbioficial e @afrobras . em Universidade Zumbi Dos Palmares https://t.co/42U4GkCcnX"
33,143443643,1529568330272620548,2022-05-25,Acabou de publicar uma foto em Estação Júlio Prestes https://t.co/dLqEGxcmcB
34,1474457047198576643,1529557075315007489,2022-05-25,Acabou de publicar uma foto em Bom Retiro https://t.co/crbK6KtiUB
35,158075053,1529480429631307780,2022-05-25,Acabou de publicar uma foto em A Casa De Babette https://t.co/IAYMaUsxzd
36,52058931,1529471968973553665,2022-05-25,https://t.co/DJNhef4JW6
37,1448969742367268879,1529433434376097797,2022-05-25,Acabou de publicar uma foto em Campos Elísios (bairro de São Paulo) https://t.co/rdXb4iQDf3
38,1504044626973540356,1529396468699877377,2022-05-25,Acabou de publicar uma foto em Sobral - CE https://t.co/2IANXGmOo6
39,1133183480186232832,1529254184037634049,2022-05-25,Acabou de publicar uma foto em Athelier das Noivas https://t.co/QTuVmBZlXD
40,1133183480186232832,1529254059785474048,2022-05-25,Acabou de publicar uma foto em Athelier das Noivas https://t.co/1wSzYktaGw
41,1133183480186232832,1529253855522848768,2022-05-25,Acabou de publicar uma foto em Athelier das Noivas https://t.co/nCFnMna9bE
42,1133183480186232832,1529251898158612481,2022-05-25,Acabou de publicar uma foto em Athelier das Noivas https://t.co/cD1c2bD4Tr
43,1133183480186232832,1529229868596092928,2022-05-24,Acabou de publicar uma foto em Athelier das Noivas https://t.co/jyijLJz0ky
44,1133183480186232832,1529229605013528577,2022-05-24,Acabou de publicar uma foto em Athelier das Noivas https://t.co/0SVZ5lQ2D9
45,1133183480186232832,1529229312561500160,2022-05-24,Acabou de publicar uma foto em Athelier das Noivas https://t.co/0hVpCXFU0e
46,17626269,1529219391203983362,2022-05-24,"big bang theory rodando non stop cobertorzin cheroso, janela aberta e no aguardo das flores. folguinha perfeitinha, cabecinha tranquilinha"
47,16564364,1529181045362413570,2022-05-24,"Sexta feira, eu irei tocar na festa de anos 80 e 90 @odysseyfesta com os amigos @barbo_sergio e @malo_aka_bueno. Ingressos a venda na bio da página da @odysseyfesta. ❤️ em Casa da Luz https://t.co/61fkDGVuwX"
48,282198621,1529145811409461248,2022-05-24,Acabou de publicar uma foto em Campos Elísios (bairro de São Paulo) https://t.co/mHrXUt8AyW
49,69428565,1529143409164042242,2022-05-24,Acabou de publicar uma foto em GRÊMIO GAVIÕES DA FIEL TORCIDA https://t.co/WA85yssLIx
50,1448969742367268879,1529121994351865856,2022-05-24,Acabou de publicar uma foto em Campos Elísios (bairro de São Paulo) https://t.co/x6AQwvObc5
51,1333826453809623042,1529119195643928576,2022-05-24,https://t.co/yaBT7werZ1
52,270356782,1529105640655708160,2022-05-24,Acabou de publicar uma foto em Pinacoteca https://t.co/yAdotQjuOe
53,1268557713744723968,1529094398394474499,2022-05-24,@escritosrame @MelendiNando https://t.co/FGq8Q53z7O
54,52058931,1529080448390922240,2022-05-24,https://t.co/cICvC4g3YO
55,33290764,1528944049733918721,2022-05-24,Ainda sobre sábado https://t.co/aeJBuksRiX
56,39899805,1528941819194744832,2022-05-24,Registro de uma segunda-feira fria mas cheia de fofura 🐶 em Campos Elísios (bairro de São Paulo) https://t.co/TPvoLUnMlM
57,9263792,1528881157462695936,2022-05-23,boa noite. https://t.co/nrjkJ5ubM2
58,76481710,1528826816156385280,2022-05-23,Acabou de publicar uma foto em Hotel Prince Tower https://t.co/cdDNMl4dY2
59,136773661,1528800731754635267,2022-05-23,"Estações Bonitas Demais ®
E Homens Não Tão Fotogênicos Quanto A Estação © em Estação da Luz https://t.co/6scq2i9T0H"
60,2214807172,1528799925685096449,2022-05-23,"Quem é de São Paulo e ainda não viu a exposição da Adriana Varejão na @pinacotecasp, veja! Tem obras inéditas e trabalhos nunca expostos anteriormente. Até 01.08. #SegundaFeira https://t.co/uTj1uGf0gz"
61,1504044626973540356,1528664303179550720,2022-05-23,Acabou de publicar uma foto em Sobral - CE https://t.co/B6m9z1QGB8
62,33290764,1528598746807902212,2022-05-23,Ai eu tenho uma puta queda por P&amp;B https://t.co/7BoSUScYA7
63,33290764,1528596258805391360,2022-05-23,Também teve essa https://t.co/9vIKxT3qyg
64,339183004,1528551840723632130,2022-05-23,Acabou de publicar uma foto em Castelinho da Rua Apa https://t.co/KT8MrzbfzM
65,1455234068812111883,1528495699851104259,2022-05-22,Bora PAPÃO @Paysandu 💙🤍 https://t.co/sHp9qPz3t7
66,18688345,1528494730237050881,2022-05-22,Momentos mágicos com @ju_moranguete e @fernandohorsao ouvindo o coro da @osesp_ em Sala São Paulo https://t.co/9WH90OOcYM
67,1103561379028574208,1528473357041209347,2022-05-22,Kikikikiki https://t.co/yrS5VhfAvS
68,40726387,1528440002207694848,2022-05-22,amo os meus amigos https://t.co/0DDx6432k4
69,162424619,1528429243503345664,2022-05-22,Sunny Sunday https://t.co/m5RcvjfTOr
70,172561008,1528409030095429637,2022-05-22,Muerta https://t.co/jko2E2wUrd
71,42611569,1528400856038637570,2022-05-22,Vem gente… https://t.co/YTgqPmaI0Y
72,254807654,1528384023277588483,2022-05-22,https://t.co/WJXsHN4vjU
73,71581273,1528352516370534401,2022-05-22,Acabou de publicar uma foto em Museu da Língua Portuguesa https://t.co/jFionXF6XC
74,1034228671278669825,1528178304766955520,2022-05-22,"Hoje foi o aniversário do nosso More e grande Chazan Samy Citman!!!
Mazal Tov ve Siman Tov💙✡ https://t.co/IkTDdfsvNe"
