,author_id,tweet_id,created_at,text
0,38993755,1540484690410622977,2022-06-24,Bate-papo com @antonionetopdt! https://t.co/v0c1UAQBKf
1,28688054,1540483226933891073,2022-06-24,✨ https://t.co/agdAHViZU1
2,28688054,1540483074403737601,2022-06-24,Orquestra de São Paulo com meu maridão ❤️💙 https://t.co/WkGdEEZ0r1
3,1112662343446614019,1540480488015405056,2022-06-24,Acabou de publicar uma foto em Sobral - CE https://t.co/bXsPPkCBIk
4,248824571,1540476320139943939,2022-06-24,Aqui no @sindpd com @antonionetopdt... Vamos pra cima #TurmaBoa https://t.co/ic7IY9fLny
5,16595668,1540475619607285764,2022-06-24,"Ela foi regente aqui da Sala São Paulo e era um prazer quando tinha concerto com ela (pq eu não conseguia pegar muitos 💰). E no meio das descobertas do filme soube que ela criou uma bolsa para mulheres regentes e que a Valentina Peleggi, regente do coro, foi beneficiada por essa"
6,16595668,1540475616838959105,2022-06-24,"Tweetando da @osesp antes do concerto pra avisar que ""The Conductor"" sobre a Marin Alsop teráo outra sessão amanhã na programação do @InEditBrasil e eu se fosse vcs veria. Achava ela ótima, depois do filme acho ela ainda mais foda! 1ª mulher a reger uma grande orquestra nos EUA! https://t.co/Dy8nywHHpL"
7,91267816,1540474044700557315,2022-06-24,@antonionetopdt agora aqui no sindpd ouvindo o povo jovem https://t.co/qeOuoc8nQM
8,1420927006535995398,1540401922628354048,2022-06-24,"I'm at Flor Café in Sao Paulo, SP https://t.co/5MXlRzEFdE"
9,1420927006535995398,1540383486321852417,2022-06-24,"I'm at Pinacoteca de SP in São Paulo, SP https://t.co/t8vkgtqnW0"
10,282198621,1540379100703264768,2022-06-24,Acabou de publicar uma foto em Campos Elísios (bairro de São Paulo) https://t.co/0OTCw5t7R3
11,1445743452004618245,1540364469330554881,2022-06-24,Acabou de publicar uma foto em Central Caos https://t.co/oFBdBVBiDW
12,743178570093072384,1540362809715851264,2022-06-24,"I'm at Pinacoteca de SP in São Paulo, SP https://t.co/Dxq1tJDN7B"
13,66542051,1540358426093551616,2022-06-24,Colegas de trabalho! https://t.co/3vlmHjOnXg
14,1133183480186232832,1540345846016790528,2022-06-24,Acabou de publicar uma foto em Athelier das Noivas https://t.co/KCgF8XblAw
15,1133183480186232832,1540345396412784640,2022-06-24,Acabou de publicar uma foto em Athelier das Noivas https://t.co/b867lfJK4A
16,1133183480186232832,1540344995676569600,2022-06-24,Acabou de publicar uma foto em Athelier das Noivas https://t.co/Ml4bqNxUvR
17,1133183480186232832,1540344269659160576,2022-06-24,Acabou de publicar uma foto em Athelier das Noivas https://t.co/957NeG2KGl
18,1133183480186232832,1540344173831798784,2022-06-24,Acabou de publicar uma foto em Athelier das Noivas https://t.co/ejhWSU5kti
19,1133183480186232832,1540344051106545665,2022-06-24,Acabou de publicar uma foto em Athelier das Noivas https://t.co/YSCy9n0y1I
20,1133183480186232832,1540343905903853568,2022-06-24,Acabou de publicar uma foto em Athelier das Noivas https://t.co/RKdw2JZYKV
21,1133183480186232832,1540338305845399553,2022-06-24,Acabou de publicar uma foto em Athelier das Noivas https://t.co/G7ICxeQ8a0
22,74325248,1540324910290968576,2022-06-24,Acabou de publicar uma foto em Schettini Luthieria https://t.co/E65rRIJpbl
23,74325248,1540315622453788672,2022-06-24,Acabou de publicar uma foto em Schettini Luthieria https://t.co/qgeyhda6Wd
24,1112662343446614019,1540275156618301442,2022-06-24,Acabou de publicar uma foto em Sobral - CE https://t.co/Jzp8d7cnye
25,23001395,1540151161671532544,2022-06-24,Acabou de publicar uma foto em Teatro Popular Uniao E Olho Vivo https://t.co/OKWmi4eVmM
26,14177719,1540126521159032832,2022-06-24,Bloody Mary https://t.co/Y4h5UGUb2P
27,2214807172,1540108746009055232,2022-06-23,Meu bairro está assim! @LulaOficial #VaiSerNoPrimeiroTurno #LulaNoPrimeiroTurno https://t.co/9JsWPtLZfR
28,1474457047198576643,1540073455281913857,2022-06-23,Acabou de publicar uma foto em Bom Retiro https://t.co/aykZqHnfNu
29,1034228671278669825,1539978655404785664,2022-06-23,Estoque renovado !!! https://t.co/qdI3Sf0QJL
30,2267384157,1539965368898306050,2022-06-23,"Olá, Cecíliers! https://t.co/kdTTeD8N1f"
31,1005823371144318977,1539960685207101440,2022-06-23,https://t.co/2Iyr1FOZcp
32,1005823371144318977,1539955687391887360,2022-06-23,https://t.co/Y6Ds5angcE
33,1035634444315570181,1539918804838400004,2022-06-23,Sobre a noite de ontem! 🥰🎼 https://t.co/W4tooeawKn
34,1504044626973540356,1539911117866209281,2022-06-23,Acabou de publicar uma foto em Sobral - CE https://t.co/1tX3l3jc1O
35,1061087437454221312,1539809473820237825,2022-06-23,Algum macho ativo afim de real agora!! Tô em São Paulo próximo a estação da luz
36,596894572,1539761415472517121,2022-06-23,Just posted a photo @ Skate - Centro De Esportes Radicais https://t.co/qw96j1Abj1
37,20743783,1539735494640209920,2022-06-22,"Marginal Tietê.
Ponte Orestes Quércia. https://t.co/tHA5QpJ7S2"
38,245975911,1539714255397814272,2022-06-22,"Oi quarta dose, sua linda! 💉❤️ em Sta. Cecilia - SP https://t.co/3K4jwPB3Ac"
39,327436826,1539711499219902465,2022-06-22,4 e pouco. em Museu da Língua Portuguesa https://t.co/ywT7TLrv35
40,736635987745476608,1539682739296899073,2022-06-22,Acabou de publicar uma foto em Parkour Park - Centro de esportes radicais https://t.co/5l4O5K4vqb
41,74325248,1539652140477693953,2022-06-22,"Extração concluída com sucesso.
Agora é a vez de pegar o formão e esculpir. em Schettini Luthieria https://t.co/ER6Xp1rApp"
42,74325248,1539647251076743170,2022-06-22,Acabou de publicar uma foto em Schettini Luthieria https://t.co/92UkTfXWBB
43,1164167497,1539589697638367233,2022-06-22,Acabou de publicar uma foto em Sobral - CE https://t.co/fy0Idtbxbn
44,18688345,1539558393488089088,2022-06-22,Acabou de publicar uma foto em Estação da Luz https://t.co/7Jvd3gccLv
45,18688345,1539557676849455104,2022-06-22,Acabou de publicar uma foto em Estação da Luz https://t.co/vXZOwJAjFu
46,115146921,1539463972616712193,2022-06-22,"Um pouco de #biscoito pré #pandemia kkkk 
#masculicidade em Brutus PARTY https://t.co/oApqqGr6OO"
47,50791870,1539403791094644738,2022-06-22,Back. Orchestre Philharmonique Real de Liège. Chopin Piano Concerto No. 1 and Brahms Symphony No. 2. https://t.co/aZnDvKny1W
48,18688345,1539331751482380289,2022-06-21,Acabou de publicar uma foto em Museu da Língua Portuguesa https://t.co/RpK9glbbmc
49,36417316,1539331686864936961,2022-06-21,Férias em São Paulo = visitar museus. em Museu da Língua Portuguesa https://t.co/SaLE2i5ZMu
50,1536881722364682240,1539313955021017088,2022-06-21,https://t.co/TJK0Vcdoeb
51,920597438439804928,1539286981007577093,2022-06-21,Acabou de publicar uma foto em Bom Retiro Capital https://t.co/U0xcE7bQdG
52,3001943555,1539257688470831105,2022-06-21,Acabou de publicar uma foto em Empório Grego https://t.co/i24PAzg0AO
53,41819297,1539203994312007680,2022-06-21,"Sky so blue
.
.
.
.
#skyline #travelgram en Away https://t.co/ZQ2ZZOBR9e"
54,74325248,1539184320656580609,2022-06-21,Acabou de publicar uma foto em Schettini Luthieria https://t.co/k6Qyi8hFCD
55,1504044626973540356,1539167761720549377,2022-06-21,Acabou de publicar uma foto em Sobral - CE https://t.co/0500ARomts
56,18688345,1539044688090505217,2022-06-21,Janelas… em Museu da Língua Portuguesa https://t.co/EWmnjazqrZ
57,282198621,1539021621272485888,2022-06-20,Acabou de publicar uma foto em Campos Elísios (bairro de São Paulo) https://t.co/NXzh1c6u1A
58,18688345,1538951285038272513,2022-06-20,Acabou de publicar uma foto em Museu da Língua Portuguesa https://t.co/zMe7lFMeKo
59,18688345,1538947210481651712,2022-06-20,Detalhes do nosso “Big-Ben”! em Museu da Língua Portuguesa https://t.co/ZJdC6otP7b
60,18688345,1538945249682259968,2022-06-20,Acabou de publicar uma foto em Museu da Língua Portuguesa https://t.co/7rreu9sLJd
61,18688345,1538944131719888896,2022-06-20,"Na sexta-feira fomos ap Museu da Língua Portuguesa. Ao final nos convidam para conhecer e terraço, e fomos brindados por esse lindo por do sol! em Museu da Língua Portuguesa https://t.co/s1wLCmGIgE"
62,18688345,1538921514682179587,2022-06-20,Acabou de publicar uma foto em Estação da Luz https://t.co/CWiCV8oWNX
63,18688345,1538916428824428545,2022-06-20,Cenas paulistanas. em Estação da Luz https://t.co/HHEvkY3qdn
64,1538818370673463296,1538889455699992576,2022-06-20,Alguém balança pra mim ? https://t.co/F35HxWL452
65,1164167497,1538876628327182336,2022-06-20,Acabou de publicar uma foto em Sobral - CE https://t.co/oXCUr5nqdq
66,1504044626973540356,1538819811773407233,2022-06-20,TAPETE PELEGO PELUDO PARA DECORAÇÃO E FOTO PROFISSIONAL em Sobral - CE https://t.co/PK3I9zF3tN
67,2214807172,1538722355043876864,2022-06-20,Tem um milhão de gaes nessa festa 😱 https://t.co/NLq4ny8alM
68,21415271,1538721220618764290,2022-06-20,"Boom Boom Kid

53/100 em Hangar 110 https://t.co/PqK5oJTs52"
69,8644932,1538719126897696768,2022-06-20,"Senhores, até flores chegaram pra festa 🥳 🎉 Valeeeeu Dri @adrianamel0 em Campos Elísios (bairro de São Paulo) https://t.co/muU0P4lhnC"
70,8644932,1538717009973682176,2022-06-20,"Sem bolinho não é aniversário!  🎂🍾🥂🥳
PS: camafeu substituindo brigadeiro, pode siiiiimmmm em Campos Elísios (bairro de São Paulo) https://t.co/ODlGVEA7IM"
71,18688345,1538709108588789760,2022-06-20,Compartilhando um pouco mais do Museu da Língua Portuguesa. em Museu da Língua Portuguesa https://t.co/WCMmCIrsJX
72,21415271,1538677306583142403,2022-06-20,"Garage Fuzz

52/100 em Hangar 110 https://t.co/sOxg7LRUmX"
73,21415271,1538657757376786440,2022-06-19,"In Venus

51/100 em Hangar 110 https://t.co/usMwDoPthl"
74,21415271,1538633191648595971,2022-06-19,"Boom Boom Kid (at @Hangar110 in São Paulo, SP) https://t.co/PwWlMHHIfv"
75,61178974,1538563802219761665,2022-06-19,Acabou de publicar uma foto em GRÊMIO GAVIÕES DA FIEL TORCIDA https://t.co/PrbEX5Haoz
76,1272619092114096132,1538543760317067267,2022-06-19,me mandaram uma boa do dia no horário do Corinthians... https://t.co/KVxGAcDl8j
77,1272619092114096132,1538540021665435648,2022-06-19,A MARO É FANTÁSTICA!!! https://t.co/YaRtbnWGwK
78,217871086,1538535779462524928,2022-06-19,😏💙 em Campos Elísios (bairro de São Paulo) https://t.co/igNQjIxWyr
79,47973912,1538522531749015552,2022-06-19,"Lúmen 🏮

📷 @annegodoneo em Hangar 110 https://t.co/sD3GUITHoY"
80,1033038950020079616,1538408324844392450,2022-06-19,https://t.co/yNk6sMw59N
81,18688345,1538343756856008705,2022-06-19,Acabou de publicar uma foto em Museu da Língua Portuguesa https://t.co/hCMU8HF7uX
82,18688345,1538325849535139840,2022-06-19,"Nossa história, repleta de erroe e absurdos e algumas pouquíssimas tentativas de reparação! em Museu da Língua Portuguesa https://t.co/sVvdnVqhs4"
83,379239422,1538304558501355520,2022-06-18,Acabou de publicar uma foto em Fresh Cake Factory https://t.co/wmVJBYRD0Z
84,18688345,1538279553608650753,2022-06-18,"Ziraldo, muito atual! em Museu da Língua Portuguesa https://t.co/80NvsESDi5"
