,author_id,tweet_id,created_at,text
0,133521856,1569822883018407936,2022-09-13,Just posted a photo @ Smart Fit https://t.co/DA1k191In6
1,1569684972688261120,1569687504630214661,2022-09-13,💪🏼💪🏼💪🏼 https://t.co/Ik977cN8dH
2,1564581831286063106,1569613156418207744,2022-09-13,"Vamos de bom dia, passear por São José dos Campos hoje....😈😈🔥🔥🔥 https://t.co/b1D1DvNMfK"
3,727083578278993920,1569606674213904384,2022-09-13,Bom dia em Parada Inglesa https://t.co/HSSyD34rnm
4,130738907,1569430858012192768,2022-09-12,Acabou de publicar uma foto em DiHero House https://t.co/v1aWFtIqS3
5,1564581831286063106,1569258884501479424,2022-09-12,"E vamos de bom dia, naquele tesão louco..... https://t.co/Di52tIMbjv"
6,727083578278993920,1569243646792450048,2022-09-12,Bom dia em Parada Inglesa https://t.co/0aWvjwY7qX
7,43470333,1569038690042761223,2022-09-11,Acabou de publicar uma foto em Vila Nivi https://t.co/BfLsuQ1JQY
8,23260002,1569017250925117441,2022-09-11,pensando em como vamos pagar a conta em Jangada do Velho Chico https://t.co/eEqBDp7imt
9,727083578278993920,1568922509176619009,2022-09-11,Bom dia em Jaçanã https://t.co/xyb4w505ir
10,78718386,1568841692090073088,2022-09-11,"Quase 3h da vontade de tomar o tal do gin do Guidini, o que eu fiz? Vim"
11,727083578278993920,1568736540947525632,2022-09-10,Boa noite em Jaçanã https://t.co/a7l1iSX06A
12,15430166,1568732150094241792,2022-09-10,🍽 | @mocotorestaurante em Mocotó Bar e Restaurante https://t.co/Afl4BMCXdH
13,15430166,1568707146610790400,2022-09-10,"I'm at Mocotó Restaurante &amp; Cachaçaria - @rodrigomotoco in São Paulo, SP https://t.co/lga6LmVrJU https://t.co/i5e82svF3s"
14,133426384,1568690378576101377,2022-09-10,Acabou de publicar uma foto em Tucuruvi | Zona Norte https://t.co/AZwYNxXCU7
15,163312074,1568660873564291072,2022-09-10,Acabou de publicar uma foto em Vila Medeiros https://t.co/niC1r4tPei
16,1176623633168576512,1568654072974131201,2022-09-10,"Transistindo
@ErikakHilton 🏳️‍⚧️💕 https://t.co/31awRbsMSD"
17,1194339711722151936,1568604941522026496,2022-09-10,10.❤️enjoy! LoviU Y'Äll https://t.co/kHSBD0Qwcd
18,727083578278993920,1568558829679378432,2022-09-10,Bom dia em Jaçanã https://t.co/pynD56Kbma
19,727083578278993920,1568396526543687680,2022-09-10,Boa noite em Jaçanã https://t.co/RcwzMui5vZ
20,1313545550063693826,1568325994121150465,2022-09-09,Batata ❤ em Vila Mazzei https://t.co/xX7SAgEL5H
21,13427702,1568172076019892224,2022-09-09,Acabou de publicar uma foto em Parque Vitória https://t.co/r9V3GCGzaM
22,727083578278993920,1568155949835210753,2022-09-09,Bom dia em Parada Inglesa https://t.co/tcA8EoEjlI
23,74441013,1568038645902282754,2022-09-09,"Não precisa mais de máscara no ônibus

Eu: ATÉ QUE ENFIM PORRA https://t.co/PLA6cWRvNu"
24,727083578278993920,1568016052524650499,2022-09-08,"Boa noite, daqui a pouco tem o programa Dreams of Love comigo e DJ Valdeci, venha conosco curtir as melhores melodias, acesse a rádio Rádio Hot Sounds https://t.co/q7hXKoBLEN em Jaçanã https://t.co/YuNjaEld6M"
25,33325255,1567700540653539329,2022-09-08,Acabou de publicar uma foto em Smartfit https://t.co/wqTSGmvKp6
26,727083578278993920,1567665285074767873,2022-09-08,Boa noite em Jaçanã https://t.co/iuye5fcQiq
27,1560762378182066178,1567646039783444486,2022-09-07,Meu fofo #MEUPETNOCIDADEALERTA https://t.co/AXkvtHpLSk
