,author_id,tweet_id,created_at,text
0,362798663,1560032897871990784,2022-08-17,Acabou de publicar uma foto em Tucuruvi (São Paulo Metro) https://t.co/DH3ls9KIq5
1,1420869957609574401,1559866128834482177,2022-08-17,"O primeiro voto que o @LulaOficial pediu foi pra @JanjaLula. Ele acordou ela à 0h e 1 minuto do dia 16/08 e disse: ""Janjinha, eu quero seu voto"", disse #LulaPresidente13 em entrevista na Rádio Super de MG. É uma figura esse cara, fala sério kkkkk."
2,727083578278993920,1559823297373765632,2022-08-17,Bom dia em Parada Inglesa https://t.co/xbluMSoWTA
3,245619512,1559705580884750336,2022-08-17,💁🏼‍♀️ em Tucuruvi | Zona Norte https://t.co/z9oi0fWcrN
4,727083578278993920,1559700461116162052,2022-08-17,Boa noite em Jaçanã https://t.co/DP03MPdt7z
5,14220748,1559698214856556549,2022-08-17,"I'm at Sergin Carne, Breja E Rock'n Roll in São Paulo w/ @alesqui https://t.co/yvg2XEtimL"
6,93786108,1559644412115910660,2022-08-16,Acabou de publicar uma foto em Tucuruvi | Zona Norte https://t.co/sBvszHMTrW
7,25042231,1559631841719615488,2022-08-16,Dia de acompanhar as beneficiárias do Transcidadania @cclgbtinorte para início de estágio/ vivência profissional no Descomplica. Uma excelente iniciativa e parceria que tem rendido ótimos resultados! 😍🌈✌🏼 https://t.co/JO8JwJYfcz
8,71054287,1559630584846209026,2022-08-16,Acabou de publicar uma foto em Feiras Industriais https://t.co/0x53pppbof
9,65201001,1559609090036342784,2022-08-16,"A Senhora vai sair dessa vozinha 😭🙏🏻 (@ Hospital Presidente in São Paulo, SP) https://t.co/0qg95yJder https://t.co/3oTig1jl0A"
10,43711008,1559535626592174081,2022-08-16,Acabou de publicar uma foto em Sesc Santana https://t.co/MmJ1lHJIri
11,719427905760202752,1559503475154849799,2022-08-16,Acabei de publicar uma foto em Vila Mazzei https://t.co/mhzaXWy06L
12,727083578278993920,1559460891443269633,2022-08-16,Bom dia em Parada Inglesa https://t.co/QNesiXnGst
13,838084496079654912,1559415890185166848,2022-08-16,"#havaianas
@studiosone.digital 
@fabricando_liberdade 
@origemtecnologia 
@renan.ssz 
@teressa_mendes em Alfamidiavisual https://t.co/XoWe0FB4tl"
14,727083578278993920,1559324412855336967,2022-08-15,Boa noite @ Jaçanã https://t.co/cjv11lPQ5Q
15,1644110526,1559299528687329282,2022-08-15,Acabou de publicar uma foto em Vila Gustavo - Parada Inglesa https://t.co/zCHuziT24X
16,727083578278993920,1559098075993587713,2022-08-15,Bom dia em Parada Inglesa https://t.co/qW0VrAjA1x
17,1519884887959953408,1559027688559591425,2022-08-15,Prazer Mirella Mak 🔥 https://t.co/R2DJ9eyHB5
18,51430514,1559019845064298496,2022-08-15,#escolhaseconsequências em Tucuruvi | Zona Norte https://t.co/c4YCWwe8d9
19,321236518,1558954398235213826,2022-08-14,"Não tenho legendas para descrever o dia de hoje, só agradecer 🙏🙏 
Obrigado Deus por permitir tudo isso 😁🙌 em Shopping Metro Tucuruvi https://t.co/mVHFOFqL4A"
20,51430514,1558949481747456000,2022-08-14,#escolhaseconsequências em Tucuruvi | Zona Norte https://t.co/2WwKWjWjCq
21,3371594355,1558927050647511040,2022-08-14,Acabou de publicar uma foto em Vila Mazzei https://t.co/Odz8YJlAlQ
22,4048550813,1558889747686244355,2022-08-14,De volta p minha terrinha 😮‍💨 https://t.co/x3jyyDGkta
23,37031702,1558821949089906695,2022-08-14,"Feliz dia dos Pais, em especial ao meu Pai, Félix.
Que Deus abençoe e ilumine todos os Pais do planeta em Mocotó Bar e Restaurante https://t.co/Jv1kP705K0"
24,1558786842614550528,1558788954547228673,2022-08-14,Gratidão 😘 https://t.co/82cgrFQr8H
25,727083578278993920,1558784351873257472,2022-08-14,"Saudades pai, e para aqueles que ainda tem os seus pais respeitem e cuidem bem deles, um feliz dias dos pais pra todos em Jaçanã https://t.co/sNmOftM9Iv"
26,727083578278993920,1558774520512651264,2022-08-14,Bom dia e feliz dia dos pais em Jaçanã https://t.co/1DoiR8pJMx
27,252806783,1558652223768461313,2022-08-14,SabadoouuUU https://t.co/nLDEZPdx7Z
28,727083578278993920,1558625918775693314,2022-08-14,Boa noite em Jaçanã https://t.co/OggmNz1qP7
29,143248942,1558623462792597504,2022-08-14,Sigo me apoiando no que me mantém de pé atrás da positividade sem que eu perca minha fé ✨ em Vila Maria Alta https://t.co/Tg0usg310a
30,67895112,1558583501686988803,2022-08-13,Peça de hoje https://t.co/lyRvX1WjMn
31,76763647,1558556104409452546,2022-08-13,Acabou de publicar uma foto em IASD Tucuruvi Oficial https://t.co/WhUqh2oRbg
32,3387282047,1558541283228061703,2022-08-13,😎 em Inova Bar https://t.co/jsjILMYMzT
33,30791137,1558404352666177536,2022-08-13,Passeando! en Trimais Places https://t.co/gwfaszid96
34,30791137,1558403076846919681,2022-08-13,"GatoCat en Cantareira, Sao Paulo, Brazil https://t.co/dpcIUtR02P"
35,1484263804187942912,1558164205894881281,2022-08-12,O fim de um ciclo sempre trás o início de um novo caminho. https://t.co/YwIrx6gEe4
36,1513391481645588480,1558060332572082176,2022-08-12,"a xeury lançou a carecagem 

@cherryrar https://t.co/PeAuBmuav2"
37,1521521058066710528,1558046327715635202,2022-08-12,Oh happy day
38,727083578278993920,1558010884232036354,2022-08-12,Bom dia em Parada Inglesa https://t.co/KUP9MrtLOe
