,author_id,tweet_id,created_at,text
0,838084496079654912,1549461160272994307,2022-07-19,"#alfamidiavisual 
#letrapvcexpandido
#painelacrilico em Alfamidiavisual https://t.co/Ri2NRzbAsE"
1,2405282319,1549396960897110018,2022-07-19,"Noite abençoada pelo Espírito Santo!
Meu coração transbordando de gratidão vendo minha família servindo ao Rei do universo, Jesus Cristo!🙌🏻🙏🏻❤️🖐🏻🖐🏻🖐🏻🖐🏻 em IASD Tucuruvi Oficial https://t.co/zkAg6I8bXe"
2,162029205,1549396645347049472,2022-07-19,Não me acompanha que não sou novela em SkalFit Academia https://t.co/zxnsvLvMWi
3,43470333,1549348326297849856,2022-07-19,Acabou de publicar uma foto em Vila Nivi https://t.co/xVBPECuyGc
4,43470333,1549348008323694593,2022-07-19,Acabou de publicar uma foto em Vila Nivi https://t.co/ZpsiBUnAMP
5,727083578278993920,1549313995902922753,2022-07-19,Bom dia em Parada Inglesa https://t.co/CJf4xvIeHI
6,1124741493418332165,1549218652024709120,2022-07-19,BH https://t.co/Jj8wyh47pF
7,43711008,1549185097152225280,2022-07-19,Acabou de publicar uma foto em Sesc Santana https://t.co/W9CTgALU6T
8,727083578278993920,1549181729025449984,2022-07-18,Boa noite em Jaçanã https://t.co/Wy2T3evFfG
9,629133704,1549128318657732616,2022-07-18,🌪🌬 em Curtiço https://t.co/7AqD1BcFyk
10,42881764,1548984915458506762,2022-07-18,"Sao Paulo, from the Serra da Cantareira region. Contrasts with the tropical forest. @ Cantareira, Sao Paulo, Brazil https://t.co/JGRFnx4Utg"
11,727083578278993920,1548834399193554944,2022-07-18,Boa noite em Jaçanã https://t.co/lUVZFylCiq
12,43470333,1548822340254851072,2022-07-18,"Fermentar na geladeira pelas próximas 18h...

#fermentacaonatural #panificacaoartesanal em Vila Nivi https://t.co/Cq8fl0tqky"
13,232330396,1548658857957662721,2022-07-17,Trouxemos uma imagem de Nossa Senhora de Aparecida para zelar por nossa casa. em Santuario Aparecida do Norte https://t.co/DIyDzgzDcy
14,727083578278993920,1548637688194076674,2022-07-17,Bom dia em Jaçanã https://t.co/zHmePIhb0c
15,70573414,1548471131719446536,2022-07-17,#sabado #hamburguer em Jardim São Paulo (Santana) https://t.co/IyVMxKT9fr
16,727083578278993920,1548470553702330368,2022-07-17,Boa noite em Jaçanã https://t.co/zZMgylsQ5A
17,23260002,1548429542884122625,2022-07-16,the best people in life are free em Outback Shopping Tucuruvi https://t.co/HyO5IoGKac
18,1543359476488601603,1548417865157554176,2022-07-16,"Definição de Harmonia e Equilíbrio, mas disseram que combina comigo em Parada Inglesa https://t.co/aJ4cwE8gEe"
19,74198936,1548410632105447429,2022-07-16,Acabou de publicar uma foto em Padaria Paris https://t.co/NQAQcRyB3C
20,232330396,1548404577312968705,2022-07-16,Em um dos belos espaços do Santuário de Aparecida do Norte. em Santuario Aparecida do Norte https://t.co/kEC1jiQskm
21,4280297357,1548353099625951235,2022-07-16,https://t.co/fgZuVVzQCg
22,232330396,1548337077367894021,2022-07-16,Agradecendo bênçãos de Nossa Senhora Aparecida. em Santuario Aparecida do Norte https://t.co/L6xfb6FRuz
23,838084496079654912,1548335850986975234,2022-07-16,"#totens 
#farmacia
#fachadaemacm em Alfamidiavisual https://t.co/g7b7e98UZV"
24,838084496079654912,1548335036327374850,2022-07-16,"#totem
#fachadaemacm 
#loja em Alfamidiavisual https://t.co/LRnaEcOcr3"
25,43470333,1548328089158963204,2022-07-16,"Pão Dia!

#bomdia #panificacaoartesanal #fermentacaonatural em Vila Nivi https://t.co/TlxaCkQsUo"
26,60547295,1548225770853519360,2022-07-16,OBSERVANDO E SENTINDO AS PLANTAS AS FLORES E O AMOR EM MEU CORAÇÃO ! COMO A VIDA É BELA E DELICADA E PASSAGEIRA ! #love #flowers em Praça Ulisses Guimarães https://t.co/tGykH2gacm
27,43470333,1548114214710956032,2022-07-16,"Pão quentinho saindo... Mmmmmm

#fermentacaonatural
#lovebakes
#panificacaoartesanal #fazerpaoemassa 

@annariccio 

Feito com @nitaalimentosoficial em Vila Nivi https://t.co/jH0fyfwPx1"
28,727083578278993920,1548081367505723395,2022-07-15,Boa noite em Study Company https://t.co/ecJ3BPtj9x
29,222295580,1548078243974000640,2022-07-15,Acabou de publicar uma foto em Jardim Brasil Sp https://t.co/t1Ch5KJnfN
30,1136723095295791104,1548041441317777409,2022-07-15,Horizonte em Parque Vitória https://t.co/JhjoJlZVz2
31,1136723095295791104,1548040586745155590,2022-07-15,De uns dias atrás ❤️✨ em Parque Vitória https://t.co/LUHmeffhgj
32,2405282319,1548028596005965825,2022-07-15,Acabou de publicar uma foto em IASD Tucuruvi Oficial https://t.co/8UJH4LJKjl
33,727083578278993920,1547865118200844290,2022-07-15,Bom dia em Parada Inglesa https://t.co/R2eLWoFKsB
34,43470333,1547750647415525377,2022-07-15,"Guardei o meme que a prima @ritadecassia_mr mandou para o fim de semana de temperaturas melhores hehehe 

Finalmente um tempinho melhor pra fermentar a massa

Bora fazer pao com @nitaalimentosoficial em Vila Nivi https://t.co/mpQ371IDZj"
35,727083578278993920,1547701025796042753,2022-07-14,"Estou esperando vcs, a partir das 21 horas, eu e o DJ Valdeci para escutar o programa Dreams of Love, Acesse  https://t.co/q7hXKokagd em Jaçanã https://t.co/Pc1EV4akdv"
36,1238944145118580737,1547631742663634944,2022-07-14,"Saí para almoçar e fiz o meu pedido sem dó pq to com fome e com vontade. O garçom “é tudo pra senhora?!” 😒

Pessoal precisa normatizar a comilança e o date de uma pessoa só 🙄"
37,1547450588014825472,1547597784366231554,2022-07-14,"VAI SE FUDER ETEC, VAI TOMA NO OLHO DO CÚ CPS
não aguento mais"
38,2937614243,1547594820851421191,2022-07-14,"Acabou de publicar uma foto em Zona Norte, Parada Inglesa https://t.co/Twj5ExF3l5"
39,2937614243,1547592648000647168,2022-07-14,"Acabou de publicar uma foto em Zona Norte, Parada Inglesa https://t.co/cIgVpL2eR1"
40,128124649,1547560337213313024,2022-07-14,"#tbt de 2014 quando minha coroa achou essa peita aqui e disse que queria pra ela. #UH 

Feliz aniversário mãe, nunca conseguirei externar o tanto que você significa para mim. Te amo muito, você é foda! ❤️ https://t.co/XaJh1AlaXD"
41,727083578278993920,1547501952501686273,2022-07-14,Bom dia em Parada Inglesa https://t.co/MX7MI9SAf0
42,1193949410050347010,1547379531497062402,2022-07-14,Tô no shopping
43,1525218046545100804,1547287313532739585,2022-07-13,Acabou de publicar uma foto em JR Estética https://t.co/SdLhPZparH
