,author_id,tweet_id,created_at,text
0,321236518,1558954398235213826,2022-08-14,"Não tenho legendas para descrever o dia de hoje, só agradecer 🙏🙏 
Obrigado Deus por permitir tudo isso 😁🙌 em Shopping Metro Tucuruvi https://t.co/mVHFOFqL4A"
1,51430514,1558949481747456000,2022-08-14,#escolhaseconsequências em Tucuruvi | Zona Norte https://t.co/2WwKWjWjCq
2,3371594355,1558927050647511040,2022-08-14,Acabou de publicar uma foto em Vila Mazzei https://t.co/Odz8YJlAlQ
3,4048550813,1558889747686244355,2022-08-14,De volta p minha terrinha 😮‍💨 https://t.co/x3jyyDGkta
4,37031702,1558821949089906695,2022-08-14,"Feliz dia dos Pais, em especial ao meu Pai, Félix.
Que Deus abençoe e ilumine todos os Pais do planeta em Mocotó Bar e Restaurante https://t.co/Jv1kP705K0"
5,1558786842614550528,1558788954547228673,2022-08-14,Gratidão 😘 https://t.co/82cgrFQr8H
6,727083578278993920,1558784351873257472,2022-08-14,"Saudades pai, e para aqueles que ainda tem os seus pais respeitem e cuidem bem deles, um feliz dias dos pais pra todos em Jaçanã https://t.co/sNmOftM9Iv"
7,727083578278993920,1558774520512651264,2022-08-14,Bom dia e feliz dia dos pais em Jaçanã https://t.co/1DoiR8pJMx
8,252806783,1558652223768461313,2022-08-14,SabadoouuUU https://t.co/nLDEZPdx7Z
9,727083578278993920,1558625918775693314,2022-08-14,Boa noite em Jaçanã https://t.co/OggmNz1qP7
10,143248942,1558623462792597504,2022-08-14,Sigo me apoiando no que me mantém de pé atrás da positividade sem que eu perca minha fé ✨ em Vila Maria Alta https://t.co/Tg0usg310a
11,67895112,1558583501686988803,2022-08-13,Peça de hoje https://t.co/lyRvX1WjMn
12,76763647,1558556104409452546,2022-08-13,Acabou de publicar uma foto em IASD Tucuruvi Oficial https://t.co/WhUqh2oRbg
13,3387282047,1558541283228061703,2022-08-13,😎 em Inova Bar https://t.co/jsjILMYMzT
14,30791137,1558404352666177536,2022-08-13,Passeando! en Trimais Places https://t.co/gwfaszid96
15,30791137,1558403076846919681,2022-08-13,"GatoCat en Cantareira, Sao Paulo, Brazil https://t.co/dpcIUtR02P"
16,1484263804187942912,1558164205894881281,2022-08-12,O fim de um ciclo sempre trás o início de um novo caminho. https://t.co/YwIrx6gEe4
17,1513391481645588480,1558060332572082176,2022-08-12,"a xeury lançou a carecagem 

@cherryrar https://t.co/PeAuBmuav2"
18,1521521058066710528,1558046327715635202,2022-08-12,Oh happy day
19,727083578278993920,1558010884232036354,2022-08-12,Bom dia em Parada Inglesa https://t.co/KUP9MrtLOe
20,727083578278993920,1557863821724745729,2022-08-11,"Olá, boa noite, logo mais às 21:00 hs tem o programa Dreams of Love comigo e DJ Valdeci com o melhor do romantismo, acesse a rádio Rádio Hot Sounds e sinta-se a vontade para se emocionar. https://t.co/q7hXKoBLEN https://t.co/o6aR4m56nu"
21,1644110526,1557847969382031360,2022-08-11,Acabou de publicar uma foto em Vila Gustavo - Parada Inglesa https://t.co/qWnPwaTQPS
22,71152305,1557801517717114887,2022-08-11,"🤦🏼‍♂️ (at @McDonalds_br in São Paulo, SP) https://t.co/TKEmIYguix"
23,71152305,1557801155798962176,2022-08-11,"Bater perna... (@ Shopping Metrô Tucuruvi - @shopmtucuruvi in São Paulo, SP) https://t.co/hUB9CmTqMg"
24,106223307,1557789652865671168,2022-08-11,"Lentidão no trânsito da Av. Guapira no Bairro de Tucuruvi.
São 5 dias com buracos que sobraram após obra de ligação em edifício. Ninguém resolve. Trânsito chega a ficar com mais de 3 km nos dois sentidos. Fora caminhões da obra, parados na via.
#BDSP #prefeiturasaopaulo  #CETSP_ https://t.co/kfvB6UnLhm"
25,1248757180196687874,1557744655894056963,2022-08-11,😎😏 https://t.co/hDvsmVSXy4
26,30791137,1557663227592314881,2022-08-11,"Sueño en Cantareira, Sao Paulo, Brazil https://t.co/PWJ7HovvN3"
27,727083578278993920,1557650228727074818,2022-08-11,Bom dia em Parada Inglesa https://t.co/F0WikfqJLE
28,727083578278993920,1557521239094312960,2022-08-11,Boa noite em Jaçanã https://t.co/K9TN5pcMVs
29,1551691829413908480,1557472393270009868,2022-08-10,https://t.co/zTMju0mFky
30,32847062,1557451654357815298,2022-08-10,"Cês tem noção??? Somente @charlesdobronxs O MAIOR LUTADOR O UFC! O CAMPEÃO TEM NOME! 
Em Outubro o Makhachev vai chorar!
Arrebenta, Campeão! em GR6 Eventos https://t.co/KV7IJH347U"
31,1248757180196687874,1557327433661046784,2022-08-10,😙😙 https://t.co/5ascq6uYUN
32,727083578278993920,1557159026709843968,2022-08-10,Boa noite em Jaçanã https://t.co/vcYk0w8evP
33,245619512,1557140045013868545,2022-08-09,Acabou de publicar uma foto em Tucuruvi | Zona Norte https://t.co/NL3yIUI5TV
34,1297659685873557512,1556960924300345344,2022-08-09,"Treinão de segunda. 

#bjj #jiujitsu #brazilianjiujitsu #lifestyle #tatame #keiko #kimono #gracejiujitsu #trimaisplaces #gavioestrimais em Academia Gaviões - Shopping Trimais https://t.co/V7bhN8gbZF"
