,author_id,tweet_id,created_at,text
0,14787132,1562578800931528704,2022-08-24,"Hoje foi um dia muito especial por vários motivos:

Receber a premiação de Município Certificado PMVA!
Rever amigos queridos!
Começar e terminar o dia com Saúde e Paz! https://t.co/NlrxoXWtmx"
1,169825640,1562554573394288640,2022-08-24,"I'm at Shopping Butantã - @butantashopping in São Paulo, SP https://t.co/0172wPuby2"
2,3991143969,1562531419200831488,2022-08-24,"https://t.co/d07zYLohR3
@_mrrorbaII 📷 https://t.co/BWnmhTWWUV"
3,15678859,1562524219753123842,2022-08-24,"Na bola, segue o jogo. https://t.co/qwticdLzrC"
4,15678859,1562523886289186818,2022-08-24,Tão promovendo queima de máscaras aqui no Campus.
5,3328079567,1562521641787084801,2022-08-24,Acabei de ver uma das Ferraris mais bonitas q eu já vi
6,15349705,1562508770617757696,2022-08-24,Acabou de publicar uma foto em Vila Borges Z/O https://t.co/n7UsPFi5po
7,58759505,1562498200153382912,2022-08-24,Acabou de publicar uma foto em Jardim Bonfiglioli https://t.co/Ikz9gSGEkV
8,1561812986968383489,1562485723311140865,2022-08-24,Amazing talk! 🐭🧠❤️@RenataFrazaolab https://t.co/uEmoRrnukf
9,1562125046079954947,1562444543064420354,2022-08-24,é muito louco a universidade estar seguindo a rotina normalmente sendo que tem estudantes que MORAM DENTRO DA PRÓPRIA UNIVERSIDADE que sequer tem acesso a água direito
10,1274917361489973262,1562229989327527936,2022-08-24,"Atenção! Estátua raríssima e exclusiva chegou na USP 😁🤣

8km levinho para não assustar a canela dolorida ✅

📷@nopacebobby 

#clubeingadecorrida #maniadecorrida #pacebobby em Usp https://t.co/fynBCGfUUg"
11,1354455548352147461,1562213544409825280,2022-08-23,"Gostaria de apresentar a vocês a nova teacher que irá ministrar as futiras aulas. Quem encontrou ela? 🤣🤣
#gatinhosfofos #gatos #gatosfofos #kittenlove #kittensofinstagram #kitten #homeoffice #homeofficelife #butantã https://t.co/sdAzfkihPN"
12,47656062,1562148599449927688,2022-08-23,Acabou de publicar uma foto em Butantã https://t.co/fSk52VQMsT
13,1187698723406667777,1562143889951264769,2022-08-23,Clarão 🌟 https://t.co/VkZqwng90z
14,1037050573600841728,1562133658198220802,2022-08-23,Eu acho mulheres cariocas maravilhosas e muito sensual https://t.co/a7EAKoGjvj
15,45477829,1562053557624389632,2022-08-23,Acabou de publicar uma foto em Pinheiros https://t.co/nAYKYoTptF
16,36533572,1562048553425506304,2022-08-23,Acabou de publicar uma foto em No Topo Do Mundo https://t.co/paq7MiKpmb
17,1201218050009321474,1561810591840436224,2022-08-22,Acabou de publicar uma foto em Academia Central de Aikido Kawai Shihan https://t.co/U5ZSPseAmU
18,1505952224261943297,1561700498557833216,2022-08-22,tá frio pessoal https://t.co/GTwbhHdlCq
19,96876429,1561692664608727040,2022-08-22,Acorda gay! O trem lotado tá te esperandooo 🗣🗣🗣 https://t.co/7Yvhbdm0uX
20,1260643800902443008,1561553994736193538,2022-08-22,Uma sequência de Bibi cheia de amor ❤️ em Pinheiros https://t.co/0aSvNvJZX2
21,33275504,1561476565841899521,2022-08-21,"Acabou de publicar uma foto em Surtolândia, Valdoxânia, Brasil https://t.co/ZlCCyz8Aox"
22,127240672,1561465195372765184,2022-08-21,Acabou de publicar uma foto em Moto na Estrada https://t.co/qkRJM8uCfx
23,1037050573600841728,1561455182143262720,2022-08-21,Boa tarde maravilhosa musa https://t.co/2RcGN7hG34
24,517391200,1561451480556642311,2022-08-21,"sextinha foi braba demais, obrigado a todos os envolvidos! ❤️❤️❤️
 
2️⃣2️⃣ e fé 🙏🏼 https://t.co/1yvSgPtOGg"
25,52837716,1561449336898207744,2022-08-21,"""Seja gentil consigo mesmo ao prosseguir nesta jornada. Essa gentileza, por si só, é um meio de despertar a centelha do amor dentro de você e ajudar os outros a descobrir essa centelha dentro de si."" (Tsoknyi Rinpoche) https://t.co/O5ipAPSr6G"
26,30893561,1561382950440259584,2022-08-21,"Hoje foi dia de visitar o lugar preferido delas!
#institutobutantan em Instituto Butantan https://t.co/Qnjh8cvzEh"
27,60161613,1561372667424706561,2022-08-21,Acabou de publicar uma foto em Parque dos Príncipes https://t.co/tpf5YHSWRF
28,60733150,1561346815223627777,2022-08-21,Acabou de publicar uma foto em Butantã (São Paulo Metro) https://t.co/eHMGlwNMxN
29,60733150,1561343757076807681,2022-08-21,Acabou de publicar uma foto em Butantã (São Paulo Metro) https://t.co/qUKSh45m7L
30,47656062,1561341543784529924,2022-08-21,Acabou de publicar uma foto em Butantã https://t.co/SKzO7FWF4z
31,87721285,1561328068253343744,2022-08-21,Acabou de publicar uma foto em Navio Homero Krähenbühl https://t.co/LwibVkQydr
32,52279685,1561326684124626947,2022-08-21,Acabou de publicar uma foto em Usp https://t.co/epz3oCM1nX
33,2741840722,1561324584753926145,2022-08-21,Acabou de publicar uma foto em Butantã https://t.co/RE6WHLUHv7
34,36407991,1561156377942183938,2022-08-21,Centenário do GOSP ✨ em Um Rooftop https://t.co/BxRb5NOqyM
35,2741840722,1561142500848308225,2022-08-21,"Em QAP total 🇧🇷🙏🏽
Bom trabalho pra todos nós Deus abençoe sempre 🙏 em Butantã https://t.co/RntW7oumZE"
36,2741840722,1561142189433954305,2022-08-21,Acabou de publicar uma foto em Butantã https://t.co/JQ0cPrmpvh
37,2741840722,1561133956816195584,2022-08-20,QRA Marco 🦅 top demais 🙏🏽 em Butantã https://t.co/uQXgJD3m36
38,36746626,1561122110193471488,2022-08-20,"Hoje foi dia de torcer pro meu time 👟 TENIS CERTO, estamos classificados para a semi finais do 🏆 troféu Nike.

Parabéns time pela classificação, vamos em frente 🙏🏻👊🏻🔥.

#teamteniscerto #trofeunike em Usp https://t.co/Qseddtf2U6"
39,52837716,1561024359300419584,2022-08-20,Acabou de publicar uma foto em Universidade de São Paulo https://t.co/JMhOKEF3b6
40,49836909,1560922086561894401,2022-08-20,"Por aqui....
📷 🌆
.
#semfiltro #ceu #crepusculo #pordosol #anoitecer #ocaso #natureza #vidaurbana #beleza #espetaculo #luz #cores #falaceres em Condominio Residencial Pablo Picasso https://t.co/Dvo2ajsPOW"
41,33275504,1560800426412359680,2022-08-20,"Reposted from @esperanca.espirita Que assim seja 🙏 em Surtolândia, Valdoxânia, Brasil https://t.co/2TZm57A0KJ"
42,88919496,1560773206168027143,2022-08-19,Além de padrinho do curta/tcc somos base de produção; apto e prédio hehe! #orgulhodofilhao em Pinheiros https://t.co/dLRY10k0eH
43,939243755529523200,1560577046056665088,2022-08-19,@idriszinho Do mundo inteiro 3 pessoas fazendo aniversário logo hoje
44,336289096,1560480555426369537,2022-08-19,"Te vi e te apoiei nas quartas, e não vai ser diferente na semi. Vamos! 🔴⚪️⚫️ https://t.co/NYmvBbp7FN"
45,110688963,1560412935717113856,2022-08-18,"I'm at Pão de Açúcar - @paodeacucar in São Paulo, SP https://t.co/1ADpdLWiAU"
46,89705791,1560325355365437441,2022-08-18,Acabou de publicar uma foto em Toca do Estudante https://t.co/u1p6nW04Re
47,752252937267806208,1560285896834011138,2022-08-18,amei essa cantina com brinquedinhos pras crianças do prédio brincarem no recreio https://t.co/t56iRpXanx
