,author_id,tweet_id,created_at,text
0,61647895,1530274071451250689,2022-05-27,Acabou de publicar um vídeo em Butantã Jardim Bonfiglioli https://t.co/5HCGezdVma
1,151564993,1530248075284996103,2022-05-27,https://t.co/tUJDa1ix27
2,151564993,1530247860075241473,2022-05-27,https://t.co/ZjXxFg2hpZ
3,14357628,1530219605406384128,2022-05-27,Acabou de publicar uma foto em Pinheiros https://t.co/J9Mlq9ZxVk
4,144811662,1530187047323025408,2022-05-27,Acabou de publicar uma foto em Butantã https://t.co/tCO8toUdPB
5,41694143,1530174839951982597,2022-05-27,"//
Quando a natureza encontra meios de se fazer presente... em Hospital Veterinário da Usp https://t.co/rOFBkoBxmd"
6,799412180,1530161611666857991,2022-05-27,"Seminário Polícia Judiciária e a Lei 14.321/2022 (violência institucional), promovido pela Academia da @Policia_Civil.
Debates produtivos e publicação da nova edição da obra Lei contra o abuso de autoridade, em coautoria com os professores @marcelolessa72 e Benedito Giudice. https://t.co/pDinqhmvlk"
7,58552050,1530124862039027712,2022-05-27,Botando mal costume...kkkk em Padaria Cidade Universitária https://t.co/BQHma9LUdE
8,41385276,1530017026315534336,2022-05-27,A usp demonstra sua total incompetência ao provar que desconhece a língua pátria. em Usp https://t.co/uxlWuVbY6q
9,57017730,1530000736616062978,2022-05-27,Hoje tbm foi de live e tbm de gravação na @donaalexandrinapadaria para @zau_media com @adrianovalente.photo em Padaria Dona Alexandrina https://t.co/9ocI8ZHfxR
10,911584367658590209,1530000446382907392,2022-05-27,"Let's find some ediacaran zircons 👨🏻‍💻⛰️
@usponline
#geology #zircon #geochronology #fieldmapping #tectonics https://t.co/Ef1ehc4Z6x"
11,482490389,1529983241482121219,2022-05-27,o bom de ser amigo da lulis é q vc manda no gp “5 min na meia lua pra respirar da aula?” ela topa na hora e a gnt vai desbravar a fea 😍 https://t.co/7Bwpjb1NTs
12,61647895,1529982855706824730,2022-05-27,Nós os trouxas em Vila São Luís https://t.co/gaOghrEI97
13,305778664,1529975998342696961,2022-05-27,Estratégia de estudo #MapaMental #5ano em Alcides da Costa Vidigal https://t.co/8HYfoRE5K2
14,31194890,1529966133578719243,2022-05-26,"Já dizia Napoleon Hill:
“TUDO o que a mente humana pode conceber, ela pode conquistar”. 
E eu concordo. #boanoite"
15,113773688,1529922767155609629,2022-05-26,Minha história de amor favorita. 💓 #tbt em Cidade de Guararema https://t.co/70PX2USu6X
16,60733150,1529865832079273984,2022-05-26,Acabou de publicar uma foto em Butantã (São Paulo Metro) https://t.co/ik5UaeZd5r
17,2306707293,1529835203723595782,2022-05-26,Acabou de publicar uma foto em Pinheiros https://t.co/57IdpYwRDn
18,2306707293,1529830812446777350,2022-05-26,Acabou de publicar uma foto em Pinheiros https://t.co/EowJG5YUfJ
19,49836909,1529825847443607552,2022-05-26,"Por aí.... #TBT
📷 🌔 🏙
.
#semfiltro #lua #luaminguante #natureza #vidaurbana #beleza #espetaculo #luz #cores #falaceres em Praça Zaphira Vieira Leite https://t.co/SVxiISlyBc"
20,2306707293,1529813432899354624,2022-05-26,Acabou de publicar uma foto em Pinheiros https://t.co/cLEaCTLvS0
21,539348739,1529777047446462464,2022-05-26,Campus bonito da porra https://t.co/ohTdIfd3qu
22,14357628,1529622461699936256,2022-05-26,Acabou de publicar uma foto em Pinheiros https://t.co/19rPJYUVfH
23,188547682,1529616986925326336,2022-05-26,Acabou de publicar uma foto em Fermentaria Jandira https://t.co/U2EdYcsFGN
24,1335450813439864832,1529529115090501635,2022-05-25,"Que legal,ter que vim apê pra casa porque vai ter greve,daí chego no  ponto onde eu desso e tem logo 5 ônibus esperando, aaaaaaa vai pra porra."
25,2306707293,1529521473907572737,2022-05-25,Acabou de publicar uma foto em Pinheiros https://t.co/ztjxT4iS3z
26,64149391,1529477653568397314,2022-05-25,Ela tinha uma picada envenenada e um sonho 🥰 https://t.co/qc7cIMwlZt
27,1088016058919849984,1529269858315210754,2022-05-25,Acabou de publicar uma foto em Butantã https://t.co/uG0d493BEc
28,907308025777713156,1529266934969257984,2022-05-25,"Me desculpe meus amigos de treino, mas esse é o meu parceiro  preferido. ❤️🥋 em Brabu’s academia - Butanta https://t.co/UYx9Kl2eg1"
29,172532861,1529247550192107520,2022-05-24,Acabou de publicar uma foto em Butantã Jardim Bonfiglioli https://t.co/8D1WJRjFsJ
30,2306707293,1529243888401231873,2022-05-24,#visibilidade #pan #pansexual #pansexualpride #pansexuals #lgbtq🌈 #lgbtbrasil #lgbtfobia em Pinheiros https://t.co/dmF9HsxCAf
31,2306707293,1529223691640492034,2022-05-24,Acabou de publicar uma foto em Pinheiros https://t.co/Dz54tuJWT1
32,25700962,1529159005313961985,2022-05-24,Acabou de publicar uma foto em LKPA S/A https://t.co/ngEbINLBKD
33,2306707293,1529106969163878402,2022-05-24,Acabou de publicar uma foto em Pinheiros https://t.co/TrGGuUoviJ
34,2306707293,1529084691839590402,2022-05-24,"O dia em que tomei minha primeira vacina contra a COVID-19, que irá fazer um ano no mês que vem
.
.
#vacina #vacinacãocovid #vacinejá #vacine #ᴠᴀᴄɪɴᴀᴘᴀʀᴀᴛᴏᴅᴏs em Pinheiros https://t.co/lv5eTRFbw9"
35,188547682,1528916069955559425,2022-05-24,"Bastidores com pessoas lindas !
Muuuuuuaaaacckk 😘❤️🎶🤗✨
#fla_mingooficial #fermentariajandira #glamrock #postpunk #indierock #diversidade #fashionrock #musicandfashion #audiovisual #novamusica #novosingle #novoep https://t.co/rWZucgppov"
36,1431131812001165314,1528906347961540613,2022-05-24,Acabou de publicar uma foto em Instituto Butantan https://t.co/BxjJSxjlSe
37,337137527,1528903620615360517,2022-05-24,Acabou de publicar uma foto em Colégio Albert Sabin https://t.co/i9coWJhtoH
38,33275504,1528886263893397510,2022-05-23,"Acabou de publicar uma foto em Surtolândia, Valdoxânia, Brasil https://t.co/jO9h2ch0Bf"
39,312923675,1528880187382804480,2022-05-23,Dia de discutir o financiamento da educação https://t.co/IfrxAVrw2O
40,72287523,1528845237333942275,2022-05-23,Como eu amo estudar na USP 💖 https://t.co/khFwwWZfkY
41,719130551,1528842188985073664,2022-05-23,Acabou de publicar uma foto em Casa Tarumã https://t.co/KjseEUz4Wn
42,61647895,1528755604134805506,2022-05-23,Acabou de publicar uma foto em Vila São Luís https://t.co/UIoQwGdD4z
43,2306707293,1528704980844150785,2022-05-23,Acabou de publicar uma foto em Pinheiros https://t.co/Jytma2xZys
44,49145938,1528677973636919297,2022-05-23,"Malhou, girou a chave e partiu, rumo ao desconhecido. https://t.co/Ztz94UhyPz"
45,1436470090413846529,1528564356182593538,2022-05-23,GENTE PELO AMOR DE DEUS https://t.co/9oy4269Mmj
46,127240672,1528511558317383686,2022-05-22,Acabou de publicar uma foto em Moto na Estrada https://t.co/CqinYMdGC7
47,127240672,1528482117520445441,2022-05-22,Acabou de publicar uma foto em Moto na Estrada https://t.co/X5KS22J9Gi
48,1446896501620449293,1528460760757768194,2022-05-22,E saudade 🤤 https://t.co/JPhiPZPIPt
49,2306707293,1528442292431990784,2022-05-22,Acabou de publicar uma foto em Pinheiros https://t.co/Nq3SHr5KBx
50,167505006,1528414422611501057,2022-05-22,Acabou de publicar uma foto em Centro de Treinamento Gracie - Butantã https://t.co/Ynx7jHIOr6
51,48907216,1528412204017631233,2022-05-22,Muito feliz de participar do Encontro de 50 anos de Pós-graduação em Periodontia da FOUSP. em FOUSP - Faculdade de Odontologia da Universidade de São Paulo https://t.co/YDhQSLt7v5
52,799412180,1528398440635432962,2022-05-22,"Está chegando!
Seminário Polícia Judiciária e a Lei 14.321/2022 (violência institucional), dia 24/05, promovido pela Academia da @Policia_Civil .

#Acadepol
#PolíciaJudiciária
#ViolênciaInstitucional
#DevidoProcessoLegal
#InvestigaçãoCriminal
#DevidaInvestigaçãoCriminal https://t.co/IktbuYMmMh"
53,14357628,1528394901817262081,2022-05-22,"Baleia fantástica

#grafite #graffiti #urbanart #arteurbana #streetart #artederua #saopaulo #saopaulocity #terradagaroa #sp #sampacity #sampalovers #sampa #instagrafite #instastreetart #arte #art em Pinheiros https://t.co/74VmZey2XA"
54,34264727,1528362579361398788,2022-05-22,Acabou de publicar uma foto em Pinheiros https://t.co/oTLLSz0pxi
55,116929873,1528343108756287488,2022-05-22,"Dell E6430 I5 8gb
Ssd 256gg
Vende-se
Me chama no inbox @ Rio Pequeno Jardim Ivana https://t.co/NDkHT3ALEY"
56,116929873,1528342402599092224,2022-05-22,"Vende-se
Thinkpad I5 8gb
Ssd 256
Me chama no inbox @ Rio Pequeno Jardim Ivana https://t.co/aR8gbxWqhf"
57,2306707293,1528214699417948160,2022-05-22,Acabou de publicar uma foto em Pinheiros https://t.co/gIyC5I9E53
58,18688345,1528193031983312896,2022-05-22,Acabou de publicar uma foto em Capela São Francisco de Assis https://t.co/4oaluj03Dx
59,58994298,1528184073419644931,2022-05-22,Acabou de publicar uma foto em Pinheiros https://t.co/iVjXtccFxo
60,434585854,1528176660092276736,2022-05-22,Acabou de publicar uma foto em Instituto Butantan https://t.co/t4qfe3cFQJ
