,author_id,tweet_id,created_at,text
0,15678859,1540081918024339458,2022-06-23,@_alineramos Muito bonita pra rasgar.
1,2306707293,1539979306402734082,2022-06-23,Acabou de publicar uma foto em Pinheiros https://t.co/DJZVvfrkGJ
2,15678859,1539976949262561281,2022-06-23,"Bom strogonoff da Cida, ainda acho que o nosso é melhor @ritatritapepe 😉 https://t.co/0Pk2qpMqhi"
3,15678859,1539940921059549184,2022-06-23,"Segunda vez, em menos de dois meses, que vejo pessoas em frente ao IOUSP pedindo comida. A fome e a miséria batem na porta da USP."
4,40146795,1539838489562435584,2022-06-23,Just posted a photo @ Usp https://t.co/JvYlwyI7ZH
5,96990201,1539778421668159500,2022-06-23,Just posted a photo @ Butantã https://t.co/ej5FVbqGg5
6,116929873,1539720843282059264,2022-06-22,Oremos por todos nós @ Paróquia Santíssima Trindade https://t.co/KhMSCJikOj
7,49836909,1539717948335501312,2022-06-22,"Por aqui....
📷 🌆
.
#semfiltro #ceu #nuvem #crepusculo #pordosol #anoitecer #ocaso #natureza #vidaurbana #beleza #espetaculo #luz #cores #falaceres em Condominio Residencial Pablo Picasso https://t.co/7vok085QJ4"
8,823540749316792321,1539676337635483652,2022-06-22,fui COMER num RESTAURANTE aqui e me serviram comida CRUA 🙄 aguarde processo
9,15678859,1539674108979560448,2022-06-22,Eles insistem aqui. https://t.co/MWz4hFCVvs
10,1571000250,1539626230609113089,2022-06-22,✨ em Pinheiros https://t.co/c1IQQpFLTp
11,1527015111763845120,1539623703813783552,2022-06-22,WhatsApp optimiza su versión para Windows https://t.co/PixKb54zJB
12,2306707293,1539611483289567233,2022-06-22,"Confira meu mais novo texto da coluna no Pragmatismo político
.
.
#texto #americalatina #coluna #colunista #colunacritica #pragmatismo #pragmatismopolitico #eleições #eleicoes2022 #lula #lula2022 #lulaalckmin https://t.co/Ss44PUPmkv"
13,15678859,1539610002427715585,2022-06-22,"Seu amigo diabético, vem comer feijoada nessa quarta gelada e só pega carne na proteína e couve como carboidrato. Está na dieta."
14,58216233,1539587477962256386,2022-06-22,Mais um pra conta em Smart Fit https://t.co/dDj4pF6rfI
15,2306707293,1539435642538668034,2022-06-22,Acabou de publicar uma foto em Pinheiros https://t.co/3z8JyciMyG
16,1107016789714714624,1539412549116080133,2022-06-22,Hoje foi dia de treinar 🍑✨ https://t.co/MvbDihkuh5
17,214562966,1539388137499156483,2022-06-21,Acabou de publicar uma foto em Garena free fire brasil https://t.co/jkt0iscKxQ
18,176875950,1539306473381326848,2022-06-21,Acabou de publicar um vídeo em CavePool - Sp https://t.co/jHRfJCKv8q
19,166495623,1539287953201045504,2022-06-21,Passeando rs!!! em Estação São Paulo-Morumbi https://t.co/A2jRbriVwP
20,53091306,1539271851192553472,2022-06-21,"Começar o dia assim é demais! 
#malyne x #flacelo 🎾
Jogamos contra? Não, treinamos juntos!!! em Estação Praia https://t.co/VQbmNKwnG3"
21,1571000250,1539258204307214337,2022-06-21,✨ em Pinheiros https://t.co/vp11s0OQii
22,2306707293,1539246413787324416,2022-06-21,Acabou de publicar uma foto em Pinheiros https://t.co/0s0kbdTP3J
23,2306707293,1539239454765883393,2022-06-21,Acabou de publicar uma foto em Pinheiros https://t.co/7cKid6VBG7
24,24701343,1539210334099197954,2022-06-21,"Faltam 193 dias para o fim do ""governo"" Bolsonaro."
25,33275504,1539198294324301824,2022-06-21,"Visitantes matinais! em Surtolândia, Valdoxânia, Brasil https://t.co/2OZIYFSads"
26,14328502,1539056504036331520,2022-06-21,Drinking a Bicheiro (Straight RIS) by Dude Brewing @ Eapzinho — https://t.co/I8RGmVGLtv
27,14328502,1539055770452492288,2022-06-21,Drinking a Red Power (Red Velvet Choco Cake) by Dude Brewing @ Eapzinho — https://t.co/1UFJWK83Fn
28,14328502,1539055515556249602,2022-06-21,Drinking a Dude Social Club (Birthday/Coffee Cake) by Dude Brewing @ Eapzinho — https://t.co/Log7q04ouM
29,14328502,1539055254637092865,2022-06-21,Drinking a Cyborg (Coffee Blend #2) by Dude Brewing @ Eapzinho — https://t.co/JjH2hnuiXH
30,14328502,1539055005487054848,2022-06-21,Drinking a Lo Pan (Pecan Brownie Stout) by Dude Brewing @ Eapzinho — https://t.co/vLyq6F4bVi
31,14328502,1539053503758450690,2022-06-21,Drinking a Sophia Lambic by Brasserie Cantillon @ Eapzinho — https://t.co/4Tajuo5S0L
32,14328502,1539053029634510849,2022-06-21,Drinking a Bourbon County Double Barrel Brand Toasted Barrel Stout (2021) by @GooseIsland @ Eapzinho — https://t.co/tyVOgPT255
33,14328502,1539052477479546880,2022-06-21,Drinking an 3 Fonteinen Zenne y Frontera (season 18|19) Blend No. 93 by @3fonteinen @ Eapzinho — https://t.co/j3iylUKiBX
34,14328502,1539051749071282176,2022-06-21,Drinking a Candy Shop MAX by Croma @ Eapzinho — https://t.co/523SV66tAp
35,14328502,1539051497488633856,2022-06-21,Drinking a Lorem by Croma @ Eapzinho — https://t.co/sOFFBcIbrT
36,14328502,1539050991047348225,2022-06-21,Drinking a Sentidos #2 by La Caminera Cervejaria @ Eapzinho — https://t.co/bnKNwyGVjM
37,33275504,1539001434091335680,2022-06-20,"Hoje o pilates quase me arranca o couro... literalmente... hahahahahahah em Surtolândia, Valdoxânia, Brasil https://t.co/hKfkOZhskB"
38,68794087,1539000443510132737,2022-06-20,Sylvie só de bubuia se protegendo do frio #gatosfofos #cats #photography #catstagram #gatos em Jardim Bonfiglioli https://t.co/WYRyL0b90p
39,824617176917307392,1538992046605737989,2022-06-20,Acabou de publicar uma foto em Butantã https://t.co/OcWG93eApO
40,2306707293,1538986706824732673,2022-06-20,"Confira meu mais novo texto da coluna no Pragmatismo político
.
.
#texto #americalatina #coluna #colunista #colunacritica #pragmatismo #pragmatismopolitico #colombia🇨🇴 #gustavopetro em Pinheiros https://t.co/r52CNkmnkT"
41,15678859,1538968965665390595,2022-06-20,Eita!!! https://t.co/dglrtfKw7N
42,3313559703,1538830468010889217,2022-06-20,"Aooooow @_Linhas8e9, o desserviço da Linha 9 Esmeralda está ótimo! #privatizaquemelhora #serviçolixo #voltaCPTM https://t.co/9R9SfAc6Ao"
43,172532861,1538719157167988738,2022-06-20,"4 anos de puro mel... 🐝🍯🌻
Você foi a realização de um sonho e todo ano comemoro a felicidade que é ter você na minha vida. Parabéns, minha eterna princesa!
.
.
.
.
.

#bilhetespramel #parabens #bday #mel #melissa https://t.co/FvBSAX4oMv"
44,62038975,1538716159910072322,2022-06-20,Doce de Leite vapt-vupt!!! https://t.co/8aJ7aOwH3k
45,62038975,1538715095064367104,2022-06-20,Doce de Leite vapt-vupt!! https://t.co/9za6vQjanW
46,2306707293,1538712364660531200,2022-06-20,Acabou de publicar uma foto em Pinheiros https://t.co/6bQLNaLKuq
47,2306707293,1538711785447886849,2022-06-20,Acabou de publicar uma foto em Pinheiros https://t.co/CyUTOBjiUQ
48,221759428,1538663726198423552,2022-06-19,Drinking a Zilly by Croma @ Eapzinho — https://t.co/5DoeFTMkJ9
49,221759428,1538663435193417728,2022-06-19,Drinking a KiwiKiwi by Trilha Cervejaria @ Eapzinho — https://t.co/R1JjzXXDcs
50,221759428,1538663194704629760,2022-06-19,Drinking a Duffin Dry Stout by Salvador Brewing Co. @ Eapzinho — https://t.co/HWGlmolpQL
51,221759428,1538662662283874304,2022-06-19,Drinking a Sophia Lambic (2020) by Brasserie Cantillon @ Eapzinho — https://t.co/KmiLiuV03m
52,221759428,1538661937046818817,2022-06-19,Drinking a Piña Descolada by @bebalambelambe @ Eapzinho — https://t.co/i8HlS0r4Ly
53,221759428,1538661452692738049,2022-06-19,Drinking a Bicheiro (Straight RIS) by Dude Brewing @ Eapzinho — https://t.co/4UpgolT3xS
54,221759428,1538661155866038279,2022-06-19,Drinking a Dude Social Club (Birthday/Coffee Cake) by Dude Brewing @ Eapzinho — https://t.co/xEbHmh3ORm
55,221759428,1538660443857862659,2022-06-19,Drinking a Red Power (Red Velvet Fruited Stout) by Dude Brewing @ Eapzinho — https://t.co/5LASC5Nqba
56,221759428,1538659902666817536,2022-06-19,Drinking a Cyborg (Coffee Blend #2) by Dude Brewing @ Eapzinho — https://t.co/Kgqrs8dbXr
57,221759428,1538659422825857024,2022-06-19,Drinking a Lo Pan (Pecan Brownie Stout) by Dude Brewing @ Eapzinho — https://t.co/rLFhloB9QJ
58,221759428,1538658929600876557,2022-06-19,Drinking a Pink Lemonade by Cervejaria Dádiva/@2cabecas @ Eapzinho — https://t.co/u14GrzwXBA
59,221759428,1538658417644122112,2022-06-19,Drinking a Bourbon County Double Barrel Brand Toasted Barrel Stout (2021) by @GooseIsland @ Eapzinho — https://t.co/bEckiZpCYg
60,221759428,1538657912255823872,2022-06-19,Drinking an Arriba by @bebalambelambe @ Eapzinho — https://t.co/5ck4h9E8Yd
61,221759428,1538657428518195200,2022-06-19,Drinking a Stranger Things by Croma @ Eapzinho — https://t.co/0sy9ypyTiJ
62,221759428,1538656889592025093,2022-06-19,Drinking an 3 Fonteinen Zenne y Frontera (season 18|19) Blend No. 93 by @3fonteinen @ Eapzinho — https://t.co/sa2pRfxOzV
63,221759428,1538656381921906689,2022-06-19,Drinking a Theta by Koala San Brew @ Eapzinho — https://t.co/cBfYYnwF3P
64,221759428,1538655877107965952,2022-06-19,Drinking a Candy Shop MAX by Croma @ Eapzinho — https://t.co/uV4lb0qce8
65,221759428,1538655377981689860,2022-06-19,Drinking a Firestarter by Cervejaria Escafandrista @ Eapzinho — https://t.co/RQ0STgwdr1
66,221759428,1538654663104405504,2022-06-19,Drinking a Free Smile by Mad Lizard @ Eapzinho — https://t.co/JnPcX2stSn
67,221759428,1538650625797672960,2022-06-19,"Drinking an Ephemeral Pêssego, Manga e Baunilha by Cervejaria Dádiva @ Eapzinho — https://t.co/WD589Ipq7J"
68,2306707293,1538588460155404289,2022-06-19,"Viva a Parada LGBTQIA+ 
.
.
#PARADA #paradagay #paradalgbt #lgbtq🌈 #lgbtqia #lgbtqiapride em Pinheiros https://t.co/oO1Echp56B"
69,2306707293,1538582030967095301,2022-06-19,#dia #dia19dejunho #dianacionaldocinema #diadocinemanacional em Pinheiros https://t.co/8AFcP39NPl
70,33275504,1538502903433945089,2022-06-19,"Acabou de publicar uma foto em Surtolândia, Valdoxânia, Brasil https://t.co/xNRocdFqIS"
71,89705791,1538346466011492352,2022-06-19,"Um dia quase comum na Casa Toca.
#sóaTocafaz em Toca do Estudante https://t.co/TQlJkm88u3"
72,1391233893064392704,1538343294199123973,2022-06-19,Hoje tem festa do boi e eu nem sabia 😂
73,2306707293,1538337539378978816,2022-06-19,Acabou de publicar uma foto em Pinheiros https://t.co/RD0l6Aj902
74,110688963,1538296236121411584,2022-06-18,I'm at Zeze E Lele Buffet in São Paulo https://t.co/rxwtKLPjf4
75,1537997496617562113,1538279948275834880,2022-06-18,"Só vamo! Hahahahaha

 @DanniDanttas @SoutoNeto @andreylimap https://t.co/hyaXsUcnWR"
76,14328502,1538234641466925058,2022-06-18,Drinking a Piña Descolada by @bebalambelambe @ Eapzinho — https://t.co/OkqSXy3R0x
77,4631911,1538214366360883202,2022-06-18,Sábado de feijoada 😃#SaoPaulo https://t.co/tGnPDK9xCh
78,2306707293,1538181126770110466,2022-06-18,Acabou de publicar uma foto em Pinheiros https://t.co/t7av6OUTFN
79,24701343,1538126072197283840,2022-06-18,"“Você é distraído?”

“Não, imagina…” https://t.co/KLk4BfppGW"
80,188547682,1537955517456187396,2022-06-18,Acabou de publicar uma foto em Fermentaria Jandira https://t.co/IvQ2QHNMmj
