,author_id,tweet_id,created_at,text
0,75827450,1531811865105506307,2022-06-01,Sdds emprego
1,23726935,1531727179930796033,2022-05-31,Acabou de publicar uma foto em NF Estúdio https://t.co/zOHDbLHwY9
2,1524129450027278337,1531727081222164482,2022-05-31,Feeling Adorable 🥰😊 https://t.co/wlMa1Mst7P
3,114287430,1531674708915134465,2022-05-31,Acabou de publicar uma foto em Vila Carrão https://t.co/CoCBNe30PE
4,790632315038859264,1531005257827983362,2022-05-29,SÁBADO  PRIMEIRO DIA DE TRABALHO ESPAÇO NOVO COM MEU AMIGO E CLIENTE JOÃO PENSA EM UM PRETO GATO @charlesmendes_cm em Barbearia Do Angelo King Barber https://t.co/UoH7URoeU3
5,958851652018196480,1530588067219881984,2022-05-28,o tipo de carro que teria se quisesse um carro em Vila Carrão City https://t.co/otOmvJaAUc
6,595755969,1530520986667429889,2022-05-28,Acabou de publicar uma foto em Neo Vila Carrao https://t.co/0QVOtnqL4b
7,595755969,1530182962322489345,2022-05-27,Acabou de publicar uma foto em AD Belém 111 - Vila Dalila https://t.co/JqaeL4kG2t
8,64727308,1529762587914559488,2022-05-26,#quintouuu em Vila Carrão _ sp - z/l https://t.co/MV0C4gGFOj
9,1074706685137174528,1529534287925878784,2022-05-25,essa escola da de 10 a 0 no amelia
10,595755969,1529517144987271172,2022-05-25,"“Guardei a Tua Palavra em meu coração, para não pecar contra Ti.” (Salmos 119:11)

@adviladalila @adbvilacarrao @adbelemsp #adviladalila #umacoisanova em AD Belém 111 - Vila Dalila https://t.co/u4DRjYga8g"
