,author_id,tweet_id,created_at,text
0,78617110,1543726613761646592,2022-07-03,in the House
1,595755969,1543674663787806722,2022-07-03,Acabou de publicar uma foto em AD Belém 111 - Vila Dalila https://t.co/eKDEkpnqlT
2,32692633,1543376496210849794,2022-07-02,Acabou de publicar uma foto em Vila Matilde-Minha Casa https://t.co/A6fg9C3vx9
3,52591649,1543309079149514752,2022-07-02,"No Chup's na Praça da Toco na Vila Matilde.
Hoje sozinho, mas melhor assim do que mal acompanhado de pessoas INGRATAS. em Vila Matilde https://t.co/r6LglhLubL"
4,52591649,1543307005879779332,2022-07-02,"No Chup's na Praça da Toco na Vila Matilde.
Hoje sozinho, mas melhor assim do que mal acompanhado de pessoas pessoa  INGRATAS. em Vila Matilde https://t.co/r6LglhLubL"
5,1247336669889642497,1542587390673518594,2022-06-30,Acabou de publicar uma foto em Aruja https://t.co/gNjFJXTACM
6,4715652562,1542481351647154178,2022-06-30,Acabou de publicar uma foto em Maksud Plaza https://t.co/IXflFHqr9A
7,23726935,1542125443083636736,2022-06-29,Acabou de publicar uma foto em NF Estúdio https://t.co/YH5KS2JIpu
8,1247336669889642497,1541784312235917312,2022-06-28,Acabou de publicar uma foto em Aruja https://t.co/6Hh1Meu89z
