,author_id,tweet_id,created_at,text
0,1247336669889642497,1542587390673518594,2022-06-30,Acabou de publicar uma foto em Aruja https://t.co/gNjFJXTACM
1,4715652562,1542481351647154178,2022-06-30,Acabou de publicar uma foto em Maksud Plaza https://t.co/IXflFHqr9A
2,23726935,1542125443083636736,2022-06-29,Acabou de publicar uma foto em NF Estúdio https://t.co/YH5KS2JIpu
3,1247336669889642497,1541784312235917312,2022-06-28,Acabou de publicar uma foto em Aruja https://t.co/6Hh1Meu89z
4,1485394721656774659,1541424829605318656,2022-06-27,"Olá Amigos...

Hoje começo mais um novo desafio profissional. Sou vendedor de estofados da loja Casa Mais Design Outlet aqui em SP.
Caso vocês estejam procurando sofás novos e barato, não deixe de me procurar.
Abraço a todos. ✨🙏🏼 https://t.co/SnF3lX8tZF"
5,274719530,1541250566638149632,2022-06-27,iPhone 13 Pro Max 128 GB/256 GB em Vila Fernandes https://t.co/tHFLfHFW6K
6,240800341,1541062927154761728,2022-06-26,"Clube do advento X QG Vila Formosa, jogo beneficente para arrecadar alimentos para a ASA. em Clube Manchester https://t.co/ns9oi0iJRR"
7,73493771,1540725672720695296,2022-06-25,"I'm at Íris Veterinária in São Paulo, SP https://t.co/Ct6AeZtI77"
8,167281734,1540689008119803904,2022-06-25,Há batalha que se ganha por propósitos! em CR e Lima Cabeleireiros https://t.co/ia0QX5HGTi
