,author_id,tweet_id,created_at,text
0,782391607601528832,1551326915541311488,2022-07-24,"Missões...
Falar do plano da Salvação de Jesus cristo 
Para com a criatura @ Metro Guilhermina Esperanҫa https://t.co/gatlbotDbx"
1,595755969,1551269357375787008,2022-07-24,Acabou de publicar uma foto em AD Belém 111 - Vila Dalila https://t.co/mjF0C7cW6i
2,867828601604984832,1551248322085601280,2022-07-24,"Ter uma irmã é ter, pra sempre, uma infância lembrada com segurança em outro coração. @ Hippo’s burger https://t.co/nmqA803PsP"
3,75827450,1551202831360729088,2022-07-24,olá @ Condominio Edificio Manchester https://t.co/flRkAqWI0T
4,1329051085957427202,1550903774008512517,2022-07-23,Meu idosinho 🥹 https://t.co/aSmknvyqOp
5,1463501695099576328,1550484724199587841,2022-07-22,"Moça o pão de queijo tá menor né?
Tá
Tudo bem, vê um
Nossa tá cru moça!
Tá 
Pode trocar?
Não 
#sextou"
6,1489323860755460102,1550455810395889664,2022-07-22,dia lindo pra resolver os empecilhos que a vida coloca na nossa frente. 🫠🥱
7,32692633,1550436766431297536,2022-07-22,O tempo não comprou passagem de volta. Tenho lembranças e não saudades. em Vila Matilde-Minha Casa https://t.co/o2BWDcRkpm
8,2288985993,1550282954227781632,2022-07-22,"@laugonzalezz5 Vixi não sabia que aparecia a localização, tá errado vida tô dormindo"
9,2288985993,1550282411514249216,2022-07-22,@laugonzalezz5 Que gay
10,2423958642,1550132922677592064,2022-07-21,Venha fazer parte da nossa equipe. em Corpo e Terapias https://t.co/GLQvcdlKJD
11,1247336669889642497,1550108706884526081,2022-07-21,Just posted a photo @ Aruja https://t.co/PuBVPfKSzM
12,114287430,1549951048411856896,2022-07-21,Just posted a photo @ Vila Carrão https://t.co/ucJ23X66W3
13,114287430,1549949349865480192,2022-07-21,Just posted a photo @ Vila Carrão https://t.co/bnsSG2TFNU
14,99143055,1549578202179313664,2022-07-20,Acabou de publicar uma foto em Pq. Vila Manchester Vila Carrao https://t.co/ZiClrbFqdQ
15,161696522,1549429112728686592,2022-07-19,"I'm at Lepok Vila Formosa in São Paulo, SP https://t.co/whdG4rvPRF"
