,author_id,tweet_id,created_at,text
0,64885525,1530981008471781376,2022-05-29,"Treinin de hoje rendeu !!! 
💪🏽😏 em Guaianases, Sao Paulo, Brazil https://t.co/AfWABOAEGH"
1,100560298,1530898236872937472,2022-05-29,Acabou de publicar uma foto em Prainha Branca https://t.co/vAKZSk3gZl
2,100560298,1530895747322941440,2022-05-29,Acabou de publicar uma foto em Prainha Branca https://t.co/5TzyF1xQ9E
3,100560298,1530892725154897924,2022-05-29,"😍🙌 um ótimo domingo de descanso e paz para nós! 
#domingo #amor #família em Prainha Branca https://t.co/sgaAqcfUWG"
4,1519058242764255233,1530569401031921666,2022-05-28,"#sp1 boa tarde
virada CULTURAL é um muito bom prá galera se divertir pra esquecer um pouco das dificuldades que estamos passando."
5,143102544,1530170370090799111,2022-05-27,Deixe sua intenção de falecimento e participe: domingo 9h30 da manhã na igreja São Benedito (SOLENIDADE DA ASCENSÃO) em Igreja São Benedito Guaianases https://t.co/IR2uVESHk7
6,143102544,1530170321487253504,2022-05-27,Deixe sua intenção de falecimento e participe: domingo 9h30 da manhã na igreja São Benedito (SOLENIDADE DA ASCENSÃO) em Igreja São Benedito Guaianases https://t.co/6ZBoREguDk
7,1519058242764255233,1530113941522812928,2022-05-27,"e uma pena eu não poder estar em vários eventos ao mesmo tempo na virada (CULTURAL) #bdsp 
@rodrigobocardi (SEXTOU COM O MELHOR DA MANHÃ)"
8,71674128,1529959263434571776,2022-05-26,"Bom é quando vc embarca no ônibus vazio, só você, o motorista e o cobrador.
Linha 312N São Miguel Paulista - Terminal Cidade Tiradentes (sentido São Miguel Paulista)
#312N #48757 #Express https://t.co/jdRZqVX1g4"
9,53195346,1529931230585798665,2022-05-26,"Acompanhamento das aprendizagens com os coordenadores pedagógicos da EMEF Maurício Goulart. 

Tarde de muito trabalho, gratificante. em DIPED Guaianases https://t.co/4lo47sm68L"
10,1519058242764255233,1529756788471504897,2022-05-26,"#bdsp bom dia
não se engana não é Dubai e são Paulo Brasil https://t.co/y1TtCitlrU"
11,1541168126,1529433202791792641,2022-05-25,Acabou de publicar uma foto em Jardim São Pedro https://t.co/Ri7AXMkfPW
12,1529020507831541760,1529408273438367745,2022-05-25,Me siga no Tik Tok https://t.co/kirhXUCrrE https://t.co/q2L68SYFC7
13,1519058242764255233,1529402062823464961,2022-05-25,"#BDSP bom dia
a vida começa depois do café detalhe só pra quem não precisa fazer regime @xoia https://t.co/3qcFLyR3Lu"
14,1519058242764255233,1529398723490488320,2022-05-25,"#BDSP 
bom dia.. é impressão minha ou você está precisando fazer um regime Rodrigo bocard... bora malhar https://t.co/naWj0XWzPH"
15,1529020507831541760,1529395328931270656,2022-05-25,"Bom dia @rodrigobocardi  e @xoia , bora tomar café cafezinho? https://t.co/qQSysJq8eQ"
16,1519058242764255233,1529391009653829632,2022-05-25,pra mim chega basta vou te denunciar no #bdsp fica a dica pra vocês também .
17,1529020507831541760,1529060258815041536,2022-05-24,"Aqui curtindo o frio, e vcs me torturando pelo estômago né @rodrigobocardi  @xoia 🤭🤭 #bdsp https://t.co/uAAm4ghsg2"
18,1519058242764255233,1529031961620238339,2022-05-24,"DIA do milho 
(um milhão de utilidade)
 tudo que vêm do milho e saboroso e saudável #BDSP
@AndreModesto20
@rodrigobocardi https://t.co/YI15QxjYY4"
