,author_id,tweet_id,created_at,text
0,1425475714170691590,1569790684441329664,2022-09-13,"Hoje as 20h tem um podcast com @aleck.johnson não percam porque está muito bom! 😄
Link na bio!

https://t.co/7XCz1wSBxK

#podcast #aleckjohnson #pontual #musica #trap #perrengue em Pontual Duplicação https://t.co/nKuZmoTT4k"
1,65126460,1569784991831171077,2022-09-13,Acabou de publicar um vídeo em Fundação Casa Chiquinha Gonzaga https://t.co/ZTpt8DItsr
2,1521510305649602564,1569739698674991105,2022-09-13,"Lembrar de coisas do passado que te deixaram marcas é foda de lidar. Terapia ajuda, tocar no assunto é complicado. Você conta as coisas, dá aquela chorada básica e segue em frente. 
Relação entre pais e filhos....Ta quase igual a musica do Legião Urbana"
3,195562928,1569733819980255241,2022-09-13,"Museu do ipiranga

#museudoipiranga #fotografia #arte #escultura #rosto #vaso #planta #Palácio em Museu do Ipiranga https://t.co/dqcToEcc1S"
4,25932877,1569732226413203457,2022-09-13,"📘 Leitura do dia:
“Doce imaginação”, escrito por James Petterson, publicado pela @BuzzEditora 

📸 Fotografia na estação da #CPTM Tamanduateí em #SP https://t.co/NCE6WtVBSh"
5,75877617,1569710704063614983,2022-09-13,Acabou de publicar uma foto em MQ Professional Hair Styling https://t.co/57SKz3urCz
6,190379364,1569695039013662722,2022-09-13,Todo sábado na @santacandidasp em Paróquia Santa Cândida https://t.co/EZcHq9Hqj5
7,190379364,1569694929139400711,2022-09-13,"Hoje, na @tvcancaonova tem. Gente de Fé. em Paróquia Santa Cândida https://t.co/urrYU5mtyd"
8,190379364,1569644900496416768,2022-09-13,Acabou de publicar uma foto em Paróquia Santa Cândida https://t.co/RE5PMgIHL1
9,190379364,1569643691186307072,2022-09-13,Acabou de publicar uma foto em Paróquia Santa Cândida https://t.co/SdSSffYPpZ
10,2343950340,1569527405982670848,2022-09-13,"Acabou de publicar uma foto em Museu do Ipiranga,São Paulo https://t.co/AElqZ71yiw"
11,133426384,1569522219943960579,2022-09-13,Acabou de publicar uma foto em Love Is In The Air https://t.co/AqzmaqhWZp
12,71952282,1569472015148679171,2022-09-12,Acabou de publicar uma foto em Santthora Jewel https://t.co/ZXtYm81APb
13,1556037377621106688,1569439940039290880,2022-09-12,"I'm a free soul, like a bird 🦋 #LGBTQ #love #beautiful #photo https://t.co/bLJ8QZeZd6"
14,190379364,1569385657406996480,2022-09-12,Acabou de publicar uma foto em Paróquia Santa Cândida https://t.co/lGG2AdHi9h
15,190379364,1569385616072138755,2022-09-12,Acabou de publicar uma foto em Paróquia Santa Cândida https://t.co/vNrYGX3Gcm
16,190379364,1569363530603692034,2022-09-12,Acabou de publicar uma foto em Paróquia Santa Cândida https://t.co/8hR3TVpBZx
17,190379364,1569363441638326273,2022-09-12,Acabou de publicar uma foto em Paróquia Santa Cândida https://t.co/YDLytAAlXD
18,1613027815,1569332661243502592,2022-09-12,"Cuidar da Saúde Mental é um Mandamento do Conselho de Medicina!

Após um período de Pandemia, passamos por muitas alterações, é necessário um Cuidado, uma Atenção com nossa Mente, nossa Psique!

O Associado do Plano de Saúde tem acesso garantido com os Médicos da Aérea! https://t.co/Dp8x2yzwlb"
19,190379364,1569281878397710336,2022-09-12,Acabou de publicar uma foto em Paróquia Santa Cândida https://t.co/YDcQzVZwI9
20,190379364,1569281789134340102,2022-09-12,Acabou de publicar uma foto em Paróquia Santa Cândida https://t.co/dl3hWTGmNJ
21,129336320,1569173277188280323,2022-09-12,"Vou alí... falar com o povo que disse ter ""descoberto o Brasil"", porque precisam cobrir novamente. 

Tem algo errado que não está certo. em Museu do Ipiranga https://t.co/jKZDoZP7b9"
22,129336320,1569163371911725057,2022-09-12,"Museu do Ipiranga, até que enfim... em Museu do Ipiranga https://t.co/H3mYVTCb8b"
23,68211432,1569159547834757120,2022-09-12,"""Vou agora, levantar-me, volto à casa do meu pai"".
#quotesliterarios em Ipiranga - O Bairro Mais Importante Do País. https://t.co/YVXcrStTom"
24,201285499,1569118569211826178,2022-09-12,Acaba de publicar una foto en Museu do Ipiranga https://t.co/DOJITadxIy
25,1535339578487349248,1569107860948398080,2022-09-11,Agora a pouco no museu Ipiranga https://t.co/d2ngWrqjLG
26,79594476,1569073822933868545,2022-09-11,Conhecendo a Casa Rosa! em Ipiranga - O Bairro Mais Importante Do País. https://t.co/Cjg0CAzBZ6
27,47652768,1569064611546107904,2022-09-11,"&lt; ouviram do Ipiranga, às margens plácidas, de um povo heroico, o brado retumbante. 🇧🇷&gt; @ Museu do Ipiranga https://t.co/rT2gE88eVs"
28,1592643384,1569048338166685703,2022-09-11,🤟🏼 https://t.co/WueNoH5dRw
29,984867291581042690,1569010596468736000,2022-09-11,Sejam bem vindos ao novo museu e a minha nova versão 🥰 em Museu do Ipiranga https://t.co/fWQtLxsoa4
30,1545571816760025088,1569010427111116809,2022-09-11,"Bora inaugurar a linha 15 prata 😏
Primeira vez no monotrilho 😁
 #MetroSP #ZL #sp https://t.co/VCIHNexNj9"
31,60211118,1569007256452177922,2022-09-11,Olha quem tá querendo aparecer 🍑 hahah https://t.co/JGlt4fh6SZ
32,1521510305649602564,1568983161379471362,2022-09-11,"É hoje. Raider Nation 4 Life!!!
Conexão Carr to Adams!!!
Segura nós!!!
#NFLnaESPN 
#nfl 
#RaiderNation https://t.co/pPwK5oG5pn"
33,1512442312479199232,1568972723057209344,2022-09-11,#🇧🇷 https://t.co/rmA4H8madb
34,190379364,1568970953543008256,2022-09-11,Acabou de publicar uma foto em Paróquia Santa Cândida https://t.co/OXLu4zMs7p
35,190379364,1568970229866438659,2022-09-11,Acabou de publicar uma foto em Paróquia Santa Cândida https://t.co/4JPj43IY2e
36,190379364,1568970194424406019,2022-09-11,Acabou de publicar uma foto em Paróquia Santa Cândida https://t.co/0RFQiyictK
37,86780048,1568968410674991112,2022-09-11,"Turistando mto esse fim de semana. (@ Museu do Ipiranga - @museupaulista in São Paulo, SP) https://t.co/nOetnlowsN https://t.co/VhLv33eSv0"
38,190379364,1568903453593800704,2022-09-11,Acabou de publicar uma foto em Paróquia Santa Cândida https://t.co/icXhKswqXf
39,1486058855268294656,1568763816145461248,2022-09-11,Acabou de publicar uma foto em Museu do Ipiranga https://t.co/9nOT4uh1xG
40,86780048,1568739597433335808,2022-09-10,"I'm at Parque da Independência in São Paulo, SP https://t.co/rsaGmR4NG8 https://t.co/s5X1Ng6sml"
41,66571468,1568721375237656576,2022-09-10,I'm at Condomínio Las Villas in São Paulo w/ @tonazevedo @rafael_sucao https://t.co/FkonX7OncB
42,2886790366,1568687841168982016,2022-09-10,"Mulher tem voz! Mulher tem força! Mulheres autênticas. Donas de si, sabem o que querem! @Zambelli2210 🇧🇷2️⃣2️⃣🔟🇧🇷 https://t.co/Co9EE4P5e1"
43,1545571816760025088,1568663480139399169,2022-09-10,A capivara do #Pantanal tá diferente 😏 Dona @tvglobo chama eu de figurante 😅 Partiu show do @GabrielSater ❤ O Cramulhão do #Pantanar 😈 https://t.co/5W4bi8rmRB
44,531299575,1568645778712989698,2022-09-10,Acabou de publicar uma foto em Piracaia https://t.co/0YbgaKy1I2
45,1521510305649602564,1568643039866032128,2022-09-10,"Dificuldade de falar pra um amigo que não estou saindo pra tomar umas a noite. Fora estar fazendo uso de remédios controlados, tem blitz e tal.
Daqui a pouco eu invento algo."
46,181382369,1568635610717364226,2022-09-10,Acabou de publicar uma foto em Manifesto Skate Park https://t.co/u4WQyHDZ5p
47,546230403,1568624694772768770,2022-09-10,Acabou de publicar uma foto em Sacomã https://t.co/ontgCN4yZY
48,55751084,1568591401964736512,2022-09-10,O Aquário de São Paulo é INCRÍVEL! https://t.co/X3VdG7jSaE
49,190379364,1568570802123198464,2022-09-10,Acabou de publicar uma foto em Paróquia Santa Cândida https://t.co/SuD00lcA3L
50,190379364,1568570730446454787,2022-09-10,Acabou de publicar uma foto em Paróquia Santa Cândida https://t.co/MS6cDftSZZ
51,190379364,1568570433271697410,2022-09-10,Acabou de publicar uma foto em Paróquia Santa Cândida https://t.co/HUvIDpDuGo
52,190379364,1568570353005527040,2022-09-10,Acabou de publicar uma foto em Paróquia Santa Cândida https://t.co/riVCquQdJF
53,1568224923969114112,1568538893233815552,2022-09-10,"#pets 
#dogs
Tanta beleza,tanta fofura... https://t.co/xdlYbSoIlY"
54,144171098,1568458110024531969,2022-09-10,#videomapping #bicentenario #museudoipiranga #vjscan #2022  foto by @taniamatahary @ Museu do Ipiranga https://t.co/II5ddGtwuG
55,727083578278993920,1568374489804849157,2022-09-09,Boa noite em Playball - Bola Na Trave Futebol Feminino https://t.co/cqtu9p0rWc
56,1592643384,1568330381090324482,2022-09-09,"Hoje também foi dia de revisar nossa aplicação de PPF @upgrade_customs nessa Taycan 4S com nossos parceiros da @flip_wash_ricardo_jafet!!! 

Todo zelo e cuidado de nossa equipe…. @guiwrap_personalcar em Upgrade Customs https://t.co/FmrXQqddlI"
57,2886790366,1568309015297269760,2022-09-09,Avenida Paulista tomada pelo mar do verde e amarelo! Um povo. Uma voz! Uma nação família patriota pelo futuro do país 🇧🇷 7 de Setembro marcou os 200 anos da história do Brasil🇧🇷 Bicentenário da Independência do Brasil 🇧🇷 https://t.co/4a7hEmdDSf
58,1521510305649602564,1568291203245899776,2022-09-09,@EsportudoW @vevitolas Continue assim sendo essa pessoa bacana que vc é. Sucesso total sempre.
59,1521510305649602564,1568290786428731395,2022-09-09,"Qual será a temperatura que vai estar em SP no domingo la pras 17:00? Ver Raiderzão pela primeira vez de jersey em mais de 30 anos de vida kkk Será um marco !!! Vou cozinhar? Sim. To nem ai? Talvez kkk
#RaiderNation"
60,2886790366,1568283925507903489,2022-09-09,@pauloguedesbot Ministro Paulo Guedes se coloca na posição de um cidadão brasileiro e faz uma perspectiva sobre a Economia Brasileira e Internacional valorizando a capacidade de gestão do nosso futuro governador de São Paulo Tarcísio @tarcisiogdf 🔟 - 08/09/2022 https://t.co/rsjatifeCg
61,190379364,1568283365278638080,2022-09-09,Acabou de publicar uma foto em Paróquia Santa Cândida https://t.co/cm12bnp9iB
62,16423307,1568274390944546820,2022-09-09,♥️ https://t.co/XX0vAzOY21
63,1613027815,1568249349888409600,2022-09-09,"Pessoas Especiais tratadas com Atenção, Curto Prazo para Consultas Exames e Diagnósticos!

O Plano de Saúde lhe oferece este Serviço Especial!

Planos Individuais / Familiar / Adesão / MEI / Empresarial https://t.co/AhvEHRRt4k"
64,1613027815,1568249288354058243,2022-09-09,"Venha para a Lecroc_store
Sofisticação em seu Visual
Parcelamos suas Compras no Cartão de Crédito! https://t.co/F3WS9rpssu"
65,1613027815,1568248889613975552,2022-09-09,"Pessoas Especiais tratadas com Atenção, Curto Prazo para Consultas Exames e Diagnósticos!

O Plano de Saúde lhe oferece este Serviço Especial!

Planos Individuais / Familiar / Adesão / MEI / Empresarial https://t.co/6gFvUFwK3e"
66,190379364,1568238103403597824,2022-09-09,Acabou de publicar uma foto em Paróquia Santa Cândida https://t.co/F8pnoPo76R
67,579387724,1568206836716683267,2022-09-09,"I'm at Cepam - @padariacepam in São Paulo, SP https://t.co/khHWKIY3VH https://t.co/5RNroc0LRp"
68,190379364,1568201342979608577,2022-09-09,Acabou de publicar uma foto em Paróquia Santa Cândida https://t.co/qpAh9n1z6A
69,90432796,1568194111160598528,2022-09-09,"Sobre ontem em um dos lugares preferidos de SP, com mamis 🥰❤️ 
.
.
#sp #011 #sãopaulo #deontem #museudoipiranga #ipiranga #amo em Museu do Ipiranga https://t.co/5MzpOlT5dL"
70,1521510305649602564,1568093367182950405,2022-09-09,"""Os mais falsos e hipócritas são muitas vezes os que afirmam gostar de você.""
#ficaadica"
71,797252943804252160,1568073043485855747,2022-09-09,🎭 em Sacomã https://t.co/tToWHKMwNY
72,359647331,1567978608744091648,2022-09-08,Mooca é Mooca... https://t.co/fgJ1WnYsT2
73,1521510305649602564,1567972057916342284,2022-09-08,"Fui ao centro, Santa Efigênia...
Vi metade de um roubo: Moleque correndo na avenida e a senhora correndo e xingando atrás. Creio que foi mais um celular. Segurança tinha melhorado, mas, ja deu pra ver focos de drogados/noias espalhados por la. Resolvi umas coisas e voltei."
74,75911540,1567961081263407105,2022-09-08,"Enquanto isto, em 07 de setembro #200anos depois... em Museu do Ipiranga https://t.co/DggBsemWTW"
75,2886790366,1567959390107598851,2022-09-08,"Hoje 08.Set às 19h00 no Clube Juventus receberemos o candidato à governador Tarcísio @tarcisiogdf para tratar sobre o atual Cenário da Economia Brasileira.
Endereço: Rua Juventus, 660, Moóca, São Paulo.
Amig@s compartilham @Callas_Brasil  @EliseCavi @MARINESARALDI https://t.co/yEVeATn8gO"
76,1521510305649602564,1567947511712595969,2022-09-08,"Hoje volta a NFL
Um calor em Sp, se colocar o preto Raiderzão vou cozinhar kkk
Talvez acompanhe com menos fanatismo quanto já fui pra essa temporada. Fiz muitas amizades com esportes via internet, perdi grandes pessoas por brigas bobas. Sei lá, vou mais na manha do gato 🐱 kkk"
77,190379364,1567942315867611136,2022-09-08,Acabou de publicar uma foto em Paróquia Santa Cândida https://t.co/3njBGXh2j5
78,190379364,1567942196225253376,2022-09-08,Acabou de publicar uma foto em Paróquia Santa Cândida https://t.co/oihXbzQjj6
79,1521510305649602564,1567895582361919490,2022-09-08,"Aprendendo a fazer costura em roupa com meu pai. Deu certo kkk
Ele é médico, já fez muito ponto em pessoas.
Quase o mesmo princípio
Obs: Casa ponto longe um do outro, mas, valeu"
80,297602795,1567876927569989632,2022-09-08,https://t.co/Z5kNZi3mXR
81,71952282,1567869212575547397,2022-09-08,Acabou de publicar uma foto em Santthora Jewel https://t.co/tc1lClQpAc
82,221156709,1567855283229040641,2022-09-08,"Artigos decorativos para a sua sessão de yoga. 🧘🏾‍♂️🧘🏾‍♀️

JungleCasa, objetos trazidos da Ásia. ⛩️🎋

#yogabrasil #yoga #meditação #meditando #bhujangasana #decoracaointeriores em Jungle Casa Decoração Oriental https://t.co/NIOLu4FqVf"
83,78417340,1567852251657404417,2022-09-08,"Bora de #TBT Jardins do Museu do Ipiranga SP 2010.
#museudoipiranga
#saopaulo em Museu do Ipiranga,São Paulo https://t.co/MVWJlPg18s"
84,190379364,1567832282467078145,2022-09-08,Acabou de publicar uma foto em Paróquia Santa Cândida https://t.co/DUyPbzwhQi
85,190379364,1567832232416481280,2022-09-08,Acabou de publicar uma foto em Paróquia Santa Cândida https://t.co/c8ZW6FbWQJ
86,190379364,1567832156407496704,2022-09-08,Acabou de publicar uma foto em Paróquia Santa Cândida https://t.co/INt0ERcwq2
87,144811662,1567826051967123457,2022-09-08,Acabou de publicar uma foto em Estação Tamanduateí https://t.co/muGWGOcT5g
88,774469015,1567790765082038272,2022-09-08,"📍 SÃO PAULO BRASIL

#maisumnomundo #saopaulo #brasil #instagood #nightshot #fotonoturna #palacio #antigo #palace #antique em Ipiranga (district of São Paulo) https://t.co/ax19N96Uyv"
89,4715652562,1567711272870838272,2022-09-08,"Faça sempre o que tem que fazer e não o que foi apenas lhe pedido para fazer. 

#SFT37

📸 @fotografiaedurocha 

@sftcombat @sftcombatusa 

#mma #sftcombat #sft37 #sftmma #sftx #sftmma #fightclub #fightclubmma https://t.co/g3i8iRm7yd"
90,44934419,1567708060910485506,2022-09-08,"Bicentenário da Independência do Brasil ❤
#ForaBolsonaro em Ipiranga - O Bairro Mais Importante Do País. https://t.co/DDMOAq1wEj"
91,357561011,1567705428565311488,2022-09-08,Reabertura do*Novo Museo do Ipiranga no dia do Bicentenário da Independência do Brasil em Museu do Ipiranga https://t.co/6hBfD5et85
92,136525766,1567704099558154242,2022-09-08,Acabou de publicar uma foto em As margens do Rio Ipiranga https://t.co/CFZz91iIHQ
93,147034786,1567702208598384640,2022-09-08,"Com a melhor cia, prestigiando o nosso amigo @davidjmoraes_ na reinauguração do Museu do Ipiranga em Museu do Ipiranga https://t.co/9Uekj9rDNs"
94,295326327,1567697088028332032,2022-09-08,"“Verás que o filho teu não foge à luta.”
 Viva nossa democracia, viva nossa independência, viva o BRASIL. 🇧🇷🇧🇷
#BolsonaroReeleitoEm2022 #7desetembro #200AnosDaIndependencia https://t.co/DNnV0NeA3l"
95,774469015,1567690732449718273,2022-09-08,"📍MUSEU DO IPIRANGA - SÃO PAULO BRASIL
Parada pra ver o Novo Museu do Ipiranga ... De longe⚠️

#maisumnomundo #saopaulo #brasil #independencia #museudoipiranga #ipiranga #historia #show #independenceday #history https://t.co/opBpwzlflH"
96,8205502,1567681808929628161,2022-09-08,Acabou de publicar uma foto em Museu do Ipiranga https://t.co/qswe8ON1Db
97,854502288819441666,1567681392145797120,2022-09-08,Incrível! @juliette https://t.co/3C1ds1iRkr
98,27152664,1567673084278341632,2022-09-08,"depois de anos juntando poeira, tive coragem de mexer. #workinprogress #wip #trabalhoemandamento #4árvorespretas #aoficinadebrunourbanavicius #flagrantesdavidareal #eviteacriseanuncie #artistaétrabalhador https://t.co/Cou47ZzDal"
99,824791354484088832,1567666669702496256,2022-09-08,"Só consegui tirar essa foto dela pq eu queria prestar atenção somente nela cantando, e que CANTORA!!! 😭
te amo @juliette te amo https://t.co/zZbspu6BOo"
100,754091462774648833,1567665105998909448,2022-09-08,não resisti e vim ser iludida pelo show de drones 🤡 https://t.co/Pfj17DtTyf
101,1256730258113466369,1567663681340674048,2022-09-07,#PrefiroCiro https://t.co/wixOj4XP3R
102,1256730258113466369,1567663495650414595,2022-09-07,#PrefiroCiro https://t.co/HB3iQOHkHb
103,40146795,1567656725242691589,2022-09-07,Acabou de publicar uma foto em Museu do Ipiranga https://t.co/r1ckA7KJaa
104,1256730258113466369,1567655352061104128,2022-09-07,"Difícil acompanhar o candidato que + vai a sabatinas, rs. Mas o bom é que não muda o discurso, como os 2 que roubaram propostas dele. https://t.co/OgjOr6dJRs"
105,15329559,1567653068023414784,2022-09-07,Feliz em visitar o @museudoipiranga com o @danilo_huvos no dia do bicentenário da Independência do Brasil. Obrigado pelo convite @jushellard @institutoband #museudoipiranga #bicentenario #independenciadobrasil https://t.co/Vmwv1yvV7i
106,1256730258113466369,1567651996315811842,2022-09-07,"@gduvivier, quem é aliado do #Gedel (50 🌽 em $) e #Eunicio é o L.
Ruim não é dizer q assunto técnico é complexo pra quem não é da área Eco (seja da ""favela"" ou não). ELITISTA É DAR + $ PROS BANCOS QUE POVO, é ser o Neoliberal Simpático. O ""Brother das Empreteiras)
#PrefiroCiro https://t.co/dCvT8RH3cI"
107,1256730258113466369,1567650912276979713,2022-09-07,"@linsaquiles @gduvivier Quem é aliado do #Gedel e #Eunicio é o Lula. 
O problema não é dizer wue assunto técnico é complexo pra quem não é da área Econômica (seja da ""comunidade"" ou não). Ser ELITISTA É DAR + $ PROS BANCOS QUE POVO, é ser o Neoliberal Simpático.
#PrefiroCiro https://t.co/3rdoT1KZs2"
108,1256730258113466369,1567650128508473346,2022-09-07,@linsaquiles @gduvivier https://t.co/scWqdb38pV
109,1120376289683214337,1567649943141363712,2022-09-07,"Olhadinha no retorno kkkk
Museu do IPIRANGA Reinauguração 9 anos de reforma , 200 drones formam a Bandeira Nacional Brasileira  foi top em Museu do Ipiranga https://t.co/h0NGd3N3yD"
110,1120376289683214337,1567642680934502400,2022-09-07,"Link ao vivo para @templourgente  Reinauguração do Museu do
IPIRANGA depois de 9 anos em Museu do Ipiranga https://t.co/zljjzMQ5GL"
111,1486058855268294656,1567638111923982336,2022-09-07,"E a festa da Inauguração do Museu foi linda!!!

Muita luz e muitos shows. Este 7 de setembro no museu do Ipiranga 🥰
.
.
.
#independenciadobrasil #setedesetembro #museudoipiranga #ipiranga #parquedaindependencia https://t.co/nkX9bLDMcQ"
112,721037381072265216,1567622188659769345,2022-09-07,a postos https://t.co/tXaRCOHFyT
