,author_id,tweet_id,created_at,text
0,224463912,1533947107689779201,2022-06-06,https://t.co/hDV2wdW1nd
1,358558153,1533946042294513664,2022-06-06,Acabou de publicar uma foto em Odontologia Agda Andrade https://t.co/z4nDXUrIZZ
2,358558153,1533945587476881413,2022-06-06,Acabou de publicar uma foto em Odontologia Agda Andrade https://t.co/Iz0c0k1s0O
3,2251797826,1533939038884974594,2022-06-06,"Pedrinho, vai dormir!!!! Pq hj tem samba e vc não vai!!! Hehehehehehe!!!!
#sambaéaminhavida 
#camisa12 
#sambaenredonaveia 
#011/013
#tmjuntim"
4,224463912,1533924912473178118,2022-06-06,Lá Vamos nós https://t.co/0dFPJzPOFO
5,190379364,1533881765361856512,2022-06-06,Acabou de publicar uma foto em Paróquia Santa Cândida https://t.co/TN4T2kkl5o
6,190379364,1533881653025701888,2022-06-06,Acabou de publicar uma foto em Paróquia Santa Cândida https://t.co/Fp97aXWZ2X
7,358558153,1533879829291933697,2022-06-06,Acabou de publicar uma foto em Odontologia Agda Andrade https://t.co/wYey807ewU
8,976117022022127617,1533855019421814784,2022-06-06,@pedrocafe_ Tbm odeio você só de se chamar pedro
9,28437915,1533823158184288258,2022-06-06,"The real oldschool antifascists are called fascist by the young fake antifascists

D-Day, 78 years ago today, Normady Beach. The end of the Terror. Thanks all for your services!

Dia D, há 78 anos, Praia da Normandia. O fim do Terror. Obrigado a todos!

#DDay #DDay78  #Normandy https://t.co/yTpcBYJN9J"
10,190379364,1533800754657517568,2022-06-06,Acabou de publicar uma foto em Paróquia Santa Cândida https://t.co/Fg6S5rDobH
11,190379364,1533800646452862978,2022-06-06,Nesta terça-feira as 21h30 na @tvcancaonova em Paróquia Santa Cândida https://t.co/buwFgNW1V2
12,190379364,1533785327265095681,2022-06-06,Acabou de publicar uma foto em Paróquia Santa Cândida https://t.co/iGTwHRuCZR
13,190379364,1533785270289633280,2022-06-06,Acabou de publicar uma foto em Paróquia Santa Cândida https://t.co/zT7YCQWFY4
14,190379364,1533785202119540736,2022-06-06,Acabou de publicar uma foto em Paróquia Santa Cândida https://t.co/5oWu0pwNhv
15,190379364,1533755563884036096,2022-06-06,"Da Santa Missa de Pentecostes deste ano, na qual foram investidas como Coroinha e Acolita, a Maria Clara e a Giovana, respectivamente. Muito bem-vindas, e Deus abençoe o vosso ministério na nossa @santacandidasp https://t.co/ikC7tz7wuY"
16,190379364,1533755272484749312,2022-06-06,"Da Santa Missa de Pentecostes deste ano, na qual foram investidas como Coroinha e Acolita, a Maria Clara e a Giovana, respectivamente. Muito bem-vindas, e Deus abençoe o vosso ministério na nossa @santacandidasp https://t.co/KojtOWt9aL"
17,732736663793881088,1533660183213252608,2022-06-06,"Está reformando e não sabe qual piso instalar? Podemos te ajudar nessa tarefa, pra que você tenha o melhor resultado sem gastar uma fortuna. Entre em contato conosco e agende uma visita em nosso Show-room. 

WhatsApp: (11) 9.7661-8992 

#projepisos #pisos #pisosvinilicos https://t.co/Pe87WxlkPr"
18,38796664,1533658183935336448,2022-06-06,Uma noite antológica! Eu Vivo na Terra que nana leite e mel Chalav U’Dvash” em Betlehem Igreja Apostólica https://t.co/1DlWtE1Ko2
19,1301010707216052225,1533623180757282817,2022-06-06,❄️ https://t.co/1RY3uYm2Ew
20,190379364,1533607921921187841,2022-06-06,Acabou de publicar uma foto em Paróquia Santa Cândida https://t.co/y8xkXHOaP4
21,35614608,1533560390772305922,2022-06-05,Um CAOS no Mooca Plaza Shopping. Fizeram o festival do torresmo no local. Tudo parado para sair do estacionamento. Um segurança disse para uma cliente que algumas cancelas quebraram e que o local suporta três mil carros e tem quatro mil e quinhentos. https://t.co/ythxPvfz8b
22,917028523,1533554474698014723,2022-06-05,"""Quando a noite cai... Eu penso em você. E nos caminhos que hão de vir"" (Sugar, Marina Lima) https://t.co/DO313RfMlU"
23,280705494,1533553308639567872,2022-06-05,Acabou de publicar uma foto em Komplexo Tempo https://t.co/Ujo3p8E8Qp
24,188889800,1533545165050236943,2022-06-05,Ai que frio… vou até colocar meu cropped de manga longa 🫶🏻 https://t.co/jRslygAbD5
25,1592643384,1533519133798711299,2022-06-05,"Na manhã de 5 de junho de 1985, Ferris acordou sem vontade de ir à escola. O resto é história do cinema. 🍿🎬 em Upgrade Customs https://t.co/8u47uxzKUZ"
26,1304075424587296769,1533519083324555264,2022-06-05,Aqui no ipiranga encostem https://t.co/4K7MeElOAQ
27,45711835,1533498914749431808,2022-06-05,@partidonovo30 👏👏👏 em Ipiranga (district of São Paulo) https://t.co/s3GSvqH9cJ
28,50478237,1533495198214459392,2022-06-05,Mafalda no rolê do Festival do Torresmo. Porco é pra assar mesmo! https://t.co/HZIOTtdAU7
29,14293099,1533489200112324608,2022-06-05,"Repost da patroa (@mariaceciliasilveira) pq, CREDO, que moleque bonito. em Vila Prudente https://t.co/PhSMWp5Jq4"
30,1521510305649602564,1533487927296131072,2022-06-05,"Galera, ando meio afastado do TT pois não ando bem esses dias.
Cuidando da saúde. Tá complicado mas temos que seguir em frente."
31,35588436,1533478520256483331,2022-06-05,Acabou de publicar uma foto em Bike Leste https://t.co/VDj4onPeRa
32,443268298,1533478498974715906,2022-06-05,"Melhor café. (@ Fran's Café in São Paulo, SP) https://t.co/wzKhNUs9GA https://t.co/iB3An3MEV1"
33,190379364,1533470249026301954,2022-06-05,Acabou de publicar uma foto em Paróquia Santa Cândida https://t.co/hD0vOYWcNS
34,190379364,1533469943584501761,2022-06-05,Acabou de publicar uma foto em Paróquia Santa Cândida https://t.co/Z6P5bCUy9d
35,187693596,1533468563507396612,2022-06-05,Ontem foi dia de fight 👊🏻🔥💪🏻🥊 https://t.co/XonUpIcuYr
36,736511804323581952,1533452715858305027,2022-06-05,"O artista - agora em cores! em Moinho Velho, São Paulo - SP https://t.co/eUUW2DGrDB"
37,1318929622952792065,1533447687559061505,2022-06-05,Adorei a luz desse banheiro 😁 em Komplexo Tempo https://t.co/p0GThylFxl
38,190379364,1533405780614868992,2022-06-05,Acabou de publicar uma foto em Paróquia Santa Cândida https://t.co/5Issf7pNCw
39,190379364,1533405689657237505,2022-06-05,Acabou de publicar uma foto em Paróquia Santa Cândida https://t.co/vdighhmAsC
40,16631711,1533288973291859968,2022-06-05,"Motive a si mesmo a prosseguir, pois você é o único que entende suas dificuldades. em Centro Velho De Sampa https://t.co/q2OJuOTtKg"
41,736511804323581952,1533260258700931074,2022-06-05,"Pensa num artista em Moinho Velho, São Paulo - SP https://t.co/ZbdY2tXSIu"
42,2434411259,1533259056093208578,2022-06-05,"Sim eles crescem , o tempo passa ...

E só tenho a capacidade de agradecer o cara lá de cima...

De fato não merecia ser tão agraciado...não mesmo

Somente isso... em Vila Prudente https://t.co/H1FNnKR1at"
43,54532456,1533252245151698944,2022-06-05,Acabou de publicar uma foto em Clube Atlético Ypiranga https://t.co/xyf3lXdeta
44,981333167515881472,1533248676381999105,2022-06-05,🙈🙈😩😩😩 em Clube Trackday https://t.co/DGZUoW4SFU
45,1354164949954781187,1533242339652780032,2022-06-05,https://t.co/TfMH3rxtze
46,1533232391518662656,1533240973760909312,2022-06-05,✨ https://t.co/59L0O3i39W
47,78992868,1533238281264959489,2022-06-05,Jurassic World Domínio! em Cinemark Mooca Plaza Shopping https://t.co/L3dkJxtq8C
48,1371667306733010945,1533234638721847298,2022-06-04,#SPFW https://t.co/8EAdeh8j3Z
49,73956998,1533214397228797952,2022-06-04,São Paulo Fashion Week com o desfile do meu queridíssimo @walerioaraujo ❤️‍🔥 #SPFW53 em Komplexo Tempo https://t.co/gijOJkebIg
50,1521510305649602564,1533214119427510272,2022-06-04,"@silvinhareis Se é FUEGO, deve deixar bem demais hein kkk
Boa noite moça !!! kkk"
51,1521510305649602564,1533213883695042561,2022-06-04,"Boa noite meu polvo.
Passando por uns dias meu ruins, mas as coisas tem que ir pra frente. Vou dar noticias. Nem sei as fofocas novas no twitter kkkk
Bjs pras minas, abraços nos manos."
52,4715652562,1533202969122025474,2022-06-04,Acabou de publicar uma foto em Clube Atlético Juventus https://t.co/xIKVmUOAh6
53,67202036,1533135729097814016,2022-06-04,"Falta 1 semana para mais esse espetáculo do @Belo em SP 🥰🎙🎶 
Vem todo mundo!!! em Clube Atlético Juventus https://t.co/lpVzvKP5Es"
54,981333167515881472,1533134183127732226,2022-06-04,Acabou de publicar uma foto em Clube Trackday https://t.co/fDbNZbS5tO
55,42611569,1533123181401317378,2022-06-04,"Hoje, meu marido esta estreando seu carrinho de doces, e eu tô muito orgulhoso dele ❤️🏳️‍🌈  

Ele está no Instagram gente 😉
https://t.co/XTgAb81xnQ https://t.co/lieiACx0rS"
56,1903994184,1533121477196644358,2022-06-04,Acabou de publicar uma foto em Espaço Núcleo Femme https://t.co/LT2sg67PKa
57,1521510305649602564,1533110375239102464,2022-06-04,"Deveria haver réplica e tréplica para comentários sobre locais no Google kkk
Ia ser mais engraçado 😜😜😜"
58,120556049,1533106630845513729,2022-06-04,Acabou de publicar uma foto em Central Plaza Shopping https://t.co/momo7Bib0y
59,1329061617712164867,1533089492650827781,2022-06-04,Transmissão da Copa CAY aqui no Clube Atlético Ypiranga! #futebol #somostodoscay #dodonarrador https://t.co/Rgh8A9cA53
60,4715652562,1533080512851546112,2022-06-04,Acabou de publicar uma foto em Clube Atlético Juventus https://t.co/AbmBR5GrPP
61,190379364,1533068250522714112,2022-06-04,Acabou de publicar uma foto em Paróquia Santa Cândida https://t.co/OxUSiOXlMV
62,190379364,1533068135703584768,2022-06-04,Acabou de publicar uma foto em Paróquia Santa Cândida https://t.co/5NDjpHZYeZ
63,981333167515881472,1533059619584614400,2022-06-04,"O sucesso nunca é permanente.
O fracasso nunca é total.
O importante é a coragem de lutar.

Borá pra cima ⚡️🚀🍀🔥🙌🏼 em Clube Trackday https://t.co/uX8ycOq74i"
64,190379364,1532915632211120128,2022-06-04,Acabou de publicar uma foto em Paróquia Santa Cândida https://t.co/euK9lmLtTW
65,190379364,1532915559725244420,2022-06-04,Eu e algumas das coroinhas danosas @santacandidasp em Paróquia Santa Cândida https://t.co/rqrc0pKzRI
66,190379364,1532915366980202498,2022-06-04,"Um abraço que envolve muito amor e alegria, em poder testemunhar o noivado da minha querida filha, irmã e diretora do Gente deFé @jehcris_cn em Paróquia Santa Cândida https://t.co/3U7sbdH4Ho"
67,64258447,1532910300734758913,2022-06-04,"A outra sorri de olho fechado pra luz 😅

Mais uma só pra fechar a fileirinha ✨ em Buffet Marcante https://t.co/yqNK6fwg4C"
68,38796664,1532907430698434561,2022-06-04,"No Domingo celebraremos SHAVUOT, com nossa família BETLEHEM e com todos os amigos queridos que forem trazidos pelo Amor do Nosso Pai! Sejam muito bem vindos! em Betlehem Igreja Apostólica https://t.co/ZpCh0MGcez"
69,55310560,1532884250260914176,2022-06-04,"bastante carinho nele porque está gripadinho! #spitzjapones 🐶✨
•
•
@luckyfilgueiras em Vila Prudente https://t.co/7KsQbjf4Bg"
70,1392698040,1532879924033474563,2022-06-04,Hoje com o cunhadinho e cunhadinha! em Quinkas Bar Ipiranga https://t.co/tqU9WuIfxv
71,1468041386519785476,1532874300960677889,2022-06-03,"MANO SIFUDE KI HOMEM LINDO, PISA EM MIM T3DDY FAZ O QUE QUISER EU SEI FAZER ARROZ E FEIJAO https://t.co/ThhArScg8e"
72,981333167515881472,1532863663157256198,2022-06-03,"Irmãs na fila de espera.
Já já estarão nas pistas.
@ricardomasumoto @carreira_81 em Clube Trackday https://t.co/aVJE8cB38H"
73,981333167515881472,1532863327461732353,2022-06-03,"Adesivo e marca nova @philippinhotrackday 
Desenvolvido pelos melhores @agenciaideen @eufranme @lucaslambertdesign vocês são fera demais. em Clube Trackday https://t.co/segw3ItWFl"
74,736511804323581952,1532846166156554240,2022-06-03,"Bonde dos Careca em Moinho Velho, São Paulo - SP https://t.co/kso5UUzfJ5"
75,78997743,1532809139008708612,2022-06-03,@iampauloandre desfilou para #misci no #komplexotempo  e fizemos matéria para #globoesporte #spfwn53 em Komplexo Tempo https://t.co/WEumdpHIPv
76,1592643384,1532782888927862786,2022-06-03,Just posted a photo @ Upgrade Customs https://t.co/KsVmJcIdpK
77,190379364,1532771654207778819,2022-06-03,Just posted a photo @ Paróquia Santa Cândida https://t.co/hdJINNJQNV
78,190379364,1532771551430557698,2022-06-03,Just posted a photo @ Paróquia Santa Cândida https://t.co/QvB0JmsYFV
79,360064315,1532767841954500608,2022-06-03,"Mais uma grande apresentação, esse registro ficou por conta do @carlos.phot #GloriaDeus 🙌🏽🙏🏽 em Clube Atlético Juventus https://t.co/ekKotKNzf5"
80,1521510305649602564,1532747176874590208,2022-06-03,"Vamo que vamo. Fim de semana chegou.
Tentando não sair na mão com idoso doido na rua kkkk
😭😭😭😭😭😭"
81,14418146,1532742049249824768,2022-06-03,"mystreetview project 
_
About the project (photographs of my view of city, click by cellphone)

#mystreetview #cellphoneproject em Ipiranga (district of São Paulo) https://t.co/3ljVTBNGOK"
82,190379364,1532737643909218304,2022-06-03,Just posted a photo @ Paróquia Santa Cândida https://t.co/3bJpw1pup8
83,190379364,1532737470193860608,2022-06-03,Just posted a photo @ Paróquia Santa Cândida https://t.co/vHeDNzLgL4
84,190379364,1532730252455292930,2022-06-03,Just posted a photo @ Paróquia Santa Cândida https://t.co/twdzTnazS1
85,190379364,1532730063933698048,2022-06-03,Just posted a photo @ Paróquia Santa Cândida https://t.co/igQ5jf7tmL
86,71351432,1532728513408770052,2022-06-03,"Degustação de produtos 

Conte com a Factu!

https://t.co/2m4ElDbnTD 

#degustação #pdv #factutrademarketing https://t.co/uTqlbdYFXJ"
87,63841291,1532715539944161283,2022-06-03,#spfwN53 photodump ❤️‍🔥 #SPFW https://t.co/jsJN1pXZG8
88,579387724,1532699331333083136,2022-06-03,I'm at Help Nails Esmalteria in São Paulo https://t.co/TWUMuiBDpG
89,190379364,1532692956729294848,2022-06-03,Just posted a photo @ Paróquia Santa Cândida https://t.co/jicd8N88bj
90,190379364,1532692834670858241,2022-06-03,Just posted a photo @ Paróquia Santa Cândida https://t.co/DOGozMRF2j
91,190379364,1532692417463341058,2022-06-03,Just posted a photo @ Paróquia Santa Cândida https://t.co/dOJNNGWGpT
92,190379364,1532690230800793600,2022-06-03,Just posted a photo @ Paróquia Santa Cândida https://t.co/XiqSyE6ybQ
93,190379364,1532690056837832706,2022-06-03,Just posted a photo @ Paróquia Santa Cândida https://t.co/HnifChwJeB
94,148029925,1532627517340667905,2022-06-03,Just posted a video @ Imoveis Marcelo kavaleski https://t.co/OBXWj7eEjC
95,2663965709,1532552853163626496,2022-06-03,"Sim, tem filtro 😜 mas ao vivo sou bonito também

##gaysp #gayrecife #gaymen #gaypride #gayman #gayboyfriend #pride🌈 #pridemonth #pride2020 #pride2022 #instagood #instagay #instagram #instalikes em Sacomã https://t.co/3fdX3fFPRk"
96,95519933,1532524403493425152,2022-06-03,#spfwN53 https://t.co/qDj4455zoy
97,45462135,1532513375753732101,2022-06-03,Acabou de publicar uma foto em Vila Prudente https://t.co/clJ0ZuG638
98,62080707,1532506290437619716,2022-06-02,Tava com saudades de um desfile presencial ❤️ https://t.co/9m2yj0Zjpw
99,45711835,1532477338667081728,2022-06-02,Parabéns tukão querido!!!! #Luky em Ipiranga (district of São Paulo) https://t.co/pddUYPDPxk
100,1183471371197792256,1532472186019143685,2022-06-02,"Linha 2 intervalo menor que 2 minutos em ambos os sentidos 
@SPSobreTrilhos @infosspbr @metrosp_oficial @metronoticiando @CampoLimpoNotic @nepomuceno_sr @Jacksonlucassp @drikadejesus https://t.co/gcpSUbM7Wl"
101,190379364,1532464171039838210,2022-06-02,Acabou de publicar uma foto em Paróquia Santa Cândida https://t.co/AHLCQtLXnx
102,190379364,1532464133936975873,2022-06-02,Acabou de publicar uma foto em Paróquia Santa Cândida https://t.co/IlQByg9PSb
103,190379364,1532444979318206466,2022-06-02,Acabou de publicar uma foto em Paróquia Santa Cândida https://t.co/So0h93lXXO
104,190379364,1532444893280456707,2022-06-02,Acabou de publicar uma foto em Paróquia Santa Cândida https://t.co/eG5kodKzvF
105,25932877,1532417200753197057,2022-06-02,"📓 Leitura do dia:

“Uma mulher vestida de silêncio”, biografia de Maria Thereza Goulart, escrita pelo jornalista @WagnerWilliam22, publicado pela @editorarecord 

📸 Fotografia na estação Tamanduateí, em São Paulo. https://t.co/kitoIVycKV"
106,1592643384,1532399246015619073,2022-06-02,"Faça o que é certo, não o que é fácil.... #onemoreday em Upgrade Customs https://t.co/dNAZEg4WPG"
107,379239422,1532394816054493184,2022-06-02,Acabou de publicar uma foto em Parque da Mooca https://t.co/CUO41AtcQJ
108,254242619,1532381863872020480,2022-06-02,"#tbt 

Rua de Heliópolis, zona sul de São Paulo, década de 80, local como esse em que o nosso autor, vivenciou por 10 anos. 

O que esse cenário de pobreza fez com ele, você descobre em nossa obra literária Favela no divã. 

#favelanodivã 
#heliopolis 
#helipa 
#tbt https://t.co/J77UUD0EBd"
109,1278354550647332864,1532381014504488961,2022-06-02,(11)963392331 rainha do oral e do beijo grego https://t.co/Dvjlxc7s4p
110,1490586129980182528,1532359024716533760,2022-06-02,#coletivo #juntosporsp #juntosporsaopaulo #saopaulo #sp #alesp #candidatura #precandidatura #precandidato #mulheresnapolitica #renovação #bemcomum #renovabr #brasil https://t.co/RTLHOqG9XX
111,190379364,1532357329374650372,2022-06-02,Acabou de publicar uma foto em Paróquia Santa Cândida https://t.co/Bhm1qJ9PwX
112,190379364,1532357301427838978,2022-06-02,Acabou de publicar uma foto em Paróquia Santa Cândida https://t.co/rdL4ePqCuG
113,1521510305649602564,1532356196497244163,2022-06-02,"Bom dia, sem sol na fazendinha :(
Mas, ouvi boas palavras e dicas de uma pessoa firmeza vinda do Twitter. Serviu pra dar um up, esquecer de problemas ""bobos"" e bola pra frente.
Meu ditado: ""Saiu 1, chegam 10""
Bjs paras as mulheres, abraços para os manos."
114,2663965709,1532343788114411521,2022-06-02,"Para hoje os 7 chacras

#zen #mistico #místico #chacras #sol #lua #luz #espiritualidade em Sacomã https://t.co/QmHE5IfpCp"
115,190379364,1532336493729042432,2022-06-02,Acabou de publicar uma foto em Paróquia Santa Cândida https://t.co/1gsYcfWVgV
116,190379364,1532336241626210304,2022-06-02,Acabou de publicar uma foto em Paróquia Santa Cândida https://t.co/ZZCFFsanR1
117,4706720667,1532333806652477440,2022-06-02,Acabou de publicar uma foto em Duvidando https://t.co/0EUjZcMHgg
118,1354462997700345865,1532326209299927047,2022-06-02,Acabou de publicar uma foto em Vila Prudente https://t.co/ALCksZObkA
119,297602795,1532312449684217856,2022-06-02,🐲 Boteco Caverna do Dragão 🐉 https://t.co/EndAqN8WnD
120,232528409,1532175956231741441,2022-06-02,"to aqui no terminal e acabei de ver um miranha descendo do ônibus

não tá fácil pra ninguém"
121,1213595685573914624,1532118424125640706,2022-06-01,"Umbandistas, entendam: Terreiros são, preponderantemente, territórios de preservação de existência e cultura negra, diferente disso  não é terreiro."
122,85163182,1532115306298023936,2022-06-01,Just posted a photo @ Komplexo Tempo https://t.co/iSdDwAmr0a
123,1521510305649602564,1532107760350941186,2022-06-01,"Conclusão pós consulta: Meu pré ceratocone não evoluiu, meu grau de astigmatismo ficou na mesma 🙏😱🥺
Não preciso de lentes novas e vamo que vamo. Dr meio seco, moda antiga, mas, rápido igual Sonic kkk"
124,251427835,1532094192855433220,2022-06-01,Na luta 🧑🏽‍💻📌
125,1429314596209405954,1532086974273802241,2022-06-01,Tupinambá demarcando. https://t.co/PgzI1RXoQz
126,4715652562,1532086375322947586,2022-06-01,Acabou de publicar uma foto em Clube Atlético Juventus https://t.co/X1HFyWYjn5
127,1521510305649602564,1532067779146547200,2022-06-01,"Óculos , máscara, tudo pra chegar bem na consulta do oftalmologista kkk https://t.co/Xufq8Kugr7"
128,190379364,1532066143099203584,2022-06-01,Acabou de publicar uma foto em Paróquia Santa Cândida https://t.co/EgHhhgO9YU
129,190379364,1532066101747515393,2022-06-01,Acabou de publicar uma foto em Paróquia Santa Cândida https://t.co/3JmroIRnHO
130,1521510305649602564,1532055772867207170,2022-06-01,"@RedRedMia @FabiVinco @GRZmotors Te envio essa, amarelo da cor do Packão.
AMG 45 sedã https://t.co/IJOuMyX004"
131,190379364,1532055143579009027,2022-06-01,Acabou de publicar uma foto em Paróquia Santa Cândida https://t.co/RW5c6SJ9ha
132,190379364,1532055108099649536,2022-06-01,Acabou de publicar uma foto em Paróquia Santa Cândida https://t.co/EV9z02D2eT
133,1521510305649602564,1532021419571306497,2022-06-01,"Época boa das festas juntas: Ficar preso na cadeia de madeira, no frio, porém, bêbado kkk
Criança te zoando. 
Junho sempre chega kkk"
134,190379364,1532012873899196417,2022-06-01,Acabou de publicar uma foto em Paróquia Santa Cândida https://t.co/yc2TorOkdQ
135,190379364,1532012842014105601,2022-06-01,Acabou de publicar uma foto em Paróquia Santa Cândida https://t.co/acXvOk6FZX
136,14293099,1532004458338582528,2022-06-01,Vai um cafezinho? NA MEIA! em Vila Prudente https://t.co/UaWqNr9Oah
137,190379364,1531949073426685956,2022-06-01,Acabou de publicar uma foto em Paróquia Santa Cândida https://t.co/uaXA7RDnwD
138,190379364,1531948984541003776,2022-06-01,Acabou de publicar uma foto em Paróquia Santa Cândida https://t.co/0nyKo4nZvs
139,190379364,1531948928702324736,2022-06-01,Acabou de publicar uma foto em Paróquia Santa Cândida https://t.co/i7iY5mHLki
140,190379364,1531947574785200128,2022-06-01,Acabou de publicar uma foto em Paróquia Santa Cândida https://t.co/ZMFQN9ZSv0
141,190379364,1531947286288388096,2022-06-01,Acabou de publicar uma foto em Paróquia Santa Cândida https://t.co/N2e1RU0Mhx
142,1422810738943479814,1531931577357410309,2022-06-01,Um frio Veneza! em AME Barradas https://t.co/lVuL1K548P
143,14504663,1531800644247592961,2022-06-01,Tava numa saudade https://t.co/N7ZiYNnFIK
144,64258447,1531797909087432704,2022-06-01,"Mais uma de ontem pq sim 💛

📷 @vivimarrese te amo em Buffet Marcante https://t.co/y108UW3FaU"
145,1298654566049873920,1531794090018365441,2022-06-01,"@rebstxt todo dia é dia, o erro é da sociedade e seus padrões"
146,2598588525,1531789478741819392,2022-06-01,queria beber
