,author_id,tweet_id,created_at,text
0,1903994184,1526134557443084291,2022-05-16,Acabou de publicar uma foto em Espaço Núcleo Femme https://t.co/AEfmTI8xuo
1,34779125,1526042558039789569,2022-05-16,O último pedacinho de Lua antes dela sumir atrás das nuvens por aqui #Eclipse https://t.co/kF3PMwimmO
2,34779125,1526037831499530242,2022-05-16,Seguimos tentando (e falhando) na busca de retrato do eclipse lunar https://t.co/jy9yuwlAWb
3,59567148,1526030045776695297,2022-05-16,é cada malabarismo que a gente faz pra não perder aquilo que já está perdido
4,241733376,1525987045071536128,2022-05-15,Osito polar 🐻‍❄️ en Aquário de São Paulo https://t.co/KSJYujpuv2
5,34779125,1525977060551929861,2022-05-15,E a Lua hoje? 🤩🌕 https://t.co/eNAwQuT1NO
6,190379364,1525955246664601602,2022-05-15,Acabou de publicar uma foto em Paróquia Santa Cândida https://t.co/NBrYFAfRYX
7,190379364,1525955213215027204,2022-05-15,Acabou de publicar uma foto em Paróquia Santa Cândida https://t.co/qpTgOwSKy8
8,190379364,1525955090900733954,2022-05-15,Acabou de publicar uma foto em Paróquia Santa Cândida https://t.co/DtzZo5Yunh
9,2396245058,1525932411791491074,2022-05-15,"""Taxar fortunas, gerar mais renda, mais oportunidades, facilitar a vida do povo!""
Esse será o meu mantra para as eleições 2022. #PrefiroCiro https://t.co/l2AVYYUJ9l"
10,190379364,1525906948599779329,2022-05-15,Acabou de publicar uma foto em Paróquia Santa Cândida https://t.co/EE7oK3MnFz
11,190379364,1525906826268659714,2022-05-15,Nesta terça-feira as 21:30 na @tvcancaonova em Paróquia Santa Cândida https://t.co/WvSdZiNm7P
12,1448510713283162113,1525887837714915328,2022-05-15,H e t que:. E. Chi y.     Jn.      B vc BB.      Vc h no https://t.co/18cGyGXysy https://t.co/moeCpBq5SB
13,23579118,1525885317827502083,2022-05-15,Acabou de publicar uma foto em Metrô Paraiso https://t.co/zQqH63q9kZ
14,144811662,1525863046387728385,2022-05-15,Acabou de publicar uma foto em Estação Vila Prudente https://t.co/nNhiYp7UtC
15,1525838597592580096,1525841039201804290,2022-05-15,https://t.co/LBjpNk1WDY
16,281472725,1525832941636505602,2022-05-15,"TBT com meu garotao
#novinhodopai #filhote #amomuito❤ em Funsai - Fundação Nossa Senhora Auxiliadora do Ipiranga https://t.co/6nFk7aDWZ3"
17,190379364,1525789587280236545,2022-05-15,Acabou de publicar uma foto em Paróquia Santa Cândida https://t.co/7H7AF7lfGS
18,190379364,1525789553092612096,2022-05-15,Acabou de publicar uma foto em Paróquia Santa Cândida https://t.co/t8CtwBtJR0
19,190379364,1525789512667906049,2022-05-15,Acabou de publicar uma foto em Paróquia Santa Cândida https://t.co/ul7O0dgJt8
20,97190766,1525655509218500610,2022-05-15,A noite pede uma: TEMPO… vamos!!
21,47965679,1525651525951016960,2022-05-15,"Eu devo ser uma sereia…
Não tenho medo nenhum de profundidades, mas um pavor enorme de viver no rasinho. ~a.nin em Museum Food Park https://t.co/NhXfdgwotf"
22,81146737,1525641257141297154,2022-05-15,"omg she's crazy 🤪 
.
.
.
.
.
#friends #love #piquenique #parqueipiranga #Ipiranga #nature #portrait #parquedaindependencia #saopaulo em Parque da Independência https://t.co/MHpetfXwQs"
23,190379364,1525640221752233985,2022-05-15,Acabou de publicar uma foto em Paróquia Santa Cândida https://t.co/BrA2sgxhsY
24,1521510305649602564,1525600092450959362,2022-05-14,Vou no lugar todos os dias e sinto uma energia negativa vindo de uma pessoa específica. Foda. Sempre te testando a fazer merda. Tenho que ser forte ou trocar o lugar. 👿👺😈
25,1272888458760138754,1525567928401281025,2022-05-14,"Cineminha.
Doctor Strange ❤️🌀💥🔥🌌🎬🍿 https://t.co/Fi6XeRtWkK"
26,34779125,1525498469661777920,2022-05-14,"#Pantanal é um sucesso de público e crítica aqui na feira do bairro. Uma feirante da barraca de frutas lamentava por não ter “visto a Juma” ontem, relatando ter orgulho de saber que a Alanis Guillen era conterrânea sua, de Santo André https://t.co/cGePZpP1zN"
27,736511804323581952,1525489688538226700,2022-05-14,❤️ em Nawaki Sushi https://t.co/UY2wrVpEjG
28,67085183,1525489024860712960,2022-05-14,Acabou de publicar uma foto em TCM Supply https://t.co/OCpcWif1I3
29,67085183,1525486432810176513,2022-05-14,Acabou de publicar uma foto em TCM Supply https://t.co/PMR93OBJB7
30,67085183,1525478482171637762,2022-05-14,Acabou de publicar uma foto em TCM Supply https://t.co/ByH0gBe2hI
31,190379364,1525303822834450432,2022-05-14,Do Batizado da Mariah em Paróquia Santa Cândida https://t.co/U5ObzePk7h
32,190379364,1525303628440997888,2022-05-14,Acabou de publicar uma foto em Paróquia Santa Cândida https://t.co/pxjRrd9PId
33,190379364,1525303536925478913,2022-05-14,Da série do meu afilhado Tobias em Paróquia Santa Cândida https://t.co/aAdBkuViV3
34,1521510305649602564,1525300780256923648,2022-05-14,"@bea_adami Temos o nosso Salem no condomínio. Hoje, ele meio que sumiu. Espero que ninguém tenha feito mal ao bichinho 😢 https://t.co/iVvLDopSsq"
35,298757506,1525274451755028487,2022-05-14,"Boooa Noitê,  vamos lá ser felizes no........ em Ipiranga (district of São Paulo) https://t.co/bwJ3b2gKj5"
36,34991437,1525251354565849088,2022-05-13,"Ângela Barbour 
Flora Ring, 02, 2022
Felt and Laser Cut em Ellora Ateliê https://t.co/oeXxR5dEbC"
37,34991437,1525250886011867136,2022-05-13,"Ângela Barbour 
Flora Rings, 2022
Felt and Laser Cut em Ellora Ateliê https://t.co/HPtUHoQESt"
38,34991437,1525248562593931309,2022-05-13,"Ângela Barbour 
Flora Ring 01
Felt with Laser Cut em Ellora Ateliê https://t.co/SZyYaxE4eF"
39,77844663,1525218863591346176,2022-05-13,Quer me ver feliz me leva em lugares que tenham bichinhos em Aquário de São Paulo https://t.co/TTDTP2PcH2
40,190379364,1525202070332223497,2022-05-13,Acabou de publicar uma foto em Paróquia Santa Cândida https://t.co/og0Og9OyEy
41,190379364,1525202016582213633,2022-05-13,Acabou de publicar uma foto em Paróquia Santa Cândida https://t.co/rk7pBokJTc
42,190379364,1525201958826565632,2022-05-13,Acabou de publicar uma foto em Paróquia Santa Cândida https://t.co/zN92UEonGd
43,67085183,1525189375394426880,2022-05-13,Acabou de publicar uma foto em TCM Supply https://t.co/o7QFOzBZW7
44,67085183,1525181467009196033,2022-05-13,Acabou de publicar uma foto em TCM Supply https://t.co/BCaBF6d9xv
45,1101575305,1525145242457866250,2022-05-13,Acabou de publicar uma foto em Uva Vinhos https://t.co/SimHRZUwVV
46,190379364,1525125358445645826,2022-05-13,Acabou de publicar uma foto em Paróquia Santa Cândida https://t.co/GSs2xjCCYk
47,190379364,1525125330272501762,2022-05-13,Acabou de publicar uma foto em Paróquia Santa Cândida https://t.co/J4DKFm1fZu
48,190379364,1525125291181490177,2022-05-13,Acabou de publicar uma foto em Paróquia Santa Cândida https://t.co/GPrlWroLFM
49,190379364,1525123191957495809,2022-05-13,Acabou de publicar uma foto em Paróquia Santa Cândida https://t.co/Am9pQsneOU
50,190379364,1525123126450962444,2022-05-13,Acabou de publicar uma foto em Paróquia Santa Cândida https://t.co/mJ0PoHd5rD
51,190379364,1525103923194957824,2022-05-13,Acabou de publicar uma foto em Paróquia Santa Cândida https://t.co/bszqy4rglH
52,85163182,1525102771208429570,2022-05-13,Just posted a photo @ Komplexo Tempo https://t.co/0JaO5WZvUI
53,148029925,1525081958522445824,2022-05-13,Acabou de publicar uma foto em Imoveis Marcelo kavaleski https://t.co/UBcFyAv8e5
54,190379364,1525055447077736448,2022-05-13,Acabou de publicar uma foto em Paróquia Santa Cândida https://t.co/0bFHuAKrZL
55,190379364,1525055409731645443,2022-05-13,Acabou de publicar uma foto em Paróquia Santa Cândida https://t.co/YupowDglTo
56,190379364,1525055371055882244,2022-05-13,Acabou de publicar uma foto em Paróquia Santa Cândida https://t.co/aurEh6rxiv
57,23539355,1524923486526898211,2022-05-13,"Acabou de publicar uma foto em Visconde De Itaúna, Ipiranga https://t.co/vodpRi216d"
58,67085183,1524915547091107846,2022-05-13,Acabou de publicar uma foto em TCM Supply https://t.co/9U3XU70aGB
59,67085183,1524914879907364890,2022-05-13,Acabou de publicar uma foto em TCM Supply https://t.co/iJWqZzJUWO
60,992906200441327616,1524894571850674176,2022-05-12,Eu odeio o fato do meu cabelo ser escrotamente fino e em TODA foto que eu tiro eu fico parecendo aqueles calvos de cabelo ralo. em Chácara Klabin https://t.co/HvDx3vy4u8
61,34779125,1524890727909675019,2022-05-12,"Alto do Ipiranga, visto a partir do Sacomã 🤔 https://t.co/kE1a7hM14o"
62,1519295968340066304,1524878367937421323,2022-05-12,"Vinho combina sim com barbearia
#vinho
#ipiranga #bairrodoipiranga #museudoipiranga https://t.co/fsf2WhSaRo"
63,28108895,1524872396838166541,2022-05-12,Acabou de publicar uma foto em Metrô Paraiso https://t.co/el2W9AeOCv
64,774469015,1524837048011608087,2022-05-12,"#usavamascara agora não mais 😏
""Changes are coming...""

#maisumnomundo #vilaprudente #saopaulo #broke em Vila Prudente https://t.co/VtajOOMzdi"
65,1359651983150440449,1524833147959005201,2022-05-12,https://t.co/T9TnDF4jOk
66,67085183,1524827301107617797,2022-05-12,Acabou de publicar uma foto em TCM Supply https://t.co/GBRvQLEamE
67,1521510305649602564,1524818684543488000,2022-05-12,"Raiderzão tem o Adams
E eu sou tipo Tio Chico Adams kkk
#Raiders 
#NFL 
#raidernation https://t.co/QwYz7OtJ8O"
68,1521510305649602564,1524808072409108480,2022-05-12,Quintou e o pai tá ON!!! Saúde moçada!!! https://t.co/lUsgzBr3Oq
69,1521510305649602564,1524769702106603521,2022-05-12,iPhone na mão de idoso = Som alto da desgraça 😢🥺😢🥺😢💩💩💩
70,426015718,1524767114359279617,2022-05-12,Acabou de publicar uma foto em Dia Da Enfermagem https://t.co/orO1ixgO3f
71,1521510305649602564,1524765328349319170,2022-05-12,"O Jaguars na pré temporada é so pra dar aquela falsa alegria kkkk
Adams, vc vai ter que pegar passe até na arquibancada no colo do Mark Davis kkk"
72,1521510305649602564,1524765038447403008,2022-05-12,"Como eu falei antes....9-7 sofrido hein.
#RaiderNation https://t.co/MgQBxkffDN"
73,1521510305649602564,1524764253403684864,2022-05-12,"Hoje vão sair os times contra o Raiderzão.

Vi em um site, não sabia se era oficial. Posto mais a noite a real.

Pelo que eu vi....meu Jesus...da pra ficar um 9-7 sofrido kkk"
74,37031702,1524675161064198147,2022-05-12,"#TBT do aniversário desse meu grande amigo.
Uma pessoa incrível com uma criatividade enorme, inclusive para aniversário.
Um grande abraço @darioteixeiraof @psico.darioteixeira em Ipiranga (district of São Paulo) https://t.co/h7yHZsqvfI"
75,1580111216,1524592967398346752,2022-05-12,Acabou de publicar uma foto em Casa De Teatro Mariajosé De Carvalho https://t.co/37FjT7aXeO
76,1524432828280287233,1524544499577495562,2022-05-12,"Me sentir tão feliz esse dia que é só eu ver essa fotinha que eu fico feliz dnv 
( preciso de mais um show pra reabastecer ) MINHAS PREFERIDAS
deviam ser matéria escolar, toda pretinha precisa crescer se amando 
@Tashaokereke 
@tracieokereke https://t.co/uJuX1DQlxc"
77,1521510305649602564,1524541080766763008,2022-05-12,"Bora Giannis, vai pra cima !!!"
78,1521510305649602564,1524540596010074112,2022-05-12,"A pessoa que compra no E-Commerce, é a mesma que chega no mercado e pede pra dar desconto nos produtos? Ou quer parcelar o Compra em 12x no boleto? kkkk
Se o produto é 100, não pede 70 kkk Ainda tenho uma paciência boa pra negociar."
79,21415271,1524524601363025920,2022-05-11,"I'm at Atacadão in São Paulo, SP https://t.co/hKVQYt6Ed3"
80,56416020,1524523875941421057,2022-05-11,Acabou de publicar uma foto em Condominio Quality House https://t.co/D1qxTzF7hS
81,1521510305649602564,1524520358795264001,2022-05-11,"A pessoa vende o produto la na casa do C*****, ai falo que pago no site, cai na conta da mesma, nao aceita.
20, 30 km pra ir la? Dançou. Daqui a pouco acho um mais perto kkk
OLX Entregas, funciona, uma via de duas mãos. Simples."
82,1521510305649602564,1524519112596201472,2022-05-11,"@pepenarduchi Respira fundo e bola pra frente. Essa fase vai passar meu irmao. Estou aqui com pensando forte pra vc ir pra frente, vencer esses obstaculos. Abraços manolo"
83,1521510305649602564,1524513449224683521,2022-05-11,"Cortei o dedo na maldita capinha de metal do pendrive.
Ai, multilaser, bora me mandar uns produtos de graça kkk"
84,1521510305649602564,1524512584581496833,2022-05-11,"The cure for the sorrow
Is to live like there's no tomorrow (no tomorrow)
Blow it up, pull the pin from the inside
The cure for the sorrow
Is to live like there's no tomorrow (no tomorrow)
Nothing lasts, no one wins, but it's alright

Three Days Grace - No Tomorrow"
85,11351602,1524492937807151104,2022-05-11,"Mudança de planos ao longo do dia, sketch e contemplação sempre que possível.

#sketchbook #hahnemühle #fudepen #faber-castell #ink #ipiranga
#saopaulo #sampa @ Ipiranga (district of São Paulo) https://t.co/ldvNiPRup6"
86,190379364,1524471160452395009,2022-05-11,Acabou de publicar uma foto em Paróquia Santa Cândida https://t.co/so0iqzlKGT
87,67085183,1524460068267347968,2022-05-11,Acabou de publicar uma foto em TCM Supply https://t.co/hKnxBMGJ6H
88,1524447505391497216,1524451790577672198,2022-05-11,"OBS: Legenda desnecessária!

.
.
.

#corinthians #timao #fieltorcida #bandodeloucos #futebol #brasileirão #paulista #paulistão #campeonatobrasileiro #copalibertadores #conmebollibertadores #CopadoBrasil2022 https://t.co/rGKe3V97AR"
89,251427835,1524450266187186178,2022-05-11,Boa 🔥
90,190379364,1524441056728788993,2022-05-11,Acabou de publicar uma foto em Paróquia Santa Cândida https://t.co/wK9WkzzirR
91,190379364,1524440988323831809,2022-05-11,Acabou de publicar uma foto em Paróquia Santa Cândida https://t.co/mbfcd4jg3L
92,1521510305649602564,1524422948689526786,2022-05-11,"Tenho formação em jornalismo, achava que escrevia bem, falava rápido, tipo locutor....mas, não segui o caminho.
Hoje, com o tanto de piadas de pavê que eu faço, bora fazer Stand UP kkk"
93,3163747396,1524408725762674688,2022-05-11,Acabou de publicar uma foto em Fazendinha Estação Natureza SP https://t.co/djeBszQsZ6
94,1521510305649602564,1524400150952628224,2022-05-11,"Thorton, Marleau, Pavelsk, jogadores lendas do Sharks, param de jogar, mudam de time, foda. Como torcedor do tubarão 🦈, ficam só as lembranças.
Chorei no dia que o Niemi ( Nemo ) saiu e voltou pra Europa. Foda. Bora seguir.
#SJSharks 
#NHLnaESPN https://t.co/6tL3bhItrH"
95,190379364,1524383520583561216,2022-05-11,Acabou de publicar uma foto em Paróquia Santa Cândida https://t.co/ImtHJGybrD
96,190379364,1524383479101751297,2022-05-11,Acabou de publicar uma foto em Paróquia Santa Cândida https://t.co/n3KUVc0ozc
97,190379364,1524383451851464705,2022-05-11,Acabou de publicar uma foto em Paróquia Santa Cândida https://t.co/f4OECvpQHV
98,34779125,1524348222868758528,2022-05-11,Sorte do dia: Uma composição do Metrô vazia pára na sua estação 🙌🤗 https://t.co/Htq1PKr79t
99,2983019729,1524335926607982592,2022-05-11,"❤️💕🤩❤️❤️😍💟💟🍬😍😍❤️❤️🍫🍫🍫❤️😍🍬🤩💕💟👍💕💟🍫🍬😍😍❤️

Amo meu príncipe e minha princesa em Vila Prudente https://t.co/JnDy2qAaSv"
100,190379364,1524332762383228928,2022-05-11,Acabou de publicar uma foto em Paróquia Santa Cândida https://t.co/fX23I4ExEo
101,190379364,1524332707039244288,2022-05-11,Acabou de publicar uma foto em Paróquia Santa Cândida https://t.co/G7SSGyQwJm
102,921364987129532417,1524165360269811712,2022-05-10,Acabou de publicar uma foto em Espaço 162 https://t.co/OyW1sNHYaD
103,1592643384,1524154069891309568,2022-05-10,Acabou de publicar uma foto em Upgrade Customs https://t.co/vB3JMPSGc4
104,1521510305649602564,1524147623317446656,2022-05-10,"@lineysk2 Sorte que surgiu uma mascara antes de eu entrar pra ver o Doutor kkk Amanha eu levo uma nova para outra consulta kkk
Eu estava exatamente assim, igual o Pica Pau doidão :( https://t.co/60yhAoyMet"
105,761974464712208384,1524132832830017543,2022-05-10,passeio no almoço... https://t.co/lxuLISs2j7
106,231919295,1524124205880512513,2022-05-10,O poder do marketing pessoal. https://t.co/ZmylownTkS
107,830547658922135554,1524123217987870722,2022-05-10,"Oie Pomposos ❤️
Meu Baby já está medicado 🙏
Agora vamos ver se melhora né 🤷‍♀️
A minha voltou atacar 🤦‍♀️
Já procurei o médico!
Se tudo der certo…
Segunda voltamos aos trabalhos ?
Ouvi um amém ? 
Ai gente, como quem tem Asma sofre 😔 https://t.co/GAVApTDFEE"
108,190379364,1524108574653394944,2022-05-10,Acabou de publicar uma foto em Paróquia Santa Cândida https://t.co/YjuHVIkrpu
109,1521510305649602564,1524027484865544193,2022-05-10,"Vai ao médico e esquece a máscara kkk
Aí Jesus. Vou colocar a camiseta na no rosto.
Acho que vão me ceder uma kkk https://t.co/BAg0OJr944"
