,author_id,tweet_id,created_at,text
0,3298162567,1569816463967502337,2022-09-13,"Tirei essa foto no intervalo e esqueci de postar. Vi o Hudson, ex-volante, acompanhando o jogo lá na Fazendinha. Ele agora é empresário de jogadores. https://t.co/2qEyVzeUaf"
1,3298162567,1569791590972940290,2022-09-13,"Comemoração do terceiro gol, o da virada, do Corinthians. Jogadaça do Guilherme Henrique na origem da jogada, e conclusão perfeita do Wesley. Placar final: Corinthians 3x2 São Paulo. Jogaço! https://t.co/4rg8NOCNmA"
2,64231534,1569772204794986502,2022-09-13,"Hoje deu bom!
Diminui o ritmo e voltei pra terra!
Bora!
@stabilita 
@iisa_gs em Parque do Trote https://t.co/bQ4p1KDV4H"
3,3298162567,1569771547531055104,2022-09-13,"Com menos de um minuto do 2T, mais um pênalti, dessa vez pro Corinthians e em cima do Wesley.
Adryan bateu com perfeição! Que batida. https://t.co/1YMdNqjaUz"
4,3298162567,1569771081749401600,2022-09-13,O próprio @NewertonMartins foi pra bola e guardou. Ele é o vice-artilheiro do time na temporada com 11 gols. https://t.co/LhfNNe90sO
5,1559865008321880066,1569705797487132673,2022-09-13,"queria que tivesse como formatar a cabeça, apagar tudo, não pensar em mais nada."
6,32517420,1569691076268531712,2022-09-13,"🙏🏻💪🏻 em Villa Maria, Sao Paulo, Brazil https://t.co/JiYHgeCyBq"
7,1559865008321880066,1569627509347467268,2022-09-13,"pareço tão forte, mas acredite, eu estou exausto."
8,163312074,1569141198480187396,2022-09-12,Acabou de publicar uma foto em Vila Maria Zona Norte https://t.co/EAXbFmeBX9
9,1161459586265694208,1568940373870886912,2022-09-11,"Raspei a cabeça 😈😈🍆🍆

✅ https://t.co/ByCkzQdWNz 
For more videos like this Subscribe to onlyfans and get access to all my videos. $5 https://t.co/kpzeTBAq52"
10,1194339711722151936,1568604941522026496,2022-09-10,10.❤️enjoy! LoviU Y'Äll https://t.co/kHSBD0Qwcd
11,58783015,1568598694865371142,2022-09-10,"I'm at Hospital Nipo-Brasileiro in São Paulo, SP https://t.co/8mPIfYsdAh"
12,2669823832,1568220444645543937,2022-09-09,"Acabou de publicar uma foto em Villa Maria, Sao Paulo, Brazil https://t.co/S5Nf8ZEghl"
