,author_id,tweet_id,created_at,text
0,1482444419777323011,1567577931634843656,2022-09-07,Manutenção do campo aqui no Alfredo Schürig está feita https://t.co/Deu5N8nuoW
1,256525294,1567474846442967045,2022-09-07,"... já raiou a liberdade no horizonte do Brasil! 🎶 em Villa Maria, Sao Paulo, Brazil https://t.co/T2HghG37Ph"
2,180929724,1567315110766551041,2022-09-07,I'm at Lig-Esfiha in São Paulo https://t.co/QyZpGdVRMy
3,170497442,1566935573939494912,2022-09-05,"Pedal Noturno Urbano.
Região do Tatuapé SP. em Metro Tatuapé. https://t.co/QWGn3ttfWy"
4,72171219,1566854113933017089,2022-09-05,"Há 3 anos atrás, tudo começou...

Gestando uma vida extremamente importante para mim. Não imaginei que seria algo tão belo, emocionante e desafiador... em Ethernal Fotografia https://t.co/UyAYdhPyoe"
5,1253134002921373696,1566608645470699520,2022-09-05,finalizando o domingo do jeito que eu gosto 🥹 https://t.co/rIoaAvw9Rt
6,1387242472678494212,1566397613213097991,2022-09-04,Rico bem novinho faz parte da ficção😘 https://t.co/PEXMJVYNc4
7,3217646565,1566180285028384770,2022-09-03,"Na minha humilde opinião, um dos melhores compositores de samba de todos os tempos!!! @poetacleberaugusto em Limoeiro Bar https://t.co/ayil2MXAUI"
8,1440756753134612487,1566077332086980609,2022-09-03,🧃 https://t.co/zgF0QXSOcz
9,1962794342,1566069299751550984,2022-09-03,"Mais de 100 milhões de brasileiros aderiram ao Pix. O sistema instantâneo de pagamentos, lançado pelo Governo Federal, facilitou a vida de consumidores e empresários, reduziu o custo de transações bancárias e equiparou o Brasil a países desenvolvidos na área de inovações. https://t.co/7YWVK2lwZS"
10,155337308,1565382027544772609,2022-09-01,"Quem tem um casaco desses, não quer guerra com ninguém… 🥶 em São Paulo, Brasil https://t.co/DMrEAq2GtZ"
