,author_id,tweet_id,created_at,text
0,1378533026313998341,1564394916804952065,2022-08-29,"Cuidado com as receitinhas #lowcarb 
Muitas delas trocam os carboidratos por gorduras e a gordura tem mais que o dobro de calorias. “Coma o quanto quiser” só pq é low carb…
É conversa!!! =}"
1,1049853801920950273,1564384228875423751,2022-08-29,"Boa noite, meus amigos! Que tenhamos todos uma noite de sono abençoada, tranquila e revigorante. em Bairro Cangaíba / Penha - São Paulo / SP https://t.co/uIeaEEoq5d"
2,1049853801920950273,1564382122491666432,2022-08-29,Sucesso é para quem enxerga cada início de semana como um recomeço. Faça dessa segunda-feira uma nova história! em Bairro Cangaíba / Penha - São Paulo / SP https://t.co/8Ui0Af3G78
3,1049853801920950273,1564380558473707520,2022-08-29,"Meus amigos, eu desejo a todos vocês uma boa tarde! em Bairro Cangaíba / Penha - São Paulo / SP https://t.co/dCySjrO0yJ"
4,1049853801920950273,1564378837898723329,2022-08-29,"Viva cada momento, ria todos os dias, ame além das palavras... Tenham todos um  bom dia! em Bairro Cangaíba / Penha - São Paulo / SP https://t.co/nFvFBv6ssa"
5,1049853801920950273,1564376463343771650,2022-08-29,A vida é muito curta para não aproveitar todos os momentos. em Bairro Cangaíba / Penha - São Paulo / SP https://t.co/fBgE7unLIb
6,1049853801920950273,1564371267138068481,2022-08-29,Que a semana venha cheia de emoções sinceras carregadas de carinhos e paz. Uma linda semana para todos! em Bairro Cangaíba / Penha - São Paulo / SP https://t.co/4R08iFap2g
7,1570764218,1563964833300709378,2022-08-28,Uma noite memorável!!! Uma comemoração pra ficar marcada na história! Obrigado!!! em Morro Bar https://t.co/Y6dDPMirKt
8,56851995,1563879440832249857,2022-08-28,"I'm at Academia Gaviões - Penha in São Paulo, SP https://t.co/AjuYQhRWGC"
9,47220478,1563685461159198721,2022-08-28,Com amigo Fernando e a Amada Imortal no Outback do shopping Penha em Outback Brasil https://t.co/yA6lX6obHB
10,967061455223783426,1563624579662233601,2022-08-27,Poder dizer que o amor é... https://t.co/MQn0nlxVyo
11,316775437,1563614698758901762,2022-08-27,Acabou de publicar uma foto em Tiquatira - Zona Leste https://t.co/RQWIFZN8q2
12,143833718,1563507526183702528,2022-08-27,좋은 아침 ❤️😘🛍️let's work . em Shopping Penha https://t.co/FAznm9AELc
13,57220858,1563494016645500928,2022-08-27,"Porque uma partida começa bem antes do horário marcado.
#prejogo #clubeesportivodapenha #taçacidadedesãopaulo #femininosub17 #futebol em Clube Esportivo da Penha https://t.co/w4nn6fdFZi"
14,490288995,1563477115861110789,2022-08-27,"Acabou de publicar uma foto em Penha De França, Sao Paulo, Brazil https://t.co/n0hVrUBhGS"
15,53103492,1563473749504311296,2022-08-27,Acabou de publicar uma foto em Associação São Paulo Diferenciado ASPD https://t.co/ljlfxUF2TP
16,3724233975,1563272656413409283,2022-08-26,Certeza meu Outback preferido dos últimos tempos 💚 (@ Outback Steakhouse - @outbackbrasil in São Paulo) https://t.co/9vofXYZacd https://t.co/etzROUE8zb
17,51468456,1563199931380248582,2022-08-26,"@malcolm_mcofc Projeto Literatura Marginal 

“Sem Norte” #13 ! 

#literatura_marginal em Penha - Zona Leste https://t.co/hlhTxjTs3u"
18,1423298468513296388,1563173430396010496,2022-08-26,Acabou de publicar uma foto em Estúdio De Estilos https://t.co/g3le78EFLG
19,51603888,1562973269560815621,2022-08-26,#TBT com a lata na mão e comemorando a temporada sinistra de 2017. em Ponte Grande https://t.co/edMxDEOwNK
20,1049853801920950273,1562946331991126017,2022-08-25,"Boa noite, meus amigos! Que tenhamos todos uma noite de sono abençoada, tranquila e revigorante. em Bairro Cangaíba / Penha - São Paulo / SP https://t.co/CLnL5rzRty"
21,1049853801920950273,1562938004767145984,2022-08-25,Uma quinta-feira com muita luz e sonhos realizados é o que desejo às pessoas que mais amo neste mundo! em Bairro Cangaíba / Penha - São Paulo / SP https://t.co/jr6x3MPwE2
22,1049853801920950273,1562935738395934721,2022-08-25,Uma feliz tarde para todos! em Bairro Cangaíba / Penha - São Paulo / SP https://t.co/s5KeFDeR09
23,1049853801920950273,1562933834772975622,2022-08-25,Que o dia nos apronte boas surpresas e nos faça sorrir. em Bairro Cangaíba / Penha - São Paulo / SP https://t.co/Wa0JDntODF
24,1049853801920950273,1562931582054580224,2022-08-25,A cada noite temos uma nova oportunidade de recarregar as nossas energias e refletir sobre a nossa evolução espiritual. Bom descanso. A todos em Bairro Cangaíba / Penha - São Paulo / SP https://t.co/6Ab6ttv5dN
25,1049853801920950273,1562930029746536448,2022-08-25,eu desejo uma tarde maravilhosa e cheia de paz! Para todos em Bairro Cangaíba / Penha - São Paulo / SP https://t.co/cxjCzsl08c
26,1152585281134104577,1562899082859134976,2022-08-25,@ThiagoLenhador Estou aqui a disposição. https://t.co/TUrEszFtAK
27,65800379,1562859029650878464,2022-08-25,"Aí que saudade de um beija flor
Que me beijou depois voou
Pra longe demais 😭🥺✨️ em Cangaíba https://t.co/jR8ecFsOEl"
28,2878024792,1562829000107405312,2022-08-25,Juntos podemos mais!!!!! em Universo https://t.co/9587lSdES8
29,226749590,1562624844814241794,2022-08-25,"🏫 em Igreja Da Penha, Sp https://t.co/N2QIopyFvG"
30,1449067172567859200,1562618860674506756,2022-08-25,@AP_Impossible do you still use this account?
31,76257183,1562572745401311238,2022-08-24,Almocinho ao lado dela 🍛🍕😍😘❤️ #Primas #FamiliaEspañola #FamiliaLópez #Familia #FamiliaLopez em Churrascaria Espeto &amp; Bombacha https://t.co/sZPWGybuF9
32,55887107,1562451535317315584,2022-08-24,E esses anjinhos? https://t.co/Hk8fF6bm2J
33,1049853801920950273,1562446779097829377,2022-08-24,Bom dia! As oportunidades são feitas de superação. em Bairro Cangaíba / Penha - São Paulo / SP https://t.co/v1K0Wyhrgf
34,1049853801920950273,1562445452628590593,2022-08-24,Viva um dia de cada vez para ser feliz todos os dias. Bom dia! em Bairro Cangaíba / Penha - São Paulo / SP https://t.co/blcqzxuWtg
35,1049853801920950273,1562433814206771202,2022-08-24,Tenham  todos uma terça-feira iluminada! em Bairro Cangaíba / Penha - São Paulo / SP https://t.co/k4b9xcRnfX
36,1049853801920950273,1562422992319029248,2022-08-24,Seja leve e releve. Boa tarde! em Bairro Cangaíba / Penha - São Paulo / SP https://t.co/cWFDxa2GRT
37,1049853801920950273,1562421603602173957,2022-08-24,"Viva cada momento, ria todos os dias, ame além das palavras... Tenha um bom dia! em Bairro Cangaíba / Penha - São Paulo / SP https://t.co/Q0wECPqoOj"
38,72180781,1562348362229514242,2022-08-24,"Existem momentos inesquecíveis, coisas inexplicáveis e pessoas incomparáveis. em Dentro De Um Abraço https://t.co/OyrzRxBzsa"
