,author_id,tweet_id,created_at,text
0,143126709,1529162788303687681,2022-05-24,Acabou de publicar uma foto em Ponte Grande https://t.co/Nf2Y2pvbtG
1,91025970,1529127567369854977,2022-05-24,"Finalmente voltei a fazer valer as anuidades da OAB.

Só tomar uma dúzia de café por dia nas salinhas da OAB e quase saio no lucro. https://t.co/UbX09GI6YK"
2,323327079,1529124797224984577,2022-05-24,Acaba de publicar una foto en Universo https://t.co/i7JroXgQOb
3,71877624,1529081756514656257,2022-05-24,Pensando em fazer uma fanCam pro aquecedor de água aqui de casa.
4,940889614973308928,1529080024137179139,2022-05-24,Que cor eu coloco agora 😁😁😁 https://t.co/x46vHvcVl3
5,74899968,1528976810091991040,2022-05-24,Acabou de publicar uma foto em Asé Alaketu Opará Lomy https://t.co/dAojXxKByR
6,282979559,1528860565829033996,2022-05-23,Acaba de publicar una foto en Universo https://t.co/9acIMMaETf
7,71437422,1528857494382071810,2022-05-23,Acabou de publicar uma foto em Comodoro.gru https://t.co/WSoHkgxWW6
8,1378533026313998341,1528830635724312576,2022-05-23,Acabou de publicar uma foto em Nutri Solange de Paula Torres https://t.co/hpPEWeXetJ
9,105962343,1528782978758737920,2022-05-23,Acabou de publicar uma foto em Universo https://t.co/3HxA148kgr
10,1511557871754006533,1528775327346003969,2022-05-23,"I'm at Penha - @sp_prefeitura in São Paulo, SP https://t.co/k4uF1qWMIK"
11,1267547384684388352,1528530974341926912,2022-05-23,Acabou de publicar uma foto em Shopping Penha https://t.co/rhfREykuo6
12,2429206439,1528518405975941120,2022-05-22,"Sheik Móvel em ação nas ruas ❤️
@pejulio https://t.co/S4vvXzOx7q"
13,700297367841587201,1528513719973597185,2022-05-22,"El boss del porno es el @samuel.redx.official !!! En dos peliculas publicadas, el publico se ha enamorado de este gran professional! Aqui con su querido @suso280680 y @juan_aduff su …. à Universo https://t.co/6sDpSogrhr"
14,166995676,1528467116541755393,2022-05-22,"Uma voltinha com papai!  
Pensa num homem que falou do frio esses dias. Kkkkkkk em Shopping Penha https://t.co/15TAkSebUY"
15,48144276,1528423237411012612,2022-05-22,@zeluizlhesdiz CAMPEOOOOOONESSSS https://t.co/LbuLzSASjW
16,1402459314019876866,1528411600708943879,2022-05-22,Calourada Unifesp foi brabooo demais 🔥🔥 https://t.co/bvZFSDvJvI
17,56851995,1528387918645051396,2022-05-22,"I'm at Undokai AOVC in Guarulhos, SP https://t.co/myHnVaADum"
18,56851995,1528387857433370624,2022-05-22,"I'm at Estádio Municipal Arnaldo J. Celeste in Guarulhos, SP https://t.co/zfypVF5Ds5"
19,24214391,1528216509822259203,2022-05-22,Acabou de publicar uma foto em Dentro De Um Abraço https://t.co/M3zmv21CG1
20,91428401,1528214127579058177,2022-05-22,Amo demais esse pequeno modelo. 😍 em Jardim Munhoz https://t.co/YlqWyKdlLZ
21,61900700,1528193846345080832,2022-05-22,"Acabou de publicar uma foto em Penha De França, Sao Paulo, Brazil https://t.co/nItiSMSGvh"
22,1507732249411739656,1528137566758883334,2022-05-21,"Disponível 
#modafeminina  #presentes #sp en Ponte Grande https://t.co/EwpKlr4rBE"
23,143126709,1528124189391167489,2022-05-21,Acabou de publicar uma foto em Ponte Grande https://t.co/AojB6E7EA8
24,1231029181431058432,1528068162725597189,2022-05-21,Morri no meio do caminho https://t.co/vDlhjqSw2r
25,1507732249411739656,1528067175256309760,2022-05-21,"Disponível 
#garrafa #modafeminina #SP #presentes en Ponte Grande https://t.co/rhb6VWKfJm"
26,1416915625499414529,1528059729473376256,2022-05-21,oi
27,316775437,1528050753885114371,2022-05-21,Acabou de publicar uma foto em Tiquatira - Zona Leste https://t.co/t3Wx5oYWle
28,187407766,1528035692193923074,2022-05-21,indumentária de shows em dias frios. em Show Cpm 22 https://t.co/PGs35R56vC
29,1401436668649955329,1528002453848743936,2022-05-21,Acabou de publicar uma foto em Paulo Valentin https://t.co/jUoKIgxJpP
30,1401436668649955329,1527999578435371008,2022-05-21,"A linda Simony arrasando Com esse look 
Incrível adoro fazer moda mas vestir pessoas com estilo é  melhor mais novidades por aí #paulovalenttin #ocostureirodasestrelas⭐⭐⭐⭐⭐💃✂️🪡🧵🙋‍♂️🇧🇷☎️ (11) 984435095 em Paulo Valentin https://t.co/xTCVqcKWtR"
31,76257183,1527842117665562629,2022-05-21,Se *ELE* tá de blusa é pq tá muitooooo frio 😱😍❤️ em Shopping Penha https://t.co/RjbI5fQXDw
32,394210899,1527841313730732032,2022-05-21,💙💙💙 foi incrível!!! em Teatro Flávio Império https://t.co/Gp05XDC17T
33,316775437,1527768093803552771,2022-05-20,Acabou de publicar uma foto em Parque Tiquatira https://t.co/UDBDmaszEW
34,1049853801920950273,1527651796608552960,2022-05-20,FDD 2 em Metrô Vila Matilde https://t.co/awFG7nnjYN
35,1049853801920950273,1527649741638623232,2022-05-20,Sextou 2 em Metrô Vila Matilde https://t.co/BASMkomBwd
36,1049853801920950273,1527648844099383296,2022-05-20,Sex 2 em Metrô Vila Matilde https://t.co/NmOJ2iV7Au
37,1049853801920950273,1527646127180238848,2022-05-20,Qui 2 em Metrô Vila Matilde https://t.co/besDjVBPYz
38,1049853801920950273,1527645435820707840,2022-05-20,Qua 2 em Metrô Vila Matilde https://t.co/KCGea39vaG
39,1049853801920950273,1527643960017027072,2022-05-20,Ter 2 em Metrô Vila Matilde https://t.co/JaLTCLDfIR
40,63610371,1527640753551429633,2022-05-20,Acabou de publicar uma foto em Centro Cultural Penha https://t.co/l0lUZdxB44
41,1243135490607415297,1527490283834732544,2022-05-20,Não nascemos sendo vencedores e não nascemos sendo perdedores. Nascemos podendo escolher. em Shopping Penha https://t.co/IYrNIzGJ95
42,1172647983135043584,1527418337059254272,2022-05-19,Acabou de publicar uma foto em Adega Gluts https://t.co/XPe5uMBoXA
43,1378533026313998341,1527375209954566144,2022-05-19,"Que frioooo!!!
Deu vontade de uma alimentação mais quentinha e aconchegante? Abuse dos legumes na sopa, assados, refogadinhos… Fique atento a escolha dos ingredientes, acabamos colocando mais embutidos na alimentação nessa época. 
#alimentacaosaudavel"
44,74899968,1527315658551066624,2022-05-19,Temos muitas novidades confira em  nossa loja https://t.co/oF1H8Didfp em Asé Alaketu Opará Lomy https://t.co/3fAx7zxV8D
45,121441754,1527245449090027520,2022-05-19,Acabou de publicar uma foto em Bairro Cangaíba / Penha - São Paulo / SP https://t.co/yUtm8Y8llj
46,121441754,1527013298159472642,2022-05-18,"Não dá pra acreditar que já já completa 2 anos que comecei esse sonho. ❤️

Você tem noção do que significa pra mim? 🥰

#OuseDeusa
#meusonhorealizado
#ObrigadaDeusas ❤️
#OuseDeusaFaz2
#GratidãoDefine
#ObrigadaVida 🙏🏼 https://t.co/rBREgPgdgO"
47,1152585281134104577,1526987848758468608,2022-05-18,"Alguém gosta de social?

🔁 Para ajudar o ursinho aqui... https://t.co/MBXZRqXCjD"
48,350574982,1526892154332774401,2022-05-18,"Aí, uma falta abonada agora..."
49,1152585281134104577,1526878922075516928,2022-05-18,@SpCambuci @dozeduzias Me dá esse leite quente então
50,937105569953075200,1526871834045648898,2022-05-18,"Seráque o @metrosp_oficial congelou???
Passar frio, nesse vento, na passarela, não estava nos meus planos hoje. https://t.co/3wGzL04rCv"
51,1499808688261013509,1526857344596033536,2022-05-18,A motivação de acordar cedo é a criança querer assistir bdsp 🫣🫣#bdsp https://t.co/U72f53jpFm
52,53103492,1526833904065187840,2022-05-18,"Você chegou pesado. Aí, sim 8 graus pra mim é pouco! #ASPD #AssociaçãoSãoPauloDiferenciado #ClubedosLojistasdaVilaMatide #ZonaLesteemDesenvolvimento #VilaMatilde leão em Associação São Paulo Diferenciado ASPD https://t.co/ie10ZxYkjj"
53,1161977734496772096,1526745611818741767,2022-05-18,Bora descansar 😴 https://t.co/S0w9cB2wrl
