,author_id,tweet_id,created_at,text
0,316775437,1558918057032122369,2022-08-14,"Hoje nosso dia dos #Pais foi como..
Visitinha no #sogrão @olliveira.marco depois almocinho com a família com a #mamae @anakubalak e o #filho @nicolaskubalak 

#diadospais #papai #papa #familia #família #family https://t.co/hgqAcC5TOu"
1,55578094,1558822908402728967,2022-08-14,Feliz dia dos pais! #Luke #Leia #paidepet ❤️🐾🐶 em Penha - Zona Leste https://t.co/vSEzO4PW3n
2,78351338,1558817733810143234,2022-08-14,Presente da Carol em Mansão dos Cavalcanti https://t.co/ooGIMJOfzV
3,35331454,1558602246354608128,2022-08-13,"Alice através do espelho 🐰💖
Com minha parceira de aventuras, maravilhosa, @deliane_luna_moura 
Obrigado por mais esse momento tão mágico 💖 em Alice Através Do Espelho https://t.co/A0CxJhwBWh"
4,1524115098666782723,1558512159407181829,2022-08-13,#academia gaviões hj tbm é dia... https://t.co/pldDSLPWM2
5,1490689420147765255,1558489749530222594,2022-08-13,aos sábados eu exercito o meu lado artista https://t.co/ObR8hMYP4X
6,1451097485460459521,1558457822924382209,2022-08-13,👻Sc_deepak_bhagat06 @ Snapchat World https://t.co/WxFYBloGBV
7,276270452,1558413178073223170,2022-08-13,"Bom dia, caindo de sono isso sim kkkkkkkkkkkkkk minha cabeça tá assim ó 🤪🤪🤪🤪 https://t.co/cNaOVRkTrL"
8,1438826646396710913,1558154551395500034,2022-08-12,"Próximo sábado dia 20 de agosto #mutirãodeemprego no #bairrodapenha na @familiapenhaicf 
.
#missõesurbanas #missoesurbanas #mutiraodeemprego #emprego #empregarja #empregabilidade #missoes #missao #semearnoconcreto https://t.co/Wdd3c92r3x"
9,190468584,1557866773126426624,2022-08-11,"Reflexões em Penha De França, Sao Paulo, Brazil https://t.co/JlMeECQ0nh"
10,1049853801920950273,1557857459099897856,2022-08-11,Que a noite seja doce e feliz. em Cangaiba Zona Leste https://t.co/wwegqX2U5i
11,1049853801920950273,1557775736085352451,2022-08-11,"Boa tarde! Que a  tarde seja leve, abençoada, iluminada, produtiva e feliz. em Bairro Cangaíba / Penha - São Paulo / SP https://t.co/1IleOJsC4p"
12,1049853801920950273,1557755469363494912,2022-08-11,Que nesta quinta-feira não nos falte bom humor para encarar as caras feias do dia. em Bairro Cangaíba / Penha - São Paulo / SP https://t.co/bjKRBQL1vQ
13,1458452998255005699,1557687967669518337,2022-08-11,"Não seja cuzã9.
Não seja cuzã9.
Não sejas cuzão, por favor!"
14,181289811,1557684778282926080,2022-08-11,"I'm at Intermédica Centro Clínico II Guarulhos in Guarulhos, São Paulo https://t.co/bDMfS0ouom"
15,190468584,1557554980088938499,2022-08-11,"Eu voto Lula13, Haddad13, Deputado Federal e Estadual 13  e as estrelas representam meus candidatos! Sem medo se ser feliz de novo. A Esperança é o amor vão vem as fases news: eu acredito! https://t.co/OaJFuuQYs5"
16,121441754,1557486830853001217,2022-08-10,Acabou de publicar uma foto em Bairro Cangaíba / Penha - São Paulo / SP https://t.co/o9IQ99KzNH
17,53103492,1557351141767188480,2022-08-10,"Quarta, 10 de agosto. Qual a novidade do dia? #ASPD #AssociaçãoSãoPauloDiferenciado #ClubedosLojistasdaVilaMatilde #ZonaLesteemDesenvolvimento em Associação São Paulo Diferenciado ASPD https://t.co/do45ucxvhd"
18,29374383,1557117480803438592,2022-08-09,Acaba de publicar una foto en Dolphin Mall Miami https://t.co/FK75Amc6cK
