,author_id,tweet_id,created_at,text
0,463926171,1662996207331860484,2023-05-29,O Sr. Jesus disse: Todo o que o Pai me d치 vir치 a mim; e o que vem a mim de maneira nenhuma o lan칞arei fora. 游닀Jo칚o 6:37 https://t.co/KB3uiob4jv
1,14387285,1662929504547774467,2023-05-28,칔ltimo dia. #spfw https://t.co/0x1hoVi5uC
2,1074166986597416961,1662910723062657024,2023-05-28,queria ir pro jogo quinta-feira mas eu saio 19:30 do trabalho e n vou pagar caro em ingresso pra assistir s칩 metade
3,181289811,1662843797393268736,2023-05-28,"I'm at Universidade S칚o Judas Tadeu (USJT) - @usjtoficial in S칚o Paulo, SP https://t.co/orCFHibQYt"
4,21415271,1662658363304423430,2023-05-28,"I'm at Hospital Salvalus in S칚o Paulo, SP https://t.co/mpVdlkIBcI"
5,579387724,1662498443602931712,2023-05-27,"I'm at Sukiya in S칚o Paulo, SP https://t.co/60DnlODOAd"
6,1652806761877839873,1662471542175924230,2023-05-27,O veio quase arranca meu ombro https://t.co/IbvgdR2XLQ
7,579387724,1662465788933206023,2023-05-27,"I'm at Br치s - @sp_prefeitura in S칚o Paulo, SP https://t.co/TQKaAj18wu"
8,1074166986597416961,1661928643466084355,2023-05-26,"j치 perdi as contas de quantas vezes o piercing do meu peito inflamou, e olha q eu n칚o uso suti칚 游멇릶멇릶"
