,author_id,tweet_id,created_at,text
0,21415271,1565851871658524673,2022-09-02,"I'm at Pizzaria Castelões in Sao Paulo, Brazil https://t.co/IjQnUUhcey"
1,715191572850147328,1565832167321751554,2022-09-02,"Grandes parceiros, grandes negócios e resultados incríveis! em SENAI SP Têxtil e Moda https://t.co/QfqppnhiJw"
2,817882111868805120,1565818556495073280,2022-09-02,"Acabou de publicar uma foto em Brás, Sao Paulo, Brazil https://t.co/qOpgBIMPln"
3,137704954,1565811294854385664,2022-09-02,"Qual vc prefere pra um sextou,

Dançar un passinho ou breack? 

Passar vergonha é  cmg  e com o @_vinnyezord kkk

Sextou heim!

 Com o Link na bio tem sets e playlists para você curtir o fds daquele jeitão 🔥🔥🔥 https://t.co/gZi4bsKYnU"
4,1305290834259193856,1565789167799468040,2022-09-02,Acabou de publicar uma foto em Sao paulo https://t.co/CgWrIY7dbg
5,1524904996843802630,1565733623206223872,2022-09-02,Acabou de publicar uma foto em Rua Augusta (São Paulo) https://t.co/yEDiLPEww8
6,1555491326904385538,1565728961598050304,2022-09-02,Toma cuidado  Barba  ...  @LulaOficial    num mosca.... https://t.co/sCMaHSSL6F
7,2759295580,1565724769869234177,2022-09-02,I'm at Hemocentro IBCC https://t.co/CnHkAlPHDq
8,38436423,1565671409984147456,2022-09-02,"Acabou de publicar uma foto em Brás, Sao Paulo, Brazil https://t.co/9JB4wyxNXN"
9,891671153395339264,1565518200711806982,2022-09-02,"São os ciclos que nos transformam. 
Vem #sectember#virgo
#conexão em Mooca https://t.co/GEHaZ00jR8"
10,1402999849197314069,1565497241678368768,2022-09-02,Mooca Bello! 🤌🏼 https://t.co/Sxsa6otkGf
11,83720016,1565491001925537794,2022-09-02,"I'm at Esfiha Juventus in São Paulo, SP w/ @fcterras https://t.co/vzk98rfg8S"
12,1057326004358791169,1565462684069269504,2022-09-01,"a manhã gostosa que foi hoje não tá escrito, pena que já voltei pra realidade https://t.co/5XtHa78Gut"
13,3820831775,1565435498612531203,2022-09-01,Acabou de publicar uma foto em Iron Wraps https://t.co/Q7pzzMSo2U
14,3820831775,1565420588625461248,2022-09-01,Acabou de publicar uma foto em Iron Wraps https://t.co/blE1EziFHv
15,3820831775,1565418159221473283,2022-09-01,Acabou de publicar uma foto em Iron Wraps https://t.co/HE1cwlZ4PS
16,1305290834259193856,1565407497497837570,2022-09-01,Acabou de publicar uma foto em Sao paulo https://t.co/qdReLpnreB
17,1536117973886410758,1565402216621608964,2022-09-01,"hello loves available for video call or sale of content call in private.
Disponível para vídeo chamada 😋😋😋🔞🔞🔞🔞🔞😍😍😍❤️💓💓 https://t.co/380R1baoKd"
18,1524904996843802630,1565386644093812736,2022-09-01,Acabou de publicar uma foto em Rua Augusta (São Paulo) https://t.co/JJ7XLfa0pp
19,1402607206915321857,1565336425507467266,2022-09-01,Minhas paixões kk https://t.co/lz1FqSzoSq
20,817882111868805120,1565324463746428928,2022-09-01,"Acabou de publicar uma foto em Brás, Sao Paulo, Brazil https://t.co/EhkGaZw3xR"
21,2946035369,1565159155308142593,2022-09-01,bye august 👋🏼 https://t.co/A3UGuL4dlv
22,267293166,1565155020743614465,2022-09-01,"I'm at Pro 3 Academia in São Paulo, SP https://t.co/YfzKQJpptS"
23,1527814337062129664,1565133187491237888,2022-09-01,"“Enquanto você não libera a palavra, você domina ela.

Quando você libera, ela domina você”. em Mooca https://t.co/jGX1SogrwV"
24,120544109,1565116853713788932,2022-08-31,"Eu amei esse bar, rolê calminho pra morrer velhinho https://t.co/OtcH1169Fk"
25,827592936,1565106254611206144,2022-08-31,sdds em Bahia https://t.co/SDLmXR5awW
26,130271934,1565089678872772608,2022-08-31,Acabou de publicar uma foto em Brasil São Paulo Sp https://t.co/7Ycsr93fFn
27,1524904996843802630,1565076657928552454,2022-08-31,Acabou de publicar uma foto em Rua Augusta (São Paulo) https://t.co/hKLDGHBhj8
28,3820831775,1565076243329851392,2022-08-31,Acabou de publicar uma foto em Iron Wraps https://t.co/PXiFFSAiEs
29,3231617541,1565061417618792448,2022-08-31,"“Cultura de confiança”, publicado pela @EditoraGente, é um livro que transforma a vida de todo gestor e promove a sinergia com seus liderados. Afinal, gestores definem metas. Bons líderes acompanham seus subordinados.

Resenha no blog Irmãos Livreiros:
👇
https://t.co/ALabMckeGk https://t.co/4XBHG1Wwhv"
30,1305290834259193856,1565044186809769985,2022-08-31,Acabou de publicar uma foto em Sao paulo https://t.co/Szh6UuuOkA
31,2634720245,1565042984265125889,2022-08-31,"Obrigada por me ensinar tanto, todos os dias. Eu amo a Catequese. Mas ela com você, fica muito mais leve, divertida e especial. Te amo, minha Catequista maravilhosa. em Paróquia São Rafael Arcanjo Mooca https://t.co/g6Vz3J88qb"
32,203809353,1565024092041904129,2022-08-31,"I'm at Deck Lounge Bar in São Paulo, SP https://t.co/PoTMVyaY28"
33,100353774,1565017623678652416,2022-08-31,Acabou de publicar uma foto em Ceagesp - Companhia de Entrepostos e Armazéns Gerais de São Paulo. https://t.co/ZdCEuNQwwj
34,128124649,1565006308855762946,2022-08-31,"Hoje é o aniversário do meu titio querido @pardalchimello lenda do @anthares_metal 

Feliz aniversário tio, te amo! Felicidades! 

📸: Dani Moreira em Sesc Belenzinho https://t.co/nigsB8FFFs"
35,56851995,1565004591888056326,2022-08-31,"I'm at Academia Ultra in 聖保羅, SP https://t.co/rWmDJwYImI"
36,817882111868805120,1564961544726781959,2022-08-31,"Acabou de publicar uma foto em Brás, Sao Paulo, Brazil https://t.co/KCmjtdsCOP"
37,1151226393902166021,1564944372139008001,2022-08-31,Acabou de publicar uma foto em Coaching &amp; Realize https://t.co/Wj2fSNl2m3
38,336117114,1564803412784562179,2022-08-31,"@paomorejon Yo que agradezco amiga, la medicina inunda nuestras vidas de Guayaquil a São Paulo. Nos veremos para volver a Buenos Aires. Abrazos desde la Mooca. https://t.co/yKKzYf2lBI"
39,35131751,1564793901776601095,2022-08-31,"An Italian canteen, a pasta dish, a company. You #blackandwhitephoto #blackandwhitephotography #photo #streetphotography #photography #photographer #Photographie 
📷 © Jose Alberto Moraes https://t.co/tEBc7D1jeC"
40,1305290834259193856,1564785604684283906,2022-08-31,Acabou de publicar uma foto em Sao paulo https://t.co/JqeGUmwFri
41,38436423,1564732378551132162,2022-08-30,"Acabou de publicar uma foto em Brás, Sao Paulo, Brazil https://t.co/9JB4wyxNXN"
42,90432796,1564706897160290304,2022-08-30,De uns dias 🍹🎉💫 em Caô Bar https://t.co/0XQKr9bMoZ
43,1487794465561620490,1564683327986180097,2022-08-30,"Chegou a hora, eu quero é já, é @tarcisiogdf para São Paulo melhorar.

Caminhada no Bras com Tarcísio!
#Eleicoes2022 #TarcisioGovernadorSP2022 #GustavAraujoEstadual22433 https://t.co/1PH48fMYvM"
44,1524904996843802630,1564678622228652035,2022-08-30,Acabou de publicar uma foto em Rua Augusta (São Paulo) https://t.co/DiFCSvv1WW
45,1031612925885276161,1564666908087033858,2022-08-30,"Prefeitura de Setubinha MG
Renault Master 16 lugares poltrona móvel 
Parabéns pela sua conquista.SUCESSO 
#renaultmaster #renault #master #acessibilidade #inclusaosocial em Radial Leste https://t.co/BizAV48Pja"
46,1549510350,1564636295858724870,2022-08-30,Acabou de publicar uma foto em Império das Gravatas https://t.co/ZwulttfmZ5
47,1549510350,1564634103768547330,2022-08-30,Acabou de publicar uma foto em Império das Gravatas https://t.co/5ghfKIUWDM
48,1549510350,1564634072261005313,2022-08-30,Acabou de publicar uma foto em Império das Gravatas https://t.co/Xr2So3Mtmm
49,1549510350,1564633903134117892,2022-08-30,Acabou de publicar uma foto em Império das Gravatas https://t.co/XnMkf0HRgI
50,1549510350,1564633748452294660,2022-08-30,Acabou de publicar uma foto em Império das Gravatas https://t.co/35zGU9Solm
51,69362233,1564629604308058121,2022-08-30,Acabou de publicar uma foto em Teatro Municipal da Mooca Arthur Azevedo https://t.co/R8zFrIAK06
52,2535411416,1564615183653371917,2022-08-30,"Ta feliz??? @Belle_belinha__  ???? 
Universidade inclusiva, temos. Kkkkk https://t.co/qJHWtJNsgQ"
53,1151226393902166021,1564600879076052993,2022-08-30,Acabou de publicar uma foto em Coaching &amp; Realize https://t.co/h90Um2e2H7
54,817882111868805120,1564586801427349504,2022-08-30,"Acabou de publicar uma foto em Brás, Sao Paulo, Brazil https://t.co/Bj3PvCPp4g"
55,56851995,1564566263795425281,2022-08-30,"I'm at Academia Ultra in 聖保羅, SP https://t.co/vv8eWPKzMs"
56,233592511,1564549104411496449,2022-08-30,"Manhã de muito frio em SP, mas os corações estão aquecidos pelo Senhor. 🔥
A oração é chave. 🙏🏻
@advecsaopaulo em ADVEC São Paulo https://t.co/7AkrYqxYqC"
57,233592511,1564430573908926464,2022-08-30,🙏🏻 em ADVEC São Paulo https://t.co/wULl3gsA33
58,267293166,1564425326930927617,2022-08-30,"I'm at Pro 3 Academia in São Paulo, SP https://t.co/a1oz6FCiN2"
59,817882111868805120,1564409695691055104,2022-08-30,"Acabou de publicar uma foto em Brás, Sao Paulo, Brazil https://t.co/vnEPHHZZ8C"
60,27008217,1564400785232134144,2022-08-29,"SP Escola de Teatro… #Brás #early20thcenturyarchitecture #SaoPaulo #nofilter em Brás, Sao Paulo, Brazil https://t.co/oq6qjsOvHs"
61,1305290834259193856,1564366986485895170,2022-08-29,Acabou de publicar uma foto em Sao paulo https://t.co/tUdvRKOXMT
62,280194491,1564362812876623877,2022-08-29,Acabou de publicar uma foto em Sesc Belenzinho https://t.co/NSsQ0KMXH7
63,3158064713,1564359816012709889,2022-08-29,Faith in the future  #LT369
64,1524904996843802630,1564328882370936832,2022-08-29,Acabou de publicar uma foto em Rua Augusta (São Paulo) https://t.co/Pn7hmX9K8r
65,47669029,1564327150102134786,2022-08-29,"Hoje a FAPCOM visitou a ETEC Prof. Camargo Aranha, no Bairro da Mooca. https://t.co/4So5NUBok0"
66,1560843066738712576,1564310482756018178,2022-08-29,O alerta do General Heleno. O recado está dado. https://t.co/fxKSkgAZXC
67,137704954,1564278228046565378,2022-08-29,"""

The man with the red face 

📸 @_vinnyezord

#housemusic #music #musicaeletronica #dj #techhouse #nostrilhos #saopaulo #redligths #approve #nacional #festa em Nos Trilhos https://t.co/8ncBO1okuI"
68,195562928,1564272553883058178,2022-08-29,Acabou de publicar uma foto em Mooca https://t.co/LfKyVwm0dA
69,233592511,1564250774821130241,2022-08-29,"Hoje na @advecsaopaulo 🔥 culto da Vitória. 
Convida 5 vem! em ADVEC São Paulo https://t.co/ak57nfWJXC"
70,233592511,1564239857165246465,2022-08-29,Noite linda na @advecsaopaulo 🔥Jesus é maravilhoso! em ADVEC São Paulo https://t.co/zi8uP4Hj8F
71,1151226393902166021,1564212907998646272,2022-08-29,Acabou de publicar uma foto em Coaching &amp; Realize https://t.co/Vcris6ox9h
72,336117114,1564109031635050497,2022-08-29,"Ecuador.Guayas. Candidata a prefecta Marcela Aguiñaga de Revolución Ciudadana abiertamente elogia a los evasores Uribe Schwarkopf identificados por el Observatorio Dolarización @dolarizacionEc. Igual que Susana González PSC. Mismo evento. No  hay disputa, ideologías, ni ética. https://t.co/KSmdOwtF5H"
73,124879030,1564081222976000000,2022-08-29,Acabou de publicar uma foto em Mooca https://t.co/LIZxExjeyQ
74,14400616,1564070977897652225,2022-08-29,"E ela hoje se apresentou no palco principal e foi de vermelho ao Red Carpet, tudo de vermelho intencional!!!!
#DebateNaBand #VMAs https://t.co/N4ggBE893X"
75,1476769328087416836,1564063080019070985,2022-08-29,@MesquitaBrasil https://t.co/GDW8XAlMyw
76,76548213,1564049350661410818,2022-08-29,"Fechando mês de Agosto com chave de ouro, estreia do novo cenário e uma energia incrível no Teatro  do SESC Belenzinho, nosso muito obrigado a todos que curtiram com a gente!!😉🙏🎶😀💙 em Sesc Belenzinho https://t.co/Cm8ubCIng3"
77,42027444,1564048314471006210,2022-08-29,"#benemeritobras 
A nova gestão do Conselho Gestor do Parque Benemérito José Brás  esteve reunida no dia 28/8/2022. Instalação de um cachorrodromo no Parque a título de experiência e apontadas as necessidades de manutenção do entorno. #profchristian https://t.co/yXCd30b866"
78,336117114,1564045587640713216,2022-08-29,Debate histórico. Ahora en São Paulo me siento en la historia de Brasil. La que Lula va a cerrar de una vez acabando con la basura de una vez por todas. Por el futuro de América Latina. https://t.co/RRq8NH6kom
79,59850664,1564042262115409925,2022-08-29,Vai começar! #DebateNaBand em Assistindo debate presidêncial na Band https://t.co/TUALoZKHcV
80,1865549592,1564006636829622273,2022-08-28,Começamos 🍻 #BoaNoite #GoodEvening #Friends #Amigos em Cinelândia Rio De Janeiro https://t.co/rMLfojiVYs
81,971847510,1563931566950301697,2022-08-28,"Foto de 2013, que lindeza!
#camera #analogphotography #film #rolleiflex en Cinelândia Rio De Janeiro https://t.co/cz4C4vifFf"
82,935333725,1563903173655404544,2022-08-28,O Bom Prato de cada dia 🙏🏾 https://t.co/pSwZbRqIO9
83,1495726521746661376,1563896596433182726,2022-08-28,"Oi amores hoje vou atender na Mooca na parte da tarde
Rua do Oratório 622 suíte 40,00"
84,2750393776,1563850751927017474,2022-08-28,"Noite incrível! Aniversário da Isabela, nossa sobrinha... parabéns @isacabrelli Deus te abençoe sempre! Felicidades! 🙏🏼🎊🎁🥳 em Mooca https://t.co/xHOsoxTAEw"
85,71839760,1563842667934539780,2022-08-28,#Amaralinda_07-03-20 em Belenzinho Zona Leste https://t.co/YeuI70zIVb
86,121659280,1563840681113706499,2022-08-28,Acabou de publicar uma foto em Imprensa Oficial de São Paulo https://t.co/BA2oM758g5
87,161709441,1563658276700848128,2022-08-27,"VITÓRIA DO MLK TRAVESSO:

E meus coxudos da Javari ganharam o jogo hoje 27/08 em casa enfrentando o Oeste.
Os 2 gols foram marcado pelo querido❤️
⚽️⚽️ @llsouza_97 
#forzajuve em Estádio Juventus da Mooca https://t.co/LskgIeZigk"
88,1524904996843802630,1563649221277978627,2022-08-27,Acabou de publicar uma foto em Rua Augusta (São Paulo) https://t.co/vvu2F4cPg7
89,17724563,1563642035248447488,2022-08-27,#Javari #Mooca #Juventus em Estádio Conde Rodolfo Crespi https://t.co/18PfmocW27
90,1341406621658963968,1563616043016359936,2022-08-27,Tomahawk muito bem executado..🔪💕 https://t.co/jm9WUdSKuO
91,17724563,1563615725335375872,2022-08-27,"Fim de jogo na #Javari: Juventus 2x0 Oeste.

Jogo oficial só ano que vem. :/"
92,336117114,1563614297447473154,2022-08-27,"Here comes the sun, little darlin… https://t.co/FsLUTfHc0Z"
93,1024189116,1563602944083501060,2022-08-27,Gol do @oficialjuventus https://t.co/7cUCcoyUHb
94,17724563,1563590795923316741,2022-08-27,Última do ano. #Juventus https://t.co/G90kVXwdQs
95,551303416,1563584964805140485,2022-08-27,Just posted a photo @ Festa Italiana https://t.co/cEEAyYgmM3
96,83720016,1563553651322368000,2022-08-27,"I'm at Empório Coisas de Minas in São Paulo, SP w/ @fcterras https://t.co/2Za8039fqJ"
97,1546391239,1563543226891456513,2022-08-27,"Dizer que o agro é fascista e direitista é fácil, mas é de onde vem aquela “água mineral” que ele mais gosta?? Se souberem posta nos comentários 🤣🤣🤣"
