,author_id,tweet_id,created_at,text
0,52268517,1553607509495218180,2022-07-31,Acabou de publicar uma foto em Cama https://t.co/ywiNBlwoSO
1,178883575,1553376850197594112,2022-07-30,Acabou de publicar uma foto em Google Meet https://t.co/ZViVslZueK
2,793259180299849728,1553068020125286400,2022-07-29,Irmãos Beni preparando o 3° CONAER - Congresso Aeromédico Brasileiro @resgateaeromedico #mestredecerimonias em Anhembi Morumbi https://t.co/DuBJcdbJ0O
3,1550547731177000961,1553064788451885061,2022-07-29,Obrigado pessoal do São Lucas 👊 https://t.co/9QbM9OfAro
4,993669513106395136,1552825578973184000,2022-07-29,"Pessoas Lindas do meu coração,
A todos uma BOA NOITE ! em Valinhos, São Paulo https://t.co/jV2Mwfaswi"
5,1421428030736683010,1552818907555287043,2022-07-29,https://t.co/e3EH4oBWNN
6,55748108,1552719505771700230,2022-07-28,Acabou de publicar uma foto em Parque São Lucas https://t.co/T3bvoH87qc
7,70141650,1552658878419984396,2022-07-28,"#TBT recente do último fim de semana. @ Valinhos, São Paulo https://t.co/Hg0qSH837O"
8,53929018,1552435027086114827,2022-07-27,Acabou de publicar uma foto em Academia Cia Mega Fitness - Unid. Oratório https://t.co/BYiyQPRss6
9,1176691098632237059,1552361034144514048,2022-07-27,Acabou de publicar um vídeo em CylersCrew https://t.co/yaMvyovlLr
10,1176691098632237059,1552357426401361931,2022-07-27,Acabou de publicar um vídeo em CylersCrew https://t.co/enaNeYvBg8
11,1514686573081681930,1552078059750232064,2022-07-26,Na onda parece miragem 📌 em Litoral Paulista https://t.co/tkCM34zhY5
12,1320986447369932800,1552073733287907334,2022-07-26,"Alô @emtu_oficial ....
O app indica 3 onibus no mesmo local..sentido são Caetano e NENHUM ÔNIBUS sentido santo André????

O que acontece???
Linha 140 https://t.co/3qyWV3MSvv"
13,1022840668882972672,1552034172717240321,2022-07-26,"Acabou de publicar uma foto em Valinhos, São Paulo https://t.co/hwcZ9j1A1m"
14,46761175,1551958878086111232,2022-07-26,Vitória importante e a quebra de mais um tabu no último domingo pelo Paulista de Flag. Ducks 23x00 Titans. Seguimos firme e focados em busca do nosso objetivo. #GoDucks #PaulistadeFlag2022 #APFA #FA #FutebolAmericano https://t.co/XpiV9JQB7l
15,1267252983852654595,1551783563934277632,2022-07-26,"Eu fico com esses @ e quero repetir, aí será que eles pensam que eu quero algo a mais quando eu só quero mesmo é dar???"
