,author_id,tweet_id,created_at,text
0,110014742,1569369747724042241,2022-09-12,"Dia 11/09 Dia do Árbitro 
FPFS PAULISTA A2 INICIAÇÃO 

BATALHA x PINDA em Vila Alpina ZL / SP https://t.co/HF8culgEww"
1,70141650,1569330913267302402,2022-09-12,"20kg mais gordo, mas que Fim de Semana ótimo. @ Valinhos, São Paulo https://t.co/EESmY1vBDn"
2,26854668,1569102266153553920,2022-09-11,"#Tidal #YouTube #Vevo #carlovymusicc #carlovywear #noslackinginvolved #harlem 
CARLOVY MUSICC PRESENTS FRIEND ZONE 3 @ Tidal https://t.co/97U3inAzQn"
3,1520320583338237954,1568988821089288193,2022-09-11,"Treino pago, o Vinho tá liberado..🥵 https://t.co/kNtxFCNiBx"
4,73424735,1568812578796601346,2022-09-11,Continuando as comemorações do 4.0 ❤️ em Stones Music Bar https://t.co/neefp5B1QB
5,73424735,1568810523965243392,2022-09-11,Hoje é dia de rock bebê! em Stones Music Bar https://t.co/zYwvBDny9K
6,1329154927231455236,1567662730676412416,2022-09-07,"Role básico 

#vilaalpina #zlestesp #role #migles❤️ #saopaulo #viber #paz #model #modas #naturelovers #viver #diversion #lgbtq🌈 #transsexuals #gaybrasil em Vila Alpina ZL / SP https://t.co/JLjyb0ipD9"
