,author_id,tweet_id,created_at,text
0,1047614019509657602,1528117338846814208,2022-05-21,Rolê aleatório com minha Princesa Laura Brandão em Mooca Plaza Shopping https://t.co/QDe84e4CDa
1,1521510305649602564,1528062932071895043,2022-05-21,"300/400 ou mais uma calça para o frio.
Por isso o pessoal importa da Shopee por 100 kkk"
2,1521510305649602564,1528045221795225600,2022-05-21,@Mahomes_baiano Colocaram a escada em cima pra dar mais velocidade. Igual carro de empresa de telefonia ou internet kkkk https://t.co/wkvIzvSUcI
3,1521510305649602564,1528044068470677510,2022-05-21,"Como é possível sonhar com duas pessoas do twitter sem nunca terem os conhecido pessoalmente?
Um dia foi @pauloantunes 
Hoje, mais duas pessoas kkk
Jesus."
4,1521510305649602564,1528039171239157762,2022-05-21,"Sair pra almoçar: Vc não sabe se é o frio, rinite, alegria. Tá uma blz o nariz escorrendo dentro do restaurante.
Ou...pode ser o chopp gelado kkkk"
5,1521510305649602564,1528034203933233153,2022-05-21,Bater um rango com a família no restaurante do Shopping Mooca https://t.co/GRVKOvo7DP
6,144811662,1528016026998190081,2022-05-21,Acabou de publicar uma foto em Estação Vila Prudente https://t.co/ivD7NGGIsR
7,2516966574,1527970573539737602,2022-05-21,I'm at Pera Açai in São Paulo https://t.co/mMQYSpm7yP
8,2516966574,1527970351313043457,2022-05-21,I'm at Burger King in São Paulo https://t.co/p3s2iPtndI
9,2516966574,1527948030011383809,2022-05-21,I'm at Vitrolla's Burger in São Paulo https://t.co/5eNZKqc6Kc
10,1526699031249944582,1527798583868723201,2022-05-20,https://t.co/bittUFKryC
11,83720016,1527796847665991680,2022-05-20,"I'm at Grand Cru in São Paulo, SP w/ @fcterras https://t.co/XDtZIOz6hP"
12,83720016,1527796697665089538,2022-05-20,"I'm at Madero Steak House - @maderobrasil in São Paulo, SP w/ @fcterras https://t.co/Q9beABxk9T"
13,774469015,1527755038747131905,2022-05-20,😍 em Vila Prudente https://t.co/cEz9bRqgBW
14,371479366,1527737878888886272,2022-05-20,Acabou de publicar uma foto em Dnbb Office https://t.co/T7z6r7lcmx
15,3786253882,1527664419936915457,2022-05-20,"fui comer uma maçã e o trem chegou bem na hr 
pelo menos 35% da minha maçã eu deixei numa plantinha q tava toda murcha e capenga
cuidar dessa plantinha vai ser minha nova obsessão 🤩 e eu acabei criando isso acidentalmente"
16,144811662,1527619910733426689,2022-05-20,Acabou de publicar uma foto em Estação Tamanduateí https://t.co/XO4Zs2Aa7K
17,31515394,1527359942348312577,2022-05-19,@meltedvideos https://t.co/2lpSPVkKzO
18,579387724,1527311289202130944,2022-05-19,I'm at Tocco burger in São Paulo https://t.co/JHLpwTsfes
19,579387724,1527263663639478273,2022-05-19,"I'm at Cepam - @padariacepam in São Paulo, SP https://t.co/Y9NAaGBMmh"
20,2787216415,1527001723352539137,2022-05-18,Acabou de publicar uma foto em Teatro São Cristóvão https://t.co/M4J2NMJ5jd
21,42212423,1526927104570445829,2022-05-18,"Está foi uma daquelas noite que ficará registrada em nossos corações para sempre. Que presença linda de Jesus!!

Mais uma vez, obrigado por nos abençoar tanto @fredfigueiredo. 🔥 em Época da Graça https://t.co/GjTLNVLznN"
22,60211118,1526923661193752577,2022-05-18,Dennis EXTREMAMENTE FELIZ com o frio: https://t.co/eR6y15nugt
23,579387724,1526891370064928773,2022-05-18,"I'm at Cepam - @padariacepam in São Paulo, SP https://t.co/cEXQOxb9ZB"
24,1389581689354129431,1526705331371376640,2022-05-17,CHEGAMOS E VAMOS MOSTRAR PARA O QUE VIEMOS 🏴🏳️ https://t.co/LRMLxyDkae
25,203809353,1526600362093957122,2022-05-17,I'm at Super Grill Express in São Paulo https://t.co/8bApEh4jen https://t.co/Xt7Z6NKQkW
26,20102067,1526570042267258881,2022-05-17,"@CETSP_ @sptrans @Prefeitura_SP Eu condutor escolar estou enfrentando problemas tds os dias para embarcar alunos na EMEF DES. FRANCISCO MEIRELLES, a duas semanas a @CETSP_ removeu as placas que antes não respeitavam, hoje sem elas piorou. Não deram previsão de substituição. https://t.co/F0Lyi8GB79"
27,42212423,1526533497141317634,2022-05-17,"Minha expectativa está nas alturas por esta noite. 🔥 Que alegria receber meu querido canela  @fredfigueiredo ❤️

Vc não pode perder!!
Junte-se a nós neste Culto Sobrenatural.
Logo mais às 20hs em Época da Graça https://t.co/BtHdvwHzOk"
28,745269332842844164,1526531114050920448,2022-05-17,"@xoia @rodrigobocardi até agora a #L2 está com problemas.  Assisti as 7:37 que tinha normalizado mais é mentira do @metrosp_oficial . Parou, ficou 3 minutos de porta fechada e só depois abriu. E esta parado sem sair. https://t.co/5ubVRTSX9O"
29,55310560,1526363001552572420,2022-05-17,"AEEE, curtimos um style animal print! ✨🔥[vulgo: @pantanal.novela ] 🐆 em Vila Prudente https://t.co/BloFkiNMky"
30,71581273,1526284580562554883,2022-05-16,Acabou de publicar uma foto em Estação Tamanduateí https://t.co/83S0dqqnDo
31,774469015,1526264239039684612,2022-05-16,"Já comeu no Sukiya? 🍜😋🥰

#maisumnomundo #sukiya #japanesefood #japan #vilaprudente #food #fotografia #fotos #simplephoto em Vila Prudente https://t.co/rmkCpnruEE"
32,60211118,1526224485942280198,2022-05-16,"Encontrei de novo o HOMEM MAIS LINDO DA VILA PRUDENTE 
E ele falou comigo. 

Tô apaixonada 

(Alguém faz esse Tweet chegar nele) https://t.co/iJvNc9biao"
33,358558153,1526220112407175169,2022-05-16,Acabou de publicar uma foto em Odontologia Agda Andrade https://t.co/6G9ZfTJ4O2
34,774469015,1526189756576501760,2022-05-16,"Sobre ontem 🌚
Lua de Sangue

#maisumnomundo #vilaprudente #saopaulo #brasil #fullmoon #luadesangue #bloodymoon #skyphotography #darkphotography em Vila Prudente https://t.co/LQ11tt3OOK"
35,1087529434259865601,1526185959468965889,2022-05-16,Acabou de publicar uma foto em Estadio Dos Aflitos Recife https://t.co/nQoqXz2drA
36,1087529434259865601,1526185786521096195,2022-05-16,Acabou de publicar uma foto em Estadio Dos Aflitos Recife https://t.co/Kt4hXuTRQx
