,author_id,tweet_id,created_at,text
0,1201304740908478465,1529606084712882177,2022-05-25,Antes da merda acontecer 🤡 https://t.co/Y24TLFUGhW
1,774469015,1529348304198414336,2022-05-25,Acabou de publicar uma foto em Vila Prudente https://t.co/akG7kH3evo
2,68753538,1529241095447711746,2022-05-24,"Dois dias sem ela, não aguento mais, já estou com saudades 😭😭😭😭 em Nirá Sushi https://t.co/HLW6AWzv7P"
3,371479366,1529112049153982464,2022-05-24,Acabou de publicar uma foto em Dnbb Office https://t.co/PCGUwsZSnU
4,144811662,1529044574106136577,2022-05-24,Acabou de publicar uma foto em Estação Vila Prudente https://t.co/6HEQbKv4NG
5,86780048,1528750453869228032,2022-05-23,"E vamos de resolver coisas da vida adulta. (@ 26.º Cartório de Registro Civil - Vila Prudente in São Paulo, SP) https://t.co/dPrTYHWPZT"
6,144811662,1528704027499892736,2022-05-23,Acabou de publicar uma foto em Estação Vila Prudente https://t.co/0qpPYNwmxe
7,579387724,1528695455965761538,2022-05-23,"I'm at Cepam - @padariacepam in São Paulo, SP https://t.co/mQG88lSCWg"
8,996114205345533952,1528483062991900672,2022-05-22,"Seja paciente no processo e não tenha medo do novo, tudo que nos desafia é compensador em França - Paris https://t.co/FRnh7bZxO3"
9,1278359767153549318,1528467778415607811,2022-05-22,Do nada vim parar aqui na Vl Prudente
10,21259353,1528429247974580224,2022-05-22,eu e meu pompom fofo em Vila Prudente https://t.co/ZCG7NNAzlW
11,55310560,1528412288029425664,2022-05-22,Sem sorrisinho/ Com sorrisinho. 🔥❤️‍🔥✨ em Vila Prudente https://t.co/sMFaASsojU
12,1520499965822484483,1528396209337122818,2022-05-22,E hoje e contra as trikas!!! Vamuu Corinthians
13,1520499965822484483,1528396205981581312,2022-05-22,@centraldotimao https://t.co/iaEDyyfwsm
14,930464635806978048,1528195921246408705,2022-05-22,Tô na moral🤳🏽😎✌🏽 https://t.co/EAcMICaKmT
15,1047614019509657602,1528117338846814208,2022-05-21,Rolê aleatório com minha Princesa Laura Brandão em Mooca Plaza Shopping https://t.co/QDe84e4CDa
16,1521510305649602564,1528062932071895043,2022-05-21,"300/400 ou mais uma calça para o frio.
Por isso o pessoal importa da Shopee por 100 kkk"
17,1521510305649602564,1528045221795225600,2022-05-21,@Mahomes_baiano Colocaram a escada em cima pra dar mais velocidade. Igual carro de empresa de telefonia ou internet kkkk https://t.co/wkvIzvSUcI
18,1521510305649602564,1528044068470677510,2022-05-21,"Como é possível sonhar com duas pessoas do twitter sem nunca terem os conhecido pessoalmente?
Um dia foi @pauloantunes 
Hoje, mais duas pessoas kkk
Jesus."
19,1521510305649602564,1528039171239157762,2022-05-21,"Sair pra almoçar: Vc não sabe se é o frio, rinite, alegria. Tá uma blz o nariz escorrendo dentro do restaurante.
Ou...pode ser o chopp gelado kkkk"
20,1521510305649602564,1528034203933233153,2022-05-21,Bater um rango com a família no restaurante do Shopping Mooca https://t.co/GRVKOvo7DP
21,144811662,1528016026998190081,2022-05-21,Acabou de publicar uma foto em Estação Vila Prudente https://t.co/ivD7NGGIsR
22,2516966574,1527970573539737602,2022-05-21,I'm at Pera Açai in São Paulo https://t.co/mMQYSpm7yP
23,2516966574,1527970351313043457,2022-05-21,I'm at Burger King in São Paulo https://t.co/p3s2iPtndI
24,2516966574,1527948030011383809,2022-05-21,I'm at Vitrolla's Burger in São Paulo https://t.co/5eNZKqc6Kc
25,1526699031249944582,1527798583868723201,2022-05-20,https://t.co/bittUFKryC
26,83720016,1527796847665991680,2022-05-20,"I'm at Grand Cru in São Paulo, SP w/ @fcterras https://t.co/XDtZIOz6hP"
27,83720016,1527796697665089538,2022-05-20,"I'm at Madero Steak House - @maderobrasil in São Paulo, SP w/ @fcterras https://t.co/Q9beABxk9T"
28,774469015,1527755038747131905,2022-05-20,😍 em Vila Prudente https://t.co/cEz9bRqgBW
29,371479366,1527737878888886272,2022-05-20,Acabou de publicar uma foto em Dnbb Office https://t.co/T7z6r7lcmx
30,3786253882,1527664419936915457,2022-05-20,"fui comer uma maçã e o trem chegou bem na hr 
pelo menos 35% da minha maçã eu deixei numa plantinha q tava toda murcha e capenga
cuidar dessa plantinha vai ser minha nova obsessão 🤩 e eu acabei criando isso acidentalmente"
31,144811662,1527619910733426689,2022-05-20,Acabou de publicar uma foto em Estação Tamanduateí https://t.co/XO4Zs2Aa7K
