,author_id,tweet_id,created_at,text
0,68753538,1529241095447711746,2022-05-24,"Dois dias sem ela, não aguento mais, já estou com saudades 😭😭😭😭 em Nirá Sushi https://t.co/HLW6AWzv7P"
1,371479366,1529112049153982464,2022-05-24,Acabou de publicar uma foto em Dnbb Office https://t.co/PCGUwsZSnU
2,144811662,1529044574106136577,2022-05-24,Acabou de publicar uma foto em Estação Vila Prudente https://t.co/6HEQbKv4NG
3,86780048,1528750453869228032,2022-05-23,"E vamos de resolver coisas da vida adulta. (@ 26.º Cartório de Registro Civil - Vila Prudente in São Paulo, SP) https://t.co/dPrTYHWPZT"
4,144811662,1528704027499892736,2022-05-23,Acabou de publicar uma foto em Estação Vila Prudente https://t.co/0qpPYNwmxe
5,579387724,1528695455965761538,2022-05-23,"I'm at Cepam - @padariacepam in São Paulo, SP https://t.co/mQG88lSCWg"
6,996114205345533952,1528483062991900672,2022-05-22,"Seja paciente no processo e não tenha medo do novo, tudo que nos desafia é compensador em França - Paris https://t.co/FRnh7bZxO3"
7,1278359767153549318,1528467778415607811,2022-05-22,Do nada vim parar aqui na Vl Prudente
8,21259353,1528429247974580224,2022-05-22,eu e meu pompom fofo em Vila Prudente https://t.co/ZCG7NNAzlW
9,55310560,1528412288029425664,2022-05-22,Sem sorrisinho/ Com sorrisinho. 🔥❤️‍🔥✨ em Vila Prudente https://t.co/sMFaASsojU
10,1520499965822484483,1528396209337122818,2022-05-22,E hoje e contra as trikas!!! Vamuu Corinthians
11,1520499965822484483,1528396205981581312,2022-05-22,@centraldotimao https://t.co/iaEDyyfwsm
12,930464635806978048,1528195921246408705,2022-05-22,Tô na moral🤳🏽😎✌🏽 https://t.co/EAcMICaKmT
13,1047614019509657602,1528117338846814208,2022-05-21,Rolê aleatório com minha Princesa Laura Brandão em Mooca Plaza Shopping https://t.co/QDe84e4CDa
14,1521510305649602564,1528062932071895043,2022-05-21,"300/400 ou mais uma calça para o frio.
Por isso o pessoal importa da Shopee por 100 kkk"
15,1521510305649602564,1528045221795225600,2022-05-21,@Mahomes_baiano Colocaram a escada em cima pra dar mais velocidade. Igual carro de empresa de telefonia ou internet kkkk https://t.co/wkvIzvSUcI
16,1521510305649602564,1528044068470677510,2022-05-21,"Como é possível sonhar com duas pessoas do twitter sem nunca terem os conhecido pessoalmente?
Um dia foi @pauloantunes 
Hoje, mais duas pessoas kkk
Jesus."
17,1521510305649602564,1528039171239157762,2022-05-21,"Sair pra almoçar: Vc não sabe se é o frio, rinite, alegria. Tá uma blz o nariz escorrendo dentro do restaurante.
Ou...pode ser o chopp gelado kkkk"
18,1521510305649602564,1528034203933233153,2022-05-21,Bater um rango com a família no restaurante do Shopping Mooca https://t.co/GRVKOvo7DP
19,144811662,1528016026998190081,2022-05-21,Acabou de publicar uma foto em Estação Vila Prudente https://t.co/ivD7NGGIsR
20,2516966574,1527970573539737602,2022-05-21,I'm at Pera Açai in São Paulo https://t.co/mMQYSpm7yP
21,2516966574,1527970351313043457,2022-05-21,I'm at Burger King in São Paulo https://t.co/p3s2iPtndI
22,2516966574,1527948030011383809,2022-05-21,I'm at Vitrolla's Burger in São Paulo https://t.co/5eNZKqc6Kc
23,1526699031249944582,1527798583868723201,2022-05-20,https://t.co/bittUFKryC
24,83720016,1527796847665991680,2022-05-20,"I'm at Grand Cru in São Paulo, SP w/ @fcterras https://t.co/XDtZIOz6hP"
25,83720016,1527796697665089538,2022-05-20,"I'm at Madero Steak House - @maderobrasil in São Paulo, SP w/ @fcterras https://t.co/Q9beABxk9T"
26,774469015,1527755038747131905,2022-05-20,😍 em Vila Prudente https://t.co/cEz9bRqgBW
27,371479366,1527737878888886272,2022-05-20,Acabou de publicar uma foto em Dnbb Office https://t.co/T7z6r7lcmx
28,3786253882,1527664419936915457,2022-05-20,"fui comer uma maçã e o trem chegou bem na hr 
pelo menos 35% da minha maçã eu deixei numa plantinha q tava toda murcha e capenga
cuidar dessa plantinha vai ser minha nova obsessão 🤩 e eu acabei criando isso acidentalmente"
29,144811662,1527619910733426689,2022-05-20,Acabou de publicar uma foto em Estação Tamanduateí https://t.co/XO4Zs2Aa7K
30,31515394,1527359942348312577,2022-05-19,@meltedvideos https://t.co/2lpSPVkKzO
31,579387724,1527311289202130944,2022-05-19,I'm at Tocco burger in São Paulo https://t.co/JHLpwTsfes
32,579387724,1527263663639478273,2022-05-19,"I'm at Cepam - @padariacepam in São Paulo, SP https://t.co/Y9NAaGBMmh"
33,2787216415,1527001723352539137,2022-05-18,Acabou de publicar uma foto em Teatro São Cristóvão https://t.co/M4J2NMJ5jd
34,42212423,1526927104570445829,2022-05-18,"Está foi uma daquelas noite que ficará registrada em nossos corações para sempre. Que presença linda de Jesus!!

Mais uma vez, obrigado por nos abençoar tanto @fredfigueiredo. 🔥 em Época da Graça https://t.co/GjTLNVLznN"
35,60211118,1526923661193752577,2022-05-18,Dennis EXTREMAMENTE FELIZ com o frio: https://t.co/eR6y15nugt
36,579387724,1526891370064928773,2022-05-18,"I'm at Cepam - @padariacepam in São Paulo, SP https://t.co/cEXQOxb9ZB"
