,author_id,tweet_id,created_at,text
0,727083578278993920,1527209827528753153,2022-05-19,Bom dia zapp em Parada Inglesa https://t.co/z8ilgTmdwX
1,64908810,1527115220975423488,2022-05-19,APAS 2022 em Expo Center Norte https://t.co/byAsGlaEp9
2,1439105270064496643,1527111950676766720,2022-05-19,"Acabou de publicar uma foto em IFSP - Instituto Federal de Educação, Ciência e Tecnologia de São Paulo https://t.co/ZuYKDLiUK1"
3,1439105270064496643,1527038932331794433,2022-05-18,"Acabou de publicar uma foto em IFSP - Instituto Federal de Educação, Ciência e Tecnologia de São Paulo https://t.co/iQ9xCYuLmN"
4,1344449880887087107,1527012914657472514,2022-05-18,Frio nova yorkino por aqui https://t.co/nC8tNiUiny
5,454419733,1527001379818000385,2022-05-18,Acabou de publicar uma foto em Jardim São Paulo (Santana) https://t.co/p6qbfuEc2q
6,292943643,1526985417723191296,2022-05-18,"Falando para a @RevSuperVarejo sobre a participação italiana no mercado brasileiro de alimentos e bebidas.
#APASShow #gastronomia #Italia https://t.co/o8OkJUofZj"
7,1076106932807708673,1526949318745378817,2022-05-18,Acabou de publicar uma foto em Vila Guilherme https://t.co/yqnaaPVoj3
8,40125120,1526947147689644033,2022-05-18,"APAS 2022
Expo Center Norte-SP
By CEPEDA Francisco/APAS em Expo Center Norte https://t.co/qwJpndMsXa"
9,1227573126923419649,1526883921069166592,2022-05-18,"Acabou de publicar uma foto em SOL Do Oriente. "". https://t.co/FB2hObkynI"
10,1227573126923419649,1526883543586045952,2022-05-18,"Acabou de publicar uma foto em SOL Do Oriente. "". https://t.co/uGWgDskPA0"
11,887519911723008000,1526859167385919488,2022-05-18,Equipe de reportagem as 4:30hrs com 7°c na operação policial de hj 📽🥶 https://t.co/XzjnFCvvil
12,727083578278993920,1526845397058170880,2022-05-18,Bom dia em Parada Inglesa https://t.co/kIQqLbxGjW
13,40125120,1526757196842811393,2022-05-18,"Bailarinas do Faustão 
@apasshow 
@radiobandnewsfm 
By CEPEDA Francisco/APAS em Expo Center Norte https://t.co/FLDiGNftci"
14,78507844,1526737388927651840,2022-05-18,Nesse sábado tem em é nóis no Prainha da Vila em nome do pai e do filho.... em Prainha da Vila Bar https://t.co/19fH5PYhIS
15,167156849,1526715950912913408,2022-05-18,Acabou de publicar uma foto em Expo Center Norte https://t.co/iDydiBTpVT
16,1644110526,1526580936757809152,2022-05-17,Acabou de publicar uma foto em Vila Gustavo - Parada Inglesa https://t.co/gj0XFFf8ae
17,1644110526,1526577614382669826,2022-05-17,Acabou de publicar uma foto em Vila Gustavo - Parada Inglesa https://t.co/vfYwlvsxh1
18,1227573126923419649,1526532425928609792,2022-05-17,"Acabou de publicar uma foto em SOL Do Oriente. "". https://t.co/Rg07yco3RA"
19,16137880,1526342717600583680,2022-05-16,"I'm at Instituto Federal de Educação, Ciência e Tecnologia de São Paulo - @ifsaopaulo in São Paulo, SP https://t.co/YnPMleEV8C"
20,1644110526,1526342107388166144,2022-05-16,Acabou de publicar uma foto em Vila Gustavo - Parada Inglesa https://t.co/ZRbieZtfFO
21,215474722,1526318390423474178,2022-05-16,Acabou de publicar uma foto em DAMA DA NOITE CLUB https://t.co/ZHGWozqnYp
22,958340875515514881,1526317475914301440,2022-05-16,"Minha filha está com dor de cabeça a uma semana, trouxe ela no hospital para avaliação médica.  Cheguei aqui as 14:11hs agora são 18:42hs e o médico ainda não nos atendeu.

Detalhe: É convênio."
23,40125120,1526316341103316992,2022-05-16,"Jair Bolsonaro 
APAS Show 2022/SP
By CEPEDA Francisco em Expo Center Norte https://t.co/Vmgsjad9QL"
24,52839629,1526301418864271360,2022-05-16,Acabou de publicar uma foto em Expo Center Norte https://t.co/8hWTrmn2QG
25,1477674075438960640,1526301181475176448,2022-05-16,Lv https://t.co/PBo7gtSi7D
26,52839629,1526300258594078720,2022-05-16,Acabou de publicar uma foto em Expo Center Norte https://t.co/G8Jt3E5kqW
27,215474722,1526271152171241479,2022-05-16,Nesta terça feira tem Libertadores ao vivo na Dama da Noite em DAMA DA NOITE CLUB https://t.co/eOFuEi3tWY
28,842482153,1526253029938405378,2022-05-16,"APAS SHOW
Maior feira de alimentos, bebidas e afins, da América Latina. https://t.co/067s7fJPeo"
29,3070899617,1526248239548157953,2022-05-16,APAS 2022 🤝👊🙌🙏💚🐷💚 https://t.co/1zfkGemEub
30,727083578278993920,1526119881892147200,2022-05-16,Bom dia em Parada Inglesa https://t.co/Eagi4Ke8cv
31,1289788754337701888,1526086912405999616,2022-05-16,Acabou de publicar uma foto em Ginásio De Esportes José Corrêa - Barueri https://t.co/BXzJcx38v7
32,52792186,1526040829541986304,2022-05-16,Dr. Estranho 🍿🎥😎👩🏻‍❤️‍💋‍👨🏾 (@ Cinemark Bradesco Prime - @cinemarkoficial in São Paulo) https://t.co/6F65sxJngr
33,1305001083169890304,1526031661883850752,2022-05-16,"A lua

#EclipseLunar https://t.co/gZA92iGVHu"
34,1260097627,1525972990592176128,2022-05-15,Acabou de publicar uma foto em Centro Esportivo Vila Manchester https://t.co/5CqNBjOEoD
35,836265813728444417,1525947405891510272,2022-05-15,"✨Quem tem um amigo, tem tudo ✨ em Expo Center Norte https://t.co/RHiwN3e7S9"
36,251233867,1525901164591648768,2022-05-15,"Metallica 🥰🤩🤘

#metinsaopaulo 
#metallica em Show Metallica no Estádio do Morumbi https://t.co/tO7ADLBYN5"
37,251233867,1525898094893834241,2022-05-15,"Sem palavras para descrever o que foi estar nesse show!!!

@metallica 

#metinsaopaulo #metallica #rockpesado🎸 em Show Metallica no Estádio do Morumbi https://t.co/EsRYVgAJ0G"
38,267293166,1525665850660986880,2022-05-15,"I'm at Cinemark for Doctor Strange in the Multiverse of Madness in São Paulo, SP https://t.co/pAFbTch8sJ"
39,79641068,1525651705890803713,2022-05-15,"Hoje a pizza é com essas figurinhas raras aqui kkkkkk só falam besteira

#pizza #saturday em Tuna’s Pizza https://t.co/1xakimDlxB"
40,29595934,1525642684811161600,2022-05-15,Just posted a photo @ Shopping D https://t.co/BKEkBB4UBL
41,35005800,1525612376724209665,2022-05-14,"Oye como va

Da me una cueca cuela guey! em Los Sombreros Parada Inglesa https://t.co/OIP4aYVC7Y"
42,780907393085497344,1525576577630752769,2022-05-14,"Da uma olhada nisso aqui que eu acabei de fazer, só por 50 reais 🥰🥰🥰 https://t.co/0DlZTM8ZQO"
43,285118966,1525575787780390912,2022-05-14,"Recomendo 👍🏻

E o espaço do game aqui no Shopping D é da hora! https://t.co/IujEBemxZP"
44,1644110526,1525561443445186560,2022-05-14,Acabou de publicar uma foto em Vila Gustavo - Parada Inglesa https://t.co/lBNyL0GtwQ
45,78507844,1525556026719846403,2022-05-14,"O samba não pode parar, esperando vc chegar, bora lá? em Laplaya.sportsbar https://t.co/yoflAxxqWe"
46,132672694,1525531283773960192,2022-05-14,Acabou de publicar uma foto em Silvio Cerri https://t.co/auauriBUBY
47,151581569,1525506956374450177,2022-05-14,"I'm at @TGIFridays_br in São Paulo, SP w/ @murillomarigo https://t.co/QS6CCZD2GT"
48,75371607,1525505025946025986,2022-05-14,Rodízio árabe raiz + gatinho appreciation post. https://t.co/fVOZD4TdXv
49,100353774,1525497337489108995,2022-05-14,Acabou de publicar uma foto em Expo Center Norte https://t.co/BPcdeLr6On
50,151564993,1525478922099609600,2022-05-14,https://t.co/tdGw4CHZ3Z
51,188546872,1525470643755843584,2022-05-14,A gente finge que joga e fala que não bebe 😂😂😂 https://t.co/fF0jXmNaqH
52,2446325420,1525440940474634242,2022-05-14,"Acabou de publicar uma foto em IFSP - Instituto Federal de Educação, Ciência e Tecnologia de São Paulo https://t.co/8O2iZIS3wt"
53,203809353,1525326571434913794,2022-05-14,"I'm at Outback Steakhouse - @outbackbrasil in São Paulo, SP https://t.co/CKzssaWpns https://t.co/bOinY6EuJO"
54,203809353,1525326116575133696,2022-05-14,"Direto da festa dos Pires Cavalcante @claudioherrera_ @victorlesky (@ Shopping @CenterNorte_ in São Paulo, SP) https://t.co/U36uuHgoXa https://t.co/vZgoFfwjSl"
55,53034941,1525268106087653376,2022-05-14,"Comemorando o níver da minha amada e linda Filhota com a Família reunida, é uma benção.... Feliz aniversário Thayanne papai te amo muito.... em Estância Caipira - São Paulo https://t.co/KABH8LS9Km"
56,1623432385,1525248690893402112,2022-05-13,Just posted a photo @ Ginásio De Esportes José Corrêa - Barueri https://t.co/rOaetaGsVW
57,70708267,1525240767870128129,2022-05-13,@rebele_sp @cirogomes @masp #política #cirogomes #eleicoes2022 en MASP https://t.co/wDiJDBcQeU
58,14220748,1525155085931757570,2022-05-13,"(@ Café No Jardim in São Paulo, SP w/ @alesqui) https://t.co/IpqEKfV1j7"
59,91624966,1525146851758030849,2022-05-13,"""His name was jason and today... is his birthday"".
Boa Sexta-feira 13 pra vocês, quebrem espelhos e andem embaixo de escadas 👊😁.
Para agendamentos e orçamentos chamem no link azul do whatsapp que está na Bio . https://t.co/r1UFxqgU5H"
