,author_id,tweet_id,created_at,text
0,80086599,1558604225772486658,2022-08-13,Feliz com mais um espaço instagramável que eu fiz ✨👩‍💻 em Abcasa Expo Center Norte https://t.co/nHBnhhvSPZ
1,67895112,1558583501686988803,2022-08-13,Peça de hoje https://t.co/lyRvX1WjMn
2,1493009388994506752,1558568226010927104,2022-08-13,Amei o Leão de palha #criativo #abcasa #design #riso #alegria https://t.co/GsBKB9mRpD
3,3387282047,1558541283228061703,2022-08-13,😎 em Inova Bar https://t.co/jsjILMYMzT
4,1534726594350170113,1558458592973524992,2022-08-13,"Coroa roludo, tava com tanto tesao que enfiou logo na primeira! Vontade de encontrar ele d novo rssss https://t.co/Y6uFjtX631"
5,1227573126923419649,1558422061655154688,2022-08-13,"Acabou de publicar uma foto em SOL Do Oriente. "". https://t.co/Gh07ryRCcP"
6,163874389,1558403780248539137,2022-08-13,"Msg do dia: ""Quando a alegria de outra pessoa for sua alegria, você terá entendido o significado de amar."" em Basilica De Aparecida Do Norte https://t.co/RAj42zhaCA"
7,1112151467119513601,1558274852808785920,2022-08-13,Tapa de qualidade da @_aryborges https://t.co/cFwA9OqRso
8,4039835303,1558243311248461826,2022-08-13,Cheguei no aeroporto amo
9,80086599,1558235066773413888,2022-08-12,Apreciadora de bons quadros 🖼 #art em Abcasa Expo Center Norte https://t.co/y3sjluAwvN
10,1227573126923419649,1558190540868538369,2022-08-12,"Acabou de publicar uma foto em SOL Do Oriente. "". https://t.co/2L4jtyFPQW"
11,215474722,1558181502319468552,2022-08-12,Acabou de publicar uma foto em DAMA DA NOITE CLUB https://t.co/zqbZUkRSUt
12,215474722,1558180246892986373,2022-08-12,Acabou de publicar uma foto em DAMA DA NOITE CLUB https://t.co/pFLf3mjq2f
13,215474722,1558179540752539650,2022-08-12,Acabou de publicar uma foto em DAMA DA NOITE CLUB https://t.co/JKtFSLKevj
14,215474722,1558179064904617984,2022-08-12,Acabou de publicar uma foto em DAMA DA NOITE CLUB https://t.co/wnpUhISYcC
15,215474722,1558178626843049985,2022-08-12,Acabou de publicar uma foto em DAMA DA NOITE CLUB https://t.co/3gRfAsUHG6
16,215474722,1558170411380215809,2022-08-12,Acabou de publicar uma foto em DAMA DA NOITE CLUB https://t.co/FdjIWVbrzB
17,215474722,1558169196835512321,2022-08-12,Acabou de publicar uma foto em DAMA DA NOITE CLUB https://t.co/xwItbMmhBe
18,215474722,1558168523901325312,2022-08-12,Acabou de publicar uma foto em DAMA DA NOITE CLUB https://t.co/be70rurOUC
19,1484263804187942912,1558164205894881281,2022-08-12,O fim de um ciclo sempre trás o início de um novo caminho. https://t.co/YwIrx6gEe4
20,1553430449199906816,1558116084670242822,2022-08-12,Hoje a nostalgia foi gostosa a ponto de me lembrar que Sou Foda pra CRL! em Shopping Center Norte https://t.co/G4PrPYSfUz
21,2446325420,1558115476013826049,2022-08-12,"Acabou de publicar uma foto em IFSP - Instituto Federal de Educação, Ciência e Tecnologia de São Paulo https://t.co/lWHPc2Yncl"
22,53587588,1558092666222567426,2022-08-12,Acabou de publicar uma foto em Petz https://t.co/1Zpcin8Efy
23,1449424233826852868,1558088648595165184,2022-08-12,Acabou de publicar uma foto em Guitar Home https://t.co/sl85FYhgb5
24,1526642113873600512,1558065657035603969,2022-08-12,16 reais um cafezinho e uma coxinha nesse lugar 😍
25,1116063488785485827,1558057158083616768,2022-08-12,E acredite que o melhor possa ser feito! em Shopping Center Norte https://t.co/s9MIUMXe4Q
26,14119329,1558056637868408834,2022-08-12,Acabou de publicar uma foto em Biblioteca de São Paulo | BSP https://t.co/w4kOL3HwDG
27,1439105270064496643,1558032550412619776,2022-08-12,"#GloboTerrestre #Geografia #Turismo #Interatividade #Conhecimento #SalaDaInformação #História #Arquivo 🌐🌐🌐🌐🌐🌏🌏🌏🌏🌎🌎🌎🌎🌍🌍🌍🌍 em IFSP - Instituto Federal de Educação, Ciência e Tecnologia de São Paulo https://t.co/9ZOP2xMAMO"
28,727083578278993920,1558010884232036354,2022-08-12,Bom dia em Parada Inglesa https://t.co/KUP9MrtLOe
29,215474722,1557912967466860546,2022-08-12,"#aniversariodamadanoite #porconorolete #fogonocabaré #fogonoputeiro 

@302_night_club_prive @capuavadamadanoite3 @smartpowerenergydrink @romildo.francisco.1848 @thinamayaddn @carlosh_azevedo @vanildocamara https://t.co/0DfiWHlvTs"
30,1557171658766573568,1557912884461592576,2022-08-12,https://t.co/qTLiyRCKaG https://t.co/W9NQGKbhSO
31,215474722,1557907411175882752,2022-08-12,"#aniversariodamadanoite #porconorolete #fogonocabaré #fogonoputeiro 

@302_night_club_prive @capuavadamadanoite3 @smartpowerenergydrink @romildo.francisco.1848 @thinamayaddn @carlosh_azevedo @vanildocamara https://t.co/reg8B6RmUG"
32,1644110526,1557847969382031360,2022-08-11,Acabou de publicar uma foto em Vila Gustavo - Parada Inglesa https://t.co/qWnPwaTQPS
33,79717192,1557844476558655488,2022-08-11,"esperando a aula de museologia.... 

#êxul em ETEC Parque da Juventude https://t.co/Y2YlrnGo0i"
34,49822406,1557812411146461184,2022-08-11,"Assim como na vida de um mágico ,para alcançar resultados precisamos TRANSFORMAÇÃO e por isso devemos aprender, desaprender e reaprender #marcozanqueta #palestracommagica #palestrante magico em Expo Center Norte https://t.co/agl9W13FlW"
35,227459988,1557789020188467200,2022-08-11,"- O #tbt que eu queria agora: no rolê com a minha irmã, fazendo compras igual em filme das gêmeas Olsen e devorando uns lanche no  @mcdonalds_br ♥️

#saudade #sister @ Shopping Center Norte https://t.co/TlkF9D0pES"
36,164920903,1557780704188137473,2022-08-11,Tarde. 🤓🥶❄️☃️ https://t.co/RKzGhkvlQV
37,1059818709764792320,1557751280830914562,2022-08-11,"Ela me ensinou como amar sem esperar nada em troca.
.
.
.
.
#amordecao 
#amoremquatropatas 
#lovemypet em Parque da Juventude https://t.co/D6eXbkSZn6"
38,727083578278993920,1557650228727074818,2022-08-11,Bom dia em Parada Inglesa https://t.co/F0WikfqJLE
39,1553430449199906816,1557574745075359745,2022-08-11,Acabou de publicar uma foto em Shopping Center Norte https://t.co/tqdz7Dx2Td
40,1522580334000414727,1557517061533958144,2022-08-10,🤌🏻 https://t.co/hlkXUD3ZrJ
41,32847062,1557451654357815298,2022-08-10,"Cês tem noção??? Somente @charlesdobronxs O MAIOR LUTADOR O UFC! O CAMPEÃO TEM NOME! 
Em Outubro o Makhachev vai chorar!
Arrebenta, Campeão! em GR6 Eventos https://t.co/KV7IJH347U"
42,1227573126923419649,1557332661504466944,2022-08-10,"Acabou de publicar uma foto em SOL Do Oriente. "". https://t.co/QjzrV26hWq"
43,1557171658766573568,1557183319359496192,2022-08-10,https://t.co/qTLiyRCKaG https://t.co/ISpXKpGvnp
44,1274464809317273600,1557147022238654464,2022-08-09,Just posted a photo @ MASP https://t.co/8WqKXheyZ1
45,215474722,1557113636589490181,2022-08-09,"Hoje a grande decisão

Duelo de gigantes em DAMA DA NOITE CLUB https://t.co/QeRJCi2Yle"
46,1483449956119810050,1557094356095586306,2022-08-09,Replay 😎 https://t.co/pAvMP8zmXB
47,1374901242678411270,1556978536426180611,2022-08-09,oi
48,43089906,1556968854861090816,2022-08-09,"#BookCrossing na @CentralBaterias , #MarkOwen.

@markowenf24 https://t.co/gm9ydFiQQQ"
49,1274464809317273600,1556966270171598848,2022-08-09,Just posted a photo @ MASP https://t.co/eDDE4phxBS
50,198165966,1556826575777239045,2022-08-09,MK PIÃO DE MALOKERO 🤡
51,57956355,1556805975654514689,2022-08-09,Drinking a Brooklyn East IPA by @brooklynbrewery @ Lassù — https://t.co/TZ1WSE8B4h
52,215474722,1556800568718512137,2022-08-09,Acabou de publicar uma foto em DAMA DA NOITE CLUB https://t.co/uMYsgbPdta
53,215474722,1556799684034772994,2022-08-09,Acabou de publicar uma foto em DAMA DA NOITE CLUB https://t.co/6AdCcg9Ui8
54,215474722,1556799278051430406,2022-08-09,Acabou de publicar uma foto em DAMA DA NOITE CLUB https://t.co/FULhLYdvIL
55,57956355,1556798422732210176,2022-08-09,Forte e deliciosa - Drinking a Straffe Hendrik Brugs Tripel Bier 9° by @BrugseZotBruges @ Lassù  — https://t.co/58DUpIA6cD
56,3557223568,1556790099723042822,2022-08-08,A luz desse lugar ✨🟣 https://t.co/gTIvpBapNb
57,53587588,1556773460336058368,2022-08-08,"Imagem pioneira em marcar presença em vários banho &amp; tosa da Petz.

A história de um afeto registrada em imagem fotográfica, é uma das maneiras mais sensíveis  de perpetuar a brevidade de uma vida...📸

Lionel Falcon https://t.co/iOuLHmx0aV"
58,1553430449199906816,1556766781666123777,2022-08-08,https://t.co/mMeedlOb3d
59,236379742,1556708653264248833,2022-08-08,Acabou de publicar uma foto em Novotel São Paulo Center Norte https://t.co/NYRdlP2vwL
60,199706558,1556700162508079105,2022-08-08,🧙‍♀️ 🪄 NAMASWITCH ✨🔥 em Toca da Bruxa https://t.co/BFZHzRUS2P
61,3557223568,1556692553227018243,2022-08-08,Done ✅ https://t.co/m4RWIDStbZ
62,52792186,1556486570320044032,2022-08-08,O Palestrante (@ Cinemark Bradesco Prime - @cinemarkoficial in São Paulo) https://t.co/lvLKMSwaEP
