,author_id,tweet_id,created_at,text
0,1439105270064496643,1540484068130930689,2022-06-24,Acabou de publicar uma foto em ABF Franchising Expo https://t.co/oIpXusoGT1
1,1439105270064496643,1540482315155083270,2022-06-24,Acabou de publicar uma foto em ABF Franchising Expo https://t.co/vAv9XywDXb
2,1076106932807708673,1540463694521552897,2022-06-24,Acabou de publicar uma foto em Terminal Rodoviário Tietê https://t.co/Briv6h8dRi
3,1440604975311122434,1540456116110430212,2022-06-24,Boraaaaaa  Campinas minha  quebrada tô xegando  .... https://t.co/bI879EoLKg
4,1272907131293970442,1540431282928320519,2022-06-24,"Bate papo muito interessante com o "" mago das franquias "" prezado senhor @sidneykalaes  @guilhermestoralli  @denis_sampaio_costa 

#vempralocatudo🔝  #alwaysahead em ABF Franchising Expo https://t.co/zjmwRocOh6"
5,1644110526,1540422200968232961,2022-06-24,Acabou de publicar uma foto em Canindé (bairro de São Paulo) https://t.co/aCJ9IG14MY
6,94878293,1540417745124220929,2022-06-24,Acabou de publicar uma foto em Arena Magalu https://t.co/5K0QgrFHnO
7,1076106932807708673,1540399756337242112,2022-06-24,Acabou de publicar uma foto em Terminal Rodoviário Tietê https://t.co/Lo9PTGmBfk
8,135142887,1540389535716179968,2022-06-24,"Muito obrigado @JuliskaAzevedo pela entrevista. 
https://t.co/H4sPEBUP6W https://t.co/NkiMIg04wV"
9,889963208823500802,1540351064632958977,2022-06-24,🥲 https://t.co/NbiDA93gU0
10,44208464,1540341935067521030,2022-06-24,Acabou de publicar uma foto em Complexo Canindé https://t.co/SXKxqRWesC
11,1076106932807708673,1540279435848327168,2022-06-24,Acabou de publicar uma foto em Terminal Rodoviário Tietê https://t.co/BTvoaKJQco
12,438473416,1540181890782507008,2022-06-24,Acabou de publicar uma foto em Prainha da Vila Bar https://t.co/lIdkVjr1jM
13,215474722,1540177534003937280,2022-06-24,Arraial Sexy Dama da Noite em DAMA DA NOITE CLUB https://t.co/Ab2DjgnHki
14,832847128997289984,1540140897790205953,2022-06-24,Feira de Franquias - A maior da América Latina. em Expo Center Norte https://t.co/1uyZXB70tK
15,52455406,1540138602189004804,2022-06-24,"Aconteceu uma situacão com uma pessoa que eu estava gostando durante a minha viagem e eu fiquei meio sem reação. Me fez sentir culpadodurante algo que era muito importante para mim. Nao foi intencional. Mas tá tudo bem, essa terra plana gira e tudo passa. :)"
16,47931439,1540125268513267712,2022-06-24,Acabou de publicar uma foto em Tres Pedras Botucatu https://t.co/AOkqAb08Cq
17,1644110526,1540109443756695554,2022-06-23,Acabou de publicar uma foto em Parque do Trote https://t.co/hOtqVUf5mt
18,53238085,1540108153769050112,2022-06-23,https://t.co/ifwSOXG2Xt
19,103169020,1540087331599835136,2022-06-23,A festa em Ginásio da Portuguesa https://t.co/kazcXBKTy9
20,1076106932807708673,1540083887086485504,2022-06-23,Acabou de publicar uma foto em Terminal Rodoviário Tietê https://t.co/vvSLJHepzO
21,103169020,1540081381769969665,2022-06-23,Acabou de publicar uma foto em Estádio da Portuguesa https://t.co/LIxTYg5qNS
22,45384117,1540073282644451328,2022-06-23,A neta de Madalena e o Neto de Silvio Santos 🖤⚡️#turupom? em Expo Center Norte https://t.co/NhDsdSDjqO
23,1644110526,1540057270851084288,2022-06-23,Acabou de publicar uma foto em Vila Gustavo - Parada Inglesa https://t.co/DhXbVlF2vO
24,1076106932807708673,1540038631800315904,2022-06-23,Acabou de publicar uma foto em Terminal Rodoviário Tietê https://t.co/YKttgDXEzD
25,80901793,1540037022794092544,2022-06-23,"Domingo divertidíssimo na companhia do best friend @leomiguel_ numa Festa Junina sensacional!!!

#tbt em Ginásio da Portuguesa https://t.co/UHG3KfRN0V"
26,15716894,1539995870237806598,2022-06-23,Hoje o dia é aqui. #exposhopping #assessoriadeimprensa em Expo Center Norte https://t.co/rP0S4LfVgx
27,1076106932807708673,1539976708236816387,2022-06-23,Acabou de publicar uma foto em Terminal Rodoviário Tietê https://t.co/DpYORJ896N
28,39098467,1539964275439067136,2022-06-23,Acabou de publicar uma foto em Expo Center Norte https://t.co/AzUBV6WOPR
29,1076106932807708673,1539944805895225344,2022-06-23,Acabou de publicar uma foto em Terminal Rodoviário Tietê https://t.co/r89PQ4pqC4
30,1076106932807708673,1539909984972062720,2022-06-23,Acabou de publicar uma foto em Terminal Rodoviário Tietê https://t.co/AjhlZ78ROd
31,1076106932807708673,1539770509738381313,2022-06-23,Just posted a photo @ Terminal Rodoviário Tietê https://t.co/DE3rineoFU
32,35897335,1539767591052378112,2022-06-23,"Mais uma feira para conta!
Novos desafios
#bateriaserbs #eurotires_br em Expo Center Norte https://t.co/Bwm0KmAPun"
33,91624966,1539744629972537344,2022-06-22,Acabou de publicar uma foto em Venice Ink Tattoo https://t.co/PeWQgUVmnQ
34,2446325420,1539743333227954177,2022-06-22,"Acabou de publicar uma foto em IFSP - Instituto Federal de Educação, Ciência e Tecnologia de São Paulo https://t.co/rwpDZ00ore"
35,215474722,1539732859111481344,2022-06-22,"Hoje tem @copadobrasil na melhor @damadanoiteclub @damadanoitenig @capuavadamadanoite3 @alexandredama 
Com Belas Gatas !!! em DAMA DA NOITE CLUB https://t.co/uFPARtsbzp"
36,219703517,1539731201879056386,2022-06-22,#shoppingcenter #abrasce #Auditoria https://t.co/5KwhKz6HB7
37,43908609,1539678635908628481,2022-06-22,Acabou de publicar uma foto em Marginal Tiete Da Depressao https://t.co/DMvHshXOqK
38,979004334850666496,1539664773683761152,2022-06-22,"Estamos na maior feira de franquias do mundo!!! Esperamos por você aqui na Feira da ABF - Expofranchising 2022, no setor de microfranquias. 
#Cuidare #franquia 
#expofranchising2022 
#abf #franquias #franchising https://t.co/mww9V1Jq8c"
39,918110876049305600,1539623676433223681,2022-06-22,"Você vai sair melhor do que entrou.

#26BienalDoLivro #BienalDoLivroSP
#TriunoLivraria #Turistando 

@bienaldolivrosp 
@triunolivraria 
@livrariasanl 
@cbloficial em R Jose Bernardo Pinto 333 https://t.co/7xucDjXbom"
40,63057498,1539600193238228992,2022-06-22,Acabou de publicar uma foto em Feira Da ABF - Associaçäo Brasileira De Franquia https://t.co/77XVP5aHGf
41,46977083,1539573039263776768,2022-06-22,A clássica  foto no espelho antes do rolézinho... em Vila Guilherme https://t.co/VDjLEsR6Fc
42,487995901,1539460721272049664,2022-06-22,Como quien no quiere la cosa ✈️ https://t.co/1W6CBx1dqG
43,215474722,1539452298660921349,2022-06-22,Nesta Sexta 24/06. Venha para o Arraial Sexy Dama da Noite em DAMA DA NOITE CLUB https://t.co/SC6ENRUDiA
44,215474722,1539433937252098050,2022-06-22,Toda emoção do mata mata da @CopadoBrasil vc só vê aqui na @DDNCLUB ao lado das + belas gatas. https://t.co/3UFLZ6OVlx
45,215474722,1539432911514091523,2022-06-22,Quarta tem emoção no mata mata da @copadobrasil em DAMA DA NOITE CLUB https://t.co/NFJTmwKfnd
46,793197010564284416,1539429306732003328,2022-06-22,"Quarta e última comemoração de aniversário o pessoal que gosta de comemorar viu Hahahahah 

Em família ❤️❤️ em Lassù https://t.co/UhG5LYyXJK"
47,1504931222895669248,1539422642863755264,2022-06-22,"Apesar de ter faltado metade da nossa turma, é sempre bom estarmos juntos e unidos pelos meninos! E domingo, no show da Portuguesa/SP só reforçou ainda mais que todo esforço vale a pena! 
Obrigada @matheusekauan e @ClubeMek por deixar tudo tudo mais especial! 💖💖

#matheusekauan https://t.co/BsF4NhD8fD"
48,69883294,1539374434108297224,2022-06-21,Por que a EMTU @emtu_oficial não faz igual a linha 1016 Cemitério do Horto da @sptrans e não disponibiliza 2 carros seguidos da linha 103/105 pra atender a população? #emtu #transportepublico #Sptrans #onibus https://t.co/OatHlUsDzI
49,21415271,1539368897937297411,2022-06-21,"I'm at Petz in São Paulo, SP https://t.co/VHm9WQk9pv"
50,43089906,1539293944160321541,2022-06-21,"I'm at @CentralBaterias in São Paulo, SP https://t.co/NikVTo5d04"
51,1644110526,1539292830132097024,2022-06-21,Acabou de publicar uma foto em Canindé (bairro de São Paulo) https://t.co/Qqg8XwhxZX
52,16980730,1539286897909825536,2022-06-21,Acabou de publicar uma foto em Expo Center Norte https://t.co/B3ggI9CsOE
53,102992758,1539246013583699970,2022-06-21,Acabou de publicar uma foto em São Paulo Brasil Centro https://t.co/l4xpChDJNL
54,43089906,1539196469307228160,2022-06-21,"I'm at Parque da Juventude in São Paulo, SP https://t.co/ncUHjGrgWO"
55,43089906,1539196078075138050,2022-06-21,"I'm at Estação Carandiru (Metrô) in São Paulo, SP https://t.co/fk9J2DhjAs"
56,3557223568,1539066917469753345,2022-06-21,"Aproveitando que a luz tava boa, tirei umas fotinhas 📸😁 https://t.co/9pzffGs9Vn"
57,61035194,1539058483756146689,2022-06-21,Adoro uma festa junina… https://t.co/EBPACKjggL
58,1532764930251886593,1539033670878740487,2022-06-20,Aqui na rodoviária já chorando
59,1269075256695762946,1539032193783279625,2022-06-20,Eu e minhas tralha… https://t.co/PzqfE7XZSm
60,1245012505476378625,1538852846778687489,2022-06-20,A volta p Rio é triste... https://t.co/ZztlGeOdJt
61,86258438,1538685741336825857,2022-06-20,Aquele rolezin na night 🌙❤️ em Exquina Gastrobar https://t.co/4SGDQbLFv9
62,1477382056887869446,1538653234528657409,2022-06-19,que lugar lotado meu deus https://t.co/PmSNYQCQi6
63,1117519924195409923,1538569481236127747,2022-06-19,indo pra blumenau
64,4892970573,1538547964309798912,2022-06-19,E essa intro da Nat? Entregou tudooooo! https://t.co/4PRPTVCJDN
65,1230099917315727366,1538407103978684417,2022-06-19,"Quem tá aqui? 🤔☺️
TNW PRIDE EDITION https://t.co/2SiPODCpHI"
66,19692946,1538291741731835908,2022-06-18,"I'm at Tietê Bus Terminal in São Paulo, SP https://t.co/y1JgP6fHOk"
67,337596942,1538285004966477824,2022-06-18,"I'm at Joykids in São Paulo, SP https://t.co/FX80Nbytec"
