,author_id,tweet_id,created_at,text
0,1245012505476378625,1538852846778687489,2022-06-20,A volta p Rio é triste... https://t.co/ZztlGeOdJt
1,86258438,1538685741336825857,2022-06-20,Aquele rolezin na night 🌙❤️ em Exquina Gastrobar https://t.co/4SGDQbLFv9
2,1477382056887869446,1538653234528657409,2022-06-19,que lugar lotado meu deus https://t.co/PmSNYQCQi6
3,1117519924195409923,1538569481236127747,2022-06-19,indo pra blumenau
4,4892970573,1538547964309798912,2022-06-19,E essa intro da Nat? Entregou tudooooo! https://t.co/4PRPTVCJDN
5,1230099917315727366,1538407103978684417,2022-06-19,"Quem tá aqui? 🤔☺️
TNW PRIDE EDITION https://t.co/2SiPODCpHI"
6,19692946,1538291741731835908,2022-06-18,"I'm at Tietê Bus Terminal in São Paulo, SP https://t.co/y1JgP6fHOk"
7,337596942,1538285004966477824,2022-06-18,"I'm at Joykids in São Paulo, SP https://t.co/FX80Nbytec"
8,203809353,1538264962958770176,2022-06-18,"1° ensaio da The Brotherhood 🤘🏻 (at @RockTogether Studio in São Paulo, Brazil) https://t.co/7W93z7Pj2F"
9,78767059,1538197337188798466,2022-06-18,"!!!!

Tem um mini parque dos dinossauros do lado de fora! em Shopping D https://t.co/CVae3rPCK3"
10,78767059,1538196545300230144,2022-06-18,Mais dinossauros. em Shopping D https://t.co/5ksjImapuA
11,1433224212,1538143121527169025,2022-06-18,Café bom demais! https://t.co/Pjx1o7oBH8
12,102992758,1538135219135467524,2022-06-18,Acabou de publicar uma foto em Terminal Rodoviário Tietê https://t.co/tubKhU4ZnT
13,102992758,1538134818873032704,2022-06-18,Acabou de publicar uma foto em São Paulo Brasil Centro https://t.co/1T59TN1FSY
14,102992758,1538134448952287232,2022-06-18,❤️❤️❤️❤️❤️ em São Paulo Brasil Centro https://t.co/tiIyDw4c5m
15,102992758,1538133755638030337,2022-06-18,Acabou de publicar uma foto em Terminal Rodoviário Tietê https://t.co/IZbs2BYx8d
16,102992758,1538133409272242176,2022-06-18,Acabou de publicar uma foto em São Paulo Brasil Centro https://t.co/NGxyomePmy
17,102992758,1538133310945255424,2022-06-18,🚍🚍🚍🚍🚍 em Terminal Rodoviário Tietê https://t.co/GAZzBmtTBZ
18,102992758,1538133232784490496,2022-06-18,Indo para Campos do Jordão ❤️ em Terminal Rodoviário Tietê https://t.co/rcZWlUaggQ
19,1227573126923419649,1538114430508089345,2022-06-18,"Acabou de publicar uma foto em SOL Do Oriente. "". https://t.co/RGfl3Jokmp"
20,1227573126923419649,1538112435076333572,2022-06-18,"Acabou de publicar uma foto em SOL Do Oriente. "". https://t.co/q02IJCEtqQ"
21,1238565679458127874,1537999358532018176,2022-06-18,"Já tinha dito antes 

eu até gosto de uma emoção, mas disputa não é comigo. tô fora"
22,215474722,1537950127750451202,2022-06-18,"Já começou nosso Arraial

Bora que tá gostosinho em DAMA DA NOITE CLUB https://t.co/m0tqrbaZIU"
23,438473416,1537941625451606017,2022-06-17,Acabou de publicar uma foto em Prainha da Vila Bar https://t.co/lvJnbGf6aI
24,438473416,1537941478437072899,2022-06-17,Acabou de publicar uma foto em Prainha da Vila Bar https://t.co/n82xLeeLtB
25,438473416,1537941350913429508,2022-06-17,Acabou de publicar uma foto em Prainha da Vila Bar https://t.co/WhuWeipFHQ
26,438473416,1537935555333197825,2022-06-17,Acabou de publicar uma foto em Prainha da Vila Bar https://t.co/bBaNN0y00k
27,215474722,1537930775399526404,2022-06-17,"Hoje Sexta Feira 17/06
Arraial Dama da Noite
Bora que o clima só tá esquentando em DAMA DA NOITE CLUB https://t.co/tvipDz5Kea"
28,91624966,1537921197395980289,2022-06-17,Acabou de publicar uma foto em Venice Ink Tattoo https://t.co/PvnbXYqmFf
29,36461415,1537865655973707777,2022-06-17,"Sem açúcar, mas com afeto. https://t.co/EaMS95a1w2"
30,438473416,1537841113532403715,2022-06-17,Acabou de publicar uma foto em Prainha da Vila Bar https://t.co/ErpvcxZDAs
31,438473416,1537840850532634624,2022-06-17,Acabou de publicar uma foto em Prainha da Vila Bar https://t.co/rGb5LHTeG0
32,935181549946982401,1537837654489931776,2022-06-17,E o dia de ontem teve direito até a vitrine viva... pro mais dias assim... @cavilhena sei que odeia fotos... mas entra na brincadeira... #feriado #shoppingD #momentodivertido em Shopping D https://t.co/VllvHtPJLl
33,838084496079654912,1537814765300490240,2022-06-17,"#letracaixa
#placadeacrilico
#alfamidiavisual 
@ciliosdecondessa 
@fabricando_liberdade 
@teressa_mendes em Alfamidiavisual https://t.co/7uEBPlG9lz"
34,438473416,1537809557585543170,2022-06-17,Acabou de publicar uma foto em Prainha da Vila Bar https://t.co/mXkIpti9tK
35,438473416,1537808974183297025,2022-06-17,Acabou de publicar uma foto em Prainha da Vila Bar https://t.co/Hv4A3R57gQ
36,438473416,1537808601250770945,2022-06-17,Acabou de publicar uma foto em Prainha da Vila Bar https://t.co/PBRyDqz9EG
37,438473416,1537808063398350854,2022-06-17,Acabou de publicar uma foto em Prainha da Vila Bar https://t.co/5tZqZ4uyoy
38,438473416,1537807942736613378,2022-06-17,Acabou de publicar uma foto em Prainha da Vila Bar https://t.co/9lmMRAUc7j
39,438473416,1537807813749223427,2022-06-17,Acabou de publicar uma foto em Prainha da Vila Bar https://t.co/yHB8URRRbZ
40,438473416,1537807712897183744,2022-06-17,Acabou de publicar uma foto em Prainha da Vila Bar https://t.co/R6QpfV2kXV
41,438473416,1537807465424687104,2022-06-17,Acabou de publicar uma foto em Prainha da Vila Bar https://t.co/EQEd2uSuAr
42,438473416,1537807370553810944,2022-06-17,Acabou de publicar uma foto em Prainha da Vila Bar https://t.co/xgRrmmv9zB
43,438473416,1537807298105692160,2022-06-17,Acabou de publicar uma foto em Prainha da Vila Bar https://t.co/VcmNnKOo0Z
44,438473416,1537807199765876736,2022-06-17,Acabou de publicar uma foto em Prainha da Vila Bar https://t.co/4SCZPLwRPp
45,438473416,1537807081293484032,2022-06-17,Acabou de publicar uma foto em Prainha da Vila Bar https://t.co/30PhUWjXD3
46,2566083565,1537794372032417796,2022-06-17,Acabou de publicar uma foto em Rufu's Bar https://t.co/e1SKEq4mgh
47,1106324144990375936,1537771131872092162,2022-06-17,"Arte in the box! 
*
*
*
#saopaulo #masp #turista #sp #tbfriday em MASP https://t.co/nBE6nLWciO"
48,1108809383037812736,1537642457726337026,2022-06-17,COMO DIRIA MEU AMIGO PUTA QUE PARAIOOOUUH 🔥🔥🔥🔥🔥🔥🔥 https://t.co/tOvlWkr9Xp
49,52792186,1537610608086028291,2022-06-17,#Lightyear 🚀 (@ Cinemark XD - @cinemarkoficial in São Paulo) https://t.co/WquXBxRHR9
50,1513525364529713160,1537608407808614406,2022-06-17,https://t.co/svBrfKKuQv
51,1513525364529713160,1537608399378169856,2022-06-17,https://t.co/myis1KQKQV
52,1513525364529713160,1537608389848621056,2022-06-17,https://t.co/4TyoR3DOB3
53,1513525364529713160,1537608378876305408,2022-06-17,https://t.co/JkmGe5zGuu
54,1513525364529713160,1537608368960962565,2022-06-17,https://t.co/133r8bwb8P
55,1513525364529713160,1537608359163187201,2022-06-17,https://t.co/eEkxXL3w9t
56,1513525364529713160,1537608349918842887,2022-06-17,https://t.co/YtNMIOwZeu
57,1513525364529713160,1537608341572268033,2022-06-17,https://t.co/X32m9KF5zy
58,1513525364529713160,1537608331522605058,2022-06-17,https://t.co/fLK1eGDc4N
59,1513525364529713160,1537608323796705281,2022-06-17,https://t.co/Jz7zpquQvB
60,1513525364529713160,1537608316485939200,2022-06-17,https://t.co/JIRtRxTrRK
61,1513525364529713160,1537608308856610820,2022-06-17,https://t.co/Zv51HCWdM0
62,1513525364529713160,1537608300782571520,2022-06-17,https://t.co/Vg05c00mp0
63,1513525364529713160,1537608290783436800,2022-06-17,https://t.co/S4IPM0CKfb
64,1513525364529713160,1537608281673601024,2022-06-17,https://t.co/CJJJZeBHT9
65,1513525364529713160,1537608273876160513,2022-06-17,https://t.co/jXAieUVxhd
66,1513525364529713160,1537608263981744128,2022-06-17,https://t.co/xF2hlCwx40
67,1513525364529713160,1537608253634396166,2022-06-17,"ExpoCatólica, 28/05 📸
Uma thread de fotos sobre a primeira vez que fotografei um evento: https://t.co/9DWarVp2uM"
68,169096694,1537606668678225929,2022-06-17,#vielafutsal #Futsal #familiaviela #Futsal #futsalamador #festival muito bom voltar a jogar festival fora e trazer 🏆 ... 2 jogos top e mais um pra conta !!! @viela_futsal_ https://t.co/Xft7g4IzDw
69,44636743,1537544995175124992,2022-06-16,"I'm at Sophie Emporio E Forneria in São Paulo, SP https://t.co/7P17X0L8XV"
70,199012929,1537534281307893762,2022-06-16,Acabou de publicar uma foto em Expo Center Norte https://t.co/yXtZStkY88
71,53587588,1537512458314731525,2022-06-16,Acabou de publicar uma foto em Petz https://t.co/Ynw2XIFpQd
72,1534726594350170113,1537485165802541057,2022-06-16,"Que vontade de sentar, alguém pela zn? Santana https://t.co/MJqi9AOeUL"
73,1268953379780341762,1537465705578258437,2022-06-16,No aguante las ganas https://t.co/81NFoD4X1Y
74,438473416,1537453010854596609,2022-06-16,"É Hoje!!!
A partir das 16hs o Grupo Samba Entre Amigos @grupo.s.e.a_oficial estará no Palco do Prainha Da Vila, com a participação de Walmir Borges @walmirborges 
Avisa Geral e vem!! https://t.co/kGq5dYvZA5"
75,438473416,1537450362524733440,2022-06-16,"Chegou o Dia Galera!!
Hoje tem no Prainha Da Vila @prainhadavilabar  Grupo Samba Entre Amigos e Walmir Borges @walmirborges 
A vem todo mundo!!! em Prainha da Vila Bar https://t.co/IEcGnK3p7W"
76,215474722,1537385176451391488,2022-06-16,"Venha para a maior festa junina da Zona Norte
Arraial Dama da Noite em DAMA DA NOITE CLUB https://t.co/2wFPfLKzpq"
77,215474722,1537252253874196482,2022-06-16,"Arraial Sexy Dama da Noite

Sexta 17 Junho em DAMA DA NOITE CLUB https://t.co/tZQSlfDew3"
78,67895112,1537246082182291458,2022-06-16,"I'm at Terminal Rodoviário Tietê in São Paulo, SP https://t.co/SyCqQtKqeG"
79,343134749,1537229073751060480,2022-06-16,+1 💙 https://t.co/mxSrJm0tOa
80,43089906,1537163444348231682,2022-06-15,"I'm at Kakeya Loterias in São Paulo, SP https://t.co/uO7X0LFBRV"
81,283031976,1537100246542651393,2022-06-15,@ProgramadorREAL dando show na #ArenaDevelopers #UNIVERSOTOTVS2022 @TOTVS https://t.co/YcalOkkF86
82,1400869620375068673,1537099423393660930,2022-06-15,Bar e lanchonete NOVA VOLUNTÁRIOS
83,727083578278993920,1536993196756152320,2022-06-15,Bom dia em Parada Inglesa https://t.co/UiCS22jIpL
84,85802930,1536904256434933761,2022-06-15,Se liga no nosso horário do ferido em Let's Ride https://t.co/Ne9sWwJIe3
85,1056885719585701888,1536900226010730496,2022-06-15,"Pé na estrada, onde o timão for jogar, mais um pelo grande @Corinthians  SP &gt; Curitiba 🏴🏳️ https://t.co/eJ1DRnxjkJ"
86,838084496079654912,1536891181329551360,2022-06-15,"#vendas
#alfamidiavisual 
#fabricandoliberdade 
@fabricando_liberdade em Alfamidiavisual https://t.co/G8pwV0Cu7A"
87,438473416,1536882132848713729,2022-06-15,"Neste Feriado se liga no que vai rolar no @prainhadavilabar 
Grupo Samba Entre Amigos &amp; Walmir Borges @walmirborges 
Vem todo Mundo 💥💥💥💥 em Prainha da Vila Bar https://t.co/Fb9QgBGMY7"
88,92845781,1536845521524076551,2022-06-14,Adquirindo e conhecendo novas expertises 🔍 #totvs #tecnologia #erp #saopaulo #manaus em Expo Center Norte https://t.co/wzD9x6sWBY
89,60904263,1536819161069867008,2022-06-14,Vem coisa boa por aí! Hoje foi dia de reunião para alinhar várias questões 🌽🌽 #comeceagora Obrigado pela recepção @magalu.marketplace em Arena Magalu https://t.co/2veBvkOx3g
90,60904263,1536815247910109185,2022-06-14,Vem coisa boa por aí! Networking e trabalho bem feito de verdade é o que conta neste mundo! Obrigado pela recepção @magalu.marketplace . Bora pra cima! 🌽🌽 #comeceagora em Arena Magalu https://t.co/IlerOl19JU
91,80901793,1536750647437053953,2022-06-14,#festajunina #quermesse em Ginásio da Portuguesa https://t.co/Mkgsy3KRLn
92,1644110526,1536724938773733376,2022-06-14,Acabou de publicar uma foto em Canindé (bairro de São Paulo) https://t.co/E88qQnGXUY
93,1523756701484298243,1536710777134006272,2022-06-14,Universo Totvs 2022 Tecnologia e muita inovação . https://t.co/z9nC2V7hZX
94,1227573126923419649,1536695493622960130,2022-06-14,"Acabou de publicar uma foto em SOL Do Oriente. "". https://t.co/bnngCLvXhS"
95,72300916,1536680102498549761,2022-06-14,"#universototvs
#totvstec
#totvsdevelopers
@TOTVSDevelopers https://t.co/nXnadW77k6"
96,48048971,1536671369743814657,2022-06-14,"@DiariodaCPTM na estação santana, sentido Jabaquara... Esqueceram dos trens. https://t.co/cHcSBd7kFH"
97,2583345503,1536653050789568512,2022-06-14,Bora para mais um grande evento da Totvs … 🙏🙏🙏 em Expo Center Norte https://t.co/uB4qZak4DX
98,475362746,1536480134110269442,2022-06-13,"Minha gata faz 21, te amo ❤️ https://t.co/2fXbfjbBsR"
99,1644110526,1536448301758808067,2022-06-13,Acabou de publicar uma foto em Vila Gustavo - Parada Inglesa https://t.co/oLA4xwbqSX
100,177433776,1536441600913596416,2022-06-13,I'm at Vila Guilherme https://t.co/CPDMru1f2R
101,1644110526,1536441358675677184,2022-06-13,Acabou de publicar uma foto em Canindé (bairro de São Paulo) https://t.co/O4zhuqrARH
102,3901440928,1536429333048434688,2022-06-13,"Depois de uma breve estadia na paulista, partiu CARIOCA, ficar mais perto de casa.
Deus no controle sempre. em Terminal Rodoviário Tietê https://t.co/J72AOh3HrI"
103,1535809576326819840,1536428369381937153,2022-06-13,O Melhor 🤗 https://t.co/5NjEg0yHvT
