,author_id,tweet_id,created_at,text
0,1233997482293649415,1622640255735037965,2023-02-06,cheiro de terra molhada https://t.co/RF9NKv1Yjv
1,752576945448247300,1622611300055482369,2023-02-06,Acabou de publicar uma foto em Jovens Sarados Parada Inglesa https://t.co/lTYkOHweNn
2,1227573126923419649,1622573531530928129,2023-02-06,"Acabou de publicar uma foto em SOL Do Oriente. "". https://t.co/p8R78xYAqi"
3,182792084,1622509739270602752,2023-02-06,"I'm at Estação Portuguesa-Tietê (Metrô) - @metrosp_oficial in São Paulo, SP https://t.co/8E1HvSVkOl"
4,182792084,1622509696761331712,2023-02-06,"I'm at Terminal Rodoviário Tietê in São Paulo, SP https://t.co/HcDIewYmKL"
5,55467929,1622395637860802561,2023-02-06,Fim de férias ❤️ em Terminal Rodoviário Tietê https://t.co/gEXBB1k33a
6,822150796351537152,1622381305991135232,2023-02-05,Tomar chuva e ver um bom (péssimo) futebol 👏👏 https://t.co/887NUil1uq
7,85977181,1622380554330021894,2023-02-05,No #caninde - 1° tempo - #LUSA 0 x 0 #interdelimeira - 6a Rodada - #PaulistaoA1Sicredi2023 - @portuguesaoficial @paulistao @fpf_oficial em Estádio do Canindé https://t.co/htFT7zZDtI
8,79579194,1622372991148654592,2023-02-05,Acabou de publicar uma foto em Equipe Hilton Santos Boxe https://t.co/WmQlMYiWPS
9,41981015,1622368558297530368,2023-02-05,"Eu acho que a discussão se encerra aqui, @tarcisioranhel  veja https://t.co/49DCf8S1ZB em Via Jardins dos Ipês https://t.co/4fnn4LcfQM"
10,1959923005,1622361146320617472,2023-02-05,"Churras pós vitória 😋 (@ Churrascaria Garzon 33 in São Paulo, SP) https://t.co/THstyOYqzP"
11,3353497102,1622319283744260096,2023-02-05,Acabou de publicar uma foto em Vila Guilherme ZN https://t.co/baOuF7jFeY
12,2165665577,1622205060477321216,2023-02-05,🏃🏿🔥✊🏿😃 em Estadio Municipal Paulo Machado De Caralho https://t.co/6Zd3jhXulh
13,2557417559,1622181757654126592,2023-02-05,"Bom dia pessoal lindas e inteligentes, excelente domingo pra todos nós!!!
Uhuuuuuu https://t.co/9ibv2IAFjT"
14,736976767097929729,1622032572342566912,2023-02-05,oq eu fiquei feliz quando descobri que confirmaram #QuilomboLab2023 é brincadeira! Só quem viveu isso em 2020 sabe o quanto foi foda!!💛🌿 @lab_fantasma https://t.co/wmoiTJwxFt
15,312810454,1621983693572014083,2023-02-04,Acabou de publicar uma foto em TEG Vila Guilherme https://t.co/4rJlAYiqtR
16,207624102,1621959995549192192,2023-02-04,"Partiu sentir medo, megan 
.............................................
Left to feel afraid em Shopping Center Norte https://t.co/a5nNCPLeaF"
17,2741840722,1621945022185619456,2023-02-04,🦅 @ilmagoncalves em Shopping Center Norte https://t.co/aNWIMiQFkx
18,1469917943119101954,1621937767667191810,2023-02-04,parece que consultas aos sábados demoram mais que consultas durante a semana… haja paciência 🥴
19,201442875,1621908729166708738,2023-02-04,Acabou de publicar uma foto em Empório Rota do Queijo https://t.co/P1I0fdkuvo
20,1227573126923419649,1621886664703614976,2023-02-04,"Acabou de publicar uma foto em SOL Do Oriente. "". https://t.co/C2y5zIXWgZ"
21,76763647,1621861043621306371,2023-02-04,Acabou de publicar uma foto em Espaço NOVO TEMPO Santana https://t.co/4DZJqg0Zyw
22,1227573126923419649,1621832422412222470,2023-02-04,"Acabou de publicar uma foto em SOL Do Oriente. "". https://t.co/Wkle1dljLn"
23,182792084,1621712740896104448,2023-02-04,"CWB ❤️ aí vou eu 🥰 (@ Terminal Rodoviário Tietê in São Paulo, SP) https://t.co/VOv26e7mSi"
24,53164767,1621590361620578305,2023-02-03,"Acabou de publicar uma foto em Patagônia, Argentina https://t.co/rQJE18hehA"
25,924819187696054272,1621589395273912323,2023-02-03,"Bons amigos são como estrelas: nem sempre podemos ver, mas temos certeza que estão sempre lá.

#churrasco #amigos #confraternização #familia em Churrascaria Boizão Grill Marginal https://t.co/lzjoTYIhOO"
26,203809353,1621578599231807493,2023-02-03,"✅️ (@ Posto De Emissao De Passaporte in São Paulo, SP) https://t.co/dCOek6zFBv https://t.co/jsbsONGxhn"
27,47656062,1621555240825675776,2023-02-03,"@tonylimoeiro esse cabra bom faz Forró a miliano em SP. Um grande Agente multiplicador da cultura do Forró tradicional.

Obrigado pela dedicação. em Novo Limoeiro https://t.co/lIdM1eijtR"
28,1227573126923419649,1621483080966864897,2023-02-03,"Acabou de publicar uma foto em SOL Do Oriente. "". https://t.co/eDJfUinowo"
29,727083578278993920,1621429725695442945,2023-02-03,Uma ótima sexta-feira pra todos nós 🙏🙌 em Estação Parada Inglesa https://t.co/0vH11N2nhR
30,144336033,1621339081182527490,2023-02-03,cringe atemporal em MASP https://t.co/OlSW6ZIHiv
31,1369984909440339972,1621322552600584192,2023-02-03,Boa noite estou sumidinha mas logo volto a postar com frequência https://t.co/vOkij91y7E
32,2445503825,1621305957283205120,2023-02-03,Acabou de publicar uma foto em CIOSP - Congresso Internacional de Odontologia de São Paulo https://t.co/4PtskIaFQC
33,15410917,1621284697006374913,2023-02-02,"Começando a temporada 2023 dos rolês aleatórios. 😛 (@ Sala VIP - 1001 / Catarinense / Cometa / Expresso do Sul in São Paulo, SP) https://t.co/GxZVNiBHqK"
34,942086743083438080,1621204827698069504,2023-02-02,"Acabou de publicar uma foto em Zona Norte, Parada Inglesa https://t.co/oDctNBv8IQ"
35,2446325420,1621192178407022592,2023-02-02,"Acabou de publicar uma foto em IFSP - Instituto Federal de Educação, Ciência e Tecnologia de São Paulo https://t.co/fBYvK7iiU8"
36,1298935844951199744,1621188808698904582,2023-02-02,Acabou de publicar uma foto em Parque da Juventude https://t.co/P3hNBHw77k
37,24222989,1621071197445423104,2023-02-02,Tive que parcelar em 3x https://t.co/YaaFmsgLez
38,1224841207853015040,1620944574343708672,2023-02-02,Treinaram hoje boys? https://t.co/dWN1NFoHOk
39,1365427084634521609,1620915767519875073,2023-02-01,"@Andreeesgraca Isso não muda o fato que na Bahia, a cada 10 baianos, 10 são da Bahia."
40,207588434,1620874647226171397,2023-02-01,"ピックアップ(今日のマンホール) 2/2(木): Estacionamento - Center Norte - Vila Guilherme, São Pa #manhotalk https://t.co/deWD7FN0LZ"
41,44636743,1620823617389957123,2023-02-01,"I'm at Madero Steak House in São Paulo, SP https://t.co/X8ax4HV8Pk"
42,752576945448247300,1620796499511607297,2023-02-01,Acabou de publicar uma foto em Jovens Sarados Parada Inglesa https://t.co/A4XoJO7ZlY
43,43089906,1620770363495055360,2023-02-01,"#Bookcrossing na @CentralBaterias, #JoséDeAlencar https://t.co/FAqsxQD6PJ"
44,727083578278993920,1620705042276786181,2023-02-01,Uma ótima quarta feira pra todos nós 🙏🙌 em Metro Santana - Av. Cruzeiro Do Sul https://t.co/8NDFeR7OuM
45,1076106932807708673,1620625075715330048,2023-02-01,Acabou de publicar uma foto em Marginal Tietê https://t.co/L9VPHtpyPo
