,author_id,tweet_id,created_at,text
0,1533797012868677632,1558527964987506689,2022-08-13,"Os jogos de hoje pelo Campeonato 🇧🇷 em Cohab II, Lado Leste, Itaquera https://t.co/pZukioVvPW"
1,1533797012868677632,1558507193917480962,2022-08-13,"Até ele na arquibancada 😆😆😆
#PremierLeague em Cohab II, Lado Leste, Itaquera https://t.co/qcko5IjghS"
2,1533797012868677632,1558502273063350272,2022-08-13,"Os torcedores do Brentford nesse momento no estádio!
Brentford 4
Manutd 0
#PremierLeagueNoStarPlus em Cohab II, Lado Leste, Itaquera https://t.co/1GgSq5tb97"
3,1533797012868677632,1558494753599234048,2022-08-13,"Os jogos de hoje pelo
Campeonato 🇵🇹 em Cohab II, Lado Leste, Itaquera https://t.co/ab7i6etizR"
4,1533797012868677632,1558487099695058944,2022-08-13,"Começa hoje o Campeonato Italiano com destaque para o campeão Milan!
#CampeonatoItaliano em Cohab II, Lado Leste, Itaquera https://t.co/SDr3xrmibJ"
5,1533797012868677632,1558484134808494081,2022-08-13,"Próximo e último jogo do dia pela Premier League!
13:30
#PremierLeague em Cohab II, Lado Leste, Itaquera https://t.co/qVuWOBVY2l"
6,1533797012868677632,1558468966925930496,2022-08-13,"Bola rolando!
#CampeonatoFrancês 
#LaLiga em Cohab II, Lado Leste, Itaquera https://t.co/q7N9tA68MZ"
7,1533797012868677632,1558450590799233025,2022-08-13,"Jogos das 11 horas da manhã pela Premier League!
#PremierLeague em Cohab II, Lado Leste, Itaquera https://t.co/YbqVaHiDxb"
8,1533797012868677632,1558446200025661447,2022-08-13,"Ponto final no Villa Park!
#PremierLeague em Cohab II, Lado Leste, Itaquera https://t.co/lVPS3lICwg"
9,1533797012868677632,1558436374382092288,2022-08-13,"Os jogos de hoje pelo Campeonato Alemão!
#Bundesliga em Cohab II, Lado Leste, Itaquera https://t.co/qaCL2LLiiC"
10,2583345503,1558435775531941890,2022-08-13,"Em 27/08/2022, a partir das 18 horas, na Rua Dança do Fogo, será realizada a terceira edição do PROJETO FLASH HOUSE NA RUA.

CONTAMOS COM SUA PRESENÇA. em Bar E Restaurante Estrela Dalva https://t.co/5615xVQ9TZ"
11,1533797012868677632,1558404145941397505,2022-08-13,"Bom dia!
Desejamos que todos tenham um ótimo sábado!
E o nosso dia de futebol começa às 08:30 da manhã em partida válida pela Premier League!
#AstonVilla #Everton
#PremierLeague em Cohab II, Lado Leste, Itaquera https://t.co/qw2dATLx35"
12,338606985,1558387816182210563,2022-08-13,"Acabou de publicar uma foto em Cohab II, Lado Leste, Itaquera https://t.co/zEtDIs4F0c"
13,1529020507831541760,1558380299310039040,2022-08-13,@Privacidades Ravi 💙 https://t.co/QY8atKTOi6
14,2472958435,1558271035325161474,2022-08-13,"Trombei esse cara na 269Chilli.
Kado com M.
Toda vz q a gent se trombva ele me comia. Total d 4! O maxo é 1a máquina de foder!
Pau macio, uma delícia. Pediu contato. Disse querer me foder numa cama e com calma...

#SINDICATODOSDIVULGADORES
#PINTOAWARDS 
@horadoleite
@OsLeiteirox https://t.co/qcGkxERNug"
15,99383268,1558230214496473089,2022-08-12,"Só confirmo que o mundo está invertido, pessoas sem caráter mentem, inventam e depois se fazem de vítima… tudo para disfarçar sua própria falta de honra e caráter.. https://t.co/j6WgsJnrjW"
16,1533797012868677632,1558143939068166145,2022-08-12,"Por fim os gajos as 16:15! em Cohab II, Lado Leste, Itaquera https://t.co/oz9Xz550xg"
17,1533797012868677632,1558132326927851520,2022-08-12,"Jogo das 16 horas! em Cohab II, Lado Leste, Itaquera https://t.co/Bv9dgt7hkL"
18,1533797012868677632,1558109789565100034,2022-08-12,"A partida que inicia o Campeonato Espanhol!
#LaLiga em Cohab II, Lado Leste, Itaquera https://t.co/YhxFGKVYvf"
19,1533797012868677632,1558102765938819073,2022-08-12,"Primeiro jogo do dia!
#Bundesliga em Cohab II, Lado Leste, Itaquera https://t.co/Bed8hTApZj"
20,1533797012868677632,1558084749209501696,2022-08-12,"Juventus apresenta Kostic!
#MercadoDaBola #Juventus #Kostić em Cohab II, Lado Leste, Itaquera https://t.co/moiaoxJm8J"
21,1533797012868677632,1558068715627106310,2022-08-12,"A composição das semifinais da Libertadores! em Cohab II, Lado Leste, Itaquera https://t.co/uiaWFbhwrc"
22,1533797012868677632,1558062025221328900,2022-08-12,"Assim estão formas as semifinais!
#SulAmericana em Cohab II, Lado Leste, Itaquera https://t.co/6EmYdwoISY"
23,1533797012868677632,1558047386328522752,2022-08-12,"Tem furacão na semifinal 🌪️
#Libertadores em Cohab II, Lado Leste, Itaquera https://t.co/qvvQM9UI15"
24,1519058242764255233,1558030592595435520,2022-08-12,"bati o martelo vou ficar na cama mais um tiquinho que fri #BDSP  @rodrigobocardi  
@sabinasimonato_"
25,1519058242764255233,1558029738622550017,2022-08-12,@Marialourdessiq https://t.co/gh5K3zqfAk
26,1519058242764255233,1558015374867718145,2022-08-12,"#BDSP bom dia
manhã dê sexta -feira com cara de segunda será assim o dia todo @sabinasimonato_  
SEXTOU."
27,718532652672933888,1557861534319140864,2022-08-11,Mudei de casa na hora certa KKKKKKKK https://t.co/PUm29Viu2l
28,1533797012868677632,1557830184891555843,2022-08-11,"O jogo que define o último semifinalista!
#Libertadores em Cohab II, Lado Leste, Itaquera https://t.co/rAezr36tCX"
29,1533797012868677632,1557767750554107910,2022-08-11,"Sai deste jogo o último semifinalista!
#SulAmericana #Inter em Cohab II, Lado Leste, Itaquera https://t.co/BCOApYz6Ns"
30,1533797012868677632,1557755337717022720,2022-08-11,"Ela: ""Gosta tanto de futebol que qualquer dia vai encher o muro só de chuteiras""!

Eu: em Cohab II, Lado Leste, Itaquera https://t.co/PD4o2aNcda"
31,1533797012868677632,1557721650644127745,2022-08-11,"Em uma disputa acirrada de pênaltis, o Palmeiras se classificou para a semifinal da Libertadores!
#Libertadores #Palmeiras em Cohab II, Lado Leste, Itaquera https://t.co/c9BuINezB2"
32,1533797012868677632,1557708133732175874,2022-08-11,"Bom dia! Certeza que temos um brasileiro na final!
#SulAmericana em Cohab II, Lado Leste, Itaquera https://t.co/1u38VUgHUU"
33,1519058242764255233,1557662791225458688,2022-08-11,já tive uma televisão portatio  desta a pilhas como sofria kkkk #BDSP  @rodrigobocardi  @sabinasimonato_  @AndreModesto20  hoje ninguém sofre. https://t.co/r9yVo6SECw
34,71674128,1557474083708731392,2022-08-10,"Primeira foto com o S21+
TS da #263C Jd. Helena - COHAB II
#32608 #32001 #MBB #O500U #Caio #Induscar #VMP #Área3 em Conjunto Habitacional José Bonifácio https://t.co/Zf8PT1I9dq"
35,1533797012868677632,1557471312385155072,2022-08-10,"Real Madrid é o Campeão da Supercopa da Europa! em Cohab II, Lado Leste, Itaquera https://t.co/H67NYlqoJz"
36,1533797012868677632,1557463908344004610,2022-08-10,"Após um empate no primeiro jogo, Palmeiras x Atlético-MG decidem mais um semifinalista da Libertadores!
#Libertadores #Palmeiras #AtléticoMG em Cohab II, Lado Leste, Itaquera https://t.co/ulvQnOrt5n"
37,1533797012868677632,1557442724676059136,2022-08-10,"O jogo que define mais um semifinalista!
#SulAmericana 
#Cerará #SãoPauloFC em Cohab II, Lado Leste, Itaquera https://t.co/4kTC0iUdhR"
38,1519058242764255233,1557438952000430083,2022-08-10,https://t.co/MiMhNWwo0N
39,1533797012868677632,1557426653105737729,2022-08-10,"Real Madrid escalado ✔️
Eintracht Frankfurt escalado ✔️
#SuperCopa em Cohab II, Lado Leste, Itaquera https://t.co/q9ySp7TmS4"
40,72180781,1557421052686438401,2022-08-10,O que Michele Bolsonaro proferiu contra as religiões de matriz africana é racismo religioso. https://t.co/BlPqNof09t
41,1533797012868677632,1557405004025147393,2022-08-10,"As 16 horas os campeões da Champions League e Europa League se enfrentem no Estádio Olímpico de Helsinque!
#SuperCopa em Cohab II, Lado Leste, Itaquera https://t.co/BR4Bf7jTep"
42,1533797012868677632,1557349886668017666,2022-08-10,"O cântico de sua torcida diz:
""Tu és time de tradição
Raça, amor e paixão
Oh, meu mengo""!
Assim pode se definir a classificação do Flamengo!
#Libertadores #SemiFinal em Cohab II, Lado Leste, Itaquera https://t.co/xgkwcXuKIW"
43,1533797012868677632,1557322462420942850,2022-08-10,"Bom dia!!!
🐉🐉🐉
#SulAmericana em Cohab II, Lado Leste, Itaquera https://t.co/OYNZh9ZwuA"
44,1519058242764255233,1557295888720183302,2022-08-10,"#BDSP bom dia
cancelado a final do jogo de golf entre Rodrigo bocard x jodar muita chuva em São Paulo   @sabinasimonato_  @rodrigobocardi  @alejodar https://t.co/Jns50xn7iE"
45,1519058242764255233,1557290396870492161,2022-08-10,"#bdsp bom dia
chegamos até longe de mais vamos por ordem na casa e voltar no ano que vem... vai Corinthians https://t.co/wIgs3hk1Qd"
46,1533797012868677632,1557149897186414592,2022-08-09,"Flamengo escalado ✔️
Corinthians escalado ✔️
#Libertadores em Cohab II, Lado Leste, Itaquera https://t.co/KDknplnNTj"
47,1533797012868677632,1557127433756856322,2022-08-09,"Flamengo x Corinthians em um jogo que promete pegar 🔥
#Libertadores em Cohab II, Lado Leste, Itaquera https://t.co/smcZUHf7uv"
48,1239048675692892160,1557124359361363971,2022-08-09,um dia eu volto pra cá nem q eu tenha q fazer macumba
49,1533797012868677632,1557070467911016449,2022-08-09,"Pra cima deles, Dragão 🐉
#SulAmericana em Cohab II, Lado Leste, Itaquera https://t.co/58AFPyErST"
50,1533797012868677632,1557037375645171713,2022-08-09,"Os jogos de hoje pelo Brasileirão Série B! em Cohab II, Lado Leste, Itaquera https://t.co/H9UQGWLmNS"
51,1519058242764255233,1556952787602259968,2022-08-09,#bdsp acho melhor vocês começar a praticar golf com uma vassoura kkkkkk https://t.co/SU1KeAEEWa
52,1519058242764255233,1556951692666720256,2022-08-09,Rodrigo eu era fã da minha mãe a rainha do taco só que era dê vassoura o alvo era a gente kkkkk #bdsp @rodrigobocardi  @sabinasimonato_  @alejodar
53,1519058242764255233,1556924176908357632,2022-08-09,bom dia a todos acreditar sempre nada é impossível #BDSP  @alejodar  @sabinasimonato_ @rodrigobocardi vai Corinthians.. https://t.co/l5jn20nvHV
54,95303457,1556897257089286145,2022-08-09,"Louvado seja Deus! em Cohab II, Lado Leste, Itaquera https://t.co/ks5IEorVfm"
55,95303457,1556895056698777602,2022-08-09,"Acabou de publicar uma foto em Cohab II, Lado Leste, Itaquera https://t.co/kH4jNpwZTt"
56,1533797012868677632,1556634868477485057,2022-08-08,"O dia em que este humilde ADM e editor de efootball teve a honra de participar do evento da @konamibrasil 
Então lançamento do PES2018 em Cohab II, Lado Leste, Itaquera https://t.co/mbCR4IOpQS"
57,1533797012868677632,1556632281946722305,2022-08-08,"Assim está o top 6 do Brasileirão Série A! em Cohab II, Lado Leste, Itaquera https://t.co/BRmlev5M3w"
58,1533797012868677632,1556619423229681665,2022-08-08,"Bom dia!
Desejamos uma ótima semana para todos 👊🏼👊🏼👊🏼
Segue aí resultados e tabela atualizada do Brasileirão Série B! em Cohab II, Lado Leste, Itaquera https://t.co/UiWw6ubRsf"
59,1519058242764255233,1556580707228581888,2022-08-08,"este telão está com problema sério deve ser preguicite dê segunda- feira 
#bdsp https://t.co/c51ZCDumyG"
60,1519058242764255233,1556568445776527360,2022-08-08,@Marialourdessiq @rodrigobocardi @sabinasimonato_ 🤔🤔🤔
61,1519058242764255233,1556565328313868289,2022-08-08,"segunda-feira recheada
dê frio e muita chuva abençoada a cara do Rodrigo bocard #BDSP"
62,1519058242764255233,1556563948798984194,2022-08-08,"É preciso amor pra poder pulsar...
É preciso paz pra poder sorrir...
É preciso a chuva para florir... muito bom. #BDSP"
63,1519058242764255233,1556543137912332289,2022-08-08,"#hora1 bom dia
tá chovendo aí aqui também tá como o kovalic diz tá bom pra dormir e comer também guaianases zona leste sp"
