,author_id,tweet_id,created_at,text
0,1533797012868677632,1554924515716579328,2022-08-03,"O outro duelo brasileiro do dia, só que pela Libertadores! em Cohab II, Lado Leste, Itaquera https://t.co/kbaGb5cQPC"
1,1533797012868677632,1554889027291070466,2022-08-03,"Duelo brasileiro válido pelas quartas de final!
#SulAmericana #SãoPauloFC #Ceará em Cohab II, Lado Leste, Itaquera https://t.co/etbjtUcMRg"
2,1533797012868677632,1554849238714126338,2022-08-03,"Os jogos de hoje pela Pré Champions! em Cohab II, Lado Leste, Itaquera https://t.co/UExkxfugZo"
3,1533797012868677632,1554830230207938563,2022-08-03,"Resultados de ontem!
Pré Champions em Cohab II, Lado Leste, Itaquera https://t.co/RNwuycxugv"
4,1533797012868677632,1554822818990268417,2022-08-03,"Na estreia do artilheiro do amor, que deixou seu gol, o Sport apenas empata com o Criciúma em casa!
#BrasileirãoB em Cohab II, Lado Leste, Itaquera https://t.co/GbOM1GGQ8p"
5,1533797012868677632,1554811662330388481,2022-08-03,"Flamengo vence o Corinthians fora de casa com direito a um gol polêmico!
#Libertadores em Cohab II, Lado Leste, Itaquera https://t.co/9ss5y53Xuy"
6,2472958435,1554804590935261187,2022-08-03,@uberrsp Sou louco por uma putaria em provador
7,1533797012868677632,1554795316590903298,2022-08-03,"Bom dia!
🇧🇷🐉 em Cohab II, Lado Leste, Itaquera https://t.co/DkWfYxuWur"
8,1519058242764255233,1554754124532654080,2022-08-03,(CORINTHIANS ) decepção decepção decepção decepção #BDSP  @alejodar
9,1519058242764255233,1554624821178339328,2022-08-03,"#libertadoresNOsbt
aí que vontade de gritar bem alto pra todo mundo escutar VAI CORINTHIANS https://t.co/WOIp0gyRpH"
10,1519058242764255233,1554599575310172167,2022-08-02,vamos Corinthians está noite teremos que ganhar... https://t.co/4EvS06ITOm
11,234578293,1554571204987699202,2022-08-02,Acabou de publicar uma foto em Giorgia Trança https://t.co/BOtOVHlkj7
12,1533797012868677632,1554548855126994947,2022-08-02,"Anota aí ✍🏼
Aquele que promete ser o jogão do dia🔥
#Libertadores #Corinthians
#Flamengo em Cohab II, Lado Leste, Itaquera https://t.co/AmGecOgWUA"
13,1533797012868677632,1554520611480711168,2022-08-02,"Anota aí ✍🏼
#SulAmericana em Cohab II, Lado Leste, Itaquera https://t.co/NBkqynPse3"
14,1533797012868677632,1554495876114038785,2022-08-02,"Os jogos de hoje pela luta para chegar à fase de grupos da Champions League! em Cohab II, Lado Leste, Itaquera https://t.co/Ltgg4GAQCv"
15,1111050171146739712,1554474311540506624,2022-08-02,"Estréia na Copa Morgante! 

#ÉoTrémMané

🚂💨💨💨💨 em Campo Do Morgante https://t.co/vERzHMG19M"
16,1533797012868677632,1554442347924135939,2022-08-02,"Fim da rodada 20! O campeonato oscilando cada vez mais!
#BrasileirãoA em Cohab II, Lado Leste, Itaquera https://t.co/Fy0kRTnOLh"
17,1519058242764255233,1554412709864738816,2022-08-02,"#BDSP bom dia
nem tudo é ruim em guaianases o sól também brilha nesta manhã dê terça feira. https://t.co/B3WzhlYWJO"
18,1519058242764255233,1554397452190498819,2022-08-02,"#BDSP bom dia
hoje é dia de tomar aquele remédio de pressão arterial @rodrigobocardi  
@sabina_simonato  @alejodar guaianases zona leste https://t.co/8qGWWr6OYJ"
19,205486971,1554321326772568064,2022-08-02,Meninas radicais. com #skate https://t.co/2MHAIpAKrP
20,1533797012868677632,1554079953104297984,2022-08-01,"Bom dia!
Desejamos a todos uma ótima semana 👊🏼
Os resultados de ontem pelo Brasileirão Série A! em Cohab II, Lado Leste, Itaquera https://t.co/qElwMfJWlB"
21,1519058242764255233,1554044352858673153,2022-08-01,depende da farinha Rodrigo bocard #BDSP  @sabina_simonato https://t.co/3XBLMgNk1j
22,1519058242764255233,1554031281595367424,2022-08-01,"vem com gosto mês dê agosto que assim seja #BDSP  @rodrigobocardi
@sabina_simonato bom dia"
23,1533797012868677632,1553742635277459456,2022-07-31,"Os jogos de hoje pelo Brasileirão Série A! em Cohab II, Lado Leste, Itaquera https://t.co/1SNDB7JUbG"
24,526528864,1553733445179809795,2022-07-31,IEPAVES GUAINAZES em Jardi Aurora Guaianazes São Paulo https://t.co/rKxy8dXSHD
25,526528864,1553732658978590721,2022-07-31,IEPAVES GUAINAZES em Jardi Aurora Guaianazes São Paulo https://t.co/cKzMgWG5Uc
26,1533797012868677632,1553721427890618369,2022-07-31,"E o Brasileirão Série B 🔥🔥🔥 em Cohab II, Lado Leste, Itaquera https://t.co/DDUsSPU6wg"
27,1533797012868677632,1553713545543827456,2022-07-31,"Resultados de ontem!
#BrasileirãoA em Cohab II, Lado Leste, Itaquera https://t.co/WylFd3xP3F"
28,1533797012868677632,1553696794143608832,2022-07-31,"Bola rolando pela Championship!
#Sunderland
#Coventry em Cohab II, Lado Leste, Itaquera https://t.co/XPPS3phZ16"
29,1177599427198029824,1553561129040879616,2022-07-31,🍀 em Conjunto Habitacional José Bonifácio https://t.co/GEVyi1yJXe
30,1519058242764255233,1553551365401677824,2022-07-31,"#agorasãoelasnosbt 
eu tiraria a jogadora Duda"
31,1541168126,1553547065355026433,2022-07-31,🥶🥰 em Jardim São Pedro https://t.co/FkkhG7EKXp
32,1519058242764255233,1553534314524073987,2022-07-31,"#AgoraSaoElasNoSBT 
cadê o amarelinho está com frio vamos chamar o amarelinho"
33,1533797012868677632,1553496801357037569,2022-07-30,"E o outro Verdão também venceu! em Cohab II, Lado Leste, Itaquera https://t.co/Bi50JxMpcO"
34,1533797012868677632,1553496127390900224,2022-07-30,"Segue o líder! em Cohab II, Lado Leste, Itaquera https://t.co/jZnh5ZvcJm"
35,1533797012868677632,1553488072171331585,2022-07-30,"Bayern campeão da Supercopa da Alemanha! em Cohab II, Lado Leste, Itaquera https://t.co/j5cbaqnCl3"
36,1547543685629345796,1553464933538562048,2022-07-30,https://t.co/YCm98XUpwh
37,1533797012868677632,1553419420659322880,2022-07-30,"Um pênalti no final do jogo garantiria 3 pontos ao Brusque...
Por conta de dois toques ao batê-lo, o gol foi anulado!
#BrasileirãoB em Cohab II, Lado Leste, Itaquera https://t.co/rFACcKHhiu"
38,1533797012868677632,1553401724076949504,2022-07-30,"Liverpool escalado ✔️
Manchester City escalado ✔️ em Cohab II, Lado Leste, Itaquera https://t.co/c7D5IkJSWm"
39,1533797012868677632,1553335588165672960,2022-07-30,"Noite recheada de gols pelo Brasileirão Série B! em Cohab II, Lado Leste, Itaquera https://t.co/Lqhp5JSTU3"
40,1519058242764255233,1553309617811345409,2022-07-30,feliz sábado a todos 😂✌️😎🌞 https://t.co/9ZyrhcMCB3
41,1533797012868677632,1553111546112401410,2022-07-29,"Reforço no gol do São Paulo Futebol Clube!
#MercadoDaBola em Cohab II, Lado Leste, Itaquera https://t.co/ZwAaoL06Vq"
42,1533797012868677632,1553111345301803011,2022-07-29,"Reforço no Flamengo!
#MercadoDaBola em Cohab II, Lado Leste, Itaquera https://t.co/yrjey9ZzXb"
43,1533797012868677632,1553007625385689088,2022-07-29,"Resultados de ontem!
#BrasileirãoB em Cohab II, Lado Leste, Itaquera https://t.co/g61raj5Pte"
44,1533797012868677632,1552990329850236934,2022-07-29,"O Tricolor do Rio venceu o Tricolor cearense por 1x0 e levou a vantagem para a próxima partida no Rio de Janeiro! em Cohab II, Lado Leste, Itaquera https://t.co/ourMhqqJZu"
45,1533797012868677632,1552980354876575744,2022-07-29,"Com gol de Luciano, São Paulo sai na frente em partida válida pelas quartas de final da Copa do Brasil! em Cohab II, Lado Leste, Itaquera https://t.co/Byziyd7xVD"
46,1519058242764255233,1552946199233191936,2022-07-29,#BDSP  bom dia sabina Simonato achei que você gostaria pra guardar dê lembrança @sabina_simonato https://t.co/hKWvf4gmHK
47,1519058242764255233,1552941436676591620,2022-07-29,"#BDSP bom dia (sextou.)
feliz sexta feira a todos com @sabina_simonato https://t.co/RrBH5sfzqX"
48,27034840,1552836920924946432,2022-07-29,"Olá, Júpiter! em Vila Prudente - São Paulo/sp https://t.co/R7lSlCG9jf"
