,author_id,tweet_id,created_at,text
0,1277728653187702786,1550881488819863553,2022-07-23,Melhor festa junina de SP. Gostinho da terrinha 🌽🎊 https://t.co/CHyKy0Uqem
1,183642514,1550735970974195712,2022-07-23,Ahhh Marília 😍 https://t.co/9Gh1bb8KvV
2,66544424,1550665225090768897,2022-07-23,Acabou de publicar uma foto em PRO MAGNO Centro de Eventos https://t.co/LZCS5b2gNx
3,430891172,1550582837706989568,2022-07-22,Acabou de publicar uma foto em CTN - Centro de Tradições Nordestinas https://t.co/v21Jt8IGrB
4,27008217,1550499808539967495,2022-07-22,I'm at Bar do Português in São Paulo https://t.co/gRe7RTEKQU
5,27008217,1550139429490139136,2022-07-21,I'm at Bar do Português in São Paulo https://t.co/COQ503ZznD
6,701680421126463488,1550042334154326022,2022-07-21,Just posted a photo @ Limão https://t.co/8THNIvXUPo
7,430891172,1549877743839760389,2022-07-20,Just posted a photo @ CTN - Centro de Tradições Nordestinas https://t.co/lY7L3ZW6zX
8,855938087742050305,1549825419167338497,2022-07-20,Just posted a photo @ Spa Keep Depil https://t.co/AWt8XEZCKJ
9,67898559,1549793578607583233,2022-07-20,Legal você pintar nessa carona… em Quadra da Escola De Samba Rosas De Ouro https://t.co/l3iyGF318Q
10,267507997,1549730393343107073,2022-07-20,"I'm at CT São Paulo FC - @saopaulofc in São Paulo, SP https://t.co/6gFuNGr8jv"
11,48586521,1549721976092049408,2022-07-20,Muito obrigado por terem comigo nesta caminhada! em Lado Norte Dessa Zona https://t.co/lmHgEpSqNO
12,835282783874478080,1549615538636308481,2022-07-20,"Ainda estou chocada,mt obg glr♡

#mahito #mahitoedit #adm #birthday em 19 Anoooooooos https://t.co/mUmMjMbgKn"
13,1314646539613208576,1549585121195466754,2022-07-20,Recordemos juntos... en Home Sweet Home https://t.co/Fr8RUIcFok
14,1197707770025435136,1549500521848967168,2022-07-19,Acabou de publicar uma foto em PRO MAGNO Centro de Eventos https://t.co/OmDtDi5gHl
15,1076106932807708673,1549358291947556865,2022-07-19,Acabou de publicar uma foto em Marginal Tietê - São Paulo/Sp https://t.co/CLiSZ9AEwq
16,1076106932807708673,1549316255852777472,2022-07-19,Acabou de publicar uma foto em Marginal Tietê - São Paulo/Sp https://t.co/42flQsl30x
17,57837367,1549196638501146625,2022-07-19,Boa noite https://t.co/g9VIH5L5vE
18,637385447,1549065612395175938,2022-07-18,Marcos Guilherme fugiu dos protocolos e já pediu para vestir a camisa na apresentação. #gesaopaulo https://t.co/wplSwaKzy3
19,56248472,1549042701777047552,2022-07-18,"Nada não, a luz só estava boa 🥹 em Cervejaria Tarantino https://t.co/XnO4aHszXQ"
20,1544128266398728192,1548988712037617664,2022-07-18,https://t.co/Xm4cb7zZjZ
21,1314646539613208576,1548969135916343296,2022-07-18,Dice el dicho cuando una puerta se cierra el Universo se abre a tu favor y yo lo creo...🙏🙏🙏🙏🙏 en Home Sweet Home https://t.co/G6xAEpQtCr
22,365075592,1548776904072765440,2022-07-17,"Efeito da #ReduçãodeICMS em São Paulo!

#BolsonaroReeleito2022 https://t.co/HPrisbECHN"
23,801099001,1548739403643756544,2022-07-17,Acabou de publicar uma foto em PRO MAGNO Centro de Eventos https://t.co/s60vxn93As
24,801099001,1548737681315741699,2022-07-17,Acabou de publicar uma foto em PRO MAGNO Centro de Eventos https://t.co/SlS1ZZxc7p
25,289063916,1548733756655247362,2022-07-17,"I'm at Residencial Casa  Verde in São Paulo, SP https://t.co/wCsVhSauBV"
26,263957467,1548714122489085955,2022-07-17,Eventão do REPUBLICANOS 10. em PRO MAGNO Centro de Eventos https://t.co/NW8N0MuXnL
27,289063916,1548711533060018176,2022-07-17,"I'm at @Telhanorte in São Paulo, SP https://t.co/DRevnyCo1x"
