,author_id,tweet_id,created_at,text
0,1586039953221472263,1648483748785303554,2023-04-19,"Montando um mix com a Coleção Fé! 
Qual joia vc mais gostou? 

https://t.co/YItAXakOV5

#lefleurs #uselefleurs #lefleursgerabeleza #semijoias #acessórios #colar #pulseira #anel #brinco #bracelete #lefleursparatodas #mulheresreais #fé https://t.co/PHrIMfU7Qt"
1,14328502,1648122694565494784,2023-04-18,Drinking a Vidu by @cervejariadogma @ Cervejaria Tarantino — https://t.co/RZOReqwyA8
2,14328502,1647660998260662276,2023-04-16,Drinking a Green Socks by Croma @ Cervejaria Tarantino — https://t.co/DpR3K05dYu
3,14328502,1647641790185459712,2023-04-16,Drinking an IRISH DRY STOUT by Cervejaria 77 @ Cervejaria Tarantino — https://t.co/s0oJQUtgbG
4,14328502,1647637006548074496,2023-04-16,Drinking a Sombrero by Cervejaria Bareô @ Cervejaria Tarantino — https://t.co/n6rsZKvLoN
5,14328502,1647628657035292672,2023-04-16,Drinking a Santana by La Caminera Cervejaria @ Cervejaria Tarantino — https://t.co/UZnsqsWe5l
6,14328502,1647626503323041792,2023-04-16,Drinking a ZN Lager by Cervejaria Tarantino @ Cervejaria Tarantino — https://t.co/aKp3yxwjUq
