,author_id,tweet_id,created_at,text
0,220419072,1528872901600067585,2022-05-23,u know what it izzzz 🤌🏾 em Quieto No Meu Canto https://t.co/URETuWnxRT
1,3415911419,1528861895222083584,2022-05-23,#Vemax nos ajustes finais para #flexoelabels2022 🥰😄💪💪 em PRO MAGNO Centro de Eventos https://t.co/QmRxXg9vyG
2,67898559,1528812485624713216,2022-05-23,Tenho uma nova foto favorita da vida https://t.co/7FfToM7h0D
3,28140373,1528807511981142016,2022-05-23,"Acabou de publicar uma foto em Emef Antônio Prudente, Prof https://t.co/odhPWVAsqu"
4,2787216415,1528765754358759424,2022-05-23,Acabou de publicar uma foto em CTN - Centro de Tradições Nordestinas https://t.co/F2wD24PmOh
5,297653828,1528759146203467778,2022-05-23,Acabou de publicar uma foto em Time Do Leão https://t.co/nVeXBJ5XWn
6,1015302215752409094,1528749049347723267,2022-05-23,Acabou de publicar uma foto em Home Sweet Home https://t.co/W3rFDE8g01
7,771520845470691332,1528739942741860357,2022-05-23,Acabou de publicar uma foto em Cursos de Excel Online https://t.co/RpwOictpi2
8,149789964,1528550447333617665,2022-05-23,@mercado.fest @simplesmentenanys @ Cervejaria Tarantino https://t.co/zXl1NwbeLM
9,947609330697883648,1528453508592279553,2022-05-22,Oxi mainha! #ctnsp #nordeste #baiaodedois #arcoiris em CTN - Centro de Tradições Nordestinas https://t.co/v86Y3hBDf4
10,13124602,1528122342802706433,2022-05-21,"Comecei a beber bebida colorida de festa de jovem, que deus proteja meu fígado 🤙🏻 https://t.co/Z9GbvKepsy"
11,92517878,1528091516065009665,2022-05-21,Nova integrante da família... Begônia - chuva de prata em Rua João Roberto Thut https://t.co/pxK2OykZ7k
12,67202036,1528034309604380672,2022-05-21,Ontem ele esquentou a noite gelada de SP ☃️🎵 em CTN - Centro de Tradições Nordestinas https://t.co/ysYDrKlhXF
13,188090798,1527951039835426819,2022-05-21,"Níver do meu neto Joaquim, noite pra lá  de maravilhosa com a família! em Pitoresca Pizza https://t.co/sCVIvKAHxP"
14,972462380,1527793064177192962,2022-05-20,Acontecendo agora em Distinta Freguesia @rmacielviolao em Distinta Freguesia https://t.co/kUKWC024JA
15,78507844,1527508739472990220,2022-05-20,Tds os domingos tem nosso pagode nessa onda ali na Inajar de Souza pertinho to te esperando bora lá.... em Boa Vila Espetaria https://t.co/XInODWKHgW
16,1524377144784261120,1527451640965496832,2022-05-20,Aquecedor a aleo e vinho caseiro para esquentar! https://t.co/0tvhlAQY0k
17,113988684,1527414707040227328,2022-05-19,Blind lights👋🏻 @ Num Lugar Secreto Que Ninguém Pode Saber https://t.co/xxYZLQl9Ab
18,1321213727610408961,1527355313220833287,2022-05-19,"@dp_jackie eu não tenho palavras pra descrever a gratidão que estou sentindo. Nunca imaginei que alguém faria o que está fazendo por mim.
Não vejo mas sinto luz em você.
Desejo um dia poder te dar um forte e longo abraço.
Gratidão por ser especial para mim. https://t.co/aQjKmI73Qn"
19,1321213727610408961,1527330661706571776,2022-05-19,"Estão convidados a fazer uma vídeo chamada comigo pra me conhecer e ver se temos sintonia pra agendar um encontro inesquecível 💋
Não quero quantidade, quero muita qualidade. https://t.co/ndujIbK9JV"
20,1076106932807708673,1527281034093465600,2022-05-19,Acabou de publicar uma foto em Marginal Tietê - São Paulo/Sp https://t.co/pUW49X1okL
21,1076106932807708673,1527263972520509440,2022-05-19,Acabou de publicar uma foto em Marginal Tietê - São Paulo/Sp https://t.co/w4vFYpCvCz
22,1015302215752409094,1527258357656129536,2022-05-19,Acabou de publicar uma foto em Home Sweet Home https://t.co/DTVi6ukISM
23,228852406,1527110012232941568,2022-05-19,É oficial: Lula &amp; Janja enfim casados! em Brazil https://t.co/2fDF9nGAwz
24,2667164849,1527102275495272448,2022-05-19,#maiaraemaraisa https://t.co/rKFvEQ2X3U
25,2667164849,1527101886310109185,2022-05-19,#maiaraemaraisa https://t.co/nhitb3r4tV
26,1145508420004536321,1526965808320192513,2022-05-18,"É bom perceber que mesmo,fora do padrão, meus vídeos passam uma energia boa e tesao nos meus seguidores.
O @tantrico20cm me segue a muito tempo e sempre foi fã dos meus vídeos. Ontem teve troca de casal Sexo é vida e viver é o que importa @putobare220  e @Guerra1913 
Dar um Rt aí https://t.co/3UDJtUxdH8"
27,771520845470691332,1526630986250870784,2022-05-17,"17 de Maio

Dia Internacional de Combate à Homofobia

https://t.co/covyot8l77

#diganãoahomofobia #homofobia #lgbt #lgbt+ #LGBTQIA+ #lutacontraahomofobia em Cursos de Excel Online https://t.co/UMXTzE2CDS"
