,author_id,tweet_id,created_at,text
0,60940932,1559308814750568453,2022-08-15,Te amo incondicionalmente Painho ❤️. @ Cidade Patriarca https://t.co/AxbdbCc2Dz
1,316775437,1559292879448817664,2022-08-15,Acabou de publicar uma foto em Parque Tiquatira https://t.co/gTTq0DX6xv
2,51430514,1559246778142281729,2022-08-15,#escolhaseconsequências #neoquimicaarena #maracanã #labombonera#estadiomariofilho #estadiodopacaembu #pacaembu #estadiodomorumbi #estadioyokohama em Artur Alvim https://t.co/PbbWNqSrLj
3,508706735,1559246369348616193,2022-08-15,Acabou de publicar uma foto em Escola Estadual Dom Miguel Kruse https://t.co/vJAYIETq93
4,57220858,1559227283411386368,2022-08-15,"Domingo de dia dos pais, aquele bom e velho churrasco, cerveja, familia em Cangaíba https://t.co/veKRBbXOoe"
5,53103492,1559155390738317313,2022-08-15,"Semana iniciando com reuniões. Manhã, tarde e noite. Bora, produzir ações sociais e de inclusão? #AssociaçãoSãoPauloDiferenciado #ASPD #ClubedosLojistasdaVilaMatide #CLVM #ZonaLesteemDesenvolvimento #ZLD https://t.co/f43pqc3d0C"
6,1049853801920950273,1559023624505507841,2022-08-15,"Que a noite venha suave como a brisa, trazendo tudo que a nossa alma precisa. Boa noite a todos! em Bairro Cangaíba / Penha - São Paulo / SP https://t.co/Rnxqr0d9lt"
7,1049853801920950273,1559021674774814720,2022-08-15,Desejo um domingo abençoado para nós em Bairro Cangaíba / Penha - São Paulo / SP https://t.co/INgDGHt6ss
8,47966229,1559015948409004032,2022-08-15,"🥰😍 em Penha De França, Sao Paulo, Brazil https://t.co/RGRaetewaI"
9,3724233975,1558981360362086407,2022-08-15,"Sem mais choros, apenas gin. em Casa Do Norte Vidal E Pontes https://t.co/vC8zjrH9X0"
