,author_id,tweet_id,created_at,text
0,67514645,1566548358029840385,2022-09-04,Acabou de publicar uma foto em TV FIGHT https://t.co/ifaGUUpI9o
1,121441754,1566542603297906694,2022-09-04,Acabou de publicar uma foto em Bairro Cangaíba / Penha - São Paulo / SP https://t.co/i3SVfbIlaX
2,316775437,1566491678143352832,2022-09-04,Acabou de publicar uma foto em Tiquatira - Zona Leste https://t.co/WjVPyPyXTL
3,1172647983135043584,1566476948335136768,2022-09-04,Acabou de publicar uma foto em Qg Espalhando Maneva https://t.co/hY1WoS4SeT
4,26748706,1566429589408301058,2022-09-04,"Acredito que esse estátua seja do Itamar Assumpção em frente ao centro cultural da Penha. Se não for, por favor, me corrijam. em Centro Cultural Penha https://t.co/eon121h69l"
5,1387216514248593416,1566284288806780928,2022-09-04,Acabou de publicar uma foto em Igreja Evangélica Missionária Santidade e Poder https://t.co/YiR1f4lmnH
6,1049853801920950273,1566263227327348736,2022-09-04,"Boa noite, meus amigos! Que tenhamos todos uma noite de sono abençoada, tranquila e revigorante. em Bairro Cangaíba / Penha - São Paulo / SP https://t.co/0vN7s7dJOX"
7,1049853801920950273,1566259772814512130,2022-09-04,Abençoado seja o nosso sábado! em Bairro Cangaíba / Penha - São Paulo / SP https://t.co/QNU4AW2CzL
8,1049853801920950273,1566253700955635712,2022-09-04,"Meus amigos, eu desejo a todos vocês uma boa tarde! em Bairro Cangaíba / Penha - São Paulo / SP https://t.co/Obfqn99N6d"
9,1049853801920950273,1566250920689770496,2022-09-04,Bom dia! Ser feliz é apenas uma questão de mudar a nossa atitude perante às nossas dificuldades. em Bairro Cangaíba / Penha - São Paulo / SP https://t.co/eZy2OY6wTg
10,1049853801920950273,1566248836896636928,2022-09-04,"Que o final de semana seja abençoado, de luz, de paz interior e cheio de amor. em Bairro Cangaíba / Penha - São Paulo / SP https://t.co/NHQsDc9uEJ"
11,1049853801920950273,1566247678924963840,2022-09-04,"Que a noite venha suave como a brisa, trazendo tudo que a nossa alma precisa. Boa noite a todos! em Bairro Cangaíba / Penha - São Paulo / SP https://t.co/4U1dAfrXkM"
12,1049853801920950273,1566246146716172288,2022-09-04,"Se joga, hoje é sexta-feira! em Bairro Cangaíba / Penha - São Paulo / SP https://t.co/AzOcQgp9Uc"
13,1049853801920950273,1566244728689025026,2022-09-04,Que nesta tarde apenas os bons sentimentos nos visitem! em Bairro Cangaíba / Penha - São Paulo / SP https://t.co/SwuC9RIvpy
14,1049853801920950273,1566242170461638657,2022-09-04,Que hoje seja um dia tão especial em Bairro Cangaíba / Penha - São Paulo / SP https://t.co/8tVFPaCorY
15,106859192,1566221641872449538,2022-09-04,Permita-se em EuroSoccer https://t.co/aChHttYUhI
16,170497442,1566214253253648386,2022-09-03,"pedal na Madrugada de São Paulo.
Saindo do bairro da Penha sentido Ponte do Limão,Barra Funda SP. em Penha - Zona Leste https://t.co/SzlI0qSl8a"
17,1429642286615388161,1566209900564324354,2022-09-03,"Plantão de sábado, pré Rock in Rio 😍#doctorslife https://t.co/1dO9F8eZRs"
18,170497442,1566200228574789645,2022-09-03,"Pedal Noturno Urbano.
Retornando para Barra Funda. Trajeto tranquilo. Recomendo. em Penha - Zona Leste https://t.co/gjN4zWm12R"
19,85459043,1566131775381856256,2022-09-03,@Sandrarso1 Bom dia 😁😁 https://t.co/mb7xE6WgLp
20,91480390,1566129560919457796,2022-09-03,#juventus em Vila Esperança https://t.co/32cyrE1sRk
21,1435055997823987714,1566070679304282113,2022-09-03,🤍 https://t.co/ui0JG1F5ih
22,51430514,1566049041040957445,2022-09-03,Acabou de publicar uma foto em Artur Alvim https://t.co/oRmiUcyrHA
23,51430514,1566048875311513600,2022-09-03,Acabou de publicar uma foto em Artur Alvim https://t.co/N8qxkRe1b1
24,51430514,1566048686547030016,2022-09-03,Acabou de publicar uma foto em Artur Alvim https://t.co/3dvl2jfosZ
25,51430514,1566048519009738752,2022-09-03,Acabou de publicar uma foto em Artur Alvim https://t.co/v8fc5Z0neP
26,67514645,1566031919749681152,2022-09-03,Acabou de publicar uma foto em TV FIGHT https://t.co/Gc8cTIxqLU
27,1325921464500023298,1566022562588626945,2022-09-03,BOM DIA 😃 acordei cedo e ja to aqui
28,64727308,1566008031988666368,2022-09-03,"Bomm diaaaa ☕️
#sabadou🍻 em Penha De França, Sao Paulo, Brazil https://t.co/v9BSWq89V9"
29,63279367,1565882048212090881,2022-09-03,Acabou de publicar uma foto em Broadway Burger https://t.co/JjlmpL7FBz
30,2168385747,1565856792550293507,2022-09-03,Acabou de publicar uma foto em Basílica Nossa Senhora da Penha https://t.co/g8kNlxOZ0d
31,67514645,1565835651928440835,2022-09-02,Acabou de publicar uma foto em TV FIGHT https://t.co/1XzaJf8wKt
32,112726540,1565827327405211655,2022-09-02,"Blonde again @bacacc_  💫

#blonde #hairstyle #beauty #equipevhugo  #braehaircare #viral em Vicenzo di Franco Hair https://t.co/NTdN6sS2L9"
33,128243073,1565705374166048777,2022-09-02,"Em meio às guerras 

Eclesiastes 3:1 Tudo tem o seu tempo determinado, e há tempo para todo propósito debaixo do céu: 8 tempo de amar e tempo de aborrecer; tempo de guerra e tempo de paz. em Igreja Renascer Vila Matilde https://t.co/K9egFYMBXb"
34,64727308,1565642296535785472,2022-09-02,Bomm diaaaa ☕️ em Vila Ré https://t.co/i3II0mvPuL
35,1049853801920950273,1565516671179276288,2022-09-02,Que a noite seja doce e feliz. em Bairro Cangaíba / Penha - São Paulo / SP https://t.co/rrirhTu9mm
36,1049853801920950273,1565515342729908224,2022-09-02,Que nesta quinta-feira não nos falte bom humor para encarar as caras feias do dia em Bairro Cangaíba / Penha - São Paulo / SP https://t.co/LNQpZI0P54
37,1049853801920950273,1565512776029708289,2022-09-02,"Linda tarde para todos que, com alegria, espalhem amor e carinho todos os dias! em Bairro Cangaíba / Penha - São Paulo / SP https://t.co/PZlV7yH0vn"
38,1049853801920950273,1565507309589102593,2022-09-02,"Nesta manhã, te desejo apenas uma coisa: que todos sejam muito feliz! Um ótimo dia! em Bairro Cangaíba / Penha - São Paulo / SP https://t.co/3nGrB6egLA"
39,3638069663,1565503379509592066,2022-09-02,Acabou de publicar uma foto em Penha - Zona Leste https://t.co/ZsjNCaMdN7
40,316775437,1565458677171367936,2022-09-01,Acabou de publicar uma foto em Tiquatira - Zona Leste https://t.co/AQjJBLWPvp
41,67514645,1565316546452488193,2022-09-01,Acabou de publicar uma foto em TV FIGHT https://t.co/QrvtWmuy6x
42,67514645,1565303000075325440,2022-09-01,Acabou de publicar uma foto em TV FIGHT https://t.co/bAcbwg4K1q
43,864616609071149056,1565173753197256705,2022-09-01,Salve Corinthians https://t.co/xJXEWv1X5m
44,864616609071149056,1565172506981531651,2022-09-01,Na quebrada https://t.co/b8rwDCqmtX
45,110764294,1565169498285539328,2022-09-01,"Ela foi dormir cedo, mas passou pra dar boa noite!
.
#lua  #instalua #fotodecelular #luar em Pq. Ecológico Tietê https://t.co/ADTpPII4Oy"
46,164920903,1565114176065921029,2022-08-31,A focinheira até qnd vamos utilizar? 😷🚄Ⓜ️ https://t.co/AyyPpTZ2sV
47,771943792702283776,1564985146742374402,2022-08-31,Que treino 🙅🏻‍♂️🔥
48,1009980493847257088,1564942609889599488,2022-08-31,Acabou de publicar uma foto em Parque Ecológico Tietê https://t.co/G2JQDTz7hi
49,1378533026313998341,1564923484765036549,2022-08-31,"Ser nutricionista é entender que ""nem só de whey vive o homem""... Feliz dia do nutricionista! #insegurançaalimentar #31deagosto #2022 #CONSEA #CRN #CFN #saude"
50,904741795220815872,1564813511049428992,2022-08-31,#ViralVideo #Familia #legal merito https://t.co/thmc68RwPo
51,909455049667104768,1564787253179830272,2022-08-31,@eliasjabbour Ela não tem vergonha de ser burra pqp
52,3685487001,1564769455045021697,2022-08-31,"Aula de atabaque particular ou grupo. 
Venha aprender a tocar atabaque!
Aula de atabaque para todas as idades, venha aprender a tocar atabaque para louvar seu Orixá. 
Estamos localizados na zona leste de SP, Ponte Rasa,  chama no WhatsApp   +55 11 96576-2348 https://t.co/CF2emgMEIO"
53,316775437,1564719667800842247,2022-08-30,Acabou de publicar uma foto em Tiquatira - Zona Leste https://t.co/fUPsHbEuQp
54,1435040408489299971,1564624771903619077,2022-08-30,Acabou de publicar uma foto em Morro Da Fé https://t.co/Gc3TlUqTRx
55,78384985,1564614419899883525,2022-08-30,Glorinha❣️ em Jardim Popular https://t.co/nHvlwEGWBS
56,78384985,1564613914561859601,2022-08-30,Pequenas🥰 em Jardim Popular https://t.co/hgO5zlqlSW
57,78384985,1564613245893222403,2022-08-30,Helena 🥰 em Jardim Popular https://t.co/tNl4y9kTZx
58,78384985,1564612204799950862,2022-08-30,Glória ♥️ em Jardim Popular https://t.co/K6pb5UE3iI
59,348144029,1564607977599942670,2022-08-30,Acabou de publicar uma foto em Vila Esperança https://t.co/3DV2Fe2Ak1
60,1049853801920950273,1564434680962846720,2022-08-30,Bons Momentos 2 em Bairro Cangaíba / Penha - São Paulo / SP https://t.co/xJJgjgTF1h
61,1378533026313998341,1564394916804952065,2022-08-29,"Cuidado com as receitinhas #lowcarb 
Muitas delas trocam os carboidratos por gorduras e a gordura tem mais que o dobro de calorias. “Coma o quanto quiser” só pq é low carb…
É conversa!!! =}"
62,1049853801920950273,1564384228875423751,2022-08-29,"Boa noite, meus amigos! Que tenhamos todos uma noite de sono abençoada, tranquila e revigorante. em Bairro Cangaíba / Penha - São Paulo / SP https://t.co/uIeaEEoq5d"
63,1049853801920950273,1564382122491666432,2022-08-29,Sucesso é para quem enxerga cada início de semana como um recomeço. Faça dessa segunda-feira uma nova história! em Bairro Cangaíba / Penha - São Paulo / SP https://t.co/8Ui0Af3G78
64,1049853801920950273,1564380558473707520,2022-08-29,"Meus amigos, eu desejo a todos vocês uma boa tarde! em Bairro Cangaíba / Penha - São Paulo / SP https://t.co/dCySjrO0yJ"
65,1049853801920950273,1564378837898723329,2022-08-29,"Viva cada momento, ria todos os dias, ame além das palavras... Tenham todos um  bom dia! em Bairro Cangaíba / Penha - São Paulo / SP https://t.co/nFvFBv6ssa"
66,1049853801920950273,1564376463343771650,2022-08-29,A vida é muito curta para não aproveitar todos os momentos. em Bairro Cangaíba / Penha - São Paulo / SP https://t.co/fBgE7unLIb
67,112726540,1564372549815136256,2022-08-29,Acabou de publicar uma foto em Vicenzo di Franco Hair https://t.co/kBDzBvaj6D
68,1049853801920950273,1564371267138068481,2022-08-29,Que a semana venha cheia de emoções sinceras carregadas de carinhos e paz. Uma linda semana para todos! em Bairro Cangaíba / Penha - São Paulo / SP https://t.co/4R08iFap2g
