,author_id,tweet_id,created_at,text
0,389043807,1531943051509190656,2022-06-01,Acabou de publicar uma foto em Aura Terapias Naturais https://t.co/4mrfzKhcVQ
1,182387684,1531936819289509888,2022-06-01,Acabou de publicar uma foto em Pintar e Bordar https://t.co/mXCa5ANO61
2,60207311,1531928542623285249,2022-06-01,Acabou de publicar uma foto em Planalto Paulista https://t.co/dMJwHyHle7
3,60207311,1531928363157229569,2022-06-01,Acabou de publicar uma foto em Planalto Paulista https://t.co/lFPHKDLQVH
4,60207311,1531927975905591296,2022-06-01,Acabou de publicar uma foto em Planalto Paulista https://t.co/P9PPP8L2yF
5,58921547,1531860303662788609,2022-06-01,"Porpetas e copa do BR, e RBR fora que julgo bom ainda pro #AvantiPalestrinas 

É isso! Seguimos! Que doce é a liberdade! https://t.co/KE8IaPgD2o"
6,60207311,1531849867441717249,2022-06-01,Acabou de publicar uma foto em Planalto Paulista https://t.co/tFfZq0qm4B
7,19383548,1531811555930693635,2022-06-01,#recadinho @ Rui Bloem https://t.co/kfMMmBhHJu
8,304730976,1531801440204767233,2022-06-01,"Quarta Rock, sportes Rock copa do Brasil para curtir tempo feio depois do temporal punk ontem. boas noites Rock friends and Rockers em Brooklin São Paulo Z.sul https://t.co/YwiYoCp1Xp"
9,111948040,1531797347553923072,2022-06-01,Just posted a photo @ Shopping Ibirapuera https://t.co/FF7GJTZhGh
10,111948040,1531794767100760066,2022-06-01,Just posted a photo @ Shopping Ibirapuera https://t.co/G7V5yxbXBF
11,1247994699518029824,1531786833834688514,2022-05-31,"Fim de semana na quebrada 
É uma beleza! 😁
📸:@dudy_blcx em Favela da Alba https://t.co/mp1BpB9tTO"
12,60743669,1531784010963243008,2022-05-31,"Acabou de publicar uma foto em Moema, SP https://t.co/MwYO3Lp7um"
13,15244021,1531779859822874628,2022-05-31,"O dia todo com ele! Como é bom estar com você, @PauloVieiraReal! Tô nem aí pra foto tremida! https://t.co/h9xQRZ6G2M"
14,1022554246007410691,1531761587912048641,2022-05-31,eitaaaaa invalidação da minha bissexualidade nem gosto nem gosto kkkkk🤤
15,60207311,1531758506885500928,2022-05-31,Acabou de publicar uma foto em Planalto Paulista https://t.co/YKeBWQyX1B
16,1205428300568506368,1531745034546159621,2022-05-31,"Clínica Campo Belo 
OTORRINO- PEDIATRIA-ACUPUNTURA
Av. Vereador José Diniz, 3300, conj 201.
Atendemos convênios.
Entre em contato conosco:
(011) 94243-2619, (011) 5543-8457,(011) 5044-3201. https://t.co/cm7TTEK0fo"
17,1205428300568506368,1531732141918371842,2022-05-31,"Clínica especializada
Agende um check up em #otorrinolaringologia #drjoaomarcospiva  #clinicacampobelo #rinite #sinusite #gripe #faringite #otite #inverno https://t.co/sz1eORbTzm"
18,106590007,1531699438288359426,2022-05-31,Acabou de publicar uma foto em Bless Optical https://t.co/O5xKWQORsm
19,333760963,1531681898501652485,2022-05-31,CGH-&gt;SSA https://t.co/EnuzmWpFAS
20,3383629216,1531649095470833664,2022-05-31,"Será que estamos realmente vivendo de modo consciente a nossa identidade cristã e o propósito para o qual fomos chamados neste mundo onde Deus está trabalhando e nos convocando a trabalhar com Ele?

Pense seriamente! https://t.co/Buz3FZE5Wi"
21,106590007,1531627707582267392,2022-05-31,Acabou de publicar uma foto em Bless Optical https://t.co/SuQWMUanK4
22,2879809951,1531598410666614784,2022-05-31,E lá vou eu RIU DI XANEIRU https://t.co/KrrQSVg66u
23,857403643124998145,1531594644299079680,2022-05-31,"Comprei pão de queijo um café , e uma coca cola de lata 45,00 reais kkkkkkkkk mano tu não tem escolha"
24,1007930785,1531592912265482240,2022-05-31,"I'm at Aeroporto de São Paulo / Congonhas in São Paulo, SP https://t.co/35BTlQCLpt"
25,81813407,1531584448596017154,2022-05-31,Acabou de publicar uma foto em Zazou Moda Gestante https://t.co/0IrFxe0cpC
26,60207311,1531572290667704320,2022-05-31,Acabou de publicar uma foto em Planalto Paulista https://t.co/SrEpw6SK8o
27,60207311,1531572138326597632,2022-05-31,Acabou de publicar uma foto em Planalto Paulista https://t.co/O5FQSLz6mZ
28,1363359051757875203,1531530676813680645,2022-05-31,@haseulAKtrovao concordo
29,28273980,1531488727868002305,2022-05-31,Acabou de publicar uma foto em Villa Glam https://t.co/dMkgqfzZTg
30,60207311,1531450599920762881,2022-05-31,Acabou de publicar uma foto em Planalto Paulista https://t.co/H9M0aGXf6K
31,81813407,1531433845781934084,2022-05-31,Acabou de publicar uma foto em Zazou Moda Gestante https://t.co/DUa7XF0Mwj
32,1241245173792886785,1531425482457096193,2022-05-31,chá de cadeira pela @azulinhasaereas
33,1084600726624583686,1531425380833402880,2022-05-31,"Acabou de publicar uma foto em Aeroporto De Congonhas, São Paulo - SP https://t.co/v4rAOJhFUx"
34,41934128,1531415919628627969,2022-05-30,Acabou de publicar uma foto em Cenário Balões https://t.co/HkHLkbyveM
35,106590007,1531411725353992193,2022-05-30,#blessotical #blessoptical_brasil #blessoptical_brazil #bottega #independent #independenteyewear #conceito #independente #worldbrands #atelier #fattoamano #tecnologia #design em Bless Optical https://t.co/p4wf5SuaGL
36,41934128,1531397447196483585,2022-05-30,Acabou de publicar uma foto em Cenário Balões https://t.co/gEGdEOJk3q
37,721354011333521408,1531378544462467072,2022-05-30,https://t.co/6k79EPRqg5
38,44053466,1531366430276321280,2022-05-30,Acabou de publicar um vídeo em Beach 4 Fun https://t.co/aj6pc0DjxL
39,318056797,1531365851462619139,2022-05-30,I'm at Hardyfloor pisos e revestimentos a base de resinas 11 2364 8172 in São Paulo https://t.co/W1iTAym1nW https://t.co/AWdrYqBavh
40,829151811592474625,1531357589350584320,2022-05-30,"Você é a melhor esposa que eu poderia ter e espero conseguir retribuir todos os dias a felicidade que você me traz meu amor! Deus é maravilhoso! Te amo eternamente! em Aeroporto De Congonhas, São Paulo - SP https://t.co/RLWmMGV9cL"
41,494143650,1531356298868150272,2022-05-30,"Paz queridos hoje e amanhã na cidade #penha #santacatarina .

Orem por mim preciso de renovo rsrs . em Aeroporto De Congonhas, São Paulo - SP https://t.co/i8RE0x8gyT"
42,407723267,1531355189512388611,2022-05-30,"São Paulo, amanhã retorno pro frio que está se formando,  Até logo. em Aeroporto De Congonhas, São Paulo - SP https://t.co/orvZvl02Nu"
43,1403919346548809729,1531353746940346368,2022-05-30,tou mto mal
44,106590007,1531348298308673541,2022-05-30,Acabou de publicar uma foto em Bless Optical https://t.co/f6iJfjKkH6
45,41934128,1531347834955522053,2022-05-30,"Inscrições:

Até 31/05/2022 com desconto de 10%

Pague em até 10 vezes sem juros! Fale conosco.

Link na Bio em Cenário Balões https://t.co/A5g5fmv11m"
46,1313076252748722176,1531343566022266884,2022-05-30,Hj acordei com muito tesão omg🙈 🥵🥵🥵🥵 https://t.co/RqRWYku20l
47,1067836967373758464,1531327426701189124,2022-05-30,onde vivem as peruas paulisters https://t.co/zTW9lfEyua
48,19383548,1531316480255459331,2022-05-30,#recadinho @ Rui Bloem https://t.co/VOQkYAcN7D
49,30404697,1531315201605128193,2022-05-30,Acabou de publicar uma foto em Campo Belo (district of São Paulo) https://t.co/QNuy7rHxIH
50,84912815,1531278827539902464,2022-05-30,Acabou de publicar uma foto em Bourbon Street Music Club https://t.co/qKszDAesFm
51,1529894649023934484,1531269660527804417,2022-05-30,https://t.co/Ns8itJMKmT
52,41934128,1531252660828917760,2022-05-30,Acabou de publicar uma foto em Cenário Balões https://t.co/QCKHq4wGYE
53,1918511930,1531248797707272195,2022-05-30,☕️
54,81813407,1531230509627494401,2022-05-30,Acabou de publicar uma foto em Zazou Moda Gestante https://t.co/UNNsBmehlI
55,1293717575025688576,1531223944572850176,2022-05-30,Subiu 4.9 turbo https://t.co/3MyaBfQuhA
56,60207311,1531186366440259584,2022-05-30,Acabou de publicar uma foto em Planalto Paulista https://t.co/fOPIkpGwii
57,60207311,1531185090725806080,2022-05-30,Acabou de publicar uma foto em Planalto Paulista https://t.co/Md7mJJTuEY
58,60207311,1531185024833290243,2022-05-30,Acabou de publicar uma foto em Planalto Paulista https://t.co/kisnaDezTZ
59,35620080,1531125418576728071,2022-05-30,Acabou de publicar uma foto em RM's H https://t.co/frDfvKAM1P
60,35620080,1531121943373651969,2022-05-30,"💝® Foto dia 10/12/2015 5f 3.8 🎯 BS JR 29/05/2016 domingo ®😉🙌🙏🏻👏🏻❤️😍🔝🎼🎧🎤📳🇧🇷♎️💎💙🌟😘 
30/05/2022 2f 44 quase 7a #remacedo #remacedo38 #remacedo44 #remacedo77 #remacedo2022 em RM's H https://t.co/K7LKPhHAPP"
61,71877526,1531087090074763264,2022-05-30,"Vamos Desejar o Bem, que esta semana seja cheia de Prosperidade e de Vitórias!!! Que assim seja Graças a Deus 🙌🏻🙌🏻🙌🏻 em Studios Laercio Da Costa https://t.co/mgC0BYx26e"
62,304730976,1531062913833832449,2022-05-30,Gallo Metal Rock sportes tudo a ver em Brooklin São Paulo Z.sul https://t.co/4uUkqtlqiB
63,76103370,1531055882011922432,2022-05-29,Acabou de publicar uma foto em Bourbon Street Music Club https://t.co/ETmfNlAkyu
64,76103370,1531055151858999296,2022-05-29,Acabou de publicar uma foto em Bourbon Street Music Club https://t.co/owhn9nBftJ
65,60207311,1531045033822019587,2022-05-29,Acabou de publicar uma foto em Planalto Paulista https://t.co/D6P8mTdd6y
66,24683934,1531029305173614597,2022-05-29,Acabou de publicar uma foto em Aielo Motors https://t.co/VKNkgx2r6p
67,60207311,1531021257369497600,2022-05-29,Acabou de publicar uma foto em Planalto Paulista https://t.co/cA3D624710
68,2602508179,1531020771614674945,2022-05-29,"#Sp #Brasil #Drinks #gin #monsterenergy #badassbartender #Chama #Deubom #Bora

Só na água não vai nao em jardim Oriental jabaquaraS.P https://t.co/ZNoGIbgHyP"
69,41934128,1531012370017013761,2022-05-29,Acabou de publicar uma foto em Cenário Balões https://t.co/Ey0JbWvyqQ
70,1521509225406607363,1530996088534089728,2022-05-29,"🍊 Orange em Ibirapuera, São paulo https://t.co/Ekqi8brrnq"
71,19383548,1530978756847869953,2022-05-29,"Bolo de frutas vermelhas 
#foodbullying @ Café Des Fleurs https://t.co/9si7sB5BLs"
72,19383548,1530972279395569664,2022-05-29,"Fish tacos 
#foodbullying @ Taco Bar e Cozinha Mexicana https://t.co/rNUfu7sxaU"
73,19383548,1530963796625342465,2022-05-29,"Ultimate Nachos 
#foodbullying @ Taco Bar e Cozinha Mexicana https://t.co/mPkT3aFrYi"
74,1319773515990564865,1530963720565936128,2022-05-29,Nos vemos hoje na Ópera de Arame. Ansiosa! @KamasiW xxx
75,42673823,1530955842350088192,2022-05-29,Acabou de publicar uma foto em Beverly Comedy https://t.co/ClEDGEJkZl
76,58921547,1530946588088090624,2022-05-29,Negroni 🌶🙏🔥👌❤️🚀 https://t.co/Ax8RO8t8L0
77,937049228404314112,1530937507273232384,2022-05-29,"Acabou de publicar uma foto em Aeroporto De Congonhas, São Paulo - SP https://t.co/1LTyjiwIVN"
78,81813407,1530935966638018560,2022-05-29,Acabou de publicar uma foto em Villa Glam https://t.co/n19UikvdAF
79,41934128,1530933273609719808,2022-05-29,Acabou de publicar uma foto em Cenário Balões https://t.co/s0Ohf429AU
80,318056797,1530929108422623234,2022-05-29,"I'm at Paróquia Sagrado Coração de Jesus in São Paulo, SP https://t.co/6TqgVUYsQu https://t.co/Z44H1kdmV8"
81,318056797,1530926771935367168,2022-05-29,I'm at Hardyfloor pisos e revestimentos a base de resinas 11 2364 8172 in São Paulo https://t.co/1ZtAaq1NOx https://t.co/nrYjorZlFx
82,318056797,1530924767766884352,2022-05-29,"I'm at Pão de Açúcar - @paodeacucar in São Paulo, SP https://t.co/a4m39S94Kr https://t.co/XzWjdAL97D"
83,76103370,1530907436076482562,2022-05-29,Acabou de publicar uma foto em Bourbon Street Music Club https://t.co/awLeV2F32M
84,41934128,1530900147403509761,2022-05-29,Acabou de publicar uma foto em Cenário Balões https://t.co/NbnXyEQIuR
85,75058368,1530861789587578886,2022-05-29,"Haja inseticida… em Aeroporto De Congonhas, São Paulo - SP https://t.co/Cq6E6zgs97"
86,81813407,1530854063314817026,2022-05-29,Acabou de publicar uma foto em Villa Glam https://t.co/AyAHBqgT8I
87,60207311,1530841004944904193,2022-05-29,Acabou de publicar uma foto em Planalto Paulista https://t.co/cR8kzfj3Ld
88,60207311,1530840945700241408,2022-05-29,Acabou de publicar uma foto em Planalto Paulista https://t.co/2QHhSf24jh
89,937049228404314112,1530751769852223490,2022-05-29,"Acabou de publicar uma foto em Aeroporto De Congonhas, São Paulo - SP https://t.co/PGSvET5KUn"
90,47502733,1530715265020960770,2022-05-29,Fototeste em Parque das Bicicletas https://t.co/ZVzy9FFBp2
91,12708372,1530714768704667658,2022-05-29,Dia do hambúrguer comemorado com sucesso. em Justíssimo Burger &amp; Bar https://t.co/n8v3U9Xgcu
92,335755549,1530704469469667328,2022-05-29,"Um brinde para todos os lugares que visitamos! E para todos os lugares que nós vamos visitar! E um brinde para mim, sussurrando em seu ouvido de novo e de novo: EU TE AMO! #8years https://t.co/1XHgEffSCT"
93,60207311,1530702251282550785,2022-05-29,Acabou de publicar uma foto em Planalto Paulista https://t.co/HYSGUi4jj9
94,111948040,1530675110625034242,2022-05-28,"Camisetas Volcom Deadly Stone. Modelagem Regular, estampa em silk frontal, assinatura Volcom na manga e viés contrastante. #americanino 
#volcom #volcombrasil #volcomoriginal
#shoppingibirapuera @ Shopping Ibirapuera https://t.co/oKOaH6CTcU"
95,111948040,1530659765193302017,2022-05-28,Just posted a photo @ Shopping Ibirapuera https://t.co/dJ8OYHiPpL
96,97689547,1530652638773137410,2022-05-28,Drinking a Pilsen by Cervejaria BR-88 @ Brooklyn Paulista — https://t.co/ZL0pUBwkKG
97,2585001029,1530649205752094722,2022-05-28,"Que felicidade em encontrar de surpresa e no meio da correria de uma conexão em Congonhas o futuro Presidente @cirogomes! Uma honra apertar sua mão, Cirão! ✊🏻🌹

#PrefiroCiro #TurmaBoa #PND https://t.co/dLxzKHZdl0"
98,318056797,1530647625879388161,2022-05-28,"I'm at Padaria Colonial in São Paulo, SP https://t.co/AVcC1TlaiR https://t.co/qJvCgNEF8F"
99,73493771,1530637735354064898,2022-05-28,I'm at Fórmula Pet in São Paulo https://t.co/lj4x3leMCS
100,920102627211382784,1530629436751679489,2022-05-28,Acabou de publicar uma foto em Esmalteria Vivian Sampaio https://t.co/eMBcAlBkHy
101,920102627211382784,1530628700236132352,2022-05-28,Acabou de publicar uma foto em Esmalteria Vivian Sampaio https://t.co/Dj84b19m9X
102,920102627211382784,1530627865343033345,2022-05-28,Acabou de publicar uma foto em Esmalteria Vivian Sampaio https://t.co/CG9I9OeV2c
103,920102627211382784,1530627517836677121,2022-05-28,Acabou de publicar uma foto em Esmalteria Vivian Sampaio https://t.co/8NIEy9uhRj
104,111948040,1530623119693684737,2022-05-28,"Modelagem Regular, estampa em silk frontal, assinatura Volcom na manga e viés contrastante. 
Confeccionada em meia malha 30/1
#volcom #volcombrasil #americanino 
#volcomoriginal #shoppingibirapuera @ Shopping Ibirapuera https://t.co/0v5M5ru0mW"
105,8774132,1530594108007501827,2022-05-28,Comemorando o Dia Mundial do Hambúrguer @SevenKingsBgr https://t.co/evhaXTWd4m
106,1266512796797284352,1530585827260129280,2022-05-28,Comemorando meus 23 anos da melhor forma 💙 https://t.co/z6AyRbMUIG
107,2935479502,1530572389448355841,2022-05-28,Acabou de publicar uma foto em Bourbon Street Music Club https://t.co/uJVI1zVnoy
108,261366155,1530571554249183233,2022-05-28,Acabou de publicar uma foto em Instituto da Cerveja Brasil https://t.co/5pHZa9P1BN
109,106590007,1530569156353040385,2022-05-28,#deolho #olhovivo #olhando #olha #olhar #olho #eye #occhio #blessoptical #blessotical_brazil #blessoptical_brasil #todeolho #deolho #sguardo em Bless Optical https://t.co/zEBzpPSdVw
110,41934128,1530561977143238656,2022-05-28,Acabou de publicar uma foto em Cenário Balões https://t.co/nDTk2Xyhe6
111,318056797,1530542817675714562,2022-05-28,I'm at Hardyfloor pisos e revestimentos a base de resinas 11 2364 8172 in São Paulo https://t.co/l2AucaQLkw https://t.co/XCBYN0QQIn
112,41934128,1530528032099815426,2022-05-28,Acabou de publicar uma foto em Cenário Balões https://t.co/y0eFD1LwMD
113,56610486,1530525858028474369,2022-05-28,Acabou de publicar uma foto em Campos Do Jordão - A Suíça Brasileira https://t.co/hQwirB5xQs
114,56610486,1530524520569884676,2022-05-28,Acabou de publicar um vídeo em Campos Do Jordão - A Suíça Brasileira https://t.co/ZfMq9VKzhz
115,56610486,1530524239647977479,2022-05-28,Acabou de publicar um vídeo em Campos Do Jordão - A Suíça Brasileira https://t.co/guEqDRUGY3
116,1103077752914219008,1530522125836206081,2022-05-28,Uma criança fã de Harry Potter feliz por aqui 🥰 https://t.co/55sPokGCZm
117,56610486,1530521451203272704,2022-05-28,"Amo essa paisagem de Campos do Jordão, ainda mais no frio, que lugar lindo. em Campos Do Jordão - A Suíça Brasileira https://t.co/Q15F9VxDFQ"
118,56610486,1530520963883880449,2022-05-28,"FELIZ SÁBADO pra todos vcs, que Deus abençoe muito. em Campos Do Jordão - A Suíça Brasileira https://t.co/7vd7P3QCWe"
119,233383596,1530504755851689984,2022-05-28,"Acabou de publicar uma foto em Aeroporto De Congonhas, São Paulo - SP https://t.co/RRyE2AjRkG"
120,60207311,1530470315037450244,2022-05-28,Acabou de publicar uma foto em Planalto Paulista https://t.co/MRxRwpDMBA
121,60207311,1530470238533234688,2022-05-28,Acabou de publicar uma foto em Planalto Paulista https://t.co/JoGMUyMsWr
122,304730976,1530393791764512768,2022-05-28,Madrugada Rock friends and Rockers. Curta a brevê louca vida. O tempo não para. Rock forever Rock em Brooklin São Paulo Z.sul https://t.co/C6pOA37WkZ
123,304730976,1530392449314607105,2022-05-28,Rock friends and Rockers. House Rock night sextou Rock. Sempre em Brooklin São Paulo Z.sul https://t.co/DnjE6yScsM
124,304730976,1530392002281480193,2022-05-28,Boas noites Rock friends and Rockers. Rock night in house tomando aquela gelada. Tears Rockers em Brooklin São Paulo Z.sul https://t.co/rp9YImFhEP
125,482933194,1530371752643133441,2022-05-28,😍 em CASA PETRA https://t.co/1lkNzQ0fmX
126,560797121,1530359971170377728,2022-05-28,"Excelente @Eleazardomini!

Dei um estudo bíblico e fui questionado sobre Sábado e Ellen White. A pessoa viu Tiago Arrais falar que o sábado poderia ser outro dia e a Sra. White era descartada.

Ele era o pastor.
Eu só alguém dando estudo.

Olha o perigo!

https://t.co/WZSYIDAODk"
127,1346503196215271425,1530356642092662784,2022-05-28,Virei fã de HP moress 🥰 https://t.co/ij8OEmPqb5
128,53114639,1530343886350163968,2022-05-28,Acabou de publicar uma foto em Jovem Pan https://t.co/vLpQp0JGvF
129,58921547,1530320003098091523,2022-05-27,E o buteco é tudo nosso. #AvantiPalestra https://t.co/7lSgpzeDVi
130,60207311,1530308896660889602,2022-05-27,Acabou de publicar uma foto em Planalto Paulista https://t.co/cG9k04kMn2
131,60207311,1530308804885327877,2022-05-27,Acabou de publicar uma foto em Planalto Paulista https://t.co/10Z6IgqTab
132,1521722263694979072,1530308212611813376,2022-05-27,https://t.co/Kc9b7AeV13
133,60207311,1530306925216137216,2022-05-27,Acabou de publicar uma foto em Planalto Paulista https://t.co/PZNBusF8za
134,52833087,1530294390853451777,2022-05-27,"I'm at Aeroporto de São Paulo / Congonhas in São Paulo, SP https://t.co/BtgZm1wGId"
135,127430417,1530286060244180992,2022-05-27,"Amanhã sai o papo completo e eu já estou apaixonada! Teve até um salve pra Tamiroca.
Preparem-se para rir e chorar com a Erikotinha! 💛

#Corinthians @SCCPFutFeminino #futebolfeminino https://t.co/u6MViBEPJh"
136,164142088,1530263593974915072,2022-05-27,"HOJE!
Nos vemos lá galera 👊🏼👊🏼

#faiskaborges #faiska #steelbarsp #steelbar #sp #moemasp #marklambert em Steel Bar SP https://t.co/NJEstGMtd9"
137,339265678,1530244294673674244,2022-05-27,🤝 https://t.co/7WzdHx4mGb
138,1269319782685388802,1530241936187174914,2022-05-27,Séculos que eu não pisava em São Paulo
139,60207311,1530241223306293248,2022-05-27,"Como dizem os nutricionistas:
- Tem que comer na hora certa. em Planalto Paulista https://t.co/tWmjGQApXj"
140,84912815,1530216465340710913,2022-05-27,"HOT BLUES FEST
JAM SESSION
Campanha do agasalho para esquentar as noites de inverno das pessoas em situação de rua.

01/06/22
21h30
Bourbon Street Music Club

@bourbon_street 
@manoblues1971 em Bourbon Street Music Club https://t.co/bznmnS0C2Y"
141,41934128,1530215334719938560,2022-05-27,Acabou de publicar uma foto em Cenário Balões https://t.co/t8eKp2ppDZ
142,16864622,1530208967133220865,2022-05-27,Drinking a Lager by Cerveja Carabina @ Achapa — https://t.co/MIuBHIHxnL
143,1316184874206756866,1530199307474837505,2022-05-27,"Ó senhor Deus, como o Senhor tem sido tão bom comigo!

Obrigado Deus maravilhoso! 🙏🏻🥺❤️ https://t.co/y1oThXKo8k"
144,19450758,1530196423907606529,2022-05-27,"Just posted a photo @ Aeroporto De Congonhas, São Paulo - SP https://t.co/w8yHE2yYup"
145,41385276,1530188490520113154,2022-05-27,a CÂMARA aprovou ontem o Projeto de lei: dia da Harmonização Facial.  O frouxo eleitor assustadiçamente submete-se. em Brasília https://t.co/sj2aYaCs7M
146,41934128,1530171309203808256,2022-05-27,Acabou de publicar uma foto em Cenário Balões https://t.co/B9K9kD4VZR
147,117719574,1530165437660639234,2022-05-27,Não é sobre voar! É sobre entender que temos uma verdadeira experiência @azulinhasaereas em Nas Nuvens https://t.co/bVgTRgKonn
148,1101575305,1530161884867047424,2022-05-27,Acabou de publicar uma foto em Hocca Bar - O Famoso do Mercadão https://t.co/JC6DZ3ahcv
149,47502733,1530148569461796865,2022-05-27,Extranhooo! em Parque das Bicicletas https://t.co/FMCzVSjhLZ
150,1108157878836383749,1530142063076974592,2022-05-27,Acabou de publicar uma foto em Pedro Bomfim Advocacia https://t.co/Ebe8aVmNSv
151,2761344034,1530126655280271362,2022-05-27,"Turma de teologia para leigos.
Instituto Itelse. São Paulo/SP
Preparando para servir nas pastorais. em Colégio Maria Imaculada https://t.co/GhULyaqdSb"
152,2230246254,1530124857890971650,2022-05-27,Minha lombar tá fudida bom dia 👍🏻
153,60207311,1530110654417252353,2022-05-27,Acabou de publicar uma foto em Planalto Paulista https://t.co/JQRr3lxvJi
154,60207311,1530110568572633088,2022-05-27,Acabou de publicar uma foto em Planalto Paulista https://t.co/1Si5jbsxSD
155,58921547,1530034591242797064,2022-05-27,Sextou braziu 🌶 https://t.co/gz3V2Qv7Pj
156,712803270155235328,1530007163690680329,2022-05-27,Acabou de publicar uma foto em Vidraçaria Proglass Temperados e Laminados https://t.co/xfL4Kz7njk
157,239765705,1529970653947912212,2022-05-26,"Seminário Empreendedorismo e Economia Azul em Memorial da América Latina, São Paulo https://t.co/xeSTQDzsoF"
158,60207311,1529944554258022435,2022-05-26,Acabou de publicar uma foto em Planalto Paulista https://t.co/HXaV5StE36
159,169964377,1529933074745671680,2022-05-26,Acabou de publicar uma foto em Faculdade de Educação - USP https://t.co/76Bp6a5VQG
160,1363359051757875203,1529892127861354520,2022-05-26,@ejaculassao eu tenho
161,76103370,1529889168008138753,2022-05-26,Acabou de publicar uma foto em Bourbon Street Music Club https://t.co/Lstpq5yTTX
162,37987887,1529878943255343109,2022-05-26,"Hoje, em São Paulo... em Seven Kings Moema - SP https://t.co/XV2QhnwRpE"
163,63057498,1529877987214213126,2022-05-26,@sphouseimoveis em SP HOUSE Imóveis https://t.co/LZxJXxX49A
164,261366155,1529868040287961089,2022-05-26,Acabou de publicar uma foto em Instituto da Cerveja Brasil https://t.co/nVIrASZFxu
165,145310619,1529863684067139584,2022-05-26,🏝🛬 Pra algum lugar em paz!
166,41934128,1529853794904952832,2022-05-26,Acabou de publicar uma foto em Cenário Balões https://t.co/It5cKZO2wO
167,1081903915816443904,1529818864472629249,2022-05-26,Acabou de publicar uma foto em Brasília https://t.co/4GNAmGrfqy
168,1146261631506309120,1529816802653519873,2022-05-26,"e se eu falar que eu trombei com o @manobrown, na padaria e perguntei se era ele mesmo"
169,1494774540236427268,1529810317622054913,2022-05-26,"https://t.co/Q3yCGrBkGf
#vemprafatec #fatecitatiba #itatibasp #jarinú #morungaba #louveirasp #jundiaí #varzeapaulista #atibaia #varzeapaulista #valinhos #vinhedo #itupeva em Itatiba, SP https://t.co/YTDqOGUgyj"
170,41934128,1529806592052445185,2022-05-26,"Cenário Balões Festival

O Maior Festival de Balões do Mundo!

De 22 a 26 de junho de 2022

São Paulo - Brasil

Inscrições até 31/05/2022

Link na Bio em Cenário Balões https://t.co/39KKMPREfy"
171,53353970,1529789233845747712,2022-05-26,"""Liberdade de voar num horizonte qualquer, liberdade de pousar onde o coração quiser.""

Cecília Meireles em Aéroport international de Congonhas https://t.co/9lwBwGuAua"
172,3240827291,1529781048430710785,2022-05-26,Acabou de publicar uma foto em Carro 0 https://t.co/4PEWrJDMal
173,1133548983345930245,1529777434433921028,2022-05-26,"Esse perfil é patrocinado pelo SAVANA ,fazendo a felicidade dos Tripulantes desde 1967 https://t.co/hP3wnqxJlS"
174,3240827291,1529756761816694785,2022-05-26,Acabou de publicar uma foto em Carro 0 https://t.co/MgjXqZgkmx
175,60207311,1529737081836163076,2022-05-26,Acabou de publicar uma foto em Planalto Paulista https://t.co/JNmKJVq7kd
176,60207311,1529737032234328064,2022-05-26,Acabou de publicar uma foto em Planalto Paulista https://t.co/eWMjylNNWZ
177,10224712,1529638138209083392,2022-05-26,Última noite minha com o time do @PicPayDev 😢 (até mês que vem) https://t.co/FjcOErIQLL
178,60207311,1529631600232779776,2022-05-26,Acabou de publicar uma foto em Planalto Paulista https://t.co/QeLVwqAVx8
179,67623216,1529629154412572672,2022-05-26,Acabou de publicar uma foto em Futuro https://t.co/czUmSD8tzy
180,25863274,1529627319081525250,2022-05-26,"Pensa num lanche bom! Tata Lanches: Ingredientes de primeira e preços de outra era! Bora ajudar a divulgar a lanchonete dessa família, na vila Santa Catarina, próximo ao aeroporto de Congonhas. Vale muito a pena sair da vila Madalena pra comer aqui. Compensa até a gasolina! https://t.co/KUvHmwoMBj"
181,920102627211382784,1529622986361298945,2022-05-26,Acabou de publicar uma foto em Esmalteria Vivian Sampaio https://t.co/PEFpW8qVMd
182,920102627211382784,1529622433048797184,2022-05-26,Acabou de publicar uma foto em Esmalteria Vivian Sampaio https://t.co/rGivfih43e
