,author_id,tweet_id,created_at,text
0,60207311,1554971472921350144,2022-08-03,Acabou de publicar uma foto em Planalto Paulista https://t.co/MO1qcNWZma
1,60968055,1554959960802574336,2022-08-03,Muito bonito pra ficar somente na minha galeria! https://t.co/8h6yDGRLUW
2,95433357,1554956579551821825,2022-08-03,A Arte de Implantar Condomínios!                         Secovi - Agora em Secovi-SP https://t.co/Ys2qf4L7Wf
3,84872494,1554937089577439232,2022-08-03,"Pedi pra chamar alguém responsável, e a pessoa não estava disponível no momento.
Mesmo sendo uma diferença de R$1,00, isso é fraude, é crime. @BurgerKingBR também não orienta funcionários. O jeito é acionar o @proconspoficial, pois imagina o quanto eles “roubam” agindo assim"
4,84872494,1554937085903134720,2022-08-03,"@BurgerKingBR tem um site com cupons (foto 1), qndo vc tenta resgatar ele redireciona pra um App e com valor acima do indicado no site (foto 2), fui perguntar ao atendente da unidade do Shop. Ibirapuera e ele disse que o site não funciona e não pode fazer nada sobre os valores+ https://t.co/2UGhENFqU3"
5,261263814,1554930024150712323,2022-08-03,"#labace #recominte #tronair #embraer #dassault #cessna #textron #gulfstream #bellhelicopters #leonardo #airbus #aeronautica #aviacao #anac #aeronaves em Aeroporto De Congonhas, São Paulo - SP https://t.co/K7v7LXdzJa"
6,188546872,1554912415829065728,2022-08-03,Partiu BH! https://t.co/klOiJWNHon
7,3895005683,1554875582667558913,2022-08-03,Acabou de publicar uma foto em Espaço Drina Vieira https://t.co/0LQ8nOO72f
8,3895005683,1554873232217575424,2022-08-03,Acabou de publicar uma foto em Espaço Drina Vieira https://t.co/qmu60I5Z9M
9,76103370,1554872438470721542,2022-08-03,Acabou de publicar uma foto em Bourbon Street Music Club https://t.co/CK0y4YqOjO
10,110688963,1554862485852901379,2022-08-03,"I'm at @DIASupermercado in São Paulo, SP https://t.co/CNV1CcU85b"
11,3240827291,1554858074300567552,2022-08-03,Acabou de publicar uma foto em Carro 0 https://t.co/Y3nq8LHtpg
12,110688963,1554855670188572672,2022-08-03,"Pastel (@ Feira Livre - @sp_prefeitura in São Paulo, SP) https://t.co/m7u78HOYqd"
13,810115935235411968,1554852919216082945,2022-08-03,"Fotinhas do evento de ontem na @TopMagazine 
Foi maravilhoso ❤

#projota https://t.co/YLop8hdbrf"
14,182808450,1554849502300864514,2022-08-03,indeed @arvidkahl ! here in Brazil we have the same blindsight. #Web3 #blockchain #notary #indentity #DeFi https://t.co/A4gLfAsX2B
15,106774618,1554832059318673408,2022-08-03,"I'm at Latitude Workspaces in São Paulo, SP https://t.co/qKcYHSmGVz https://t.co/cz1OoNqosn"
16,14220748,1554826462577823744,2022-08-03,"Cabine de “X - A Marca  da Morte” (@ PlayArte Cinemas - @grupoplayarte in São Paulo, SP) https://t.co/qt7RgQnW8G"
17,347359854,1554809826722680832,2022-08-03,Acabou de publicar uma foto em Arena Entulhao https://t.co/hXpQHwSFGb
18,60207311,1554806291775766528,2022-08-03,Acabou de publicar uma foto em Planalto Paulista https://t.co/0LbN38eHpK
19,60207311,1554806010140934144,2022-08-03,Acabou de publicar uma foto em Planalto Paulista https://t.co/mZDCdu4Sms
20,81813407,1554797097169420292,2022-08-03,Acabou de publicar uma foto em Zazou Moda Gestante https://t.co/bPoyKNjt7a
21,162503327,1554788188341903361,2022-08-03,Só Palestra. Vamoooo https://t.co/g5luNlEQaT
22,3354920057,1554774682494287874,2022-08-03,"O @InfinityAsset #DailyDrops, informação na velocidade do mercado financeiro - 03/08/2022 com @JasonVieira https://t.co/CiozLrYnsg"
23,35620080,1554656435899813889,2022-08-03,Acabou de publicar uma foto em RM's H https://t.co/icGSaG7Ztl
24,164142088,1554629411990814722,2022-08-03,Acabou de publicar uma foto em EM&amp;T  Escola de Música e Tecnologia https://t.co/IeGeAccD6e
25,1342613868611252225,1554608858986946561,2022-08-02,"Eu nao iria postar, mas seria muito pecado https://t.co/tnXwcKBpAw"
26,1359942342493564929,1554605211506954241,2022-08-02,"rumo à bh! 
AVANTI PALESTRA! ✈️🐷💚 https://t.co/g0U6fmiOt6"
27,60207311,1554587095712366593,2022-08-02,Acabou de publicar uma foto em Planalto Paulista https://t.co/FOlO7xPWuI
28,1513885897036607489,1554575290923266055,2022-08-02,"Chegamos no Coletivo Geek!

Venha visitar nossa nova loja! 💕 em Coletivo Geek https://t.co/B5n8mImRJq"
29,740922267199242240,1554574355081969665,2022-08-02,#Libertadores https://t.co/dgQhybI5lo
30,838833999334227968,1554574146776010754,2022-08-02,Acabou de publicar uma foto em Brasília https://t.co/PfCujbu6ah
31,897835101786132480,1554540031553015809,2022-08-02,"Acabou de publicar uma foto em Ibirapuera, São paulo https://t.co/QVm6o3d3XD"
32,37987887,1554530478971133959,2022-08-02,"O cara que mais entende de futebol no Brasil e o meu amigo @carterbatista 😂😂😂😂
Valeu a resenha e a visita!!!! em Seven Kings Moema - SP https://t.co/4HkfwXDdho"
33,19383548,1554520172093906947,2022-08-02,"o importante é sobreviver pra errar de novo 
#recadinho @ Rui Bloem https://t.co/TxI9ylzJi9"
34,3895005683,1554510734800945154,2022-08-02,Acabou de publicar uma foto em Espaço Drina Vieira https://t.co/Z3Od266Twe
35,60207311,1554506089013489666,2022-08-02,Acabou de publicar uma foto em Planalto Paulista https://t.co/cUqQCvzu2y
36,313967766,1554503054074019840,2022-08-02,Família Santos !! Santos sempre santos ! @santosfc em Vila Belmiro. O Templo Do Futebol! https://t.co/uT92lC4p2I
37,28149075,1554499954722455552,2022-08-02,Acabou de publicar uma foto em Estudio Chinelada https://t.co/nKTJTbMIT7
38,37919713,1554498976212287489,2022-08-02,"A gente perde a conexão do voo, mas fica se achando muito famousa por encontrar o próprio livro em congonhas. 💙 https://t.co/r68a6Kzjxf"
39,300048582,1554486092539330560,2022-08-02,"Semana do orgulho lgbtq+ em Amsterdã em Vondelpark, Amsterdam https://t.co/5EvAgrTUEM"
40,106590007,1554479275511877636,2022-08-02,#blessoptical #blessoptical_brasil #blessoptical_brazil #blue #azzurro #azul #bleu #estilo #conceito #personalidade #nadaconvencional #curadoria #acervo #independentbrands #marcasindependentes em Bless Optical https://t.co/vd7lvPRe9O
41,106590007,1554479060918714368,2022-08-02,#blessoptical #blessoptical_brasil #blessoptical_brazil #blue #azzurro #azul #bleu #estilo #conceito #personalidade #nadaconvencional #curadoria #acervo #independentbrands #marcasindependentes em Bless Optical https://t.co/Y73dDK3PmN
42,106590007,1554478793372336128,2022-08-02,#blessoptical #blessoptical_brasil #blessoptical_brazil #blue #azzurro #azul #bleu #estilo #conceito #personalidade #nadaconvencional #curadoria #acervo #independentbrands #marcasindependentes em Bless Optical https://t.co/6902tzQdB0
43,3895005683,1554476447154438145,2022-08-02,Acabou de publicar uma foto em Espaço Drina Vieira https://t.co/PMiyMtkn45
44,81813407,1554467043398803462,2022-08-02,Este é uma das novidades da nova coleção de primavera que acaba de chegar na loja da Zazou. em Zazou Moda Gestante https://t.co/c5iQet5cd7
45,338097482,1554466551650287616,2022-08-02,"Acabou de publicar uma foto em Aeroporto De Congonhas, São Paulo - SP https://t.co/avvCywB4dF"
46,3240827291,1554434379983704069,2022-08-02,Acabou de publicar uma foto em Carro 0 https://t.co/IDl5DfDXbg
47,69867378,1554418725452914690,2022-08-02,Umas das coisas que eu mais gosto eh chegar em um lugar que simplesmente eu não conheço ninguém!!! https://t.co/En2cULDX33
48,60207311,1554388354380201984,2022-08-02,Acabou de publicar uma foto em Planalto Paulista https://t.co/rZJhhGHn96
49,60207311,1554388308444282881,2022-08-02,Acabou de publicar uma foto em Planalto Paulista https://t.co/JekNq53cqS
50,270375224,1554301998622818305,2022-08-02,"Acabou de publicar uma foto em Avenida General Valdomiro De Lima, Jabaquara, Sao Paulo, Sp, Brasil https://t.co/bI4LQNbrLc"
51,1455302944245436416,1554290661771337728,2022-08-02,Internacionalizando la pareja 😘😁
52,318056797,1554264210091171849,2022-08-02,"I'm at NY Barbearia in São Paulo, SP https://t.co/NVqyDAYmge https://t.co/9TIj2Soo0Y"
53,76103370,1554246611722797057,2022-08-01,Acabou de publicar uma foto em Bourbon Street Music Club https://t.co/1ynOdWdQSl
54,16885547,1554228182580187138,2022-08-01,"I'm at Aeroporto de São Paulo / Congonhas in São Paulo, SP https://t.co/WMCmVb8WSN"
55,60207311,1554220052081156098,2022-08-01,Acabou de publicar uma foto em Planalto Paulista https://t.co/qJjzHlPsa2
56,71715833,1554212038246817794,2022-08-01,"Em família❤️

@carolcberriel 

#familia #primos #amores @ Moema, SP https://t.co/vFAO4wGXgT"
57,760965890271830016,1554198061882216448,2022-08-01,❤️ https://t.co/5aP3V7fFV9
58,1047291533769297921,1554183593299173376,2022-08-01,"Acabou de publicar uma foto em Aeroporto De Congonhas, São Paulo - SP https://t.co/PCo2Nb3D7E"
59,106774618,1554166211251945473,2022-08-01,"I'm at Vivianne Wakuda Pâtissière in São Paulo, SP https://t.co/CPuSK6tq7b https://t.co/14jn0wJ8W4"
60,60207311,1554143884942385152,2022-08-01,Descanse em paz Michelle Nichols a eterna Lt. Uhura. em Planalto Paulista https://t.co/ixY2udXQOA
61,328536799,1554111258634379264,2022-08-01,Acabou de publicar uma foto em Live Pocket Studio https://t.co/7pWAaBugY9
62,19383548,1554092125511360513,2022-08-01,"Isso é bom e ruim ao mesmo tempo…
#recadinho @ Rui Bloem https://t.co/pPWGC2WlXm"
63,60207311,1554091084661133312,2022-08-01,Acabou de publicar uma foto em Planalto Paulista https://t.co/SNfYWA6tZa
64,60207311,1554091027073585152,2022-08-01,Acabou de publicar uma foto em Planalto Paulista https://t.co/nkz9XeSVe0
65,41709648,1554073800769097730,2022-08-01,Acabou de publicar uma foto em Brooklin - Campo Belo https://t.co/e5CXvgot3q
66,66858402,1554073334085722113,2022-08-01,Acabou de publicar uma foto em CQ Empresariamento https://t.co/55peygCW3o
67,1516408046817320961,1554062970958872576,2022-08-01,Partiu Rio de Janeiro ótimo semana a todos 🛫🛫 https://t.co/1fcinpJDvE
68,81813407,1554047839789088768,2022-08-01,Acabou de publicar uma foto em Zazou Moda Gestante https://t.co/zplbF3C77f
69,615408256,1553980213138264064,2022-08-01,Deveria estar dormindo mas acabei foi de receber as compras do mercado hehehehehehe
70,60207311,1553941765924818946,2022-08-01,Acabou de publicar uma foto em Planalto Paulista https://t.co/2jmzuI4Nk8
71,1045151067363856384,1553901395895586822,2022-08-01,Antes tarde do que nunca 😮‍💨
72,200738071,1553891527662874624,2022-07-31,Obrigado por não fumar(sdds sao paulo) em Willi Willie Bar e Arqueria https://t.co/MKqYQOKB8p
73,248412116,1553849294008066049,2022-07-31,"Danke (@ Aeroporto de São Paulo / Congonhas in São Paulo, SP) https://t.co/9xPXu0Zbic"
74,123601616,1553834126410661889,2022-07-31,Drinking a Paulaner Hefe-Weißbier / Hefe-Weizen / Weissbier by Paulaner Brauerei @ Instituto da Cerveja Brasil — https://t.co/ljL3rq7I1G
75,137529614,1553773590029508608,2022-07-31,"Bora pra casa!!! em Aeroporto De Congonhas, São Paulo - SP https://t.co/st5IwCo9Sj"
76,76103370,1553771818196008961,2022-07-31,Acabou de publicar uma foto em Bourbon Street Music Club https://t.co/57FcUCzZfN
77,81813407,1553749504037371910,2022-07-31,Venham conhecer e experimentar pessoalmente as promoções da coleção de inverno da @zazou_oficial. em Zazou Moda Gestante https://t.co/qZ4Jg36Vip
78,159698135,1553742746288005128,2022-07-31,"I'm at Voo LATAM JJ 3918 - @latam_bra in São Paulo, SP https://t.co/Q6KacIiJxP"
79,81813407,1553735210654744576,2022-07-31,Venham aproveitar os últimos dias da promoção da coleção de inverno da @zazou_oficial com descontos bem atraentes. Mais informações com nosso time de atendimento remoto personalizado através do WhatsApp: 11-99487-3649. https://t.co/oTUBWC8xmb
80,159698135,1553724938158219265,2022-07-31,"I'm at Aeroporto de São Paulo / Congonhas in São Paulo, SP https://t.co/GkuBMnZzjR"
81,3558186623,1553714936022548483,2022-07-31,"Torcedora clubista e que passa o pano p tudo acorda assim 👊🤣🇾🇪 
""De você não abro mão ""
Dia de + 3 pontinhos !!!! 
@SaoPauloFC https://t.co/w2vZGqsADI"
82,99162230,1553714426276184064,2022-07-31,Dia de aprender mais um pouco com @suedmachado e @gaki.gg em Universidade Paulista Unip https://t.co/CB2fGVHZZr
83,60207311,1553709214484275200,2022-07-31,Acabou de publicar uma foto em Planalto Paulista https://t.co/gG5Hsh7aGd
84,60207311,1553709144858935296,2022-07-31,Acabou de publicar uma foto em Planalto Paulista https://t.co/iUryGabGoc
85,60207311,1553709019306532864,2022-07-31,Acabou de publicar uma foto em Planalto Paulista https://t.co/NY6jVKK7Zv
86,3415267547,1553593545323331586,2022-07-31,"mais uma alma batizada esqueçe!!! 

filhote é pé quente 🤪🏴🏳️⛓

Corinthians x bostafogo +3 pontos. https://t.co/vjU9BX8PMC"
87,150501679,1553579163918925824,2022-07-31,Acabou de publicar uma foto em Tramontana Comedy https://t.co/NUHywcks2b
88,83720016,1553530408565755904,2022-07-30,"I'm at Hannover in São Paulo, SP w/ @fcterras https://t.co/9IvBaw8xXq"
89,304730976,1553528561587277824,2022-07-30,Good night Friends and Rockers. Frio mas o Rock aquece. em Brooklin São Paulo Z.sul https://t.co/fyoTh3p5fk
90,2806283612,1553525963689951235,2022-07-30,"os refri do lugar que o homi me traz

@OBQDC https://t.co/MB8MdMb5EO"
91,99162230,1553503856147009536,2022-07-30,Na janela lateral…. em Aeropuerto de Congonhas https://t.co/AEZyU6jrMP
92,51467780,1553500985372418048,2022-07-30,"Acabou de publicar uma foto em Aeroporto De Congonhas, São Paulo - SP https://t.co/9fXjQmXTV1"
93,81813407,1553500005729595392,2022-07-30,Mais uma foto deste vestido verde agora de costa… em Zazou Moda Gestante https://t.co/5F880EG8QA
94,60207311,1553489829211639810,2022-07-30,Acabou de publicar uma foto em Planalto Paulista https://t.co/a9YKaizXsA
95,1133548983345930245,1553488702810329090,2022-07-30,Voando com o spotter Marcos V. Oliveira do @JetPhotos #AvGeek https://t.co/FN9Ymt1f1P
96,736706599855751168,1553481136751403009,2022-07-30,Uma soda limonada com cupuaçu. https://t.co/TfcpEP3Z9w
97,3895005683,1553444932370800640,2022-07-30,Acabou de publicar uma foto em Espaço Drina Vieira https://t.co/vOtMUWpP2b
98,3127024384,1553440740214280194,2022-07-30,dois drinks 🍹 tô doidão alucicrazy kakakakakaka
99,738484040882343941,1553425657819971585,2022-07-30,#coffelover em Paris 6 Petit https://t.co/SSh9nM2BQ3
100,56233046,1553408419624849409,2022-07-30,Papo incrível com @omatutoprogramador sobre carreira em tecnologia. 📺 https://t.co/2hADTNUDzV em Tchê Café https://t.co/mgvP0QbXk8
101,110688963,1553397127224725506,2022-07-30,I'm at Blase in São Paulo https://t.co/hh2vL97Ysj
102,15922513,1553381781730107394,2022-07-30,"Partiu, Curitiba! Vamos, São Paulo! https://t.co/qkwVYl6KzV"
103,333760963,1553366072933367811,2022-07-30,Férias !!! https://t.co/deLCppxzW6
104,106590007,1553363915605770240,2022-07-30,#blessoptical #blessoptical_brazil #blessoptical_brasil #estilo #conceito #personalidade #nadaconvencional #independentbrands #overnice #descolado #irreverente #handmadeinholland🇳🇱 #curadoria #acervo em Bless Optical https://t.co/oI678UgYS5
105,106590007,1553363480589357059,2022-07-30,#blessoptical #blessoptical_brazil #blessoptical_brasil #estilo #conceito #personalidade #nadaconvencional #independentbrands #overnice #descolado #irreverente #handmadeinholland🇳🇱 #curadoria #acervo em Bless Optical https://t.co/hYDHLsdl6h
106,106590007,1553362597042323456,2022-07-30,#blessoptical #blessoptical_brazil #blessoptical_brasil #estilo #conceito #personalidade #nadaconvencional #independentbrands #overnice #descolado #irreverente #handmadeinholland🇳🇱 #curadoria #acervo em Bless Optical https://t.co/Td6qhJ023N
107,81813407,1553355256909955075,2022-07-30,Mostre sua barriguinha de grávida com estilo com um look da @zazou_oficial em Zazou Moda Gestante https://t.co/U1bjDKapE1
108,52385804,1553347646865244161,2022-07-30,#partiuférias #eurotrip em Congonhas https://t.co/5bbWvHL7nK
109,1464985882830819342,1553334125448372224,2022-07-30,Acabei de publicar uma foto em São Bento do Sapucaí - SP https://t.co/0ryS6gxLIl
110,60207311,1553325781572534272,2022-07-30,Acabou de publicar uma foto em Planalto Paulista https://t.co/7cxX8pNIeG
111,60207311,1553325544896282626,2022-07-30,Acabou de publicar uma foto em Planalto Paulista https://t.co/smhu1U5K9P
112,81813407,1553323091366797312,2022-07-30,Acabou de publicar uma foto em Zazou Moda Gestante https://t.co/xfTqNfVE4X
113,76103370,1553201016249655297,2022-07-30,Acabou de publicar uma foto em Bourbon Street Music Club https://t.co/wZCnWJGI3P
114,60207311,1553195405017460737,2022-07-30,Acabou de publicar uma foto em Planalto Paulista https://t.co/YLEMBfZzpm
115,30404697,1553189573110497280,2022-07-30,Acabou de publicar uma foto em Campo Belo (district of São Paulo) https://t.co/Z0FYk8LTKc
116,21834694,1553171527717224448,2022-07-30,CGH ----------- ✈️ ------------- FLN
117,1168574758281195520,1553162119415201798,2022-07-29,"nunca fui triste, minhas benicats ❤️ https://t.co/ddtX0ij4qy"
118,3895005683,1553147960006950913,2022-07-29,Acabou de publicar uma foto em Espaço Drina Vieira https://t.co/8og3f1TTmR
119,1392955910511804420,1553121719963078656,2022-07-29,Sdds de ir p swing e fazer a festa com homem de verdade enquanto o corno só assiste e fica na punheta (quando eu deixo) #cuckold #cornomansobr #hotwife #hot #safada #feet #liberal #swing https://t.co/LbktgQGlFM
120,1363573075845988357,1553117139292372992,2022-07-29,... Vou colorir o dia!❤️🧡💛💚💙💜 em Medical Discovery Brasil https://t.co/PHrbMyJVIW
121,76103370,1553106448334393344,2022-07-29,Acabou de publicar uma foto em Bourbon Street Music Club https://t.co/ir4OsaAmLZ
122,192584779,1553097203362799616,2022-07-29,Acabou de publicar uma foto em Looke https://t.co/6MAdPUFviU
123,73493771,1553096757030141952,2022-07-29,I'm at Fórmula Pet in São Paulo https://t.co/lWmi0nmklg
124,76103370,1553096143722233861,2022-07-29,Acabou de publicar uma foto em Bourbon Street Music Club https://t.co/swmRXuXPsG
125,106590007,1553090652463923201,2022-07-29,#blessoptical #blessoptical_brazil #blessoptical_brasil #estilo #conceito #personalidade #nadaconvencional #curadoria #acervo #handmadeinitaly🇮🇹 #foradacurva #elegante #sofisticado #impar em Bless Optical https://t.co/jDrd5AWUgk
126,106590007,1553090375954452485,2022-07-29,#blessoptical #blessoptical_brazil #blessoptical_brasil #estilo #conceito #personalidade #nadaconvencional #curadoria #acervo #handmadeinitaly🇮🇹 #foradacurva #elegante #sofisticado #impar em Bless Optical https://t.co/AyuNeJHjs9
127,106590007,1553090070038601732,2022-07-29,#blessoptical #blessoptical_brazil #blessoptical_brasil #estilo #conceito #personalidade #nadaconvencional #curadoria #acervo #handmadeinitaly🇮🇹 #foradacurva #elegante #sofisticado #impar em Bless Optical https://t.co/sJGiJ6D6g4
128,1206339092394467328,1553071123906105344,2022-07-29,"Enfim, sextou 🍻 https://t.co/cnzM4g060L"
129,6609882,1553066818700443651,2022-07-29,"Pessoas que batem palma na aterrissagem, até quando?"
130,251804407,1553029129963978754,2022-07-29,"I'm at Aeroporto de São Paulo / Congonhas in São Paulo, SP https://t.co/QrFXajGvdD"
131,19383548,1552992200816005122,2022-07-29,"…
#recadinho @ Rui Bloem https://t.co/m1hZp7hxr2"
132,41934128,1552985364972933120,2022-07-29,Acabou de publicar uma foto em Cenário Balões https://t.co/QAuZRgG1VV
133,248412116,1552981865790849030,2022-07-29,"Já chegamos pra #SPCity (@ Aeroporto de São Paulo / Congonhas in São Paulo, SP) https://t.co/FLCYDe1oF9"
134,55427278,1552970824646361088,2022-07-29,"#VemJaraguá ✈️🔥🎶

Alô alô @IsraeleRodolffo tô chegandooooooo!! 💃🏻💃🏻💃🏻 https://t.co/cyQD3j8jgg"
135,81813407,1552970713669128192,2022-07-29,Acabou de publicar uma foto em Zazou Moda Gestante https://t.co/UYXTwigfvq
136,24967587,1552958900508532736,2022-07-29,"I'm at Bradesco Cartões Lounge in São Paulo, SP https://t.co/h9LlKlFd21"
137,24967587,1552956570979418113,2022-07-29,"I'm at Aeroporto de São Paulo / Congonhas in São Paulo, SP https://t.co/jns8cuSk8J"
138,58213680,1552955767241801728,2022-07-29,partiu beagá 🤍 https://t.co/MQtIGMcPXC
139,35784221,1552942416625373184,2022-07-29,Zap zum zum zum... https://t.co/jG9HcyN0ax
140,60207311,1552937129981911043,2022-07-29,Acabou de publicar uma foto em Planalto Paulista https://t.co/A9Dk3j6z2d
141,60207311,1552935311013036032,2022-07-29,Acabou de publicar uma foto em Planalto Paulista https://t.co/6bzaEDw2F7
142,60207311,1552934793595142144,2022-07-29,Acabou de publicar uma foto em Planalto Paulista https://t.co/m4yK0pupsH
143,1546037685210464256,1552917417520685056,2022-07-29,Seeeeextou do melhor jeito: a caminho do #RiodeJaneiro para participar do #RioHealthNutrition
144,76103370,1552878703973224449,2022-07-29,Acabou de publicar uma foto em Bourbon Street Music Club https://t.co/OYtZKdsQBt
145,76103370,1552872438760980481,2022-07-29,Acabou de publicar uma foto em Bourbon Street Music Club https://t.co/SOS2HkjnGT
146,76103370,1552871264406085636,2022-07-29,Acabou de publicar uma foto em Bourbon Street Music Club https://t.co/iHds2oX8W5
147,60207311,1552840159380520961,2022-07-29,Acabou de publicar uma foto em Planalto Paulista https://t.co/LYm3KaDE97
148,256587353,1552823472644055040,2022-07-29,"Vamos pro play
@cezarepaulinho 

#musica #paz #amor #musicaaovivo
 #bass #dacruzluthieria #alembic #diversao #felicidade #feliz #michelleefrancojr #cezarepaulinho #musicasertaneja
 #sertanejo #contabaixo #baixo https://t.co/Qh5NR0qlrY"
