,author_id,tweet_id,created_at,text
0,58921547,1530320003098091523,2022-05-27,E o buteco é tudo nosso. #AvantiPalestra https://t.co/7lSgpzeDVi
1,60207311,1530308896660889602,2022-05-27,Acabou de publicar uma foto em Planalto Paulista https://t.co/cG9k04kMn2
2,60207311,1530308804885327877,2022-05-27,Acabou de publicar uma foto em Planalto Paulista https://t.co/10Z6IgqTab
3,1521722263694979072,1530308212611813376,2022-05-27,https://t.co/Kc9b7AeV13
4,60207311,1530306925216137216,2022-05-27,Acabou de publicar uma foto em Planalto Paulista https://t.co/PZNBusF8za
5,52833087,1530294390853451777,2022-05-27,"I'm at Aeroporto de São Paulo / Congonhas in São Paulo, SP https://t.co/BtgZm1wGId"
6,127430417,1530286060244180992,2022-05-27,"Amanhã sai o papo completo e eu já estou apaixonada! Teve até um salve pra Tamiroca.
Preparem-se para rir e chorar com a Erikotinha! 💛

#Corinthians @SCCPFutFeminino #futebolfeminino https://t.co/u6MViBEPJh"
7,164142088,1530263593974915072,2022-05-27,"HOJE!
Nos vemos lá galera 👊🏼👊🏼

#faiskaborges #faiska #steelbarsp #steelbar #sp #moemasp #marklambert em Steel Bar SP https://t.co/NJEstGMtd9"
8,339265678,1530244294673674244,2022-05-27,🤝 https://t.co/7WzdHx4mGb
9,1269319782685388802,1530241936187174914,2022-05-27,Séculos que eu não pisava em São Paulo
10,60207311,1530241223306293248,2022-05-27,"Como dizem os nutricionistas:
- Tem que comer na hora certa. em Planalto Paulista https://t.co/tWmjGQApXj"
11,84912815,1530216465340710913,2022-05-27,"HOT BLUES FEST
JAM SESSION
Campanha do agasalho para esquentar as noites de inverno das pessoas em situação de rua.

01/06/22
21h30
Bourbon Street Music Club

@bourbon_street 
@manoblues1971 em Bourbon Street Music Club https://t.co/bznmnS0C2Y"
12,41934128,1530215334719938560,2022-05-27,Acabou de publicar uma foto em Cenário Balões https://t.co/t8eKp2ppDZ
13,16864622,1530208967133220865,2022-05-27,Drinking a Lager by Cerveja Carabina @ Achapa — https://t.co/MIuBHIHxnL
14,1316184874206756866,1530199307474837505,2022-05-27,"Ó senhor Deus, como o Senhor tem sido tão bom comigo!

Obrigado Deus maravilhoso! 🙏🏻🥺❤️ https://t.co/y1oThXKo8k"
15,19450758,1530196423907606529,2022-05-27,"Just posted a photo @ Aeroporto De Congonhas, São Paulo - SP https://t.co/w8yHE2yYup"
16,41385276,1530188490520113154,2022-05-27,a CÂMARA aprovou ontem o Projeto de lei: dia da Harmonização Facial.  O frouxo eleitor assustadiçamente submete-se. em Brasília https://t.co/sj2aYaCs7M
17,41934128,1530171309203808256,2022-05-27,Acabou de publicar uma foto em Cenário Balões https://t.co/B9K9kD4VZR
18,117719574,1530165437660639234,2022-05-27,Não é sobre voar! É sobre entender que temos uma verdadeira experiência @azulinhasaereas em Nas Nuvens https://t.co/bVgTRgKonn
19,1101575305,1530161884867047424,2022-05-27,Acabou de publicar uma foto em Hocca Bar - O Famoso do Mercadão https://t.co/JC6DZ3ahcv
20,47502733,1530148569461796865,2022-05-27,Extranhooo! em Parque das Bicicletas https://t.co/FMCzVSjhLZ
21,1108157878836383749,1530142063076974592,2022-05-27,Acabou de publicar uma foto em Pedro Bomfim Advocacia https://t.co/Ebe8aVmNSv
22,2761344034,1530126655280271362,2022-05-27,"Turma de teologia para leigos.
Instituto Itelse. São Paulo/SP
Preparando para servir nas pastorais. em Colégio Maria Imaculada https://t.co/GhULyaqdSb"
23,2230246254,1530124857890971650,2022-05-27,Minha lombar tá fudida bom dia 👍🏻
24,60207311,1530110654417252353,2022-05-27,Acabou de publicar uma foto em Planalto Paulista https://t.co/JQRr3lxvJi
25,60207311,1530110568572633088,2022-05-27,Acabou de publicar uma foto em Planalto Paulista https://t.co/1Si5jbsxSD
26,58921547,1530034591242797064,2022-05-27,Sextou braziu 🌶 https://t.co/gz3V2Qv7Pj
27,712803270155235328,1530007163690680329,2022-05-27,Acabou de publicar uma foto em Vidraçaria Proglass Temperados e Laminados https://t.co/xfL4Kz7njk
28,239765705,1529970653947912212,2022-05-26,"Seminário Empreendedorismo e Economia Azul em Memorial da América Latina, São Paulo https://t.co/xeSTQDzsoF"
29,60207311,1529944554258022435,2022-05-26,Acabou de publicar uma foto em Planalto Paulista https://t.co/HXaV5StE36
30,169964377,1529933074745671680,2022-05-26,Acabou de publicar uma foto em Faculdade de Educação - USP https://t.co/76Bp6a5VQG
31,1363359051757875203,1529892127861354520,2022-05-26,@ejaculassao eu tenho
32,76103370,1529889168008138753,2022-05-26,Acabou de publicar uma foto em Bourbon Street Music Club https://t.co/Lstpq5yTTX
33,37987887,1529878943255343109,2022-05-26,"Hoje, em São Paulo... em Seven Kings Moema - SP https://t.co/XV2QhnwRpE"
34,63057498,1529877987214213126,2022-05-26,@sphouseimoveis em SP HOUSE Imóveis https://t.co/LZxJXxX49A
35,261366155,1529868040287961089,2022-05-26,Acabou de publicar uma foto em Instituto da Cerveja Brasil https://t.co/nVIrASZFxu
36,145310619,1529863684067139584,2022-05-26,🏝🛬 Pra algum lugar em paz!
37,41934128,1529853794904952832,2022-05-26,Acabou de publicar uma foto em Cenário Balões https://t.co/It5cKZO2wO
38,1081903915816443904,1529818864472629249,2022-05-26,Acabou de publicar uma foto em Brasília https://t.co/4GNAmGrfqy
39,1146261631506309120,1529816802653519873,2022-05-26,"e se eu falar que eu trombei com o @manobrown, na padaria e perguntei se era ele mesmo"
40,1494774540236427268,1529810317622054913,2022-05-26,"https://t.co/Q3yCGrBkGf
#vemprafatec #fatecitatiba #itatibasp #jarinú #morungaba #louveirasp #jundiaí #varzeapaulista #atibaia #varzeapaulista #valinhos #vinhedo #itupeva em Itatiba, SP https://t.co/YTDqOGUgyj"
41,41934128,1529806592052445185,2022-05-26,"Cenário Balões Festival

O Maior Festival de Balões do Mundo!

De 22 a 26 de junho de 2022

São Paulo - Brasil

Inscrições até 31/05/2022

Link na Bio em Cenário Balões https://t.co/39KKMPREfy"
42,53353970,1529789233845747712,2022-05-26,"""Liberdade de voar num horizonte qualquer, liberdade de pousar onde o coração quiser.""

Cecília Meireles em Aéroport international de Congonhas https://t.co/9lwBwGuAua"
43,3240827291,1529781048430710785,2022-05-26,Acabou de publicar uma foto em Carro 0 https://t.co/4PEWrJDMal
44,1133548983345930245,1529777434433921028,2022-05-26,"Esse perfil é patrocinado pelo SAVANA ,fazendo a felicidade dos Tripulantes desde 1967 https://t.co/hP3wnqxJlS"
45,3240827291,1529756761816694785,2022-05-26,Acabou de publicar uma foto em Carro 0 https://t.co/MgjXqZgkmx
46,60207311,1529737081836163076,2022-05-26,Acabou de publicar uma foto em Planalto Paulista https://t.co/JNmKJVq7kd
47,60207311,1529737032234328064,2022-05-26,Acabou de publicar uma foto em Planalto Paulista https://t.co/eWMjylNNWZ
48,10224712,1529638138209083392,2022-05-26,Última noite minha com o time do @PicPayDev 😢 (até mês que vem) https://t.co/FjcOErIQLL
49,60207311,1529631600232779776,2022-05-26,Acabou de publicar uma foto em Planalto Paulista https://t.co/QeLVwqAVx8
50,67623216,1529629154412572672,2022-05-26,Acabou de publicar uma foto em Futuro https://t.co/czUmSD8tzy
51,25863274,1529627319081525250,2022-05-26,"Pensa num lanche bom! Tata Lanches: Ingredientes de primeira e preços de outra era! Bora ajudar a divulgar a lanchonete dessa família, na vila Santa Catarina, próximo ao aeroporto de Congonhas. Vale muito a pena sair da vila Madalena pra comer aqui. Compensa até a gasolina! https://t.co/KUvHmwoMBj"
52,920102627211382784,1529622986361298945,2022-05-26,Acabou de publicar uma foto em Esmalteria Vivian Sampaio https://t.co/PEFpW8qVMd
53,920102627211382784,1529622433048797184,2022-05-26,Acabou de publicar uma foto em Esmalteria Vivian Sampaio https://t.co/rGivfih43e
54,920102627211382784,1529622062716682240,2022-05-26,Acabou de publicar uma foto em Esmalteria Vivian Sampaio https://t.co/iIcsnr0k32
55,920102627211382784,1529621734521176066,2022-05-26,Acabou de publicar uma foto em Esmalteria Vivian Sampaio https://t.co/6f3QcJXdwT
56,41934128,1529613268209352705,2022-05-25,Acabou de publicar uma foto em Cenário Balões https://t.co/8H3fOKug7F
57,233383596,1529590180180594691,2022-05-25,Acabou de publicar uma foto em Brooklin São Paulo Z.sul https://t.co/U4P6u9DLY3
58,1143484026,1529588369935716356,2022-05-25,Comi 2 pedaços de bolo… já tô na esteira 🏃🏻‍♂️
59,92516483,1529565089518452737,2022-05-25,Acabou de publicar uma foto em La Nonna Di Lucca https://t.co/K6jvjh0Jtg
60,63057498,1529560567878393857,2022-05-25,"Hoje conheci os empresários Paulo e Sansão, proprietários da @sphouseimoveis, o café hoje foi por conta deles, na imobiliária mais charmosa da região. em SP HOUSE Imóveis https://t.co/pGaPh9a6Fv"
61,2935479502,1529505903325716481,2022-05-25,Acabou de publicar uma foto em Bourbon Street Music Club https://t.co/OP1wyrij0f
62,63588252,1529502017822920706,2022-05-25,"Música nova chegando!
registro com nosso querido Maestro #picapau 💕
@velocetterock

@jpsproducoes @paulodavidsoares #velocette #jpsproducoes #rock #pop #maestro #picapau em JPS studios https://t.co/45OP9Rxo0I"
63,76103370,1529489546240565250,2022-05-25,Acabou de publicar uma foto em Bourbon Street Music Club https://t.co/cbtqQNVom1
64,3028264996,1529488901081120768,2022-05-25,#SP1 Dia da atividade física! Vamos comemorar caminhando com o baby! https://t.co/a5Bvyoh1a1
65,76103370,1529488493973491714,2022-05-25,Acabou de publicar uma foto em Bourbon Street Music Club https://t.co/yKTzEXjEz1
66,76103370,1529485653783629824,2022-05-25,"Por motivos alheios a nossa vontade, o show do @EdinhoSantaCruz &amp; Banda que ocorreria essa 5ª feira (26.5) foi adiado, e nova data será anunciada em breve.

Informações: 11.5095.6100 em Bourbon Street Music Club https://t.co/P3NrnuGyzD"
67,83681351,1529478019320004608,2022-05-25,"Acabou de publicar uma foto em Tatit, Grande &amp; Macedo Leme Sociedade de Advogados https://t.co/1jUkX3MYco"
68,76103370,1529477410130956288,2022-05-25,Acabou de publicar uma foto em Bourbon Street Music Club https://t.co/6PPtLER3li
69,76103370,1529476670557765636,2022-05-25,Acabou de publicar uma foto em Bourbon Street Music Club https://t.co/xEk611kTxx
70,318056797,1529461878170198018,2022-05-25,"I'm at Bio Ritmo in São Paulo, SP https://t.co/T1jvo4WyKM https://t.co/oiZzguESuv"
71,1268949106371833857,1529427495929495553,2022-05-25,Lembranças cearenses ❤️ https://t.co/wPXqvJadjn
72,3324949967,1529426509194219521,2022-05-25,Acabou de publicar uma foto em Sendo Feliz! https://t.co/L4rkXYcZ47
73,81813407,1529412239706542081,2022-05-25,Acabou de publicar uma foto em Zazou Moda Gestante https://t.co/urRQRpR2f9
74,2761447893,1529313899194986497,2022-05-25,"Ibira park Basket em Ibirapuera, São paulo https://t.co/f6pwC97z4c"
75,41934128,1529250627318161409,2022-05-24,Acabou de publicar uma foto em Cenário Balões https://t.co/O9K8VjwM7L
76,76103370,1529236471932145666,2022-05-24,Acabou de publicar uma foto em Bourbon Street Music Club https://t.co/lo0w36BPC7
77,76103370,1529235987884347392,2022-05-24,Acabou de publicar uma foto em Bourbon Street Music Club https://t.co/xEiqs9WOIt
78,60207311,1529232713441484806,2022-05-24,Acabou de publicar uma foto em Planalto Paulista https://t.co/2p2MNo5iGP
79,60207311,1529220301539758087,2022-05-24,Acabou de publicar uma foto em Planalto Paulista https://t.co/YDMagUODQ1
80,60207311,1529208140318777349,2022-05-24,Tiradas do terraço aqui de casa. em Planalto Paulista https://t.co/zyhwFqV92E
81,43022979,1529185310772453377,2022-05-24,"Essa porra da #Méquizice é uma bosta. Pedi para adicionar coisa no meu sundea e demorou 15 min para fazerem. Passaram todos os pedidos na frente. 
Nenhum funcionário quer sair do padrão, não."
82,70141650,1529179994559217666,2022-05-24,O sorriso no rosto de quem é pago para bater nos outros. @ Campo Belo (district of São Paulo) https://t.co/zfSG62qXLW
83,196829993,1529165997256630275,2022-05-24,@jjuvencio @futebol_info @valuationfstyle Eu tenho um Ibiza Amarelo que na minha cabeça vale uns 100 mil... https://t.co/SPYWd07XdJ
84,34365712,1529145966296633344,2022-05-24,Acabou de publicar uma foto em In Musica Records - Audio &amp; Vídeo https://t.co/mULBDGPgDY
85,14424008,1529127490253254657,2022-05-24,Dormiu assim 🤣 #dog #viralata #cachorro em Pq Jabaquara https://t.co/ZHX00jbVoU
86,1422610957864521730,1529127077605163009,2022-05-24,"O canal do YT, Twitch e Spotify demorou pois uma parceria lamentavelmente foi desfeita mas se tudo der certo, vai ao ar nos próximos dias e os 2 primeiros convidados valem muito a pena. Não que os outros 2 próximos valham menos... #FIFA23 #eFootball2022 https://t.co/XWiSqDjX48"
87,1422610957864521730,1529126343799193606,2022-05-24,"Pessoal do Grupo do Telegram, fiquem atentos a quem recebeu números gratuitos da Rifa do PS5. Sorteio tá chegando #FIFA23 #FIFA22leaks #eFootball2022 sobre o canal... #eFootballPES2021SEASONUPDATE #eFootball"
88,3389628190,1529112382160654341,2022-05-24,Friozinho desnecessário 🥶🙄 https://t.co/oPUrDU0Rzj
89,41934128,1529086836429266945,2022-05-24,Acabou de publicar uma foto em Cenário Balões https://t.co/5y9OB0h6Ag
90,81813407,1529077113038446595,2022-05-24,Acabou de publicar uma foto em Zazou Moda Gestante https://t.co/y426Jpz21r
91,81813407,1529044063218896901,2022-05-24,Acabou de publicar uma foto em Zazou Moda Gestante https://t.co/yCgdq1qyL4
92,60207311,1529016855272247297,2022-05-24,Acabou de publicar uma foto em Planalto Paulista https://t.co/wV80dNC5Cu
93,60207311,1529016486404182016,2022-05-24,Acabou de publicar uma foto em Planalto Paulista https://t.co/NXfHTHqkub
94,112443520,1528936314632118273,2022-05-24,E assim 84 anos comemorando com muita alegria em rever depois de 2 anos #felizaniversario #parabens #tio em Campo Belo https://t.co/AKYCU8008d
95,911441196,1528919881088999425,2022-05-24,"COMPADRE, AMIGO, IRMÃO PRA VIDA TODA... TMJ SEMPRE PARCEIRO. em Memorial da América Latina, São Paulo https://t.co/s9mm39HarF"
96,146537061,1528903769584541702,2022-05-24,"6 aninhos do amor da minha vida 🐾🖤

#doglovers #frenchie #frenchbulldog #bulldogfrances #mybaby #6years #victorfirmino #meuamor #loveofmylife #maioramor #filho em Brooklin São Paulo Z.sul https://t.co/flIZDAzmfH"
97,41934128,1528892092545650689,2022-05-24,Acabou de publicar uma foto em Cenário Balões https://t.co/hqxZg7ZGZy
98,920102627211382784,1528882695958417408,2022-05-23,Acabou de publicar uma foto em Esmalteria Vivian Sampaio https://t.co/RXcmSS8F0r
99,920102627211382784,1528882156822335488,2022-05-23,Acabou de publicar uma foto em Esmalteria Vivian Sampaio https://t.co/WCXM8o756L
100,110688963,1528879984064008192,2022-05-23,"I'm at @NaturaldaTerra_ in São Paulo, SP https://t.co/nTnixaBCjE"
101,920102627211382784,1528878135038488576,2022-05-23,Acabou de publicar uma foto em Esmalteria Vivian Sampaio https://t.co/hL8YvWZM3W
102,39844068,1528876103275880448,2022-05-23,Acabou de publicar uma foto em Onde Ninguém Tem Juízo https://t.co/0DxIL7FJxM
103,920102627211382784,1528875648701317124,2022-05-23,Acabou de publicar uma foto em Esmalteria Vivian Sampaio https://t.co/hAA0etDT6x
104,60207311,1528868411073232896,2022-05-23,Acabou de publicar uma foto em Planalto Paulista https://t.co/atxyf4VRuF
105,35620080,1528868370636017665,2022-05-23,07/05/2022 sábado em RM's H https://t.co/8z4UnfxkTR
106,41934128,1528849028246536194,2022-05-23,Acabou de publicar uma foto em Cenário Balões https://t.co/LmbCBktOqh
107,721354011333521408,1528846923834195980,2022-05-23,Pequenos prazeres 😋 https://t.co/B2t4YQ5BXq
108,82635920,1528839732553293825,2022-05-23,"Acabou de publicar uma foto em Aeroporto De Congonhas, São Paulo - SP https://t.co/YUjYe6oVLM"
109,1519400295775805440,1528824882796146688,2022-05-23,"@LucianoHangBr @jdoriajr Eu sabia que iria chegar esse dia você mesmo foi pra avenida sambou pulou e se divertiu,depois nos mandou ficar em casa de alma lavada estamos nós por saber que você não vai concorrer , pena pois o recado pra você nas urnas seriam menos de 1% https://t.co/k9xoFzd26f"
110,77526259,1528818694268276738,2022-05-23,E lá vamos nós!
111,899658002353049600,1528818302532964354,2022-05-23,Ser grato é saber reconhecer a importância de todas as fases da sua vida. Inclusive as ruins e sempre dedicar algum tempo para ajudar seus irmãos. #volunteer #voluntarios @cruzvermelhabrasileira https://t.co/694GNcaRro
112,1242278529410031616,1528818015684415489,2022-05-23,Progress 🩸 @ninapaviani_tattoo 🩸 em Nina Paviani Tattoo https://t.co/U7xQP7sJuj
113,1317045145,1528812271295774720,2022-05-23,Partiu 🛫 https://t.co/pKgTp26Ewh
114,47048111,1528769349099655169,2022-05-23,Guga ídolo! @gugakuerten ❤️❤️❤️ #RolandGarros https://t.co/TwTzCk3XQa
115,1509234946682109959,1528766591000842241,2022-05-23,"Acabou de publicar uma foto em Aeroporto De Congonhas, São Paulo - SP https://t.co/fMWkQNtX93"
116,1509234946682109959,1528766502303739904,2022-05-23,"Acabou de publicar uma foto em Aeroporto De Congonhas, São Paulo - SP https://t.co/Pzw2WHXd12"
117,41934128,1528757014658273287,2022-05-23,Acabou de publicar uma foto em Cenário Balões https://t.co/yWi1gzwyC9
118,318056797,1528722022896893952,2022-05-23,"ALL BLUE (@ Bio Ritmo in São Paulo, SP) https://t.co/F8SbU6KtOw https://t.co/c8Ob67ZB8h"
119,224744440,1528719795545309195,2022-05-23,"Aproveitando o voucher que ganhei de aniversário 🧘🏻‍♀️ (@ Budha Spa Moema in São Paulo, SP) https://t.co/jMbDy97op9"
120,41934128,1528717327809892352,2022-05-23,Acabou de publicar uma foto em Cenário Balões https://t.co/zhpLZLS8bU
121,41934128,1528711794260422657,2022-05-23,Acabou de publicar uma foto em Cenário Balões https://t.co/ynAUVPo6YJ
122,2819017387,1528681251674247173,2022-05-23,"Bom dia, CONCORDA ⁉️ https://t.co/NThmamf5aT"
123,66531096,1528668474330865665,2022-05-23,"Segunda-feira e eu começando a trabalhar antes do sol… em Aeroporto De Congonhas, São Paulo - SP https://t.co/Ns8ncO26ja"
124,60207311,1528664662086123521,2022-05-23,Acabou de publicar uma foto em Planalto Paulista https://t.co/Bhtt6UWDOO
125,60207311,1528664603676270594,2022-05-23,Acabou de publicar uma foto em Planalto Paulista https://t.co/WfXgOyxb5X
126,82637153,1528658926761299968,2022-05-23,Bom dia caraio!
127,107203070,1528644615053639680,2022-05-23,Bom dia! 12º 🥶 https://t.co/BqWstCPher
128,318056797,1528631135999299584,2022-05-23,I'm at Uffa! Cheguei em Casa! in São Paulo https://t.co/jObIqZlTls https://t.co/dNNLe929td
129,219149667,1528557777878138881,2022-05-23,"Lipo enzimática resultado de 3 sessões  agende sua avaliação.
11982892121
#lipodepapadaenzimatica #yaluronpen #canetapressurizada #semagulha  #semdor em Studio Michelle Antonucci https://t.co/kWrgOEcBcp"
130,1157650919770796034,1528544957065220096,2022-05-23,"Louvado seja o Senhor pela inauguração do nosso cenáculo. De São Paulo... às Nações! 🙏🏻🌍❤

""Pede-me, e te darei as nações como herança e os confins da terra como tua propriedade"". Salmo 2:8

#AliançaAeroporto #FamiliaAliancaAeroporto #UpperRoom https://t.co/lb36TcRhIf"
131,1368920346347376641,1528521267422236672,2022-05-22,Um olho na foto e o outro no @subzeroproject 😍 mais um show dos melhores para a conta!! em CLUB A Oficial https://t.co/NapJP22Erp
132,239427695,1528518134231097345,2022-05-22,"Foto de uma semana atrás por que sou desses, não posto nada na hora certa. 

.
.
.
.
.
.
.
.
.
#bloodmoon #moon #night #fullmoon  #vscocam #vsco #portraitphotography #art #goodmorning #portrait #photography em Congonhas https://t.co/pK9xRHBGz7"
133,41934128,1528490129236668417,2022-05-22,Acabou de publicar uma foto em Cenário Balões https://t.co/Fg8UAGaFL6
134,214562966,1528483929472253952,2022-05-22,Acabou de publicar uma foto em Trattoria Nacional https://t.co/ZL0AZ0MHyL
135,73422860,1528469122811629569,2022-05-22,Até a próxima Sampa! https://t.co/43a1T6dAvP
136,1320535519,1528468497239523328,2022-05-22,☁️🌤✈ em Congonhas https://t.co/wZHXVLxJyo
137,318056797,1528418414078853122,2022-05-22,"I'm at Bio Ritmo in São Paulo, SP https://t.co/BfFXl3Utme https://t.co/wNTPpAlqj5"
138,2602508179,1528412541088681985,2022-05-22,"#SP #Brasil #Food #eatrealfood #photooftheday #delicious #Instafood #dietasaudavel #aipapai #Chama 

Dieta saudável... em jardim Oriental jabaquaraS.P https://t.co/5rpgkaALgO"
139,2602508179,1528409458933743617,2022-05-22,"#SP #Brasil #eatrealfood #food #photography #photooftheday #delicious #aipapai #dietasaudavel #Bruto #rustico
#sistematico

Vem mi mim gostosura ... em jardim Oriental jabaquaraS.P https://t.co/jmhG0HwbqX"
140,81813407,1528409199822131203,2022-05-22,Acabou de publicar uma foto em Zazou Moda Gestante https://t.co/UhrUjXIXVi
141,41934128,1528405898317680640,2022-05-22,Acabou de publicar uma foto em Cenário Balões https://t.co/g2YIl7qV1f
142,201967265,1528404909871222785,2022-05-22,"Job, partiu Goiânia! (@ Aeroporto de São Paulo / Congonhas in São Paulo, SP) https://t.co/OQ0cZKbJx6 https://t.co/NeXfw6qdxg"
143,81813407,1528402844038189056,2022-05-22,Acabou de publicar uma foto em Zazou Moda Gestante https://t.co/2JOffIFjt2
144,2602508179,1528398962041884672,2022-05-22,"#SP #Brasil #Mybike #scooter #Yamaha #nmax #Clean #photography #bwphotography 

Banho tomado... em jardim Oriental jabaquaraS.P https://t.co/XoePaTttq9"
145,48161519,1528389120040398853,2022-05-22,"Do story pro feed.
Horário de descanso do trabalho, hora de blougueirar!
.
.
.
#sp #vilaolimpia #hsp #hospitalsantapaula #dostoryprofeed #semfiltro #farmacia #farmaceutico
#bicoitando #biscoito #blogueirinha https://t.co/gleujD0M1e"
146,808018885404454912,1528363356817612801,2022-05-22,"💚🐷
@Palmeiras 
@AllianzParque https://t.co/rrop0kSdAx"
147,60207311,1528344548526678018,2022-05-22,Acabou de publicar uma foto em Planalto Paulista https://t.co/76i0eguTi7
148,60207311,1528286334267412480,2022-05-22,Acabou de publicar uma foto em Planalto Paulista https://t.co/MDh9xoFT5H
149,35620080,1528204830342258688,2022-05-22,Acabou de publicar uma foto em Esporte Clube Sírio https://t.co/tPax8gpBad
150,35620080,1528196750640656384,2022-05-22,Acabou de publicar uma foto em RM's H https://t.co/yYc0ialdJn
151,1155622349309394949,1528180391319945216,2022-05-22,"Agende vc também e surpreenda-se
👉 https://t.co/e7l5113OGN https://t.co/VUut2ddtVK"
152,1466800514188955652,1528165064758513666,2022-05-22,"@lorenapimenta_ @ni_palladino A busca do amor esta no ar, do entendimento, respeito recíproco, andar lado lado de mãos dadas.. felizasso que ainda existem pessoas que lembram do amor e o buscam em sua plenitude.
Filha te amo, desejo toda felicidade... Parabéns pela linda mulher que você esta se tornando. 🙌"
