,author_id,tweet_id,created_at,text
183,920102627211382784,1529622062716682240,2022-05-26,Acabou de publicar uma foto em Esmalteria Vivian Sampaio https://t.co/iIcsnr0k32
184,920102627211382784,1529621734521176066,2022-05-26,Acabou de publicar uma foto em Esmalteria Vivian Sampaio https://t.co/6f3QcJXdwT
185,41934128,1529613268209352705,2022-05-25,Acabou de publicar uma foto em Cenário Balões https://t.co/8H3fOKug7F
186,233383596,1529590180180594691,2022-05-25,Acabou de publicar uma foto em Brooklin São Paulo Z.sul https://t.co/U4P6u9DLY3
187,1143484026,1529588369935716356,2022-05-25,Comi 2 pedaços de bolo… já tô na esteira 🏃🏻‍♂️
188,92516483,1529565089518452737,2022-05-25,Acabou de publicar uma foto em La Nonna Di Lucca https://t.co/K6jvjh0Jtg
189,63057498,1529560567878393857,2022-05-25,"Hoje conheci os empresários Paulo e Sansão, proprietários da @sphouseimoveis, o café hoje foi por conta deles, na imobiliária mais charmosa da região. em SP HOUSE Imóveis https://t.co/pGaPh9a6Fv"
190,2935479502,1529505903325716481,2022-05-25,Acabou de publicar uma foto em Bourbon Street Music Club https://t.co/OP1wyrij0f
191,63588252,1529502017822920706,2022-05-25,"Música nova chegando!
registro com nosso querido Maestro #picapau 💕
@velocetterock

@jpsproducoes @paulodavidsoares #velocette #jpsproducoes #rock #pop #maestro #picapau em JPS studios https://t.co/45OP9Rxo0I"
192,76103370,1529489546240565250,2022-05-25,Acabou de publicar uma foto em Bourbon Street Music Club https://t.co/cbtqQNVom1
193,3028264996,1529488901081120768,2022-05-25,#SP1 Dia da atividade física! Vamos comemorar caminhando com o baby! https://t.co/a5Bvyoh1a1
194,76103370,1529488493973491714,2022-05-25,Acabou de publicar uma foto em Bourbon Street Music Club https://t.co/yKTzEXjEz1
195,76103370,1529485653783629824,2022-05-25,"Por motivos alheios a nossa vontade, o show do @EdinhoSantaCruz &amp; Banda que ocorreria essa 5ª feira (26.5) foi adiado, e nova data será anunciada em breve.

Informações: 11.5095.6100 em Bourbon Street Music Club https://t.co/P3NrnuGyzD"
196,83681351,1529478019320004608,2022-05-25,"Acabou de publicar uma foto em Tatit, Grande &amp; Macedo Leme Sociedade de Advogados https://t.co/1jUkX3MYco"
197,76103370,1529477410130956288,2022-05-25,Acabou de publicar uma foto em Bourbon Street Music Club https://t.co/6PPtLER3li
