,author_id,tweet_id,created_at,text
0,1328891287714586625,1560052233106067457,2022-08-17,Boas coisas vindo por aí! ⚽️🙌🙏🏻 https://t.co/DJTRSu5KAK
1,270375224,1560014099907354624,2022-08-17,Acabou de publicar uma foto em Willi Willie Bar e Arqueria https://t.co/KQ248S0pqY
2,79058432,1560013304176705537,2022-08-17,"Vamos lá, em busca de mais uma classificação! https://t.co/scvxyJdUfA"
3,1180547494436102145,1559997642368761856,2022-08-17,2 rins foram vendidos para comprar esses cappuccinos e esse Donut no aeroporto kkk 🤡 https://t.co/pExvhNDF4u
4,19383548,1559984809774047233,2022-08-17,"Qualquer semelhança com a minha sala-de-aula não é mera coincidência.
#recadinho @ Rui Bloem https://t.co/mCm89olzVj"
5,1049847515409997825,1559982417989046273,2022-08-17,"Baixada, tô chegando! https://t.co/DtyBerb7q6"
6,106590007,1559975347248054272,2022-08-17,#blessoptical #blessoptical_brazil #blessoptical_brasil #cristal #translucido #leve #descolado #descontraido #foradacurva #handmade #estilo #conceito #personalidade #nadaconvencional em Bless Optical https://t.co/niMjhYgpzH
7,106590007,1559975025104588800,2022-08-17,#blessoptical #blessoptical_brazil #blessoptical_brasil #cristal #translucido #leve #descolado #descontraido #foradacurva #handmade #estilo #conceito #personalidade #nadaconvencional em Bless Optical https://t.co/7WAJdnC5Eq
8,106590007,1559974620014514183,2022-08-17,#blessoptical #blessoptical_brazil #blessoptical_brasil #cristal #translucido #leve #descolado #descontraido #foradacurva #handmade #estilo #conceito #personalidade #nadaconvencional em Bless Optical https://t.co/x70I9FSh3z
9,81813407,1559964431387398145,2022-08-17,Acabou de publicar uma foto em Zazou Moda Gestante https://t.co/ElOFfOz0Pi
10,780201362,1559963494690217985,2022-08-17,"I'm at Aeroporto de São Paulo / Congonhas in São Paulo, SP https://t.co/yW2FYulddT"
11,1049847515409997825,1559951075255410694,2022-08-17,"Reparem nas livrarias dos grandes aeroportos deste Brasil varonil para entender como chegamos neste estágio. Só se acha livro de autoajuda, mentoria, empreendedorismo, teorias fáceis e prontas, como ser bem sucedido, como ficar rico. Penei para achar um livro decente"
12,1101575305,1559940755543576577,2022-08-17,Acabou de publicar uma foto em Anima Vinum Brasil https://t.co/yDaLxz9lFs
13,3895005683,1559933619526807552,2022-08-17,Acabou de publicar uma foto em Espaço Drina Vieira https://t.co/9kK9vl7MXc
14,4825105985,1559921099613151232,2022-08-17,A sensualidade da raça é um dom 🩰🍒 em Caldas Novas-Goiás https://t.co/BvW9Ym6NRk
15,1014135602189660161,1559912426786750466,2022-08-17,Na santa paz de Deus 🕊 https://t.co/gfrTwUcPPK
16,1382791465248681987,1559910300593405957,2022-08-17,Vantagens de namorar uma barista…vc ganha chocolate quente kkkkk amo❤️ https://t.co/NVHKyDc31z
17,3240827291,1559888972066594821,2022-08-17,Acabou de publicar uma foto em Carro 0 https://t.co/DVPUiSADrH
18,3180486071,1559879433439305731,2022-08-17,Acabou de publicar uma foto em Shopping Ibirapuera https://t.co/4IBCOEcB0l
19,99162230,1559877444315881472,2022-08-17,"#voacanarinho 

Ano de Copa do Mundo.

Vem o Hexa! 

#copadomundo #qatar2022 em Aeroporto De Congonhas, São Paulo - SP https://t.co/2jwnP31PLl"
20,81813407,1559874365751042049,2022-08-17,Acabou de publicar uma foto em Zazou Moda Gestante https://t.co/xPwXgHWuPg
21,2664563770,1559863839667232770,2022-08-17,Esperando próximo voo para destino final ✈️ https://t.co/FK20ybqGiA
22,2664563770,1559863558359449602,2022-08-17,Madrugar para ir pro aeroporto pra férias a gente acorda até sorrindo.. agora vai acordar pra trabalhar kkk oiiiiii férias 🥰 Bom diaaaa!!!
23,17753103,1559859212750135304,2022-08-17,"Thanks @jondean1959 and @trurohighschoolforgirls for the international partnership with @ukbra_ the pioneer binational team to compete in International Finals at Goodwood-UK in October 9th, 2022. https://t.co/dm9xRszVyP"
24,60207311,1559853617670230016,2022-08-17,Acabou de publicar uma foto em Planalto Paulista https://t.co/9tSgH5zvek
25,60207311,1559853366733324289,2022-08-17,Acabou de publicar uma foto em Planalto Paulista https://t.co/I7LaozG2dI
26,976185744443236352,1559828503834533889,2022-08-17,Reserva cinco da manhã ! E o humor como tá ? https://t.co/eQcn5o2hMN
27,30268856,1559740434741661696,2022-08-17,@LATAM_BRA @LATAMAirlines  #LATAM https://t.co/zFcZ5LXPl3
28,82248385,1559679016277262337,2022-08-16,Com esse tanto de triplex que o Abel anda construindo ele vai poder trazer não só a família pro Brasil... https://t.co/e1eiSOqUDE
29,202808816,1559670564066828290,2022-08-16,Acabou de publicar uma foto em Spicyclub https://t.co/tGa0dIXzCk
30,60207311,1559663070317871104,2022-08-16,Acabou de publicar uma foto em Planalto Paulista https://t.co/NAr9sOFP6D
31,233197339,1559649362166566912,2022-08-16,Acabou de publicar uma foto em Planalto Paulista https://t.co/v7lHCAY3lU
32,1463897153626066945,1559629857386004482,2022-08-16,"academiazinha de manhã, almocinho com a migs e salaozin! 💖 - mas vou explicar: fazemos negócio todo mês, e todo mês quando quitamos nosso negócio saímos pra almoçar e pegar uma tarde no salão! =) mês passado foi no motel.. esse mês fomos no #TerraFruta https://t.co/6f1mWHSRkB"
33,1530108132592074752,1559626478240890881,2022-08-16,https://t.co/hevtBjCQNe
34,1221986103672086530,1559626058713939969,2022-08-16,Estou esperando a mais de 1 Hora para passar no Médico. Péssimo Antendimento. https://t.co/aDxZnXd3aw
35,3895005683,1559609626110427138,2022-08-16,Acabou de publicar uma foto em Espaço Drina Vieira https://t.co/OiJ3zSiZ3W
36,106590007,1559598268841168898,2022-08-16,#blessoptical #blessoptical_brazil #blessoptical_brasil #acessorios #descolado #estilo #conceito #personalidade #sicurezzaperocchiali #portaoculos em Bless Optical https://t.co/eOBc6HeC4e
37,106590007,1559597738693603328,2022-08-16,#blessoptical #blessoptical_brazil #blessoptical_brasil #acessorios #descolado #estilo #conceito #personalidade #sicurezzaperocchiali #portaoculos em Bless Optical https://t.co/MlQl910Iz2
38,106590007,1559594569737568261,2022-08-16,#blessoptical #blessoptical_brasil #blessoptical_brazil #acessorios #pingente #portaoculos #sicurezzaperocchiali #descolado #estilo #conceito #personalidade #nadaconvencional em Bless Optical https://t.co/xWuCFVeQBu
39,65275699,1559560379352715265,2022-08-16,indescritível a alegria de ter essa máquina na residência médica https://t.co/lTs9yOydUt
40,1453366417152172038,1559540645605392385,2022-08-16,Cadê os paulistas? https://t.co/bhENnhxmLl
41,19383548,1559540069547102209,2022-08-16,"Meio a contragosto às vezes, mas…
#recadinho @ Rui Bloem https://t.co/JyGtnlBubk"
42,19383548,1559539644911460360,2022-08-16,#recadinho (de ontem) @ Rui Bloem https://t.co/5MsSImCIlY
43,1357788596896477186,1559511531942969347,2022-08-16,"Oiiin, bom dia amores! 🥳
Alô pessoal de BH, tô chegando para uma temporada de 15 dias na capital. Agende seu horário! https://t.co/nnbdKF67CG"
44,55222141,1559488106797142016,2022-08-16,"Prontos para a partida @LATAM_BRA 😉🛫 
#avgeek #aviacao https://t.co/r5knUvG7zg"
45,1487807168413900802,1559476485945262080,2022-08-16,Vô ali rapidão e já volto!! https://t.co/CxwdUM8mDR
46,1523352254035677185,1559474605773017090,2022-08-16,Bom diaaaaaa com trânsito as 06:30 am hahahaha ah sp 😅👩🏼‍🦰🚗
47,318056797,1559471641763119104,2022-08-16,I'm at Uffa! Cheguei em Casa! in São Paulo https://t.co/Qj5K3iKvPm https://t.co/rvwKitbwvU
48,336550037,1559468331551395843,2022-08-16,"I'm at Aeroporto de São Paulo / Congonhas in São Paulo, SP https://t.co/rDKmGCx4lK"
49,60207311,1559467162749878274,2022-08-16,Acabou de publicar uma foto em Planalto Paulista https://t.co/NxTo3Na4dT
50,60207311,1559467087550066688,2022-08-16,Acabou de publicar uma foto em Planalto Paulista https://t.co/9AnBHSVr7Z
51,1390071845911678985,1559462728850456576,2022-08-16,"Viajar é bom, mas voltar é melhoooor! Brasília, meu amor, estou chegando! 😍
Bom diaaa!"
52,273163509,1559452637661126656,2022-08-16,Boraaaaaa!!!! Sol nem nasceu na fazendinha ainda!! https://t.co/mS45pEO1oQ
53,90432796,1559335264325189634,2022-08-16,Acabou de publicar uma foto em La Nonna Di Lucca https://t.co/Uzeeg13KL9
54,3240827291,1559324509081141248,2022-08-15,Acabou de publicar uma foto em Carro 0 https://t.co/GVGV0GW1eB
55,60207311,1559304279747428353,2022-08-15,Acabou de publicar uma foto em Planalto Paulista https://t.co/mdeqyeODPh
56,2602508179,1559290622913167360,2022-08-15,"#Sp #Brasil #skyphotography #skycolors #photography #picoftheday #gratidao 

Mais um dia.... @ jardim Oriental jabaquaraS.P https://t.co/RumcF5LXCI"
57,52809507,1559286560423550976,2022-08-15,"I'm at Aeroporto de São Paulo / Congonhas in São Paulo, SP https://t.co/7fvI3TC3Sj"
58,1221986103672086530,1559272790540357632,2022-08-15,"Que Ótimo antendimento aqui na UBS, vc chega aqui e estão fazendo a Dança das Cadeiras na Recepção, aí ficam Olhando para a sua Cara enquanto vc espera para falar com alguém para ver se o Médico quer te Atender ou não, este é o Governo Bolsomerda. 

#PrefeituraSP
#Saudepublica"
59,85382677,1559246002019860487,2022-08-15,Gastando os dois rins porque Leopoldo resolveu romper mais um ligamento 🫢
60,92516483,1559243032469405699,2022-08-15,"Um rolo que serviria só pra limpar os óculos da apresentadora, nas mãos certas vira objeto de inspiração para fotos incríveis.

#videologiaproducoes #fotos #fotocriativa em Videologia Produções https://t.co/6A8zlQOs8R"
61,780201362,1559224328889171970,2022-08-15,"I'm at Aeroporto de São Paulo / Congonhas in São Paulo, SP https://t.co/6VQuu7Gjjp"
62,1363573075845988357,1559223783969492999,2022-08-15,"Atualizando o Feed 🧡🧡🧡
@medicaldiscoverybr 
.
.
#medicaldiscovery #work em Medical Discovery Brasil https://t.co/gRYDTFzfWz"
63,1558683060832460801,1559188393040420867,2022-08-15,Pra começar a semana …. Perco meus AirPods na estação de metrô ….  Aí o universo literalmente joga esse papel na minha cara ( trazido por um ventinho kkkk https://t.co/arSzUKXb15
64,41934128,1559183376367714309,2022-08-15,Acabou de publicar uma foto em Cenário Balões https://t.co/hQJj14FkEa
65,54100700,1559172798051979265,2022-08-15,"I'm at Aeroporto de São Paulo / Congonhas in São Paulo, SP https://t.co/XZGj18yQbF"
66,1408187426011496450,1559149304379473925,2022-08-15,"Olha essa turnê realmente merece se manter com a qualidade da estreia no CTN e na gravação de Manaus, não estou criticando só estou falando o óbvio, e que seja feito o que a produção e ela achar o melhor.
Mas em questão ao áudio do DVD lançado hoje, gente está perfeito,parabéns"
67,1347077785,1559148359897829376,2022-08-15,"Eu acho que tinha que fixar a alternância do nome do programa e do tempo no GC, igual são nos jornais locais… @GloboNews #GloboNewsEmPonto https://t.co/mYz0JslvVM"
68,26815618,1559128274885906438,2022-08-15,Bora ali em Brasília rapidão
69,60207311,1559117166653456385,2022-08-15,Acabou de publicar uma foto em Planalto Paulista https://t.co/bLCZK5OW3u
70,60207311,1559116522303459333,2022-08-15,Acabou de publicar uma foto em Planalto Paulista https://t.co/hgWbC0UnVS
71,340611708,1559106958069616640,2022-08-15,Acabou de publicar uma foto em Ehab Gadalla - Escola de Dança https://t.co/4rwSL9uu0o
72,60176766,1559099158925115394,2022-08-15,"sem revista aleatória. esta semana será só de vitórias 👊🏾 (@ Aeroporto de São Paulo / Congonhas in São Paulo, SP) https://t.co/I5nSEAyRvx"
73,60207311,1559039472708329473,2022-08-15,"Linda cachorrinha para adoção.
Contato com                          Tania (11) 98221 8812 .  Muito obrigado.
Favor compartilhar. em Planalto Paulista https://t.co/UulD6ky6bo"
74,1461601153133776896,1558985968278978562,2022-08-15,Boa noite 🥱 https://t.co/VZ0BdCjddW
75,172538675,1558981744094838784,2022-08-15,Acabou de publicar uma foto em Beco Hexagonal https://t.co/o1f5gkvr9J
76,218972831,1558981134146539520,2022-08-15,"Onde quer que viva, esse é o seu templo... em Templo zu Lai - Cotia https://t.co/8eKmIZveRL"
77,1245692249817731072,1558975940256055296,2022-08-15,"Algumas pessoas até tentam disfarçar, mas não adianta, eu percebo exatamente o que elas têm a oferecer. 

As atitudes gritam por trás do discurso doce. O verniz não dura muito tempo. 

Eu aparento ser jovem, mas eu não nasci ontem."
78,1245692249817731072,1558969051677859841,2022-08-15,O mundo seria um lugar melhor se as pessoas se perguntassem: e se fosse comigo?
79,1245692249817731072,1558968630431326208,2022-08-15,"Carrego o fardo de ter o coração tão bom, ao ponto de me chatearem e eu ainda buscar entender o lado da pessoa."
80,3558186623,1558943480990388224,2022-08-14,"Sol , amigos , goleada !!! 
Melhor impossível 🇾🇪❤⚘ @SaoPauloFC 
@mttfpr  🤪 https://t.co/axhXoU6oEV"
81,765684787,1558943046636634113,2022-08-14,"Partiuuuuu Brasília 🥰🤘🏻❤️🙌🏻😊 (@ Portão 11 in São Paulo, SP) https://t.co/E4nhTpKAmd"
82,3381522531,1558932952700125184,2022-08-14,"Derbys em 2022:
@palmeiras 2x1 #Corinthians
Palmeiras 3x0 @corinthians
🦨0x1 Palmeiras

Já pode ir no cartório
🇳🇬🐷🇳🇬
#Palmeiras #Brasileirão #CampeonatoBrasileiro #BR22 em Arena Entulhao https://t.co/AnTlasBZcU"
83,60207311,1558931559058743297,2022-08-14,Acabou de publicar uma foto em Planalto Paulista https://t.co/UgtKur7mN8
84,815100174284587008,1558919084468830214,2022-08-14,"Um maravilhoso dia pro dono da melhor caipirinha desse mundo! Feliz dia meu pai , obrigada por realizar todos meus sonhos … Te escolheria todas as vezes possíveis  para ser meu pai ! Te amo 🖤 #diadospais #paiefilha https://t.co/BgxDemtzNN"
85,52792186,1558910874777174021,2022-08-14,2 anos da Clara 🥳 (@ Ateliê Creative Party in São Paulo) https://t.co/tugVZyjXsa
86,1245692249817731072,1558906951572066304,2022-08-14,Prepare-se para você ser descartado quando você não aceitar ser manipulado!
87,2602508179,1558881784980541440,2022-08-14,"#Sp #Brasil #badassbartender #Drinks #instadrinks #chama #deubom #tateno #Vaisegurando #malibu #absolutvanilia #aipapai 

Play no domingão em jardim Oriental jabaquaraS.P https://t.co/y6RTvj1Y1C"
88,76103370,1558871940395175936,2022-08-14,Acabou de publicar uma foto em Bourbon Street Music Club https://t.co/bqERUw1aAu
89,76103370,1558870651762614272,2022-08-14,Acabou de publicar uma foto em Bourbon Street Music Club https://t.co/SpChRH72nh
90,61359473,1558863046365261824,2022-08-14,#felizdiadospais ♥️ em Campo Belo (district of São Paulo) https://t.co/2Fyyvq5Bda
91,81813407,1558848864593010688,2022-08-14,Acabou de publicar uma foto em Zazou Moda Gestante https://t.co/W1GnIGFCwg
92,107700921,1558844514055462912,2022-08-14,Acabou de publicar uma foto em Esporte Clube Sírio https://t.co/QI9VFC0P9h
93,2602508179,1558830357486751745,2022-08-14,"#Sp #Brasil #Yamaha #motorcycle #freedom #beliveinyourself #thenext 
#photography #photooftheday #chama #Ride 

Pode ser que... em Nacar Motorcycle Yamaha https://t.co/Z2byx3lghm"
94,83681351,1558794351463092224,2022-08-14,"Acabou de publicar uma foto em Tatit, Grande &amp; Macedo Leme Sociedade de Advogados https://t.co/DrHbjKJKqJ"
95,1245692249817731072,1558787798831960066,2022-08-14,"Os pontos de vistas e problemas de outras pessoas podem ser contagioso.

- Ecpiteto"
96,2768216423,1558762896292716546,2022-08-14,"Se você não faz tem alguém que vai fazer .

#Bomdia ☀️"
97,60207311,1558748546442170368,2022-08-14,Para todos os Papais. em Planalto Paulista https://t.co/em4gsvLtpq
98,60207311,1558746843672154112,2022-08-14,Acabou de publicar uma foto em Planalto Paulista https://t.co/3egmBvo4ky
99,60207311,1558743320158818304,2022-08-14,Acabou de publicar uma foto em Planalto Paulista https://t.co/6qLKMn9Iiv
100,22576338,1558715654324330496,2022-08-14,"Bailado Roots (@ Clube Esportivo Helvétia - @clubehelvetia in São Paulo, SP) https://t.co/IgIETR1QcW"
101,261263814,1558652202398482434,2022-08-14,"Com o parceiro de longa data, Edson Lopes, da Primer Air, especialista em pintura de aviões executivos. em Aeroporto De Congonhas, São Paulo - SP https://t.co/Np1W9MhDSk"
102,149789964,1558616311831355392,2022-08-14,FINALMENTE!!!!! Como é difícil comer #yakitori nessa cidade! #サンパウロ　#ごちそうさまでした ＃ブラジル @ Yakitori Restaurante https://t.co/Hp2y7Bqq97
103,60207311,1558608212462632961,2022-08-14,Acabou de publicar uma foto em Planalto Paulista https://t.co/t3K0E7Sj9a
104,60207311,1558608046129029122,2022-08-14,Acabou de publicar uma foto em Planalto Paulista https://t.co/gdPM0QUxg3
105,60207311,1558607894295318529,2022-08-14,Acabou de publicar uma foto em Planalto Paulista https://t.co/MmexCCp2D0
106,60207311,1558606208340303872,2022-08-14,Acabou de publicar uma foto em Planalto Paulista https://t.co/BgnQvifN2o
107,60207311,1558605276969725952,2022-08-14,Acabou de publicar uma foto em Planalto Paulista https://t.co/9BegalLmcK
108,60207311,1558605222540324865,2022-08-14,Acabou de publicar uma foto em Planalto Paulista https://t.co/qhTkJFdMkm
109,60207311,1558605090801553411,2022-08-14,Acabou de publicar uma foto em Planalto Paulista https://t.co/BV5jkx9Avs
110,45731030,1558597587531403269,2022-08-13,Dia de combate na @casa.medieval com direito a gritos e faíscas! em Casa Medieval https://t.co/faFCAT0LVY
111,1513885897036607489,1558594171685855232,2022-08-13,Um pouquinho de NewPOP 💕 em Coletivo Geek https://t.co/f0vnQB3t6H
112,133386591,1558582325142851585,2022-08-13,Acabou de publicar uma foto em Boissucanga https://t.co/PycVi6g6IZ
113,1245692249817731072,1558571390139355143,2022-08-13,"quem não entende o meu sarcasmo
tão pouco entenderá a minha ironia"
114,1248216462843666433,1558541737211183106,2022-08-13,Just because @ Campo Belo (district of São Paulo) https://t.co/vIb1bMMyNH
115,952134710,1558536679752867840,2022-08-13,"Partiu BH ✈️

📸: @jefdelgado https://t.co/NtkS8ASelX"
116,3895005683,1558522316233084933,2022-08-13,"Red 🍑 ❤️

#red #corruivo #ruivo #red #cobre #babyliss #babylisspodrinho #hair #hairstyle #hairdresser #espacodrinavieira #brooklinindica #saopaulo em Espaço Drina Vieira https://t.co/NJHSaXeN1m"
117,76103370,1558505108727529474,2022-08-13,Acabou de publicar uma foto em Bourbon Street Music Club https://t.co/ieYxa5iSP4
118,26484337,1558500155992727552,2022-08-13,Drinking an EVERTREZE PILSEN by Cervejaria EverBrew @ Seven Kings — https://t.co/xeWeB6mjSE
119,61359473,1558481504459784192,2022-08-13,#felizdiadospais❤ #martina em Campo Belo (district of São Paulo) https://t.co/Xl0gMWPps6
120,318056797,1558475481606930432,2022-08-13,"I'm at Autoposto Ouro 22 (BR) in São Paulo, SP https://t.co/6VQMI2uE7c"
121,171510934,1558473342079877120,2022-08-13,"Partiu Brasília! 
@_esseforroenosso em Aeroporto De Congonhas, São Paulo - SP https://t.co/HLuzFzgS0v"
122,318056797,1558464755760828417,2022-08-13,I'm at Oba Hortifruti Farm in São Paulo https://t.co/qsm7ot6GW4 https://t.co/btWcTLtF5y
123,844773661,1558459477543763968,2022-08-13,Passeio 🥰🐶 #Joy💙 https://t.co/VUFxnO12oY
124,147034786,1558455082185785345,2022-08-13,Dia da Família na escola dos sobrinhos Henrique e Bianca 🥰🥰🥰🥰 em Rede Decisão Unidade Mascote https://t.co/kVqcFAcfGz
125,243662422,1558448911290929153,2022-08-13,"Só ando sonhando com tragédia, se louco! Mal dormi essa noite direito 🥲"
126,2837496571,1558448424088911874,2022-08-13,Alone on a rooftop with a mask...No one within KM...Idiots are everywhere.. https://t.co/Q7qJfkcxB9
127,106590007,1558436957189033984,2022-08-13,#blessoptical #blessoptical_brasil #blessoptical_brazil #verde #estilo #conceito #personalidade #nadaconvencional #foradopadrao #handmadeinitaly🇮🇹 #descolado em Bless Optical https://t.co/qNi5hobjsG
128,106590007,1558436611712581632,2022-08-13,#blessoptical #blessoptical_brasil #blessoptical_brazil #verde #estilo #conceito #personalidade #nadaconvencional #foradopadrao #handmadeinitaly🇮🇹 #descolado em Bless Optical https://t.co/75HcKnQTJK
129,106590007,1558436210208489472,2022-08-13,#blessoptical #blessoptical_brasil #blessoptical_brazil #verde #estilo #conceito #personalidade #nadaconvencional #foradopadrao #handmadeinitaly🇮🇹 #descolado em Bless Optical https://t.co/gDtecQpqfi
130,164142088,1558426056654217216,2022-08-13,"HOJE o point é no @steelbarsp galera. Espero vocês lá às 19h30. Abs!!!! 

Convidados | @gibafavery na batera e @ximbauchyama no baixo 

#faiskaborges #faiska #sp #steelbar #moema em Steel Bar SP https://t.co/yfN6VLr87X"
131,81813407,1558424969910034432,2022-08-13,Acabou de publicar uma foto em Zazou Moda Gestante https://t.co/hWSV9ruY4u
132,81813407,1558422738183897088,2022-08-13,Acabou de publicar uma foto em Zazou Moda Gestante https://t.co/YDcZ4EBAcC
133,106774618,1558421780230017024,2022-08-13,"I'm at Latitude Workspaces in São Paulo, SP https://t.co/l1rrX8xS8m https://t.co/Db3FdC2DKz"
134,81813407,1558408552775094272,2022-08-13,Dica de look da #zazoumodagestante para as grávidas estilosas badalarem neste sábado a noite. em Zazou Moda Gestante https://t.co/iz6TOMafAv
135,91370913,1558396258599014400,2022-08-13,"E necessário recomeçar quantas vezes for necessário.
@Flamengo https://t.co/RjyUjNlfQV"
136,60207311,1558371297008263168,2022-08-13,Acabou de publicar uma foto em Planalto Paulista https://t.co/RXS2AACslm
137,60207311,1558371071618912256,2022-08-13,Acabou de publicar uma foto em Planalto Paulista https://t.co/YH7KMKjtCz
138,360658314,1558318430192893952,2022-08-13,A night to remember https://t.co/UAMifFFXtQ
139,76103370,1558295198421204995,2022-08-13,Acabou de publicar uma foto em Bourbon Street Music Club https://t.co/hnL87Z5PQo
140,76103370,1558294766898536448,2022-08-13,Acabou de publicar uma foto em Bourbon Street Music Club https://t.co/czuAIrwGob
141,712609120,1558276357683138560,2022-08-13,Pensando no quê?  Dê seu palpite! em Miles Wine Bar https://t.co/KPa3XjnIfw
142,1412593256886640643,1558275119776206850,2022-08-13,"🍔O melhor hamburger do mundo e o chef mais gente fina ever. 

📝Comemos metade (ou mais) do cardapio da Seven Kings.

Eu fui de Bewulf e de Pendragon.

11/10

@_xoris caraca mano, brigado demais e feliz demais de rever vc!

@SevenKingsBgr @CancerJack @mateuspao @DonellaMichelle https://t.co/AuOdKkvZK7"
143,2834684794,1558264400234123265,2022-08-13,"Encontrei a @linndaquebrada saindo do aeroporto e não pude deixar de tietar! Lina, vc é muito fofa, um doce de pessoa e luz nesse mundo! https://t.co/kziLNRmotZ"
144,129521962,1558254949917655040,2022-08-13,Humildão experimentando o Camemburger! Só faltou @CancerJack aqui! https://t.co/T3QDvzu2xh
145,60207311,1558222972334260224,2022-08-12,Acabou de publicar uma foto em Planalto Paulista https://t.co/qI0L2j1ZDo
146,1466186253804654601,1558193614102093824,2022-08-12,"Uma tarde maravilhosa com a @nanivenanciooficial  no programa @tardetop  da @oficialrbtv  

Muito obrigado a toda equipe e produção e a minha irmã @carolfreitas_assessoria  por hoje 💥😍😀 @ Rede Brasil de Televisao https://t.co/FgSacPBHR3"
147,192584779,1558187262969630721,2022-08-12,Acabou de publicar uma foto em Looke https://t.co/dHVEFIOD1y
148,3180486071,1558114231756652546,2022-08-12,Acabou de publicar uma foto em Shopping Ibirapuera https://t.co/e6ziRWyWck
149,3180486071,1558110285776490496,2022-08-12,Acabou de publicar uma foto em Shopping Ibirapuera https://t.co/6JmQq10JB5
150,84912815,1558094488274407425,2022-08-12,Acabou de publicar uma foto em Steel Bar SP https://t.co/zBk9OQg6s9
151,3895005683,1558081941789822976,2022-08-12,Acabou de publicar uma foto em Espaço Drina Vieira https://t.co/4SLFIQtIFc
152,76533729,1558077231825575939,2022-08-12,Bom dia ☕🧿 em Moema Zona Sul https://t.co/8DfuRB7o1b
153,67952361,1558072306664177666,2022-08-12,Mais um dia de paixões platônicos alcançado com sucesso 🤣😥
154,54103406,1558069072016748544,2022-08-12,Acabou de publicar uma foto em Tchê Café https://t.co/l762iZEq7V
155,19383548,1558068434050727939,2022-08-12,"Nem ditador, nem torturador, nem projetinho de ditador que fez carreira política defendendo torturador.
#recadinho @ Rui Bloem https://t.co/OlCHC6rZpu"
156,1546606725893132288,1558054694928486400,2022-08-12,Bom dia ☀️ https://t.co/hgOPTSAmv1
157,54797373,1558028453059887105,2022-08-12,Eu começando a trabalhar e a lua se despedindo. #BomDia https://t.co/39wfeLWYWH
158,60207311,1558002216400822272,2022-08-12,Acabou de publicar uma foto em Planalto Paulista https://t.co/UkNtPe6ENa
159,60207311,1558002151259049985,2022-08-12,Acabou de publicar uma foto em Planalto Paulista https://t.co/dU74xvU2P8
160,76103370,1557966078549979136,2022-08-12,Acabou de publicar uma foto em Bourbon Street Music Club https://t.co/ur5WT7j609
161,60207311,1557912470152429569,2022-08-12,Acabou de publicar uma foto em Planalto Paulista https://t.co/kKBhne9RSQ
162,2377795444,1557884456861581313,2022-08-12,"@HenStockler Cara, o pior eh ficar na imaginação… não poder assistir ou ouvir o jogo tá me matando 🤦🏻‍♂️🤦🏻‍♂️🤦🏻‍♂️"
