,author_id,tweet_id,created_at,text
0,55716354,1635557448978251776,2023-03-14,Boarding to Brasilia https://t.co/XHPkd0kxDO
1,50851280,1635554813684465665,2023-03-14,"I'm at Aeroporto de São Paulo / Congonhas in São Paulo, SP https://t.co/mjOpxSwhAl"
2,1099610346,1635433783175393280,2023-03-14,Esse pão de açúcar salvou demais
3,89681574,1635433238276481025,2023-03-14,"Rodízio de carne não é legal não. 
Meu Deus pra que eu comi tanto 😅"
4,318056797,1635416122257178624,2023-03-13,"I'm at Bio Ritmo in São Paulo, SP https://t.co/z5JHxUpxSm https://t.co/exse8rUGPB"
5,15456487,1635415820313452546,2023-03-13,"Heading to Rio (@ São Paulo Airport / Congonhas in São Paulo, SP) https://t.co/LqQwjPth0j"
6,110688963,1635412651961360385,2023-03-13,"I'm at Bio Ritmo in Sao Paulo, SP https://t.co/MJaR5sqmhL"
7,1099610346,1635337208151547904,2023-03-13,O mundo caindo aqui véi
8,828641069759868928,1635299775959666690,2023-03-13,🎰 https://t.co/hpiLLnW2V9
9,37035780,1635256759475400705,2023-03-13,"I'm at São Paulo Airport / Congonhas in São Paulo, SP https://t.co/1wwie8mGQF"
10,263667283,1635242520761229312,2023-03-13,"I'm at Aeroporto de São Paulo / Congonhas in São Paulo, SP https://t.co/WOGsg9a80r"
11,337596942,1635214638244835328,2023-03-13,"I'm at Aeroporto de São Paulo / Congonhas in São Paulo, SP https://t.co/U5Alduus5i"
12,1625502154940387330,1635203853535809538,2023-03-13,"Tem coisas que dá vontade de revidar, mas a gente olha pra vida da pessoa e diz nem vale a pena.🙄"
13,1479078276865871876,1635134122573324288,2023-03-13,Rodrigues BUGGATTI Consultor de Negócios. https://t.co/hiWm5Q4mdL
14,1257494618322632705,1635097465220382721,2023-03-13,"O Oscar 2023 para Melhor Curta-metragem de Animação vai para O Menino, a Toupeira, a Raposa e o Cavalo

#Ultraverso #Oscars #Oscar https://t.co/NLINZ6kj3D"
15,42832478,1635096563998687237,2023-03-13,"Embarcado, descabelado e cansado 🫠 https://t.co/vZX2WzHyT6"
16,1257494618322632705,1635081414009036803,2023-03-13,"O Oscar 2023 para Melhor Documentário vai para Navalny

#Ultraverso #Oscars #Oscar https://t.co/utMa1y1Ese"
17,66786142,1635080595205427200,2023-03-13,"Ainda resta uma hipocrisia master da @anvisa_oficial e cias aéreas, principalmente @LATAM_BRA : aviso de recomendação de uso de máscaras + álcool sendo que nenhum comissário usa. Cobrar sem dar exemplo é balela. Eu ODEIO máscara, mas odeio hipocrisia ainda mais. #COVID19 https://t.co/8vgwWZEk62"
18,1257494618322632705,1635077739148632064,2023-03-13,"O Oscar 2023 para Melhor Atriz Coadjuvante vai para Jamie Lee Curtis 

#Ultraverso #Oscars #Oscar https://t.co/3lncUL3O49"
19,1257494618322632705,1635073552201420800,2023-03-13,"O Oscar 2023 para Melhor Filme de Animação foi para  Pinóquio, Guilhermo Del Toro.

#Ultraverso #Oscars #Oscar https://t.co/srXKDWXyyz"
20,1202996793312776192,1635052569872707584,2023-03-12,"Entre papo cabeça, negócios e fofocas passei a tarde com meu irmão! @jguilhermefoto te amo bro ❤️✨🙏🏽"
21,42832478,1635049381207453696,2023-03-12,"Oi São Paulo!! (@ Aeroporto de São Paulo / Congonhas in São Paulo, SP) https://t.co/5MvriZ06X9"
22,1491269283288170497,1635038252146237440,2023-03-12,❤️ https://t.co/KGq1TyuKQW
23,1537247057664258048,1634973524833214464,2023-03-12,https://t.co/rX6kZkAxjQ
24,318056797,1634971703271890945,2023-03-12,"I'm at Bio Ritmo in São Paulo, SP https://t.co/Gr92TgUeQO https://t.co/xydqZ05smT"
25,106562126,1634970340022530048,2023-03-12,"e aqui vamos nós 🥹 (@ Aeroporto de São Paulo / Congonhas in São Paulo, SP) https://t.co/eV87LZv2A4"
26,106774618,1634912079483383813,2023-03-12,"I'm at Aeroporto de São Paulo / Congonhas in São Paulo, SP https://t.co/oGzYE8FcCe"
27,318056797,1634911690629480448,2023-03-12,I'm at Uffa! Cheguei em Casa! in São Paulo https://t.co/mzyyqrbwdz https://t.co/hL0ocrxKDa
28,976185744443236352,1634726325209407493,2023-03-12,Fim de festa ! Partiu casa https://t.co/hEOvJjkxZG
29,208762396,1634695531887820803,2023-03-11,https://t.co/W0izX973ID
30,26484337,1634597825261580294,2023-03-11,Drinking an IPA by @eisenbahn @ Seven Kings — https://t.co/VnRx19Vujl
31,203973686,1634572721743970304,2023-03-11,"I'm at Posto Super Check-In (Ipiranga) in São Paulo, SP https://t.co/r6fmkmk8Or"
32,110688963,1634545373229326336,2023-03-11,Virou hábito (@ Koa Food Market in São Paulo) https://t.co/1msn71yfvo
33,110688963,1634527520119746562,2023-03-11,"Race de sábado (@ Bio Ritmo in Sao Paulo, SP) https://t.co/OVNLadSX0N"
34,73493771,1634490089664380928,2023-03-11,I'm at Femme Laboratório in São Paulo https://t.co/vNiqF0ApIk
35,110688963,1634377786247839745,2023-03-11,"I'm at Baggio in São Paulo, SP https://t.co/G7P82fqXui"
36,41360063,1634326671753879553,2023-03-10,"I'm at Bar Do Urso - Moema in São Paulo, SP https://t.co/p2GiOnawSG"
37,110688963,1634325170834886657,2023-03-10,"Bora nadar (@ Bio Ritmo in Sao Paulo, SP) https://t.co/nuASTsLxGq"
38,25760782,1634323355565277185,2023-03-10,"Já estou no avião e o Comandando acabou de avisar que tem 10 aviões na nossa frente para decolar. 

ESPERO QUE A BATERIA DESSA MERDA ESTEJA TOTALMENTE CARREGADA 👀😶 https://t.co/CJA1KJVQLX"
39,22197767,1634315628243824647,2023-03-10,"I'm at Shopping @Ibirapuera in São Paulo, SP https://t.co/xvA0V5IHOO"
40,318056797,1634254805945163782,2023-03-10,"I'm at Campo Belo - @sp_prefeitura in São Paulo, SP https://t.co/JDzARIZBB6 https://t.co/3LHn26AhGO"
41,318056797,1634230822097104896,2023-03-10,"I'm at Bio Ritmo in São Paulo, SP https://t.co/64AXgTRBRs https://t.co/LnIBYfNADb"
42,1192168322420346880,1634225328540332033,2023-03-10,Chá de aeroporto 🫖 ✈️
43,34659365,1634216232432934912,2023-03-10,"I'm at Aeroporto de São Paulo / Congonhas in São Paulo, SP https://t.co/Vcd8bs12Rt"
44,5815152,1634209077315133440,2023-03-10,"Oi. 
To indo ali. 
Beij. https://t.co/NsTebBCKbY"
45,1369803566769143808,1634197566647615488,2023-03-10,Após um ano recebi a visita novamente dele 📸 @Fly_NN_High_ ❤️ que veio especialmente a São Paulo pra me ver 🫶 obrigada pelo carinho e pelos presentes. Sempre muito bom te ver 🥰 até uma próxima ✈️🇺🇸🌍😍 https://t.co/uHl6lk6brZ
46,318056797,1633965914113597440,2023-03-09,"I'm at Padaria Colonial in São Paulo, SP https://t.co/sjXbaNhnDO https://t.co/3B0kt4mZdK"
47,318056797,1633963702847430657,2023-03-09,"I'm at Bio Ritmo in São Paulo, SP https://t.co/P9C6csyC2I https://t.co/n2kufYGh1f"
48,55545251,1633961430255845376,2023-03-09,@LATAM_BRA lixo de companhia…
49,1244710292598161409,1633955645916340224,2023-03-09,Sp...🧡🤍 https://t.co/OpUa3DRovn
50,55545251,1633951302089678851,2023-03-09,"Latam, Latam… como vcs fracos de serviço! Meu Deus! @LATAM_BRA"
51,2761170568,1633938385424269314,2023-03-09,"A proud moment for #India! 
Grp Captain Shaliza Dhami has become the first woman Commanding Officer of a missile squadron &amp; 
Col Geeta Rana has become the first woman officer to  command an Independent Field Workshop in a forward and remote location in Eastern Ladakh #WomensDay https://t.co/phktmuhhsE"
52,3932694016,1633922464496353285,2023-03-09,"Venha fazer parte do PROJETO 50+ e descubra tudo sobre as redes sociais.
https://t.co/hygp4xARXS https://t.co/fqAPbZBVEg"
53,1120216000975245314,1633906962235572239,2023-03-09,☕️ https://t.co/RsB1TVFLLO
54,50180633,1633785283505184769,2023-03-09,"#BDSP #G1 @Anandaappleofi1 @rodrigobocardi a árvore da esquina da Constantino x João de Souza Dias, mostrada na reportagem do Tiago já está com infestação de cupins e fungos e tem protocolos abertos há meses, é de conhecimento da sub-prefeita e estão esperando um ""acidente"". https://t.co/bnr5Hl7GqH"
55,50180633,1633780746094518273,2023-03-09,"#sptv @Anandaappleofi1 @rodrigobocardi 
Enorme árvore mostrada na reportagem de hoje. Infestada de cupins e fungos e com protocolos abertos há meses. Estão esperando cair para lamentar o ""acidente"". Um absurdo! https://t.co/UANpL4Hun1"
56,50180633,1633779805958074368,2023-03-09,@Anandaappleofi1 @rodrigobocardi #sptv a árvore da Constantino x João de s.Dias está com infestação de cupins e fungos e já abri protocolos para avaliação. A sub-prefeita tem conhecimento e ninguém aparece. Estão esperando um acidente para tomar as devidas providências. https://t.co/29ARanHQH1
57,1289220475693006848,1633736647983480832,2023-03-09,sigo aqui https://t.co/Jcdx8vfLPH
58,318056797,1633667551006978048,2023-03-09,I'm at Uffa! Cheguei em Casa! in São Paulo https://t.co/1wGzX9rKYx https://t.co/K8b58LOHSL
59,178751535,1633644592686923778,2023-03-09,Legal esse bar tocando Matanza enquanto eu janto kkk
60,178751535,1633643432844443649,2023-03-09,Consegui vaga para ir hoje na casa do consolador mas aquela chuva toda me atrasou e não cheguei a tempo :/
61,15410917,1633641464692633601,2023-03-09,"I'm at @BardoJuarez_ Moema in São Paulo, SP https://t.co/gPURSRflJa"
62,784806745147318273,1633637752330760193,2023-03-09,"30’ de delay, mas embarcado estou. Sensação divina."
63,784806745147318273,1633606159163686914,2023-03-08,"Mais um: tira cinto, iPhone, AirPod, relógio, dois computadores, passa no raio x e coloca tudo de volta. #saga"
64,1586746993333895173,1633571875170181121,2023-03-08,São Paulo chove e os carros viram lanchas https://t.co/5FuH6LgGfs
65,286417078,1633556588945625088,2023-03-08,São Paulo sendo São Paulo https://t.co/itgH31R1PN
66,1382864382493917191,1633555424149381121,2023-03-08,Todo animado pra pedalar... até que... https://t.co/XK4apCIPHG
67,306496579,1633468950020235266,2023-03-08,A caminho de Curitiba PR 😌 https://t.co/wwQzYQZfN4
68,110688963,1633438313578131456,2023-03-08,"I'm at Feira Livre - @sp_prefeitura in São Paulo, SP https://t.co/WNVML15b0I"
69,110688963,1633415203583844352,2023-03-08,"I'm at Bio Ritmo in Sao Paulo, SP https://t.co/V5JpsJysAN"
70,336550037,1633413696402731009,2023-03-08,"I'm at Aeroporto de São Paulo / Congonhas in São Paulo, SP https://t.co/z01NSk54Ig"
71,938206801392275464,1633395728667103232,2023-03-08,A pessoa que às 6 da mamãe come um hot dog de aeroporto lotado de sriracha já deixou tudo nas mãos de delz. Seloko.
72,110688963,1633236625609338880,2023-03-07,"I'm at Bio Ritmo in Sao Paulo, SP https://t.co/iNF3jODclo"
73,784806745147318273,1633236215372677120,2023-03-07,De volta à sala de aula. #college
74,318056797,1633139105591615488,2023-03-07,"I'm at Bio Ritmo in São Paulo, SP https://t.co/Ci2RU2EMjp https://t.co/ptGt0PZ7tk"
75,1352114039288115200,1633130082091900928,2023-03-07,https://t.co/SSAcDK8KqL
76,1352114039288115200,1633126683984244739,2023-03-07,Partiu Recife https://t.co/DwmD1QSrG2
