,author_id,tweet_id,created_at,text
0,550524865,1539589973485166594,2022-06-22,Até quando haverá negligência da #prefeituradesaopaulo ? @ricardo_nunessp @vereador_camilo @CETSP_ @defesacivilsp https://t.co/wX3JxXmfjr
1,1361271221657214976,1539568372639219712,2022-06-22,"Bora treinar com foco, força, fé e odio!  
Ah aproveitando o momento pra dizer que quem tem TDAH  tem obrigação de fazer exercícios físicos, na verdade, todo mundo tem que fazer no minimo 25 mins por dia de atividades físicas, quem disse isso não foi eu, foi a OMS.
+++ https://t.co/P3sSobaNXZ"
2,1047151406199840768,1539500097217626117,2022-06-22,Bom dia! em Núcleo Espírita Paulo de Tarso https://t.co/T4m0Ig0c9m
3,1047151406199840768,1539499922885574656,2022-06-22,"Bom dia! em Santo Amaro, Sao Paulo, Brazil https://t.co/C0K1V8mgEe"
4,25700962,1539451063446773766,2022-06-22,Acabou de publicar uma foto em Beyond Van Gogh Brasil https://t.co/3nM52imlT9
5,69801904,1539449357648416768,2022-06-22,Treino de terça-feira: ombros 🥵❤️💪 em Smart Fit https://t.co/xi89rhgrzN
6,69801904,1539369609714970625,2022-06-21,"Boa noite!
Good evening! em Santo Amaro, Sao Paulo, Brazil https://t.co/qUBoFksN7P"
7,50300213,1539348807997071362,2022-06-21,Um lindo por do sol na nossa @oab_santoamaro em Oab Santo Amaro https://t.co/XYJobjZLrf
8,69801904,1539333201289691138,2022-06-21,"Tem hora que cansa em Santo Amaro, Sao Paulo, Brazil https://t.co/3tGLsw7j04"
9,69801904,1539331918948343820,2022-06-21,"Sábias palavras em Santo Amaro, Sao Paulo, Brazil https://t.co/I6ezvJLIFJ"
10,69801904,1539320949580869634,2022-06-21,"Boa tarde ☕
Good afternoon ☕ em Santo Amaro, Sao Paulo, Brazil https://t.co/QrWzXbpEI3"
11,53446965,1539305600613437441,2022-06-21,"2a, 3m e 12d depois o crachá saiu da mochila em Deloitte https://t.co/4bUTpEPIZV"
12,19996223,1539260179325280258,2022-06-21,"Completando a fileirinha com a foto oficial, agora! Avisa a Nathalia que está no Olympia que vai levar uns 15 
anos, mas vai acontecer! ✨🫶🏻💖 em Vibra São Paulo https://t.co/QDbIZpx2Qj"
13,37031702,1539250682686996487,2022-06-21,Acabou de publicar uma foto em Shopping Market Place https://t.co/beX5zmHRuY
14,47832422,1539210950447882241,2022-06-21,Bora pra mais um dia de trabalho! https://t.co/cx6JXeSRPn
15,1044392722797400064,1539207252262981632,2022-06-21,Música na caixa de som até as 9h até animou meu dia 💃🏻
16,138796935,1539181918020837377,2022-06-21,Acabou de publicar uma foto em Teatro Alfa https://t.co/rMBLsA1IX5
17,870745039,1539170167657099264,2022-06-21,Acabou de publicar uma foto em Morumbi Caires https://t.co/F4sGuHhfza
18,1047151406199840768,1539130243180535815,2022-06-21,Bom dia! em Núcleo Espírita Paulo de Tarso https://t.co/BSadVbUZOK
19,1047151406199840768,1539129935280881664,2022-06-21,"Bom dia! em Santo Amaro, Sao Paulo, Brazil https://t.co/0ZxMxEkj4F"
20,69801904,1539062626658951168,2022-06-21,Treino de segunda-feira: costas 😀💪 em Smart Fit https://t.co/Nv0QBuYXeR
21,1479874758430928897,1539052944619819009,2022-06-21,#outonolovers💙 #pattinson em Conjunto Residencial Condominio Marajoara https://t.co/s5r2vaJt8n
22,1479874758430928897,1539051489305444352,2022-06-21,#outonolovers https://t.co/8FFtECq7T3
23,1484677885461946369,1539003724504367106,2022-06-20,Clean porto limpeza e higienização de sofás e estofados em geral nosso ZAP 11983125698 https://t.co/izWWNj8EVL
24,28503856,1539003334606069761,2022-06-20,"Acabou de publicar uma foto em Ráshuah SP - Meditação, Autoconhecimento e Terapias. https://t.co/3JGfWkbCBc"
25,2422357978,1538992231725645824,2022-06-20,"@TaFodaIvan Eu entendo Amigo... E quero te dizer o qto estou feliz por vc!
Qualidade de vida agregando exercícios é tido de bom.
Fica firme aí que vai dar tudo certo! 🥰 ❤️"
26,2422357978,1538990166488010759,2022-06-20,Parabéns 🥳🖤🤍🧡 https://t.co/iRSoGCa2aw
27,58669367,1538980190839263237,2022-06-20,𝒃𝒆 𝒂𝒓𝒕 💛 em Beyond Van Gogh https://t.co/eqY2xRzbYs
28,2787216415,1538965881652322304,2022-06-20,Acabou de publicar uma foto em Vibra São Paulo https://t.co/ntD8OFN6hf
29,1173404465522782209,1538955351487221760,2022-06-20,Acabou de publicar uma foto em The Doctors Ink Studio Tattoo https://t.co/z4szNCEU3T
30,69801904,1538953104070045696,2022-06-20,"Boa tarde!
Good afternoon! em Santo Amaro, Sao Paulo, Brazil https://t.co/yb8tbmEEdD"
31,37031702,1538915504324214784,2022-06-20,Acabou de publicar uma foto em Shopping Market Place https://t.co/VdVnDJCxwI
32,1515068567166857217,1538894193522778112,2022-06-20,Acabou de publicar uma foto em Rio De Janeiro - Ponte Rio Niterói https://t.co/AHz5aHqEHi
33,37031702,1538862796011601920,2022-06-20,Acabou de publicar uma foto em Shopping Market Place https://t.co/oiMlwOKpDf
34,473230160,1538859698325102594,2022-06-20,Acabou de publicar uma foto em Hípica Santo Amaro https://t.co/YqFaHCBgi2
35,35794011,1538856971914334210,2022-06-20,"Assim despedimos de São Paulo, e só  dizer Até  breve pessoal... em Vip Station https://t.co/ORmjQF9l2J"
36,610171401,1538818292575510531,2022-06-20,#bomdia em Instituto Nacinal do Seguro Social-INSS https://t.co/8tqcl3wgKL
37,1047151406199840768,1538757095746568192,2022-06-20,Bom dia! em Núcleo Espírita Paulo de Tarso https://t.co/ppKTa3X6uj
38,1047151406199840768,1538754905250439168,2022-06-20,"Bom dia e boa semana! em Santo Amaro, Sao Paulo, Brazil https://t.co/ijChERntZG"
39,69801904,1538748107294314496,2022-06-20,"Que tenhamos uma abençoada semana pela frente!
Deus no comando sempre ❤️ em Santo Amaro, Sao Paulo, Brazil https://t.co/PO2s1V1BbY"
40,49101673,1538732374204243968,2022-06-20,🎨🙌🏼✨ https://t.co/TxtZ10T6EG
41,69801904,1538674766420361218,2022-06-20,"Boa noite
Good evening em Jardim Promissão, São Paulo https://t.co/Wwen7RnayH"
42,3363253035,1538670201067167744,2022-06-19,Acabou de publicar uma foto em Jd.Marajoara https://t.co/9q0KDoTiFs
43,221759428,1538664959265103873,2022-06-19,Drinking an Avós do Brasil - Maria by Avós Cerveja Artesanal @ Residencial Place Vandome — https://t.co/epJkvA6Aan
44,221759428,1538664698819883009,2022-06-19,Drinking an Avós do Brasil - Terezinha by Avós Cerveja Artesanal @ Residencial Place Vandome — https://t.co/XnL2nf6aBS
45,132909997,1538643220992770049,2022-06-19,"Acabou de publicar uma foto em Itatiba, SP https://t.co/LKfHJfrhiY"
46,65015218,1538631390568366081,2022-06-19,"Depois de um evento entregue com sucesso.. visitar os amigos p fechar o domingo a noite
@ricoian @alasanha1 https://t.co/oFnsOCe2Qt"
47,215596444,1538629709516390406,2022-06-19,@cicloviariopinheiros #porraí https://t.co/ApoX6qYhqW
48,318056797,1538625078988050434,2022-06-19,I'm at Ferraz Cucine https://t.co/8SyouWiLil https://t.co/GKmdJkeNid
49,318056797,1538624028398833671,2022-06-19,"I'm at Padaria Colonial in São Paulo, SP https://t.co/x7JX0tjFAo"
50,64567564,1538614876494512131,2022-06-19,Acabou de publicar uma foto em Universal João Dias - SP https://t.co/DheyWdWTKX
51,2422357978,1538603016764497921,2022-06-19,"@marina_bufon Desde os tempos primórdios.. 
É da natureza do ser humano!"
52,2422357978,1538597069816053760,2022-06-19,"@capelareal 3️⃣X1️⃣
#VaiCorinthians 🖤🤍"
53,2422357978,1538584222130126848,2022-06-19,@BombeirosPMESP Que imagem mais que perfeita 🥰♥️
54,64567564,1538583238582714369,2022-06-19,"Unigrejas Bloco Sul Diadema-SP reunião do Projeto

@comedycentralbr
@bispo.ednocunha 
@prluis13 
@unigrejas 
@silmara_teix 
@bispoeduardobravo 
@carloscucatooficial em Universal João Dias - SP https://t.co/iYVV4fbxSJ"
55,3140826667,1538581423698784256,2022-06-19,#sertia ..pré #sonic..📽🎬🎞🎥 em Cinemark Market Place https://t.co/iypG3BXkSV
56,40351394,1538578290302132225,2022-06-19,"vocês me perdoem, mas não consigo https://t.co/eGxxHuF4GY"
57,318056797,1538560722300542978,2022-06-19,gnocchi (@ Ferraz Cucine) https://t.co/tJr1bkbapu https://t.co/DRNJOt6r8k
58,35794011,1538545772161024000,2022-06-19,A nova formação das Pussycat Dolls para a @biggerparty em Vip Station https://t.co/oyQ93TeVjM
59,132909997,1538538728544772097,2022-06-19,"Acabou de publicar uma foto em Itatiba, SP https://t.co/EQ0GFcsE9N"
60,35794011,1538538038984429571,2022-06-19,Demorou mas encontro aconteceu em grande estilo @jorgecosta_rj na @biggerparty em Vip Station https://t.co/1FxcWptcuJ
61,1173404465522782209,1538533001226772480,2022-06-19,Acabou de publicar uma foto em The Doctors Ink Studio Tattoo https://t.co/LRAx7Jc6N1
62,35794011,1538531848313360386,2022-06-19,De Goiânia para São Paulo na maior festa dos grandoes @biggerparty em Vip Station https://t.co/153mTs8ITQ
63,1190456798001672198,1538528130327093254,2022-06-19,🌠 #beyondvangogh #beyondvangoghbrasil @ Morumbi Shopping https://t.co/7cvZJpC4Ho
64,1368357467013406724,1538495310711992320,2022-06-19,"Frases de efeito, temos no banheiro de VIP Station! #Bigger https://t.co/LGLAGJLJT8"
65,1047151406199840768,1538394803683086336,2022-06-19,Bom dia! em Núcleo Espírita Paulo de Tarso https://t.co/8OkJUyJKoe
66,1047151406199840768,1538394288463130624,2022-06-19,"Bom dia! em Santo Amaro, Sao Paulo, Brazil https://t.co/4kYJTgs4kA"
67,69801904,1538363201183797253,2022-06-19,"O que me faz orar pela alma da pessoa... que permaneça na paz! em Santo Amaro, Sao Paulo, Brazil https://t.co/IBz0oO0D9w"
68,451750996,1538355489620123648,2022-06-19,❤ #gexperience #TvGlobo #Noveleiro #LadyNight #RedeBBB #Gshow #MãeToNaGlobo #EstudiosGlobo em gexperience https://t.co/JkNLQhrjim
69,304730976,1538351041099579393,2022-06-19,Good night rock forever fodda em Louie Louie bar https://t.co/I1cbeXyf3p
70,1479874758430928897,1538343302348607488,2022-06-19,https://t.co/HLzHMy8q0Y
71,58881971,1538334209818906625,2022-06-19,"Eu amoooo 💛🤍💛🤍

@AlexandrePires @seujorge https://t.co/kNIY49Y5nA"
72,111961943,1538332379273646080,2022-06-19,🌻🌻🌻🌻🌻🌻 https://t.co/UvExjZpbk3
73,2499929694,1538318573810159618,2022-06-19,"Uau... ""Juntos por Um propósito"" Eu e minha esposa maravilhosa @elivania.ricardo2012 ❤
Sucesso no relacionamento contigo é  simples, Ti ❤ em Igreja Apostólica Essência da Vida https://t.co/MODFVEKS72"
74,58881971,1538317910019649540,2022-06-19,Hoje a noite é com eles 💛🤍 @AlexandrePires @seujorge  #tourirmãos #alexandrepires #seujorge https://t.co/r7FdVPQPx3
75,57648654,1538308394007904258,2022-06-18,Hoje o #valenight é com eles #irmaos @alexandrepires_ @seujorge em Vibra São Paulo https://t.co/wlmhF9QUeY
76,1199720487464648704,1538300777260785664,2022-06-18,Pra comemorar Niver do maninho!🎂 https://t.co/pZC2Q8K4qS
77,92743535,1538292886210498560,2022-06-18,"Mais um concluído! 
#led #paineldeled #resolume #socesp #multivisionlocacoes em Transamerica Expo Center https://t.co/5AeNACAS7I"
78,45717924,1538291233906376721,2022-06-18,"#clickdodia

#beyondvangoghbrasil 

#fotografia #arte #cultura #SP #phography #vangoghexperience #vangoghart #vangogh #vincentvangogh #iphone13 #johnny em Beyond Van Gogh Brasil https://t.co/svFnyoFI4T"
79,3063931179,1538286638505332738,2022-06-18,Acabou de publicar uma foto em Universal João Dias - SP https://t.co/3zUCv9uYr8
80,69801904,1538249374123192320,2022-06-18,"Sempre bom ter visitas em casa, e essas são mais que especiais ❤️ em Jardim Promissão, São Paulo https://t.co/QE2NvqIU07"
81,1525854878647652353,1538230067255443457,2022-06-18,https://t.co/WuysYxcAhm
82,312764619,1538190773220417538,2022-06-18,Acabou de publicar uma foto em Macapá - AP https://t.co/2eAP51Pard
83,92743535,1538163462018412545,2022-06-18,Simples assim! em Transamerica Expo Center https://t.co/Hf0eYwtAoB
84,2422357978,1538155338230382595,2022-06-18,@italogsilva_ Pudim!
85,1439230864731299842,1538152129449320448,2022-06-18,https://t.co/HL0Fxq7xqy
86,1470322528816144385,1538124466512924672,2022-06-18,"Eu em pleno sábado de manhã na faculdade, não vejo a hora de terminar https://t.co/8eDhUTpvzb https://t.co/SI6GFZM7k0"
87,1520872188647067653,1538124267711258626,2022-06-18,Vai uma chuvinha aí? Onde vai querer? #goldenshowers https://t.co/ATCTH2SVTJ
88,83419730,1538106972918235136,2022-06-18,@pauloalexandrev Gostei. comprova a meia idade
89,921197448885886977,1538063782013980677,2022-06-18,"Applebee's - São Paulo - Sábado a noite fui jantar com alguns amigos, optei por comer o file de Saint Peter com batata rústica e legumes, imaginando ser um dos prat... Food Poisoning https://t.co/jfB2pujNlR #applebees #nausea #diarrhea #vomiting #shortnessofbreath"
90,69801904,1538021543527075840,2022-06-18,"Sono chegando 💤💤💤 em Jardim Promissão, São Paulo https://t.co/UQUQ7mEjHV"
91,69801904,1538019532530323459,2022-06-18,"Acabou de publicar uma foto em Jardim Promissão, São Paulo https://t.co/OvCVmSuuor"
92,69801904,1538017473433247753,2022-06-18,"Boa noite e um excelente fim de semana! em Santo Amaro, Sao Paulo, Brazil https://t.co/YPSGMTlw7E"
93,1047151406199840768,1538001988499017729,2022-06-18,Bom dia! em Núcleo Espírita Paulo de Tarso https://t.co/bRBnaAoUrv
94,1047151406199840768,1538001780398706689,2022-06-18,"Acabou de publicar uma foto em Santo Amaro, Sao Paulo, Brazil https://t.co/vEOlOksfpQ"
95,69801904,1537971907567398912,2022-06-18,"Treino de peitoral...
Era ontem, mas preferi dormir até acordar 🤣🤣🤣
As pernas e glúteos ficam pra amanhã em Smart Fit https://t.co/Xq2Rrtra0L"
96,27655064,1537959745646039042,2022-06-18,😍 em Le Chef Boucher https://t.co/hefFnyK0Cu
97,318056797,1537950912177508354,2022-06-18,"Você se lembra quando começou a fazer parte do Twitter? Eu me lembro! #MeuAniversárioDoTwitter 
#hardyfloor
@Hardyfloor https://t.co/Fh87XREmVF"
98,69801904,1537944145955737602,2022-06-17,"Boa noite!
Good evening!
.
.
Daqui a pouco, o treino de sexta-feira 💪 em Jardim Promissão, São Paulo https://t.co/i7q74zNwoG"
99,318056797,1537896654191226882,2022-06-17,"I'm at Padaria Colonial in São Paulo, SP https://t.co/PHW3jMUKlV https://t.co/XoSwpuCXaX"
100,318056797,1537896330772631553,2022-06-17,"I'm at NY Barbearia in São Paulo, SP https://t.co/6NCsHgLqAm https://t.co/hoB93cZtYY"
101,318056797,1537895434449850372,2022-06-17,I just hunted! (@ Ferraz Cucine) https://t.co/avwKnLmynX https://t.co/qFU9xVAaD3
102,25577896,1537854164126031876,2022-06-17,17.junho. 20h sexta @ Palácio Tangará https://t.co/4kFt6mEor2
103,8360272,1537807025584934918,2022-06-17,"Região de Santo Amaro, Sampa.  #cachorroperdido em Santo Amaro, Sao Paulo, Brazil https://t.co/q1Zg7j7ONb"
104,57521038,1537800059860840448,2022-06-17,"42º Congresso da Sociedade De cardiologia do estado de São Paulo- SOCESP.

#socesp2022 #fisiologiahumana #fisiologiadoexercicio #fisiologista #cardiologia #educaçãofísica #exercíciofísico #saúde #multidisciplinar #DCV https://t.co/BAoUaenwHz"
105,66423697,1537783027115479040,2022-06-17,"Um quadro novo que encontrei
Francolisa 😂

#exposicao #vangogh #gogh  #morumbi #shopping #arte #pintura #tinta #quadro em Exposição Van Gogh https://t.co/x57nGOyY7v"
106,41709648,1537742139806867462,2022-06-17,Acabou de publicar uma foto em Vila Leopoldina https://t.co/SgbrvCIhLR
107,1494774540236427268,1537714100515528704,2022-06-17,"Acabou de publicar uma foto em Itatiba, SP https://t.co/0DvCMlcK64"
108,1047151406199840768,1537659785524310017,2022-06-17,Bom dia! em Núcleo Espírita Paulo de Tarso https://t.co/AdXO5eNGwz
109,2374664614,1537635474294116352,2022-06-17,Te escolheria um milhão de vezes se fosse necessário… ❤️💍 https://t.co/uzEQXohvKp
110,95335083,1537613817441443840,2022-06-17,🎪👧🏻❤️ em Circo Spacial https://t.co/pz9RmhEFjk
111,2374664614,1537599976997543940,2022-06-17,"Hoje eu e o Paulo fomos no Morumbi Shopping pra encontrarmos o Vito e meu sobrinho Matheus. Meu sobrinho convidou a gente pra ver a exposição Beyond Van Gogh DE GRAÇA, e a exposição é perfeita em cada detalhe, coisa linda demais ❤️"
112,3363253035,1537596018862264322,2022-06-17,Acabou de publicar uma foto em Jd.Marajoara https://t.co/4ruDxB01q8
113,47595731,1537595279767228417,2022-06-17,Fim de tarde e começo da noite no outono... @ Bairro Alto Da Boa Vista https://t.co/brIkq0hwgB
114,69801904,1537564264101183488,2022-06-16,Solenidade de Corpus Christi em Paróquia Sagrada Família - Diocese de Santo Amaro https://t.co/2kcVzDcAhc
115,546230403,1537537857933516800,2022-06-16,Acabou de publicar uma foto em Arnold South America https://t.co/nG9icq7lLP
116,56713034,1537523956571426817,2022-06-16,June festivals season 🙌🏻 @ Parque Burle Marx https://t.co/7qqMgfKyoy
117,69801904,1537494473143422976,2022-06-16,"Boa tarde!
Aproveitando um pouquinho do sol de hoje, já que amanhã, tudo mudará novamente em Jardim Promissão, São Paulo https://t.co/blzGKxMhbd"
118,1479874758430928897,1537434869336117250,2022-06-16,#outonolovers #seliga #fitnessadict #healthchoices #listentoyourheart #pattinson em Conjunto Residencial Condominio Marajoara https://t.co/du9gMVaJ02
119,3062855996,1537433931552653317,2022-06-16,Acabou de publicar uma foto em Luisa Abram https://t.co/SeQjTPZOcx
120,53179056,1537430503040614400,2022-06-16,E hj essa minha princesa completa 5 meses. Como te amo minha filha 💚🙏🥰 em Insanolândia https://t.co/cpMtjnGScK
121,1173404465522782209,1537428993359720449,2022-06-16,Acabou de publicar uma foto em The Doctors Ink Studio Tattoo https://t.co/ZgIn56p83c
122,30404697,1537409884605583360,2022-06-16,"Acabou de publicar uma foto em Santo Amaro, Sao Paulo, Brazil https://t.co/s4bEFcJO6Z"
123,131494231,1537404530035507200,2022-06-16,Acabou de publicar uma foto em Chácara Santo Antônio https://t.co/epsIN4OWBd
124,1047151406199840768,1537282608412884992,2022-06-16,Bom dia! em Núcleo Espírita Paulo de Tarso https://t.co/k9vidL1pYy
125,1047151406199840768,1537282393597308928,2022-06-16,"Bom dia! em Santo Amaro, Sao Paulo, Brazil https://t.co/2Rn43eMi4O"
126,69801904,1537280957673181185,2022-06-16,"Resumo do treino dessa quarta-feira... tríceps 😁 em Santo Amaro, Sao Paulo, Brazil https://t.co/0BoW78gcdy"
127,2422357978,1537276670067060737,2022-06-16,"@WillianSccpLhp Precisa se apurado se é vdd Parece  que houve o falecimento do Bisavô dele hj.A ser apurado de ter a necessidade do jogador em campo! É jovem e a carga emocional é muito grande!
Aguardar pra ver se confirma isso.
Mas, lembrando que a Base tem mais  salvado do que prejudicado."
128,1360419830,1537230968250978304,2022-06-16,photo dump de hoje 💫🤏🏼🫶🏼💙🥺 em Beyond Van Gogh Brasil https://t.co/1pVwRabelp
129,258622199,1537195505972924418,2022-06-15,"O Instituto Pelo Diálogo Intercultural participa da Festa Junina da Catedral Anglicana levando delícias da culinária turca. Convidamos todos. 

As rendas arrecadadas serão usadas nas atividades sociais do Instituto Anglicano e Instituto pelo Diálogo Intercultural.

Venha 😋 https://t.co/6PALkrS7RS"
130,1212702980467650560,1537193213924188160,2022-06-15,Acabou de publicar uma foto em No Ar https://t.co/9byWD7p8sZ
