,author_id,tweet_id,created_at,text
0,1592638196600422401,1645595196921356288,2023-04-11,https://t.co/Va4TlenpM5
1,1542626124638855168,1645585165350043648,2023-04-11,e na rua nem demonstra afeto...
2,2503077872,1645303256359337984,2023-04-10,Use o Waze para dirigir até Você está aqui: https://t.co/4Z46mkw0GD
3,57717875,1645219925286350848,2023-04-10,"It's a me, Mario! (at @Kinoplex Platinum for The Super Mario Bros. Movie in São Paulo, SP) https://t.co/6L0vEKsHSe"
4,66797586,1645207430236610560,2023-04-09,"Azul é a cor mais quente?
#sp  #gay #domingo #Twitter https://t.co/HhOYbd3FbG"
5,102160355,1644827146177728513,2023-04-08,"Hora de rolar os dados. Dungeons &amp; Dragons Time 🍿📽️ (at @CinemarkOficial in São Paulo, SP) https://t.co/SQiW1MpYhT"
6,102160355,1644794200192368641,2023-04-08,"Super Mário Time 🍿📽️ (at @CinemarkOficial in São Paulo, SP) https://t.co/kMgLnSAKWJ"
7,102160355,1644789020843548672,2023-04-08,"I'm at Shopping Market Place - @smarketplace in São Paulo, SP https://t.co/5no9Zj3uBJ"
8,73493771,1644704324453294083,2023-04-08,I'm at Condomínio Jardim Hipico in São Paulo https://t.co/LRZ6wZmHVi
9,56851995,1644651843128029184,2023-04-08,I'm at Parque Bruno Covas Novo Rio Pinheiros in São Paulo https://t.co/qmxvbU00T5
10,227004615,1644636161283956737,2023-04-08,"Até quando, iremos passar por isso?
Os trens da CPTM sempre lotados, uma demora imensa na linha 9 esmeralda, mais de 1 hora de espera🤦🏻‍♂️, não adianta eu pagar um imposto alto, para passar por isso logo de manhã! #governodesp #CPTM @CPTM_oficial @tarcisiogdf @ricardo_nunessp https://t.co/N4Kyz1eNcO"
11,1238979695166787586,1644512120317390848,2023-04-08,Foi tudo o que pedi para acontecer ❤️🖤
12,69801904,1644177982452367364,2023-04-07,Cadeira extensora https://t.co/5uVUeGD46p https://t.co/Ijdv1xPmcq
13,69801904,1644177619905069058,2023-04-07,LegPress https://t.co/SAPloJZt0s
14,69801904,1644115003547480068,2023-04-06,Boa noite! https://t.co/hR7vhYEahH
15,197906460,1644017143023804420,2023-04-06,"I'm at Cantina Belladonna in São Paulo, SP https://t.co/LIzwWAqqQi"
16,57222839,1643696672352944128,2023-04-05,#labuta #niver (@ Licoretto Bebibas) https://t.co/l2f242wmKA
17,69801904,1643465782582452226,2023-04-05,Boa quarta-feira para todos https://t.co/ca38AZIj9H
