,author_id,tweet_id,created_at,text
0,69801904,1537564264101183488,2022-06-16,Solenidade de Corpus Christi em Paróquia Sagrada Família - Diocese de Santo Amaro https://t.co/2kcVzDcAhc
1,546230403,1537537857933516800,2022-06-16,Acabou de publicar uma foto em Arnold South America https://t.co/nG9icq7lLP
2,56713034,1537523956571426817,2022-06-16,June festivals season 🙌🏻 @ Parque Burle Marx https://t.co/7qqMgfKyoy
3,69801904,1537494473143422976,2022-06-16,"Boa tarde!
Aproveitando um pouquinho do sol de hoje, já que amanhã, tudo mudará novamente em Jardim Promissão, São Paulo https://t.co/blzGKxMhbd"
4,1479874758430928897,1537434869336117250,2022-06-16,#outonolovers #seliga #fitnessadict #healthchoices #listentoyourheart #pattinson em Conjunto Residencial Condominio Marajoara https://t.co/du9gMVaJ02
5,3062855996,1537433931552653317,2022-06-16,Acabou de publicar uma foto em Luisa Abram https://t.co/SeQjTPZOcx
6,53179056,1537430503040614400,2022-06-16,E hj essa minha princesa completa 5 meses. Como te amo minha filha 💚🙏🥰 em Insanolândia https://t.co/cpMtjnGScK
7,1173404465522782209,1537428993359720449,2022-06-16,Acabou de publicar uma foto em The Doctors Ink Studio Tattoo https://t.co/ZgIn56p83c
8,30404697,1537409884605583360,2022-06-16,"Acabou de publicar uma foto em Santo Amaro, Sao Paulo, Brazil https://t.co/s4bEFcJO6Z"
9,131494231,1537404530035507200,2022-06-16,Acabou de publicar uma foto em Chácara Santo Antônio https://t.co/epsIN4OWBd
10,1047151406199840768,1537282608412884992,2022-06-16,Bom dia! em Núcleo Espírita Paulo de Tarso https://t.co/k9vidL1pYy
11,1047151406199840768,1537282393597308928,2022-06-16,"Bom dia! em Santo Amaro, Sao Paulo, Brazil https://t.co/2Rn43eMi4O"
12,69801904,1537280957673181185,2022-06-16,"Resumo do treino dessa quarta-feira... tríceps 😁 em Santo Amaro, Sao Paulo, Brazil https://t.co/0BoW78gcdy"
13,2422357978,1537276670067060737,2022-06-16,"@WillianSccpLhp Precisa se apurado se é vdd Parece  que houve o falecimento do Bisavô dele hj.A ser apurado de ter a necessidade do jogador em campo! É jovem e a carga emocional é muito grande!
Aguardar pra ver se confirma isso.
Mas, lembrando que a Base tem mais  salvado do que prejudicado."
14,1360419830,1537230968250978304,2022-06-16,photo dump de hoje 💫🤏🏼🫶🏼💙🥺 em Beyond Van Gogh Brasil https://t.co/1pVwRabelp
15,258622199,1537195505972924418,2022-06-15,"O Instituto Pelo Diálogo Intercultural participa da Festa Junina da Catedral Anglicana levando delícias da culinária turca. Convidamos todos. 

As rendas arrecadadas serão usadas nas atividades sociais do Instituto Anglicano e Instituto pelo Diálogo Intercultural.

Venha 😋 https://t.co/6PALkrS7RS"
16,1212702980467650560,1537193213924188160,2022-06-15,Acabou de publicar uma foto em No Ar https://t.co/9byWD7p8sZ
17,906138272669327360,1537124453028610056,2022-06-15,"I'm at KitKat Chocolatory - @kitkatbrasil in São Paulo, SP https://t.co/Nu21N9pzdS"
18,69801904,1537124007719444483,2022-06-15,"Boa tarde!
Good afternoon!
😁 em Santo Amaro, Sao Paulo, Brazil https://t.co/ey3p6r0Swh"
19,1349141485472649217,1537119207665573889,2022-06-15,"Atendimento da @Bradesco no presencial cara … é de deixar a desejar … e ainda para resolver algo super rápido …

Chegar no banco 12h00 e as 14h00 ainda não ser atendida é complicadíssimo"
20,1292511503023775745,1537094407450656769,2022-06-15,"FUNKYOGA! Tenham uma ótima tarde. 
https://t.co/9huy6fMkhL"
21,552792609,1537093175436685312,2022-06-15,"Uma boa dica de leitura é este novo livro ""Segredos e Mistérios da Alma"",
Invista em você. em Universal João Dias - SP https://t.co/B7QS3N4CoW"
22,1046492315374813185,1537085038772330502,2022-06-15,"@BoletimCoppolla @LouOlive1 @taoquei1 Vcs vão convidar o Zelensk e o Putim para discutir sobre o final da guerra?
Não se esqueçam da cerveja pra confraternização.😇😇😇😇😇"
23,906138272669327360,1537084752074883072,2022-06-15,"I'm at MorumbiShopping in São Paulo, SP https://t.co/5BtUcm4ycj"
24,1098591459798892545,1537082827900067840,2022-06-15,Acabou de publicar uma foto em Lanchonete E Restaurante Unidez https://t.co/9cNSXhsfRi
25,203053141,1537078850856792066,2022-06-15,"eu tô de Fendi, Fendi. 
bem que tal?! 💫 
LINK NA BIO ✅
#lágrimascai em Por Enquanto Em São Paulo https://t.co/Lc4s6GTASz"
26,318056797,1536974148890656773,2022-06-15,Você se lembra quando começou a fazer parte do Twitter? Eu me lembro! #MeuAniversárioDoTwitter https://t.co/dFQZcitjtQ
27,1047151406199840768,1536941128599097345,2022-06-15,Bom dia! em Núcleo Espírita Paulo de Tarso https://t.co/rvW6iNKzA9
28,1047151406199840768,1536939575461007360,2022-06-15,"Bom dia! em Santo Amaro, Sao Paulo, Brazil https://t.co/zaNgEZuqvq"
29,1517351939264204800,1536916114688684032,2022-06-15,"Vai lá no Instagram e segue muito💕✨
#instagram #guy #gay #saopaulo https://t.co/UEo0zSqKny"
30,1346299951572283393,1536882255179784195,2022-06-15,"Delicinha 😋🐻❤️ 

Comprando presente de Dia dos Namorados 💝 https://t.co/dYW3IXEAyJ"
31,69801904,1536870433978458113,2022-06-15,"Boa noite!
Bora treinar? 🥶💪💪💪🥵 em Santo Amaro, Sao Paulo, Brazil https://t.co/LnI32mRQ1j"
32,33900482,1536869467669544961,2022-06-15,Encontre coragem para deixar a mesa quando o respeito não estiver mais sendo servido 🍴 #boanoite #avenidabrasil #jantar #explore #gexperience #healthyfood #inspiration em gexperience https://t.co/iCeuzOtab8
33,46030169,1536863029291360256,2022-06-15,Beyond Van Gogh 🌻 https://t.co/VyHOtjMryL
34,57017730,1536835937727938561,2022-06-14,"Job de hoje dentro dessa casa maravilhosa.. Nestlé..
Com os parceiros
@carlosvicentefotoevideo
@wfernandeseventos em Edifício 17007 Nações https://t.co/Cf2tRED8KN"
35,1474060879,1536830326286213121,2022-06-14,Mais um dia de trabalho concluído https://t.co/mFELlGpiTq
36,983761072644648960,1536818049336201216,2022-06-14,E o @artbattlebr que mandou uma batalha digital para o lançamento do  Lenovo Yoga i9 da @Lenovobr  na exposição do Van Gogh 🎨🖌️ https://t.co/zoQFIB3UiG
37,201882598,1536811990324215808,2022-06-14,"Pesteeeeeee ❤️🐶 não vale nada mas eu amo!!! em Santo Amaro, Sao Paulo, Brazil https://t.co/HEU9QzPfCe"
38,28503856,1536799129786982400,2022-06-14,"Acabou de publicar uma foto em Ráshuah SP - Meditação, Autoconhecimento e Terapias. https://t.co/wjT7UrD8aN"
39,69801904,1536777981636616197,2022-06-14,"Boa tarde!
Good afternoon!
☀️🥶 16°C em Santo Amaro, Sao Paulo, Brazil https://t.co/gqtBEq63go"
40,60938683,1536720457591824385,2022-06-14,"Um pouquinho da experiência do #beyondvangoghbrasil de SP, enquanto a versão Recife não chega! em Beyond Van Gogh Brasil https://t.co/Fyb62UMZVR"
41,1478545454375841800,1536694387979190281,2022-06-14,"O que valoriza o seu trabalho é o ânimo e a atenção que se usa para realizá-lo.
#orgulhoempertencer #santander
♨️💪🏾 https://t.co/haJLZnWvLM"
42,1047151406199840768,1536581479152640002,2022-06-14,Bom dia! em Núcleo Espírita Paulo de Tarso https://t.co/RFGQnjtyEs
43,1047151406199840768,1536581152487653377,2022-06-14,"Bom dia! em Santo Amaro, Sao Paulo, Brazil https://t.co/JAW8QOLTQT"
44,69801904,1536566640216883200,2022-06-14,"Boa noite e uma excelente terça-feira
8°C aqui no Jardim Promissão 🥶 em Jardim Promissão, São Paulo https://t.co/HpsxGxY2Mm"
45,120556049,1536517036079206403,2022-06-14,#gratidão @hiltonlutfi pela aquisição de minha obra Tulipas exposta no grandioso evento do grupo @altagestao  @pintorescomabocaeospes em Palácio Tangará https://t.co/vOg98gMu1n
46,69801904,1536507767883804672,2022-06-14,"Missa em honra a Santo Antônio
#paroquiasagradafamilia em Paróquia Sagrada Família - Diocese de Santo Amaro https://t.co/G65eMfNjII"
47,3818384296,1536474923744604161,2022-06-13,"“eu sonho minhas pinturas e depois pinto meus sonhos”
que sejamos livres como os girassóis de Vicent Van Gogh 🌻✨
.
.
.
.
.
.
.
#beyondvangogh #shoppingmorumbi #art #exposição #vangogh #girassol em Morumbi Shopping https://t.co/6c7xJyThXf"
48,33325255,1536474654936043520,2022-06-13,Acabou de publicar uma foto em Beyond Van Gogh Brasil https://t.co/QBmanoM20J
49,1043656791693889536,1536462144111353857,2022-06-13,"Eu na sala de espera do consultório com meu filho, mas ligada no space da @Lalinhafofoca, é so bafos em cima de bafos. As melhores notícias, fofocas e boas gargalhadas num mesmo lugar 👏👏👏
 
#Fofocadalalinha"
50,128670508,1536459225035055104,2022-06-13,👔👔 em Espaço Wood Chucri Zaidan https://t.co/pVT8Hvq3n6
51,41175670,1536454993808613377,2022-06-13,"#Sunset 
#PorDoSol https://t.co/YMSPRn0uOs"
52,3033546384,1536445435258318848,2022-06-13,"Não é fácil, mas vale a tentativa todos os dias!!! em Parque Global https://t.co/wORNmOmKmE"
53,69801904,1536442476705243139,2022-06-13,"Acabou de publicar uma foto em Santo Amaro, Sao Paulo, Brazil https://t.co/ZZRc9FgTGJ"
54,106859192,1536440223910965248,2022-06-13,Ser fiel aos seus princípios é o que faz de você alguém especial. ☮️  ❤️‍🔥 em Vibra São Paulo https://t.co/WL4MZ1K495
55,1173404465522782209,1536435389833035777,2022-06-13,Acabou de publicar uma foto em The Doctors Ink Studio Tattoo https://t.co/qI8xoV6Fuw
56,1516429790064095233,1536368404591828994,2022-06-13,"Corpo em construção,  🚧🏗⛔🚫 em Smart Fit Shopping Mais Largo 13 https://t.co/5jb7dpaiTA"
57,71877526,1536366783799513088,2022-06-13,Acabou de publicar uma foto em Vibra São Paulo https://t.co/9mUJ2HBZdb
58,2374912899,1536341920598872066,2022-06-13,Coletiva de Imprensa começa com 1 minuto de silêncio para as vítimas do COVID -19 #pride #ParadaSP https://t.co/kdfSTUCBpR
59,623050661,1536336881662799873,2022-06-13,"A oportunidade que você estava esperando de sair do aluguel.
Dueto Morumbi, apartamentos de 45 m², pronto para morar.
São 2 dormitórios.
Varanda.
1 vaga de garagem coberta.
Depósito é vagas adicionais São opcionais.
Agende uma visita pelo fone:(11) 9 6931-9745  ou (11)9 7982-1730 https://t.co/D3Qro9B1EN"
60,36289190,1536295704007671808,2022-06-13,Acabou de publicar uma foto em Jd.Marajoara https://t.co/JHsGR3orVr
61,1516429790064095233,1536261262295932930,2022-06-13,"Manhã gelada , trabalhar de segurança á noite não é fácil  #BalançoGeral https://t.co/D2n6oaBSkw"
62,1047151406199840768,1536223246663553024,2022-06-13,Bom dia! em Núcleo Espírita Paulo de Tarso https://t.co/Pu0gmCwSPT
63,1047151406199840768,1536220828811108352,2022-06-13,"Bom dia! em Santo Amaro, Sao Paulo, Brazil https://t.co/bPiMdZGrMH"
64,27921417,1536176397307240448,2022-06-13,Acabou de publicar uma foto em Fasano Sao Paulo https://t.co/B40ubK6EfI
65,33325255,1536162260355207169,2022-06-13,Acabou de publicar uma foto em Beyond Van Gogh Brasil https://t.co/0jxFGw4mHX
66,69801904,1536155308610953216,2022-06-13,"Boa noite congelante 🥶🥶🥶🥶
10°C em Santo Amaro em Santo Amaro, Sao Paulo, Brazil https://t.co/n52Qe5w2p6"
67,40545750,1536154599760986112,2022-06-13,Acabou de publicar uma foto em Beyond Van Gogh https://t.co/QayV2utIfH
68,40545750,1536154585273884682,2022-06-13,Acabou de publicar uma foto em Beyond Van Gogh https://t.co/DmXE6GzNZp
69,40545750,1536154566730866690,2022-06-13,Acabou de publicar uma foto em Beyond Van Gogh https://t.co/OsHEELOoqS
70,40545750,1536154543896965120,2022-06-13,Acabou de publicar uma foto em Tartuferia San Paolo - Restaurante Italiano https://t.co/dmnxLrYoAu
71,40545750,1536154524141993985,2022-06-13,Acabou de publicar uma foto em Tartuferia San Paolo - Restaurante Italiano https://t.co/aWkr0xvqkF
72,40545750,1536154510149623809,2022-06-13,Acabou de publicar uma foto em Tartuferia https://t.co/fgJeafLBev
73,104889558,1536132482348855298,2022-06-12,"Happy Valentine’s Day!
❤️U2🌙&amp;🔙 my dear husband ✨ em Vibra São Paulo https://t.co/v1UI7EHYyh"
74,36993251,1536127332150222848,2022-06-12,don't you know that i am right here? em Boavista Shopping https://t.co/Y0ACIGpVa5
75,838833999334227968,1536125655842275328,2022-06-12,Acabou de publicar uma foto em Palácio Tangará https://t.co/PMiBtC0kbV
76,85834455,1536122170472022017,2022-06-12,"😻😻 
#diadosnamorados em Jd.Marajoara https://t.co/nVjXW7OMq9"
77,340470755,1536115990441996288,2022-06-12,"darling, let me trace the lines on your tattoed heart. ♡ #oldroll #fotografiaamadora #saopaulocity #sp #lgbtbrasil em Boavista Shopping https://t.co/zThHyzVT5l"
78,40545750,1536115167553114112,2022-06-12,Só para registar um dos meus pratos favoritos 🫶🏻 https://t.co/u8R97l8eng
79,36748548,1536112678258745344,2022-06-12,"I'm at Extra Hipermercado - @familiaextra in São Paulo, SP w/ @_ponkitz https://t.co/TtaoZFRqed"
80,251874401,1536076661137068034,2022-06-12,"Lançamento de mais 2 livros como coautor da academia europeia da alta gestão e minha condecoração como conselheiro. Feliz, grato e grato. Ah.. grato também. em Palácio Tangará https://t.co/yEKECL3G2f"
81,73161380,1536011880107364352,2022-06-12,Acabou de publicar uma foto em Macapá - AP https://t.co/X4UXQkzmhC
82,197927723,1536010554518958080,2022-06-12,Aquele 10 km de domingo https://t.co/tqbIFn1jRx
83,2895337118,1535985841108967424,2022-06-12,Show do #Doasinfinuty em São Paulo! Fukai mori ao vivo foi mto maravilhoso! @BeTatiane https://t.co/AdBWchKJYj
84,120556049,1535983601510129664,2022-06-12,#gratidão #emoção @altagestao @pintorescomabocaeospes em Palácio Tangará https://t.co/zMWJSumTWe
85,120556049,1535981015000223745,2022-06-12,#gratidão @manograssopaola @altagestao @pintorescomabocaeospes @cristianolagoas @selmachagasdias #lançamentodelivro em Palácio Tangará https://t.co/VKWagEykm0
86,2695073968,1535978334462660608,2022-06-12,Acabou de publicar uma foto em Palácio Tangará https://t.co/OZpFXirQpm
87,73503309,1535978009647357953,2022-06-12,Just posted a photo @ No Coração https://t.co/ctCfewXSkI
88,25577896,1535952797446705153,2022-06-12,12 de junho Domingo 19h  … 19h … 19h … 19h @ Palácio Tangará https://t.co/YttD0kmb5i
89,1164893212592525312,1535951227690881024,2022-06-12,"Tamo de parabheissss!🖤🎶
Tu és maravilhosa, um love🎶 em Mais Shopping https://t.co/3UYbr5kiIV"
90,1520477884292476929,1535935096695492608,2022-06-12,O primeiro do dia derruba🥶 https://t.co/vqS69r5Twh
91,3063931179,1535903794504028160,2022-06-12,Acabou de publicar uma foto em Universal João Dias - SP https://t.co/Xzt5x2lusK
92,1047151406199840768,1535865762979663872,2022-06-12,Bom dia! em Núcleo Espírita Paulo de Tarso https://t.co/WnUuAKUL1P
93,1047151406199840768,1535865522830680066,2022-06-12,"Bom dia! em Santo Amaro, Sao Paulo, Brazil https://t.co/DlHNjweQsO"
94,120556049,1535848678002499584,2022-06-12,#gratidão #lançamentodelivro #jantardegala @cristianolagoas @pintorescomabocaeospes @altagestao @manograssopaola @marcelo_almeida1710 em Palácio Tangará https://t.co/MrNEMyRtid
95,120556049,1535846625653968902,2022-06-12,#gratidão #lançamentodelivro #jantardegala @cristianolagoas @pintorescomabocaeospes @altagestao em Palácio Tangará https://t.co/Lua5YAZPgW
96,2845855215,1535841214901145600,2022-06-12,"I'm at Mansão Arabésque in São Paulo, SP https://t.co/CwKxhY2NN7 https://t.co/WnfzUUDF7y"
97,69801904,1535840109186142208,2022-06-12,"Um abençoado domingo para todos nós 🙌 em Santo Amaro, Sao Paulo, Brazil https://t.co/78cItWk3PC"
98,106859192,1535831899100291074,2022-06-12,"Que show meus amigos, que vibe #klb em Vibra São Paulo https://t.co/jvETfnhIB9"
99,181639791,1535822235763613697,2022-06-12,Acabou de publicar uma foto em Salão Cor da Jamaica https://t.co/DCpU3v5QMU
100,2214807172,1535812504294662144,2022-06-12,"Não é sempre que você é recebido com uma taça de vinho branco por @CamilaPitanga, que esbanja beleza e talento no espetáculo “Por que não vivemos?” de Tchecov, com direção de Márcio Abreu. https://t.co/6mdUaGz2h4"
101,4236705497,1535807001049063424,2022-06-12,"Não é por nada não, mas alguém perdeu um pato(a)? Apareceu aqui no meu condomínio!!!! Hahahaha Jesus socorro!!!
#pato https://t.co/QYNP9m1gmu"
102,33900482,1535783964215939072,2022-06-12,Aproveitando que hj tem UFC.. fica aí o registro..te cuida @gloverteixeira 💪🏻 #ufc #gexperience #mma #luta #pesagem em gexperience https://t.co/1RFK4Ni4hK
103,41444151,1535763772412940288,2022-06-11,"Captando ideias...

#vocalistlife #vocal #vocalist #sennheiser #microphone #microfone #audioproduction em Louie Louie bar https://t.co/IkH1vP3c0E"
104,31228871,1535761539470344192,2022-06-11,Arraial do Suíço!!!🌽🌭👢❤️ em Escola Suíço-Brasileira de São Paulo / Schweizerschule São Paulo https://t.co/t5znQ7Atss
105,138796935,1535759674494136320,2022-06-11,Acabou de publicar uma foto em Colégio Santa Maria https://t.co/NOe1Lo5qwt
106,60369902,1535751681094209536,2022-06-11,Photo Dump - date ♡🍷 em Palácio Tangará https://t.co/ukQ6kiajaC
107,73493771,1535742260213596160,2022-06-11,I'm at Santo Antônio Da Chácara in SP https://t.co/grlWF9ZZkP
108,27279878,1535740615878660102,2022-06-11,Acabou de publicar uma foto em Arena BTG https://t.co/GsetbXTFTB
109,270069773,1535738367706636291,2022-06-11,Agora eu sou um ator global… em gexperience https://t.co/xCFnXvrJiW
110,83720016,1535735626896756743,2022-06-11,"Porque não vivemos? c/ @CamilaPitanga (@ Teatro SESC Santo Amaro in São Paulo, SP w/ @fcterras) https://t.co/CZSrvFpxoE"
111,369664223,1535735551281831944,2022-06-11,turistando na minha nova cidade @ Morumbi Shopping https://t.co/NgzjafOj7t
112,369664223,1535730523359875078,2022-06-11,passeando https://t.co/MELN0M67HM
113,855430412,1535727902813298688,2022-06-11,🏎✨ https://t.co/5hSbloYkiS
114,69801904,1535693623802548224,2022-06-11,Bora aquecer o esqueleto 💪💪💪🤣🤣🤣 em Smart Fit https://t.co/qdbnOYaokk
115,1411856143488622596,1535678780311801856,2022-06-11,e eu que fui na exposição do #vangogh em Sp🫶🏻😭 https://t.co/qqCHsKnpMo
116,60369902,1535654030013149185,2022-06-11,"Tô ou não tô muito chique? 🗣🥂✨ 
ahhh, e ainda realizei o meu sonho de foto! 🥹 hahaha a @mamsampaio manda muito, af! ♡

.
#palaciotangara em Palácio Tangará https://t.co/uAo0FW3coh"
117,8539842,1535646789608546304,2022-06-11,"@nandoreis lotou o @vibrasaopaulo ontem num show cheio de Hitz. Poeta que chama, né?

#nandoreis #music #show #photoconcert #vibrasaopaulo #arfocsp em Vibra São Paulo https://t.co/hn4wudvjXO"
118,31228871,1535646147544498177,2022-06-11,"Olha a cobra, é mentira...🌽 em Escola Suíço-Brasileira de São Paulo / Schweizerschule São Paulo https://t.co/YE1VeannOL"
119,69801904,1535627075037835264,2022-06-11,"Bom dia gelado em São Paulo!
13°C aqui em Santo Amaro
Um excelente sábado para todos nós! em Santo Amaro, Sao Paulo, Brazil https://t.co/HztfLeQx05"
120,913175362842001408,1535601013217951747,2022-06-11,Agenda do dia: palestra sobre engenharia civil na feira de profissões. https://t.co/U4hDI9JZR7
121,3033546384,1535591900392083456,2022-06-11,Bom é estar contigo SENHOR! em Parque Global https://t.co/c95tZ423uG
122,1047151406199840768,1535522295271284736,2022-06-11,"Acabou de publicar uma foto em Santo Amaro, Sao Paulo, Brazil https://t.co/teLzdA0V9G"
123,1047151406199840768,1535506962686918656,2022-06-11,Bom dia! em Núcleo Espírita Paulo de Tarso https://t.co/4whSpzIuCH
124,69801904,1535489667524874240,2022-06-11,"Bom fim de semana para todos nós!
(Com as fotos do treino de bíceps dessa sexta-feira rs) em Santo Amaro, Sao Paulo, Brazil https://t.co/FDdUpatSgP"
125,2278090306,1535427598804819969,2022-06-11,"Feliz dia dos namorados à todos !!!
* Ae Danielle já tá valendo heinm !!! 😅 em Tokio Marine Hall https://t.co/fi7jkT8M1q"
126,304730976,1535417275829800960,2022-06-11,Rock night sextou Rock. Boas noites Rock em Louie Louie bar https://t.co/icCqrcmknN
127,304730976,1535416836975521792,2022-06-11,Boas noites Rock friends and rockers.sextou Rock night.cuidado a COVID não acabou e varíola de macaco já está no Brasil é bem pior. em Louie Louie bar https://t.co/MC21xSWYGf
