,author_id,tweet_id,created_at,text
0,826229336,1624897454716993537,2023-02-12,Acabou de publicar uma foto em Terra Dourada Integração Ambiental https://t.co/GFp74TNTj4
1,732387436446240768,1624869493523488768,2023-02-12,@sri2kreddy120 https://t.co/Ib20AnpbyC
2,36036799,1624860802934091776,2023-02-12,Just posted a photo @ Holambra https://t.co/BNqOYLEZ7U
3,732387436446240768,1624829889143533569,2023-02-12,Domingou! https://t.co/yOe9IqYLe1
4,1615688082065326080,1624807989302423552,2023-02-12,Resultado Final 👇 https://t.co/IgsJJtdAeX em Macapá - AP https://t.co/jbn5ajwYWG
5,107785164,1624778154010202113,2023-02-12,Acabou de publicar uma foto em Yacht Club https://t.co/jhWIJzvYDG
6,1103370507070726144,1624772746445037570,2023-02-12,Acabou de publicar uma foto em Teatro Paulo Eiró https://t.co/9F8TsDIVP1
7,303478419,1624768636295729152,2023-02-12,"Two baddies, two baddies, one Porsche 🎶

#nct127 #neocity #thelinktour #ncttour em Vibra São Paulo https://t.co/cCLwWu2YVT"
8,1014174368,1624617471784235009,2023-02-12,19 anos... em Vicolo Nostro https://t.co/wIzEHeAKJj
9,35015510,1624578611125620736,2023-02-12,Começou! #NandoHits https://t.co/G515VKy4gl
10,199706558,1624575874904236033,2023-02-12,QUEM VIVE SEM CHOCOLATE?  FALA PRA MIM.  SIMPLESMENTE IMPOSSÍVEL!!! 🥰🥰🥰 em Em Casa https://t.co/BwVOvLdJe4
11,66565714,1624567996751695872,2023-02-12,Uma mulher de unhas dos pés feita com francesinha não quer Guerra com neguem!!!🤣🤣🤣🥂🥂🥂 em Granja Julieta https://t.co/dNdFofjx4y
12,905801733347139591,1624559253682880512,2023-02-12,"Só uma por hoje 😃
Vai Palmeiras 💚💚💚💚

Quem vem ??😅😅😅 https://t.co/cGdVpy6Fqc"
13,3346948101,1624511529801465857,2023-02-11,Just posted a photo @ Parque Severo Gomes https://t.co/ICvfsxxY0M
14,475298385,1624495544163868674,2023-02-11,"Programa Mulher Em Questão com Priscila Cardoso na rádio Nova Morada AM1260 
.
.
.
#informação #Entrevista #Entretenimiento #mulheremquestão https://t.co/NT6EHx1wg8"
15,170735796,1624488637063725058,2023-02-11,Acabou de publicar uma foto em Transamerica Expo Center https://t.co/2114P0AVYh
16,150413399,1624480776774467591,2023-02-11,"Eu U MILHO!
Lembrei do diretor @marceloamiky visitando ontem o @gexperience_br e vendo o Milho do @maskedsingerbr ❤️

#maskedsinger em gexperience https://t.co/2yswsk3lTC"
17,68746589,1624469909374631936,2023-02-11,@praieirogastrobar em Macapá - AP https://t.co/W8YYJUnRt2
18,76533729,1624466152599478272,2023-02-11,"@governosp @CPTM_oficial @ViaMobilidade89
@ViaMobilidade89
@tarcisiogdf @governosp @g1saopaulo
Boa tarde um absurdo os banheiros fechados ? https://t.co/Q2H69BFgAv"
19,37104324,1624463811871744003,2023-02-11,Ps. Só p dizer q te amo @cesarfilho 🤍 em Palácio Tangará https://t.co/nu0zz5BQ6t
20,704328194934054912,1624418231850004481,2023-02-11,Deseja mais saber zap ⚡️ crédito LBI: 11 957729915 CRISPIM BRASIL 🇧🇷 FINANCIAL ADVISORY 🇺🇸🇬🇧🇵🇹🇧🇷 em Palácio Tangará https://t.co/auphKohfdx
21,19907731,1624415681818001408,2023-02-11,"começou a garoar na hora que eu entrei aqui vamooo (at @DryWashOficial in São Paulo, SP) https://t.co/PUVGZOQRBG"
22,704328194934054912,1624414159109754880,2023-02-11,Salmão de entrada estava simplesmente PERFECT 😍 em Palácio Tangará https://t.co/hbknDuFbVv
23,704328194934054912,1624413130901295105,2023-02-11,Black Angus com trufas tava bom 😌 hein!?!! 😃👌🏾 em Palácio Tangará https://t.co/v7y2ayTFm4
24,704328194934054912,1624410831160049664,2023-02-11,Gostei da indicação apesar da chuva ☔️!!! Gostei dia desses volto!!! Nota 1000! em Palácio Tangará https://t.co/8L89iDRR2F
25,704328194934054912,1624409762145107969,2023-02-11,E aqui ooohhh tá perdida 😞 ooossshhheee!!! 🤪 kkk em Palácio Tangará https://t.co/hsRkZufLPT
26,84386862,1624294724629569537,2023-02-11,Acabou de publicar uma foto em Alto da Boa Vista https://t.co/2ZZHx1ohd0
27,1279943343464689664,1624258440158760960,2023-02-11,Drinking a Tanger by Cervejaria Dinastia @ All Beers Sessions — https://t.co/Lhab6aWjfo
28,1279943343464689664,1624257689877356545,2023-02-11,"Drinking a Transeunte - Double Juicy IPA com Citra, Galaxy, Hallertau Blanc e Mosaic by Devaneio do Velhaco @ All Beers Sessions — https://t.co/fSZaKjvC3Y"
29,1279943343464689664,1624255441055191040,2023-02-11,Drinking a RED IPA by Molinarius Brewing Co. @ All Beers Sessions — https://t.co/RI0rIhxkRa
30,1279943343464689664,1624254651959853056,2023-02-11,Drinking a Saison Caipirinha 006 by Fermentaria Local @ All Beers Sessions — https://t.co/zd2TCJ7Uz7
31,1279943343464689664,1624254645483839488,2023-02-11,Drinking a Belgian Nr. 10 by Cervejaria Narcose @ All Beers Sessions — https://t.co/8YVS7ZSYWo
32,1279943343464689664,1624254278297690112,2023-02-11,Drinking a CozaDoida Nº 03 - Festa da Laranja - 2021/2022 - Clube Cozalinda  by @cozalindaFLN @ All Beers Sessions — https://t.co/OBMFnvwdk8
33,1279943343464689664,1624253181881360386,2023-02-11,Drinking a Terroir Líquido - 001 Imperial Stout Woodford Reserve Bourbon by Marek Cervejaria Artesanal @ All Beers Sessions — https://t.co/YFIQcREoY9
34,1279943343464689664,1624252903044141057,2023-02-11,Drinking a Dankful IPA by @SierraNevada @ All Beers Sessions — https://t.co/yKZD6RsnAg
35,1279943343464689664,1624252642770796550,2023-02-11,Drinking a Disturbed by Cervejaria Verace @ All Beers Sessions — https://t.co/eby8p4S0gr
36,1279943343464689664,1624252382170185729,2023-02-11,Drinking a Black Hole Groselha Campari by Cervejaria Pineal @ All Beers Sessions — https://t.co/kNA4em7bbe
37,1279943343464689664,1624252373978718209,2023-02-11,Drinking a Caffeine Sunrise by All Beers Conspiracy @ All Beers Sessions — https://t.co/Da9OevlRz2
38,1279943343464689664,1624252149294137345,2023-02-11,Drinking a Reina Sofia by Goose Island Brewhouse São Paulo @ All Beers Sessions — https://t.co/KWdoUFjEU0
39,1279943343464689664,1624252123318820865,2023-02-11,Drinking a Manioko by Cervejaria Prisma @ All Beers Sessions — https://t.co/2MC64s6Jhm
40,1279943343464689664,1624251897409421313,2023-02-11,Drinking a Hermes e Renato Hop Lager by @bastardsbrewery @ All Beers Sessions — https://t.co/IR48T733hx
41,1279943343464689664,1624251869861408768,2023-02-11,Drinking a Cold Zappa by @damabier @ All Beers Sessions — https://t.co/xnBqDbqmBa
42,1279943343464689664,1624251864886771712,2023-02-11,Drinking a Ping of Death by CyBEER Lab @ All Beers Sessions — https://t.co/wG7nzc8Ne9
43,1279943343464689664,1624251641447710721,2023-02-11,Drinking a Sculptured In Stone by Spartacus Brewing @ All Beers Sessions — https://t.co/nnfnMfXCNp
44,1279943343464689664,1624251603610894336,2023-02-11,Drinking a Midnight Sun by Olaf Brewing @ All Beers Sessions — https://t.co/zqZyNFuRCa
45,1279943343464689664,1624251597663469570,2023-02-11,Drinking a Sem Futuro  by Cervejaria 77 @ All Beers Sessions — https://t.co/VW90z07UTm
46,1279943343464689664,1624250897067913216,2023-02-11,Drinking a Weizenbock by Gård Cervejaria @ All Beers Sessions — https://t.co/rGf4TBh95P
47,318056797,1624246285032120322,2023-02-11,"I'm at MorumbiShopping in São Paulo, SP https://t.co/Q04OIedE8G https://t.co/Dh7nsXQG1b"
48,1306623615283101697,1624215670983479296,2023-02-11,Sextoooou lindossss❤️🧡gratidão a todos encontros e reencontros que ocorreram hoje ✨                                  bora para o último ✅
49,40793376,1624212983290204164,2023-02-11,API Rock Team !! @ GoPub https://t.co/pMecgT2VTw
50,77098153,1624206768044662785,2023-02-11,Passeando com as migles!!! em Shopping Morumbi https://t.co/2Cc8lzVOHU
51,40793376,1624204965282545666,2023-02-11,Rock and Friends!! @ GoPub https://t.co/SsFhTFEgAw
52,704328194934054912,1624190482845925377,2023-02-10,"Escolhe 3 pratos por favor 🙏🏾, ajudaaaa!!! 😃🤩😎✌🏾🙏🏾 em Palácio Tangará https://t.co/6njhhpb83W"
53,704328194934054912,1624189930460131331,2023-02-10,Ainda da tempo de chegares??? Hein?!? em Palácio Tangará https://t.co/GWzNssAIBP
54,704328194934054912,1624189608308211715,2023-02-10,Vamos jantar? em Palácio Tangará https://t.co/bHvSJUTBHc
55,76471293,1624179946867376128,2023-02-10,Acabou de publicar uma foto em Jd.Marajoara https://t.co/gjosoK6QLt
56,53371678,1624159738685706240,2023-02-10,"Lançamento Nacional dia 24 de Fevereiro em todas as plataformas Digitais inclusive no YouTube Music 

""Eu Te Prometo Amor""
WShow

acesse 
https://t.co/eTiodmN2V8 em Circo Spacial https://t.co/qYJ1m813dc"
57,197906460,1624077528624205826,2023-02-10,I'm at Nova Portugal in São Paulo https://t.co/H8V5ZVy4q5
58,1613027815,1624063041657528320,2023-02-10,https://t.co/QRkRvpsi2R
59,68746589,1624055596344397829,2023-02-10,@praieirogastrobar em Macapá - AP https://t.co/v7VUYA3q89
60,173462111,1624052996798656515,2023-02-10,"Somos Raros, mas não invisíveis. em TransAmerica Expo Center. Sao Paulo. https://t.co/ld1581SR4g"
61,47776080,1624040165458034691,2023-02-10,#sorryZOOM mas no dia 28/2 tem encontro presencial no @cowcoworkingspace. E as inscrições estão com força total… vagas super limitadas! Quem vem? em COW Coworking Space https://t.co/SOyCGSuqKP
62,25577896,1624018092366917635,2023-02-10,"10.fev., Palácio Tangará, 19h30, sexta em Palácio Tangará https://t.co/ROfE7ishi7"
63,1601687614280683524,1623985656518086658,2023-02-10,"Ao tocar uma alma humana, seja apenas outra alma humana ♥️🫰🏻 https://t.co/FUxphH8dCp"
64,69801904,1623921944461549568,2023-02-10,"Boa noite!
Good night! em Jardim Promissão, São Paulo https://t.co/bq9UE1uaSe"
65,57460575,1623900856566398977,2023-02-10,Hoje teve sessão de aniversário de 25 anos do filme com direito a Le Coeur de la Mer no pescoço. @samukagrecco #Titanic25thAnniversary https://t.co/q6mZzwiMCG
66,1623862262581583873,1623867329703469056,2023-02-10,https://t.co/95ssvszLRp
67,1325826314092285955,1623867044046245896,2023-02-10,"cinema, fodase @ Boavista Shopping https://t.co/qEZr8w0yH8"
68,92896687,1623860525334515712,2023-02-10,Precisando voltar… #tbt em Punta Cana - República Dominicana https://t.co/fsG34uPBXf
69,172628020,1623857737493782528,2023-02-10,Acabou de publicar uma foto em Quality Score Contabilidade https://t.co/Wo0rT0rQwS
70,56427275,1623829564555243520,2023-02-09,"Parafraseando o Mestre @deumas.oliveira :
Carinho de aluno não tem preço, se o aluno tb for professor então…
Obrigado Maurício e muito sucesso pra ti nessa jornada! em Instituto Gourmet - Santo Amaro - SP https://t.co/IdVpc4yXQF"
71,712803270155235328,1623823066496376832,2023-02-09,Acabou de publicar uma foto em Jd.Marajoara https://t.co/900XdvnPoQ
72,764551507459137536,1623817406257790977,2023-02-09,"I'm at Botequim São Paulo in São Paulo, SP https://t.co/Vz4AQL9STB"
73,227811108,1623768642163703809,2023-02-09,"Treinando quase em horário de herdeira (@ Cristal Academia - Aeroporto in São Paulo, SP) https://t.co/4vQcQ5mAj0 https://t.co/PoXso9ejjE"
74,1523671506907246593,1623678294204751872,2023-02-09,Acabou de publicar uma foto em Macapá - AP https://t.co/O3LpzEByAL
75,1282855855977897986,1623670661519405059,2023-02-09,"Prêmio Paralímpicos 2022 🏆

Eleito pela 5x consecutiva o melhor atleta do ParaBadminton 🇧🇷 https://t.co/OY15zRGjZE"
76,37875362,1623653875688304642,2023-02-09,Não aguento ver essa placa sem dar uma risadinha... Nitidamente autor e clientes nunca ouviram falar de pajubá na vida https://t.co/BysLBSklx3
77,69801904,1623568198900629509,2023-02-09,Boa quinta-feira para todos! https://t.co/Tu41Vz9H0D
78,172628020,1623501382744694784,2023-02-09,Acabou de publicar uma foto em Quality Score Contabilidade https://t.co/lwuZIyDQpe
79,339183004,1623481407107436545,2023-02-09,Acabou de publicar uma foto em Avenida Roque Petroni Junior https://t.co/c7XoTsFyzk
80,82958591,1623472980830351361,2023-02-09,"Levando a princesa pra curtir um filme no cinema favorito, a princesa sou eu mesma 💅🏼 (at @Kinoplex Platinum for Knock at the Cabin in São Paulo, SP) https://t.co/xdt5TQnmyX https://t.co/wIzr8uRztw"
81,49370468,1623458041596190720,2023-02-08,I'm at @Apple Morumbi in São Paulo https://t.co/EYsrn56NkI
82,1365427084634521609,1623454418816634882,2023-02-08,@SpaceX @elonmusk aí sim pae
83,58541236,1623396174441971713,2023-02-08,Acabou de publicar uma foto em Mais Shopping https://t.co/MIGTgCkrAq
84,69801904,1623370864400932864,2023-02-08,"Boa tarde!
Dia de dar um trato no cabelo 😊 em Santo Amaro, Sao Paulo, Brazil https://t.co/R7Z0JM8FuM"
85,1615688082065326080,1623364385652543499,2023-02-08,Acabou de publicar uma foto em Macapá - AP https://t.co/WUorZK9WVP
86,183087789,1623349319226245120,2023-02-08,"Lugar especial para pessoas especiais 😂❤️

- Naldo em Montes Claros, Mg https://t.co/Z2dnSsvYlb"
87,58541236,1623290488722804736,2023-02-08,Acabou de publicar uma foto em Morumbi Shopping https://t.co/90ufmmOKsh
88,339183004,1623287350385324035,2023-02-08,"#Metrô (prensado na lata de Sardinha indo pra o trabalho)😂😂😂.

#bomdia @metrospoficial #estacaobrooklin #sp1#bdsp em Estação Brooklin https://t.co/61ENpFHqf8"
89,1014264572952432641,1623268643592175618,2023-02-08,@_Linhas8e9 Esta normal https://t.co/FHvw28c9JE
90,1014264572952432641,1623268263189700608,2023-02-08,@_Linhas8e9 Estação santo Amaro lotada e demora dos trens para passar.
91,151185308,1623138235307229184,2023-02-08,"Acabou de publicar uma foto em Santo Amaro, Sao Paulo, Brazil https://t.co/ippimIQZ8M"
92,11352422,1623135486108930048,2023-02-08,Acabou de publicar uma foto em Varanda Novamerica https://t.co/qzQto7M8zX
93,483444460,1623123884105953280,2023-02-08,💥🎭 em Shopping Morumbi https://t.co/24ub7S0QmZ
94,483444460,1623121994978926593,2023-02-08,@guuz2k em Shopping Morumbi https://t.co/UUEALBF2BQ
95,1298662460078149640,1623070685877747714,2023-02-07,Acabou de publicar uma foto em Escola ZION - Santo Amaro SP https://t.co/0qdWv92URo
96,864583851527598081,1623058389906624513,2023-02-07,Segundo dia na #FENINJER76 apresentando o ciclo de palestras. #mestredecerimonias #apresentadora #jornalista #eventos2023 #locutora https://t.co/YAJzbAu2VP
97,1268564911363444738,1622971238619529217,2023-02-07,"Essa é para aqueles que curtem uma bela safada a deliciosa da ⤵️

@MillySensual 

Esse diamante negro está loca pra realizar os seus fetiches add ela essa delícia vai te levar a loucura de tesão, ela está pronta para os seus fetiches e ae vai encarar ??? 😈🔥 https://t.co/i84atxrF28"
98,47776080,1622941153635999745,2023-02-07,Acabou de publicar uma foto em COW Coworking Space https://t.co/H7bm4ad8VU
99,74871050,1622929172250099714,2023-02-07,"I'm at Consulado Geral dos Estados Unidos da América - @embaixadaeua in São Paulo, SP https://t.co/cMjTzNWtXN"
100,172628020,1622782646966157313,2023-02-07,Acabou de publicar uma foto em Quality Score Contabilidade https://t.co/UWT03XvuHT
