,author_id,tweet_id,created_at,text
0,92010174,1640264034707546114,2023-03-27,"""Não se afobe, não
Que nada é pra já"" 

Esperei tanto para finalmente ver Chico Buarque em ação, um dos grandes responsáveis por me fazer gostar tanto da nossa música brasileira.

De quebra, mais uma vez Mônica Salmaso e sua voz incrível cantando com o coração. https://t.co/r7Kttk7eJd"
1,1581701925506105344,1640188323342831616,2023-03-27,Dia 29/03 estarei fazendo aquele show maravilhoso pra vcs no Muchachos conto com a presença de todos vcs 😘 https://t.co/3jNL9FLJts
2,1414984050675224576,1640151274321584129,2023-03-27,Finalizando os trabalhos do fds...#Madero https://t.co/W8eKEDUOf4
3,39924479,1640119955084705794,2023-03-26,"Don't be shy. Score a job like ""Director, Network Products-Switching &amp; Operations"" at Mastercard by asking for referrals. It's a great way to get a meeting with HR. Check out the link in our bio to apply. #ProductManagement"
4,69801904,1640077364930519040,2023-03-26,Deixa eu erotizar um pouco por aqui... sinto muito se eu ofender alguém... mas posto o que quiser na minha conta 🤣🤣🤣 https://t.co/vctrwSUIkS
5,318056797,1640019457476108289,2023-03-26,"I'm at Choppizza in São Paulo, SP https://t.co/whWUPrPebh https://t.co/5mZHsJ0vYw"
6,1638477698497495041,1640009896090382343,2023-03-26,"@rosaliaonbr @mikeshardbrasil EU TO AQUI NA PORTA LITERALMENTE ME TREMENDO E CHORANDO ME AJUDEM POOOOOOOORFAVOR 

#MikesnoLollaBR https://t.co/LjmrfqrE8y"
7,86780048,1639778338305654784,2023-03-25,"Agora a gente é da cultura (@ Vibra São Paulo in São Paulo, SP w/ @camillehikari) https://t.co/QlQVzBgu5Q"
8,6256732,1639698224125468673,2023-03-25,🏍️ 💨 (@ Autostar Harley-Davidson® Santo Amaro in São Paulo) https://t.co/3Is6J0JIhB https://t.co/lYeZLEwZ3q
9,1542621577468067842,1639658390237454336,2023-03-25,"I'm at Estação Santo Amaro (CPTM) - @cptm_oficial in São Paulo, SP https://t.co/0lwrjZgl2o"
10,110688963,1639616492445782016,2023-03-25,"Ovos (@ Mantiqueira em Casa in São Paulo, SP) https://t.co/qEATdlHxo0"
11,44300313,1639387639009906688,2023-03-24,"a herança parte 2 (@ Teatro @VivoEmrede in São Paulo, SP) https://t.co/yPuIqCEV1y"
12,318056797,1639377389829636096,2023-03-24,"I'm at NY Barbearia in São Paulo, SP https://t.co/QvbtwEz0bG https://t.co/kR3pHNDEMz"
13,73493771,1639291744050200577,2023-03-24,"I'm at MorumbiShopping in São Paulo, SP https://t.co/LBNN1hbSIk"
14,73493771,1639284729902923777,2023-03-24,"I'm at Franguito in São Paulo, SP https://t.co/ZnIpe4EFft"
15,73493771,1639213416324931584,2023-03-24,"I'm at Honda South America in São Paulo, SP https://t.co/IgGBPdOVcp"
16,2378685033,1639053591934533633,2023-03-23,Você se lembra de quando ingressou no Twitter? Eu me lembro! #MeuAniversárioNoTwitter https://t.co/yRmJEbxqxz
17,1414984050675224576,1638905353545867267,2023-03-23,Deus é maravilhosoooooo!!!!
18,1637140739049005058,1638890589486997507,2023-03-23,"BOM DIA! LIVE ON 🔥

Bora contratar os jogadores mais brabos do mundo🔥

https://t.co/gfBMgbKYh0"
19,69801904,1638763659752030211,2023-03-23,Boa quinta-feira! https://t.co/kZ2GY2tcQ8
20,245585173,1638517245860102144,2023-03-22,Confira minha atividade no Strava: https://t.co/rStlRwRiQX https://t.co/rla0cDHv9l
