,author_id,tweet_id,created_at,text
0,1283794088047923202,1530214961586262016,2022-05-27,https://t.co/K5hejFVWOy
1,1283794088047923202,1530214280548728833,2022-05-27,"Amigos boa tarde,eu estou com uma gripe muito forte e agora tomando novos antibióticos,porém eu tô com uma tosse horrível que dói o peito,para aliviar foi receitado o Loratadina Xarope,porém está em falta nas UBS e não disponho de nenhum valor para compra,alguém que possa doa lo? https://t.co/Ad49CNj1bX"
2,14350111,1530204537646202883,2022-05-27,Acabou de publicar uma foto em Cross Life Artur Alvim https://t.co/Z6NCkhCH8d
3,91228249,1530016677739503630,2022-05-27,Partiu oitavas! 👊🏾⚫️⚪️🦅🦅 #VaiCorinthians #zl #Corinthians #Libertadores https://t.co/sC3SKIP99o
4,1529952872686837770,1529974667901128718,2022-05-26,https://t.co/dfk0dozY1f
5,931277060550680576,1529972510439137286,2022-05-26,"Gostozim ouvir um torcedor Gritando ao desembarcar na Estação Corinthians-Itaquera:

""V A I    C O R I N T H I A N S."""
6,1270720282655813634,1529964709503545344,2022-05-26,itaquera quebrada de corinthiano!! https://t.co/aRTSLlXOp1
7,954918709553922048,1529950532412006408,2022-05-26,🎱 https://t.co/bEIThxxkau
8,1197503500084764672,1529943080706637824,2022-05-26,Curtindo aquele cafezinho antes do jogo...Vai @Corinthians  !!! https://t.co/IZ868UEqlp
9,34123254,1529938549134573576,2022-05-26,Um brinde a possibilidade de 48 pts no primeiro turno e nem to falando do Corinthians no Brasileirão https://t.co/AKc6coHOXZ
10,137055378,1529930877110820864,2022-05-26,Ja pode Amém 🙏🏽 https://t.co/ZaA0dwY92h https://t.co/rpDJKj4MHB
11,1097786900105048065,1529923125743435787,2022-05-26,Já tô por aqui • CAMISA 12 • 1971 https://t.co/pJ8mJowqOM
12,2713527322,1529880034592272385,2022-05-26,"Preparem-se para esse festival maravilhoso! Link na bio.
#lgbtq🌈  #standup #aquenda #hamsa em Hamsa Comedy https://t.co/4MfeEJoUWP"
13,1283794088047923202,1529867190823952385,2022-05-26,"Esse é o nosso príncipe Chacal,como podem ver ele está bem corado,gordinho e é bem cuidado,aqui nós somos humildes mais o amor aos animais é incondicional. https://t.co/Jh9th55QTr"
14,965657854144335873,1529841805348454401,2022-05-26,Acabou de publicar uma foto em Brasil https://t.co/zqDuvwubnb
15,459332230,1529799425589227520,2022-05-26,"Acabou de publicar uma foto em Itaquera, Sao Paulo, Brazil https://t.co/0b6mElWyAG"
16,55909800,1529674345265741824,2022-05-26,"Processos pedagógicos pressupõem o mínimo de intencionalidade junto a processos sociais,  contendo em si, contextos educativos.  Ou serão apenas exercícios egocêntricos de uma  classe pseudo intelectual distante das teorias, filosofias, dogmas e trololós figurantes de time lines."
17,1204870873414549506,1529648816525295616,2022-05-26,"#BDSP #Hora1 
Precisamos de ajuda. A linha 3795/10 (Jd. São Carlos saindo do metrô Itaquera) não segue os horários programados. Tinha saída prevista para 23h10 no sistema olho vivo, mas, não aconteceu. Alo @sptrans https://t.co/UCiWSm0MuV"
18,459332230,1529634547482169344,2022-05-26,"Acabou de publicar uma foto em Itaquera, Sao Paulo, Brazil https://t.co/o5ENEXKYbV"
19,459332230,1529537696779190273,2022-05-25,"Meu boxeador, muito lindo e cuidado quem mexer com ele, é bravo e derruba no primeiro roude kkkkkk 🤼‍♀️🤼‍♀️🤼‍♀️ em Itaquera, Sao Paulo, Brazil https://t.co/d1nw1jQC5Z"
20,1133081081966731264,1529448572604784641,2022-05-25,Acabou de publicar uma foto em SM Sports https://t.co/cs8m7MWflY
21,459332230,1529371060461785089,2022-05-25,"Acabou de publicar uma foto em Itaquera, Sao Paulo, Brazil https://t.co/XuE56ctc0s"
22,459332230,1529360410096373761,2022-05-25,"Acabou de publicar uma foto em Itaquera, Sao Paulo, Brazil https://t.co/a44xsrljmJ"
23,459332230,1529359513152851968,2022-05-25,"Acabou de publicar uma foto em Itaquera, Sao Paulo, Brazil https://t.co/6gLE0TNg5X"
24,459332230,1529358872611373056,2022-05-25,"Lindo texto em Itaquera, Sao Paulo, Brazil https://t.co/dzewqNugKw"
25,1235513679757615104,1529237605908357120,2022-05-24,"fim da mudança, tamo em Itaquera agora numa casinha que tem até descarga. tá melhor que antes hHahHh"
26,526528864,1529203355314180098,2022-05-24,"Pôr do Sol em Itaquera, Sao Paulo, Brazil https://t.co/oP2x774u9p"
27,1283794088047923202,1529138215264854020,2022-05-24,"Quero fazer meu apelo,preciso muito dos medicamentos: Dicloridrato de Betaistina 24mg / Simeticona / Omeprazol / Diazepam 0,05mg ou 0,10mg quem puder doar eu agradeço 🙌"
28,1283794088047923202,1529138212039446531,2022-05-24,"Boa tarde,estou doando os itens abaixo.

1 cartela comprimidos celestrat
1 estetoscópio
1 livro para uma vida iluminada - Seicho-no-ie

Entrego somente nas estações Artur Alvim e Corinthians Itaquera

São Paulo capital zona leste Itaquera https://t.co/qt1VHDQtzB"
29,859111550623387649,1529132049747136520,2022-05-24,"Venha fazer a sua cotação.
Não perca tempo!
#segurança
#gusttavolima 
#carro 
#caminhoneiro 
Vem para BEM PROTEGE https://t.co/JShXP7cPLn"
30,27566436,1529122364813893632,2022-05-24,férias dia 1. em Jd Nordeste https://t.co/R849yBaNcd
31,459332230,1529059079833935872,2022-05-24,"Acabou de publicar uma foto em Itaquera, Sao Paulo, Brazil https://t.co/iejaucUBbH"
32,459332230,1529029570166304770,2022-05-24,"Acabou de publicar uma foto em Itaquera, Sao Paulo, Brazil https://t.co/RXxjxlpQkP"
33,459332230,1529028856618917890,2022-05-24,"Acabou de publicar uma foto em Itaquera, Sao Paulo, Brazil https://t.co/gW8hG8cAZP"
34,459332230,1528987361358454788,2022-05-24,"Acabou de publicar uma foto em Itaquera, Sao Paulo, Brazil https://t.co/nsKEhxaNWu"
35,459332230,1528985283072507905,2022-05-24,"🥲🥲🥲🥲💔💔💔 em Itaquera, Sao Paulo, Brazil https://t.co/vpZlLSya6e"
36,459332230,1528935714968293378,2022-05-24,"Acabou de publicar uma foto em Itaquera, Sao Paulo, Brazil https://t.co/BzavbQIGj4"
37,1283794088047923202,1528797360654008320,2022-05-23,"Boa tarde a todos,alguém sabe me orientar para casos de dengue? Quais medicações podem e não podem? Oque substitui o soro do posto? 🤔 Meu companheiro foi confirmado com dengue e está em observação por 15 dias,não está tendo melhora e tem febre 2x por dia 😷 https://t.co/wpq8T5LbxD"
38,156049334,1528763077612773378,2022-05-23,Timão 1 x 1 trikas 👋 @Corinthians https://t.co/yLlmdD4EYM
39,1101214225626775552,1528548031498428417,2022-05-23,Momentos do dia ✨ https://t.co/iQukdHwWlu
40,1338129926726291456,1528547515494187009,2022-05-23,Escalação prontinha pra mais um clássico . https://t.co/qOieP3GEBn
41,2786057416,1528505219063095298,2022-05-22,🖤 https://t.co/MFyr9L8bm4
42,1381980799831056384,1528501062436630528,2022-05-22,TE AMO CORINTHIANS https://t.co/wMenxCWvXe
43,2991833872,1528489840018268161,2022-05-22,"Obrigada @alca71rj 
💙🤘🏻🎸 em Itaquera, Sao Paulo, Brazil https://t.co/UCvSSH7KLY"
44,459332230,1528483202754568192,2022-05-22,"Acabou de publicar uma foto em Itaquera, Sao Paulo, Brazil https://t.co/z5oZGhTOk1"
45,241533539,1528471096604954626,2022-05-22,"""Café das cinco""

#pordosol #pordosolnaquebrada #cafe #cafenossodecadadia #luzesombra #entardecer #crepusculo #autoretrato #fotografesuaquebrada em Itaquera, Sao Paulo, Brazil https://t.co/cQBtJwyhzH"
46,284058920,1528435465359171584,2022-05-22,"Sempre apoiando, torcendo e gritando: VAI CORINTHIANS!!! em Arena Corintinhans https://t.co/zB0xLYImyw"
47,459332230,1528415454469017601,2022-05-22,"Acabou de publicar uma foto em Itaquera, Sao Paulo, Brazil https://t.co/JHaRXSYpey"
48,459332230,1528413615035781122,2022-05-22,"Acabou de publicar uma foto em Itaquera, Sao Paulo, Brazil https://t.co/KkMxJ18xTk"
49,459332230,1528413438954721280,2022-05-22,"Acabou de publicar uma foto em Itaquera, Sao Paulo, Brazil https://t.co/qPhtndMnIF"
50,1351148295012425729,1528408965813526529,2022-05-22,"#VAICORINTHIANS 
#BEMVINDOAOHOSPICIO
#AQUINÃO
⚫⚪🦅
🤪🤪🤪🤪🤪🤪 https://t.co/QROt5R8WZM"
51,3033548951,1528389054001201152,2022-05-22,"Já começou o esquenta!!!!
#VaiCorinthians 

@cynthiadfs 
@pamluna 
@SccpAH https://t.co/1Y278ZNeJ2"
52,459332230,1528316435218325504,2022-05-22,"Acabou de publicar uma foto em Itaquera, Sao Paulo, Brazil https://t.co/t72jJoC7Ws"
53,318228108,1528184044634218501,2022-05-22,Acabou de publicar uma foto em Athur Alvim Sao Paulo https://t.co/fyhvYk60tf
