,author_id,tweet_id,created_at,text
0,61178974,1526407810598043649,2022-05-17,Acabou de publicar uma foto em Sociedade Esportiva Elite Itaquerense https://t.co/NxdgQPy6AD
1,252806783,1526376877471956992,2022-05-17,Amo muito td isso 😁🍔 https://t.co/HQZuhr49wQ
2,459332230,1526203268929667075,2022-05-16,"Acabou de publicar uma foto em Itaquera, Sao Paulo, Brazil https://t.co/Ml2tu1vhJ2"
3,459332230,1526200460914397185,2022-05-16,"Acabou de publicar uma foto em Itaquera, Sao Paulo, Brazil https://t.co/f48hETpdRr"
4,459332230,1526197741969358849,2022-05-16,"Acabou de publicar uma foto em Itaquera, Sao Paulo, Brazil https://t.co/I4DOSRIFzT"
5,459332230,1526186731808051200,2022-05-16,"Acabou de publicar uma foto em Itaquera, Sao Paulo, Brazil https://t.co/eO87TriuYx"
6,459332230,1526176603163664385,2022-05-16,"Acabou de publicar uma foto em Itaquera, Sao Paulo, Brazil https://t.co/nTbqyqIay6"
7,459332230,1526175349754810368,2022-05-16,"Acabou de publicar uma foto em Itaquera, Sao Paulo, Brazil https://t.co/lNEwx5F4UL"
8,459332230,1526174150225711105,2022-05-16,"Acabou de publicar uma foto em Itaquera, Sao Paulo, Brazil https://t.co/LP9tixkslk"
9,117788374,1526166721580638211,2022-05-16,A promoção continua !!! T Cross 2022 com IPVA gratis !!! Só aqui na @vworiginal corre que termina dia 30 !!! #vworiginal #tcross #suvw em Original Veiculos Sao Miguel https://t.co/tSP666bdiY
10,1283794088047923202,1526153678327107590,2022-05-16,https://t.co/h0tNTEcAEL
11,1283794088047923202,1526153639718531072,2022-05-16,"Sua ajuda é muito importante!
Não deixe de divulgar nosso pedido de socorro para que outras pessoas possam ajudar 🙏 https://t.co/frmMMwijE7"
12,1283794088047923202,1526152373961428992,2022-05-16,"Mutuals bom dia,nossos gatinhos já estão sem ração desde ontem 😿 faço esse apelo com URGÊNCIA 🙌 alguém que possa doar ração de 🐈 ou até mesmo contribuir na vaquinha pelo PIX CELULAR para a compra do pacote de 10kg? A fome não espera,ajudem a toca dos gatos 🙏 https://t.co/DaTzTbBHGu"
13,459332230,1526039594084466690,2022-05-16,"Acabou de publicar uma foto em Itaquera, Sao Paulo, Brazil https://t.co/NW2Job8pZg"
14,459332230,1526037595578322946,2022-05-16,"Acabou de publicar uma foto em Itaquera, Sao Paulo, Brazil https://t.co/UsTCi2uNZa"
15,459332230,1526036467121790979,2022-05-16,"Acabou de publicar uma foto em Itaquera, Sao Paulo, Brazil https://t.co/AfugJlrihA"
16,459332230,1526035692865867776,2022-05-16,"Não a ninguém substitua ninguém,  porque somos únicos e ficamos eternamente na memória e lembranças de cada um que passamos na vida ❤️❤️ em Itaquera, Sao Paulo, Brazil https://t.co/dOnQCxk9P3"
17,1525995829814763522,1525997016362496000,2022-05-16,Oi boa noite https://t.co/LXcOJJqeJj
18,526528864,1525987215570001921,2022-05-15,"Lua sua linda 😍 em Itaquera, Sao Paulo, Brazil https://t.co/TL8Fk8GOeo"
19,526528864,1525986740107984896,2022-05-15,"Lua linda em Itaquera, Sao Paulo, Brazil https://t.co/fJcevEpuEt"
20,157873755,1525964661317070848,2022-05-15,"Que lugar maravilhoso, pqp! Mais uma vitória na bancada! @saopaulofc 2 x 1 Cuiabá Campeonato Brasileiro 15/05/22 em Estadio Cicero Pompeu Toledo https://t.co/jGiSz5OctK"
21,944100184216260608,1525924087415054336,2022-05-15,Nada pra fazer…só comer mesmo hahaha https://t.co/4mTkcPjAtO
22,944100184216260608,1525913864096739328,2022-05-15,"Hoje eu acordei tão feliz… mas irei dormir cm um aperto no coração…
Pq eu não estava la? Pq eu não pude ajudar?   😣😢"
23,241533539,1525874900556185601,2022-05-15,"Domingo é aquele dia em que é permitido cara de sono, cabelo bagunçado, preguiça no andar e sair na rua como se estivesse dormindo 

#boatarde #domingou #soninho #preguiça #billydog #doglovers #pretin #homensdeoculos https://t.co/CP4fjx22uu"
24,1147158493302087681,1525712511819042817,2022-05-15,sabadou/domingou 🙏🏼 https://t.co/XRUNoHLSYI
25,72180781,1525637761704894466,2022-05-15,Acabou de publicar uma foto em Pelo Mundo A Fora. https://t.co/8NGpkU5aoz
26,1460385948726923265,1525580579743453185,2022-05-14,"https://t.co/EYH5oBwSes… 

Vamos esquentar essa noite? Só um drink, sem compromisso.. 🔥 https://t.co/mYRwi2mli0"
27,459332230,1525549924162580480,2022-05-14,"Acabou de publicar uma foto em Itaquera, Sao Paulo, Brazil https://t.co/oxH68neaTQ"
28,459332230,1525548648473407489,2022-05-14,"Acabou de publicar uma foto em Itaquera, Sao Paulo, Brazil https://t.co/jzS0kkJFFp"
29,459332230,1525547586647638022,2022-05-14,"Acabou de publicar uma foto em Itaquera, Sao Paulo, Brazil https://t.co/6t50eg4LGE"
30,459332230,1525514208523296769,2022-05-14,"Acabou de publicar uma foto em Itaquera, Sao Paulo, Brazil https://t.co/zy2CpOasbe"
31,526528864,1525498772855349248,2022-05-14,"Amei meu café da manhã nesse dia especial em minha vida. 5.3🎂
Obrigado minha linda esposa ❤️ em Itaquera, Sao Paulo, Brazil https://t.co/GStRzb2rCh"
32,526528864,1525496677162967041,2022-05-14,"Amei meu bolo de aniversário 🎂🤠 em Itaquera, Sao Paulo, Brazil https://t.co/hNGWPQuQRb"
33,857624090936528898,1525481136906022914,2022-05-14,Acabou de publicar uma foto em Vila Prudente - São Paulo/sp https://t.co/YpxwnanVWP
34,459332230,1525303582874128391,2022-05-14,"Acabou de publicar uma foto em Itaquera, Sao Paulo, Brazil https://t.co/piOmgcEyoo"
35,459332230,1525276310364372993,2022-05-14,"Acabou de publicar uma foto em Itaquera, Sao Paulo, Brazil https://t.co/6QU8jaPmH5"
36,1460385948726923265,1525265729922244613,2022-05-14,Sexta-feira 13! 🔥🖤 https://t.co/lD7RkLxVe0
37,459332230,1525109317845671938,2022-05-13,"Acabou de publicar uma foto em Itaquera, Sao Paulo, Brazil https://t.co/gN2tNafVAp"
38,1283794088047923202,1524992714265214976,2022-05-13,https://t.co/zhBTXnkxTQ
39,1283794088047923202,1524991495798931456,2022-05-13,https://t.co/fmN2185Jwp
40,1283794088047923202,1524991211467153408,2022-05-13,"Sou tutor de 16 gatos resgatados e infelizmente por estar adoentado,não tô podendo sair para juntar recicláveis ou latinhas,tão pouco tem aparecido bicos 😔 IMPLORO que nos ajudem como puder 🙏 É muito triste e difícil passar fome e ver seus animais passando necessidade 😿 https://t.co/TYxFrUMt7u"
41,1283794088047923202,1524990427539066880,2022-05-13,"Na nossa última doação,ganhamos apenas 1 feijão e cheio de bichos,mais não desperdiçamos e fizemos uso. Posso passar o endereço via DM se necessário ou até mesmo busco a doação. Doe também através do PAYPAL: tiano.sp2018@gmail.com ou pelo PICPAY  https://t.co/aA0iuLmwDQ https://t.co/cMvQNdKN3l"
42,1283794088047923202,1524989134904995842,2022-05-13,"Mutuals eu IMPLORO por sua ajuda! Nossa geladeira está vazia e pra piorar os 16 gatinhos já vão ficar sem ração 😿 POR FAVOR! doe RAÇÃO e MANTIMENTOS se não tiver fazendo falta e se puder ajude através do PIX, qualquer valor mínimo que seja ajuda,até agora só conseguimos 5,00 😢 https://t.co/hxTv5Gpwy7"
43,123987522,1524855224061534208,2022-05-12,só vagabundos &amp; semelhantes https://t.co/RYH2OSctRj
44,459332230,1524815872048635905,2022-05-12,"Acabou de publicar uma foto em Itaquera, Sao Paulo, Brazil https://t.co/P2QnF2roxL"
45,1522533992951595010,1524804779444162561,2022-05-12,Primeira foto pra começar https://t.co/tBA5VcHfMo
46,742082823205584897,1524794836251025410,2022-05-12,"Mas um belo dia na cptm 
#linha11
#CPTM https://t.co/dOvz47ENVM"
47,42541553,1524775854043238405,2022-05-12,"Faça, aconteça! Você vale ouro! #vencedor #merecedor #integro em Itaquera, Sao Paulo, Brazil https://t.co/qVuSnUpzTI"
48,1283794088047923202,1524742947324841985,2022-05-12,"Um ato de caridade para Deus se torna um grande feito 🙌 vamos nos unir e fazer o bem,vivemos uma fase que emprego não está fácil e a ajuda é quase nula. Por favor,não deixe de ajudar,mesmo o pouco faz grande diferença 🙏 https://t.co/v6vPBzfHap"
49,1283794088047923202,1524741642334310411,2022-05-12,"Nossos 16 gatinhos estão pra ficar sem ração, se alguém puder ajudar doando um pacote de ração,posso passar o endereço na DM ou até mesmo buscar se necessário,ou também pode contribuir na vaquinha através das contas bancárias 🙏 https://t.co/NRwcgVwFF1"
50,1283794088047923202,1524740186067906562,2022-05-12,"A toca dos gatos também aceita doação via PICPAY 👇 https://t.co/aA0iuLmwDQ

https://t.co/W8EUyauNNZ https://t.co/zRpqyIPAh5"
51,1283794088047923202,1524740175322042370,2022-05-12,"A toca dos 🐈 precisa muito da sua ajuda,precisamos URGENTE de MANTIMENTOS e RAÇÃO de 🐈 DOE se não tiver fazendo falta 🙌 Caso prefira e possa,faça sua doação através das contas abaixo ou via PAYPAL através do email: tiano.sp2018@gmail.com
Esse foi o último feijão que ganhamos. https://t.co/JwG4dnqxDs https://t.co/iGN0mOP60o"
52,221759428,1524680024900648960,2022-05-12,Drinking a Sequoia by Trilha Cervejaria @ Condomínio Santa Barbara III - Edifício Nova Zelândia — https://t.co/tx1mejv0x8
53,526528864,1524654438857646080,2022-05-12,"Acabou de publicar uma foto em Itaquera, Sao Paulo, Brazil https://t.co/4stOPQSyvu"
54,73183704,1524589306672726017,2022-05-12,de conjuntinho chave pra classificação do timão https://t.co/euxIe1vj52
55,754073900942659585,1524585638531588096,2022-05-12,"Corinthians 2 x 0 Portuguesa/RJ.

Parece meu clone, mas é só meu irmão mais novo. https://t.co/S2vC0RESAq"
56,221759428,1524547931587629058,2022-05-12,Vai Corinthians!!! - Drinking a Muvuca by Trilha Cervejaria @ Condomínio Santa Barbara III - Edifício Nova Zelândia  — https://t.co/T3i8irvFi3
57,80692778,1524540353470078977,2022-05-12,"Acabou de publicar uma foto em Itaquera, Sao Paulo, Brazil https://t.co/lPqByUCZsE"
58,1398938089255587847,1524492487699664897,2022-05-11,CHEGANDO A NOITE 🌙 https://t.co/I5eb8gSiRp
59,1351908391564824578,1524397666163167234,2022-05-11,Kao Kabecilê.
