,author_id,tweet_id,created_at,text
0,1417510425713852416,1529246831158476800,2022-05-24,Devemos investir cada vez mais em educação e instruir nossos jovens na busca de seus sonhos. 📚 #aprendizagem #cursinho #educação #vestibular #diadovestibulando #frases #motivação em Brasil https://t.co/RQ4rR64gf7
1,17626269,1529219391203983362,2022-05-24,"big bang theory rodando non stop cobertorzin cheroso, janela aberta e no aguardo das flores. folguinha perfeitinha, cabecinha tranquilinha"
2,482978541,1529219059597709312,2022-05-24,Exposição Contramemória em Teatro Municipal https://t.co/PEGPXH34dY
3,16339549,1529196171138301960,2022-05-24,"Voltei pra SP e tenho novos vizinhos… a Cracolândia 😑 (@ Santa Cecília - @sp_prefeitura in São Paulo, SP) https://t.co/8rHBtSJfgV"
4,26612847,1529177333726269440,2022-05-24,"Várias, mensagens subliminares. em Beer4U Higienópolis https://t.co/1dJPV3BT9V"
5,23579118,1529175341830492161,2022-05-24,Acabou de publicar uma foto em Smart Fit https://t.co/iTYZ5PjxQd
6,190312750,1529174048877445120,2022-05-24,Acabou de publicar uma foto em Arena De Lutas SP https://t.co/YRXiigualS
7,1105557560084623360,1529162074252771328,2022-05-24,Eu quero o melhor 😻😻 @McDonalds_BR https://t.co/6nNiXJXs8q
8,282198621,1529145811409461248,2022-05-24,Acabou de publicar uma foto em Campos Elísios (bairro de São Paulo) https://t.co/mHrXUt8AyW
9,1065964061010141184,1529137426161082371,2022-05-24,Acabou de publicar uma foto em Praça Do Ciclista - Avenida Paulista https://t.co/sIVZzEsOfx
10,135363695,1529134709015453696,2022-05-24,@UOLNoticias https://t.co/ziRKHVj4dU
11,1448969742367268879,1529121994351865856,2022-05-24,Acabou de publicar uma foto em Campos Elísios (bairro de São Paulo) https://t.co/x6AQwvObc5
12,17230271,1529117134625857536,2022-05-24,"Boa tarde com ""Nu Azul II"", de Henri Matisse, 1952. em Brasil https://t.co/QrrrjJBCPB"
13,214292151,1529117042447683584,2022-05-24,"E sempre quando vc precisar estaremos aqui para te dar o suporte!!
@fab_oficial 
#PeloBrasil
#doesangue em Hemocentro Santa Casa https://t.co/Y6z8r99NQ4"
14,1420869957609574401,1529109433422434306,2022-05-24,"Duque de Caxias se foi com o povo da praça.
#caracolandia https://t.co/M6I61wtMWH"
15,768878510249275392,1529104955298267136,2022-05-24,Acabou de publicar uma foto em Galeria do Rock https://t.co/GorbkVb1JZ
16,768878510249275392,1529103164498141184,2022-05-24,Acabou de publicar uma foto em Galeria do Rock https://t.co/mlCfntGVcW
17,251109370,1529101725705162752,2022-05-24,Acabou de publicar uma foto em TEND TUDO BROTHERS https://t.co/ahlRwVtWaM
18,1445743452004618245,1529098531880968195,2022-05-24,Acabou de publicar uma foto em Soundsgood https://t.co/hDDKEOfxTq
19,1268557713744723968,1529094398394474499,2022-05-24,@escritosrame @MelendiNando https://t.co/FGq8Q53z7O
20,55970374,1529077717764820997,2022-05-24,Acabou de publicar uma foto em Santa Cecília https://t.co/MU93MOfN5s
21,102879087,1529051898803736577,2022-05-24,Acabou de publicar um vídeo em Casa Mário de Andrade https://t.co/PCGDiimCHv
22,233592511,1529043902518374400,2022-05-24,Com meu amigo @prcleziodearaujo na @advecsaopaulo • noite de bençãos! em São Paulo - A Cidade Que Não Para! https://t.co/qNdRxOL3Cc
23,33290764,1528944049733918721,2022-05-24,Ainda sobre sábado https://t.co/aeJBuksRiX
24,39899805,1528941819194744832,2022-05-24,Registro de uma segunda-feira fria mas cheia de fofura 🐶 em Campos Elísios (bairro de São Paulo) https://t.co/TPvoLUnMlM
25,1091499218563448832,1528940865909141505,2022-05-24,"Me sentindo privilegiada em dormir olhando para essa vista! 
Apaixonada por SP ❤️ https://t.co/FR9Cx7AzjZ"
26,1249983240951267329,1528885080344735745,2022-05-23,Tesão pós treino. https://t.co/dZ5ihew2zU
27,61097173,1528847574932672512,2022-05-23,Acabou de publicar uma foto em Theatro Municipal de São Paulo https://t.co/rcnoBlhnp3
28,43370903,1528846688944889857,2022-05-23,"Make invisível + cabelinho novo 🥹🫶🏼✨    

 Desafio #KakáLab + #SheLingerie  @kaka.oliveira @shelingerie em Santa Cecília https://t.co/5lDO1ieHSz"
29,61097173,1528845767263256576,2022-05-23,"Sampa
#sampa #sp em Theatro Municipal de São Paulo https://t.co/fBENTUjWkj"
30,27412034,1528842530812375040,2022-05-23,• Isso aqui ainda estávamos sóbrios (eu acho) pt.1 @ Irregular https://t.co/SelSGqTOva
31,1280959943630295042,1528841055436685312,2022-05-23,Fim de tarde em gotham city https://t.co/svezNWGLOd
32,2177060390,1528836286878040064,2022-05-23,Acabou de publicar uma foto em São Paulo SP Brasil 011 https://t.co/dO7oRxG18A
33,16631711,1528834195430187009,2022-05-23,Acabou de publicar uma foto em Theatro Municipal de São Paulo https://t.co/D1TbtBVuR7
34,64631305,1528816391519977479,2022-05-23,Tem festa dos dogs sábado agora! Preparades? https://t.co/x3xRTn5Jn6
35,23579118,1528816029819756545,2022-05-23,Acabou de publicar uma foto em Smart Fit https://t.co/nMor89l48d
36,41724125,1528772853096763393,2022-05-23,E esse drink de cachaça com pimenta e gordura de porco https://t.co/1VpgHP1uF3
37,1290712371502239746,1528772525626376195,2022-05-23,#ForaPaolaCarosella https://t.co/zWC6emBeMa
38,774469015,1528745997832228865,2022-05-23,Acabou de publicar uma foto em Instituto Artium de Cultura https://t.co/OAal14Vhzv
39,1153787864855040000,1528740892730830849,2022-05-23,Começar bem a semana em Administração Central https://t.co/2NYQhbUboY
40,1347077785,1528734892850302978,2022-05-23,A C O R D A Pedrinho
41,1205124909522915328,1528731465105690624,2022-05-23,"Bom dia, vamos começa a semana assim. AÍ GALERA, VAMOS OU NÃO SUBIR ESSE ISNTA.
https://t.co/1vLNg4RmSR https://t.co/cSOKvM1P9b"
42,1402106878902030339,1528729119491497986,2022-05-23,Fogo no parquinho 😈😈 https://t.co/4Zse2ZZNe3
43,33631090,1528712324973993985,2022-05-23,"Friozinho de SP: a
Eu: https://t.co/ylWAryNRbU"
44,73503309,1528707842504523782,2022-05-23,Just posted a photo @ Brasil https://t.co/kkOU4vqY3A
45,167471254,1528641181214724097,2022-05-23,Muito amor nessa foto ❤️‍🔥 em Hey Hey Club &amp; Eventos https://t.co/zovM4xdV22
46,33290764,1528598746807902212,2022-05-23,Ai eu tenho uma puta queda por P&amp;B https://t.co/7BoSUScYA7
47,33290764,1528596258805391360,2022-05-23,Também teve essa https://t.co/9vIKxT3qyg
48,28273980,1528575210957463553,2022-05-23,Acabou de publicar uma foto em Japan Tower https://t.co/xQxyHe0szF
49,16030618,1528573775918211074,2022-05-23,"Just posted a photo @ Atlantic Ocean, Some Where https://t.co/c7alTorFMa"
50,339183004,1528551840723632130,2022-05-23,Acabou de publicar uma foto em Castelinho da Rua Apa https://t.co/KT8MrzbfzM
51,127625246,1528534250659667968,2022-05-23,Cara no sol #fall #outono https://t.co/4WVBvZUvSS
52,59916086,1528523381439713283,2022-05-22,"fiz essa foto hj no minhocão e n faço ideia de quem seja esse cara……
imagina q daora ele receber esse clique https://t.co/KrCK5B3rEV"
53,1488111475789082624,1528519383601094657,2022-05-22,@_cornolandia Melhor posição
54,157508037,1528513372152483840,2022-05-22,"Come on, Harry, we wanna say goodnight to you 🥰 

——— 

Amo demais esse vestidinho vermelho e o @harrystyles @ Instituto Artium de Cultura https://t.co/nmFDsxO9EA"
55,43370903,1528510702075404290,2022-05-22,Sumida por motivos de: repondo as energias que gasto no frio 🫠🥐🫶🏼 em Fabrique Pães &amp; Café https://t.co/U5k1wlslvq
56,1360212608515792897,1528508816609910784,2022-05-22,Paguei com bitcoin 😬.   #PizzaDay https://t.co/ckkIvkjZid
57,34264727,1528505474739486721,2022-05-22,Acabou de publicar uma foto em Banca Curva https://t.co/AE4u1gq46O
58,155421066,1528501319941640198,2022-05-22,o folklore e o evermore sempre juntos ♥️ @ Irregular https://t.co/Sf2gnKC73d
59,138257731,1528496294972559360,2022-05-22,Acabou de publicar uma foto em Catedral da Sé - São Paulo https://t.co/dlEiGfeqRk
60,1455234068812111883,1528495699851104259,2022-05-22,Bora PAPÃO @Paysandu 💙🤍 https://t.co/sHp9qPz3t7
61,18688345,1528494730237050881,2022-05-22,Momentos mágicos com @ju_moranguete e @fernandohorsao ouvindo o coro da @osesp_ em Sala São Paulo https://t.co/9WH90OOcYM
62,1488111475789082624,1528491722199781377,2022-05-22,❤️🔥👸🏻 #transex #mulhertrans #travestis #transwomenadmirers #travestiativa #transpauzudas #transgirl #shemale #shemalebrasil #transwomen #bonecatrans #transexbrasil #travesti #meninatrans #braziliantransex #brazilianshemale
63,57794600,1528485167882375168,2022-05-22,Fechando a trinca de vermelhinhos ♥️🍷 em Tokyo 東 京 https://t.co/9jiEnw4Esu
64,57794600,1528484369748447235,2022-05-22,"Esse aí sou eu...
Da pra notar que eu tenho que dar um jeito na minha vida. 🤭
#vermelho ♥️🍷 em Tokyo 東 京 https://t.co/i7cMe85xoy"
65,76481710,1528484358222254080,2022-05-22,Acabou de publicar uma foto em Hey Hey Club &amp; Eventos https://t.co/ibGXt2wGan
66,15165399,1528458570735443969,2022-05-22,#minhocão em Minhocão https://t.co/lilFkmcRWk
67,1511557194910777346,1528453552691109890,2022-05-22,https://t.co/pIfYg2sl0j
68,1248229525663735808,1528453036296781825,2022-05-22,https://t.co/hQYTQsrsbT
69,1121401968604450816,1528434370012401665,2022-05-22,"Atualizações sobre nossa rainha. 
👑🔥👑 em Santa Casa de São Paulo https://t.co/TM3f8s5Xl6"
70,82268715,1528431452576174081,2022-05-22,"🌀

.
.
.

#porai #minhocao #sunday #wallart #photo #sp em Minhocão https://t.co/cntEZYKxgF"
71,162424619,1528429243503345664,2022-05-22,Sunny Sunday https://t.co/m5RcvjfTOr
72,172561008,1528409030095429637,2022-05-22,Muerta https://t.co/jko2E2wUrd
73,42611569,1528400856038637570,2022-05-22,Vem gente… https://t.co/YTgqPmaI0Y
74,57794600,1528399456349171712,2022-05-22,"🎶Dizem por aí que ando com álcool a me envenenar, mas é existem coisas aqui em mim que preciso matar...
#vermelho em Tokyo 東 京 https://t.co/Uh5e48hFwK"
75,73503309,1528394034137513986,2022-05-22,Feliz dia do abraço!!! Já abraçou quem você ama hoje? “Pluft” estreia em Julho nos cinemas! @raccordproducoes @dtfilmes @globofilmes @pluftofilmeoficial @arthuraguiar @ Brasil https://t.co/1mFQT46p9q
76,15430166,1528389784271568897,2022-05-22,I'm at Parque Minhocão in São Paulo https://t.co/sig23Wbf5A https://t.co/CPCAdjjXpS
77,67092014,1528384834707435520,2022-05-22,Acabou de publicar uma foto em Santa Cecília https://t.co/tTey7juCbK
78,1398883573432737795,1528374198476865536,2022-05-22,Bom dia♥️❤️
79,109695751,1528373228594507778,2022-05-22,Acabou de publicar uma foto em Minhocão https://t.co/RubWkPvbua
80,1053256480068169728,1528365738620239872,2022-05-22,@Alabitweets https://t.co/ceo5hbX0b4
81,1150111070280925185,1528237013069094912,2022-05-22,"Legenda... em República, São Paulo https://t.co/aiwhVzX6b4"
82,52866878,1528202483750805504,2022-05-22,"Oi, férias! Cheguei 🥂 em Esther Rooftop https://t.co/NMeomEXZkl"
83,10668022,1528187239003561986,2022-05-22,Vai fazer igual Moises? em Freezer https://t.co/hzj6EpyPSp
84,1282773009032523776,1528184477188403200,2022-05-22,Acabou de publicar uma foto em Santa Cecília https://t.co/ptpWMbSiT4
85,91840976,1528174192276951041,2022-05-22,シングルではありません！選択的 em Tokyo 東 京 https://t.co/fU2sS7Y6xE
86,1513134594035531781,1528164710192914432,2022-05-22,Sabadou 😈🔥 #PINTOAWARD #BUNDAAWARDS  #biscoito #gay https://t.co/qraz0ge4l1
87,95433357,1528161452858695680,2022-05-21,Agora é hora dos Hermanos Argentinos. Bora para Cabernet Sauvignon. Rsrs em São Paulo - A Cidade Que Não Para! https://t.co/bjpksUoDWG
88,1528131399806509056,1528153058307457026,2022-05-21,https://t.co/AklwRGgUlT
89,67895112,1528144435195822080,2022-05-21,I'm at Teatro @PortoSeguro in São Paulo https://t.co/rWc0C4woUH https://t.co/UPnhRITHIz
90,49502064,1528141763197673478,2022-05-21,prestigiando o irmão mosqueteiro @passadnt https://t.co/umpf4JbntM
91,1077238737816481799,1528139991108534273,2022-05-21,"Bom demais, inclusive https://t.co/gud3Muux71"
92,281130563,1528133910760148999,2022-05-21,Acabou de publicar uma foto em Galeria do Rock https://t.co/4lBmNtvv0m
93,281130563,1528133796687761415,2022-05-21,Acabou de publicar uma foto em Galeria do Rock https://t.co/s8s214kEP5
94,281130563,1528133356306702339,2022-05-21,Acabou de publicar uma foto em Galeria do Rock https://t.co/beinq8wqzr
95,95433357,1528130240979120129,2022-05-21,Bora variar…muito bom Português By @Rafael Souza. em São Paulo - A Cidade Que Não Para! https://t.co/QyezVHjlv8
96,67895112,1528127103002198020,2022-05-21,"Sopinha de tomate , vinho e brigadeiro pra esquentar um pouco . (@ SESC Bom Retiro - @sescsp in São Paulo, SP) https://t.co/cNGEPJI8YC"
97,1213929585097658368,1528122302822596609,2022-05-21,https://t.co/zmVO0RSGim
98,95433357,1528103775969361921,2022-05-21,Começamos os trabalhos prestigiando o Italiano da região de Piemonte em São Paulo - A Cidade Que Não Para! https://t.co/Tu1x618Koc
99,36164543,1528093810898649089,2022-05-21,Acabou de publicar uma foto em Teatro Municipal https://t.co/5fU7a8gS4C
100,16030618,1528093021971140608,2022-05-21,"Just posted a photo @ Atlantic Ocean, Some Where https://t.co/wM2uLckd4x"
101,16030618,1528092869604610050,2022-05-21,"Just posted a photo @ Atlantic Ocean, Some Where https://t.co/EIaNFeIAcO"
102,1387185770767822850,1528080238139387906,2022-05-21,Com acessório novo da @lionsexshopp . Muito top https://t.co/8j1eemJ7Jb
103,100353774,1528073228115140608,2022-05-21,Acabou de publicar uma foto em Terraço Itália Restaurante https://t.co/91Q2vqvIZY
104,71672841,1528071652281618434,2022-05-21,registro que encontrei o melhor Moscow Mule de SP https://t.co/XLlwRV348G
105,37339121,1528065864452415489,2022-05-21,🕊️🕊️🕊️🕊️ @ Santa Cecília https://t.co/7RoLS18wfO
106,78099686,1528062054871048195,2022-05-21,Acabou de publicar uma foto em Theatro Municipal de São Paulo https://t.co/DJqeG33IBx
107,78099686,1528061981080576000,2022-05-21,Acabou de publicar uma foto em Theatro Municipal de São Paulo https://t.co/HvlFGp0Jee
108,78099686,1528061928563691520,2022-05-21,Acabou de publicar uma foto em Theatro Municipal de São Paulo https://t.co/8lnmkHtUBo
109,78099686,1528061870883721218,2022-05-21,Acabou de publicar uma foto em Theatro Municipal de São Paulo https://t.co/Nv9cb7RdlE
110,1090681428,1528040148113444864,2022-05-21,"Simbora, aproveitar o #fds em Evemotos https://t.co/DvG5wKYSgn"
111,16030618,1528034655685025796,2022-05-21,"We did 9 hoes, because we don't do no L's. 
#MiniGolf
@carnival_conquest 
@uplift @ Atlantic Ocean, Some Where https://t.co/NWDeT5cuH2"
112,1270899980228837377,1528012952795758594,2022-05-21,"#WorldFamilyDoctorDay 
#WFDD2022
#AlwaysThere2Care
@aafp 
@WoncaWorld https://t.co/66N0v6qKnd"
113,16030618,1528001025571016704,2022-05-21,"Was tired boots, but stay cute! ~Queen @ Atlantic Ocean, Some Where https://t.co/ymjp2hih9Q"
114,253164228,1527978130799046656,2022-05-21,"#julianobaeta #viagem #s9plus #fotografia #arte #saopaulo em Praça Das Artes, Centro Histórico De São Paulo https://t.co/vVCi8rjW9d"
115,75348255,1527977333868707842,2022-05-21,Acabou de publicar uma foto em A Próxima Companhia https://t.co/VfklO9NHVS
116,1130249719555481600,1527969496555831297,2022-05-21,Sou porra louca mas também sou dedicada
117,1498114366138466309,1527889240322973697,2022-05-21,Ouié - play! https://t.co/UBEe8poASS
118,51405210,1527857735756173312,2022-05-21,Na leitura e no Bar… uma noite da temporada em Sampa… amei cada momento em De Caquinho Bar https://t.co/lUuo4gVveh
119,158107810,1527841501543374849,2022-05-21,Sem risadinha // com risadinha https://t.co/E7rDt1ZlG5
120,253164228,1527840951447609349,2022-05-21,#julianobaeta #viagem #s9plus #fotografia #arte #saopaulo #semanadeartemodernade22 em Theatro Municipal de São Paulo https://t.co/k0GWlBd6iO
121,774469015,1527826414879313921,2022-05-21,"A song for us to be calm 😌

#maisumnomundo #micksugui #saopaulo #salasaopaulo em Sala São Paulo https://t.co/HgLa8bNzBo"
122,1304509993358708739,1527805864622575616,2022-05-21,Acabou de publicar uma foto em Gabinete Deputado Federal Abou Anni https://t.co/XE6J6iNXQ5
123,45940626,1527794464244305921,2022-05-20,Hoje decidi encarar o frio e sair  pra tomar um “ar” gelado. https://t.co/YvUk7dTQHy
124,55970374,1527781594542444544,2022-05-20,Acabou de publicar uma foto em Santa Cecília https://t.co/dmBEHAk4j7
125,55298352,1527769467396280320,2022-05-20,Tokyo né mores https://t.co/quU9j6GLMr
126,253164228,1527760243593191425,2022-05-20,#julianobaeta #viagem #s9plus #fotografia #arte #saopaulo em Theatro Municipal de São Paulo https://t.co/ub44nbWfwI
127,253164228,1527755639774236672,2022-05-20,#julianobaeta #viagem #s9plus #fotografia #arte #saopaulo em Theatro Municipal de São Paulo https://t.co/BAgt2ZyhWk
128,724693836694478848,1527753533818281986,2022-05-20,a inflação tá alcançando patamares terríveis https://t.co/oYD9zfVbm2
129,1512997952603705353,1527747058790289409,2022-05-20,"More beer... let's go 🍻❄ 

#erdinger #weisbier #galeriadorock #rockburguer https://t.co/fQwpji6TbN"
130,3290793863,1527732427182964736,2022-05-20,A Parada de Orgulho de SP @paradasp organizou discussões importantes durante o Segundo Fórum de Direitos LGBTQ2+ em Sao Paulo. Um prazer representar o Reino Unido nessa conversa junto com ativistas que mudaram nosso mundo pra o melhor  🏳️‍🌈 🇬🇧 🇧🇷 https://t.co/EwlmcNQ0RY
131,253164228,1527713615037534211,2022-05-20,#julianobaeta #viagem #s9plus #fotografia #arte #saopaulo #semanadeartemodernade22 em Theatro Municipal de São Paulo https://t.co/ZGXwIVVpjk
132,82427060,1527691929848365056,2022-05-20,Que restaurante foda! Recomendo demais. https://t.co/KYepFBQJ5P
133,74325248,1527677509566726144,2022-05-20,Acabou de publicar uma foto em Schettini Luthieria https://t.co/zfdPtcsaFu
134,1444730024150634502,1527676914659377153,2022-05-20,e vamos nós 🗣
135,1027288927,1527672136860585989,2022-05-20,abri a janela e rio grande ta assim https://t.co/YvV0ptGAvu
136,1390016160918294529,1527669345803022337,2022-05-20,"Il termine ‘utopia’ è la maniera più comoda per liquidare quello che non si ha voglia, capacità o coraggio di fare… cambia … esci dalla tua zona di confort zone… @irinatirdea @ Lago Di Lecco https://t.co/puYGJqmvch"
137,1508091205237850122,1527612840923766784,2022-05-20,Eita que lugar frio https://t.co/QEgz5j22Kq
138,15946117,1527612396428218369,2022-05-20,"Em uma rua do centro de SP:

""Vapor de Incenso
Assomam na Polis
Assomam cantos
Fúnebres, lamento!"" https://t.co/ufAFf3hius"
139,3288782332,1527600931159822337,2022-05-20,Acabou de publicar uma foto em Avenida Angélica https://t.co/oGiTEbKWJ2
140,1304509993358708739,1527551926874869760,2022-05-20,Acabou de publicar uma foto em Gabinete Deputado Federal Abou Anni https://t.co/9j3ncPkLDg
141,1526647126486355969,1527469904626057218,2022-05-20,"Caste of the ""untouchables"" is the lowest in India. Kovind won with 65% of the votes

https://t.co/Ppgn04NWIl @opensea"
142,108998279,1527437250606383113,2022-05-19,Cafezinho pra esquentar 🥶☕️
143,133778741,1527436910699827200,2022-05-19,Acabou de publicar uma foto em Porto Alegre - RS https://t.co/YnbuWwZKZp
144,132909997,1527430969782771712,2022-05-19,Acabou de publicar uma foto em Sao Paulo Higienopolis https://t.co/f72BhEDYlY
145,55970374,1527426713080283157,2022-05-19,Acabou de publicar uma foto em Santa Cecília https://t.co/RtvidTn1fp
146,423985972,1527422870351233033,2022-05-19,Acabou de publicar uma foto em Teatro Galeria Olido https://t.co/spk1sjQ6gX
147,1207489299895205888,1527406913159368706,2022-05-19,Tudo funciona melhor se ninguém souber de nada. https://t.co/nXeFyD3iqv
148,3072319151,1527381932576624659,2022-05-19,Bethânia segue em plena recuperação e sendo linda. A vida é irada demais de novo. https://t.co/N9fEjnjs2H
149,23579118,1527337993597378567,2022-05-19,Acabou de publicar uma foto em Smart Fit https://t.co/Wq0zx6Pqt9
150,79274410,1527329144614182924,2022-05-19,Acabou de publicar uma foto em Minuto Seguros https://t.co/YVUbC1EPKx
151,1282760525110284290,1527307963035045889,2022-05-19,Vamo Twuittar ? https://t.co/u48sbq9ybE
152,389212885,1527299929559158785,2022-05-19,"E eu que tava com  saudades de tirar foto de prédio. 
#saopaulo em Santa Cecília https://t.co/RuX80lXvvV"
153,3667115362,1527291339091521542,2022-05-19,Dia de aprender mais um pouco. https://t.co/tU1bbBldEi
154,1702543254,1527285920990261249,2022-05-19,Ontem foi realizada a plenária com diversos movimentos culturais da cidade contra a proposta de privatizar as casas de cultura de são paulo. Mais um ataque privatista e contra a população paulistana vinda da @smcsp tucana! Não vamos deixar! E iremos cobrar! https://t.co/rPsACkbOx9
155,233166705,1527273343480696832,2022-05-19,"Luís Cláudio foi vítima da violência 

Agora, não foi o pai dele quem atacou os policiais por combater bandidos que roubam celular?? UÉ!!!

A culpa é do seu pai que diz que não aceita mais ver jovens indo presos só por roubar um celular as vezes para tomar uma cervejinha... https://t.co/Vm18zJK7o3"
156,233166705,1527270895928152065,2022-05-19,sempre que pensar em machucar alguém esteja pronto. pois além do retorno não falha 👊🏻👆🏻 https://t.co/dBDY1u4HZ0
157,143126709,1527262685196320768,2022-05-19,Acabou de publicar uma foto em Brasil https://t.co/JDdvVCWjzU
158,233166705,1527234115719811072,2022-05-19,Acabou de publicar uma foto em República (distrito de São Paulo) https://t.co/0hWPgwomTR
159,95433357,1527187232469024769,2022-05-19,"Parafraseando meu amigo que gélido germânico @bernd.siegel.7 , é só um refresco de outono. 🤣🤣🤣 em São Paulo - A Cidade Que Não Para! https://t.co/zrXSYonowY"
160,233166705,1527118222947934208,2022-05-19,https://t.co/IfSk6IAKlf
161,233166705,1527118010770677766,2022-05-19,https://t.co/vMhwOUwTRa
162,233166705,1527117763000549381,2022-05-19,https://t.co/hF7tacH3vZ
163,39788592,1527103345080651776,2022-05-19,Acabou de publicar uma foto em Brasil https://t.co/QGcdXUx6fp
164,26810678,1527084121066979329,2022-05-19,É muito bom ser emo veio https://t.co/tk2BZSNqaH
165,89356585,1527074457348603904,2022-05-18,"Frioooo #frio #beagles #beaglelove #beagledaily #beaglesofinstagram #beaglepuppy #beaglelovers #duckobeagle em Santa Cecília, Quase Higienópolis https://t.co/aKIGmQVNRn"
166,73503309,1527067708440727552,2022-05-18,Just posted a photo @ Brasil https://t.co/OQi6IH1kcG
167,1335325411539087362,1527041996455550976,2022-05-18,"É grande???🐸🐸🐸
Kkkk
Vamos fazer uma chamada de vídeo

 tá friozinho pra esquentar 🐸😈🌡️🔥 https://t.co/xhclye2Bc6"
168,58950809,1527025579920351235,2022-05-18,Acabou de publicar uma foto em Central Caos https://t.co/C3N6V1Re9o
169,76481710,1527014465849499649,2022-05-18,Acabou de publicar uma foto em Hey Hey Club &amp; Eventos https://t.co/ngeIxSGg2x
170,23579118,1527002158507470848,2022-05-18,Acabou de publicar uma foto em Smart Fit https://t.co/WMAkVQyJWG
171,68737051,1526966121735327745,2022-05-18,Gravando na Tokyo hoje com @gabrielrenne e @gustavo_gall 🔥 https://t.co/OELuvIToOo
172,22283171,1526965798668992513,2022-05-18,"Bota na cabeça que estilo não é marra. E aí, Marquinho DJ? Faz o sampley de guitarra 🎶 em Vila Buarque https://t.co/fspIafxsFL"
173,17230271,1526953471529717761,2022-05-18,"Boa tarde com Tarsila do Amaral e seu ""A Cuca"", 1924. em Brasil https://t.co/X6V2ABzi1F"
174,114581418,1526951462374449152,2022-05-18,Acabou de publicar uma foto em Rede Resiliência e Consciência https://t.co/cdQedMyytu
175,191430081,1526937946011607041,2022-05-18,tiozão cringe que tira foto com planta https://t.co/JxU5gAfmdj
176,1056897457139933184,1526933388359356416,2022-05-18,"Cher do meu arco-íris, que frio é esse?
BRRRRR... 🥶 em Secretaria Municipal De Fazenda https://t.co/TmrkQoIpF0"
177,233166705,1526930498597134337,2022-05-18,https://t.co/OrxRpU8r7Z
178,233166705,1526930466749947906,2022-05-18,Reforma da Obra de ART #Dicavalcante https://t.co/mUSNcgbRx9
179,74325248,1526929896882065408,2022-05-18,Acabou de publicar uma foto em Schettini Luthieria https://t.co/Et3nULhds7
180,1224790884551622656,1526918837253316608,2022-05-18,Bom dia! Tá tão frio aqui no centro de SP que até os passarinhos procuraram abrigo no 3° andar do #sesc24demaio. https://t.co/1BP4LMw6Ff
181,78099686,1526859108808269824,2022-05-18,Acabou de publicar uma foto em Av Ipiranga x Av Sao Joao https://t.co/pStdX5ibm5
182,95433357,1526825034206941185,2022-05-18,"Eita, vamo que vamos, ainda por cima o vento esta fe despentear meus cabelos. Rsrs em São Paulo - A Cidade Que Não Para! https://t.co/85IOXLetIU"
