,author_id,tweet_id,created_at,text
0,8205502,1547730985067823104,2022-07-14,Acabou de publicar uma foto em Bom Retiro https://t.co/2lecDuxcgq
1,67092014,1547729110687838210,2022-07-14,"5 meses de muita gostosura!

Te amo filhote, obrigado por me ensinar tanto!

Ps: amo, amo você ❤️🥰 em Santa Cecília https://t.co/ZXOWVE5jp6"
2,1456967893942509574,1547717561822810121,2022-07-14,"Ingressos na mão,bora correr pra ver o jogo🤩⚽️🔥 #cypresshill https://t.co/QdjohmcN61"
3,27008217,1547714672932970499,2022-07-14,"Além do arame farpado estilo campo de prisioneiros, o que me marcou nesta foto é na verdade o que não apareceu nela: um homem de barba grisalha, diante do estacionamento deste supermercado ao lado, com um cartaz pedindo por comida. https://t.co/Qq70MCqHlU"
4,27008217,1547713939663769600,2022-07-14,"Nesta manhã eu estava passando pela Av. Angélica quando eu quis fotografar este casarão que fica diante dum ponto de ônibus. Apesar do rolo de arame farpado, milagrosamente está de pé e sem maiores alterações. Não sei se é tombado pelo patrimônio histórico. https://t.co/b6TvcMSfMG"
5,1423871670914330624,1547713058914439169,2022-07-14,Gay do sec 21 morando só… to criando até amizade com os vizinhos.. https://t.co/a3VqU7eXtv
6,848205260451696641,1547673976456941570,2022-07-14,Iniciando a quinta-feira com café da manhã na @fabriquepaes #fabriquepaes #ricardoalexandreadvogados #raadvogados em Fabrique Pães &amp; Café https://t.co/DNHnpOnBED
7,55970374,1547660770040635396,2022-07-14,Acabou de publicar uma foto em Santa Cecília https://t.co/QZsRbZrpXf
8,2236651340,1547659147981647873,2022-07-14,Acabou de publicar uma foto em Brasil https://t.co/f0eNL9fCQ4
9,233166705,1547616666799943686,2022-07-14,Não precisamos falar mais nada. em República (distrito de São Paulo) https://t.co/KkH5gEWTyw
10,224648416,1547614696382930945,2022-07-14,O sabor do bauru é inconfundível! em Ponto Chic https://t.co/lioMdZGXyb
11,224648416,1547613815738576896,2022-07-14,Experimentando o bauru! em Ponto Chic https://t.co/61ockNviCp
12,224648416,1547613103524679682,2022-07-14,Olha o bauru! em Ponto Chic https://t.co/iV2e5doQJZ
13,224648416,1547612314311921664,2022-07-14,"Casemiro Pinto Neto, o criador do bauru… em Ponto Chic https://t.co/VUmWm3fgp7"
14,224648416,1547610141360500736,2022-07-14,Abrindo os trabalhos! Conhecendo o Ponto Chic… em Ponto Chic https://t.co/7vy7skgXqS
15,15591680,1547605783721811971,2022-07-14,Sempre https://t.co/KaYwucBAJs https://t.co/nIJRCWZxGK
16,114581418,1547597735833923585,2022-07-14,"Bom dia!!! 
A partir deste mês de julho, o benzimento começa a ser feito às quintas feiras!!!!
Venham participar

@fernando_cigano_ 

Tudo fica melhor quando tem verdade vontade e amor. em Rede Resiliência e Consciência https://t.co/UdI90whQ49"
17,41708682,1547595734245003274,2022-07-14,"Inaugurando uma nova Plantã na Sede da ABGLT no Largo do Arouche ao Lado da nossa Queridissima Líder Presidentra  Symmy Larrat, e da  Lua, Nova Colega! Um dia Histórico! Feliz Luta! 💙💜🤍🌈 https://t.co/aHC5RNsso8"
18,21415271,1547591595284762628,2022-07-14,"I'm at Petz in São Paulo, SP https://t.co/lFmWA6P562"
19,1540474363618656256,1547566870940643329,2022-07-14,Acabou de publicar uma foto em Tokyo 東 京 https://t.co/bSfdY28Vlu
20,53520976,1547565382923235330,2022-07-14,"Fotos que meu amor @camillagcb tirou para o @brechominante 🫶🏼🍃 em República, São Paulo https://t.co/4lmM3nG1fc"
21,37571692,1547402332476002305,2022-07-14,Acabou de publicar uma foto em Museu da Energia https://t.co/7OTtLSGJUL
22,8205502,1547396248608673793,2022-07-14,Acabou de publicar uma foto em Conceição Discos &amp; Comes https://t.co/zN8jf6aK12
23,209026290,1547350265371668480,2022-07-13,Acabou de publicar uma foto em Academia Paulista de Letras https://t.co/zM7JT2oNIy
24,20743783,1547342276468277248,2022-07-13,"Praça Buenos Aires, SP. https://t.co/GucGXwCBg6"
25,302741662,1547326633178288130,2022-07-13,Ensaios a todo vapor! Esse fds tem show na @BlueSpaceSP sábado e domingo 💙
26,53554742,1547320151464448001,2022-07-13,"Obrigado, rock'n'roll.

#guitarra
#diamundialdorock 
#diadorock em Associação Cultural Cecília https://t.co/N9db55KNXV"
27,74325248,1547300282454925313,2022-07-13,Acabou de publicar uma foto em Schettini Luthieria https://t.co/vaUhrcrqwJ
28,55970374,1547265509644677120,2022-07-13,Acabou de publicar uma foto em No Meu Atelier https://t.co/pi6yluSONM
29,1486058855268294656,1547247267681341440,2022-07-13,Acabou de publicar uma foto em Praça da República https://t.co/IMjGU4rexL
30,1347077785,1547231011460841475,2022-07-13,@FGlobais1 Picos de 45 quando a protagonista caipira falar que vem para “sumpaulo”
31,1347077785,1547230227037822976,2022-07-13,Podia ter glass studio… https://t.co/RDqX63U5iL
32,164796545,1547217391402246146,2022-07-13,I'm at Jazz Nos Fundos https://t.co/FDhmIv5gZf https://t.co/tJbC9EKkXG
33,164796545,1547217269452947456,2022-07-13,"I'm at Estação Santa Cecília (Metrô) in São Paulo, SP https://t.co/QWEaz0GSmp https://t.co/IJajIkgsKW"
34,164796545,1547217143292432384,2022-07-13,I'm at Nobile Downtown in São Paulo https://t.co/L1XJdfHRlo
35,164796545,1547217086019211265,2022-07-13,"I'm at Slaviero Downtown in São Paulo, SP https://t.co/Eq5GgUin9P https://t.co/lF04T5TFnR"
36,438473416,1547214248086061056,2022-07-13,Acabou de publicar uma foto em Frigideira Grill Dom José de Barros https://t.co/Lun27WI4lX
37,1528842277153538049,1547201968568877056,2022-07-13,Acabou de publicar uma foto em Espaço Gisele Ferreira https://t.co/NMbgFgETgg
38,1542352796430761989,1547190516873396224,2022-07-13,saudades de uma piscininha 😜 https://t.co/8P2ZavI4oq
39,857624090936528898,1547172982405177353,2022-07-13,"Acabou de publicar uma foto em República, São Paulo https://t.co/T5JnRmH6Wu"
40,932900692762808320,1547046939614740482,2022-07-13,Acabou de publicar uma foto em Colégio São Gonçalo https://t.co/MYBF1jGSRP
41,607737998,1547030950281973760,2022-07-13,私を抱きしめてキスして 🇯🇵 em Tokyo 東 京 https://t.co/PcGMe4IZPC
42,76481710,1547026846625275904,2022-07-13,Acabou de publicar uma foto em Blue Space https://t.co/vlfOpTAv8G
43,196743696,1547007990363987968,2022-07-13,Acabou de publicar uma foto em Suna https://t.co/QAQIK465Kp
44,173819903,1547006295303245825,2022-07-12,"Pensa num #Beirute #BentoFreitas #Top e o atendimento sensacional, super recomendo @lanchonete.e.rest.dacidade 
#Show em Lanchonete E Restaurante Da Cidade De Sao Paulo https://t.co/AbDLdGCTCr"
45,340590353,1546988174198640640,2022-07-12,Just posted a photo @ Theatro Municipal de São Paulo https://t.co/QFUqExQBte
46,52058931,1546985772548505600,2022-07-12,https://t.co/zQFpIJvleg
47,3691625422,1546977417268543488,2022-07-12,OS SEGURANÇA NÃO FIZERAM NADAAA @GloboNews @g1 @folha @bbcbrasil https://t.co/9KVFgFmLrT
48,3691625422,1546977294576766978,2022-07-12,CENAS DE RACISMO PLENO SÉCULO 21 NA SESC 24 de MAIO! E A @Sesc @sesc24demaio NÃO FEZ NADAA @QuebrandoOTabu @MidiaNINJA https://t.co/Fqotz7l1jB
49,1347077785,1546971235346776066,2022-07-12,AMEI VEM ÍCONE #TodasAsFlores https://t.co/N6xkuLlz50
50,1347077785,1546970273424998402,2022-07-12,AMEI VEM AI!!!!! #TodasAsFlores https://t.co/BrWH0xXZ2Q
51,1347077785,1546970077139984388,2022-07-12,@Noveleii 🙏
52,109626658,1546950124236148743,2022-07-12,Acabou de publicar uma foto em Brasil https://t.co/2qaBW0lEQo
53,233592511,1546943723770101761,2022-07-12,Esse é preguiçoso. #simba em São Paulo - A Cidade Que Não Para! https://t.co/neBkNRplM0
54,76481710,1546933802420903936,2022-07-12,Acabou de publicar uma foto em Hey Hey Club &amp; Eventos https://t.co/nJ69f0K6k6
55,1347077785,1546928561612890117,2022-07-12,@Noveleii Tomara que seja a Zoé!!! #TodasAsFlores
56,1347077785,1546928311531610115,2022-07-12,@globoplay Pode entrar ZOÉ!!!!!!!  @ReginaCase #TodasAsFlores
57,21415271,1546926823413805058,2022-07-12,"I'm at Centro Clínico NotreDame Intermédica in São Paulo, SP https://t.co/mppiY7LiEm"
58,1390016160918294529,1546925463318106112,2022-07-12,Foto appena pubblicata @ Lago Di Lecco https://t.co/TlDqLVhYSH
59,77233601,1546920942227578880,2022-07-12,""" O caminho para a felicidade está em vivermos o presente. Não volte ao passado, nem fique tentando adivinhar o futuro."" em República, São Paulo https://t.co/yMqBLr2mU8"
60,114581418,1546917114505748487,2022-07-12,Acabou de publicar uma foto em Rede Resiliência e Consciência https://t.co/uyaSzucZ1a
61,21415271,1546890125493342208,2022-07-12,4ª dose! (@ SAE Campos Eliseos in São Paulo) https://t.co/NmIAfFrRv7
62,1161961828219596800,1546881183035826178,2022-07-12,"No mesmo evento será lançado o material educativo, um convite à experimentação de percursos possíveis no espaço expositivo e a continuidade de sua ativação em outros espaços.
Terça-feira, dia 12/07, das 19h às 20h30
Local: Exposição, 5º andar
Entrada Gratuita https://t.co/88k8aocu0e"
63,1161961828219596800,1546881179181371392,2022-07-12,"Acontece hoje o lançamento da publicação que reúne a pesquisa curatorial, com textos, biografias dos artistas e imagens das obras e da exposição ""Raio-que-o-parta: ficções do moderno no Brasil"" no @sesc24demaio: 

https://t.co/sB5aIn3zsn"
64,4331665120,1546879911297695746,2022-07-12,"Registro sob um dia lindo na capital!
— 14/Maio

Img: @nadi.ne
✲! em Terra da Garoa https://t.co/gb4Zc8BTn0"
65,282731659,1546878060074508291,2022-07-12,Drinking a Madalena Premium Lager by Cervejaria Premium Paulista @ Busger Higienópolis — https://t.co/2fUYF483HF
66,1347077785,1546877345084104704,2022-07-12,"Espero muito que em 26 ou talvez 32 ela possa ter chances de ir a um 2º turno!!! Votaria com prazer nela. Infelizmente, hoje, não dá não https://t.co/K6oxIK5FTJ"
67,1522691205410308096,1546864859924635657,2022-07-12,"Sentado no banco de concreto no meio da Santa Casa. Marcello aparece e bibicua dizendo não entender o ser/espécie humana, dou uma risada sem graça, ele vira o rosto e bate asa rumo ao ponto de ônibus. Penso, Esse seria, talvez, o famoso ""um passarinho me contou""? #SantoPássaro https://t.co/BCJS7Gjyqi"
68,28356964,1546832608662851587,2022-07-12,"I'm at Bar e Lanches Pombalense in são paulo, sp https://t.co/uGOJHzbRxZ"
69,22157406,1546822345456771074,2022-07-12,"HOJE: Lançamento das publicações da exposição RAIO-QUE-O-PARTA: ficções do moderno no Brasil
12/07/2022, 
terça-feira, 19h, 5º andar
@sesc24demaio São Paulo

se eu fosse vc, não perderia esse rajadão ⚡️
#exposicao #exhibition #exposición #modernismos #brasil #sesc #artebrasileira https://t.co/YRG8beZsqF"
70,114581418,1546705764911308802,2022-07-12,Acabou de publicar uma foto em Rede Resiliência e Consciência https://t.co/SU6z1wFGtI
71,3053063052,1546674063355019266,2022-07-12,Divulgação de Only Murders In The Building no metrô ❤️ #OMITB https://t.co/htAURG89pU
72,164796545,1546672871380078592,2022-07-12,🏨 https://t.co/i0aSmRoPiZ
73,125864433,1546668128700141568,2022-07-12,🙌🏽 em Riqueza que fala https://t.co/vWlAtj8E0s
74,74835944,1546666647691436032,2022-07-12,Acabou de publicar uma foto em Espaço Zero 11 https://t.co/ayxC5XY8rD
75,76481710,1546665033123467264,2022-07-12,Acabou de publicar uma foto em Blue Space https://t.co/iPg5GoGanV
76,27991603,1546662298353184769,2022-07-12,Nessa quinta eu toco no Soda Pop! Te vejo lá! em Soda Pop Bar https://t.co/zzIxU5LCF8
77,14164165,1546653703050084352,2022-07-12,Acabou de publicar uma foto em Sesc 24 de Maio https://t.co/eUqRHHG7bn
78,306307341,1546643270457069570,2022-07-11,Alguém tá servido? Vamos comer um pirarucu com molho. #jantar #comida #delicia #obrigadodeus #baxaaguiaqueamodaemuitoboa em Almanara Shopping Higienopolis https://t.co/a4LHXkOrOA
79,1326946766583951360,1546606818515996677,2022-07-11,"Muito boa noite a vocês, atendendo em casa essa semana

@RuivoMedieval @FAcompanhantes https://t.co/9j5QGQQvE1"
80,201519238,1546604296891813888,2022-07-11,Uma cara fechada não significa um coração ruim 😝 em Tokyo 東 京 https://t.co/9RM0TZajge
81,1542192579151904768,1546553483595288577,2022-07-11,"Que felicidade amigos consegui emagrecer tô conseguindo seguir firme o tratamento!!!  

Hoje tenho nutricionista e Endocrinologista pra inciar a dieta Rumo a Vitória!!!"
82,2818411502,1546546700696690688,2022-07-11,Acabou de publicar uma foto em Irregular https://t.co/XH6dgZjWm1
83,853994633411670018,1546522038709489665,2022-07-11,Segunda braba 🥱 https://t.co/mVurGJiBEW
84,74325248,1546519839040315394,2022-07-11,Acabou de publicar uma foto em Schettini Luthieria https://t.co/WyKJ39lImH
85,1347077785,1546493083088568326,2022-07-11,Alguém sabe quando são as próximas férias da Patrícia? Não vejo a hora de ter a Maria substituindo ela no #encontro!!!! https://t.co/jgG90c0c4B
86,1445743452004618245,1546485557106118661,2022-07-11,Acabou de publicar uma foto em Central Caos https://t.co/9ciJ3kd2jB
87,1093169613662244864,1546328814862622721,2022-07-11,Tamo em Tokyo em Tokyo 東 京 https://t.co/UwZ78Jy7Jr
88,48825283,1546305469207252992,2022-07-11,Vamos orar para não ter ninguém ferido nesse incêndio aqui no centro de São Paulo https://t.co/9nYjbiOhKT
89,209570167,1546290070789001217,2022-07-11,Da noite linda de ontem 😍 https://t.co/MpJM3DCaLU
90,34123254,1546288251484475392,2022-07-11,🍺 https://t.co/TKpSpONxxX
91,58070434,1546287944125775874,2022-07-11,Lugar maravilhoso @galeriadorockoficial 😍😍 em Galeria do Rock https://t.co/jSkFwdTETQ
92,817779697903894529,1546286096815882241,2022-07-11,Sempre bom lembrar que essa é a energia https://t.co/Eu5yj4NIHU
93,573309143,1546276537028280320,2022-07-10,Acabou de publicar uma foto em Parque Minhocão https://t.co/KACdjZdbaY
94,169155251,1546264318798401537,2022-07-10,A última sessão de Freud em Teatro Porto Seguro https://t.co/zYnpW318vr
95,164796545,1546263773287178241,2022-07-10,I'm at Comfort Inn in São Paulo https://t.co/hs43OxOZGu
96,164796545,1546256435616649218,2022-07-10,I'm at Estacionamento Trevo in São Paulo https://t.co/Tn3DMGWGPO
97,221759428,1546252190540611588,2022-07-10,Direita - Drinking a From Rejection To Oblivion N6 by @cervejariadogma @ Cervejaria Dogma  — https://t.co/G0KOG2eyvR
98,221759428,1546251225187901440,2022-07-10,Meio — Drinking a Huaka'i po by @cervejariadogma @ Cervejaria Dogma  — https://t.co/QepTuxQ6GB #photo
99,221759428,1546250984233603072,2022-07-10,Esquerda — Drinking a Winternator by @cervejariadogma @ Cervejaria Dogma  — https://t.co/dgXNINdQyL #photo
100,221759428,1546243395143847936,2022-07-10,Drinking a Sourmind Morango e Abacaxi by @cervejariadogma @ Cervejaria Dogma — https://t.co/mxXTgIWaQc
101,221759428,1546242932776353793,2022-07-10,Direita — Drinking a Strata Blast by @cervejariadogma @ Cervejaria Dogma  — https://t.co/07I9FWCrdc #photo
102,221759428,1546242069835964417,2022-07-10,Esquerda — Drinking a Citra Blast by @cervejariadogma @ Cervejaria Dogma  — https://t.co/pBoFfLLj1s #photo
103,221759428,1546241313640792071,2022-07-10,Esquerda — Drinking an Amante de Lúpulo by @cervejariadogma @ Cervejaria Dogma  — https://t.co/LDSrruuHzQ #photo
104,221759428,1546240637820968965,2022-07-10,Direita - Drinking a Huaka'i po by @cervejariadogma @ Cervejaria Dogma  — https://t.co/V91kpg45Ce
105,46705163,1546235499123187712,2022-07-10,A deusa Bruna Lombardi na minha frente #sesc24demaio
106,18688345,1546234793624494081,2022-07-10,Acabou de publicar uma foto em Colégio Sion https://t.co/PtSBGT7446
107,18688345,1546234340039876612,2022-07-10,Com os queridos do @magnificatcoral em Colégio Sion Higienópolis https://t.co/H5FCoQwZjQ
108,1304509993358708739,1546204653448224771,2022-07-10,Acabou de publicar uma foto em Gabinete Deputado Federal Abou Anni https://t.co/bb5qlNzkd5
109,3929009307,1546200123243380743,2022-07-10,Domingão da preguiça ✌️😂 em Ressaca Fudida! https://t.co/3n0weRReNp
110,164796545,1546193861948702721,2022-07-10,"I'm at Atlantica Hotels in Sao Paulo, São Paulo https://t.co/WRGLofmdkE https://t.co/0uBgM8spKg"
111,78099686,1546193861243977728,2022-07-10,Acabou de publicar uma foto em Minhocão https://t.co/9kGxrrazi3
112,164796545,1546193766331072518,2022-07-10,"I'm at Secretaria Municipal da Saúde - Prefeitura De São Paulo in São Paulo, SP https://t.co/4AdShJt0Co"
113,164796545,1546193631731654657,2022-07-10,Ufaaaaa (@ Nobile Downtown in São Paulo) https://t.co/pBI651925R https://t.co/qktGsY9xXe
114,166634136,1546193263786217472,2022-07-10,Rolezin top na madruga com minha linda @nathikage em Frango Com Tudo Dentro https://t.co/zqZW6Jo0iF
115,774469015,1546188288112803842,2022-07-10,"Showtime 😉
📍SALA SÃO PAULO - JÚLIO PRESTES SP BRASIL

#maisumnomundo #salasaopaulo #concert #concerto #music #musica #lifestyle #musicaevida em Sala São Paulo https://t.co/a6mv5mm0dU"
116,774469015,1546177577689169922,2022-07-10,"😌

#maisumnomundo #micksugui #people em Sala São Paulo https://t.co/2XUTK9sVr9"
117,78099686,1546173552101031937,2022-07-10,Acabou de publicar uma foto em Minhocão https://t.co/5IByeZPgd0
118,78099686,1546173421150564357,2022-07-10,#solminhocao em Parque Minhocão https://t.co/6PT6AtIlAY
119,78099686,1546172362642657280,2022-07-10,Acabou de publicar uma foto em Minhocão https://t.co/GXWywnYtCW
120,15165399,1546171579775811584,2022-07-10,Acabou de publicar uma foto em Minhocão https://t.co/YZCQpM6BQC
121,78099686,1546166572670193666,2022-07-10,Acabou de publicar uma foto em Parque Minhocão https://t.co/8EwxZ23uNM
122,765913081088241664,1546153831733645312,2022-07-10,Acabou de publicar uma foto em Casa Da Música https://t.co/gb25ZhrnHK
123,1282772919421206529,1546123767834984450,2022-07-10,Evangélicos brasileiros venderam a alma para o DIABO!
124,1282772919421206529,1546122711839260673,2022-07-10,"BOZOLUCIFER, virou rainha da Inglaterra. ""Presidente decoração""."
125,1053256480068169728,1546114572150607874,2022-07-10,"Remova o ódio do seu coração, a vida é curta. @ República, São Paulo https://t.co/jRPDc0tGi9"
126,340590353,1546106774268379141,2022-07-10,"Dissolver como o sal
Desarrumar o sol
Desafinar o mal
Desligar o farol @ Theatro Municipal de São Paulo https://t.co/Rb9FRDY7Sa"
127,1390358520,1546068407057088512,2022-07-10,"Se eu quero você, não se preocupe com quem me quer."
128,209570167,1545982651961589760,2022-07-10,Do nada… https://t.co/zW4RR6H9Lz
129,1500160402897973252,1545967751696715776,2022-07-10,"Chegueiiiiii...
Quem vem?
Já começou e vai até as 5:00. Muita putaria e muito leite.
Vem pra @upgradesxclub 
Produção @rohcamillo 

#boydotado #TheBoys #gay @ADUFF_NET @boyzspace @_divulga_boys_ @centralmachos @_K_A_I_R_O_S @FrenchGaymer @new_gaywanking https://t.co/JkASDZ8iCk"
130,78632358,1545966330410663936,2022-07-10,Drinking a Central De Caquinho Colab 2 by Cervejaria Central @ Cervejaria Central — https://t.co/oBTrjAarTf
131,78632358,1545961288144134145,2022-07-10,Drinking a Central #1 by Cervejaria Central @ Cervejaria Central — https://t.co/rgVqyLjpIO
132,78632358,1545960764862767105,2022-07-10,Drinking a Panorama by Cervejaria Central @ Cervejaria Central — https://t.co/eqqJvWcmtV
133,78632358,1545960516866154497,2022-07-10,Drinking a Cecitra by Cervejaria Central @ Cervejaria Central — https://t.co/kBYpj8KCiw
134,954003020240637952,1545940554298662918,2022-07-10,"Apreciar minha amiga aquarelista, atriz e produtora de uma peça solo magnífica deixou meu coração tão quentinho hj 🥰 

#sereníssima https://t.co/lpSOCh7KCK"
135,166270232,1545939218404413450,2022-07-10,Just posted a photo @ Sesc 24 de Maio https://t.co/RR82nWLH2g
136,174806999,1545937468381433856,2022-07-10,um banheiro bonito a gente jamais dispensa um registro :) em L.O.T.E. https://t.co/WCzhvMCLMx
137,86137639,1545907713967661056,2022-07-09,Acabou de publicar uma foto em Abc Musical Loja e Escola De Musica https://t.co/RZ0OzRrvVj
138,348475556,1545898037989593089,2022-07-09,Essa turminha também se diverte !!!! em Teatro Porto Seguro https://t.co/JBWSWGbLiX
139,22576338,1545875312835182594,2022-07-09,"I'm at Teatro SESC Bom Retiro in São Paulo, SP https://t.co/K6NfoCFLQi https://t.co/3MN5q1mCLy"
140,26576437,1545865750480666624,2022-07-09,Lançamento da pré-candidatura da @bancadatrabsp à deputada estadual com @neudespdt na cabeça de chapa a cadeira na ALESP com @lsdiana @CassioFaeddo @sougeansoares @nicolemacedosp com presença de @elviscezar_ofc e @antonionetopdt 🌹🇧🇷 https://t.co/fXxbD7YtCR
141,78099686,1545857649635459076,2022-07-09,Acabou de publicar uma foto em Galeria do Rock https://t.co/Z1qazS2LZc
142,70424635,1545855470547730433,2022-07-09,👀 https://t.co/RjsfGhZwNW
143,1420869957609574401,1545851837512810497,2022-07-09,"Márcio França, a coerência de um defensor da democracia e do estado de direito. Nosso candidato ao Senado. 👏👏👏
@marciofrancasp https://t.co/rNQkjpJKKs"
144,1443399233260986371,1545830653924605959,2022-07-09,Trabalhamos no feriado SIM!!!! ✅ em Shopping Pátio Higienópolis https://t.co/gq9z5kAMVP
145,1542192579151904768,1545816850344415240,2022-07-09,Comendo churrasco Grego pra manter a imunidade estável!!!! Fica A Dica
146,44141697,1545815004825411585,2022-07-09,"Fim de festa , e as texturas de caos , sujeira e cultura. https://t.co/WWxEaQtIyY"
147,562107096,1545773934565629953,2022-07-09,Acabou de publicar uma foto em Av Ipiranga x Av Sao Joao https://t.co/rd6INCo5TD
148,438473416,1545765714723749889,2022-07-09,Acabou de publicar uma foto em Frigideira Grill Dom José de Barros https://t.co/wT6I66ajdV
149,438473416,1545764245626933254,2022-07-09,Acabou de publicar uma foto em Frigideira Grill Dom José de Barros https://t.co/s3LuOBXP5l
150,438473416,1545764040462503941,2022-07-09,Acabou de publicar uma foto em Frigideira Grill Dom José de Barros https://t.co/3ecVH4gnOG
151,22428146,1545748374003097600,2022-07-09,I'm at Vibe República - @aptovc in São Paulo https://t.co/pBgWDnt11z
152,17230271,1545743175343644672,2022-07-09,"Buenos dias com Man Ray e sua ""Composition"", só para lembrar que faltam 85 dias para as eleições e 176 dias para o fim do governo Bozo. em Brasil https://t.co/dfsl78RntF"
153,421902687,1545658299575566337,2022-07-09,Quantos comercios e moradias #cracolandia e seus craqueiros do bem irão fechar na Av Rio Branco e Duque de Caxias em São Paulo @rodrigogarcia_ @STF_oficial @JanainaDoBrasil @gen_heleno @EmbaixadaChina @reinaldoazevedo #intervençãomilitar já ! https://t.co/jjThjAaZgo
154,74835944,1545606497450840065,2022-07-09,Acabou de publicar uma foto em Espaço Zero 11 https://t.co/6fwXuxLyRF
155,22402665,1545603318176784387,2022-07-09,Acabou de publicar uma foto em Veridiana Pizza https://t.co/ths914PbIZ
156,22402665,1545600646161776642,2022-07-09,"Confraternização famílias Amaral Frias x Rocha Santos @beatrizfrias / @zeernesto33 (@ Veridiana Pizzaria - @veridianapizzas in São Paulo, SP w/ @angelofrias @celisafrias) https://t.co/cfGP1rRNpN https://t.co/1Iqrwfg0q1"
157,144876699,1545586724687986688,2022-07-09,Sextou … em FRÊ https://t.co/wRlPDARep3
158,1485704671490625542,1545580948854636545,2022-07-09,Fechando a semana 🥰❤️ https://t.co/kFhu522aSX
159,1304509993358708739,1545577347306356736,2022-07-09,"#DEPUTADOFEDERALABOUANNI 
#ABOUANNIFILHO2022 
#FORÇAEMDOBROPELOTRANSPORTESP
#QUALIFICAÇÃODECONDUTORESDESP 
@ABOUANNI @V.ABOUANNI em Gabinete Deputado Federal Abou Anni https://t.co/gaIXOaYJeZ"
160,1528842277153538049,1545570029084745729,2022-07-09,Acabou de publicar uma foto em Espaço Gisele Ferreira https://t.co/OnrDliNE1W
161,50791870,1545564635809648641,2022-07-09,Sibelius Symphony No. 2. https://t.co/unKlMUQpgy
