,author_id,tweet_id,created_at,text
0,573309143,1546276537028280320,2022-07-10,Acabou de publicar uma foto em Parque Minhocão https://t.co/KACdjZdbaY
1,169155251,1546264318798401537,2022-07-10,A última sessão de Freud em Teatro Porto Seguro https://t.co/zYnpW318vr
2,164796545,1546263773287178241,2022-07-10,I'm at Comfort Inn in São Paulo https://t.co/hs43OxOZGu
3,164796545,1546256435616649218,2022-07-10,I'm at Estacionamento Trevo in São Paulo https://t.co/Tn3DMGWGPO
4,221759428,1546252190540611588,2022-07-10,Direita - Drinking a From Rejection To Oblivion N6 by @cervejariadogma @ Cervejaria Dogma  — https://t.co/G0KOG2eyvR
5,221759428,1546251225187901440,2022-07-10,Meio — Drinking a Huaka'i po by @cervejariadogma @ Cervejaria Dogma  — https://t.co/QepTuxQ6GB #photo
6,221759428,1546250984233603072,2022-07-10,Esquerda — Drinking a Winternator by @cervejariadogma @ Cervejaria Dogma  — https://t.co/dgXNINdQyL #photo
7,221759428,1546243395143847936,2022-07-10,Drinking a Sourmind Morango e Abacaxi by @cervejariadogma @ Cervejaria Dogma — https://t.co/mxXTgIWaQc
8,221759428,1546242932776353793,2022-07-10,Direita — Drinking a Strata Blast by @cervejariadogma @ Cervejaria Dogma  — https://t.co/07I9FWCrdc #photo
9,221759428,1546242069835964417,2022-07-10,Esquerda — Drinking a Citra Blast by @cervejariadogma @ Cervejaria Dogma  — https://t.co/pBoFfLLj1s #photo
10,221759428,1546241313640792071,2022-07-10,Esquerda — Drinking an Amante de Lúpulo by @cervejariadogma @ Cervejaria Dogma  — https://t.co/LDSrruuHzQ #photo
11,221759428,1546240637820968965,2022-07-10,Direita - Drinking a Huaka'i po by @cervejariadogma @ Cervejaria Dogma  — https://t.co/V91kpg45Ce
12,46705163,1546235499123187712,2022-07-10,A deusa Bruna Lombardi na minha frente #sesc24demaio
13,18688345,1546234793624494081,2022-07-10,Acabou de publicar uma foto em Colégio Sion https://t.co/PtSBGT7446
14,18688345,1546234340039876612,2022-07-10,Com os queridos do @magnificatcoral em Colégio Sion Higienópolis https://t.co/H5FCoQwZjQ
15,1304509993358708739,1546204653448224771,2022-07-10,Acabou de publicar uma foto em Gabinete Deputado Federal Abou Anni https://t.co/bb5qlNzkd5
16,3929009307,1546200123243380743,2022-07-10,Domingão da preguiça ✌️😂 em Ressaca Fudida! https://t.co/3n0weRReNp
17,164796545,1546193861948702721,2022-07-10,"I'm at Atlantica Hotels in Sao Paulo, São Paulo https://t.co/WRGLofmdkE https://t.co/0uBgM8spKg"
18,78099686,1546193861243977728,2022-07-10,Acabou de publicar uma foto em Minhocão https://t.co/9kGxrrazi3
19,164796545,1546193766331072518,2022-07-10,"I'm at Secretaria Municipal da Saúde - Prefeitura De São Paulo in São Paulo, SP https://t.co/4AdShJt0Co"
20,164796545,1546193631731654657,2022-07-10,Ufaaaaa (@ Nobile Downtown in São Paulo) https://t.co/pBI651925R https://t.co/qktGsY9xXe
21,166634136,1546193263786217472,2022-07-10,Rolezin top na madruga com minha linda @nathikage em Frango Com Tudo Dentro https://t.co/zqZW6Jo0iF
22,774469015,1546188288112803842,2022-07-10,"Showtime 😉
📍SALA SÃO PAULO - JÚLIO PRESTES SP BRASIL

#maisumnomundo #salasaopaulo #concert #concerto #music #musica #lifestyle #musicaevida em Sala São Paulo https://t.co/a6mv5mm0dU"
23,774469015,1546177577689169922,2022-07-10,"😌

#maisumnomundo #micksugui #people em Sala São Paulo https://t.co/2XUTK9sVr9"
24,78099686,1546173552101031937,2022-07-10,Acabou de publicar uma foto em Minhocão https://t.co/5IByeZPgd0
25,78099686,1546173421150564357,2022-07-10,#solminhocao em Parque Minhocão https://t.co/6PT6AtIlAY
26,78099686,1546172362642657280,2022-07-10,Acabou de publicar uma foto em Minhocão https://t.co/GXWywnYtCW
27,15165399,1546171579775811584,2022-07-10,Acabou de publicar uma foto em Minhocão https://t.co/YZCQpM6BQC
28,78099686,1546166572670193666,2022-07-10,Acabou de publicar uma foto em Parque Minhocão https://t.co/8EwxZ23uNM
29,765913081088241664,1546153831733645312,2022-07-10,Acabou de publicar uma foto em Casa Da Música https://t.co/gb25ZhrnHK
30,1282772919421206529,1546123767834984450,2022-07-10,Evangélicos brasileiros venderam a alma para o DIABO!
31,1282772919421206529,1546122711839260673,2022-07-10,"BOZOLUCIFER, virou rainha da Inglaterra. ""Presidente decoração""."
32,1053256480068169728,1546114572150607874,2022-07-10,"Remova o ódio do seu coração, a vida é curta. @ República, São Paulo https://t.co/jRPDc0tGi9"
33,340590353,1546106774268379141,2022-07-10,"Dissolver como o sal
Desarrumar o sol
Desafinar o mal
Desligar o farol @ Theatro Municipal de São Paulo https://t.co/Rb9FRDY7Sa"
34,1390358520,1546068407057088512,2022-07-10,"Se eu quero você, não se preocupe com quem me quer."
35,209570167,1545982651961589760,2022-07-10,Do nada… https://t.co/zW4RR6H9Lz
36,1500160402897973252,1545967751696715776,2022-07-10,"Chegueiiiiii...
Quem vem?
Já começou e vai até as 5:00. Muita putaria e muito leite.
Vem pra @upgradesxclub 
Produção @rohcamillo 

#boydotado #TheBoys #gay @ADUFF_NET @boyzspace @_divulga_boys_ @centralmachos @_K_A_I_R_O_S @FrenchGaymer @new_gaywanking https://t.co/JkASDZ8iCk"
37,78632358,1545966330410663936,2022-07-10,Drinking a Central De Caquinho Colab 2 by Cervejaria Central @ Cervejaria Central — https://t.co/oBTrjAarTf
38,78632358,1545961288144134145,2022-07-10,Drinking a Central #1 by Cervejaria Central @ Cervejaria Central — https://t.co/rgVqyLjpIO
39,78632358,1545960764862767105,2022-07-10,Drinking a Panorama by Cervejaria Central @ Cervejaria Central — https://t.co/eqqJvWcmtV
40,78632358,1545960516866154497,2022-07-10,Drinking a Cecitra by Cervejaria Central @ Cervejaria Central — https://t.co/kBYpj8KCiw
41,954003020240637952,1545940554298662918,2022-07-10,"Apreciar minha amiga aquarelista, atriz e produtora de uma peça solo magnífica deixou meu coração tão quentinho hj 🥰 

#sereníssima https://t.co/lpSOCh7KCK"
42,166270232,1545939218404413450,2022-07-10,Just posted a photo @ Sesc 24 de Maio https://t.co/RR82nWLH2g
43,174806999,1545937468381433856,2022-07-10,um banheiro bonito a gente jamais dispensa um registro :) em L.O.T.E. https://t.co/WCzhvMCLMx
44,86137639,1545907713967661056,2022-07-09,Acabou de publicar uma foto em Abc Musical Loja e Escola De Musica https://t.co/RZ0OzRrvVj
45,348475556,1545898037989593089,2022-07-09,Essa turminha também se diverte !!!! em Teatro Porto Seguro https://t.co/JBWSWGbLiX
46,22576338,1545875312835182594,2022-07-09,"I'm at Teatro SESC Bom Retiro in São Paulo, SP https://t.co/K6NfoCFLQi https://t.co/3MN5q1mCLy"
47,26576437,1545865750480666624,2022-07-09,Lançamento da pré-candidatura da @bancadatrabsp à deputada estadual com @neudespdt na cabeça de chapa a cadeira na ALESP com @lsdiana @CassioFaeddo @sougeansoares @nicolemacedosp com presença de @elviscezar_ofc e @antonionetopdt 🌹🇧🇷 https://t.co/fXxbD7YtCR
48,78099686,1545857649635459076,2022-07-09,Acabou de publicar uma foto em Galeria do Rock https://t.co/Z1qazS2LZc
49,70424635,1545855470547730433,2022-07-09,👀 https://t.co/RjsfGhZwNW
50,1420869957609574401,1545851837512810497,2022-07-09,"Márcio França, a coerência de um defensor da democracia e do estado de direito. Nosso candidato ao Senado. 👏👏👏
@marciofrancasp https://t.co/rNQkjpJKKs"
51,1443399233260986371,1545830653924605959,2022-07-09,Trabalhamos no feriado SIM!!!! ✅ em Shopping Pátio Higienópolis https://t.co/gq9z5kAMVP
52,1542192579151904768,1545816850344415240,2022-07-09,Comendo churrasco Grego pra manter a imunidade estável!!!! Fica A Dica
53,44141697,1545815004825411585,2022-07-09,"Fim de festa , e as texturas de caos , sujeira e cultura. https://t.co/WWxEaQtIyY"
54,562107096,1545773934565629953,2022-07-09,Acabou de publicar uma foto em Av Ipiranga x Av Sao Joao https://t.co/rd6INCo5TD
55,438473416,1545765714723749889,2022-07-09,Acabou de publicar uma foto em Frigideira Grill Dom José de Barros https://t.co/wT6I66ajdV
56,438473416,1545764245626933254,2022-07-09,Acabou de publicar uma foto em Frigideira Grill Dom José de Barros https://t.co/s3LuOBXP5l
57,438473416,1545764040462503941,2022-07-09,Acabou de publicar uma foto em Frigideira Grill Dom José de Barros https://t.co/3ecVH4gnOG
58,22428146,1545748374003097600,2022-07-09,I'm at Vibe República - @aptovc in São Paulo https://t.co/pBgWDnt11z
59,17230271,1545743175343644672,2022-07-09,"Buenos dias com Man Ray e sua ""Composition"", só para lembrar que faltam 85 dias para as eleições e 176 dias para o fim do governo Bozo. em Brasil https://t.co/dfsl78RntF"
60,421902687,1545658299575566337,2022-07-09,Quantos comercios e moradias #cracolandia e seus craqueiros do bem irão fechar na Av Rio Branco e Duque de Caxias em São Paulo @rodrigogarcia_ @STF_oficial @JanainaDoBrasil @gen_heleno @EmbaixadaChina @reinaldoazevedo #intervençãomilitar já ! https://t.co/jjThjAaZgo
61,74835944,1545606497450840065,2022-07-09,Acabou de publicar uma foto em Espaço Zero 11 https://t.co/6fwXuxLyRF
62,22402665,1545603318176784387,2022-07-09,Acabou de publicar uma foto em Veridiana Pizza https://t.co/ths914PbIZ
63,22402665,1545600646161776642,2022-07-09,"Confraternização famílias Amaral Frias x Rocha Santos @beatrizfrias / @zeernesto33 (@ Veridiana Pizzaria - @veridianapizzas in São Paulo, SP w/ @angelofrias @celisafrias) https://t.co/cfGP1rRNpN https://t.co/1Iqrwfg0q1"
64,144876699,1545586724687986688,2022-07-09,Sextou … em FRÊ https://t.co/wRlPDARep3
65,1485704671490625542,1545580948854636545,2022-07-09,Fechando a semana 🥰❤️ https://t.co/kFhu522aSX
66,1304509993358708739,1545577347306356736,2022-07-09,"#DEPUTADOFEDERALABOUANNI 
#ABOUANNIFILHO2022 
#FORÇAEMDOBROPELOTRANSPORTESP
#QUALIFICAÇÃODECONDUTORESDESP 
@ABOUANNI @V.ABOUANNI em Gabinete Deputado Federal Abou Anni https://t.co/gaIXOaYJeZ"
67,1528842277153538049,1545570029084745729,2022-07-09,Acabou de publicar uma foto em Espaço Gisele Ferreira https://t.co/OnrDliNE1W
68,50791870,1545564635809648641,2022-07-09,Sibelius Symphony No. 2. https://t.co/unKlMUQpgy
69,53796569,1545557378921222149,2022-07-08,🌃👏👏🥂💫💯 em Esther Rooftop https://t.co/weLRq4j876
70,1535359741001613314,1545542732650790914,2022-07-08,https://t.co/2v7r4FbhlA
71,23579118,1545542589033717760,2022-07-08,Acabou de publicar uma foto em Smart Fit https://t.co/sZZPqJm2Tm
72,107427568,1545531930623492096,2022-07-08,"Postais paulistas II
Estação Júlio Prestes.

Sao Paulo postcards II
Julio Prestes Station.

#saopaulo #luz #citysnapshot #postcards #brazil #amateurphotography #mobilephotography #cidades em Estação Júlio Prestes https://t.co/10o2J97kFt"
73,51421519,1545531710191947777,2022-07-08,Acabou de publicar uma foto em Santa Cecília https://t.co/YRX48zQL7m
74,66410762,1545530223931932672,2022-07-08,"I'm at Cora in São Paulo, SP https://t.co/s8CzqplwKc"
75,1535359741001613314,1545527358383325185,2022-07-08,https://t.co/OsBwypB57E
76,1443399233260986371,1545521983705718784,2022-07-08,Mais um dia de trabalho !!! #nofilter #gay https://t.co/4Hc0twfx3E
77,147665151,1545517361574432769,2022-07-08,Shopping? Só mais galeria… https://t.co/hr8Vfz7C2J
78,1522883136664838146,1545514104583905280,2022-07-08,"Acabou de publicar uma foto em República, São Paulo https://t.co/ssaxDZPgX6"
79,1522883136664838146,1545511199592177664,2022-07-08,Acabou de publicar uma foto em Santa Casa de São Paulo https://t.co/idEsBE19zt
80,55968440,1545494246538596365,2022-07-08,Acabou de publicar uma foto em Lvtetia Erick Jacquin https://t.co/TO0eKpanMM
81,1347077785,1545478266500354051,2022-07-08,Será que amanhã a @beltraomaria vai abrir o programa falando: “tá aí? Então entra que você já #ÉdeCasa!”
82,1347077785,1545477353991716868,2022-07-08,"Para além da canalhice de fazer parte do Orçamento Secreto, se fôssemos um país serio, deveria ser critério básico para ser senador, no mínimo, experiência de pelo menos 1 mandato na Câmara tbm. Não dá pra chegar na Casa mais alta do Congresso com ações de vereador https://t.co/sp7UlbK5it"
83,1121631714382503937,1545471304173854720,2022-07-08,Existe amor em SP? em Tokyo 東 京 https://t.co/xU09u2LTeN
84,1347077785,1545458337382375424,2022-07-08,"E olha que tá sendo um investimento bom hein…não só pra Maria poder apresentar o #encontro ou o #MaisVoce em substituição, mas pode ser que o #ÉdeCasa possa se tornar diário… https://t.co/VTN5u1iLby"
85,1347077785,1545458035866456066,2022-07-08,"Problema não é a inversão, é a apresentadora e o formato…#encontro https://t.co/l3dOPSpgP9"
86,1347077785,1545456680246419456,2022-07-08,"Armar a população traz mais segurança sim, confia 👍 https://t.co/PNLyCHiTY3"
87,2787216415,1545445953645289473,2022-07-08,Acabou de publicar uma foto em Galeria Dandi https://t.co/B88pheZ8lA
88,438473416,1545399666342301696,2022-07-08,"Chegou Sexta-feira e o Samba é no Frigideira 💥💥💥💥
Se liga nessa promoção 😱😱😱
Latinha a R$1,50
#sextou🔥 #frigideiragrill #gruposambaentreamigos em Frigideira Grill Dom José de Barros https://t.co/DEVRz9emnm"
89,1460081320630140932,1545295931159072768,2022-07-08,Tocou CAVALONA no #irregular socorro eu AMEI @iBlogueirinha icone do Brasil
90,273556388,1545274569602342912,2022-07-08,Sendo expulsa do amarelinho neste momento
91,28356964,1545246037853495297,2022-07-08,"I'm at Trago in São Paulo, SP w/ @stayrai https://t.co/GCMWIu5GPj"
92,28356964,1545237552466214914,2022-07-08,"I'm at Pratododia in São Paulo, SP w/ @stayrai https://t.co/xlIIGI9ooN"
93,41958045,1545231904441618433,2022-07-08,Sempre uma experiência incrível na @acasadoporcobar em A Casa do Porco Bar https://t.co/3ZGZbsZXra
94,1443399233260986371,1545202294853013504,2022-07-08,Fim do dia de trabalho!!! em Shopping Pátio Higienópolis https://t.co/kGlreVgfda
95,22530598,1545198046845325312,2022-07-08,E qdo o bloco de Carnaval chega até vc? Em julho??? Em São Paulo? Como faz?
96,69343364,1545194921820405761,2022-07-07,Obrigado Cuuuuuunhada amei meu presente!! em Edificio Capitolio https://t.co/4LUXfdTEsB
97,983761072644648960,1545192056620032007,2022-07-07,"Mais um trabalho entregue, customização para a Playmobil Art Experience. https://t.co/Rdco7x7BsE"
98,34118957,1545188769959387136,2022-07-07,"""Existe ❤️ em SP!""
Já que hoje é dia de tbt, vamos de uma noite na cidade que existe amor sim, bbs. 
#tbt #love #goodmoments #goodnight em Tokyo 東 京 https://t.co/0M6BTdNarq"
99,1508582235393380355,1545186371991732231,2022-07-07,"Ótima noite, amores! https://t.co/3cmK1jL6p7"
100,251109370,1545178407360765955,2022-07-07,Acabou de publicar uma foto em TEND TUDO BROTHERS https://t.co/24pAqXvKcr
101,15946117,1545173241291046912,2022-07-07,07.07 https://t.co/96GtchtKwR
102,22530598,1545168298303700992,2022-07-07,Hoje está particularmente difícil... Hahahaha #sqn https://t.co/TBsQdw5BKa
103,25042231,1545158997220605952,2022-07-07,Separando material de acervo pro documentário do Queers &amp; Queens achei essa pérola pro #TBT de hoje. Quem me conhece sabe que essa cara é de mal intencionada 🤣😈 em Morfeus Club https://t.co/3uzb4cSj79
104,1347077785,1545157969670725644,2022-07-07,Meio mundo em Portugal e eu não quero ver isso lalalalalalala
105,1486058855268294656,1545156242657640448,2022-07-07,Acabou de publicar uma foto em Coraçao da Cracolândia https://t.co/YzdTWxkJwU
106,72601613,1545125912102031360,2022-07-07,Acabou de publicar uma foto em Interamerican Network https://t.co/fjb690D8Z6
107,1522734726041190402,1545120974693175299,2022-07-07,"Acabou de publicar uma foto em Porto Seguro Alameda Barão de Piracicaba, 618 https://t.co/BuFX4TMCeY"
108,1522734726041190402,1545120330666020865,2022-07-07,"Acabou de publicar uma foto em Porto Seguro Alameda Barão de Piracicaba, 618 https://t.co/BgFLRyiPIP"
109,2984844466,1545066814924808192,2022-07-07,"Eu sei que todos os dias quando eu acordo Deus dá um sorriso e me diz, estou te dando a chance de tentar de novo. #bomdia #dialisando #renalcronica #deusnocomando #fé em Nefro São João https://t.co/UCQYhvYm8j"
110,333376246,1545045292264800261,2022-07-07,"Movimento é verbo, né 🎈🌵🌿🌸🎏
Bom diae
#coragem em Ação Educativa https://t.co/nK9D2MwskH"
111,69343364,1545013872150683651,2022-07-07,Olha isso Brasil 🇧🇷 despertar no #largodoarouche em Edificio Capitolio https://t.co/wZEORSsKay
112,233592511,1545010528560578562,2022-07-07,"Começamos ontem a nova série de mensagens na @advecsaopaulo • CARTAS ÀS IGREJAS. 
Amamos a Palavra de Deus. 
Te espero quarta que vem! 🔥 em São Paulo - A Cidade Que Não Para! https://t.co/rJALx7gNsb"
113,1506481613667983366,1545010101131649025,2022-07-07,Bom dia ☀️ https://t.co/4szFv8z7BX
114,28273980,1544893675632836608,2022-07-07,"E assim se passaram 10 anos!!!

Muita Parceria 
Muita Labutaria
Muita Correria 
Perrengues e Alegrias!

Obgda Sempre Kiridus
@waldirterence  e @ronnyvieira82 

Que venham mais!!! @ Terraço Itália Restaurante https://t.co/OQWg4ZuHQy"
115,553554326,1544882495514152960,2022-07-07,cuidando da mana
116,85299365,1544866901830033410,2022-07-07,Na vida eu só tenho professores. Sempre aprendendo com você meu amigo @edison.palhares ☕️🤜🤛🤙 @ Shopping Pátio Higienópolis https://t.co/hES7Neqqrb
117,76481710,1544850121082511361,2022-07-07,Acabou de publicar uma foto em Blue Space https://t.co/47p6dPUsI2
118,162424619,1544840211393380364,2022-07-07,Obrigado poluição de São Paulo por mais um sunset https://t.co/vfSjw0s54U
119,254050963,1544829868197789696,2022-07-06,Acabou de publicar uma foto em Teatro Porto Seguro https://t.co/V4r8Iuzl0d
120,2902560759,1544823813707337729,2022-07-06,Brandow Bossa Nova 🪐 @ Instituto Artium de Cultura https://t.co/8JjDFloQP8
121,28356964,1544808909722079237,2022-07-06,I'm at Pizzaria Central https://t.co/0BxUsWtPq0
122,114581418,1544808550383423489,2022-07-06,Acabou de publicar uma foto em Rede Resiliência e Consciência https://t.co/y1xfz5soGd
123,15419776,1544807533893849089,2022-07-06,"Foto dedicada aos modelos do clique, centro de São Paulo City. #saopaulocity #saopaulowalk #fotodecelular #fotos #fotoart #photo #photography #streetphotography #photooftheday #pocox5pro em Sesc 24 de Maio https://t.co/2jhfgE1SRm"
124,55970374,1544798804821643266,2022-07-06,Acabou de publicar uma foto em Santa Cecília https://t.co/BvyeC79IcX
125,14813467,1544793417783414784,2022-07-06,Acabou de publicar uma foto em Santa Cecília - Sp Capital https://t.co/sj1K3cqWuN
126,80051818,1544771948848287746,2022-07-06,"Lugar com o nome mais apropriado pra ficar com o #thelastclassico no radinho. @TACOCS café, digo... https://t.co/5nYFeSEFSp"
127,1494447863505510405,1544769810986319874,2022-07-06,Tudo na vida passa… menos a vontade de ficar rico e de DAR! https://t.co/Tfi2Ioy5ao
128,26327667,1544758855963271168,2022-07-06,Acabou de publicar uma foto em Brasil https://t.co/kocAtqzv8Q
129,27008217,1544755304495476736,2022-07-06,Pausa para um café. #TheatroMunicipal #Arcos #SaoPaulo #Coffee #early20thcenturyarchitecture #sampa #nofilter em Theatro Municipal de São Paulo https://t.co/k5qRUUeisi
130,27008217,1544752579313377285,2022-07-06,Pichação na fachada do Teatro Municipal de São Paulo…😒 https://t.co/EFixM9nKnG
131,1383869697972572164,1544749785873358850,2022-07-06,Os gerentes responsáveis sempre cumprem seus horários de almoço juntos. Lamentável @BancodoBrasil
132,1383869697972572164,1544749481475842049,2022-07-06,"A resposta da atendente quando a questionei, como a deixaram sozinha sem a capacidade de executar as funções, ela disse ser sempre assim .
Lamentável @BancodoBrasil"
133,1383869697972572164,1544749113589305346,2022-07-06,"Já saiu discussão, ofensas e muito descontentamento dos clientes, agora mesmo tem mais um cliente que a atendente não conseguiu resolver e terá q esperar por algum responsável. Lamentável @BancodoBrasil"
134,1383869697972572164,1544748708327194627,2022-07-06,"Esperamos por muito tempo e quando somos chamado, a atendente não consegue executar o procedimento, então, voltamos para o banco e esperamos novamente até a chegada de algum responsável. Lamentável situação @BancodoBrasil"
135,1383869697972572164,1544747872788307968,2022-07-06,"Vcs não acreditam!!!! Estou dentro de uma agência do @BancodoBrasil para fazer uma quitação de financiamento imobiliário, saíram todos os gerentes responsáveis e deixaram uma atendente que não possui acesso ao procedimento.
Várias pessoas a serem atendidas e apenas uma pessoa"
136,27008217,1544745627409686529,2022-07-06,"Bora resolver uns pepinos… (@ Sebrae Sp in São Paulo, SP) https://t.co/PhJvnpcIX0"
137,1522734726041190402,1544724809501708288,2022-07-06,"Acabou de publicar uma foto em Porto Seguro Alameda Barão de Piracicaba, 618 https://t.co/71iobVVw8M"
138,1522734726041190402,1544719469208936448,2022-07-06,"Acabou de publicar uma foto em Porto Seguro Alameda Barão de Piracicaba, 618 https://t.co/ePoh298d5j"
139,1347077785,1544717870319427584,2022-07-06,Aaaaaaaaaaaaaaaaaaaaaaaaaaaaaaa 😰😰😰😰😰😰😰😰😰😰😰😰😰 https://t.co/0G2d1HjsVy
140,1249758495374807042,1544716076008853504,2022-07-06,"@HothouseSP  
       🔥QUARTA E❌❌❌TRA 🔥

shows eróticos 🔞 
pizza free 🍕 https://t.co/3BtL1u2pyO"
141,1347077785,1544715288926732288,2022-07-06,GRAÇAS A DEUS 🙏 https://t.co/ocLfmlYfbx
142,13484842,1544710878842523649,2022-07-06,"Tomei uma matcha latte gelado e comi um brownie de matcha. Uma delícia, só recomendo pedir dose extra de matcha 💚"
143,13484842,1544710875227062273,2022-07-06,"Hoje fui conhecer o Gatcha, primeiro cat café de SP e que é especializado em matcha. Duas paixões minhas gatos e matcha 💚. Só não pude brincar com os gatos pq tava sem tempo, mas amei, lugar pequeno mas muito bacanat https://t.co/jFJK8khYX8"
144,932900692762808320,1544696920437841921,2022-07-06,Acabou de publicar uma foto em Colégio São Gonçalo https://t.co/YrqdqLXeTI
145,932900692762808320,1544693280176492544,2022-07-06,Acabou de publicar uma foto em Colégio São Gonçalo https://t.co/izhywJjCy1
146,1528842277153538049,1544645956292968449,2022-07-06,Acabou de publicar um vídeo em Espaço Gisele Ferreira https://t.co/pDegiYCJh9
147,1521522379704483841,1544637881003790338,2022-07-06,Bom dia SP https://t.co/VvKOzWbryP
148,74325248,1544628106887061508,2022-07-06,Acabou de publicar uma foto em Schettini Luthieria https://t.co/guh6TlWpQY
149,14409620,1544555071299497984,2022-07-06,"Suit Style
📸 @andrefrenesi em L.O.T.E. https://t.co/KwRcz8FuEh"
150,1507070421564276739,1544523862230056962,2022-07-06,Just posted a photo @ Brasil https://t.co/eFCyt03o8U
151,1511058555985702912,1544504076603478016,2022-07-06,@GordoBi33 sim sp
152,1898283902,1544501044675108865,2022-07-06,Acabou de publicar uma foto em TV CDK Brasil https://t.co/MFZz3H504U
153,1898283902,1544500893487448066,2022-07-06,Acabou de publicar uma foto em TV CDK Brasil https://t.co/mW8Ej3D3XH
154,169254972,1544496690438279169,2022-07-06,Acabou de publicar uma foto em Escola do Frio CTR https://t.co/9HQCzgoKEb
155,438473416,1544467207224102912,2022-07-05,Acabou de publicar uma foto em Frigideira Grill Dom José de Barros https://t.co/rYqiix2PxE
156,114581418,1544443580470935552,2022-07-05,Acabou de publicar um vídeo em Rede Resiliência e Consciência https://t.co/5IuFOUPeY7
157,889984327257378816,1544419034363564034,2022-07-05,"Toda semana uma @tiffanyariel_ passando no seu feed! 🔥
⠀
Você faria um ensaio assim? em Setin Downtown Nova República https://t.co/IMbr40yUsL"
158,64405389,1544418489879990273,2022-07-05,🌡️🔥 em Irregular https://t.co/ruQVOGz0ZX
159,1110348628592418816,1544414680889827328,2022-07-05,"⭐️⭐️⭐️ ATENÇÃO  ⭐️⭐️⭐️

Salve galera, passando pra avisar que HOJE tem LIVE no canal do ONLYFANS às 22:30 não percam 🔥🔞🆘️

https://t.co/L3fsrTq28f https://t.co/H3bvAiKfAu"
160,2787216415,1544410448027582469,2022-07-05,Acabou de publicar uma foto em Teatro UOL https://t.co/IZXzfRWxXt
161,1347077785,1544402553135316999,2022-07-05,Im not saying he deserved it but God’s timing is always right https://t.co/TKZZzIZ42P
162,1347077785,1544401952003575809,2022-07-05,Fora o adesivos gigantesco no vidro da redação que tbm é horroroso. @GloboNews deem um trato no estúdio principal do Rio como vcs deram no do #Estudioi plmdds
163,1347077785,1544401149763227650,2022-07-05,"E fazer uma bela reforma nesse principal, tá foda #Edicao16"
164,1347077785,1544401147212988420,2022-07-05,"O estúdio G da GloboNews no Rio precisa de uma reforma URGENTE. Olha essa tv do canto direito, horrível de pequena. Tem muita poluição de painel de madeira, no #J10 ainda colocam duas tvs verticais que não servem pra nada. Precisa mandar os programas pro estúdio do #Estudioi"
165,74325248,1544370245803991040,2022-07-05,Acabou de publicar uma foto em Schettini Luthieria https://t.co/Zs4w6cZr3x
166,1347077785,1544360758871482368,2022-07-05,Sdds de ver a @beltraomaria chamando a @NatuzaNery na minha tv às 13h30 da tarde 😰💔 #Estudioi
167,1521625431639736320,1544352730524925952,2022-07-05,“Today is good day to have a good day” :) https://t.co/FIFEVEP6M3
168,1347077785,1544352263791067137,2022-07-05,@ICepollina Acho que isso tem cheiro de acabar com a Sessão da Tarde e colocar a Namaria entre o JH e o VAPVDN
169,1358832120572108806,1544348068480708608,2022-07-05,🥛
170,1358832120572108806,1544347926616481794,2022-07-05,Cadê? 🍆
171,114581418,1544333697993826304,2022-07-05,Acabou de publicar um vídeo em Rede Resiliência e Consciência https://t.co/7xQwM2r63P
172,2369876893,1544331647314690053,2022-07-05,https://t.co/hgwxw2Rovg
173,1347077785,1544323756742643714,2022-07-05,Mds…NINGUÉM pediu a Patrícia no #Encontro e muito menos a manhã inteira 🙄🙄🙄🙄 https://t.co/LP1KtQ03Qq
174,1445743452004618245,1544306546833760256,2022-07-05,Acabou de publicar uma foto em Central Caos https://t.co/nqav5wnehH
