,author_id,tweet_id,created_at,text
175,1542866357959753731,1544297415297142790,2022-07-05,"Bom dioou, ótima terça - feira. 
#existeamoremsp https://t.co/ZKsrKKAeXZ"
176,28356964,1544296107827683331,2022-07-05,"I'm at Bar e Lanches Pombalense in são paulo, sp https://t.co/c5fn9Vh5RW"
177,28356964,1544294727427694593,2022-07-05,"I'm at Urban Resort in São Paulo, Sp https://t.co/cN0PVAO8QQ"
178,1503835985897041924,1544274882917269505,2022-07-05,"Não!!! O Álvaro Dias é uma lenda 
... o único que defendeu muito o Moro... entre o Lula e balsonaro ele não tem dúvida e eu Tb!!! https://t.co/ioWSt9l64S"
179,1528842277153538049,1544273851231748097,2022-07-05,Acabou de publicar um vídeo em Espaço Gisele Ferreira https://t.co/wRGhJNBC0A
180,69343364,1544247163827277824,2022-07-05,Meu amor felicidades parabéns tenha um dia lindo de grandes realizações e muita saúde te amo bjs kkkkk bolo as 6:00 horas da manhã ninguém merece kkkkk em Edificio Capitolio https://t.co/huwfXcLqFi
181,1002073590425116672,1544163909464215554,2022-07-05,"Que tarde !!!!

Um 🔥🔥🔥 maravilhoso, química sensacional, companhia maravilhosa e fechamos com chave de ouro no nosso restaurante favorito ❤️ https://t.co/n5I2UUoQgw"
182,22530598,1544161774018215938,2022-07-05,Hj vou dour com um gatão!!! https://t.co/RqQahezcmr
183,1213847318195101696,1544139984164323333,2022-07-05,a foto clássica rs https://t.co/E3woQtveDD
184,1002073590425116672,1544130886412779521,2022-07-05,"Sorte do dia.
E muito bom de 😛 https://t.co/z6WWShy5bC"
185,28356964,1544117548836331520,2022-07-05,I'm at Edifio Metro II https://t.co/VfVfMjSP7J
186,22576338,1544111056552923136,2022-07-05,"Fórum do Reggae (at @GaleriaOlido in São Paulo, SP) https://t.co/YaTZpDYxO9 https://t.co/hYWyyHIfP0"
