,author_id,tweet_id,created_at,text
0,1390016160918294529,1531563983055953921,2022-05-31,Foto appena pubblicata @ Lago Di Lecco https://t.co/d3QpsjwUUt
1,1478239042919710721,1531547263666950146,2022-05-31,"Lá vou eu, gastar meu dinheiro no Princesinha."
2,1832686855,1531497861828993025,2022-05-31,Eu tenho um irmão que… 🫣 https://t.co/HEMosqIVsU
3,438473416,1531483376535977987,2022-05-31,"Se liga só no que vai rolar nesta Sexta Feira!!
Estaremos de volta ao Centro e essa volta será no @frigideiragrilleventos @frigideiraoficial em Frigideira Grill Dom José de Barros https://t.co/Cceq3H7uxQ"
4,438473416,1531483150064418821,2022-05-31,"Se liga só no que vai rolar nesta Sexta Feira!!
Estaremos de volta ao Centro e essa volta será no @frigideiragrilleventos @frigideiraoficial em Frigideira Grill Dom José de Barros https://t.co/TkzRyvQT5h"
5,438473416,1531481363139944448,2022-05-31,"Se liga só no que vai rolar nesta Sexta Feira!!
Estaremos de volta ao Centro e essa volta será no @frigideiragrilleventos @frigideiraoficial em Frigideira Grill Dom José de Barros https://t.co/you1BX7LwM"
6,51644295,1531435916870488064,2022-05-31,"🥳 Uma tarde deliciosa com pessoas maravilhosas que me fazem muito feliz ! Obrigado amigos, vcs são incríveis 🥳🎈 #BirthdayDoTih  desliza pra ver esses lindos, eu amo cada um ❤️ em FRÊ https://t.co/VXQYdfdEip"
7,73002111,1531432120132018179,2022-05-31,"O nosso amor não é normal, mas as nossas loucuras não fazem mal. ❤️ em Praça Marechal Deodoro (São Paulo) https://t.co/DEy8Bl1N4d"
8,72601613,1531429714027585540,2022-05-31,Acabou de publicar uma foto em Interamerican Network https://t.co/wG9HV2duoL
9,48907216,1531407862857080835,2022-05-30,Acabou de publicar uma foto em Sala São Paulo https://t.co/DfgNMxg9rF
10,72601613,1531407392788848640,2022-05-30,Acabou de publicar uma foto em Interamerican Network https://t.co/KgJNXdF7io
11,128124649,1531398715558068224,2022-05-30,Acabou de publicar uma foto em La Salsa Discotek https://t.co/UfFtVrYYaK
12,1226381700168474624,1531360023040839681,2022-05-30,unthaw mah heart ❄🧊🌬 @ Freezer https://t.co/CR36JBMdRW
13,774469015,1531339161919184901,2022-05-30,Acabou de publicar uma foto em Memorial do Holocausto https://t.co/hKu65BWsIC
14,2953014478,1531337985484013569,2022-05-30,"Mais um #30 Vozes trocado, dessa vem foi A História do Holocausto. Com a querida Sarita Sarue. em Memorial do Holocausto https://t.co/LpIZndCk6U"
15,72601613,1531332315707854848,2022-05-30,Acabou de publicar uma foto em Interamerican Network https://t.co/F2MGxWhTlo
16,822929250437177345,1531323599197446144,2022-05-30,Hoje o dia ta suave
17,1181938948702162945,1531301055933423617,2022-05-30,sweet dreams (are made of this) - funk version https://t.co/ViESChAeCz
18,1260458882335465472,1531297868916613120,2022-05-30,Acabou de publicar uma foto em Brasil https://t.co/X82YyzN7k4
19,11351602,1531287990063988741,2022-05-30,Just posted a photo @ Santa Cecília /Higienópolis/República/Vila Buarque https://t.co/QqFExIQv4A
20,1058570406175694848,1531286766929453058,2022-05-30,Ainda rindo com amor desse bolo! 🥰🎂 https://t.co/b2B24L4yUR
21,64550233,1531276095756066816,2022-05-30,Estamos abertíssimos!! em Santa Cecília https://t.co/Y3IpRz4GvU
22,74325248,1531267862970654725,2022-05-30,Acabou de publicar uma foto em Schettini Luthieria https://t.co/LYraZIzhkH
23,1445743452004618245,1531264867130175488,2022-05-30,Acabou de publicar uma foto em Soundsgood https://t.co/3uLWPWXo9q
24,36764360,1531247193084121088,2022-05-30,Acabou de publicar uma foto em Hemocentro Santa Casa https://t.co/G5kSRBxdbB
25,36764360,1531244452563632129,2022-05-30,"Subiram os balões pra comemorar meu aniversário, mas quem ganhará o presente serão pelo menos 4 pessoas que irão receber este sangue.
Os bancos de sangue estão cada vez mais escassos, então para que mais pessoas possam comemorar mais aniversários: 
Doe Sangue, Salve Vidas https://t.co/T9rTOB5YIA"
26,305758981,1531241234731126784,2022-05-30,"📷🚶🚶

.
.
#spmano #splovers #vscon #urbanart #spdagaroa #ig_brail #ig_saopaulo #city #sponeway #olharesdesampa #art em Minhocão https://t.co/tUwVvmKDxS"
27,35291115,1531235673323208704,2022-05-30,Animado eu não estou... Mas vim!!!
28,934879761956065281,1531227226699616257,2022-05-30,"A melhor torcida do mundo @torcidamv83 passou por aqui , banco de sangue da Santa Casa 🩸 https://t.co/YRvmtKzdl6"
29,253164228,1531103233694998528,2022-05-30,#julianobaeta #viagem #s9plus #fotografia #arte #saopaulo em Theatro Municipal de São Paulo https://t.co/1M5UkQeYlE
30,790449313,1531100384944607232,2022-05-30,"@eladaninha Aqui teremos 6. Até meu neto tequila é lula . Mas contanto com a família , acho que uns 25 https://t.co/oifPlJRhgr"
31,15349705,1531073236875845636,2022-05-30,Acabou de publicar uma foto em Av Ipiranga x Av Sao Joao https://t.co/lBi548Wis5
32,82648434,1531069420507959296,2022-05-30,Acabou de publicar uma foto em Galeria do Rock https://t.co/FKc3zUN5qI
33,119103924,1531067639807844354,2022-05-30,"Ontem final da Champions e encontro do peladinha, tive o prazer de conhecer o @principevidane , que tem sido minha companhia toda quinta feira desde 2015. Tamo junto príncipe e continue fazendo esse trabalho foda 🤘🏼🤙🏼 https://t.co/FaQb3G4PRp"
34,2912213903,1531063995511189504,2022-05-30,Dumb. em Tokyo 東 京 https://t.co/hk7cxHN4w8
35,2912213903,1531063050228350976,2022-05-30,Dumb 🇯🇵 em Tokyo 東 京 https://t.co/SX01WxehC6
36,2912213903,1531061858005917697,2022-05-29,Dumb 🍣 em Tokyo 東 京 https://t.co/YzMdxqvMH0
37,3291345878,1531048242049327105,2022-05-29,Acabou de publicar uma foto em AutoAba Acessorios Especialistas em Acessórios https://t.co/vlK5ExIwIe
38,193043317,1531039735267098624,2022-05-29,🚀🏹 https://t.co/ad9rO3MCI7
39,64550233,1531022603925737475,2022-05-29,Estamos abertíssimos em Japan Tower https://t.co/W8Y9QmzPgJ
40,55970374,1530999197360607236,2022-05-29,Acabou de publicar uma foto em Santa Cecília https://t.co/MXhXCdS3CK
41,1477046463393935369,1530985407281876993,2022-05-29,Congresso da aliança da Juventude revolucionária do PCO! https://t.co/jomi1pnsJ8
42,1477046463393935369,1530985403745984514,2022-05-29,Participando do encerramento do Congresso Aliança da Juventude revolucionária do PCO em São Paulo! https://t.co/9cndV8QYuz
43,1427345464232497161,1530978481781235712,2022-05-29,🙅🏾‍♂️💴 https://t.co/oEiHCXkjOY
44,108637786,1530974570651340800,2022-05-29,"“…Mas trago de cabeça uma canção do rádio, em que um antigo compositor baiano me dizia: Tudo é divino tudo é maravilhoso!”

#sampa em República, São Paulo https://t.co/1yCdwFzasc"
45,202808816,1530972249712369665,2022-05-29,"AMANHÃ tem #pegadaBRAVAnoEXECUTIVO!
SET TIME 🕦 11h30"
46,134649778,1530959683833446400,2022-05-29,https://t.co/wGItrRw3AF
47,3291345878,1530950208351354881,2022-05-29,Acabou de publicar uma foto em AutoAba Acessorios Especialistas em Acessórios https://t.co/cLpq0Twdy9
48,1260458882335465472,1530947188657795075,2022-05-29,Acabou de publicar uma foto em Brasil https://t.co/Iu2LoqxJnc
49,55970374,1530933356489330689,2022-05-29,Acabou de publicar uma foto em Santa Cecília https://t.co/kaBdRaa6Ss
50,78099686,1530932085212471297,2022-05-29,💪💪 em Minhocão https://t.co/dp3qhKLmAC
51,78099686,1530930909364510721,2022-05-29,Vai devagar mas vai …. 💪💪🏃‍♂️🏃‍♂️ em Minhocão https://t.co/LZGwF3hXX0
52,78099686,1530930691181101060,2022-05-29,Acabou de publicar uma foto em Minhocão https://t.co/e0nFcWiygg
53,78099686,1530930000932835330,2022-05-29,Tá pago a caminha de hoje 💪💪 em Minhocão https://t.co/NBMcGyqW1L
54,15430166,1530912094350200832,2022-05-29,I'm at Parque Minhocão in São Paulo https://t.co/qici3rFxit https://t.co/KiyreP7fD6
55,1103140138530553856,1530911435638853635,2022-05-29,Já já começa https://t.co/wUoLVdjBfg
56,33085798,1530904167539265545,2022-05-29,Acabou de publicar uma foto em Sesc 24 de Maio https://t.co/NVJsu5LaEf
57,3864453645,1530898768853315584,2022-05-29,"Job entregue, equipe de milhões!!! Obrigado a todos!!! em Shopping Pátio Higienópolis https://t.co/0qzJHRJdNh"
58,1500611048830914563,1530888029937836032,2022-05-29,Yesterday 😉 https://t.co/HjUTcIFiSM
59,1103140138530553856,1530885839152103426,2022-05-29,"Bom dia.
🎶🎶🎶 https://t.co/zmrHCIjCCR"
60,1359672332990701571,1530876957272973312,2022-05-29,Igreja Da Santa Cecília umas das que eu mais gosto. https://t.co/kZNX03SGPP
61,1418387537282883585,1530840230667984896,2022-05-29,https://t.co/4WYUvv917a
62,1418387537282883585,1530819016675164160,2022-05-29,https://t.co/dpRPVfJGAT
63,511076026,1530764053424971778,2022-05-29,Acabou de publicar uma foto em Arena De Lutas SP https://t.co/ycc0Q5TQTD
64,233166705,1530748558734925824,2022-05-29,Meu segundo maior amor 😍 https://t.co/c6uaW0FPR3
65,1282773009032523776,1530718843580076032,2022-05-29,Acabou de publicar uma foto em Japan Tower https://t.co/6DR0zdicfF
66,76481710,1530717787341180939,2022-05-29,Acabou de publicar uma foto em Hey Hey Club &amp; Eventos https://t.co/LPFBQIDVOM
67,1282773009032523776,1530717759071563776,2022-05-29,Acabou de publicar uma foto em Japan Tower https://t.co/Vc1ve52otD
68,847753393900666880,1530693290500276225,2022-05-28,"Das erste Mal in 111 Jahren eine Aida mit schwarzer Protagonistin, im wichtigsten Opernhaus São Paulos #noblackfacing #aida https://t.co/Rh035U5CXS"
69,629649182,1530669189634985984,2022-05-28,Dando um tapa no telhado!!! em Bairro Barra Funda https://t.co/RAq6TCngpz
70,35072625,1530660509334110208,2022-05-28,"❤️❤️❤️ ami, te amo é issooooooooo em Caracol Bar https://t.co/FPbA86h69Q"
71,1477046463393935369,1530654368680267779,2022-05-28,Congresso da aliança da Juventude revolucionária do PCO em São Paulo! ( Análise política com Rui Costa Pimenta ) . https://t.co/hk0cwJT1Ws
72,14502791,1530645667500236800,2022-05-28,Amores em Deep Bar 611 São Paulo Brazil https://t.co/vFuWJEM0P4
73,95433357,1530627837476057088,2022-05-28,"@deepbar611 , agora… bora vir para cá assistir a preliminar de Palmeiras x Santos de amanhã.
@juniorayr   . O Santista acha que terá chances amanhã. Rsrs em Deep Bar 611 São Paulo Brazil https://t.co/Xz5uBI7IJF"
74,1265649820225753089,1530627383698538496,2022-05-28,"samba, chopp e futebol. (at @Bar_Brahma in São Paulo, SP) https://t.co/KTQ9LHXAXN"
75,78632358,1530627311158054912,2022-05-28,💚 em Minhocão https://t.co/3EytcrZIaW
76,14963281,1530623177843417088,2022-05-28,Pau comendo solto fora do estádio de France na final da Champions #UCL
77,3724233975,1530614394345889792,2022-05-28,"#Sabadou (at @Bar_Brahma in São Paulo, SP) https://t.co/NLf0SAnDXY https://t.co/UUQmm1F1Nv"
78,3404698167,1530602421034045440,2022-05-28,Jesus!!!!! https://t.co/3I9H9exLB3
79,1170883964724269057,1530583140330250241,2022-05-28,Odete Roitman e alguns de seus fãs https://t.co/uwOTBehbUZ
80,52058931,1530582097567662080,2022-05-28,"😎 Ontem, logo após o lançamento do tease do filme D’ALMA - O Pacto, na noite do dia 27/05/2022, internacionalmente.  Estamos felizes pela realização do projeto que dia a dia está ganhando corpo. Assim, vamos aproveitar esse nosso novo momento e fase da vida 🌶🍀✈️ https://t.co/Ltd7RrwkvH"
81,100640766,1530576643047182338,2022-05-28,Isso fala muito sobre nosso presente😔 https://t.co/qudC5sDShv
82,15946117,1530558019603505154,2022-05-28,"I'm at Shopping Bom Retiro in São Paulo, SP https://t.co/wSMFA52myr https://t.co/JI7Kxr3f9f"
83,69343364,1530536096337014784,2022-05-28,Bommmmm diaaaaaa pessoas incríveis bjs ótimo final de semana bjs em Edificio Capitolio https://t.co/OgJW2i1QOR
84,981327172156747776,1530534830244614146,2022-05-28,Sobre a BELIEBER PARTY ontem. ❤️ https://t.co/6ufNLeQ1no
85,1420869957609574401,1530527604775784448,2022-05-28,Está é a fachada do novo hospital da mulher construído pelo governo do estado de SP que fica na #Cracolândia. Por causa dele os nóias da Cracolândia foram expulsos do território q ocupavam proporcionando cenas de barbárie produzidas pelos agentes de segurança pública estatal https://t.co/Pz1offCejg
86,32411283,1530526128942764034,2022-05-28,Tem de se posicionar!!!! em Cervejaria Central https://t.co/JoefatIx7w
87,550611367,1530517221675610114,2022-05-28,Bora doar sangue gente !!! #doesangue
88,1485704671490625542,1530386731903623170,2022-05-28,"Fechando a sexta com um querido, venha iniciar bem meu sábado?  😘 https://t.co/mgDhDBvk36"
89,22134912,1530360634654838785,2022-05-28,Acabou de publicar uma foto em Sesc 24 de Maio https://t.co/k1c997FKzu
90,2614388485,1530350656619520002,2022-05-28,Quantos 🍪 dariam pra esse foto? #gaylife https://t.co/8zD18MgCNW
91,233166705,1530348188204470272,2022-05-28,Acabou de publicar uma foto em República (distrito de São Paulo) https://t.co/aaYqi3Ted8
92,73503309,1530332852801286145,2022-05-27,SEXTOU!!! @ Brasil https://t.co/e5JcQ7LrcK
93,52058931,1530326115855777792,2022-05-27,"😎 Tease do filme “D’ALMA - O Pacto” que foi lançado agora, nesse instante, internacionalmente. Aproveite por alguns momentos 👇 https://t.co/pnC8kCUPuG"
94,74325248,1530325838285225986,2022-05-27,Resenha pesada hein... em Schettini Luthieria https://t.co/MggUAlX0jd
95,55970374,1530313999333609473,2022-05-27,Acabou de publicar uma foto em Santa Cecília https://t.co/4GQGKVsv5y
96,34123254,1530310835096231936,2022-05-27,Bora beber cambada https://t.co/15rztWjWan
97,1304509993358708739,1530309963444363265,2022-05-27,"#DeputadoFedederalAbouAnni #TransporteEscolarSP  #DêaPreferência 
#SemprecomVocê em Gabinete Deputado Federal Abou Anni https://t.co/ZUBJ2nHLky"
98,45940626,1530309820405932032,2022-05-27,SEXTOU!!! https://t.co/eFroLwnobJ
99,1304509993358708739,1530294906790592512,2022-05-27,Acabou de publicar uma foto em Gabinete Deputado Federal Abou Anni https://t.co/mYBIESWYgF
100,137547006,1530269737258721284,2022-05-27,"I'm at Cervejaria Dogma in São Paulo, SP https://t.co/qjGjwPekMX"
101,23579118,1530244871268835329,2022-05-27,Acabou de publicar uma foto em Smart Fit https://t.co/EHusplcCMY
102,768878510249275392,1530244490300112896,2022-05-27,Acabou de publicar uma foto em Galeria do Rock https://t.co/lBac5q7rns
103,1347077785,1530232352961662977,2022-05-27,EBAAAAAAAAAA ❤️❤️❤️❤️❤️❤️❤️❤️❤️❤️❤️❤️❤️❤️❤️❤️❤️❤️❤️❤️ https://t.co/maEgNm8yKf
104,1347077785,1530232232329285632,2022-05-27,🙏🙏🙏 https://t.co/yLLJNsAXnM
105,2177060390,1530222721489149952,2022-05-27,Acabou de publicar uma foto em São Paulo SP Brasil 011 https://t.co/cruNuwzHC2
106,1260458882335465472,1530216448085434368,2022-05-27,Acabou de publicar uma foto em Brasil https://t.co/qFIHQZyrlL
107,2347607418,1530199186729320449,2022-05-27,"Neste fds acontece a Virada Cultural de SP. O Ponto Chic do Paissandu ficará aberto toda a madrugada e o domingo. 
Aproveite e venha provar o Famoso Bauru, sanduíche Patrimônio Cultural e Imaterial de São Paulo!
Largo do Paissandu, 27
#PontoChic100anos 
#ViradaCultural2022 https://t.co/f7xh9S9Dxk"
108,1613027815,1530195013694537729,2022-05-27,"Adquirir Plano de Saúde e Odontológico simplesmente pelo item Preço não é recomendável de forma alguma.

Preço quando se trata de Plano de Saúde e Odontológico tem muitas variantes as quais Você precisa saber dos detalhes.

Estamos aguardando o seu contato para lhe esclarecer! https://t.co/u7L1Lx3Uu8"
109,1254978737281683456,1530193393099612160,2022-05-27,"Vem Brinca con pae crl #Sextouu
🎵🎶senta senta no bugalu !!
 #PINTOAWARD #PINTOSAWARDS   #PENTELHUDO #BRODERAGEM #MLK SÓ SIGILAO HAHAHAH🤫😈 #SIGILO #MACHOXMACHO  #SPCENTRO #ativodotado
#novinhodopirocao
📍🆑️😈🤫🍆 22cm
SÓ MLKAO PASSIVO CHAMA!!
DM📩LIBERADA✔ https://t.co/6dvO4HLZbu"
110,1347077785,1530184012114927618,2022-05-27,@beltraomaria @AndreiaSadi @octavio_guedes Tem que ter a @NatuzaNery na despedida também! Não estou preparado pra esse momento 😰😰😰💔💔💔💔
111,16631711,1530173001832050689,2022-05-27,"Você não pode deixar de usar a criatividade. Quanto mais você usa, mais você tem.

Foto de um dia qualquer. em Rua Dom José De Barros - Republica https://t.co/yU43YR5eWq"
112,1448969742367268879,1530169929135169538,2022-05-27,Acabou de publicar uma foto em Campos Elísios (bairro de São Paulo) https://t.co/vrITGcCJxr
113,78099686,1530125220320780288,2022-05-27,Acabou de publicar uma foto em Theatro Municipal de São Paulo https://t.co/jVK2PVI4LS
114,78099686,1530125098274852864,2022-05-27,Acabou de publicar uma foto em Theatro Municipal de São Paulo https://t.co/L8mVRsJrAG
115,78099686,1530125040405995520,2022-05-27,Acabou de publicar uma foto em Theatro Municipal de São Paulo https://t.co/RmlsykSTf6
116,78099686,1530124974459129857,2022-05-27,Acabou de publicar uma foto em Theatro Municipal de São Paulo https://t.co/7TUzg6Qz67
117,78099686,1530124908180566016,2022-05-27,Acabou de publicar uma foto em Theatro Municipal de São Paulo https://t.co/mfLfwEJcHW
118,78099686,1530124853059141634,2022-05-27,Acabou de publicar uma foto em Theatro Municipal de São Paulo https://t.co/mKdzNCl5rq
119,78099686,1530124770682867712,2022-05-27,#contramemoria em Theatro Municipal de São Paulo https://t.co/uxBhUpaFca
120,78099686,1530124642756722688,2022-05-27,Acabou de publicar uma foto em Theatro Municipal de São Paulo https://t.co/Daeir0JTP8
121,78099686,1530124552495415296,2022-05-27,Acabou de publicar uma foto em Theatro Municipal de São Paulo https://t.co/6rEH3kdnRR
122,78099686,1530124418864889857,2022-05-27,Acabou de publicar uma foto em Theatro Municipal de São Paulo https://t.co/iWESb2mYVu
123,78099686,1530124216434970624,2022-05-27,Acabou de publicar uma foto em Theatro Municipal de São Paulo https://t.co/1XTpS3h3NQ
124,78099686,1530123906979205121,2022-05-27,Acabou de publicar uma foto em Theatro Municipal de São Paulo https://t.co/tC731tt4aZ
125,936496012453171201,1530081038881505282,2022-05-27,Esse Naldinho é muito sem limite 👀
126,438473416,1530004374394634261,2022-05-27,Domingo é na @saravaafestasp em Espaço Muss https://t.co/rV9hhtWrw3
127,39788592,1529996727608127488,2022-05-27,Acabou de publicar uma foto em Brasil https://t.co/BXpA7evRVQ
128,55970374,1529989148307869699,2022-05-27,Acabou de publicar uma foto em Santa Cecília https://t.co/10CwOz1J9j
129,1391818601888354307,1529984249146888194,2022-05-27,daddy and son? Paizão e filhote? https://t.co/buXpfMQpTH
130,73503309,1529983884468920320,2022-05-27,Just posted a photo @ Brasil https://t.co/DenLZ9kjZ4
131,1238288915083210752,1529983845638062082,2022-05-27,daddy and son? Paizão e filhote? Boa noite do daddy poc. https://t.co/drkWpFJiaB
132,70753923,1529979960907145216,2022-05-27,#TBT 📍 em Térreo Bar https://t.co/lE5bbiN1S6
133,908072845443567616,1529959710153138178,2022-05-26,"Brainstrom, a estreia.

Hoje, às 22h, alí no Boteco Pratododia, eu faço o set de abertura do baile.
E lá vou estar ao lado de ninguém menos que @djnyack e @DevinJMorrison.

Entrada R$25 a noite toda, fechou?
Cheguem cedo, casa sujeito a lotação.

💜 https://t.co/6CDPgv7uH7"
134,1417510425713852416,1529957399616008197,2022-05-26,E aí essa dica te ajudou? Então marque os amigos para eles também pegarem a dica! #educação #aulaparticular #vestibular #ENEM #aprendizagem #professorparticular #dicas #geografia #dicasdegeografia em Brasil https://t.co/I509nQE9cw
135,291876364,1529947044550524963,2022-05-26,—— you know you go broke tryna handle me 🫧🫥 em Elevado João Goulart - Minhocão https://t.co/QKuFMfHM9u
136,1420869957609574401,1529936832376586247,2022-05-26,Privatizar nossas empresas públicas não vai diminuir o preço da gasolina nem resolver os problemas do Brasil. É preciso parar de mentir para o povo. #LulaNoPrimeiroTurno #Lula13Presidente https://t.co/xoNNu6jRkl
137,1420869957609574401,1529935399421984775,2022-05-26,"O professor vai dar aula de gestão!

Quem concorda, curte, comenta e compartilha 🔁

#TôComHaddad #TôComOProfessor #MudaSP https://t.co/vsIsgaH6wg"
138,1420869957609574401,1529934555821486081,2022-05-26,"O professor vai dar aula de gestão!

Quem concorda, curte, comenta e compartilha 🔁

#TôComHaddad #TôComOProfessor #MudaSP https://t.co/g5F9L4O5GJ"
139,765913081088241664,1529922840325128193,2022-05-26,"Bachata libre!
Confira um pouquinho da demostração de passinhos pós aula do Prof. Lucas Moura e Tania Ferreira.
Venha conhecer o nosso evento latino!
Nos siga nas nossas redes sociais @bachatalibre em Casa Da Música https://t.co/D6pmhxUYZd"
140,24307707,1529915054543491093,2022-05-26,"sobre a sorte de morar ao lado do lugar favorito, a excelência desse kokrete de ossobuco com jalapeño @pepperyourmind e a imensa saudade que eu tava de uma boa sopa de cebola… em Conceição Discos &amp; Comes https://t.co/fndoD76AwG"
141,20743783,1529912253713109003,2022-05-26,Largo do Arouche. https://t.co/C91xutib3D
142,82940542,1529903993572446225,2022-05-26,👊🏾🙏🏾😝 em RCampos com Você https://t.co/zx9DcbRhHy
143,920597438439804928,1529858416591654915,2022-05-26,Acabou de publicar uma foto em Prato Grego https://t.co/wAF9PAFfCS
144,57017730,1529858042455543809,2022-05-26,"Sempre um prazer trabalhar com nossos parceiros que mandam super bem!!
@carlosvicentefotoevideo @wfernandeseventos

Contando com essa equipe ainda melhor.. 
@visivolocacao
@miguelaraujox
@fe_rsouza https://t.co/YnYY3VABZB"
145,194233318,1529850734216364032,2022-05-26,"Arrozinho de ossobuco com abóbora 😋

E a melhor torta de frango da vida! https://t.co/jDkfubrTMq"
146,1105557560084623360,1529834154107588608,2022-05-26,por me ajudar ? não ! https://t.co/OUPpS98pnW
147,233592511,1529833047599636480,2022-05-26,"Eu amo Jerusalém, a cidade do Grande Rei.
#tbt bem recente de uma viagem inesquecível. em São Paulo - A Cidade Que Não Para! https://t.co/jQRnCoPA1Y"
148,3332801477,1529824887837061122,2022-05-26,"Sábado, 28/5 - 19h @ccsp_oficial https://t.co/Se1mI00p1N"
149,521503771,1529818530417217539,2022-05-26,Acabou de publicar uma foto em MAQFIOS social https://t.co/F0quecaUca
150,17230271,1529817448970702848,2022-05-26,"Bom dia com Nelson Leirner e seu ""Cubo de Dados"", 1970. em Brasil https://t.co/7WthokpBxu"
151,1460081320630140932,1529811411727179778,2022-05-26,"#Beliebers atenção Festa do #JustinBieber em SP 
  aquecimento pro #rockinrio2022 #Bieber  #BelieberExperience  

Ingresso antecipado: 
https://t.co/m4hZ5CEn0A https://t.co/HujYcLZT1V"
152,17110057,1529794690362613760,2022-05-26,"No #tbt de hoje, tal qual @exudoblues pedindo desculpas à Jay-Z, eu peço desculpas ao @criolomc, porque ""Existe amor em SP"". em Tokyo 東 京 https://t.co/yzkX8OxwNm"
153,1510339063064285185,1529793662187610112,2022-05-26,Bom dia são Paulo
154,79717192,1529687177168179200,2022-05-26,matando saudades.... em Santa Cecília https://t.co/l6hQkQcua6
155,2965095953,1529658356117348353,2022-05-26,Acabou de publicar uma foto em Galeria do Rock https://t.co/WEjlbX2fPS
156,200843297,1529644139415015424,2022-05-26,Just posted a photo @ LEVIATÃ https://t.co/m7615RZzq6
157,256560116,1529618837410291719,2022-05-26,"Não se esconda atrás de arrependimentos
Apenas ame a si mesma e você estará bem
Eu estou no caminho certo, querido
Eu nasci assim!!!!!

#bornthisway #sejavoce #mudancassaonecessarias #naotenhamedodasmudanças https://t.co/CrpPjEXAwN"
158,100227419,1529609144893849600,2022-05-25,Acaba de publicar una foto en A Casa do Porco Bar https://t.co/G15ZPEVbTZ
159,233166705,1529608699140005888,2022-05-25,https://t.co/GKTh5NaCRo
160,60721389,1529595401405444097,2022-05-25,Varando a janela em Minhocão - Esparrama Pela Janela https://t.co/VHMJIKRbM2
161,52467327,1529588354525839360,2022-05-25,"Acabou de publicar uma foto em Praça Das Artes, Centro Histórico De São Paulo https://t.co/9YQb80zDEC"
162,143443643,1529568330272620548,2022-05-25,Acabou de publicar uma foto em Estação Júlio Prestes https://t.co/dLqEGxcmcB
163,1526240047967649794,1529567765677359105,2022-05-25,🥰 https://t.co/GHCIPwxist
164,1287167909215776774,1529536064213463044,2022-05-25,Acabou de publicar uma foto em Porão da Cerveja https://t.co/rB4huU6MAC
165,107445075,1529520313926660097,2022-05-25,gracias a todos 💗 https://t.co/Nax6VmaODM
166,23067792,1529516328507387904,2022-05-25,"Ô, bichin perfeito! 🐶🥰☀️ em Santa Cecília https://t.co/7C2NWdzPeR"
167,478050507,1529508106358640641,2022-05-25,Acabou de publicar uma foto em San Raphael Hotel https://t.co/XoXaPZWKmR
168,89680261,1529495811599519746,2022-05-25,"Mesa digital TF-5 é na @ninjasom !
#mesasdigitais #yamaha #tf5 #promoções em Ninja Som https://t.co/HJtcunmxb1"
169,114581418,1529479568762908673,2022-05-25,Acabou de publicar uma foto em Rede Resiliência e Consciência https://t.co/jgdKnkDOmX
170,27412034,1529478735052816384,2022-05-25,A energia dessas fotos aqui no @blocoemo vs @quartemo já to com saudade @ Irregular https://t.co/R7hlFtqd9I
171,1181321981469368320,1529463924990566400,2022-05-25,Today was our Day of Stoll by Center From São Paulo 😍🥰😲 https://t.co/mW7ypPw4UW
172,20743783,1529462290206101508,2022-05-25,Teatro Municipal. https://t.co/91RGjz1bJy
173,1417510425713852416,1529455150829535234,2022-05-25,Acabou de publicar uma foto em Brasil https://t.co/8ofFimUQJ0
174,1265649820225753089,1529446804441415680,2022-05-25,"Hei, São Paulo, terra de arranha-céu. https://t.co/OMCIMhB9IQ"
175,17059242,1529445675095756801,2022-05-25,Acabou de publicar uma foto em Theatro Municipal de São Paulo https://t.co/dvnW8nx60f
176,1448969742367268879,1529433434376097797,2022-05-25,Acabou de publicar uma foto em Campos Elísios (bairro de São Paulo) https://t.co/rdXb4iQDf3
