,author_id,tweet_id,created_at,text
177,1020386330101108736,1529409831366545416,2022-05-25,#dontpanic #towel #towelday #nerd #lifestyle #nerdstyle #toalha #diadatoalha #orgulhonerd #nerdpride #nerdprideday #douglasadams #pride #geek #geekpride #geekprideday em Brilho Design https://t.co/wUvQfzzxYy
178,81192305,1529406516972888064,2022-05-25,Acabou de publicar uma foto em Aqui Onde Cruza A Ipiranga Com A Avenida São João https://t.co/tnIDHAjK0x
179,14407123,1529392146649948160,2022-05-25,Bom dia São Paulo! https://t.co/TdBMp2BIzH
180,1522829621120712710,1529353400252522497,2022-05-25,"Siempre dar una brincó a donde nadie más pueda llegar en República, São Paulo https://t.co/PY3Eabo3JE"
181,170798680,1529282813320695813,2022-05-25,Acabou de publicar uma foto em Araujo Santos Advocacia https://t.co/31T6DHeybS
182,76481710,1529257509260627969,2022-05-25,Acabou de publicar uma foto em Hey Hey Club &amp; Eventos https://t.co/1C3mIDZdrN
183,143126709,1529252340880052224,2022-05-25,Acabou de publicar uma foto em Brasil https://t.co/VldCFy21Jj
184,1417510425713852416,1529246831158476800,2022-05-24,Devemos investir cada vez mais em educação e instruir nossos jovens na busca de seus sonhos. 📚 #aprendizagem #cursinho #educação #vestibular #diadovestibulando #frases #motivação em Brasil https://t.co/RQ4rR64gf7
185,17626269,1529219391203983362,2022-05-24,"big bang theory rodando non stop cobertorzin cheroso, janela aberta e no aguardo das flores. folguinha perfeitinha, cabecinha tranquilinha"
186,482978541,1529219059597709312,2022-05-24,Exposição Contramemória em Teatro Municipal https://t.co/PEGPXH34dY
187,16339549,1529196171138301960,2022-05-24,"Voltei pra SP e tenho novos vizinhos… a Cracolândia 😑 (@ Santa Cecília - @sp_prefeitura in São Paulo, SP) https://t.co/8rHBtSJfgV"
188,26612847,1529177333726269440,2022-05-24,"Várias, mensagens subliminares. em Beer4U Higienópolis https://t.co/1dJPV3BT9V"
189,23579118,1529175341830492161,2022-05-24,Acabou de publicar uma foto em Smart Fit https://t.co/iTYZ5PjxQd
190,190312750,1529174048877445120,2022-05-24,Acabou de publicar uma foto em Arena De Lutas SP https://t.co/YRXiigualS
191,1105557560084623360,1529162074252771328,2022-05-24,Eu quero o melhor 😻😻 @McDonalds_BR https://t.co/6nNiXJXs8q
192,282198621,1529145811409461248,2022-05-24,Acabou de publicar uma foto em Campos Elísios (bairro de São Paulo) https://t.co/mHrXUt8AyW
193,1065964061010141184,1529137426161082371,2022-05-24,Acabou de publicar uma foto em Praça Do Ciclista - Avenida Paulista https://t.co/sIVZzEsOfx
194,135363695,1529134709015453696,2022-05-24,@UOLNoticias https://t.co/ziRKHVj4dU
195,1448969742367268879,1529121994351865856,2022-05-24,Acabou de publicar uma foto em Campos Elísios (bairro de São Paulo) https://t.co/x6AQwvObc5
196,17230271,1529117134625857536,2022-05-24,"Boa tarde com ""Nu Azul II"", de Henri Matisse, 1952. em Brasil https://t.co/QrrrjJBCPB"
197,214292151,1529117042447683584,2022-05-24,"E sempre quando vc precisar estaremos aqui para te dar o suporte!!
@fab_oficial 
#PeloBrasil
#doesangue em Hemocentro Santa Casa https://t.co/Y6z8r99NQ4"
198,1420869957609574401,1529109433422434306,2022-05-24,"Duque de Caxias se foi com o povo da praça.
#caracolandia https://t.co/M6I61wtMWH"
199,768878510249275392,1529104955298267136,2022-05-24,Acabou de publicar uma foto em Galeria do Rock https://t.co/GorbkVb1JZ
200,768878510249275392,1529103164498141184,2022-05-24,Acabou de publicar uma foto em Galeria do Rock https://t.co/mlCfntGVcW
201,251109370,1529101725705162752,2022-05-24,Acabou de publicar uma foto em TEND TUDO BROTHERS https://t.co/ahlRwVtWaM
