,author_id,tweet_id,created_at,text
0,95433357,1548818162526826496,2022-07-17,"Correu 8,15 quilômetros com Nike⁠ Run Club #JustDoIt…retomando meu minhas atividades esportivas visando calendário de corridas 🏃🏿 do próximo ano. em São Paulo - A Cidade Que Não Para! https://t.co/EFkN4yKYzU"
1,16894066,1548808181333254145,2022-07-17,Just posted a photo @ Minhocão https://t.co/n4GXLTIN9p
2,76481710,1548804710362128384,2022-07-17,Acabou de publicar uma foto em Hey Hey Club &amp; Eventos https://t.co/cqqqjuT7PN
3,21415271,1548799674055725056,2022-07-17,"I'm at Petz in São Paulo, SP https://t.co/BmsQgPWoJd"
4,99602134,1548793720287498242,2022-07-17,Late night talking em Tokyo 東 京 https://t.co/nufZOh15LY
5,1274917361489973262,1548761559706603526,2022-07-17,"✅ 12km
✅ 100% da planilha da semana cumprida
✅ 100% da pesquisa do mestrado da semana cumprida 

Bora para mais uma semana!! 🙌🙌🙌

#pacebobby #clubeingadecorrida #maniadecorrida em Minhocão https://t.co/KbOtarEfYR"
6,1528842277153538049,1548747717962252290,2022-07-17,Acabou de publicar um vídeo em Espaço Gisele Ferreira https://t.co/r4vWODjkya
7,233166705,1548734964270862343,2022-07-17,"Acabou de publicar uma foto em República, São Paulo https://t.co/yqyOgM2USl"
8,15165399,1548732689745952769,2022-07-17,Acabou de publicar uma foto em Minhocão https://t.co/AWVJ76pOwW
9,15165399,1548732293400903681,2022-07-17,uma das janelas do Minhocão: @studio750 — queria trampar nesse lugar! em Minhocão https://t.co/5cyntuWshs
10,15735007,1548705729766313985,2022-07-17,"78 anos do Capo di Tutti Capi! Auguri, Babbo! 🍷🎂

#auguri #pai #aniversario #compleanno em Jardim de Napoli https://t.co/VR7Z6cMHzB"
11,15165399,1548701717352648704,2022-07-17,nós 2… em Minhocão https://t.co/QCwoOtDpOa
12,78099686,1548697319524077570,2022-07-17,A praia de Sampa … nem aí  amo 💪💕💕🏃 em Minhocão https://t.co/KnowQJHd7M
13,78099686,1548697031551528960,2022-07-17,Acabou de publicar uma foto em Minhocão https://t.co/Mk4z3UfE5w
14,78099686,1548696945341890563,2022-07-17,Acabou de publicar uma foto em Minhocão https://t.co/uLvBMWy2C9
15,15165399,1548694743319822338,2022-07-17,#domingo em Minhocão https://t.co/RajLad5eKX
16,25042231,1548684484874207233,2022-07-17,"Acabou de publicar uma foto em Complexo Cultural Funarte, Santa Cecília, São Paulo https://t.co/GTbwbXpdWE"
17,501339977,1548679653149364224,2022-07-17,@pavarini na área #peaceBwU
18,15430166,1548641845479178240,2022-07-17,I'm at Parque Minhocão in São Paulo https://t.co/iHQmSO5iDr https://t.co/xhtKOODBlI
19,76481710,1548624536769290240,2022-07-17,Acabou de publicar uma foto em Blue Space https://t.co/n40B3TlIIi
20,2765176287,1548598170145280000,2022-07-17,Just posted a photo @ Elevado João Goulart - Minhocão https://t.co/Bp5dt9SUtT
21,1372435235632246786,1548584826848034816,2022-07-17,Bora apagar o fogo no cu... https://t.co/ERhCo3ztn4
22,1500160402897973252,1548503779359698946,2022-07-17,"Chegamos... Ja estamos aqui eu, @paulaopowerofc e @recatadodobar 
bora curtir conosco?
Milk em Dobro na @upgradesxclub 
Produção @rohcamillo https://t.co/82qjtujpPE"
23,1011751272,1548476639251537924,2022-07-17,"hoje realizei um dos meus sonhos, ver um concerto e logo na sala são paulo

kamisama muito obrigada❤️consegui sentir minha alma vibrar 
foi o mais próximo que toquei da minha tia e do meu avô https://t.co/dFzkKhc6T7"
24,74835944,1548469496632856577,2022-07-17,Acabou de publicar uma foto em Espaço Zero 11 https://t.co/OZoCMJt5WS
25,21232907,1548467022350000130,2022-07-17,#ccxpawards | @ccxpawards | #sneakers @ Sala São Paulo https://t.co/mpU5HzGcRs
26,52560164,1548459195778752517,2022-07-17,🤔 https://t.co/T5vQYnXNmI
27,1307682617807036416,1548452167232528384,2022-07-16,Boa noite 😈🌹 https://t.co/FLaOI8qdDl
28,1254804437580857345,1548444573814235136,2022-07-16,"De ontem na sauna gay com vários 
dotados em vídeos, que gravei ontem.

That night I recorded many videos, with many healed of huge dicks.

⚠️Onlyfans 60%Off https://t.co/KlEVdEbqEz

⚠️onnowplay 29,90😱 https://t.co/8WCxwKw1Nn

⚠️ justforfans https://t.co/uuzTZM0hoM

RT🙏 https://t.co/jnVF8x5UDh"
29,67895112,1548435996391313408,2022-07-16,Peça de hoje : A vela quando o preconceito mora em casa . #teatrouol  . O teatro sempre me acalma ❤️❤️ https://t.co/nK5QCfUuIS
30,104311824,1548431142004477953,2022-07-16,I'm at Dali Daqui in São Paulo https://t.co/dHna9K8zvl
31,233166705,1548430048150966274,2022-07-16,"Acabou de publicar uma foto em República, São Paulo https://t.co/d1YJOzY0z1"
32,427046764,1548420196271984641,2022-07-16,"Eu amo vocês, assim sem vírgulas, sem espaço e sem ponto final. 💜 em Santa Isabel,sp https://t.co/p244gMQ7Rn"
33,76481710,1548419278549839873,2022-07-16,Acabou de publicar uma foto em Blue Space https://t.co/EQKPQm488x
34,942619364,1548396067103813638,2022-07-16,@gerarodrigues muito obrigado pelo convite!!! Amamos❤️💕 @playbeckett é incrivelmente intrigante e nos fez pensar e conversar muito!!!! Obrigado! #playbeckett em Aliança Francesa - Unidade Centro https://t.co/0LqiqpBrHX
35,130642509,1548366383649415168,2022-07-16,Acabou de publicar uma foto em Sala São Paulo https://t.co/HdEQtBWPdL
36,245975911,1548353435048628226,2022-07-16,"Ganhei meu dia! Abraçar @lifebylufe pessoalmente é inexplicável. Obrigada, Lufe. Por tudo! 🌀🌀🌀❤️❤️❤️ em Santa Cecília - Sp Capital https://t.co/8iNPHdO2Hv"
37,146918505,1548339382595121153,2022-07-16,#Atriz 🎭 #Professora 👩@teatroescolaria em Teatro-Escola RIA https://t.co/7j3w7cB6BD
38,1528842277153538049,1548332859684900864,2022-07-16,Acabou de publicar uma foto em Espaço Gisele Ferreira https://t.co/DHq3AIQX4I
39,1528842277153538049,1548332059021549568,2022-07-16,Acabou de publicar uma foto em Espaço Gisele Ferreira https://t.co/Iwd04qCfl0
40,1254448955607392256,1548318720228937730,2022-07-16,Acabou de publicar uma foto em Brasil https://t.co/D95AOyrGV2
41,53371678,1548311451298717700,2022-07-16,"Está chegando aí em sua cidade @decentesdoforro seu #Backdrop mais um trabalho concluído com sucesso! 

#decentesdoforró #ToNaMidiaDivulga #ToNaMidia #deusnocomando #ParceriaContinua em TÔ NA MIDIA https://t.co/bLfGNBX0V4"
42,245975911,1548306752482922507,2022-07-16,Tudo pronto aqui na @feiradascecilias no belíssimo @casarao_barao_de_tatui! ✂️❤️😉 em Santa Cecília - Sp Capital https://t.co/rGbPIcg9ch
43,64580805,1548291389695266817,2022-07-16,Ilusões de Imagem - Hoje às 16h https://t.co/1YgytZNw7v
44,55970374,1548277305952256003,2022-07-16,Acabou de publicar uma foto em Santa Cecília https://t.co/GnVJqVtE3q
45,52095465,1548275968107692038,2022-07-16,"I'm at @GaleriadoRock in São Paulo, SP https://t.co/gnI0V430JP"
46,438473416,1548271143483613187,2022-07-16,Acabou de publicar uma foto em Frigideira Grill Dom José de Barros https://t.co/EEXlFCRaSv
47,438473416,1548262604811804674,2022-07-16,Acabou de publicar uma foto em Frigideira Grill Dom José de Barros https://t.co/o8Fudus2Ly
48,438473416,1548262512864346114,2022-07-16,Acabou de publicar uma foto em Frigideira Grill Dom José de Barros https://t.co/hqe6Ecxe0k
49,438473416,1548262364297826305,2022-07-16,Acabou de publicar uma foto em Frigideira Grill Dom José de Barros https://t.co/Oae8aJl97M
50,438473416,1548262177504518144,2022-07-16,Acabou de publicar uma foto em Frigideira Grill Dom José de Barros https://t.co/PWa8M9AdED
51,1354041908243419143,1548227841598169097,2022-07-16,"Aquele evento de respeito. 🤛
#CCXPAwards 

Alguma nerd assistiu as transmissões ao vivo da premiação? https://t.co/ZvJi9r0JmA"
52,1524206615913771009,1548198649057779717,2022-07-16,Existe amor em SP?!?!?!?! https://t.co/IiqEGXn0Cu
53,1254804437580857345,1548191046680449024,2022-07-16,"ESTOU AGORA NA SAUNA! 
Corre no Onlyfans e onnowplay que tem muito conteúdo pra você diretamente daqui😈👅

I'M IN THE SAUNA NOW! Run on Onlyfans and Justforfans that has a lot of content for you directly from here😈👅

https://t.co/KlEVdEbqEz

https://t.co/8WCxwKw1Nn

RT🙏 https://t.co/UGXqWQEWgv"
54,774469015,1548154317122576385,2022-07-16,"Dreaming big 😎
📍THEATRO MUNICIPAL - REPÚBLICA SÃO PAULO BRASIL

#maisumnomundo #saopaulo #brasil #theatre #teatromunicipal #showtime #artistico #historicalbuildings #instagram em Theatro Municipal de São Paulo https://t.co/NNq5KuocAN"
55,956199676579020805,1548149468360413184,2022-07-16,Baguncinha gostosa ❤️ https://t.co/O1STXjE8kI
56,1547676697952079873,1548141245683212291,2022-07-16,❤️‍🔥 https://t.co/iXmc5vRo20
57,201580498,1548129723191947265,2022-07-16,Just posted a photo @ Sesc 24 de Maio https://t.co/bvOFbZs3Au
58,53501679,1548123612065832965,2022-07-16,GANHAMO o prêmio de melhor podcast na CCXP AWARDS! @Podpah 💛🖤 https://t.co/jr5SHUdNvG
59,895399550067912704,1548115539939115009,2022-07-16,"ATENÇÃO🚨
Obrigada pela atenção #CCXPAwards https://t.co/nX3klB8Yvd"
60,73503309,1548114073908154370,2022-07-16,só pra dizer que eu tô com saudade @camilacolombo @ Brasil https://t.co/iFLPzATCsd
61,79282891,1548108021670154243,2022-07-16,"Dia de @ccxpawards, e ainda fui jurada na categoria séries (chique demais). Espero que meu #look seja top nesse #redcarpet 😛 #ccxpawards em Sala São Paulo https://t.co/GbpP17EElW"
62,971378756702167040,1548103149621194755,2022-07-16,Acabou de publicar uma foto em Campos Elísios (bairro de São Paulo) https://t.co/qpk5vo3Tbi
63,59038937,1548093670804426755,2022-07-15,"Esse é raridade...
#Sextou irmão 👊 em Van Grogh Praça Bar https://t.co/IEAiqfUpcw"
64,8535022,1548074020209250304,2022-07-15,"#CCXPAWARDS (@ Sala São Paulo in São Paulo, SP) https://t.co/geaN0kkBO5"
65,55970374,1548068995391115267,2022-07-15,Acabou de publicar uma foto em Santa Cecília https://t.co/IwxBGCuNb1
66,182038489,1548064112730443781,2022-07-15,"Meu vestido vermelho carmim
Te deixou galudão em Arouche https://t.co/zrcyQAEz2x"
67,36417316,1548061764226408451,2022-07-15,Final de semana ainda bem! em Van Grogh Praça Bar https://t.co/dvt3PCcNyK
68,4280297357,1548058745711669249,2022-07-15,https://t.co/GcE0zuYIMB
69,1326946766583951360,1548055617079693315,2022-07-15,"Sextou já gente ??? 🔥
Então vem me visitar 
  
@RuivoMedieval @jefersonsousajk https://t.co/RGt3cKFRbb"
70,201580498,1548050598506795008,2022-07-15,O cair da tarde no Centro de SP… @ Sesc 24 de Maio https://t.co/rL57kZrxsc
71,86733176,1548036006817189888,2022-07-15,Acabou de publicar uma foto em Galeria do Rock https://t.co/DHWseZmmM1
72,427046764,1548004915959607298,2022-07-15,"As melhores loucuras sao com vcs e por vcs ❤️ em Santa Isabel,sp https://t.co/9nO1RGh7Hu"
73,191723258,1548000934885609475,2022-07-15,Acabou de publicar uma foto em Setin Downtown Nova República https://t.co/hILIQMbqEi
74,62842687,1547978514665680898,2022-07-15,"I'm at @GaleriadoRock in São Paulo, SP https://t.co/mTZcFPYbDj"
75,1347077785,1547974435356889089,2022-07-15,"@vandersouza_1 @forumeplay O principal estúdio da GNews no Rio precisa muito de uma reforma. Tá horrível, só remendos de placa de madeira @GloboNews"
76,2669395046,1547972883166535682,2022-07-15,#congresso #fenafarcongresso #farmacêutico #saúde #sindifarma #farmácia em Federação Nacional dos Farmacêuticos https://t.co/HJTUkSiS1p
77,438473416,1547968644268756997,2022-07-15,"É hoje!!!
Sexta feira no @frigideiragrilleventos !!
Vem todo Mundo 🌎 🌎 
#sextanocentro  #sextou🔥 #gruposambaentreamigos em Frigideira Grill Dom José de Barros https://t.co/hOwWingWZC"
78,438473416,1547967396383559683,2022-07-15,"É hoje!!!
Sexta feira no @frigideiragrilleventos !!
Vem todo Mundo 🌎 🌎 
#sextanocentro  #sextou🔥 #gruposambaentreamigos em Frigideira Grill Dom José de Barros https://t.co/SIWPLfgsqz"
79,1347077785,1547966200415600642,2022-07-15,"Eu gostei bastante da serie quando vi no globoplay, mas jamais imaginaria esse fenômeno na tv aberta https://t.co/WrZLmKv9Og"
80,1347077785,1547966066919219201,2022-07-15,Consumidores do biscoito de leite maltado da @piraqueoficial: você tbm acham que o sabor dele mudou de uns 2 anos pra cá? Ele está parecendo mais amargo e menos doce
81,1445743452004618245,1547954109721899008,2022-07-15,Acabou de publicar uma foto em Central Caos https://t.co/2WFi2FZT4n
82,82206849,1547941964129005576,2022-07-15,Anxiety is a terrible thing to feel em Vila Buarque https://t.co/sgN6OnN0MG
83,16631711,1547904062225494016,2022-07-15,"Você vai descobrir mais cedo ou mais tarde que o tempo pra ser feliz é curto, e cada instante que vai embora não volta mais. em Theatro Municipal de São Paulo https://t.co/A4VPLZHE71"
84,1528842277153538049,1547901919468785664,2022-07-15,Acabou de publicar uma foto em Espaço Gisele Ferreira https://t.co/NBAtXCuZgT
85,86137639,1547795919902425088,2022-07-15,Acabou de publicar uma foto em Theatro Municipal de São Paulo https://t.co/oPng69LvKb
86,64810427,1547776290203111426,2022-07-15,Acabou de publicar uma foto em Catedral da Sé - São Paulo https://t.co/hg1cePpkCw
87,1284477620168658945,1547741685056032772,2022-07-15,Um dia eu meto o rosto aqui… @dedalosbar hj https://t.co/tg2spldgRD
88,76481710,1547741209426219008,2022-07-15,Acabou de publicar uma foto em Hey Hey Club &amp; Eventos https://t.co/jbFvhlmCip
89,2214807172,1547740960582340609,2022-07-15,Que coisa maravilhosa é ver Claudia Abreu encenando  a vida e a obra de Virginia Woolf. Que trabalho lindo ❤️👏🏿@sesc24demaio https://t.co/ZDbRepPlPD
90,985647642574229505,1547739194973249543,2022-07-15,postando aq pq amei essa foto https://t.co/bJSP9c18LZ
91,46890707,1547738963460296706,2022-07-15,I'm at Shari Sushi in São Paulo https://t.co/XiRf77zZly
92,8205502,1547730985067823104,2022-07-14,Acabou de publicar uma foto em Bom Retiro https://t.co/2lecDuxcgq
93,67092014,1547729110687838210,2022-07-14,"5 meses de muita gostosura!

Te amo filhote, obrigado por me ensinar tanto!

Ps: amo, amo você ❤️🥰 em Santa Cecília https://t.co/ZXOWVE5jp6"
94,1456967893942509574,1547717561822810121,2022-07-14,"Ingressos na mão,bora correr pra ver o jogo🤩⚽️🔥 #cypresshill https://t.co/QdjohmcN61"
95,27008217,1547714672932970499,2022-07-14,"Além do arame farpado estilo campo de prisioneiros, o que me marcou nesta foto é na verdade o que não apareceu nela: um homem de barba grisalha, diante do estacionamento deste supermercado ao lado, com um cartaz pedindo por comida. https://t.co/Qq70MCqHlU"
96,27008217,1547713939663769600,2022-07-14,"Nesta manhã eu estava passando pela Av. Angélica quando eu quis fotografar este casarão que fica diante dum ponto de ônibus. Apesar do rolo de arame farpado, milagrosamente está de pé e sem maiores alterações. Não sei se é tombado pelo patrimônio histórico. https://t.co/b6TvcMSfMG"
97,1423871670914330624,1547713058914439169,2022-07-14,Gay do sec 21 morando só… to criando até amizade com os vizinhos.. https://t.co/a3VqU7eXtv
98,848205260451696641,1547673976456941570,2022-07-14,Iniciando a quinta-feira com café da manhã na @fabriquepaes #fabriquepaes #ricardoalexandreadvogados #raadvogados em Fabrique Pães &amp; Café https://t.co/DNHnpOnBED
99,55970374,1547660770040635396,2022-07-14,Acabou de publicar uma foto em Santa Cecília https://t.co/QZsRbZrpXf
100,2236651340,1547659147981647873,2022-07-14,Acabou de publicar uma foto em Brasil https://t.co/f0eNL9fCQ4
101,233166705,1547616666799943686,2022-07-14,Não precisamos falar mais nada. em República (distrito de São Paulo) https://t.co/KkH5gEWTyw
102,224648416,1547614696382930945,2022-07-14,O sabor do bauru é inconfundível! em Ponto Chic https://t.co/lioMdZGXyb
103,224648416,1547613815738576896,2022-07-14,Experimentando o bauru! em Ponto Chic https://t.co/61ockNviCp
104,224648416,1547613103524679682,2022-07-14,Olha o bauru! em Ponto Chic https://t.co/iV2e5doQJZ
105,224648416,1547612314311921664,2022-07-14,"Casemiro Pinto Neto, o criador do bauru… em Ponto Chic https://t.co/VUmWm3fgp7"
106,224648416,1547610141360500736,2022-07-14,Abrindo os trabalhos! Conhecendo o Ponto Chic… em Ponto Chic https://t.co/7vy7skgXqS
107,15591680,1547605783721811971,2022-07-14,Sempre https://t.co/KaYwucBAJs https://t.co/nIJRCWZxGK
108,114581418,1547597735833923585,2022-07-14,"Bom dia!!! 
A partir deste mês de julho, o benzimento começa a ser feito às quintas feiras!!!!
Venham participar

@fernando_cigano_ 

Tudo fica melhor quando tem verdade vontade e amor. em Rede Resiliência e Consciência https://t.co/UdI90whQ49"
109,41708682,1547595734245003274,2022-07-14,"Inaugurando uma nova Plantã na Sede da ABGLT no Largo do Arouche ao Lado da nossa Queridissima Líder Presidentra  Symmy Larrat, e da  Lua, Nova Colega! Um dia Histórico! Feliz Luta! 💙💜🤍🌈 https://t.co/aHC5RNsso8"
110,21415271,1547591595284762628,2022-07-14,"I'm at Petz in São Paulo, SP https://t.co/lFmWA6P562"
111,1540474363618656256,1547566870940643329,2022-07-14,Acabou de publicar uma foto em Tokyo 東 京 https://t.co/bSfdY28Vlu
112,53520976,1547565382923235330,2022-07-14,"Fotos que meu amor @camillagcb tirou para o @brechominante 🫶🏼🍃 em República, São Paulo https://t.co/4lmM3nG1fc"
113,37571692,1547402332476002305,2022-07-14,Acabou de publicar uma foto em Museu da Energia https://t.co/7OTtLSGJUL
114,8205502,1547396248608673793,2022-07-14,Acabou de publicar uma foto em Conceição Discos &amp; Comes https://t.co/zN8jf6aK12
115,209026290,1547350265371668480,2022-07-13,Acabou de publicar uma foto em Academia Paulista de Letras https://t.co/zM7JT2oNIy
116,20743783,1547342276468277248,2022-07-13,"Praça Buenos Aires, SP. https://t.co/GucGXwCBg6"
117,302741662,1547326633178288130,2022-07-13,Ensaios a todo vapor! Esse fds tem show na @BlueSpaceSP sábado e domingo 💙
118,53554742,1547320151464448001,2022-07-13,"Obrigado, rock'n'roll.

#guitarra
#diamundialdorock 
#diadorock em Associação Cultural Cecília https://t.co/N9db55KNXV"
119,74325248,1547300282454925313,2022-07-13,Acabou de publicar uma foto em Schettini Luthieria https://t.co/vaUhrcrqwJ
120,55970374,1547265509644677120,2022-07-13,Acabou de publicar uma foto em No Meu Atelier https://t.co/pi6yluSONM
121,1486058855268294656,1547247267681341440,2022-07-13,Acabou de publicar uma foto em Praça da República https://t.co/IMjGU4rexL
122,1347077785,1547231011460841475,2022-07-13,@FGlobais1 Picos de 45 quando a protagonista caipira falar que vem para “sumpaulo”
123,1347077785,1547230227037822976,2022-07-13,Podia ter glass studio… https://t.co/RDqX63U5iL
124,164796545,1547217391402246146,2022-07-13,I'm at Jazz Nos Fundos https://t.co/FDhmIv5gZf https://t.co/tJbC9EKkXG
125,164796545,1547217269452947456,2022-07-13,"I'm at Estação Santa Cecília (Metrô) in São Paulo, SP https://t.co/QWEaz0GSmp https://t.co/IJajIkgsKW"
126,164796545,1547217143292432384,2022-07-13,I'm at Nobile Downtown in São Paulo https://t.co/L1XJdfHRlo
127,164796545,1547217086019211265,2022-07-13,"I'm at Slaviero Downtown in São Paulo, SP https://t.co/Eq5GgUin9P https://t.co/lF04T5TFnR"
128,438473416,1547214248086061056,2022-07-13,Acabou de publicar uma foto em Frigideira Grill Dom José de Barros https://t.co/Lun27WI4lX
129,1528842277153538049,1547201968568877056,2022-07-13,Acabou de publicar uma foto em Espaço Gisele Ferreira https://t.co/NMbgFgETgg
130,1542352796430761989,1547190516873396224,2022-07-13,saudades de uma piscininha 😜 https://t.co/8P2ZavI4oq
131,857624090936528898,1547172982405177353,2022-07-13,"Acabou de publicar uma foto em República, São Paulo https://t.co/T5JnRmH6Wu"
132,932900692762808320,1547046939614740482,2022-07-13,Acabou de publicar uma foto em Colégio São Gonçalo https://t.co/MYBF1jGSRP
133,607737998,1547030950281973760,2022-07-13,私を抱きしめてキスして 🇯🇵 em Tokyo 東 京 https://t.co/PcGMe4IZPC
134,76481710,1547026846625275904,2022-07-13,Acabou de publicar uma foto em Blue Space https://t.co/vlfOpTAv8G
135,196743696,1547007990363987968,2022-07-13,Acabou de publicar uma foto em Suna https://t.co/QAQIK465Kp
136,173819903,1547006295303245825,2022-07-12,"Pensa num #Beirute #BentoFreitas #Top e o atendimento sensacional, super recomendo @lanchonete.e.rest.dacidade 
#Show em Lanchonete E Restaurante Da Cidade De Sao Paulo https://t.co/AbDLdGCTCr"
137,340590353,1546988174198640640,2022-07-12,Just posted a photo @ Theatro Municipal de São Paulo https://t.co/QFUqExQBte
138,52058931,1546985772548505600,2022-07-12,https://t.co/zQFpIJvleg
139,3691625422,1546977417268543488,2022-07-12,OS SEGURANÇA NÃO FIZERAM NADAAA @GloboNews @g1 @folha @bbcbrasil https://t.co/9KVFgFmLrT
140,3691625422,1546977294576766978,2022-07-12,CENAS DE RACISMO PLENO SÉCULO 21 NA SESC 24 de MAIO! E A @Sesc @sesc24demaio NÃO FEZ NADAA @QuebrandoOTabu @MidiaNINJA https://t.co/Fqotz7l1jB
141,1347077785,1546971235346776066,2022-07-12,AMEI VEM ÍCONE #TodasAsFlores https://t.co/N6xkuLlz50
142,1347077785,1546970273424998402,2022-07-12,AMEI VEM AI!!!!! #TodasAsFlores https://t.co/BrWH0xXZ2Q
143,1347077785,1546970077139984388,2022-07-12,@Noveleii 🙏
144,109626658,1546950124236148743,2022-07-12,Acabou de publicar uma foto em Brasil https://t.co/2qaBW0lEQo
145,233592511,1546943723770101761,2022-07-12,Esse é preguiçoso. #simba em São Paulo - A Cidade Que Não Para! https://t.co/neBkNRplM0
146,76481710,1546933802420903936,2022-07-12,Acabou de publicar uma foto em Hey Hey Club &amp; Eventos https://t.co/nJ69f0K6k6
147,1347077785,1546928561612890117,2022-07-12,@Noveleii Tomara que seja a Zoé!!! #TodasAsFlores
148,1347077785,1546928311531610115,2022-07-12,@globoplay Pode entrar ZOÉ!!!!!!!  @ReginaCase #TodasAsFlores
149,21415271,1546926823413805058,2022-07-12,"I'm at Centro Clínico NotreDame Intermédica in São Paulo, SP https://t.co/mppiY7LiEm"
150,1390016160918294529,1546925463318106112,2022-07-12,Foto appena pubblicata @ Lago Di Lecco https://t.co/TlDqLVhYSH
151,77233601,1546920942227578880,2022-07-12,""" O caminho para a felicidade está em vivermos o presente. Não volte ao passado, nem fique tentando adivinhar o futuro."" em República, São Paulo https://t.co/yMqBLr2mU8"
152,114581418,1546917114505748487,2022-07-12,Acabou de publicar uma foto em Rede Resiliência e Consciência https://t.co/uyaSzucZ1a
153,21415271,1546890125493342208,2022-07-12,4ª dose! (@ SAE Campos Eliseos in São Paulo) https://t.co/NmIAfFrRv7
154,1161961828219596800,1546881183035826178,2022-07-12,"No mesmo evento será lançado o material educativo, um convite à experimentação de percursos possíveis no espaço expositivo e a continuidade de sua ativação em outros espaços.
Terça-feira, dia 12/07, das 19h às 20h30
Local: Exposição, 5º andar
Entrada Gratuita https://t.co/88k8aocu0e"
155,1161961828219596800,1546881179181371392,2022-07-12,"Acontece hoje o lançamento da publicação que reúne a pesquisa curatorial, com textos, biografias dos artistas e imagens das obras e da exposição ""Raio-que-o-parta: ficções do moderno no Brasil"" no @sesc24demaio: 

https://t.co/sB5aIn3zsn"
156,4331665120,1546879911297695746,2022-07-12,"Registro sob um dia lindo na capital!
— 14/Maio

Img: @nadi.ne
✲! em Terra da Garoa https://t.co/gb4Zc8BTn0"
157,282731659,1546878060074508291,2022-07-12,Drinking a Madalena Premium Lager by Cervejaria Premium Paulista @ Busger Higienópolis — https://t.co/2fUYF483HF
158,1347077785,1546877345084104704,2022-07-12,"Espero muito que em 26 ou talvez 32 ela possa ter chances de ir a um 2º turno!!! Votaria com prazer nela. Infelizmente, hoje, não dá não https://t.co/K6oxIK5FTJ"
159,1522691205410308096,1546864859924635657,2022-07-12,"Sentado no banco de concreto no meio da Santa Casa. Marcello aparece e bibicua dizendo não entender o ser/espécie humana, dou uma risada sem graça, ele vira o rosto e bate asa rumo ao ponto de ônibus. Penso, Esse seria, talvez, o famoso ""um passarinho me contou""? #SantoPássaro https://t.co/BCJS7Gjyqi"
160,28356964,1546832608662851587,2022-07-12,"I'm at Bar e Lanches Pombalense in são paulo, sp https://t.co/uGOJHzbRxZ"
161,22157406,1546822345456771074,2022-07-12,"HOJE: Lançamento das publicações da exposição RAIO-QUE-O-PARTA: ficções do moderno no Brasil
12/07/2022, 
terça-feira, 19h, 5º andar
@sesc24demaio São Paulo

se eu fosse vc, não perderia esse rajadão ⚡️
#exposicao #exhibition #exposición #modernismos #brasil #sesc #artebrasileira https://t.co/YRG8beZsqF"
162,114581418,1546705764911308802,2022-07-12,Acabou de publicar uma foto em Rede Resiliência e Consciência https://t.co/SU6z1wFGtI
163,3053063052,1546674063355019266,2022-07-12,Divulgação de Only Murders In The Building no metrô ❤️ #OMITB https://t.co/htAURG89pU
164,164796545,1546672871380078592,2022-07-12,🏨 https://t.co/i0aSmRoPiZ
165,125864433,1546668128700141568,2022-07-12,🙌🏽 em Riqueza que fala https://t.co/vWlAtj8E0s
166,74835944,1546666647691436032,2022-07-12,Acabou de publicar uma foto em Espaço Zero 11 https://t.co/ayxC5XY8rD
167,76481710,1546665033123467264,2022-07-12,Acabou de publicar uma foto em Blue Space https://t.co/iPg5GoGanV
168,27991603,1546662298353184769,2022-07-12,Nessa quinta eu toco no Soda Pop! Te vejo lá! em Soda Pop Bar https://t.co/zzIxU5LCF8
169,14164165,1546653703050084352,2022-07-12,Acabou de publicar uma foto em Sesc 24 de Maio https://t.co/eUqRHHG7bn
