,author_id,tweet_id,created_at,text
0,272000243,1530727962789699593,2022-05-29,"Reggae é roots, amizades e paz. em São Miguel Paulista, Sao Paulo, Brazil https://t.co/9782KXyILG"
1,1447629280935096335,1530719079107026944,2022-05-29,UMA GRANDE TRISTEZA ! O BRASIL TEM SOFRIDO MUITO E OS DESMATAMENTOS TEM HAVER COM ESSE CLIMA ! https://t.co/jDa0CiPQ5M
2,272000243,1530649472308502536,2022-05-28,"Mato seco é zona leste em São Miguel Paulista, Sao Paulo, Brazil https://t.co/mQ4SG2oti3"
3,1447629280935096335,1530570628171980802,2022-05-28,O PRESIDENTE BOLSONARO NÃO PASSA DE UM VAGABUNDO QUE QUER SE REELEGER DE QUALQUER JEITO E PARA ISSO ELE DARIA ATÉ O CU ! https://t.co/mBmjz0gLcZ
4,123405231,1530562735611731968,2022-05-28,Visitando o Museu Capela de São Miguel. https://t.co/h8E9Hp8kfs
5,402688868,1530538003751370753,2022-05-28,Jonas! em Igreja Internacional Da Graça De Deus Av Marechal Tito N 921 https://t.co/aPjp8zvXoC
6,1447629280935096335,1530519911386202113,2022-05-28,LULA NÃO PASSA DE UM RELÉS LADRÃOZINHO 😁😃😁 https://t.co/W5GT3LuOOL
7,71674128,1530326938627227650,2022-05-27,"E a janta de hoje
A caneca de café é da mãe. em Vila Curuçá https://t.co/0F593PYt90"
8,1447629280935096335,1530254285035945984,2022-05-27,"ATENÇÃO MEUS AMIGOS (AS), NÃO CAIAM NO GOLPE DA BÍBLIA ! https://t.co/yR6qnynkYu"
9,1447629280935096335,1530253589544898561,2022-05-27,Parabéns a Gloriosa Polícia Militar do Estado de São Paulo e seu Batalhão de Elite ! Força e Honra ! https://t.co/ABNDHxGtTE
10,1447629280935096335,1530229345112838145,2022-05-27,LADRÃO VAGABUNDO NATO ! https://t.co/AZMFgKEDHD
11,1447629280935096335,1530228945177681927,2022-05-27,GRANDE VERDADE ! https://t.co/Xs9TJJ7jdO
12,1447629280935096335,1530228743243014148,2022-05-27,BOLSONARO NÃO PASSA DE UM FILHO DA PUTA ! https://t.co/oyZE4PI8cj
13,1447629280935096335,1530215117576708101,2022-05-27,PARA QUEM GOSTA DE BOSTA A VIVO É UM PRATO CHEIO !
14,1447629280935096335,1530214185954590723,2022-05-27,"ESSE FILHO DE UMA PUTA NUNCA SERVIU DE EXEMPLO PRA NADA ! UM LIXO, UM INÚTIL, O PIOR PRESIDENTE DA HISTÓRIA DA REPÚBLICA, PIOR QUE O LULA, A DILMA E O SAFADO DO COLLOR ! https://t.co/ZPzrAqWplg"
15,2857778422,1530177965484658690,2022-05-27,"Acabou de publicar uma foto em São Miguel Paulista, Sao Paulo, Brazil https://t.co/BSZGLgtQMw"
16,4492579047,1530005510472204293,2022-05-27,@Corinthians Fico triste por quem pagou caro pra assistir um jogo horrível como esse... https://t.co/c2cZg4lWt9
17,1447629280935096335,1529969490913550357,2022-05-26,SERIA MUITA MERDA DE UMA VEZ SÓ ! https://t.co/clZyqhS95r
18,1447629280935096335,1529948042228645897,2022-05-26,VOCÊ ESTÁ CERTINHO MEU IRMÃO ! QUEREM ACABAR COM O SUS ! https://t.co/mPFQ1tvfK0
19,58565393,1529929607352229889,2022-05-26,"Irmãos de farda, 12 anos de amizade. em São Miguel Paulista, Sao Paulo, Brazil https://t.co/JMzNkLeP9t"
20,526528864,1529912936650657809,2022-05-26,Acabou de publicar uma foto em Clube Escola Curuça https://t.co/9HPawHG12d
21,1108165369838096385,1529905044690190336,2022-05-26,Venha me conhecer no meu bar
22,58565393,1529890321689100289,2022-05-26,"""Abra minha mente, o meu coração, a minha vida à sua Luz, ao seu Amor, ao seu Poder. Que em todas as coisas eu possa enxergar o Divino."" em Vila Curuçá https://t.co/uVckC4nASS"
23,15907406,1529853566395027462,2022-05-26,"Ah, o anoitecer do outono ❤️

#tbt em Sítio Nosso Recanto https://t.co/p9PvHJqe6P"
24,1447629280935096335,1529811886895771654,2022-05-26,O PGR AUGUSTO ARAS DEVERIA SOFRER UM IMPEACHMENT POR FALTA DE COMPOSTURA E PREVARICAÇÃO NA APURAÇÃO DOS CRIMES DA CPI DA COVIDS ! ELE NÃO PASSA DE UM MERO CAPACHO DE BOLSONARO !
25,1447629280935096335,1529810805700558848,2022-05-26,AUGUSTO ARAS NÃO PASSA DE UM CAPACHO DE BOLSONARO ! https://t.co/E8DDLYhUOT
26,423635618,1529809169385197568,2022-05-26,Acabou de publicar uma foto em Igreja Evangélica das Nações - IEN https://t.co/R4Gg76PHXj
27,1447629280935096335,1529521247108857856,2022-05-25,🤪🤪🤪🤪🤪🤪🤪🤪🤪🤪🤪🤪 https://t.co/jMjc2wBA0F
28,782391607601528832,1529520750763585536,2022-05-25,"Acabou de publicar uma foto em São Miguel Paulista, Sao Paulo, Brazil https://t.co/76NWV0QBaX"
29,1487092624808988674,1529488028129009664,2022-05-25,Aonde vc beijaria? 🔥🔥🍆 https://t.co/QQP0bQAC1u
30,1447629280935096335,1529481261902876673,2022-05-25,PERDA DE TEMPO ! BARROSO É O MELHOR DE TODOS OS MINISTROS ! https://t.co/62svY1gopg
31,1447629280935096335,1529459841843986432,2022-05-25,UTILIDADE PÚBLICA PARA QUEM USA UBER ! https://t.co/oF4eWYd5gX
32,1447629280935096335,1529454298161106944,2022-05-25,ACM NETO NÃO PASSA DE UM GRANDE CANALHA IGUAL AO FALECIDO AVÔ ! https://t.co/L4RKFJENtf
33,782391607601528832,1529407869489188864,2022-05-25,"Continuamos a Orar por libertação e SALVAÇÃO DAS ALMAS 
   PR ELTON GUEDES em São Miguel Paulista, Sao Paulo, Brazil https://t.co/oSZGEjaIXX"
34,782391607601528832,1529399467211825152,2022-05-25,"Hoje ...Exatamente às 19h 
Venha Conquistar as Promessas Em o NOME DE JESUS CRISTO..
   QUARTA FEIRA DA CONQUISTA 
IPDA CABUÇU GUARULHOS SP em São Miguel Paulista, Sao Paulo, Brazil https://t.co/878b4LzEbF"
35,15907406,1529278777301377024,2022-05-25,"os maiores adoradores do pé de caqui ❤️

(vou começar a soltar fotos sem contexto temporal, whateaver)
#tucano #birdsofinstagram #birds em Sítio Nosso Recanto https://t.co/umuCuIqZ2C"
36,1447629280935096335,1529228023983218688,2022-05-24,GRANDE VERDADE ! https://t.co/lKHE5n4BbA
37,1447629280935096335,1529125991393673219,2022-05-24,",😅😅😅😅😅😅😅😅😅😅😅😅 https://t.co/8PJDb5HfSL"
38,200994456,1528897653760589824,2022-05-24,"Eu fico sempre impressionado com tanta coisa que acontece quando Jesus diz e vamos conforme Ele disse!!! .
.
.
.
.
.
.
#lettering #artist #arte #brasil #sãopaulo #evangelismo #biblia #artecristã em Vila Curuçá https://t.co/myO5dvBdQx"
39,1447629280935096335,1528815278557372417,2022-05-23,BOLSONARO SE DEU BEM COM ELON MUSK !! ELE SÓ SE DÁ BEM COM OS RICOS E OS POBRES BRASILEIROS QUE SE LIXEM !
40,1447629280935096335,1528794223327199232,2022-05-23,SE FOR VERDADE SERÁ ÓTIMO UMA TERCEIRA OPÇÃO ! https://t.co/qE0WEtMAbe
41,1447629280935096335,1528784052370669569,2022-05-23,https://t.co/NUnAwS0UFG
42,423635618,1528725319879909376,2022-05-23,Acabou de publicar uma foto em Igreja Evangélica das Nações - IEN https://t.co/6PIUB2m3xa
43,91022159,1528544014806536192,2022-05-23,"Comemorando nossos 11 anos juntos. Mãezona foi junto. 💗 em São Miguel Paulista, Sao Paulo, Brazil https://t.co/h3Vk6T0K1f"
44,1284250551342047234,1528408303084134400,2022-05-22,Passando pra agradecer a prefeitura de SP e subprefeitura de São Miguel Paulista a limpeza em nossa praça.... https://t.co/LxKdVpFClS
45,68185739,1528404652412346368,2022-05-22,Acabou de publicar uma foto em São Miguel Zona Leste https://t.co/uaPOn8Ms54
