,author_id,tweet_id,created_at,text
0,228158097,1562588638814167040,2022-08-24,Acabou de publicar uma foto em Vila Jacui -Zona Leste https://t.co/r19fhMPaXZ
1,168224497,1562521850189471749,2022-08-24,"TV não ligava. Após conserto do circuito DC-DC, aparelho com funcionamento normal e cliente satisfeito com o produto. 👍🔌⚡😉 #tecnicoeletronica #assistênciatécnica #consertotv em Eletronica Nova Diamante https://t.co/ge6yxVbGMp"
2,43759153,1562460968881250308,2022-08-24,"Ela faz a publi dela na academia 🫰🏻
#trinityintercambio 
❤️✈️🌍🗺 @ Smart Fit https://t.co/CGvpWZIR6o"
3,1232757902982680578,1562239839008866304,2022-08-24,"Imobiliária em São Miguel Paulista o maior cadastro de Imóveis em São Miguel Paulista acesse:
https://t.co/ydU8rthQKA

#imobiliariaemsaomiguelpaulista https://t.co/c9la3KyNdf"
4,1009980493847257088,1562186037933342722,2022-08-23,#NaGarupadaFalzoni pela ZL na @consertabike.sp em Vila Jacui -Zona Leste https://t.co/O9gsKhdyCI
5,108837720,1562000601302634499,2022-08-23,"Acabou de publicar uma foto em São Miguel Paulista, Sao Paulo, Brazil https://t.co/JTNCA0OWBq"
6,2844544037,1561912528761921536,2022-08-23,E o ursinho barrigudo acaba de passar na sua #timeline https://t.co/g0QhJ2ZNuJ
7,1108422376117727232,1561871060110397441,2022-08-23,Acabou de publicar uma foto em Liberdade Objetivo https://t.co/xqbSYsfi4T
8,405520958,1561696136754331648,2022-08-22,"Acabou de publicar uma foto em São Miguel Paulista, Sao Paulo, Brazil https://t.co/8jSpCjjsRr"
9,405520958,1561695739419496451,2022-08-22,"Acabou de publicar uma foto em São Miguel Paulista, Sao Paulo, Brazil https://t.co/pXtuoRRUXJ"
10,168224497,1561672768822906884,2022-08-22,Parte 1 do sábado de bolos. 👏🏾🎉🎂 em Eletronica Nova Diamante https://t.co/A2BVJWMbgQ
11,33739218,1561527963820216322,2022-08-22,Acabou de publicar uma foto em Jardim Planalto Z Leste https://t.co/bVh6wbb1uw
12,46538982,1561493047497588736,2022-08-21,"Teve bolo de laranja! #Ficou_uma_delicia_eu_que_fiz 
KKKKKKKKKKKKKKKK em Vila Curuçá https://t.co/hUbwHIETkv"
13,1518908815009329156,1561435342342963201,2022-08-21,"CANAL AME-BR TV 
Parceria Moto Clube Morumbizinho SP e Grupo AME-BR.
Vamos que vamos juntos e misturados. em Morumbizinho Moto Clube https://t.co/Yq38hN1Fi9"
14,1447629280935096335,1561410577506918400,2022-08-21,NUNCA MAIS FAÇO RENEGOCIAÇÃO DE CONSIGNADO NO BANCO PAN ! GOLPISMO ! https://t.co/3YGlmdtZVf
15,1518908815009329156,1561354847626084352,2022-08-21,"CANAL AME-BR TV EVENOS
É Hoje galera.
Todos convidados. em Morumbizinho Moto Clube https://t.co/hU3mKkcFsj"
16,148645453,1561161606599512064,2022-08-21,Acabou de publicar uma foto em A&amp;L Store https://t.co/yrrnD0pr6f
17,108837720,1561152698057011200,2022-08-21,"Acabou de publicar uma foto em São Miguel Paulista, Sao Paulo, Brazil https://t.co/I6gyTM0oMS"
18,4492579047,1561072297343176705,2022-08-20,@UOL Uma pena que parte da Igreja ajudou na fundação do PT https://t.co/fuoTpeBUOn
19,4492579047,1561065405963288578,2022-08-20,"@Metropoles @SamPancher ""Petista também afirmou que defende o Estado laico, mas que ""as igrejas não têm que ter partido político"".

Uma pena que parte da Igreja Católica tenha feito parte do fundação do PT. https://t.co/eqpXPRhRTy"
20,1560746749999841281,1560749764848877568,2022-08-19,#meupetcidadealerta Nick de São Miguel paulista https://t.co/UMzxHBs7HM
21,61940367,1560310684235157509,2022-08-18,"Frango em molho...tem coisa mió??
Na linda São Miguel Paulista. @ São Miguel Paulista, Sao Paulo, Brazil https://t.co/cNlLw1IQfH"
