,author_id,tweet_id,created_at,text
0,1447629280935096335,1539598621217259520,2022-06-22,ESSA MICHEQUE BOLSONARO VAI ACABAR INDO PARA A CADEIA TAMBÉM ! https://t.co/NX2EazdK47
1,1447629280935096335,1539598017409466370,2022-06-22,ATÉ A MICHEQUE BOLSONARO DEFENDEU O MINISTRO CORRUPTO E SEUS PASTORES HIPÓCRITAS E TERRIVELMENTE EVANGÉLICOS ! https://t.co/qyyfVT1OfI
2,1447629280935096335,1539597656711991297,2022-06-22,"😂😂😂😂😂😂😂😂😂😂😂 A CARA DELE AINDA NÃO PEGOU FOGO, MAS A CASA JÁ COMEÇOU A CAIR E A CADEIA É O QUE ESPERA A FAMÍLIA BOLSONARO ! https://t.co/szSqe1yWgU"
3,1447629280935096335,1539593358720598016,2022-06-22,A CASA COMEÇOU A CAIR ! https://t.co/OA4Ledb1UV
4,1447629280935096335,1539533699720650753,2022-06-22,"EU TAMBÉM ESCOLHERIA O DOUTOR SÉRGIO MORO PARA PRESIDENTE DA REPÚBLICA, MAS A DISPUTA ESTÁ ENTRE LULA QUE É UM LADRÃO E O BOLSONARO QUE É UM INCOMPETENTE ! https://t.co/GapbBl5lVp"
5,1447629280935096335,1539532684984307712,2022-06-22,"EU NUNCA MAIS ENTRO EM UMA LOJA AMERICANA, SÓ VENDEM PRODUTOS DE PÉSSIMA QUALIDADE QUE QUANDO APRESENTAM DEFEITOS ELES NÃO DÃO SOLUÇÃO ALGUMA ! É UMA VERDADEIRA LÁSTIMA ! https://t.co/DmRNxLj0Bs"
6,1298076561204101121,1539451127766319107,2022-06-22,"Se apaixone pelo caráter , e não por rostinho bonito."
7,1487092624808988674,1539431112845434881,2022-06-22,"Uma ótima noite pra todos....
@gayflix897 @NovinHeterow @JackKrossXX @cruisingcdmxgay @XvideosGay_18 https://t.co/OUikcqWxIa"
8,388331867,1539425474337722368,2022-06-22,"A vibe da aula de hj foi indescritível. Arrasaram!!! Ate cantar , cantaram uhuuu em Aruã Lagos - Mogi Das Cruzes https://t.co/lL3ycL8Af7"
9,1447629280935096335,1539410894559629313,2022-06-22,ESTAMOS JUNTOS CONTRA TODA ESSA CANALHICE ! https://t.co/SdBZJS8TSf
10,1447629280935096335,1539400864640688128,2022-06-22,CONCORDO PLENAMENTE COM VOCÊ MINHA AMIGA QUERIDA ! https://t.co/1QEEnlRAGY
11,1447629280935096335,1539322786187026433,2022-06-21,https://t.co/WZjyb2PQ03
12,1447629280935096335,1539313431110623232,2022-06-21,"🤣🤣🤣🤣🤣🤣🤣🤣🤣🤣🤣🤣🤣🤣🤣🤣🤣🤣🤣🤣 VAI SER DIFERENTE ???? AGORA ELE E SEUS ASSECLAS IRÃO ROUBAR MUITO MAIS, PORQUE ROUBAR NO BRASIL NÃO DÁ CADEIA PARA OS RICOS ! O STF SOLTA ! https://t.co/RYgrY69284"
13,1487092624808988674,1539286772567400449,2022-06-21,Nada melhor que uma punheta bem batida no horário de almoço né......🍆💧😈🔥🔥🔥🔥 https://t.co/V8qkJGUlRA
14,1487092624808988674,1539248914959843331,2022-06-21,🤫 https://t.co/L6TKMLH71t
15,1447629280935096335,1539226791893782530,2022-06-21,VERDADE ! ESSE É O RESULTADO DAS ATITUDES NEGACIONISTAS DO BOZO ! https://t.co/4EUl33lw40
16,1447629280935096335,1539226411495477249,2022-06-21,"DIFÍCIL, MUITO DIFÍCIL ! https://t.co/hGnGINwHUg"
17,1447629280935096335,1539226197208580098,2022-06-21,ESTAMOS JUNTOS ! NEM LULA E NEM BOLSONARO ! https://t.co/3ukZqq3Ey9
18,423635618,1538929739880095746,2022-06-20,"Você já fez sua reserva? Ainda não? 
Corra ainda temos algumas vagas disponíveis...não fique de fora.
Será um tempo precioso ao lado da pessoa que você ama. em Igreja Evangélica das Nações - IEN https://t.co/RRiLHs4ESD"
19,782391607601528832,1538860028488204289,2022-06-20,"Gratidão a Deus 
Missão Mairiporã SP 
Gratidão, Amigo Ev.Jackson e pastores em São Miguel Paulista, Sao Paulo, Brazil https://t.co/lx99LSUUGE"
20,2948921992,1538806142163460096,2022-06-20,@CETSP_ Bom CET. Farol do Cruzamento entre as Avenidas Marechal Tito e Rua Gendiroba (Vila Curuçá Velha - ZL) apagado a 3 dias. Que tal arrumar logo e evitar que pessoas possam se machucar? https://t.co/8GYmqub0Wo
21,1447629280935096335,1538685935730274308,2022-06-20,VERDADE ! CONCORDO PLENAMENTE COM VOCÊ ! https://t.co/XwIwGzmyX0
22,1298076561204101121,1538638703416983552,2022-06-19,Hoje pode https://t.co/Vkldvds1sC
23,108837720,1538609242478891009,2022-06-19,"Domingo 🤙🤙 em São Miguel Paulista, Sao Paulo, Brazil https://t.co/hpP36i9l1o"
24,1447629280935096335,1538603844224962560,2022-06-19,GRANDE GENERAL O BRASIL PRECISA DO SENHOR ! https://t.co/JOGzmYpDK3
25,1447629280935096335,1538523678455091201,2022-06-19,SOU ETERNAMENTE PALMEIRENSE ! ATÉ MORTO ! https://t.co/azxKYnACku
26,1447629280935096335,1538518724516388866,2022-06-19,VAI SEU LIXO BOLSONARO ! SEU GOVERNO MEDÍOCRE ESTÁ QUASE TERMINANDO SEU ARROMBADO DO CARALHO ! MENTIROSO E INCAPAZ DE GERIR CRISES ! TÔ DE SACO CHEIO DE VOCÊ SEU VACILÃO ! https://t.co/xIEIeSM21h
27,1447629280935096335,1538508134280577026,2022-06-19,Ministrinho do caralho ! https://t.co/WJbShUoOwA
28,108837720,1538389976559325184,2022-06-19,"😎😎😎 em São Miguel Paulista, Sao Paulo, Brazil https://t.co/SNTecfLcD4"
29,1447629280935096335,1538313097328439297,2022-06-19,https://t.co/Wvr67ag1Wm
30,1447629280935096335,1538308370234490881,2022-06-18,"AS MOTOCIATAS DE BOLSONARO AGORA ESTÃO MAIS CARAS ! SUBIU OS PREÇOS DOS COMBUSTÍVEIS, MAS ISSO NÃO É PROBLEMA ! QUEM PAGA É O POVO BRASILEIRO MESMO ! 🤣🤣🤣🤣🤣🤣🤣🤣🤣🤣🤣🤣 O POVO BRASILEIRO NÃO TÊM O QUE COMER ???? COMPRA ARMINHA ! BOLSONARO SAFADO, FILHO DA PUTA !"
31,1447629280935096335,1538305558079492097,2022-06-18,VOCE NÃO SERÁ REELEITO SEU SAFADO ! SEM VERGONHA ! VOCÊ NÃO É A RAINHA DE SABÁ SEU PUTO ARROMBADO ! https://t.co/Y1PQUJvtW5
32,1447629280935096335,1538304911376539650,2022-06-18,"CERTINHO BOLSONARO SEU FILHO DA PUTA ! NÃO SABE GOVERNAR PICA A MULA SEU VAGABUNDO, VAI FAZER MOTOCIATAS NA CASA DO CARALHO ! Bolsonaro: “Com CPI, Petrobras vai perder mais R$ 30 bilhões” https://t.co/UEZg2rPAbp"
33,72816218,1538189000074219521,2022-06-18,👣👣👣👣 em Abre Campo Minas Gerais https://t.co/VVA9hSagcu
34,1447629280935096335,1538187653870411776,2022-06-18,SÓ FERNANDO HENRIQUE CARDOSO QUE EU SEI QUE MORA NA RUA MARANHÃO EM HIGIENÓPOLIS SÃO PAULO CAPITAL ! O RESTO DOS VAGABUNDOS E PICARETAS EU NÃO SEI E NEM QUERO SABER DESSES FILHOS DA PUTA ! https://t.co/IKChPhE2Cs
35,1447629280935096335,1538172124472524801,2022-06-18,ESTÁ COM LULA ????? EM QUAL PENITENCIÁRIA ???. https://t.co/C05cnjpXns
36,1447629280935096335,1538151464178274304,2022-06-18,"MAIS UM CANALHA CORRUPTO NO JUDICIÁRIO ! MAS, INDICADO POR BOLSOLIXO VAI ESPERAR O QUE DELE NÉ ?????? https://t.co/pfrYQuonMW"
37,1447629280935096335,1538151050800205824,2022-06-18,CONCORDO PLENAMENTE COM VOCÊ MEU AMIGO QUERIDO ! https://t.co/YXvxmFByXS
38,1447629280935096335,1538150828846026759,2022-06-18,SIM ! ESTÁ AVALIANDO SE CONCORRE PARA SENADOR OU GOVERNADOR DO ESTADO DO PARANÁ ! https://t.co/fh2HGEZ6L3
39,1447629280935096335,1538150505683521536,2022-06-18,FORAM IMBECILIZADOS ! https://t.co/CUFAmdEUil
40,1447629280935096335,1538150262040408066,2022-06-18,VERDADE 🤣😃🤣😃🤣🤣🤣🤣🤣🤣🤣🤣🤣🤣🤣 https://t.co/I0MewJBCQd
41,1447629280935096335,1538150085749530624,2022-06-18,"OS DOIS, AMBOS REPRESENTAM UM COMBATE A CORRUPÇÃO ENDEMICA QUE GRASSA EM NOSSO BRASIL VARONIL ! https://t.co/BC6AZgqw9V"
42,1447629280935096335,1538149625479274497,2022-06-18,Eu votei nesse filho da puta que enganou-me e traiu todos seus eleitores ! https://t.co/dvzvgiTCqD
43,1447629280935096335,1538148584067063810,2022-06-18,"BOLSONARO NÃO ENGANA MAIS NINGUÉM ! SERÁ REELEITO SIM, LÁ NA PUTA QUE O PARIU, DESGRAÇADO, MALDITO, SEM VERGONHA, LIXO, ESCÓRIA DA SOCIEDADE E UM ETERNO VAGABUNDO ! https://t.co/YB9jRhghjp"
44,1447629280935096335,1538147936726568961,2022-06-18,"LULA É UM LADRÃO, FOI UM LADRÃO E SERÁ SEMPRE UM LADRÃO ! https://t.co/G7Giw7ISAz"
45,782391607601528832,1537817322504822789,2022-06-17,"Vamos nos ...
Depender de nós a obra não Para ...
Glória a Deus em São Miguel Paulista, Sao Paulo, Brazil https://t.co/KMX16Pdvbr"
46,1447629280935096335,1537569303410749441,2022-06-16,"NESSE SEU GOVERNO MEDÍOCRE QUE VOCÊ NOS IMPÔS A AMAZÔNIA NUNCA ESTEVE TÃO ABANDONADA A MERCÊ DE CRIMINOSOS, NARCOTRAFICANTES, EXPLORADORES DE MADEIRAS, ESTÃO ROUBANDO NOSSA AMAZÔNIA E VOCÊ FAZENDO MOTOCIATAS ! SEU LIXO DO CARALHO ! https://t.co/kcjrLZNki2"
47,1447629280935096335,1537568464516177920,2022-06-16,CONCORDO PLENAMENTE COM VOCÊ MEU AMIGO QUERIDO ! ESTOU DE SACO CHEIO DE VER TANTA MALDADE ! TANTA CORRUPÇÃO ! https://t.co/5t5JSwnBNL
48,344347538,1537554625770954754,2022-06-16,"🖤✨16 de junio de 2022✨🖤
 Los amo hasta el infinito y mas allá✨😍🥰♾ en Perdidos Por Aí https://t.co/OFzuOlinFQ"
49,156724552,1537530330734804993,2022-06-16,"Aula de manhã, tarde e noite de Kickboxing, Jiu Jitsu, Muay Thai e Boxe. Informações pelo PV. em IFC JIU JITSU https://t.co/uBUBwi2hnv"
50,1447629280935096335,1537522644362350597,2022-06-16,"NÃO ! MAS, QUE PROTEGE MARGINAIS E CRIMINOSOS SIM ! SOLTAR LULA FOI O PIOR DOS CRIMES PRATICADOS POR FACHIN ! https://t.co/O7mSJmB7aF"
51,1447629280935096335,1537519701621891088,2022-06-16,BOLSONARO É LOUCO E COMO TAL DEVE SER TRATADO ! VAGABUNDO E SAFADO ! https://t.co/W6uywrAKvb
52,1487092624808988674,1537469330451058695,2022-06-16,Uma ótima tarde pra todos..... https://t.co/XkHvQHw9Gy
53,1447629280935096335,1537464430958624768,2022-06-16,"MÁRIO FRIAS, UM INÚTIL UMA VERDADEIRA GELADA QUE QUER CONTINUAR MAMANDO NAS TETAS DO GOVERNO MEDÍOCRE !"
54,1447629280935096335,1537463710603792384,2022-06-16,"DISSE TUDO MEU NOBRE IRMÃO ! MÁRIO FRIAS É UMA GELADA, UM SER IGNOBIL QUE PERAMBULA PELO PALÁCIO DAS BANANEIRAS PROCURANDO UM ESCROTO PARA SE AGARRAR ! EM RESUMO ????? UM LIXO 😕 https://t.co/8F6E2ayZQN"
55,1447629280935096335,1537462922196267010,2022-06-16,"NÃO PRECISA PROCURAR MAIS, OS CORPOS AO QUE TUDO INDICA JÁ FORAM ENCONTRADOS PELA EFICIENTE POLÍCIA FEDERAL, FALTA SOMENTE A ANÁLISE DOS RESTOS MORTAIS PARA A CONFIRMAÇÃO ! https://t.co/ENP9iYPpdW"
56,1447629280935096335,1537462232807882753,2022-06-16,EU TENHO VERGONHA DA SUPREMA CORTE DE MEU PAÍS ! https://t.co/d7oum0RXQz
57,1447629280935096335,1537450278038937600,2022-06-16,😂😂😂😂😂😂😂😂😂😂😂 https://t.co/KJ1TQw0v7f
58,1447629280935096335,1537444217907138561,2022-06-16,😂😂😂😂😂😂😂😂😂😂😂😂😂😂😂😂😂😂😂😂 https://t.co/dxqA7KnQY1
59,782391607601528832,1537291673570516994,2022-06-16,"Não Percam!
Exatamente as 3h da madrugada falar com Deus em São Miguel Paulista, Sao Paulo, Brazil https://t.co/WceKoSUyX7"
60,1447629280935096335,1537240037867196416,2022-06-16,"JAIR MESSIAS BOLSONARO ESTÁ COM MANIA DE PERSEGUIÇÃO ! ELE PENSA QUE É A RAINHA DE SABÁ E QUE O STF ESTÁ PERSEGUINDO ELE !
DÁ RIVOTRIL PARA ELE QUE É ESQUIZOFRENIA MESMO !"
61,1447629280935096335,1537224910678130688,2022-06-16,CONCORDO PLENAMENTE COM VOCÊ MINHA AMIGA QUERIDA ! ELE HAVERÁ DE PAGAR POR TODOS SEUS CRIMES ! https://t.co/MIyBPkJseF
62,1447629280935096335,1537203001647144961,2022-06-15,VA TOMAR NO SEU CU BOLSONARO ! NÃO TEM VERGONHA DE DIZER QUE VOCÊ MENTE ????? SEU SAFADO ! https://t.co/vdmlJzMKHG
