,author_id,tweet_id,created_at,text
0,263957467,1556420150462763010,2022-08-07,Acabou de publicar uma foto em Subprefeitura Itaim Paulista https://t.co/FUBkxk7lfg
1,263957467,1556417113807409152,2022-08-07,Acabou de publicar uma foto em Subprefeitura Itaim Paulista https://t.co/VMm9gFqqDr
2,4492579047,1556371981007814656,2022-08-07,"@tmdqa Também não entendi porque escolheram uma pessoa que não tem nenhuma relação com a Seleção.

Além, claro, da velha crítica social contra o capitalismo que o mantém no topo da pirâmide social brasileira.

https://t.co/nz3Hs8UqPg"
3,201917140,1556345057875095558,2022-08-07,Acabou de publicar uma foto em Líbano https://t.co/AEvSorq7WL
4,4492579047,1556275825640620038,2022-08-07,"@igormirandasite Do @IronMaiden : 'Live After Death', o disco todo!

Da carreira solo: Chemical Wedding!

Em sua homenagem vou ouvir o 'Tattooed Millionaire' e sua versão para 'All The Young Dudes' do Mop The Hoople. https://t.co/yi9H2Cv1Uo"
5,165065280,1556267329658527744,2022-08-07,Acabou de publicar uma foto em Ciclovia Pq. Jacuí - Pq. Ecólogico https://t.co/OOYWyZf4vn
6,1232757902982680578,1556264996614672384,2022-08-07,"Casas em São Miguel Paulista lista de casas à venda em São Miguel Paulista, as melhores casas do bairro você encontra na Alto Pedroso Imóveis
https://t.co/e8T7XPkz99

#casasemsaomiguelpaulista 
#casasavendaemsaomiguelpaulista"
7,4492579047,1556257084873887750,2022-08-07,"@_sccpnews @mabragatchelo Fez os dois gols mais importantes da história do clube e uma parte da torcida o trata assim.

Alguns dirão: ""ah,mas ele disse que, no Brasil, jogaria só no @Corinthians...""

Não mentiu. No @Flamengo e no @SCInternacional não jogou nada; e no @AvaiFC será a mesma coisa."
8,4492579047,1556249378368753664,2022-08-07,"@saionetiSCCP @Malta59348077 @ComidasEstadios @Corinthians @lucasdsbarros @NeoQuimicaArena O lanche de pernil vendido do lado de fora é infinitamente melhor e mais barato que essa ""pizza"". Se a pessoa fizer questão de comer no estádio é opção dela.

Quem é acostumado a ir na @NeoQuimicaArena sabe: faz o pit stop no shopping ou nas redondezas da estação Arthur Alvim."
9,1092791339849256961,1556108255402889216,2022-08-07,Essas ideia não vai curar com uma bomba 🔥 #Melhordia https://t.co/xfsNpcfCyf
10,200994456,1556060925626572802,2022-08-06,Acabou de publicar uma foto em Vila Curuçá https://t.co/ayIOV3JdKm
11,1232757902982680578,1556006453336571907,2022-08-06,"Convidamos a todas as Imobiliárias na Zona Leste, a tomarem um delicioso café, no espaço especial que criamos, para todos os corretores de imóveis da Zona Leste de São Paulo, vamos fazer parcerias:

Acesse nossos milhares de imóveis:

https://t.co/G6me1LTXh0 https://t.co/6IxG5wJzDH"
12,4492579047,1556001716633571328,2022-08-06,"@ComidasEstadios @Corinthians @lucasdsbarros @NeoQuimicaArena Moro a 6 km da @NeoQuimicaArena e a pizza inteira (8 pedaços) custa R$ 30,00.

Só come no estádio quem quer postar fotos no Instagram. https://t.co/IFAFk3ItGz"
13,753760329855795200,1555841579214061568,2022-08-06,Amigos em Oggi Sorvetes https://t.co/HgPGmSg6zF
14,1354862147411574787,1555738025610600448,2022-08-06,@Biah82 https://t.co/XepEBFN3rV
15,1232757902982680578,1555654090201468934,2022-08-05,"Imobiliárias na Zona Leste, lista de imóveis na zona leste.

Imobiliárias na Zona Leste - Guia de Imóveis na Zona Leste, Apartamentos, casas, sobrados e comércios.  Quer Comprar, Alugar ou Anunciar imóveis na Zona Leste? 

https://t.co/G6me1LTXh0 https://t.co/tn3efY2vIw"
16,1232757902982680578,1555518796923805697,2022-08-05,"Apartamentos à venda em São Miguel Paulista, a maior lista de apartamentos no bairro de São Miguel Paulista você encontra na alto Pedroso Imóveis
https://t.co/MTpUkyVHtt https://t.co/nWUURXzY5W"
17,42544192,1555388326638768128,2022-08-05,Acabou de publicar uma foto em Teatro Sport Clube Corinthians P https://t.co/BAPUyXcc0m
18,294363227,1555230808734142465,2022-08-04,Acabou de publicar uma foto em Parque Santa Rita Zona Leste https://t.co/5sRLVctlOY
19,46538982,1554816691787276289,2022-08-03,São duzentos dias aprendendo algo não tão novo assim! Valeu pelo empurrão Bobaiona! em Vila Curuçá https://t.co/ez62mS8WsA
20,1232757902982680578,1554658406039969792,2022-08-03,"Imobiliárias em São Miguel Paulista, conheça na Alto Pedroso Imóveis, o maior portal de Imobiliárias em São Miguel Paulista e imóveis na zona leste
https://t.co/aSU8jDNHGG
#imobiliariasemsaomiguelpaulista https://t.co/Nt7o4Dla2V"
21,156724552,1554613461526712320,2022-08-02,Acabou de publicar uma foto em IFC JIU JITSU https://t.co/jg6rbfUW2Q
22,72662014,1554477727775920129,2022-08-02,"LOVE em São Miguel Paulista, Sao Paulo, Brazil https://t.co/6zhzlE47OO"
23,223498344,1554205329143078918,2022-08-01,"Os penteados e maquiagens recomendados para as mamães de noivas e noivos.

Arraste e fique por dentro 😘

#maquiagem #penteados em https://t.co/BNdqJMMuhR - Beleza em primeiro lugar https://t.co/NLE0vbUjFg"
24,72662014,1554163871568564225,2022-08-01,"Amém 🙏🙏 em São Miguel Paulista, Sao Paulo, Brazil https://t.co/SEOfxyMotW"
25,423635618,1554076139491971075,2022-08-01,Acabou de publicar uma foto em Igreja Evangélica das Nações - IEN https://t.co/KFEPZKwzrg
