,author_id,tweet_id,created_at,text
0,1447629280935096335,1532518032819494921,2022-06-03,https://t.co/Kiscvtixoy
1,1447629280935096335,1532436319510614031,2022-06-02,https://t.co/pEHKbG7h8d
2,1447629280935096335,1532158641649876993,2022-06-02,"VERDADE, ACABAM CONFUNDINDO A CABEÇA DAS CRIANÇAS QUE ACABAM PRECISANDO DE ANALISTAS, PSICÓLOGOS PARA SE DEFINIREM QUEM SÃO https://t.co/9MHhpqVdh6"
3,1447629280935096335,1532151826161848320,2022-06-02,"FLÁVIO BOLSONARO TÊM DE EXPLICAR-SE COMO CONSEGUIU COMPRAR A MANSÃO DE R$ 6.000.000,00 REAIS ! SÓ PODE SER COM O CARTÃO CORPORATIVO DO PAI QUE EM 2021 TEVE UM GASTO DE R$ 29.800.000,00 REAIS SEM EXPLICAÇÕES ! LADROEIRA PURA !"
4,1447629280935096335,1532150868686020609,2022-06-02,CONCORDO PLENAMENTE COM VOCÊ ! NO MEU TEMPO NÃO EXISTIA ESSAS COISAS ! https://t.co/ojRUsn23kj
5,1447629280935096335,1532135127215742982,2022-06-01,O LULA PEDINDO VOTOS ! https://t.co/pJ6PDFRwBF
6,1447629280935096335,1532102537217814528,2022-06-01,"VAI LULA SEU SAFADO, VAGABUNDO E LADRÃO, DEVOLVE O DINHEIRO SEU FILHO DA PUTA ! ARROMBADO DO CARALHO ! ESSA É A ÚNICA LINGUAGEM QUE VOCÊ ENTENDE SEU LADRÃO ! https://t.co/tdIRQfP8xM"
7,1447629280935096335,1532097998523666432,2022-06-01,😂😂😂😂😂😂😂😂😂😂😂😂😂😂😂😂😂😂😂😂😂 https://t.co/mlkn3GvRfh
8,405520958,1532053900773163008,2022-06-01,"Acabou de publicar uma foto em São Miguel Paulista, Sao Paulo, Brazil https://t.co/wgDXVtj6L7"
9,1447629280935096335,1532037467574046721,2022-06-01,QUANDO O SAFADO DO HADDAD SE ELEGEU PARA PREFEITO DE SÃO PAULO CAPITAL SEU PRIMEIRO ATO FOI AUMENTAR O IPTU EM VALORES ESTRATOSFÉRICOS E SEU SEGUNDO ATO FOI AUMENTAR AS PASSAGENS DE ÔNIBUS ! NA ÉPOCA ELE FOI ELEITO O PIOR PREFEITO DA HISTÓRIA DE SÃO PAULO !
10,1447629280935096335,1532036319156789248,2022-06-01,Esse é o futuro dos eleitores do PT 🤣🤣🤣🤣🤣🤣🤣🤣🤣🤣 https://t.co/Ypq4ejLBFQ
11,1447629280935096335,1532025496241901569,2022-06-01,🤣🤣🤣🤣🤣🤣🤣🤣🤣🤣🤣🤣🤣🤣🤣🤣🤣🤣🤣🤣🤠 https://t.co/db9FsnqArl
12,1447629280935096335,1531992740707418112,2022-06-01,BIVAR É UM PUTA DE UM PICARETA DO CARALHO ! UM VAGABUNDO CORRUPTO !! CAPACHO DE BOLSONARO ! https://t.co/Fjt2ie9AQE
13,423635618,1531990030155190273,2022-06-01,Acabou de publicar uma foto em Igreja Evangélica das Nações - IEN https://t.co/qCMZXvsKzh
14,1447629280935096335,1531989477438144514,2022-06-01,AH AH AH AH AH AH AH AH https://t.co/cMMV8Dr0i3
15,1447629280935096335,1531984140807151628,2022-06-01,VÁ TOMAR NO SEU CU LUCIANO BIVAR SEU TRAÍRA ! VAGABUNDO DO CARALHO ! https://t.co/T6ihIo4DFt
16,782391607601528832,1531849047958376449,2022-06-01,"VEM CONOSCO ADORAR A DEUS 
   LEVITAS ALINE GUEDES , PÉROLA,  MOCIDADE LOCCAL IPDA CABUÇU  , ADORADORA ALINE SANTIAGO E BIANCA em São Miguel Paulista, Sao Paulo, Brazil https://t.co/PFRfFDNFS7"
17,782391607601528832,1531846576271917057,2022-06-01,"Daqui a pouco vamos buscar a Deus em São Miguel Paulista, Sao Paulo, Brazil https://t.co/ejWrWv43wM"
18,108837720,1531845210896056321,2022-06-01,"Bora ser feliz em São Miguel Paulista, Sao Paulo, Brazil https://t.co/H8ujZJ7C6e"
19,1487092624808988674,1531767163345854471,2022-05-31,"Boa noite meus delícias 😋 @gayflix897 @MetflixBrasil @f_desnudos @RoccoSteeleNYC
@XvideosGay_18 @goiasgay @MenGayxMenGay @h3terospel4doss @BanheiraoDf @BanheiraoThe @Pegada_daleste @GaysNP https://t.co/72ufZ6bQKK"
20,1447629280935096335,1531675655968108544,2022-05-31,ÓTIMO ! FICAREI TORCENDO PELAS SUAS PUBLICAÇÕES 😃 https://t.co/sE9k5c8ga3
21,782391607601528832,1531662173264482304,2022-05-31,"Vc é  meu convidado participe !!!
Deus tem uma palavra pra vc ...
Pr. Elton Guedes em São Miguel Paulista, Sao Paulo, Brazil https://t.co/QEeQHffy12"
22,423635618,1531622429843509248,2022-05-31,"Venha participar conosco.
Será incrível!
#SomosIEN
#IENoSeuLugar em Igreja Evangélica das Nações - IEN https://t.co/NB9Qx7e3gc"
23,423635618,1531622149257056260,2022-05-31,Acabou de publicar uma foto em Igreja Evangélica das Nações - IEN https://t.co/dnG3YVJS19
24,1447629280935096335,1531616473554341890,2022-05-31,VERDADE ! ESSE PRESIDENTE NÃO É UM EXEMPLO PARA NINGUÉM ! ELE MANCHA A INSTITUIÇÃO***PRESIDÊNCIA DA REPÚBLICA*** UM VERDADEIRO LIXO ! https://t.co/RjYPrFV0aQ
25,1447629280935096335,1531612417381355521,2022-05-31,BOLSONARO VOCÊ É UM LIXO ! VAGABUNDO E SAFADO ! https://t.co/tuIbISx39a
26,1447629280935096335,1531609899968471041,2022-05-31,VÁ TOMAR NO SEU CU LUCIANO BIVAR ! SUA  CANDIDATURA É UMA GRANDE BOSTA ! VOCÊ NÃO GANHA NUNCA SEU LIXO ! TRAIDOR ! https://t.co/2TKqQpAoON
27,2857778422,1531609798776606720,2022-05-31,"Acabou de publicar uma foto em São Miguel Paulista, Sao Paulo, Brazil https://t.co/pgYb3PgmAh"
28,1447629280935096335,1531607448787861505,2022-05-31,Parabéns a Gloriosa Polícia Militar do Estado de São Paulo ! Parabéns a Força Tática ! https://t.co/MFxv69Ql3q
29,405520958,1531593976469409792,2022-05-31,"Acabou de publicar uma foto em São Miguel Paulista, Sao Paulo, Brazil https://t.co/77cBoqJPAT"
30,782391607601528832,1531490674213888002,2022-05-31,"Diante de Deus , estamos com um Propósito OREM CONOSCO em São Miguel Paulista, Sao Paulo, Brazil https://t.co/XGHEAS0GpN"
31,69428565,1531436384090697728,2022-05-31,Acabou de publicar uma foto em Empório Dadário https://t.co/xjcpgTGSym
32,1447629280935096335,1531425138448687104,2022-05-30,MAS DATENA JÁ AVISOU QUE NÃO É CANDIDATO A NADA ! https://t.co/dYyBN2vzQ7
33,1447629280935096335,1531424592383905801,2022-05-30,BOLSONARO NÃO PASSA DE UM SAFADO AO DEFENDER POLICIAIS CRIMINOSOS E ASSASSINOS ! AONDE VAMOS PARAR ??????? https://t.co/hKxffn3Svr
34,1447629280935096335,1531411561486684163,2022-05-30,CONCORDO PLENAMENTE COM VOCÊ MEU IRMÃO QUERIDO ! https://t.co/cmosj3lI8p
35,1447629280935096335,1531384470330392576,2022-05-30,A GRANDE CANALHICE DE LULA ! https://t.co/30Ym2vyMi0
36,1447629280935096335,1531359673303040002,2022-05-30,MICHEQUE BOLSONARO NÃO PASSA DE UMA PESSOA VIGARISTA ! https://t.co/xi2MEltdg1
37,1447629280935096335,1531353393754693636,2022-05-30,https://t.co/PemheAvrgJ
38,1447629280935096335,1531321614222209025,2022-05-30,ELE NÃO PASSA DE UM GRANDE VAGABUNDO ! O PIOR PRESIDENTE DE TODA HISTÓRIA DO BRASIL REPÚBLICA ! https://t.co/LnoANtevrr
39,1447629280935096335,1531311778268950528,2022-05-30,"TÁ NADA !! SUA POPULARIDADE DEVIDO A FORTE CRISE ECONÔMICA, ALIADA A FOME ENDEMICA QUE GRASSA PELO PAÍS RECUOU E MUITO !
GRAÇAS A DEUS ELE SAIRÁ ESSE ANO ! UFA ! https://t.co/tG6CkcQZ9P"
40,782391607601528832,1531148219236982784,2022-05-30,"Adorador em São Miguel Paulista, Sao Paulo, Brazil https://t.co/kyRhpV3hgs"
41,860323361641156608,1531028636513492993,2022-05-29,Com os melhores ❤️❤️ em Perdidos Por Aí https://t.co/P8gbnKHkcc
42,1444730024150634502,1530934238798807049,2022-05-29,"batuqueiros e sua gente, hariel e barões da pisadinha 😊 #viradacultural"
43,1447629280935096335,1530926495002140673,2022-05-29,"BOLSONARO POR FAVOR, VÁ PARTICIPAR DA MARCHA PARA O HADES !! SEU MENTECAPTO E TIRANO ! GRAÇAS A DEUS EM OUTUBRO/22 VOCÊ JÁ ERA ! O PIOR PRESIDENTE DA HISTÓRIA DA REPÚBLICA BRASILEIRA, VOCÊ, O LULA, A DILMA E O COLLOR MERECEM SER LEMBRADOS NO BASTIÃO DOS PIORES GOVERNANTES !"
44,1447629280935096335,1530912518956277767,2022-05-29,"ENQUANTO BOLSONARO LEVA O PAÍS AO ABISMO E FAZ CAMPANHA PARA REELEGER-SE O POBRE POVO BRASILEIRO MORRE DE FOME, MORRE NAS CHUVAS, MORRE SEM ASSISTÊNCIA MÉDICA DECENTE, ENQUANTO BILHÕES SÃO QUEIMADOS NO FUNDO PARTIDÁRIO !
CHEGA BOLSONARO SEU CANALHA, INSANO E VAGABUNDO !"
45,1447629280935096335,1530903723987320832,2022-05-29,https://t.co/zlQFCs34Tg
46,782391607601528832,1530870340934676482,2022-05-29,"Deus abençoe Israel em São Miguel Paulista, Sao Paulo, Brazil https://t.co/2giWrLVjbe"
47,782391607601528832,1530868972459106304,2022-05-29,"DEUS ABENÇOE A TODOS em São Miguel Paulista, Sao Paulo, Brazil https://t.co/PEeIYtm9L2"
48,782391607601528832,1530866080981434368,2022-05-29,"Propósito de oração estamos Juntos em São Miguel Paulista, Sao Paulo, Brazil https://t.co/pHrB5BiFnj"
49,1447629280935096335,1530865002105774081,2022-05-29,"ENQUANTO VOCÊ MARCHA PARA JESUS NO AMAZONAS, 35 BRASILEIROS MORRERAM NO PERNAMBUCO ! ASSIM COMO ACONTECEU NA BAHIA, VOCÊ NÃO ESTAVA NEM AÍ SEU PICARETA ! VOCÊ VAI É MARCHAR PARA O HADES QUANDO SEU GOVERNO ACABAR ! SE DEUS QUISER ! https://t.co/gNw5QfQJ8J"
50,782391607601528832,1530864039802425352,2022-05-29,"Acabou de publicar uma foto em São Miguel Paulista, Sao Paulo, Brazil https://t.co/bA0eDeo5KC"
51,1447629280935096335,1530863070922297347,2022-05-29,A moda ao redor do mundo ! https://t.co/gnbolf8gIT
52,272000243,1530727962789699593,2022-05-29,"Reggae é roots, amizades e paz. em São Miguel Paulista, Sao Paulo, Brazil https://t.co/9782KXyILG"
53,1447629280935096335,1530719079107026944,2022-05-29,UMA GRANDE TRISTEZA ! O BRASIL TEM SOFRIDO MUITO E OS DESMATAMENTOS TEM HAVER COM ESSE CLIMA ! https://t.co/jDa0CiPQ5M
54,272000243,1530649472308502536,2022-05-28,"Mato seco é zona leste em São Miguel Paulista, Sao Paulo, Brazil https://t.co/mQ4SG2oti3"
55,1447629280935096335,1530570628171980802,2022-05-28,O PRESIDENTE BOLSONARO NÃO PASSA DE UM VAGABUNDO QUE QUER SE REELEGER DE QUALQUER JEITO E PARA ISSO ELE DARIA ATÉ O CU ! https://t.co/mBmjz0gLcZ
56,123405231,1530562735611731968,2022-05-28,Visitando o Museu Capela de São Miguel. https://t.co/h8E9Hp8kfs
57,402688868,1530538003751370753,2022-05-28,Jonas! em Igreja Internacional Da Graça De Deus Av Marechal Tito N 921 https://t.co/aPjp8zvXoC
58,1447629280935096335,1530519911386202113,2022-05-28,LULA NÃO PASSA DE UM RELÉS LADRÃOZINHO 😁😃😁 https://t.co/W5GT3LuOOL
59,71674128,1530326938627227650,2022-05-27,"E a janta de hoje
A caneca de café é da mãe. em Vila Curuçá https://t.co/0F593PYt90"
60,1447629280935096335,1530254285035945984,2022-05-27,"ATENÇÃO MEUS AMIGOS (AS), NÃO CAIAM NO GOLPE DA BÍBLIA ! https://t.co/yR6qnynkYu"
61,1447629280935096335,1530253589544898561,2022-05-27,Parabéns a Gloriosa Polícia Militar do Estado de São Paulo e seu Batalhão de Elite ! Força e Honra ! https://t.co/ABNDHxGtTE
62,1447629280935096335,1530229345112838145,2022-05-27,LADRÃO VAGABUNDO NATO ! https://t.co/AZMFgKEDHD
63,1447629280935096335,1530228945177681927,2022-05-27,GRANDE VERDADE ! https://t.co/Xs9TJJ7jdO
64,1447629280935096335,1530228743243014148,2022-05-27,BOLSONARO NÃO PASSA DE UM FILHO DA PUTA ! https://t.co/oyZE4PI8cj
65,1447629280935096335,1530215117576708101,2022-05-27,PARA QUEM GOSTA DE BOSTA A VIVO É UM PRATO CHEIO !
66,1447629280935096335,1530214185954590723,2022-05-27,"ESSE FILHO DE UMA PUTA NUNCA SERVIU DE EXEMPLO PRA NADA ! UM LIXO, UM INÚTIL, O PIOR PRESIDENTE DA HISTÓRIA DA REPÚBLICA, PIOR QUE O LULA, A DILMA E O SAFADO DO COLLOR ! https://t.co/ZPzrAqWplg"
67,2857778422,1530177965484658690,2022-05-27,"Acabou de publicar uma foto em São Miguel Paulista, Sao Paulo, Brazil https://t.co/BSZGLgtQMw"
