,author_id,tweet_id,created_at,text
0,476838425,1542631579717074948,2022-06-30,Acabou de publicar uma foto em Molas Reforçadas GNV e Convencionais https://t.co/i0gkuOOnt9
1,476838425,1542630938986913799,2022-06-30,Acabou de publicar uma foto em Molas Reforçadas GNV e Convencionais https://t.co/yaGRgg2OiJ
2,476838425,1542626205467349001,2022-06-30,Acabou de publicar uma foto em Molas Reforçadas GNV e Convencionais https://t.co/Jx8K2Cakew
3,1518908815009329156,1542535595775463426,2022-06-30,"Todos convidados.
Moto Pork 
1° Encontro de Motociclistas.
Festival de Torresmo e Cerveja Artesanal.
02/06/2022 - 12h.
Sede Dorme Suju's em Dorme Suju's Moto Clube https://t.co/KE7yN4UaBp"
4,56610486,1542290054990774272,2022-06-29,"Ministério no Ministério da terceira idade da IBJS. Foi um lindo trabalho. Tema DEPRESSÃO NA TERCEIRA IDADE. em São Miguel Paulista, Sao Paulo, Brazil https://t.co/f3QDUcOAuA"
5,423635618,1542132254364672001,2022-06-29,"Se prepare para viver dias extraordinários.
Será impactante e transformador.
#ConferenciaApostolica
#SomosIEN
#IENoSeuLugar em Igreja Evangélica das Nações - IEN https://t.co/kIqh4dH8n2"
6,423635618,1542131568059228161,2022-06-29,Acabou de publicar uma foto em Igreja Evangélica das Nações - IEN https://t.co/UjN7ZnE5IB
7,118562008,1541953827548569602,2022-06-29,"Sua empresa ainda não está na internet? 
Não perca mais tempo e tenha sua presença visível na internet, divulgando seus serviços ou produtos 
https://t.co/0Ugps2O5T9 em Studio Kemilly Designer https://t.co/XMFrST3IxL"
8,782391607601528832,1541744540553461760,2022-06-28,"Nunca haverá portas de Bronze  de ferro ou até mesmo de Aço....fechadas 
     Pra quem está Orando ...
O justo viverá pela fé 
Rm 1:17 em São Miguel Paulista, Sao Paulo, Brazil https://t.co/2TL8GVUrjx"
9,782391607601528832,1541635576214032384,2022-06-28,"Acabou de publicar uma foto em São Miguel Paulista, Sao Paulo, Brazil https://t.co/LLB9FsecS5"
10,1447629280935096335,1541584741719236608,2022-06-28,😂😂😂😂😂😂😂😂😂😂😂 https://t.co/wdOc9dhsMD
11,32382452,1541564183296237573,2022-06-27,"Acabou de publicar uma foto em São Miguel Paulista, Sao Paulo, Brazil https://t.co/ssd4uW86iG"
12,782391607601528832,1541424440357044227,2022-06-27,"Infelizmente muitos estão dentro da
 Igreja sem Caráter! Porque suas Atitudes entregam ...
    Que Deus tenha misericórdia destes tais .... em São Miguel Paulista, Sao Paulo, Brazil https://t.co/8zrwIb9mYa"
13,1108422376117727232,1541152933131309057,2022-06-26,Acabou de publicar uma foto em Salão dos Anjos https://t.co/Fk7bPDUHZS
14,782391607601528832,1541020260513579009,2022-06-26,"Aqui , vamos .... Pregar a Palavra de Deus , 
Manhã com os Jovens , 
     Ipda São Paulo 
#domingo 9h em São Miguel Paulista, Sao Paulo, Brazil https://t.co/NIOwJAPwbw"
15,46538982,1540908110012788736,2022-06-26,"Dia de bagunça com esse bando de canalhas!
Kkkkkkkkkkkkkkkk em Vila Curuçá https://t.co/cfhpPBQ4xe"
16,1447629280935096335,1540852364751560705,2022-06-26,BOLSONARO ESTÁ COM O CUZINHO NA MÃO COM MEDO DE SER PRESO ! https://t.co/JPRFs3M6Au
17,1447629280935096335,1540849849012297728,2022-06-26,"BOLSONARO É SIM UM GENOCIDA ! ELE SERÁ ETERNAMENTE LEMBRADO COMO O PIOR PRESIDENTE DA HISTÓRIA DO BRASIL REPÚBLICA !
 https://t.co/XepdHwR7Z3"
18,1447629280935096335,1540792840116178945,2022-06-25,BOLSONARO OCUPARÁ UMA CELA OU NO BANGU OU NA PAPUDA ! https://t.co/OTWNAXSGTZ
19,1447629280935096335,1540790885323079680,2022-06-25,DE TODOS OS MINISTROS DO STF O BARROSO É O ÚNICO QUE BATE DE FRENTE COM SEUS PARES ! SINÔNIMO DE HONRADEZ E  ELEGÂNCIA EM SUAS PALAVRAS SEMPRE DITAS EM DEFESA DA DEMOCRACIA ! https://t.co/MvEbllsxDk
20,1447629280935096335,1540763611844444161,2022-06-25,BEM ASSIM ! LULA É SIM O MAIOR LARÁPIO DA HISTÓRIA DO BRASIL REPÚBLICA ! BOLSONARO É TROMBADINHA PERTO DELE ! https://t.co/ZRnofehdBs
21,272000243,1540757865417146368,2022-06-25,"Feijoada com pagode lapela galpão em São Miguel Paulista, Sao Paulo, Brazil https://t.co/mIHV4BX8B7"
22,1447629280935096335,1540740285701001216,2022-06-25,"A BOSTA FEDEU ! 
NO MEU GOVERNO NÃO TEM CORRUPÇÃO 🤣🤣🤣🤣🤣🤣🤣🤣🤣🤣🤣🤣🤣🤣 MISERICÓRDIA ! BOLSONARO SE FUDEU ! ACHARAM O FIO DA MEADA AGORA É SÓ PUXAR O RESTO !
CHEGO A CONCLUSÃO QUE NÃO HÁ NESTE BRASIL UM SÓ POLÍTICO HONESTO !
SÓ DÁ LADRÃO !"
23,1064167013327740928,1540732396903038976,2022-06-25,"Quando vc curte 3 fotos do seu alvo

E a pessoa flerta de volta https://t.co/lwkVushbkh"
24,1447629280935096335,1540691997039636485,2022-06-25,LULA É O MAIOR LADRÃO DE TODOS OS TEMPOS ! https://t.co/jkYhsSKUOz
25,402688868,1540690385588174853,2022-06-25,Jonas! em Igreja Internacional Da Graça De Deus Av Marechal Tito N 921 https://t.co/8EGKF9UUyJ
