,author_id,tweet_id,created_at,text
0,155278789,1566563691461738496,2022-09-04,"I'm one of one, I'm number one, I'm the only one… I’m too classy for this world! 😎💥 em Mariporã https://t.co/1n45NYH8Su"
1,1447629280935096335,1566533542611386377,2022-09-04,UMA GRANDE INJUSTIÇA PARA COM ESSA CLASSE TÃO TRABALHADORA ! UMA PENA EXCELENTÍSSIMO DR BARROSO ! https://t.co/37wLTXaIjI
2,1447629280935096335,1566486274457976833,2022-09-04,A REDE GLOBO DE TELEVISÃO TEM VERGONHA NA CARA DE PASSAR ESSA PORCARIA DE PIPOCA DA IVETE NAS TARDES DE DOMINGO ! UMA GRANDE E VERDADEIRA BOSTA !
3,71674128,1566442318051549184,2022-09-04,Aí o trem está na linha 12-Safari e pensa que está na linha 7-Ruim kkkk em Estação Jardim Helena-Vila Mara https://t.co/IIfHc6ZI1d
4,46538982,1566424299803754496,2022-09-04,"Comidas tão bonitas que parecem você!
Esse arroz doce ficou maravilhoso! Acertei em cheio dessa vez! #Ficou_uma_delicia_eu_que_fiz em Vila Curuçá https://t.co/TLxfkNhwZi"
5,165065280,1566421020164112385,2022-09-04,Acabou de publicar uma foto em Ciclovia Pq. Jacuí - Pq. Ecólogico https://t.co/JFPgtCB0Tt
6,165065280,1566413367694315523,2022-09-04,Acabou de publicar uma foto em Ciclovia Pq. Jacuí - Pq. Ecólogico https://t.co/ouLqJcWth7
7,1518908815009329156,1566085227000242176,2022-09-03,"CANAL AME-BR TV CONVIDA.
PEGADA MORUMBIZINHO MOTO CLUBE.
04/09/2022 - SEDE NACIONAL.
VAMOS QUE VAMOS JUNTOS E MISTURADOS. em Morumbizinho Moto Clube https://t.co/EFVDbq5hnr"
8,1447629280935096335,1565849734933319680,2022-09-02,"A ESQUERDA, OS ESQUERDOPATAS, O LULA E SEUS ASSECLAS SÃO TUDO UMA MERDA SÓ ! QUER VOLTAR A CENA DO CRIME !"
9,1487092624808988674,1565768670634299392,2022-09-02,Alguém aí curte chu😋par com carinho😈🍆🔥🔥🔥🔥🔥🔥🔥🔥 https://t.co/9TNAbChNJl
10,156724552,1565721849828450306,2022-09-02,Acabou de publicar uma foto em IFC JIU JITSU https://t.co/AA76X7JGJ5
11,1518908815009329156,1565659846170578944,2022-09-02,Acabou de publicar uma foto em Morumbizinho Moto Clube https://t.co/MVXyPXq7J4
12,155278789,1565478061390299137,2022-09-01,"I'm one of one, I'm number one, I'm the only one… I'm too classy for this world! 😎💥 em Mariporã https://t.co/67XuMYJD8P"
13,327175781,1565430109074608137,2022-09-01,"Parabéns @corinthians ❤
112 anos de amor, história, sofrimento e glórias ...Isso é ser Corinthians 🏴🏳

#timao112 #Corinthians112 #parabéns #Coringão #VaiCorinthians #timedopovo #sccp #1910 #112anos https://t.co/Go1NhMbU2S"
14,67534849,1565368141294837760,2022-09-01,"Acabou de publicar uma foto em São Miguel Paulista, Sao Paulo, Brazil https://t.co/yHkhskIQUs"
15,423635618,1565306525941436419,2022-09-01,Acabou de publicar uma foto em Igreja Evangélica das Nações - IEN https://t.co/POauatyIPk
16,148645453,1565133311357452289,2022-09-01,Just posted a photo @ A&amp;L Store https://t.co/YOLJ27s9Sj
17,156724552,1565010664929861635,2022-08-31,"Nesses nós confiamos!
@mariolacerda.sp 
@alexmanente
@rodrigogarciaoficial
@simonetebet em IFC JIU JITSU https://t.co/oV9G8fldhH"
18,893702551526354944,1565003985278443521,2022-08-31,vibrando positividade https://t.co/3bGgy8nnEV
19,1447629280935096335,1564995197511106562,2022-08-31,🤣🤣🤣🤣🤣🤣🤣🤣🤣🤣🤣🤣🤣🤣 SÓ NÃO CRUZA O CAMINHO DELE QUE ELE TE CHUTA kkkkkkk https://t.co/GWNhHFQXQB
20,1447629280935096335,1564994774838427648,2022-08-31,COM LULA E TUDO PURA SACANAGEM ! https://t.co/A7lFRKE6Rh
21,1214327059637518341,1564989873378959360,2022-08-31,Acabou de publicar uma foto em Rua Silveira Da Mota https://t.co/kYScov2Q6Y
22,1518908815009329156,1564710072412172288,2022-08-30,Acabou de publicar uma foto em Morumbizinho Moto Clube https://t.co/0K8NhEROKO
23,2443561397,1564668732567597056,2022-08-30,"Tô sozinho na minha Luta, quando eu tiver colhendo meus fruto quero tá da mesma forma..🤝🏼☯️ em São Miguel Paulista, Sao Paulo, Brazil https://t.co/Pcitxx4w0E"
24,1447629280935096335,1564647415214383104,2022-08-30,DESSE JEITO ! ELE PERDE A LINHA 🤣🤣🤣🤣🤣🤣🤣🤣 https://t.co/XbtBVkrnZT
25,1447629280935096335,1564633828081258499,2022-08-30,https://t.co/K7X7GoBpR2
26,423635618,1564584424964071428,2022-08-30,Acabou de publicar uma foto em Igreja Evangélica das Nações - IEN https://t.co/bo4DsmHvTp
