,author_id,tweet_id,created_at,text
0,1635350764431220760,1635419689047429122,2023-03-13,Futebol é arte https://t.co/pl0eOO07nv
1,1633584198719029249,1635179305188855808,2023-03-13,"Vai parti pro baile, tragado de #nike do jeitinho que elas gostam kk 🤪🤪 https://t.co/NyttKuFWgT"
2,37035780,1635095802749042689,2023-03-13,Drinking a Heineken by @heineken @ Pizzaria Central — https://t.co/XX1IPFiCpQ
3,4492579047,1635067596633706496,2023-03-12,@correio Por que incluir os funcionários públicos nesse programa?
4,1463559239763468292,1633804516838580226,2023-03-09,@CETSP_ colégio unicsul  tá difícil transporte escolar para na faixa Escola carro parando até em faixa de pedestre até carro de alto Escola em suma da faixa de pedestre acabou o respeito https://t.co/egOkM5ZvN5
