,author_id,tweet_id,created_at,text
0,2306707293,1549179080691441664,2022-07-18,"Rosalía es una cantante de reggaeton española, que es muy conocida en Latinoamérica por haber cantado con otros cantantes famosos
.
.
#reggaeton #reggaetón #rosalia #rosalía #rosaliabrasil em Pinheiros https://t.co/i7qyAXuncB"
1,1488644174450761735,1549177139974602754,2022-07-18,Café de vó 🤎 https://t.co/1eCta6ILfa
2,438562024,1549173677371138050,2022-07-18,@tropicaos 💣 em Fatiado Discos e Cervejas Especiais https://t.co/O8WN4dviwd
3,1224391448587644929,1549162003394076676,2022-07-18,Onde o filho chora e a mãe não vê https://t.co/AJK5c9TbAG
4,100839060,1549151882282962944,2022-07-18,1st half of july 🫶🫠🥰👩🏻‍❤️‍👨🏻💖🎂🥳🍔💕🐒♋❤️ @ Se Sentindo Apaixonada E Feliz https://t.co/ZU7NSFH1bk
5,2364794100,1549150021936992257,2022-07-18,O primeiro passo rumo a DEUTSCHLAND! Agora rumo ao B2 ♥️ @ Goethe-Institut São Paulo https://t.co/yanhBzWCtl
6,49500313,1549144638270935042,2022-07-18,Acabou de publicar uma foto em Beco do Bartman https://t.co/u3lrRMGNSU
7,49500313,1549144035268386817,2022-07-18,Acabou de publicar uma foto em Beco do Bartman https://t.co/CXmfZUnfH8
8,1052168110801899521,1549143591167164416,2022-07-18,👀 https://t.co/ewEja01V4U
9,3047685931,1549136256927518721,2022-07-18,Acabou de publicar uma foto em IN Jackson Nunes São Paulo https://t.co/6BnxUVPquO
10,137942699,1549135816877809668,2022-07-18,"Família @facialteambrasil Celebrando mais uma primavera, aniversário da @linndaquebrada 
Muitos anos de vida amigaaaaaa
Nossa tarde foi linda 
@drthiagotenorio @dramayaranogueira @carolmarrareal @tdetravesti ❤️ https://t.co/8Vxd6ADqju"
11,3047685931,1549135522324516864,2022-07-18,Acabou de publicar uma foto em IN Jackson Nunes São Paulo https://t.co/v2i3ke2TLe
12,1458366603867918341,1549130111416401921,2022-07-18,#hairycock #pentelhudo #peludo https://t.co/MRGq045Bet
13,76742645,1549110940917972992,2022-07-18,"@leandroruschel Seja honesto com quem te segue disseminador de mentiras. O Ministro está suspendendo posts mentirosos que vocês, da corja abjeta e sebosa da direita pútrida, são useiros e vezeiros em propagar."
14,1476015440430309378,1549107850617802754,2022-07-18,Voltando às aulas por aqui 💗 https://t.co/NL4VI20o5H
15,21415271,1549106536336789506,2022-07-18,"Forgotten Boys é a maior banda brasileira. E quem discordar está redondamente errado.

#forgottenboys em FFFront https://t.co/1EnPBS5MH9"
16,42518664,1549100265999159296,2022-07-18,"@DataKroll @canalcomixzone Me convenceu nesse tweet. Comprei os dois. Deve chegar amanhã. 
Gosto muito de Deus em Pessoa dele, mas aderi ao que o Thiago comentou e não sei praticamente nada sobre esse quadrinho.
Vamos ver o que me espera 🤗"
17,3047685931,1549096809703690240,2022-07-18,Acabou de publicar uma foto em IN Jackson Nunes São Paulo https://t.co/PsVz0i76p1
18,24956368,1549084152720343041,2022-07-18,"Coisa linda de viver! 

💛💛 em Fau USP São Paulo https://t.co/YgNpiK1lXq"
19,24956368,1549083735458385920,2022-07-18,"Tava voltando pro trabalho, ado olho pro outro lado da rua e vejo esse ipê lindão.  Claro que tive que atravessar a rua pra tirar uma foto. 💛 em Fau USP São Paulo https://t.co/5wF1BnFvWC"
20,168489181,1549071283069255680,2022-07-18,"Reforma do Caraí em cima , ninguém merece, 😭😭😭 #reforma #barulho #folga #caraí 😭😭😭 https://t.co/lzmMZCbHDy"
21,719130551,1549056338407198726,2022-07-18,"Mais uma noite com esses félas e só resenha hahahaha 

🥳🥳🥳 em Boteco Todos os Santos https://t.co/3leQ67t6ga"
22,42881764,1549039320773836800,2022-07-18,Acabou de publicar uma foto em São Paulo - Brasil https://t.co/VBXRd8Rbht
23,549656061,1549031679288901632,2022-07-18,Acabou de publicar uma foto em Mg Hair Design https://t.co/5siTrMZY5o
24,2306707293,1549027171620077568,2022-07-18,Acabou de publicar uma foto em Pinheiros https://t.co/RZxfetpScN
25,1103370507070726144,1549018855208542208,2022-07-18,"Até os erros já parecem ter sentido...

caminhada num frio de Sampa só com Ana nesses tempos bicudos...

#CaminhsdaMatinal 
#InvernoPaulistano 
#DoisBicudos
#AnaCarolina em Selva De Pedra https://t.co/RVD2JPCJMO"
26,1506435593160515584,1549017868511203329,2022-07-18,Acabou de publicar uma foto em Fibra Design https://t.co/vCel9DSBpq
27,863820587180883968,1549016803447390208,2022-07-18,Tesao esta explodindo nas calca 👉🏻👌🏻😱🚀 https://t.co/q6wpgF9nCD
28,1532878518631251968,1549009681846308864,2022-07-18,Acabou de publicar uma foto em Zona Oeste de São Paulo https://t.co/F3D5kuKzd7
29,2270187357,1549005710553485313,2022-07-18,Acabou de publicar uma foto em Mg Hair Design https://t.co/rVs8YytvO2
30,2765176287,1548960440625102848,2022-07-18,Just posted a photo @ Vila Madalena São Paulo - SP https://t.co/IhlhDHPT5D
31,46779569,1548869369496801282,2022-07-18,25 da novinha https://t.co/PXCImD33jr
32,15430166,1548855673047351306,2022-07-18,@longajornadateatro 🎭 em TUCA - Teatro da Pontifícia Universidade Católica de São Paulo https://t.co/Ys2hl9X9sM
33,548474899,1548849374033334273,2022-07-18,🤍🤎 em Butantã https://t.co/Faa5eYZOjV
34,67093822,1548839051393998853,2022-07-18,"Put blue tones in your week!
Encontre toda a linha de camisas Sergio K. Winter '22 em https://t.co/LVsNWI6lnP
#sergiok #camisas #stripes #winter22 #casual #inverno #algodão em Sergio K https://t.co/vygN3eunz3"
35,15329559,1548836676465819650,2022-07-18,#evita #evitaopenair 🇦🇷🇧🇷 em EVITA Open Air https://t.co/6bwmafJzjT
36,106277093,1548823454962556928,2022-07-18,"Esse fds tive um dos momentos mais incríveis de amor que aqueceu meu coração, daqueles que renova a energia ✨

Poder levar minha família para ver esse musical lindo q é EVITA e apresentar a musa @AmandaDoring q me inspira foi algo incrível e q deixou meu coração tão feliz! 💙✨ https://t.co/mY0tvBm0NM"
37,1498106763945648130,1548815942775357440,2022-07-17,🥹 https://t.co/ZgjBgH2lUx
38,15430166,1548815758045728770,2022-07-17,"“Longa jornada” (@ TUCA - Teatro da Universidade Católica de São Paulo in São Paulo, SP) https://t.co/xbOlKV3dyk https://t.co/ntl0aQffJY"
39,1103370507070726144,1548805098272428035,2022-07-17,"Hoje são 27 anos do Lucas nessa nossa caminhada...👣👣👣

Privilégio de irmão afilhado eterno Luquinhas....

#BdayLucas
#ReuniaoemFamilia
#InvernoPaulistano em Selva De Pedra https://t.co/NIwNOaSvSM"
40,836265813728444417,1548795799282262019,2022-07-17,"Nesse dia eu tava lindo, mas só lembrei-me tirar foto na madrugada, depois de ter me estatelado no chão 😍 em Hospital das Clínicas da FMUSP https://t.co/6v7XKII7xj"
41,41360063,1548795563503755264,2022-07-17,"I'm at Havanna Café in São Paulo, SP https://t.co/wCLfiyBGX2"
42,2593187235,1548788408474034178,2022-07-17,Drinking an Experimental # 0622 by Koala San Brew at @eapsp — https://t.co/xTu7sxIqty
43,2593187235,1548788392011464706,2022-07-17,Drinking a Silêncio Cósmico by Captain Brew at @eapsp — https://t.co/hkG2aVEIPP
44,2593187235,1548781591278804994,2022-07-17,Drinking a Coconut Gringo by @cervejariadogma at @eapsp — https://t.co/9LU8jTor7K
45,2593187235,1548781355844124673,2022-07-17,Drinking a Baltic Old Fashioned by Avós Cerveja Artesanal at @eapsp — https://t.co/KpQAxHj83y
46,53748964,1548779754102439939,2022-07-17,É daqui a pouco @originalsant e @lpbeatzz e nois tá como...no aguardooo. Rap nacional é a nossa cara !!! https://t.co/swetG3ejRi
47,1103370507070726144,1548777598045638660,2022-07-17,"Sou o certo, sou o errado, sou o que divide
O que não tem duas partes, na verdade existe...
(um mal desnecessário...)
Só uma certeza...

#FORABOLSONARO🤡
#ELENAO🔫 
#ELENUNCA🤡 em Selva De Pedra https://t.co/AMul9VQHxH"
48,1331275738507513857,1548776889233416197,2022-07-17,Seja forte. Aguente firme. Caia. Levante-se. Erga a cabeça. E continue sempre seguindo em frente. Você é mais forte do que pensa. em Praça Horacio Sabino https://t.co/isxNcydZXo
49,2593187235,1548776617366929411,2022-07-17,Drinking an Arapuca by La Caminera Cervejaria at @eapsp — https://t.co/XCg5wtJ4U0
50,2593187235,1548776324206051334,2022-07-17,Drinking a Spirit Crusher by Cervejaria Augustinus at @eapsp — https://t.co/oC9kmEMrMs
51,3057300731,1548773133523554304,2022-07-17,🥶🇧🇷❤️ em Parque Villa-Lobos https://t.co/SgbbUWc0m4
52,915996647456411649,1548768598721699841,2022-07-17,Eu amo uma galeria de arte a céu aberto 🤪 https://t.co/SBSpMr6kuv
53,88919496,1548763311998730242,2022-07-17,Don’t cry for me Argentina! em EVITA Open Air https://t.co/SHC6lqOaNp
54,2593187235,1548761063751127040,2022-07-17,Drinking an O DIABO VESTE PRETO by Cervejaria Demonho at @eapsp — https://t.co/LemMkspU9q
55,102249429,1548755415541891072,2022-07-17,"veio ai 

@carolmoreira3 
@mabebonafe 
@moduspod https://t.co/6NHVDcwigj"
56,2306707293,1548754057099083779,2022-07-17,Acabou de publicar uma foto em Carioca Club Pinheiros https://t.co/M4FY1fL6Zd
57,1445204575053561861,1548753171182387206,2022-07-17,Estou amando fazer meus rolezinhos por sp sozinha 🥰 Rua Girassol rendeu hoje brusinhas e lanchos 🙃💚 https://t.co/aEvZrOD1Fe
58,18293936,1548750998201544704,2022-07-17,Sunday afternoon em Mural Casa de Cultura https://t.co/xiLLyWKfIC
59,77919101,1548747875634626565,2022-07-17,Montagem da Roda gigante de São Paulo.. em Parque Villa-Lobos https://t.co/1I4SFi5liX
60,115259320,1548746765721026560,2022-07-17,"I'm at Celeiro Quintal in São Paulo, SP https://t.co/8d7NSHJXCG"
61,14328502,1548745915980304384,2022-07-17,Drinking a You Know My Name BA 2022 by Shakal at @eapsp — https://t.co/2lyin8qzZL
62,2593187235,1548742103395622916,2022-07-17,Drinking a Robust Porter Com Café Catuaí Amarelo by Locals Only Brewing Co. at @eapsp — https://t.co/n0autjVTgf
63,941526010297757696,1548741949485592576,2022-07-17,a luz da oscar freire te deixa chique em Pinheiros https://t.co/Llw5rUxLD3
64,2593187235,1548741585596203011,2022-07-17,Drinking a Settle For Nothing by Maali Brewing Co. at @eapsp — https://t.co/IVkP192UWp
65,3047685931,1548734882381283329,2022-07-17,Acabou de publicar uma foto em IN Jackson Nunes São Paulo https://t.co/MJ87nB9c2l
66,3047685931,1548733632382205956,2022-07-17,Acabou de publicar uma foto em IN Jackson Nunes São Paulo https://t.co/Jd9DrxACgw
67,2593187235,1548727254238248962,2022-07-17,Drinking a DOUBLE BLACK IPA by Molinarius Brewing Co. at @eapsp — https://t.co/0XfHfyKxfK
68,221759428,1548726729363054594,2022-07-17,Drinking a Saimiri by Three Monkeys Beer at @eapsp — https://t.co/K6aBSB3Quw
69,97865823,1548718901961408512,2022-07-17,Acabou de publicar uma foto em Pastifício Primo https://t.co/AsAi1qU9o8
70,719130551,1548713158746972161,2022-07-17,Vou falar o que? 🤣🤣 em Casa Tarumã https://t.co/LEV6KDqyz9
71,221759428,1548713153709707264,2022-07-17,Drinking a DOUBLE BLACK IPA by Molinarius Brewing Co. at @eapsp — https://t.co/RgP9BSEfIu
72,3837107379,1548706455926280193,2022-07-17,Fotinhas de ontem https://t.co/UOfVc2n3R3
73,221759428,1548703358273429505,2022-07-17,Drinking a DOUBLE BLACK IPA by Molinarius Brewing Co. at @eapsp — https://t.co/Am8oRLh4B6
74,1033038950020079616,1548696468063756293,2022-07-17,16.07.22 https://t.co/tgy50LnuTv
75,51226911,1548690000367292416,2022-07-17,"Hoje é domingo, dia de pedir por quem precisa, pela família e amigos e, principalmente, agradecer todas as bênçãos 🙏🏻 https://t.co/2yeTCUi8jJ"
76,37459265,1548688738758414337,2022-07-17,Nosso espetacular PENNE ALELUIA com camarões e alcachofras. Neste fds. 11 98802-0428 em Nello's Cantina e Pizzaria https://t.co/MCXF5X0w7F
77,18293936,1548684670828773378,2022-07-17,Brunch em https://t.co/nmueP4p3fo https://t.co/9MQb41m9Vt
78,33249379,1548682517024329729,2022-07-17,Eita brunch... https://t.co/K1i9FwDC7M
79,1506435593160515584,1548667439659061248,2022-07-17,Acabou de publicar uma foto em Fibra Design https://t.co/f5Jx0timlJ
80,251843010,1548664432649281541,2022-07-17,"Café da manhã do jovem adulto zona oester = avocado toast, café preto e Tim Bernardes e umas plantas ao fundo! 

O que eu me tornei? https://t.co/Xcg34pBiA2"
81,1385468149,1548657487368392705,2022-07-17,cosmo e wanda em lugares aleatórios https://t.co/rYTqCxJQqK
82,33249379,1548650341763276803,2022-07-17,CHEERS !!!! 🍹🍸🥃 https://t.co/nk2jNdfFdu
83,19760192,1548647506996781056,2022-07-17,"LANÇAMENTO: “Companhia Aberta: objeto e estrutura da disciplina jurídica”, de Fabiana Mendonça Martins de Almeida (prefácio de Eduardo Secchi Munhoz). https://t.co/loa1GuYLNz https://t.co/s0rj0z1SWV"
84,19760192,1548644118292828161,2022-07-17,🌤☕️ https://t.co/BAC9axgEgK
85,52833087,1548641858745679872,2022-07-17,"I'm at Piccoli Dolce e Caffè in São Paulo, SP https://t.co/vwXnWsN4aD"
86,27307810,1548635971532595201,2022-07-17,Os sonhos não envelhecem. em Casa Natura Musical https://t.co/BJuTiKz7JH
87,1449752296930349060,1548632055705214977,2022-07-17,Agradecer sempre ⛪🙏🏾🙌🏾 https://t.co/fumKHxovdG
88,1103370507070726144,1548629945722732548,2022-07-17,"... hoje tenho pressa...

nem esperei o dia clarear.

#InvernoPaulistano
#MalNecessario
#JesuitaBarbosa em Selva De Pedra https://t.co/GMRN7cYycf"
89,102249429,1548621084693598209,2022-07-17,"o caminho percorrido para ser um dos primeiros a chegar na livraria da vila. 

agora é só aguardar, pegar a senha e voltar mais tarde pra, finalmente, pegar o autógrafo da @mabebonafe e da @carolmoreira3, no meu exemplar do @moduspod https://t.co/GctYi3Rzq4"
90,47736086,1548613143651287041,2022-07-17,"Amizade, nem mesmo a força do tempo irá destruir... https://t.co/8Q6NkMj6TX"
91,3047685931,1548541990069014528,2022-07-17,"Bote um coração aqui na legenda se
você gostaria e aceitaria passar por transformações Con
@braehaircare como essa princesa passou em IN Jackson Nunes São Paulo https://t.co/Uh55eDG4qa"
92,1522198957,1548514267749666816,2022-07-17,Fiscalização de Maus Tratos a Animais no Butantã. 02 cães presos na corrente. Um Pitbull e um Pastor Alemão. 🚓🚓🚓🚓🚓🚓🚓🚓🚓🚓🚓🚓🚓🚓🚓🚓🚓🚓🚓 em Butantã https://t.co/bUFZFhv2sZ
93,2306707293,1548502627100418053,2022-07-17,#trabalhos #trabalhoacademico #trabalhosacademicos #artigocientifico #tcc #tese #tesededoutorado #dissertaçãodemestrado #trabalhodeuniversidade #universitarios #faculdade #faculdadedadepressao em Pinheiros https://t.co/wQeDrH1Rzt
94,1143606682649583616,1548498778495131653,2022-07-17,Ah...o tempo passa... em Theo de Sousa Studio https://t.co/nfGLeauAm1
95,549656061,1548492071165538307,2022-07-17,Acabou de publicar uma foto em Mg Hair Design https://t.co/mOSnISt6E5
96,838833999334227968,1548484382888865794,2022-07-17,"Bora fazer compras com o @esquadraodamoda ?
Liga lá no @sbt em Oscar Freire SP https://t.co/EL7fDmbtRV"
97,52372877,1548480172298366979,2022-07-17,Acabou de publicar um vídeo em Chá de Beleza https://t.co/6w1lIIcoBM
98,983761072644648960,1548478448103858178,2022-07-17,"Eu ia postar foto, mas eu gosto da humilhação @SimoneBispo @eagorajana @crisguterress 

@casanaturamus https://t.co/nBSGN3sJ1V"
99,221759428,1548476596947865603,2022-07-17,Drinking a Pilsner Urquell by @prazdroj1 at @eapsp — https://t.co/HNu6zd9QcN
100,10901332,1548471997042085888,2022-07-17,Tinha esquecido de como eu gosto do Finnegan's
101,37459265,1548469741613826049,2022-07-17,OSSOBUCO DO NELLO'S NESTE FDS! 11 3082-4365 em Nello's Cantina e Pizzaria https://t.co/I5R5PcLt6l
102,21415271,1548468167734751233,2022-07-17,Forgotten Boys (@ FFFront in São Paulo) https://t.co/aAePj2V0Ex
103,133689922,1548467461242032133,2022-07-17,"I'm at Tatu Bola in São Paulo, SP https://t.co/ywjgUSR2JW"
104,2885097263,1548446782761234442,2022-07-16,Vai ser foda pra caramba!! https://t.co/JEKsQI7D8u
105,1389835867422957568,1548443548625747976,2022-07-16,É sobre saber que em algum lugar alguém zela por mim... em Vila Madalena https://t.co/D8895WgiJX
106,2533118216,1548436151190450177,2022-07-16,"Sábadoou familia ♥️🙏

Quem vai ficar em casa da um salve kk 👇 em Zona Leste de São Paulo https://t.co/hpfytfKaey"
107,67093822,1548427462136041480,2022-07-16,"Nova camisa Moletom Linho Sarjada agrega originalidade, além de dar um ar descolado ao look.
Acesse agora https://t.co/LVsNWInWfn e compre a sua!
#moletom #sergiok #winter #textura #inverno #casual em Sergio K https://t.co/qqrd3uBxdi"
108,45477829,1548424085977255938,2022-07-16,Acabou de publicar uma foto em Laura Alzueta https://t.co/suQcLnjZXi
109,10430782,1548423557104799746,2022-07-16,#beer #factory #goose #monochromatic #blackandwhite @ Goose Island Brewhouse https://t.co/VbTDJfNm0k
110,47340159,1548410345080860672,2022-07-16,cheguei no bar e tá tocando Partition 🤧
111,461491382,1548404876572364802,2022-07-16,janete em sp 🫶 em Parque Villa-Lobos https://t.co/ydyfVxNtfg
112,1428300327032442883,1548400510679412738,2022-07-16,Boa tarde! 🥰 https://t.co/HuFYF45MEw
113,9624062,1548394114663604225,2022-07-16,Pedalando II em Parque Villa-Lobos https://t.co/5IuJBd3vJI
114,162451356,1548390779613130753,2022-07-16,Depois de anos ❤️❤️❤️ em A Ventana https://t.co/HmjnhTZ3ul
115,29622054,1548388658100572160,2022-07-16,"I'm at Beco do Batman in São Paulo, SP https://t.co/EcOjHD9fNP"
116,29622054,1548388491129548804,2022-07-16,"I'm at @CatracaLivre in São Paulo, SP https://t.co/8rY2hB7vAx"
117,177743869,1548388319087628292,2022-07-16,O AMOR ❤️❤️❤️ ESTA NO AR ❤️❤️❤️ em Beco do Bartman https://t.co/lgpmlXYe8Q
118,177743869,1548386804029476870,2022-07-16,VIVEMOS UM MUNDO MAIS COLORIDO COM UMA ESPERANÇA DE MAIS AMOR ❤️❤️❤️❤️ em Beco do Bartman https://t.co/2U5dH2rs8a
119,95657591,1548383359608401924,2022-07-16,"@afrodro1d, @mateusmga e ariel tão no veneno 🔥🔥🔥 https://t.co/bwIP0bOS95"
120,579733019,1548377573167534084,2022-07-16,"Sábado de sol, peguei um caminhão

#gays
#viados
#bichonas
#viadons https://t.co/dYlWSIF7oG"
121,29622054,1548373947707584516,2022-07-16,"I'm at Satú in São Paulo, SP https://t.co/Nsu7XfmBQA"
122,29622054,1548373736151142402,2022-07-16,"I'm at La Nonna di Lucca in São Paulo, SP https://t.co/cdcU2R22mn"
123,62385164,1548373198227484673,2022-07-16,Acabou de publicar uma foto em Aguzzo Cucina https://t.co/0jNyJH9Gn8
124,60733150,1548372159684177922,2022-07-16,Mude   com entrada  parcelada em até 49   vez..tel.11976903681 em Butantã (São Paulo Metro) https://t.co/ZtQvzHK8je
125,2270187357,1548367313006501889,2022-07-16,Acabou de publicar uma foto em Mg Hair Design https://t.co/AyhCOYhnoj
126,27991603,1548355111948193793,2022-07-16,Acabou de publicar uma foto em Galeria Café SP https://t.co/qePRkqYhby
127,2188643628,1548354241860734978,2022-07-16,Selva de pedra em Beco Do Batman https://t.co/Toy7tLnetS
128,96220508,1548351601215016967,2022-07-16,O dia que resolvi beber a minha intuição https://t.co/KzPDFLGFdA
129,181308673,1548347952405495810,2022-07-16,Saudades dos eventos da @EmbSantos_SP
130,82773144,1548323958176395266,2022-07-16,Acabou de publicar uma foto em Milo Garage https://t.co/kt9EcRedFB
131,719130551,1548304066534510597,2022-07-16,Só alegria 💙🤣 em Casa Tarumã https://t.co/IQqsuCssrr
132,3174510621,1548286934279000065,2022-07-16,Acabou de publicar uma foto em Usp https://t.co/LJxEsQH2gx
133,3642806663,1548284562257502210,2022-07-16,"Sobre eu ter tido o role mas incrível de todos ontem, e  ter estado no meu pico de felicidade que eu nem lembro quando foi a última vez que estive tão feliz assim! Simplesmente a noite mais feliz da minha vida!!!!!!! https://t.co/bnkpUpPdzP"
134,182454164,1548270545740783617,2022-07-16,"Um bom dia!
Abrir a janela da cozinha e ver esse lindo Ipê rosa com uma tímida floração, porém  lindo não tem preço. 
#umbomdia #bomdia🌞 #ipê #iperoxo #iperosa em Perdizes, São Paulo, Brasil https://t.co/oOietDdZwl"
135,14357628,1548267540530401281,2022-07-16,"Pôr do sol de ontem ❤️
#pordosol #sunsetlovers #sunset em Perdizes, São Paulo, Brasil https://t.co/iD2b9iVANs"
136,2765176287,1548248026858237954,2022-07-16,Just posted a photo @ Vila Madalena São Paulo - SP https://t.co/qeMBTRd5fX
137,1463897153626066945,1548168104613539842,2022-07-16,🦋🌈💕🍀🌻❤️ https://t.co/lIbqtWUOWR
138,39328633,1548150379560312835,2022-07-16,GENTE!! Achei meu lugar no mundo https://t.co/KvJyVNd6UM
139,39328633,1548146377951047684,2022-07-16,Eu e minha cunhada querendo experimentar todos os drinks até o bar fechar 👀 https://t.co/Dgg39mNRvw
140,221759428,1548145681625333764,2022-07-16,#DMD #DMD2022 - Drinking a You Know My Name BA 2022 by Shakal at @eapsp  — https://t.co/Nt7F7ETHbL
141,221759428,1548145158880841729,2022-07-16,#DMD #DMD2022 - Drinking a Slushie DMD 22 by Cervejaria Escafandrista at @eapsp  — https://t.co/D25bHdppQt
142,39328633,1548142600695074816,2022-07-16,veio aí! 🌹 https://t.co/BRHucBAROh
143,1525444210807152642,1548135970658140162,2022-07-16,Acabou de publicar um vídeo em Lopes -  Consultoria Imobiliária https://t.co/IuaSlaEDwy
144,2593187235,1548128067284922372,2022-07-16,Drinking a Pão De Mel Amburana Barrel Aged by Trilha Cervejaria at @eapsp — https://t.co/GXz4vN0dj5
145,221759428,1548121531070365704,2022-07-16,#DMD #DMD2022 - Drinking a Pão De Mel Amburana Barrel Aged by Trilha Cervejaria at @eapsp  — https://t.co/S2ZVeHUOmO
146,221759428,1548121499306889216,2022-07-16,#DMD #DMD2022 - Drinking an EU MATEI O MAR MORTO by Under Tap Brewing Co at @eapsp  — https://t.co/qSfI2qBhW3
147,221759428,1548120762074030081,2022-07-16,#DMD #DMD2022 - Drinking  The Whole Brunch by Stormy Brewing Co. at @eapsp  — https://t.co/JApd1RsYKU
148,221759428,1548113717295861760,2022-07-16,#DMD #DMD2022 - Drinking a Tonka RIS by @7handsCervejari at @eapsp  — https://t.co/CPSucmrFRp
149,221759428,1548112682984738819,2022-07-16,#DMD #DMD2022 - Drinking a RESIST - Anti Imperial Stout Cumaru e Café by Marek Cervejaria Artesanal at @eapsp  — https://t.co/6n1dLpOWz4
150,14328502,1548110468429914113,2022-07-16,"Se é pra meter 10k, que seja com uma que atravessa todo o rolê incólume. 
Preferidas da casa!
#DMD2022
10k - Drinking a Nitro Cold Brew Coffee by @GuinnessIreland at @eapsp  — https://t.co/2W5w4anjQU"
151,14328502,1548109439487463424,2022-07-16,Drinking a Coconut Gringo by @cervejariadogma at @eapsp — https://t.co/YgALXqsbFU
152,14328502,1548108426064297984,2022-07-16,Drinking a Pão De Mel Amburana Barrel Aged by Trilha Cervejaria at @eapsp — https://t.co/cnA4tAajib
153,221759428,1548103119489208320,2022-07-16,#DMD #DMD2022 - Drinking a Dark Quantum Series RIS - Cacau E Amburana by Cervejaria Satélite at @eapsp  — https://t.co/rDrCySamVT
154,14328502,1548102717347733506,2022-07-16,Drinking a Ganache de Chocolate by Salvador Brewing Co. at @eapsp — https://t.co/iqDeDdk2Fi
155,221759428,1548102714478845958,2022-07-16,#DMD #DMD2022 - Drinking a Ganache de Chocolate by Salvador Brewing Co. at @eapsp  — https://t.co/lrzakXIMDO
156,221759428,1548102422131748866,2022-07-16,#DMD #DMD2022 - Drinking  The Other Side by @seasonsbeer at @eapsp  — https://t.co/omOld36x9b
157,3047685931,1548093064744357889,2022-07-15,Acabou de publicar uma foto em IN Jackson Nunes São Paulo https://t.co/kMoHJSUFKS
158,1531819312004071424,1548092180912173056,2022-07-15,Hoje a lua tá simplesmente fantástica #SaoPaulo #Lua #moon #fotografia #Fotografie https://t.co/4bgqsMZ57E
159,2593187235,1548087040826175488,2022-07-15,Drinking an All the Blend DMD 22 by Croma at @eapsp — https://t.co/pkZEulLpFr
160,2593187235,1548086567369027584,2022-07-15,Drinking an ICONic Darkness by Spartacus Brewing at @eapsp — https://t.co/Y9s9uUyLP5
161,14328502,1548077477909540864,2022-07-15,Drinking a Slushie DMD 22 by Cervejaria Escafandrista at @eapsp — https://t.co/yWFSaRcvF7
162,14328502,1548077202385694720,2022-07-15,Drinking  The Whole Brunch by Stormy Brewing Co. at @eapsp — https://t.co/j7oqESX5jZ
163,57521038,1548073880924745729,2022-07-15,"É @verocoquetelaria ! 

#tbtforadodia em Vero Coquetelaria e Cozinha https://t.co/yUEpklGNBJ"
164,14328502,1548073687483445248,2022-07-15,Drinking an Attack! (Tiramisu Stout) by Dude Brewing at @eapsp — https://t.co/9eDAID6Xnm
165,14328502,1548073469736194049,2022-07-15,Drinking a Melted Darkness by Cervejaria Fermi at @eapsp — https://t.co/Jj5enwAJoh
166,190088556,1548073009851682816,2022-07-15,Acabou de publicar uma foto em Metro Santo Amaro https://t.co/e1r9EOteGv
167,221759428,1548069425441517569,2022-07-15,#DMD #DMD2022 - Drinking a Melted Darkness by Cervejaria Fermi at @eapsp  — https://t.co/IpRkLvnTs0
168,221759428,1548068925958545408,2022-07-15,#DMD #DMD2022 - Drinking an Obskura by Cervejaria Prisma at @eapsp  — https://t.co/RiPxlo9B7Z
169,37571692,1548068503533395970,2022-07-15,Acabou de publicar uma foto em São Paulo - Brasil https://t.co/Zsbgb4HWDc
170,221759428,1548068415172005889,2022-07-15,#DMD #DMD2022 - Drinking a Black Hole Blueberry by Cervejaria Pineal at @eapsp  — https://t.co/IIt5DUOdz2
171,221759428,1548067693764325385,2022-07-15,#DMD #DMD2022 - Drinking a Robust Porter Com Café Catuaí Amarelo by Locals Only Brewing Co. at @eapsp  — https://t.co/JIAJ0zat9b
172,221759428,1548067409075920899,2022-07-15,#DMD #DMD2022 - Drinking an Arete - Tomo 3 by Spartacus Brewing at @eapsp  — https://t.co/tZ42pT9Ev9
173,14328502,1548065566136492036,2022-07-15,Drinking an Arete - Tomo 3 by Spartacus Brewing at @eapsp — https://t.co/xEKYusy3e4
174,838833999334227968,1548064699215802374,2022-07-15,Acabou de publicar uma foto em Paróquia Nossa Senhora do Brasil https://t.co/sDpa0yAIel
175,337596942,1548064561571307521,2022-07-15,"Evita open air (@ Parque Villa-Lobos in São Paulo, SP) https://t.co/bfSbXpFcMb"
176,150242761,1548062114022973441,2022-07-15,Acabou de publicar uma foto em Cross Networking https://t.co/A0MzelHsQb
