,author_id,tweet_id,created_at,text
0,2306707293,1529243888401231873,2022-05-24,#visibilidade #pan #pansexual #pansexualpride #pansexuals #lgbtq🌈 #lgbtbrasil #lgbtfobia em Pinheiros https://t.co/dmF9HsxCAf
1,1240520560033124352,1529232947546669058,2022-05-24,Acabou de publicar uma foto em Legends Music &amp; Bar https://t.co/6sv0FmAv67
2,2306707293,1529223691640492034,2022-05-24,Acabou de publicar uma foto em Pinheiros https://t.co/Dz54tuJWT1
3,73708099,1529219075699785731,2022-05-24,Tá frio....vamos de metrô #spapé #outono2022 #frio @metrospoficial #metro #sp #butterfly #city em Vila Madalena São Paulo - SP https://t.co/yUxEXiEt9Q
4,38700760,1529217344756916225,2022-05-24,E vamos em busca do Tetra! https://t.co/6Bwqi5qiFa
5,1308205864495591424,1529205275143675904,2022-05-24,Eu já disse que acho esse lugar mágico (hoje)? https://t.co/R6a5mFS8ez
6,15320258,1529187107071213570,2022-05-24,"Cerimônia de Homenagem à Professora Emérita, Professora Dra. Ana Mae Barbosa. (@ Departamento de Jornalismo e Editoração (CJE/ECA/USP) in São Paulo, SP) https://t.co/Eaqa5Dx4P9 https://t.co/Q5gLUNviuU"
7,363756106,1529180318330232834,2022-05-24,"Buffet de Massas Show, fabricação propria massas frescas. 11-94545-0445  #buffetmassas #buffetcostabrasil #chefdavicosta em Pinheiros, São Paulo https://t.co/806FN89u6u"
8,61001887,1529171626570530824,2022-05-24,"Dias de aprendizado, sobre o papel social da ciência, para além da prática acadêmica.
Sobre o processo de investigação, compartilhamento e intercâmbio de conhecimentos, de construção coletiva, ligação de saberes.
Mucho gusto! Gracias maestro @alafuente https://t.co/xhJX8XtQb0"
9,973894061965873152,1529171483246968834,2022-05-24,"Chegando em 10 min ao lado de @maripereira_j na ESPN4 com a COPA DA RAINHA 👑
#FutebolNaESPN"
10,3403772902,1529170565147373572,2022-05-24,"50 minutos esperando por uma consulta e a pessoa fala que sou a próxima. sim meu anjo, sou a próxima tem quase uma hora, o que isso significa na prática?"
11,42441379,1529169979609841664,2022-05-24,"I'm at Vila Madalena in São Paulo, SP https://t.co/Z7xLy8gSWf https://t.co/3wbKRgsec7"
12,183752983,1529167271687487497,2022-05-24,"Acabou de publicar uma foto em Perdizes, São Paulo, Brasil https://t.co/3Aixj56nQy"
13,226338570,1529166096003125249,2022-05-24,"Fiel Torcedor carregado, para Corinthians x América-MG. Bora pra mais um! Vamo aê!!! #VaiCorinthians 🏴🏳️✊🏼"
14,973894061965873152,1529149237258342400,2022-05-24,"Esperei muito por esse click com @rogeriovaughan . Que profissional impecável, colega incrível…sempre disposto a ajudar! Por um mundo 🌎 lotado de “Vaughan’s “ e pra não perder a viagem : VIIIIISSSCAAAA 😂🇪🇸❤️@laliga https://t.co/bTz7Zv5FZ5"
15,252593537,1529143301131145222,2022-05-24,Just posted a photo @ Deserto Do Atacama https://t.co/Fq9XMiMroE
16,1258121460335423489,1529135484311678976,2022-05-24,"Acabou de publicar um vídeo em Restaurante Arturito - Pinheiros, Sao Paulo https://t.co/YmHqIJvUpL"
17,437615886,1529127480916951042,2022-05-24,👀🧡🐾🐶#pipi#pipishitzu#pietra#minhapipi#meuamor#adotei#iloveshitzu#shitzulovers#dog#doglovers#pet#petlovers#laçosdapipi em Alto de Pinheiros https://t.co/edWmVrocNM
18,23961187,1529125185873379328,2022-05-24,Just posted a photo @ Madeleine Bar https://t.co/yuMWAaWAvb
19,1390028177523814401,1529120857812914176,2022-05-24,"Ontem na última plenária que participei no CRF antes da minha pré campanha, tivemos a presença do Deputado Federal @IvanValente, onde discutimos sobre vários projetos que estão tramitando no congresso nacional de interesse para a profissão, entre eles o piso nacional. https://t.co/IhJatVobjT"
20,15997446,1529114428448378881,2022-05-24,Lançamento! Ts5 foi atração do Estúdio Showlivre e o álbum já está disponível nas principais plataformas de streaming https://t.co/wRkdmbckcb e a apresentação no YouTube https://t.co/rl1FnRsaVZ 🎶 https://t.co/HdAL7mux8M
21,468543888,1529111945701232640,2022-05-24,"A Óbvia Contábil é a maior contabilidade digital do Brasil!
Acesse https://t.co/qEtPTg6qbq e saiba mais detalhes. 
#digitalmarketing #digitalinfluencer #diadosnamorados #contabilidadedigital #abrirempresa #amor https://t.co/VUsVqTggnY"
22,1087684449607794688,1529107331874684930,2022-05-24,🌳☀️🚲 https://t.co/Lflvb6Vo5z
23,2306707293,1529106969163878402,2022-05-24,Acabou de publicar uma foto em Pinheiros https://t.co/TrGGuUoviJ
24,165849510,1529093530706223111,2022-05-24,A praça por do sol daqui é um heliponto 🤦🏻‍♂️ @ Praça Por Do Sol https://t.co/58LthYgNL9
25,45477829,1529092672572514304,2022-05-24,Acabou de publicar uma foto em Laura Alzueta https://t.co/gD5rGujitZ
26,1103370507070726144,1529090814768553984,2022-05-24,"Não leve gato por lebre...

obra @roberto.parizotti 

#EleNao
#FORABOLSONARO 🤡 em Selva De Pedra https://t.co/wtxrsswvLw"
27,2306707293,1529084691839590402,2022-05-24,"O dia em que tomei minha primeira vacina contra a COVID-19, que irá fazer um ano no mês que vem
.
.
#vacina #vacinacãocovid #vacinejá #vacine #ᴠᴀᴄɪɴᴀᴘᴀʀᴀᴛᴏᴅᴏs em Pinheiros https://t.co/lv5eTRFbw9"
28,109049442,1529074556282892290,2022-05-24,"Quantos graus tá na sua cidade???
🥶🥶🥶.

#frioemsampa #saopaulo #sp #oscarfreire #pracima #djbrunopacheco #paxmachines em Oscar Freire SP https://t.co/VG1BcHc1gf"
29,240814091,1529041054636326913,2022-05-24,"Drop 🎬

#professorkauesimioni #educacaofisica #idosos #exerciciofisico #atividadefisica #motor #cognitivo #emoções #perdadepeso  #fadiga #sarcopenia #equilibrio #controlepostural #memoria #obesidade #hioertensaoarterial #diabetes #flexibilidade #tecnologia #realidadevirtual https://t.co/9tnQsW23tQ"
30,1343522240810377216,1529018908090433538,2022-05-24,Porra só queria que o tt me liberasse o cf
31,41958045,1528941075561340928,2022-05-24,Sempre bom estar com pessoas do bem! em Nelita Restaurant https://t.co/1YX4OPik70
32,41958045,1528940650699247616,2022-05-24,"Raras pessoas tem o dom de deixar marcas em nosso coração: @tassia_magalhaes e @danyel_steinle , vocês estão impressos no meu. Parabéns por este maravilhoso sonho chamado @nelita.restaurant em Nelita Restaurant https://t.co/BxlCNGSUfy"
33,1010916878661967874,1528929502314872834,2022-05-24,"Obrigado por tudo Sampa, você nunca erra! 🙏🏽 Ainda sinto saudades, porque uma semana foi pouco. Porém suficiente para recarregar!🔋 GRATO! ✨ https://t.co/AevtlTRNmO"
34,2893240085,1528922839285473280,2022-05-24,"Mas um pedal concluído ✅ só gratidão por estar rompendo meus limites 🙌🏼🚴🏻‍♂️ 
.
.
.
.

🚴💪🙌🏼🙌🏼 https://t.co/uVMJu31A5d"
35,56199419,1528913420275404802,2022-05-24,Tonkotsu do Naruto Ramen em Pinheiros. Ótimo #lamen para aquecer do frio. Ficou tentado? Dá um pulo no link para saber mais:https://t.co/VPn3UgRxyX https://t.co/Mor5Ay6BVl
36,67093822,1528913051830870016,2022-05-24,Acabou de publicar uma foto em Sergio K https://t.co/bxQnRGzjLT
37,1431131812001165314,1528906347961540613,2022-05-24,Acabou de publicar uma foto em Instituto Butantan https://t.co/BxjJSxjlSe
38,143373590,1528905745235906561,2022-05-24,"Una foto inesperada e improvisada

#sinfiltro #semfiltro #nofilter #atardecer #puestadesol #pordosol #sunset #pinheiros #saopaulo #sãopaulo #brasil #brazil en Pinheiros, São Paulo https://t.co/0whp1UIVqk"
39,312923675,1528880187382804480,2022-05-23,Dia de discutir o financiamento da educação https://t.co/IfrxAVrw2O
40,546230403,1528879902417723392,2022-05-23,Acabou de publicar uma foto em HIIT CLUB Health &amp; Fitness https://t.co/5KG7VAa6VA
41,1240520560033124352,1528878927816663041,2022-05-23,Acabou de publicar uma foto em Legends Music &amp; Bar https://t.co/bAX8njhkNA
42,602225458,1528876837392109570,2022-05-23,Acabou de publicar uma foto em Hospital das Clínicas da FMUSP https://t.co/RO6VR3BIyy
43,943643949708775424,1528857971232493569,2022-05-23,"pé no acelerador, sente a vida no máximo a cada segundo ❤️‍🔥✨ em NOLA BAR https://t.co/F0I7TSmoK6"
44,138812580,1528854660349833216,2022-05-23,Apaixonada 🧡✨ https://t.co/obW0skRE84
45,52625191,1528847143930318848,2022-05-23,Acabou de publicar uma foto em Carioca Club Pinheiros https://t.co/LyjiMxNtn4
46,72287523,1528845237333942275,2022-05-23,Como eu amo estudar na USP 💖 https://t.co/khFwwWZfkY
47,588664334,1528844821984690176,2022-05-23,Acabou de publicar uma foto em Tvz - Multishow https://t.co/xi8XnPNSBx
48,100560298,1528843374094082056,2022-05-23,Acabou de publicar um vídeo em Associação Atlética Acadêmica Oswaldo Cruz - AAAOC https://t.co/prR2e252Qo
49,719130551,1528842188985073664,2022-05-23,Acabou de publicar uma foto em Casa Tarumã https://t.co/KjseEUz4Wn
50,59157108,1528838817985314816,2022-05-23,Los Brabos :) em Unibes Cultural https://t.co/v91LJI9vah
51,1316510641000247298,1528823862800142337,2022-05-23,Marque aquele @ que você vai levar pra esse show em Picles https://t.co/ciVJYIeyLW
52,1516027987984068610,1528801558347100161,2022-05-23,"Já pensou em conhecer um bar com entrada pela geladeira? 🫢

#TikTok #sp #baressp #pitico #farialima #redecapivara #ondeiremsp #spsecreto 

#TikTok https://t.co/MbYahZjLUu https://t.co/jSCXHC6YMu"
53,1167195698632302593,1528800771868921859,2022-05-23,"Saiba que dirigir com a CNH Suspensa é algo muito grave e o próprio Código de Trânsito Brasileiro traz, em seus artigos 162, II, 263, I e 309, punições ainda mais severas na hipótese de o motorista suspenso ser flagrado dirigindo, 
https://t.co/UUx8nK4Q05"
54,36146132,1528787608393981952,2022-05-23,Drinking a Ladybug - Morning Glory Series by Cervejaria Fermi at @eapsp — https://t.co/R5ckMpZK5h
55,36146132,1528787354999201792,2022-05-23,Drinking a MESS OF WIRES COFFEE IPA by Koala San Brew at @eapsp — https://t.co/EqDThPDz7a
56,1167195698632302593,1528784823506051074,2022-05-23,Bianco Despachante no Alto da Lapa no Google: https://t.co/gjGdlHsY7K https://t.co/e6gWW0ilHx
57,51242253,1528776521476886530,2022-05-23,"Oq essa parceria ainda vai nos dar muita alegria, não tá escrito!! Eu amei demais 🖤 https://t.co/2UkmvYE5Hp"
58,68971200,1528766904143314948,2022-05-23,"Fingindo costumes…

#streetwear 
#clothing 
#sp 
#bmxbrasill 
#bmx em Ladeira Da Morte https://t.co/0f3w6HWrPt"
59,226895549,1528764484013109248,2022-05-23,#justbe #shine #celebratelife @lovenacademy @dapaviradagelateria em Da Pá Virada Gelateria https://t.co/X14WYNkR5Z
60,1287201210936827904,1528734884902187008,2022-05-23,batuque o coração para me ver chegar https://t.co/saX7LxV129
61,15997446,1528728731531059202,2022-05-23,"É HOJE! 🔥 Formada em meados de 2013 e desde então em franco crescimento no cenário metaleiro, a Noturnall é um dos destaques da cena do heavy metal brasileiro. 

Garanta seu acesso e assista em https://t.co/vFGIfGKLXi https://t.co/QZyXiwIr95"
62,1103370507070726144,1528709540635521025,2022-05-23,"Querer não é poder,
os desejos são infinos...

#OutonoInverno
#Caminhada em Selva De Pedra https://t.co/d2qKwviO7L"
63,2306707293,1528704980844150785,2022-05-23,Acabou de publicar uma foto em Pinheiros https://t.co/Jytma2xZys
64,95502288,1528698306704166916,2022-05-23,Acabou de publicar uma foto em Buena Vista Barber Club https://t.co/E81ZrXlLLw
65,1250579729813508097,1528693935186518016,2022-05-23,Já no HC esperando vó em cirurgia
66,1327365418722484225,1528689048847540227,2022-05-23,@esildaalciprete E colocar quem capaz pra governar e ter uma ficha limpa?
67,49145938,1528677973636919297,2022-05-23,"Malhou, girou a chave e partiu, rumo ao desconhecido. https://t.co/Ztz94UhyPz"
68,2248145765,1528673972925128704,2022-05-23,"gostaria q todos tivessem a oportunidade de provar o clássico nhoque de ricota artesanal do Arturito, com ragu de linguiça de porco feita pela equipe do restaurante 🤤

tbm vale a pena ir almoçar de terça a sexta, pois tem os pratos dos agricultores a R$55, sempre delícia"
69,954032057495314432,1528555056735330305,2022-05-23,Sobre o início de ontem https://t.co/c7padXJfdq
70,1380960150396280838,1528551744912883721,2022-05-23,"… @brunofaglioni simplesmente ficou gritando:
- DEMÔNIO, DEMÔNIO 
eu amo um ser 🤣💖 https://t.co/FXklFr8cl5"
71,1213595685573914624,1528548293084602368,2022-05-23,"Saravá! Hoje venho por meio deste post me apresentar novamente: Prazer, meu nome é David Dias e sou MESTRE em Ciência da Religião, pela PUC-SP. (+) https://t.co/ur65kMjyb3"
72,2615619241,1528531830995095552,2022-05-23,Acabou de publicar uma foto em Shopping Vila Lobos https://t.co/cPMSp81SwQ
73,602225458,1528529892031221761,2022-05-23,Acabou de publicar uma foto em Hospital das Clínicas da FMUSP https://t.co/op39QwQF1x
74,2615619241,1528520941831168000,2022-05-22,Acabou de publicar uma foto em Shopping Vila Lobos https://t.co/0alzLsQqhS
75,41499336,1528516639037263872,2022-05-22,Acabou de publicar uma foto em Santana Bar https://t.co/1sQBNE3HVS
76,389141081,1528515566188756996,2022-05-22,"Um cafézin quentin mantém o frio longe do coração.

A Amorinha na minha vida faz meu coração flutuar como um balão 🎈

E passear por aí me faz feliz de montão . 🥰🥰 em Empório Coisas De Minas https://t.co/nKklbidNHJ"
77,127240672,1528511558317383686,2022-05-22,Acabou de publicar uma foto em Moto na Estrada https://t.co/CqinYMdGC7
78,36764360,1528505826348089345,2022-05-22,"Fez o churrasco, ganhou o bolo e ainda me deu o primeiro pedaço.
Encerramos assim a semana de aniversário. em Vila Madalena São Paulo - SP https://t.co/G6anQGamAN"
79,178773369,1528488644129980416,2022-05-22,Chegamos https://t.co/uNpf56ilXw
80,249924689,1528485970131267584,2022-05-22,🧶 em Frio? https://t.co/El3txXSz1p
81,16371351,1528482694514061317,2022-05-22,https://t.co/zIFzqUv8zd
82,67093822,1528482124633890816,2022-05-22,"Deixando suas combinações impecáveis, a camiseta Malha Tricot pode ser sua melhor aliada nesse tempinho, não é?
Escolha a sua em https://t.co/LVsNWI6lnP
#tricot #camiseta #sergiok #winter #detalhe #algodão em Sergio K https://t.co/JORSXl4vxO"
83,127240672,1528482117520445441,2022-05-22,Acabou de publicar uma foto em Moto na Estrada https://t.co/X5KS22J9Gi
84,167933536,1528478772441124865,2022-05-22,Pitanga kpopeira ❤️ em Carioca Club Pinheiros https://t.co/b54E3S9hK7
85,84943406,1528474154621624322,2022-05-22,"Feliz dia mundial do La Paloma, coquetel clássico mais famoso do México e 22° mais vendido no mundo em 2021. Leva tequila branca, sucos de limão e grapefruit, xarope de agave e soda artesanal de grapefruit. Amo de paixão! https://t.co/9njBsIQnxp"
86,1504585103674118162,1528472920590274568,2022-05-22,Acabou de publicar uma foto em Zona Leste de São Paulo https://t.co/4oTVyqJF7W
87,1369019655898140677,1528462794819096578,2022-05-22,Lenora de Barros https://t.co/Pa1nMOzb30
88,1369019655898140677,1528461856930729987,2022-05-22,"Cláudia Guimarães, 1990. https://t.co/TboSIBFGJZ"
89,1446896501620449293,1528460760757768194,2022-05-22,E saudade 🤤 https://t.co/JPhiPZPIPt
90,1369019655898140677,1528456116656562176,2022-05-22,Anna Maria Maiolino @tomieohtake https://t.co/wqGa9I3aAC
91,2615619241,1528450709020102663,2022-05-22,Acabou de publicar uma foto em Shopping Vila Lobos https://t.co/JdXXNfyzZD
92,1103370507070726144,1528450171452854272,2022-05-22,"URGENTE...

vejam a nova pandemia....

intervenção em post de @marisaorth em Selva De Pedra https://t.co/t8TVGNrn6M"
93,2306707293,1528442292431990784,2022-05-22,Acabou de publicar uma foto em Pinheiros https://t.co/Nq3SHr5KBx
94,14328502,1528435818041430019,2022-05-22,Drinking a Hazyland by @synergybeer at @eapsp — https://t.co/6Xp5e69unU
95,14328502,1528435810818789377,2022-05-22,Drinking a Juicyland by @synergybeer at @eapsp — https://t.co/NsKi2kYBup
96,14328502,1528433263383130113,2022-05-22,Drinking a Ladybug - Morning Glory Series by Cervejaria Fermi at @eapsp — https://t.co/h859qllmIx
97,134858135,1528430860189376512,2022-05-22,"Ontem foi dia de vôlei na Oscar! 🙌🏻🏐 Agora eu tô treinado vôlei quase todo dia (5x por semana 😮‍💨), e isso tem me feito muuuito bem. A @competition.club, mais do que nunca, tem sido minha segunda casa!! 🧡 https://t.co/gAfKefnr4j"
98,1259676580592394240,1528430372207439875,2022-05-22,Bom domingo a todos !! Friooooooo https://t.co/oXsqyfVxMW
99,276560682,1528430121937473536,2022-05-22,Acabou de publicar uma foto em Shopping Vila Lobos https://t.co/xMZyEFe5SC
100,14328502,1528429493605519363,2022-05-22,Drinking a MESS OF WIRES TERPENE COFFE IPA by Koala San Brew at @eapsp — https://t.co/4FUhOGk1iy
101,1516027987984068610,1528425885585522689,2022-05-22,"Rolezinho no lugar mais clichê de SP, mas que entrega TUDO 

Os petiscos são uma delícia, um pouco caros pela quantidade que vem, mas vale a pena 😋 

#pitico #rolessp #ondeiremsp #baressp #roles https://t.co/No4eqZL9Fw"
102,14328502,1528422195546005505,2022-05-22,Drinking a Praia do Meio - 2019/2020 by Cervejaria Cozalinda at @eapsp — https://t.co/I3yHrrWXj9
103,14328502,1528421950435037185,2022-05-22,Drinking a GERMAN PILSNER by Molinarius Brewing Co. at @eapsp — https://t.co/eqoDFLo5si
104,14328502,1528421695933095939,2022-05-22,Drinking an Ao Alambique by Fermentaria Local at @eapsp — https://t.co/U0cfYULmXX
105,3093906796,1528419819690901505,2022-05-22,Acabou de publicar uma foto em Basile Estudo Orientado - Aulas Particulares https://t.co/sQVzt8fdZL
106,2377979454,1528419128167608321,2022-05-22,"""Só serei livre se sair de Gotham city
Agora vivo como vivo em Gotham city
Mas vou fugir com meu amor de Gotham city
A saída é a porta principal"" Gotham City, Jards Macalé https://t.co/Qa90lDKLgk"
107,21203873,1528416196395012096,2022-05-22,Nos arcades em BARIO BAR https://t.co/XxNh1VY7uL
108,84642153,1528405597275791363,2022-05-22,https://t.co/uO32mFyzse
109,799412180,1528398440635432962,2022-05-22,"Está chegando!
Seminário Polícia Judiciária e a Lei 14.321/2022 (violência institucional), dia 24/05, promovido pela Academia da @Policia_Civil .

#Acadepol
#PolíciaJudiciária
#ViolênciaInstitucional
#DevidoProcessoLegal
#InvestigaçãoCriminal
#DevidaInvestigaçãoCriminal https://t.co/IktbuYMmMh"
110,69883294,1528397344747638786,2022-05-22,Alô @lucasfresno Vou Ter Que Me Virar tocando na @milogarage @fresnorock #VTQMV #fresno https://t.co/mbI7kKSufI
111,14357628,1528394901817262081,2022-05-22,"Baleia fantástica

#grafite #graffiti #urbanart #arteurbana #streetart #artederua #saopaulo #saopaulocity #terradagaroa #sp #sampacity #sampalovers #sampa #instagrafite #instastreetart #arte #art em Pinheiros https://t.co/74VmZey2XA"
112,1197158166242484225,1528392549441933314,2022-05-22,Movimentos acinzentados. @ Vila Romana - SP https://t.co/hBozZEECtB
113,8883442,1528388541977350150,2022-05-22,"Meu equilíbrio não é mais como antigamente. Mas sigo de pé e #vacinadonna 

#domingoNoParque #patins #diasdificeis #diasbons #ᴠᴀᴄɪɴᴀsim em Parque Villa-Lobos https://t.co/MFLHm2tGxI"
114,69892426,1528375817100742657,2022-05-22,Croissant com doce de leche #happysunday #saopaulo #sãopaulo #consolação #bakery #padaria @ Le Pain Quotidien Brasil https://t.co/D1qnS3IWW4
115,69892426,1528375175913275395,2022-05-22,Rolo de Calabrese con chá da menta para meu café da mañha #happysunday #saopaulo #sãopaulo #consolação #bakery #padaria @ Le Pain Quotidien Brasil https://t.co/KkXFNGWRFP
116,182454164,1528371501963034624,2022-05-22,"Um bom dia!
Obrigado Deus, por ter uma refeição saudável ao iniciar o dia, e rogamos a Deus que ampare os nossos irmãos necessitados. 
#deuséamor #espiritismo #espiritismocomjesus vival em Perdizes, São Paulo, Brasil https://t.co/ClOdLbG3a2"
117,15430166,1528370629220737025,2022-05-22,🏅| @sagazesportes #transformersrun em Parque Villa-Lobos https://t.co/y545sQivpp
118,34264727,1528362579361398788,2022-05-22,Acabou de publicar uma foto em Pinheiros https://t.co/oTLLSz0pxi
119,15430166,1528356998965866496,2022-05-22,I'm at Biblioteca Villa-Lobos in São Paulo https://t.co/QyUWp6YB5d https://t.co/srsGYnvY6F
120,55970374,1528350116335210497,2022-05-22,Acabou de publicar uma foto em Bemglô https://t.co/158Qqgs2kb
121,15430166,1528332985103171585,2022-05-22,"Dia de Transformers RUN 🏃🏻‍♂️ (@ Parque Villa-Lobos in São Paulo, SP) https://t.co/aHhwUeCIYu https://t.co/qDTv7MuFEj"
122,4873646337,1528215449736994816,2022-05-22,"…o homem que diz sou, não é…porque quem é mesmo é não sou…(Canto de Osanha por Vanessa da Mata) 😍 https://t.co/4VASZ5gVS3"
123,2306707293,1528214699417948160,2022-05-22,Acabou de publicar uma foto em Pinheiros https://t.co/gIyC5I9E53
124,1103370507070726144,1528213008052146176,2022-05-22,"Alegrias e tristezas ficam na memória..

O hoje está por vir... em Selva De Pedra https://t.co/mQM82f7Cv5"
125,2615619241,1528208146619060224,2022-05-22,"Dá-lhe Dá-lhe GRUNGEEE 🤪 Haha Esse quarto tem uma vibe muito Malhação não acham?! 😅 
.
.
.
.
.
. #bbb2022 #bbb22 #quartogrunge #quartogrungebbb #casabbb22 #réplicadacasadobbb22 em Shopping Vila Lobos https://t.co/elC4qysHzg"
126,1496469422646644736,1528207007026659328,2022-05-22,Pizza https://t.co/Cz88VmhGa4
127,51242253,1528198796064202754,2022-05-22,Meu amor que nem cabe nessa foto ❤️❤️❤️ https://t.co/eXkM0Ny5aE
128,216945561,1528194296242896897,2022-05-22,S2 em Vila Madalena https://t.co/lxcbkwXNOT
129,84943406,1528194137891213314,2022-05-22,Solara como protagonista de um documentário sobre coquetelaria. I love my job! https://t.co/z5c0NM5IGF
130,1002026651193085953,1528190755336081408,2022-05-22,❤️ https://t.co/cIvDu51if0
131,22283171,1528184198212763649,2022-05-22,QUE BONITA A SUA ROUPA NESSE CARAYO!!!  TRAZ O REFRESCO DE TAMARINDO (slide twice pro Kiko brasileiro) em Escape60 https://t.co/EtVCDWLmJe
132,58994298,1528184073419644931,2022-05-22,Acabou de publicar uma foto em Pinheiros https://t.co/iVjXtccFxo
133,41891375,1528181903056064512,2022-05-22,Dia de comemorar a vida da picoruxa !!! #prima #niver #primos 🥰 em Madero https://t.co/foiSkChW05
134,182454164,1528180649072508930,2022-05-22,"Celebrando a vida, eu e ela.
 #celebrandolavida #celebrandoavida em Perdizes, São Paulo, Brasil https://t.co/1FRELPRgw9"
135,1103370507070726144,1528180044153208832,2022-05-22,"'Material Girl' 
ahh meus 14 aninhos...e Madonna reinando...

repost @madonna

#FuiFeluz
#MaterialGirl
#Madonna
#Adolescencia em Selva De Pedra https://t.co/sMf8Zn6PYP"
136,434585854,1528176660092276736,2022-05-22,Acabou de publicar uma foto em Instituto Butantan https://t.co/t4qfe3cFQJ
137,53721403,1528173232519782400,2022-05-22,Hummmmm 😋😋😋 em Bora Bora pizza bar https://t.co/1F97or2HGK
138,97781033,1528161836897652741,2022-05-21,Seguimos 🍺 https://t.co/t3xCI2a4vH
139,69892426,1528159018065473537,2022-05-21,Just posted a photo @ Cais https://t.co/JLdyczbbX4
140,2615619241,1528158485342470146,2022-05-21,"Meu momento como Líder ✨💁🏻‍♀️👑 Fala sério se não combinou muito comigo esse roupão! 🤩 Isso precisa real algum diaaaa!!! 🙏🏼
.
.
.
.
.
. #bbb2022 #bbb22 #casadobbb22 #réplicadacasadobbb22 #fe #umdiaserareal https://t.co/2hygQd1Hkw"
141,1011751272,1528157668434755584,2022-05-21,"acrescentando: há um sebo incrível do ladinho do Cozinha de Afeto e se chama Sebo Memória, o nome ja entrega tudo, há coisas incríveis la dentro 
livros relíquias de cinema, muita coisa pra galera de med, literatura nacional, vi uma edição maravilhosa de Fausto do Goethe https://t.co/Ffve8XR2om"
142,1011751272,1528157661195292675,2022-05-21,"quem me conhece sabe que eu sou obcecada por jazz e poder estar num lugar que vc se sente aconchegada assim é a melhor coisa do mundo
alem claro do atendimento incrível!!! 
eles foram uns anjos por nos deixar gravar pra facul +"
143,1011751272,1528157659660275712,2022-05-21,"pertinho do metrô das Clínicas, vc vai descendo a marechal teodoro e vê um montão de instrumentos e a galerinha tirando um som bem gosto, dai encontra esse lugar

Cozinha de Afeto da pra almoçar, jantar e tomar um café da manhã 
e a parte que mais gostei: ao som de jazz +"
144,1011751272,1528157656564776960,2022-05-21,"YUMIDICAS - comida e livros
BOA NOITE TUITERSSSSS VCS SENTIRAM MINHA FALTA? não.

mas hoje aleatoriamente achei um lugar aqui em sp que vale uma Yumidicas bem gostosa!!!!! 

meu último dia de gravação e pra fechar com chave de ouro tomei cafézinho aqui No Cozinha de Afeto + https://t.co/3NC44BGVY6"
145,216945561,1528156067690995712,2022-05-21,Top ....... em Vila Madalena https://t.co/nORUcQGrkt
146,67093822,1528149128303169536,2022-05-21,"TROPICANA! Compre agora em https://t.co/LVsNWInWfn
#sergiok #camisas #camisaflorão #estampas #winter22 em Sergio K https://t.co/GhfNUhFLiz"
147,973894061965873152,1528145580790251521,2022-05-21,Passando pra agradecer de verdade o carinho de vcs. Eu fico feliz se  levar um pouquinho de leveza à vida de cada um. Obrigada Crush’s 🥹 meio emotional hoje rsrsrs ❤️#laliganaespn https://t.co/5v9rUGZJ8v
148,51242253,1528144939212754945,2022-05-21,"Bebendo proporcionalmente ao tempo que a gente não se via ❤️

@FlaviaCordovez https://t.co/Ra3sJyi1ij"
149,150242761,1528141661154443266,2022-05-21,Acabou de publicar uma foto em Holding Clube https://t.co/fJTDGFZ6eK
150,1340647948183592960,1528136919707705345,2022-05-21,"Formada! 🎓🤍

#NewProfilePic https://t.co/GdFWSlOk4A"
151,71909361,1528136073389432832,2022-05-21,"Nosso tour continua!

#instalike #instagood #instamoment #essepê #sampa #CarlosBakerySP #friends em Carlo's Bakery São Paulo https://t.co/K8UumbfrYE"
152,1265268737487384578,1528133001242198018,2022-05-21,Comercial de Margarina 😍 #Run #Runners #olympikus https://t.co/gUntcPRE5i
153,1295573357988118528,1528131207908696065,2022-05-21,👅💦💦 https://t.co/hvgoxPkrSB
154,216945561,1528128099526889472,2022-05-21,#brasabbq em Vila Madalena https://t.co/6bdwgLHuHn
