,author_id,tweet_id,created_at,text
0,1487092624808988674,1534207217875968007,2022-06-07,Boa tarde https://t.co/EpSQywksgq
1,423635618,1534180119723622403,2022-06-07,Pense nisso!! em Igreja Evangélica das Nações - IEN https://t.co/zCmOFAq5Dw
2,1108422376117727232,1534175724487290887,2022-06-07,Acabou de publicar uma foto em Liberdade Objetivo https://t.co/BTIuTC9K4t
3,47832422,1533959130628739072,2022-06-06,https://t.co/bS5sWTUZFE
4,1487092624808988674,1533942228099506176,2022-06-06,https://t.co/70VXJmTlF8
5,1487092624808988674,1533815737386778624,2022-06-06,Bom dia..... https://t.co/goEORRrMGq
6,423635618,1533789175631294473,2022-06-06,Acabou de publicar uma foto em Igreja Evangélica das Nações - IEN https://t.co/TQ2WYOpXn8
7,316775437,1533570627591979008,2022-06-05,Acabou de publicar uma foto em Parque Jacui https://t.co/Uv1EU9NMcK
8,1243135490607415297,1533555367258488834,2022-06-05,Acabou de publicar uma foto em Praça Do Morumbizinho https://t.co/jhj1WtuXIr
9,1243135490607415297,1533555125268226048,2022-06-05,Acabou de publicar uma foto em Praça Do Morumbizinho https://t.co/NciFVKw0aP
10,1243135490607415297,1533554556705062912,2022-06-05,Acabou de publicar uma foto em Praça Do Morumbizinho https://t.co/AliBhA4osi
11,55463909,1533447801597743104,2022-06-05,"Esforço, treino e dedicação!

O resultado esta ai Kruang Vermelha, isso é só o começo

@fightleste 

#Luta #FightLeste #Luta #MuayThai #Kruang #Saúde #Academia em Fight Leste https://t.co/Y3rLYdhuoz"
12,1109007224,1533185531261161473,2022-06-04,Do stories pro feed 😝 em Alex House https://t.co/Pv3PKsQJrB
13,47832422,1532762862027952128,2022-06-03,https://t.co/xcvY2UToPJ
14,166995676,1532373589101629440,2022-06-02,"Que Cristo e a palavra de Deus esteja em seu coração sempre. 
Coração cheio! em Iigd Regional Ermelino M. https://t.co/6KbW71iN4r"
15,166995676,1532164535930568704,2022-06-02,"Se Jesus está no seu barco ❤️,vai dar tudo certo. 
Deus abençoe. em Iigd Regional Ermelino M. https://t.co/0dQH4IXCcZ"
