,author_id,tweet_id,created_at,text
0,402688868,1531265327358570496,2022-05-30,Upa se Ermelino Matarazo em Upa Ermelino Matarazzo https://t.co/cveJvW6upt
1,860323361641156608,1531028636513492993,2022-05-29,Com os melhores ❤️❤️ em Perdidos Por Aí https://t.co/P8gbnKHkcc
2,123405231,1530562735611731968,2022-05-28,Visitando o Museu Capela de São Miguel. https://t.co/h8E9Hp8kfs
3,402688868,1530538003751370753,2022-05-28,Jonas! em Igreja Internacional Da Graça De Deus Av Marechal Tito N 921 https://t.co/aPjp8zvXoC
4,2348685380,1530269860055293952,2022-05-27,Acabou de publicar uma foto em Ermelino Matarazzo https://t.co/0bZ4MprlPX
5,3074905265,1530158202339627009,2022-05-27,"mongoloide carente do caraio, abraça a mãe mano eu n gosto de vc entenda"
6,402688868,1529828736237019142,2022-05-26,Jonas! em Parque Jacui https://t.co/LQPJhsnTW5
7,423635618,1529809169385197568,2022-05-26,Acabou de publicar uma foto em Igreja Evangélica das Nações - IEN https://t.co/R4Gg76PHXj
8,1487092624808988674,1529488028129009664,2022-05-25,Aonde vc beijaria? 🔥🔥🍆 https://t.co/QQP0bQAC1u
