,author_id,tweet_id,created_at,text
0,47832422,1533959130628739072,2022-06-06,https://t.co/bS5sWTUZFE
1,1487092624808988674,1533942228099506176,2022-06-06,https://t.co/70VXJmTlF8
2,1487092624808988674,1533815737386778624,2022-06-06,Bom dia..... https://t.co/goEORRrMGq
3,423635618,1533789175631294473,2022-06-06,Acabou de publicar uma foto em Igreja Evangélica das Nações - IEN https://t.co/TQ2WYOpXn8
4,316775437,1533570627591979008,2022-06-05,Acabou de publicar uma foto em Parque Jacui https://t.co/Uv1EU9NMcK
5,1243135490607415297,1533555367258488834,2022-06-05,Acabou de publicar uma foto em Praça Do Morumbizinho https://t.co/jhj1WtuXIr
6,1243135490607415297,1533555125268226048,2022-06-05,Acabou de publicar uma foto em Praça Do Morumbizinho https://t.co/NciFVKw0aP
7,1243135490607415297,1533554556705062912,2022-06-05,Acabou de publicar uma foto em Praça Do Morumbizinho https://t.co/AliBhA4osi
8,55463909,1533447801597743104,2022-06-05,"Esforço, treino e dedicação!

O resultado esta ai Kruang Vermelha, isso é só o começo

@fightleste 

#Luta #FightLeste #Luta #MuayThai #Kruang #Saúde #Academia em Fight Leste https://t.co/Y3rLYdhuoz"
9,1109007224,1533185531261161473,2022-06-04,Do stories pro feed 😝 em Alex House https://t.co/Pv3PKsQJrB
10,47832422,1532762862027952128,2022-06-03,https://t.co/xcvY2UToPJ
11,166995676,1532373589101629440,2022-06-02,"Que Cristo e a palavra de Deus esteja em seu coração sempre. 
Coração cheio! em Iigd Regional Ermelino M. https://t.co/6KbW71iN4r"
12,166995676,1532164535930568704,2022-06-02,"Se Jesus está no seu barco ❤️,vai dar tudo certo. 
Deus abençoe. em Iigd Regional Ermelino M. https://t.co/0dQH4IXCcZ"
13,423635618,1531990030155190273,2022-06-01,Acabou de publicar uma foto em Igreja Evangélica das Nações - IEN https://t.co/qCMZXvsKzh
14,166995676,1531988066524594179,2022-06-01,"Um novo mês que se inicia trará para você novas oportunidades. 
Deus é contigo. em Iigd Regional Ermelino M. https://t.co/xTGF4ioofl"
15,1531831957918822402,1531835205371166720,2022-06-01,#❤ https://t.co/iqNqURpdAL
