,author_id,tweet_id,created_at,text
0,118562008,1558533635841703936,2022-08-13,Almoﾃｧando do jeito que eu gosto 愚沽 @restaurante.kabanas em Kabana's Restaurante https://t.co/5YwYsghGpY
1,1576105784,1557977055337144320,2022-08-12,Acabou de publicar uma foto em Studio Fitness Power https://t.co/22RQW5Vpsc
2,1108422376117727232,1557805694660780032,2022-08-11,Acabou de publicar uma foto em Liberdade Objetivo https://t.co/Cyvadw0IQm
3,1481989980528467975,1557795819625013249,2022-08-11,AQUELA ALIVIADA  https://t.co/d17XETEYDB
4,423635618,1557748942493945857,2022-08-11,"Mateus 6:33
buscai, pois, em primeiro lugar, o seu reino e a sua justiﾃｧa, e todas estas coisas vos serﾃ｣o acrescentadas. em Igreja Evangﾃｩlica das Naﾃｧﾃｵes - IEN https://t.co/HiulA88yJy"
5,1481989980528467975,1557740347689963522,2022-08-11,"Bom passei bom um semana difﾃｭcil pensei em desistir mais graﾃｧa a meu Deus me ajuda a enfrentar cada obstﾃ｡culo de cabeﾃｧa erguida 剏
Na luta fazendo meus corre..
Vcs estava com sdds do pﾃｩ  do moreno?
Pode lamber Tela do celular que eu deixo https://t.co/yW6xq9edna"
6,1576105784,1557647116977074179,2022-08-11,"Obrigado por criarem belas mﾃｺsicas para nossos ouvidos.

#ouvindohit #music #saudemental em Studio Fitness Power https://t.co/2leSw9FypS"
7,3016186557,1557535243870953477,2022-08-11,Sou meu melhor retrato 萄 em Favela Da Santa Ines https://t.co/KgAyDSDesI
8,1576105784,1557527208553549825,2022-08-11,Acabou de publicar uma foto em Studio Fitness Power https://t.co/24MrFR1PgS
9,1518908815009329156,1557415384592093192,2022-08-10,"CANAL AME-BR TV APRESENTE
EVENTO: 1ﾂｰ MOTO ROCK ZONA LESTE Sﾃグ PAULO.
REALIZAﾃﾃグ: MOTO CLUBE MURUMBIZINHO - Sﾃグ PAULO. 
COBERTURA: CANAL AME-BR TV. 
LOCUﾃﾃグ: ANDERSON LIMA. em Morumbizinho Moto Clube https://t.co/7ueOryFsX6"
10,1576105784,1557368287675154436,2022-08-10,Acabou de publicar uma foto em Studio Fitness Power https://t.co/47GeuQsKGC
11,1557136874312982528,1557140691846930432,2022-08-09,Tesﾃ｣o tﾃ｡ demais! 櫨 https://t.co/wLqs1EGK2H
12,423635618,1556976330087989254,2022-08-09,"Hoje comeﾃｧamos uma nova sﾃｩrie que vai impactar a sua vida.
Ajuste a sua agenda e vem!
Serﾃ｡ incrﾃｭvel.
#SomosIEN
#IENoSeuLugar em Igreja Evangﾃｩlica das Naﾃｧﾃｵes - IEN https://t.co/Bfk4rDkXut"
13,1369028014097522690,1556749343633317889,2022-08-08,@Coreano Sim com certeza
14,423635618,1556719727225016320,2022-08-08,"Se prepare para a nossa Super Terﾃｧa com o Ap. Sﾃｩrgio Piovano.
Serﾃ｡ poderosa.
Anote em sua agenda.
#SomosIEN
#IENoSeuLugar em Igreja Evangﾃｩlica das Naﾃｧﾃｵes - IEN https://t.co/5v2nbwLGkQ"
15,1407645356964319234,1556686590755409921,2022-08-08,#NewProfilePic https://t.co/qQ1M8BR6AP
16,1345149011947384832,1556663611208175618,2022-08-08,Visitei o set de grey anatomi e de brinde eles me deram 30 remﾃｩdio pra toma
