,author_id,tweet_id,created_at,text
0,276270452,1540893138545434624,2022-06-26,游눘 https://t.co/3HHvZrxqFc
1,276270452,1540892838191370241,2022-06-26,Jogando um Tony Hawk 2 com os amigos 游때游뱆游낗游뱆游낗游뱆游낗 https://t.co/6pb6vWiDNz
2,402688868,1540690385588174853,2022-06-25,Jonas! em Igreja Internacional Da Gra칞a De Deus Av Marechal Tito N 921 https://t.co/8EGKF9UUyJ
3,2348685380,1540682519242166272,2022-06-25,"Olha s칩 quem est치 de volta ele, demorou pra chegar 游꼺 mas agora t치 querendo aparecer por aqui direto .
Em breve novidades ou melhor matando a saudades dele P칚o de mel recheado no nosso card치pio em Ermelino Matarazzo https://t.co/jXtHnwPwvQ"
4,2348685380,1540432634194558976,2022-06-24,"Sobre essa foto... 
Ixi eu at칠 esqueci o que ia dizer !!! 
Me conta voc칡 aqui nos coment치rios o que acha desse brownie ??? em Ermelino Matarazzo https://t.co/YHR4POoMQr"
