,author_id,tweet_id,created_at,text
0,979171115024224258,1569818811540414466,2022-09-13,Encontro Continbox and Montezzi!! em Continbox Contabilidade Inovadora https://t.co/OySY3Pi3bc
1,3298162567,1569816463967502337,2022-09-13,"Tirei essa foto no intervalo e esqueci de postar. Vi o Hudson, ex-volante, acompanhando o jogo lá na Fazendinha. Ele agora é empresário de jogadores. https://t.co/2qEyVzeUaf"
2,1233382897706504193,1569798141825945600,2022-09-13,"ENCONTRO ESPECIAL🖤🤍
Na última sexta-feira (9) , nosso ala @levy_elizabeth teve um apoio especial nas arquibancadas do Wlamir Marques!
O garoto @prinbernardo, fã do atleta, que teve seu sexto aniversário com o tema do jogador, veio prestigiar o jogo e viveu uma experiência unica https://t.co/mf3eDp7PAT"
3,3298162567,1569791590972940290,2022-09-13,"Comemoração do terceiro gol, o da virada, do Corinthians. Jogadaça do Guilherme Henrique na origem da jogada, e conclusão perfeita do Wesley. Placar final: Corinthians 3x2 São Paulo. Jogaço! https://t.co/4rg8NOCNmA"
4,3298162567,1569771547531055104,2022-09-13,"Com menos de um minuto do 2T, mais um pênalti, dessa vez pro Corinthians e em cima do Wesley.
Adryan bateu com perfeição! Que batida. https://t.co/1YMdNqjaUz"
5,3298162567,1569771081749401600,2022-09-13,O próprio @NewertonMartins foi pra bola e guardou. Ele é o vice-artilheiro do time na temporada com 11 gols. https://t.co/LhfNNe90sO
6,201967553,1569705750859071490,2022-09-13,"Quinta Feira é dia de Bar do MAJOR,!!! em Tatuapé https://t.co/U10CToUkE7"
7,1417339053503037442,1569445991685787649,2022-09-12,"Voltei pra academia, em dia de chuva, depois de 6 anos, bora voltar a ser o Rambo https://t.co/4aLYo9K1Yr"
8,1140295942702325760,1569379792625012740,2022-09-12,energia de escola pública https://t.co/bVYy7vV4vN
9,57203380,1569338186475634689,2022-09-12,Acabou de publicar uma foto em Tatuapé https://t.co/t8h3rnZN5x
10,56851995,1569270176713003008,2022-09-12,I'm at Redfit Carrefour Celso Garcia in São Paulo https://t.co/lSM5OZiUi9
11,1534662849963995142,1569119253454032897,2022-09-12,Eis me aqui esperando
12,1560744629737328647,1569114314891530240,2022-09-12,Acabou de publicar uma foto em Sabará MG https://t.co/5eDLI6IXqE
13,65939737,1569043666475356162,2022-09-11,"Dia do do doce ontem 🤭 🍭🍬🧁.
.
.
#negro #blackpower #blackmusic #rnb #music #blackstyle #Blackpeople #black #negros #p30pro #sp #style #saopaulo #colors #musician em Baiana Bombom https://t.co/thrc12zS9c"
14,380597695,1568968239274774529,2022-09-11,✌🏼🍀🍃❤️ em Sabará MG https://t.co/9qa0f018qr
15,1268858277363843074,1568951152917770245,2022-09-11,"tô bem safadinha, me gosto assim! 😈 hahahahaha"
16,1562067724871901185,1568742660743245826,2022-09-10,Somente agradecer! 🙏🏽⚽️♥️ https://t.co/7pAeQiUD4H
17,1145508420004536321,1568698624850427904,2022-09-10,"Delicioso esse cuzinho rosa e macio.
Soquei com carinho e com firmeza … fiz espumar igual a milkshake.
Vc gostam de ficar espumando pelo cu? 

Segue e dar Rt aí. https://t.co/kbXqyjcWW8"
18,891662266294296580,1568601214966693890,2022-09-10,Acabou de publicar uma foto em Esfera Universo Tatuapé https://t.co/NMHwIOimv8
19,226338570,1568599114698350592,2022-09-10,"09/09/2022

CORINTHIANS 4 X 0 SÃO JOSÉ - 1° JOGO - OITAVAS DE FINAL - LIGA NACIONAL DE FUTSAL 2022 🏴🏳️🦅⛓️✊🏼 em Ginásio Parque São Jorge https://t.co/72LqZMHbnP"
20,1268858277363843074,1568584688922501120,2022-09-10,"acordei brasil,  vou tomar um belo café da manhã e depois ir treinar pq sábado tbm é dia, boraaa Bill kkkk"
21,1117195053649276928,1568563404666802177,2022-09-10,"Estava com saudades do seu beijo, Doutor. https://t.co/4Bmjp6FA2s"
22,1365520875781562368,1568438748290994177,2022-09-10,até p viajar tem que ficar esperando ônibus em pé
23,1268858277363843074,1568405363506151425,2022-09-10,https://t.co/DXcEuOO7c4
24,1551264989868179456,1568378891693359107,2022-09-09,Acabou de publicar uma foto em Tatuapé https://t.co/ZccXR92S1y
25,226338570,1568373958042423297,2022-09-09,"A postos!
Cheguei faltando sete minutos do primeiro tempo, mas cheguei para dar sorte, pois estava 0 x 0, e estamos vencendo por 2 x 0.

Pelo Corinthians, com muito amor e até o fim! 🏴🏳️🦅⛓️✊🏼 https://t.co/FaRK9S3C8l"
26,65327357,1568350541058822144,2022-09-09,Cadê o @FabioMarcondes pra casar @odestino e eu? 🥰🖤🤍 https://t.co/7UcqLHJh2c
27,1364749118380400651,1568348668213825539,2022-09-09,Nem só do fut campo masculino nós vivemos https://t.co/XVtO12XbJd
28,82667426,1568324266956824577,2022-09-09,"A reportagem da @radiocoringao já está no palco do espetáculo e, às 18h30, fala ao vivo do Ginásio Wlamir Marques do Parque São Jorge para a fase 16 avos de final da @lnfontime contra o São José-SP. Torça conosco, Fiel!

VAI, CORINTHIANS! https://t.co/JFglHK2Zyc"
29,1026545729144332288,1568313825623003137,2022-09-09,Acabou de publicar uma foto em São Paulo https://t.co/Xb1fpuRlyB
30,64244511,1568182489314648064,2022-09-09,"Bom dia, Bom dia, Bom dia 🔴⚪⚫ em Tatuapé - São Paulo https://t.co/3nPCGsbLOr"
31,1268858277363843074,1568015620595384320,2022-09-08,2022 tá muito louco mesmo. só falta os ET's fazerem contato global agora.
32,333544268,1567889643206594565,2022-09-08,"Showroom da @maxloveoficial 
Um evento incrível e inesquecível, além de muitos lançamentos que amamos como sempre 👏 Encontros de milhões 😍

Obrigada @maxloveoficial e @smdistribuidoraltda em São Paulo https://t.co/d0xKb5OLl8"
33,1443399233260986371,1567886852237004800,2022-09-08,"Quanto mais você glorifica e celebra sua vida, mais você tem na vida para celebrar. em Vivace Club Tatuapé https://t.co/5ALbY1i60o"
34,1037373201674854400,1567879120276660224,2022-09-08,Acabou de publicar uma foto em Anclivepa-SP https://t.co/heECZDo25Z
35,103969971,1567857752290086913,2022-09-08,Dia 🙌🏻
36,344523098,1567630591603998721,2022-09-07,"#MomentoFriends e aquele momento em que você está com uma amizade que é pra toda q Vida!!! @shirleyalmeidaoficial - Ageu 2 - 8,9 #Amigo #friendsforever em Outback Boulevard Tatuapé https://t.co/rq8u9ypr6A"
