,author_id,tweet_id,created_at,text
0,1527315092072607748,1527798055700992001,2022-05-20,Shitting my guts out at Walmart
1,1450757107226136588,1527777730275602432,2022-05-20,Acabou de publicar uma foto em Feira da Madrugada Shopping https://t.co/fpi8srDvbP
2,3404349807,1527712422185816067,2022-05-20,"#sosdavida 
#evangelismo 
Venha e imperdível em Renascer Arena https://t.co/fwTUkJMaXc"
3,1206003149137498113,1527708919086436354,2022-05-20,Meu dois extremos hoje https://t.co/El5TMfK4jD
4,231216845,1527664292618592258,2022-05-20,"Passei no teste #PiracicabanoDeOrigem?🤔

#DeputadoEstadual #AlexDeMadureira #OrgulhoDeSerPiracicabano #SP #Brasil #Piracicaba #Piracity #PiracicabaCity #PiracicabaSP  #PiracicabanoRaiz #Caipiracicabano #DeputadoPiracicabano #DeputadoDePiracicaba #NascidoEmPiracicaba https://t.co/3yffErUElY"
5,1644110526,1527655495481315329,2022-05-20,Acabou de publicar uma foto em Canindé (bairro de São Paulo) https://t.co/7SmQ0xtbS2
6,1098591459798892545,1527455916928401409,2022-05-20,Sexta!!!! em Miguelitus Hamburguer &amp; Pastel https://t.co/6IYYFnda5E
7,194575741,1527444730308698112,2022-05-20,"Não defendo embriaguês ao volante, mas obrigar a gerar provas contra você não vai de encontro com a constituição? em Estado De São Paulo - Brasil https://t.co/3Kq0bl2chJ"
8,715191572850147328,1527419894165389331,2022-05-19,"Right now!

@texperience.oficial em SENAI SP Têxtil e Moda https://t.co/tGNnfevoE0"
9,194575741,1527405512924487681,2022-05-19,Acabou de publicar uma foto em Estado De São Paulo - Brasil https://t.co/FyZs7oDaUd
10,1439105270064496643,1527402838392983552,2022-05-19,"Acabou de publicar uma foto em IFSP - Instituto Federal de Educação, Ciência e Tecnologia de São Paulo https://t.co/OTKoBWtUKE"
11,1497268231215751171,1527402265270702083,2022-05-19,Mulher de fases  🌒🌓🌔🌕🌖🌗🌘 https://t.co/5Ow5RQOpxd
12,2821996462,1527332999406055424,2022-05-19,"@eujaohb Inclusive, estou aqui no Brás hoje kkk"
13,49959610,1527331732621430784,2022-05-19,"Pense em um local bom pra presente (@ Minas de Presentes in São Paulo, SP) https://t.co/CmwT5QDSo2"
14,72296145,1527303095037751296,2022-05-19,"ROCKSTAR, só metal pesado num ritmo envolvente 🤟🏻🤟🏻
📸 @mendes_kaique_ft em Complexo Canindé https://t.co/5LCXALaoN6"
15,38647632,1527299280687378435,2022-05-19,Correção da Tabela de Imposto de Renda Já!! - Assine a petição! https://t.co/gx3wlPtMSI via @change_br
16,330378043,1527261376628117504,2022-05-19,Acabou de publicar uma foto em PMs de Cristo https://t.co/b6H5zlhH19
17,1439105270064496643,1527111950676766720,2022-05-19,"Acabou de publicar uma foto em IFSP - Instituto Federal de Educação, Ciência e Tecnologia de São Paulo https://t.co/ZuYKDLiUK1"
18,2800826889,1527062446149718016,2022-05-18,Acabou de publicar uma foto em IBCC Oncologia https://t.co/W3e4fNVKd1
19,194575741,1527043963911290881,2022-05-18,Que Brasil você quer para sua família? em Estado De São Paulo - Brasil https://t.co/OOWusGPSm0
20,1439105270064496643,1527038932331794433,2022-05-18,"Acabou de publicar uma foto em IFSP - Instituto Federal de Educação, Ciência e Tecnologia de São Paulo https://t.co/iQ9xCYuLmN"
21,194575741,1527015705496936449,2022-05-18,"Para corrigir erros do passado só temos uma saída!
.
Foram 8 anos de muitas privatizações, 14 anos de desgoverno e 2 anos de passividade.
.
#mudabrasil em Estado De São Paulo - Brasil https://t.co/gLv0BcBqzl"
22,287687628,1527004161115623425,2022-05-18,Frio de torah https://t.co/9qKXaIouCr
23,715191572850147328,1526711287752937472,2022-05-17,Acabou de publicar uma foto em SENAI SP Têxtil e Moda https://t.co/bG14rn5mxg
24,715191572850147328,1526710565774712832,2022-05-17,Acabou de publicar uma foto em SENAI SP Têxtil e Moda https://t.co/mkvuMrstN4
25,69892426,1526667104769953795,2022-05-17,Just posted a photo @ Mercado Municipal de São Paulo https://t.co/9LjWAOCNdR
26,69892426,1526664735940399108,2022-05-17,Just posted a photo @ Shopping 25 de Março https://t.co/U4PiUCqlG9
27,194575741,1526664654474424321,2022-05-17,"Olha só o que encontrei, acredito ser uma mensagem subliminar!
.
Kkkkkkkkkkk em Estado De São Paulo - Brasil https://t.co/imccbRGRah"
28,82427060,1526596811636592642,2022-05-17,"Eu achava que não ía gostar, mas é muito gostoso. 
Esse valeu minhas moedas. 🤤 https://t.co/hzWgDoc1Jl"
29,1270885897991524355,1526372625643098112,2022-05-17,https://t.co/rosWgZVwZz
30,16137880,1526342717600583680,2022-05-16,"I'm at Instituto Federal de Educação, Ciência e Tecnologia de São Paulo - @ifsaopaulo in São Paulo, SP https://t.co/YnPMleEV8C"
31,1490789948978515977,1526324608630128643,2022-05-16,não falem cmg to num pessimo estado !!!
32,54623557,1526320662125719556,2022-05-16,Presente lindo que ganhei da prima @carolmarkess de aniversário em Belenzinho https://t.co/2BkUo80bs0
33,1212884945217024001,1526320637983215616,2022-05-16,Nunca fui triste 🥰 https://t.co/0mzqezt5JA
34,3404655557,1526308363944046594,2022-05-16,"Até quando os semáforos do pari vão continuar apagados e ninguém tomar uma providência,vão esperar acontecer um acidente fatal
@cetsaopaulo @subprefeiturasp 
Mais de uma semana sem semáforo, no cruzamento da avenida Bom Jardim com a  Avenida Carlos de Campos https://t.co/n9VTGTTyGN"
35,89475989,1526257433638850560,2022-05-16,Acabou de publicar uma foto em Fabriketa https://t.co/rGkR4aDKsy
36,194575741,1526255978080915456,2022-05-16,"Profissionais que muitas vezes não são notados, mas quando faltam logo são percebidos!

Respeito a todos.

#gari #diadogari em Estado De São Paulo - Brasil https://t.co/7ddjuKuZYV"
37,2165033041,1526179691077550081,2022-05-16,https://t.co/lvRjALzHi3 https://t.co/shg7ul7VJ6
38,4157493976,1526135874089631746,2022-05-16,"$3.400 só essa bolsa!
Pesando uns 100 kg
E eu me arrastando e arrastando a bolsa junto 🙄 https://t.co/YYbXh8hML4"
39,828356613958463489,1526133539879755776,2022-05-16,#BDSP linda manhã para nós! https://t.co/dL07xZVYWK
40,330378043,1526001659440205825,2022-05-16,Acabou de publicar uma foto em PMs de Cristo https://t.co/6rnLMVte6W
41,54623557,1525995569512173574,2022-05-16,Foi uma delícia ter todos vcs aqui hoje! #falei #primos #encintro em Belenzinho https://t.co/yOQ81uGjwg
42,781929521817722880,1525988575753297920,2022-05-15,A partir de amanhã às 23:58 já estaremos juntos na Oração da Meia Noite em Preparação para o dia 12/05 diretamente do Templo de Salomão. em Templo de Salomão https://t.co/EPVa7u8Ywt
43,1010227483499745281,1525907625824727041,2022-05-15,Almoço de domingo . Hoje foi dia de comer baião de dois no Brasileirinho. #almoçodedomingo #baiaodedois #restaurante #restaraunt em Mercado Municipal de São Paulo https://t.co/0lLYwqWO53
44,330378043,1525897126663835648,2022-05-15,Acabou de publicar uma foto em PMs de Cristo https://t.co/xLRmoFEPLR
45,111749889,1525875575897960451,2022-05-15,Existe amor em SP ! em Mercado Municipal de São Paulo https://t.co/smAIXwbYM9
46,194575741,1525855365350535168,2022-05-15,Acabou de publicar uma foto em Estado De São Paulo - Brasil https://t.co/azhXqFt2Ux
47,194575741,1525846328261201922,2022-05-15,Acabou de publicar uma foto em Estado De São Paulo - Brasil https://t.co/PlLqJbWtBu
48,194575741,1525843296773279744,2022-05-15,Acabou de publicar uma foto em Estado De São Paulo - Brasil https://t.co/yrCJLOqWgi
49,848658290607362050,1525770751302852608,2022-05-15,"#bom dia acabei de ganhar 3 chupadas gostosa na estação DLC 
Só que não gozei aí sair com pau duro e entrou casado bonito aí cara Nei fez xixi saiu atrás de mim e faz tosse aí fui atrás pegamos ZAP pegou no meu uma DLC ele"
50,1232780380371116034,1525680670881849344,2022-05-15,Garotos Podres tocando Papai Noel Velho Batuta no bis ❤️ https://t.co/gkQdWGIm1G
51,21415271,1525664855096758272,2022-05-15,"Garotos Podres

35/100 em Hangar 110 https://t.co/2GYsX2JhNE"
52,194575741,1525660395758829568,2022-05-15,"Hoje tive o prazer de conhecer a Drª Maria Emília Gadelha, já conhecia o seu trabalho em defesa do que é certo na medicina. em Estado De São Paulo - Brasil https://t.co/HmOOQ5CBpb"
53,29595934,1525642684811161600,2022-05-15,Just posted a photo @ Shopping D https://t.co/BKEkBB4UBL
54,21415271,1525642342140678145,2022-05-15,"Statues on Fire

34/100 em Hangar 110 https://t.co/OYOSIzekxy"
55,21415271,1525638495888359425,2022-05-15,"Garotos Podres (at @Hangar110 in São Paulo, SP) https://t.co/tOGR8CrMNk"
56,1232780380371116034,1525638433586167809,2022-05-15,“Lugar de mulher é na arquibancada. Respeita as minas!” @statuesonfire https://t.co/QlbMQuXaDY
