,author_id,tweet_id,created_at,text
0,66024631,1536815797653458948,2022-06-14,Minha gangue em Hangar 110 https://t.co/hIdE7ilsIq
1,52058931,1536794993184149508,2022-06-14,https://t.co/GHSkUS3Sq8
2,774469015,1536776962307399685,2022-06-14,"A grandiosidade eternizada ao acesso de todos!
📍 CATAVENTO CULTURAL - pARQUE DOM PEDRO II - SÃO PAULO BRASIL

#maisumnomundo #saopaulo #catavento #museu #museum #oldbuilding #education #culture em Museu Catavento https://t.co/aOS40oAKee"
3,906138272669327360,1536767653053857792,2022-06-14,"I'm at Mercado Municipal Paulistano - @portalmercadao in São Paulo, SP https://t.co/xSYwLKT1JU"
4,80901793,1536750647437053953,2022-06-14,#festajunina #quermesse em Ginásio da Portuguesa https://t.co/Mkgsy3KRLn
5,1530266753875443712,1536746082063028232,2022-06-14,Vai um canole de nutella ou pastel Belém. Irresistível! https://t.co/enKFOYIBlJ
6,119695079,1536742717530816516,2022-06-14,"We are the Crystal Gems! 🌟💫⭐

#stevenuniverso #stevenuniverse #crystalgems #stevenuniversecosplay  #stevenuniversobrasil #cartoonnetwork #cartoonnetworkbrasil #cn #cnbrasil #rebeccasugar #lgbt #lgbtq🌈 em Fatec São Paulo https://t.co/MMeUi4iCZZ"
7,906138272669327360,1536730265845911552,2022-06-14,"I'm at Catavento Cultural e Educacional in São Paulo, SP https://t.co/tTYoKDQdkR"
8,2582573880,1536725793128292358,2022-06-14,Human Kraken 10.6.22 em Hangar 110 https://t.co/WE9UhSf4Jw
9,1644110526,1536724938773733376,2022-06-14,Acabou de publicar uma foto em Canindé (bairro de São Paulo) https://t.co/E88qQnGXUY
10,6503,1536723333408034818,2022-06-14,"Reação do MTST aos 33 milhões com fome, notícia da semana passada. https://t.co/X1fXQEo4TC"
11,1378205547942588416,1536710734712819715,2022-06-14,"Rafael Cardoso
Por @leccopires em Estúdio Alex Pires https://t.co/7ILtEZkLVy"
12,1436089266526896130,1536701152791764994,2022-06-14,"Busque nas palavras dos sábios, inspirações e forças para sempre continuar lutando pelo que você acredita e siga em frente! #canalcorvittodigital #youtubercorvitto #selfietime #youtuberlyfestyle #videomaker https://t.co/LiDICmdlfg"
13,781929521817722880,1536697876952141824,2022-06-14,"🟡 EVENTO NOVA VIDA 

Um dia Memorável na vida dos que estiveram presente neste grande EventoAinda sobre o dia 12 de Junho. em Templo de Salomão https://t.co/C4EvVyu7la"
14,103958917,1536683378568724480,2022-06-14,"Receita do @MaisVoce. Já amava rabada, mas agora só como se for a receita da @ANAMARIABRAGA ! (Já pensando no almoço!)
@rodrigobocardi @tvglobo 
#bdsp #tvglobo #globo #aovivo #sp #saopaulo https://t.co/hh5OpBqdG5"
15,1521384480983953408,1536646444295258112,2022-06-14,https://t.co/hG96T2ds0E
16,2948921992,1536643909505253376,2022-06-14,"Definitivamente estou convencido da importância da Escola em Período Integral para o ensino público. Porém, precisamos melhorar as estruturas das escolas, para dar melhores condições de aprendizagem e convívio em público. https://t.co/qPmbpp5h65"
17,1189033626308153345,1536564185898881024,2022-06-14,"REUNIÃO DO ESTADO EM NOSSA IGREJA MÃE
COM NOSSO LÍDER MAIOR @oficialbisposamuelferreira 
INÍCIO DE SEMANA PRODUTIVA, CERTO DE QUE COISAS BOAS ESTÁ POR VIR. #adbras #adbrassp #somosadbras #sampacity https://t.co/UFRuCdVGhT"
18,395689514,1536555024439967746,2022-06-14,@unpossess What the fuck...
19,817882111868805120,1536486827418431494,2022-06-13,@loja_buttinari em Bras Aqui https://t.co/lB40QNFTRU
20,1644110526,1536441358675677184,2022-06-13,Acabou de publicar uma foto em Canindé (bairro de São Paulo) https://t.co/O4zhuqrARH
21,1490755142659969026,1536394384962469889,2022-06-13,https://t.co/zMw5VXGIze
22,53587588,1536387087615795200,2022-06-13,Acabou de publicar uma foto em Petz https://t.co/9P9BWzp9eq
23,817882111868805120,1536379768752463872,2022-06-13,Acabou de publicar uma foto em Bras Aqui https://t.co/oIBoFfH6Qt
24,2582573880,1536362880794255361,2022-06-13,Human Kraken 10.6.22 em Hangar 110 https://t.co/HULFes6ZfP
25,817882111868805120,1536358716215263233,2022-06-13,"Lute com determinação, abrace a vida com paixão, perca com classe e vença com ousadia, porque o mundo pertence a quem se atreve concorda? em Bras Aqui https://t.co/lZ9WEdYdWf"
26,817882111868805120,1536353514594500611,2022-06-13,@jejpijamas em Bras Aqui https://t.co/woeaHrM0AU
27,1497519418070474752,1536347764791066626,2022-06-13,"Fim de semana mais que especial, com você. E sempre com você 💚 em Festa  na Portuguesa Lusa https://t.co/XrugnHbRne"
28,1331371660067344385,1536347150887419907,2022-06-13,"Pessoal, a SP Escola de Teatro está com vagas abertas para cursos incríveis.

Para quem se interessa pela área de Iluminação,  Sonoplastia ou Técnicas de Palco não pode perder essa oportunidade.

Bora estudar na @escoladeteatro https://t.co/Eo7rNiPMA6"
29,1331371660067344385,1536345962481758209,2022-06-13,"Curso técnico de Iluminação está com vagas abertas, bora laaaa

@escoladeteatro https://t.co/1cignTt1i7"
30,1331371660067344385,1536345630766821376,2022-06-13,"Pessoal bora, não percam a oportunidade de estudar nessa escola ♥️

@escoladeteatro https://t.co/ONxb3MmtAl"
31,92772584,1536323909003386882,2022-06-13,"Bomba periférica utilizada principalmente para abastecimento doméstico e pequenos prédios.
Sua principal característica é o bombeamento de água à grandes alturas e distâncias.
Acesse: https://t.co/KLkqfdysIV
WhatsApp: (11) 93276-3926
#portaldasbombas #lepono https://t.co/3AjHx3a7Xt"
32,1536117973886410758,1536153237790900224,2022-06-13,"Hot hot😋😋😋😋🔞🔞🔞🔞🔞🔞
Logo mais solto meu onlyfans 🔞😍😍😍 https://t.co/MkrliZSMVR"
33,32866668,1536152634146553857,2022-06-13,"Vinte anos de namoro! Te amo, mortadela!!! em Festa de Rua São Vito https://t.co/pU1NLGgZF5"
34,781929521817722880,1536134422168145920,2022-06-12,"O povo, que estava assentado em trevas, viu uma grande luz; e, aos que estavam assentados na região e sombra da morte, a luz raiou. Mateus 4:16 em Templo de Salomão https://t.co/Fc5MxX5Ht9"
35,2582573880,1536114385147400192,2022-06-12,Human Kraken 10.6.22 em Hangar 110 https://t.co/jXCLipClHx
36,781929521817722880,1536110364701691905,2022-06-12,"Temos a Grande alegria de ver as pessoas que chegaram aqui hoje tristes e infelizes saindo sorrindo 😀.

Isso não Tem preço. em Templo de Salomão https://t.co/vikPeGhAyr"
37,1492579135079727108,1536102154364194818,2022-06-12,Just posted a photo @ Dela Belle enxovais https://t.co/rX7TqHiwH1
38,781929521817722880,1536091377871663104,2022-06-12,"Hoje, milhares de vidas foram transformadas pelo poder da Fé.

Um evento extraordinário que deu uma Nova vida por meio da Fé a essa multidão.

💥 Que Deus abençoe a todos os agentes do bem que lutaram por essas almas. https://t.co/470fjPN4kr"
39,66024631,1536091067187183620,2022-06-12,Rockeiros rockeirando em Hangar 110 https://t.co/fZIoNLjZAx
40,39091214,1536075243399155712,2022-06-12,"Ainda sobre ontem… comprinhas no centro histórico da minha terrinha!
❤️

#sp #sampa #011 #rua25demarço #25demarço #saopaulo #sãopaulo em Rua 25 de Março https://t.co/Nlk3FCgtiB"
41,330378043,1536050675611844609,2022-06-12,Acabou de publicar uma foto em PMs de Cristo https://t.co/2Qg01PRu2I
42,1133183480186232832,1536048766771396609,2022-06-12,Acabou de publicar uma foto em Athelier das Noivas https://t.co/2aQzEExHgA
43,1458177303305932811,1535995034092331009,2022-06-12,"Bem, hj é o nosso dia. Lacan diz que amar é dar oq não se tem para alguém que não o quer, e isso não poderia nos descrever melhor. Durante todo nosso tempo juntos você foi a pessoa que sempre esteve ali, mesmo no silêncio, não estando. 
T amo, @radValll https://t.co/OzEIIbikkf"
44,1481414343103295488,1535989308385021954,2022-06-12,olha só um lugar que contempla minhas personalidades https://t.co/IsbRSLkzk5
45,330378043,1535987392821460992,2022-06-12,Feliz dia dos Namorados em PMs de Cristo https://t.co/5TyNdKcx1g
46,1499494147576766464,1535956631674052610,2022-06-12,https://t.co/OyLnBgvhPx
47,817882111868805120,1535756939338010624,2022-06-11,Acabou de publicar uma foto em Bras Aqui https://t.co/wfbJ4B5vRg
48,25531371,1535736258256830470,2022-06-11,Dia de festa! em Escola Santa Maria https://t.co/vtSeHja0t5
49,203809353,1535721661298786305,2022-06-11,"I'm at Escola Santa Maria in São Paulo, SP https://t.co/PBugUvcVLL https://t.co/1WdOREfWf3"
50,781929521817722880,1535692767669768192,2022-06-11,"Todos juntos contra a Depressão!
Amanhã é o grande dia, ainda dá tempo de você convidar alguém para estar neste evento especial e inédito. em Templo de Salomão https://t.co/K0dQ5VU5KA"
51,203809353,1535656877559894018,2022-06-11,I'm at Top Cau in São Paulo https://t.co/pkM3TnU0vR https://t.co/Uaden26Hvt
52,330378043,1535639982139920391,2022-06-11,"Boa tarde a todos... Que Deus nós guarde a todo tempo. 

Força e Honra, Capelania Militar

Efésios 4:3 em PMs de Cristo https://t.co/vEPeSuT9d2"
53,194575741,1535617162022461441,2022-06-11,Acabou de publicar uma foto em Estado De São Paulo - Brasil https://t.co/82Rjebp0yP
54,781929521817722880,1535593510434390019,2022-06-11,Um programa Especial dedicado a quem sofre com a dor da alma. em Templo de Salomão https://t.co/41V3KeM1F2
55,715191572850147328,1535578838909931522,2022-06-11,Acabou de publicar uma foto em SENAI SP Têxtil e Moda https://t.co/R9dQqbqCCb
56,1313752729228120065,1535546191299198978,2022-06-11,Um frio do crl
57,2582573880,1535409758466891778,2022-06-10,Como eu tava com saudade desse lugar https://t.co/Xs79uucmlv
58,316775437,1535307387824766976,2022-06-10,Acabou de publicar uma foto em Museu Catavento https://t.co/pRqYNWHkCj
59,367186432,1535243309093986313,2022-06-10,"https://t.co/QPBohSi2vX 

🇧🇷🇧🇷🇧🇷🇧🇷🇧🇷🇧🇷 https://t.co/3oP51LdYC3"
60,57481509,1535221208425410560,2022-06-10,Café da manhã 🤭 https://t.co/GhR5sCBQZH
61,781929521817722880,1535039187707101188,2022-06-09,"A jaqueta DTC é ideal para aquecer os integrantes do grupo Depressão Tem Cura durante os dias mais frios ☁️

Aproveite para adquirir a sua pela @arcacenter #FicaDica😉 em Templo de Salomão https://t.co/o2oS4aXg4P"
62,1299559550090182656,1535039082283290625,2022-06-09,Acabou de publicar uma foto em Shopping D https://t.co/P2cQjwuudq
63,1311939384149790720,1535035101201027078,2022-06-09,Tentando sempre ser sol nos dias nublados… em Mercado Municipal de São Paulo https://t.co/K9uXntVIss
64,194575741,1535012276280995840,2022-06-09,"Sugestão para o MTST fazer protesto contra rico!
.
Quem para R$ 20.000,00 em um prato de comida?
. em Estado De São Paulo - Brasil https://t.co/wjhDFCvnbz"
65,194575741,1535008398747500544,2022-06-09,Acabou de publicar uma foto em Estado De São Paulo - Brasil https://t.co/fkYqEPGaRk
66,3293588062,1535004871925108736,2022-06-09,❤️‍🔥 https://t.co/p4Nx5n0Uo1
67,35130263,1535003491147685889,2022-06-09,"Aqui estacão Brás da #CPTM #L12 

A cavalaria não perdoa https://t.co/XwJh7Pjo3l"
68,68819250,1534863448378679299,2022-06-09,#tbt em Ipiranga https://t.co/bpsMvBjN4P
69,906195663104475136,1534842131260620802,2022-06-09,estou boiola baitola derretida molenga de amor https://t.co/lXqaVKj5Mr
