,author_id,tweet_id,created_at,text
0,1479874758430928897,1547334113643806720,2022-07-13,"Dá pra atualizar o cartaz da academia? 👊
#fitnessaddict em Conjunto Residencial Condominio Marajoara https://t.co/XdolB8r2fN"
1,32935648,1547332223174598659,2022-07-13,Acabou de publicar uma foto em Igreja Betesda https://t.co/dbipU8ncTI
2,158160208,1547318324924743683,2022-07-13,Acabou de publicar uma foto em Hoje eu só quero Agradecer https://t.co/u2WVkAq97B
3,87043108,1547312704091717638,2022-07-13,Acabou de publicar uma foto em Autódromo de Interlagos https://t.co/xYRHv0jXm0
4,4130852296,1547304515828949004,2022-07-13,Acabou de publicar uma foto em Grêmio Esportivo Campo Grande https://t.co/oOrtzZEKWF
5,90533220,1547265717980090368,2022-07-13,Bora tiozinho👊🏻 #gym #idoso #terceiraidade https://t.co/kQSGk3gkAk
6,1538188316851507206,1547248461921357824,2022-07-13,"hoje acordei com essa paranoia que foi comprovada por 3 pessoas diferentes, ninguém me vê mais em casa, toda hora que alguém fala cmg eu tô no escritório https://t.co/1kiY6TnLmb"
7,75946968,1547212422397804546,2022-07-13,Da até dó de colher em Campo Grande -Interlagos https://t.co/phkWHZTRAO
8,15410917,1547189164759728128,2022-07-13,"Por mais academias que toquem ‘rock and roll’, como o som ambiente.

Viva o Dia Mundial do Rock! 🤘🏻

#rock #rocknroll #fitness #smartfit #gym #saopaulo #brazil #applewatch #apple em Smart Fit Av. Nossa Senhora Do Sabara https://t.co/n4hx1SWoII"
9,15410917,1547170887253778434,2022-07-13,"Bom dia, feliz Dia Mundial do Rock! (@ Smart Fit in São Paulo) https://t.co/egZtWIaQfZ"
10,1047151406199840768,1547086047867244544,2022-07-13,Bom dia! em Núcleo Espírita Paulo de Tarso https://t.co/oyqGq3jiNg
11,36748548,1546944487779360769,2022-07-12,"I'm at Peg Pese Hortifruti in São Paulo, SP w/ @_ponkitz https://t.co/ODsiKSd5Rw"
12,162937441,1546921187833520131,2022-07-12,I'm at @HabibsOnline in São Paulo https://t.co/qgTkW9H5nx
13,32130620,1546915357721501696,2022-07-12,Acabou de publicar uma foto em Ambrosia Doces Artesanais por Aline Sartor https://t.co/yLtzvrJQpx
14,32130620,1546915159050010624,2022-07-12,Acabou de publicar uma foto em Ambrosia Doces Artesanais por Aline Sartor https://t.co/YnoNiY0gJv
15,2566083565,1546847484907065346,2022-07-12,"Novidades em breve…. 

Hahahahaha 😎

#novidadesembreve #aguarde #diamonds #lifestyle em Buffet Piatto https://t.co/h0qhOOjQtT"
16,1047151406199840768,1546711762233327616,2022-07-12,Bom dia! em Núcleo Espírita Paulo de Tarso https://t.co/6fC7ijB16G
17,69801904,1546670213801734145,2022-07-12,Acabou de publicar uma foto em Smart Fit https://t.co/S7Eam5E7KR
18,138950210,1546607668781109253,2022-07-11,Acabou de publicar uma foto em Autódromo de Interlagos https://t.co/YK2jxADeVt
19,32935648,1546505230975922176,2022-07-11,Acabou de publicar uma foto em Igreja Betesda https://t.co/e8RjnqPzRL
20,162476497,1546489478415618048,2022-07-11,"O resultado não foi qual gostaríamos, mas nada perdido. É buscar nas próxs! 💆🏽‍♂️💆🏽🙏🦅⚽️🖤✊🙌 em Cdc Vila Anhanguera https://t.co/scXJbLgFBX"
21,1047151406199840768,1546381738015956997,2022-07-11,Bom dia! em Núcleo Espírita Paulo de Tarso https://t.co/IXTDW5kAds
22,75946968,1546289883689492480,2022-07-11,Esse ama dinossauro em Shopping SP Market https://t.co/jMFzmgVh7G
23,2366101488,1546256638079819777,2022-07-10,🤙🏼👊🏼 em Mahalo https://t.co/ibZB6SNzMf
24,15410917,1546231580682747904,2022-07-10,"Rumo as compras! (at @LeroyMerlinBra in São Paulo, SP) https://t.co/t18QW3EDP2"
25,331268697,1546176273139089409,2022-07-10,vou por ai
26,55356202,1546140728283250688,2022-07-10,Drinking a Tangará by OCA Cervejaria @ Condomínio Forest Hills — https://t.co/cIjW2tqhYJ
27,1047151406199840768,1546071993535139840,2022-07-10,Bom dia! em Núcleo Espírita Paulo de Tarso https://t.co/IvtkdA5K7t
28,315490988,1545959256628903938,2022-07-10,"Charles Perrault,  Wilhelm e Jacob Grimm, galos que chegaram pintainhos e hoje pesam mais de 5 Kg cada!!😍 em Instituto Edukaleidos https://t.co/6nFJvvB6eZ"
29,41880014,1545958497694625792,2022-07-10,Acabou de publicar uma foto em Condomínio Portal do Brooklin https://t.co/hojVJzNZuJ
30,315490988,1545957298752950283,2022-07-10,"Olha as policiais do galinheiro aqui!! Quando vêem confusão elas logo correm atrás dos encrenqueiros como que dizendo ""vamos circulando ai rapaziada"" rss e saem todos correndo🤣 em Instituto Edukaleidos https://t.co/c8txZEtzKm"
31,315490988,1545954221832404992,2022-07-10,Frida Kalo.  A galinha D'Angola mais temida do galinheiro 😅 em Instituto Edukaleidos https://t.co/3FYJZzEorU
32,315490988,1545946883637579776,2022-07-10,"Conde de Monte Cristo,  Falada e Vítor Hugo são os gansos de nosso projeto permacultura TERAPÊUTICA 🤩 em Instituto Edukaleidos https://t.co/P3p67I2z3P"
33,315490988,1545936637758214148,2022-07-10,Olha o Gato de Botas tirando um cochilo no consultório depois do atendimento😍 em Instituto Edukaleidos https://t.co/z4EVmgR28W
34,585726008,1545936413887238148,2022-07-10,"@_tiagoromano lenda do drift, gente boa demais, vários papos sobre os carros japoneses. em Autódromo de Interlagos https://t.co/7FL54KaiDh"
35,585726008,1545936192465690624,2022-07-10,@thiagoroman em Autódromo de Interlagos https://t.co/StcMm0Yx52
36,315490988,1545929008822603776,2022-07-10,Falada (a gansa) pensa que é namorada do Wilhelm Grimm (galo branco) em Instituto Edukaleidos https://t.co/6hPScM4BUS
37,585726008,1545916618357628928,2022-07-09,Chevrolet Corvette em Autódromo de Interlagos https://t.co/Ex5qY7XgIq
38,1520020871213207552,1545916312714706945,2022-07-09,@Beto1967B @trocafone @TrocafoneTech Acabei de passar em 1. Não compensa não.
39,585726008,1545916118853996547,2022-07-09,Ferrari SF90 @duasrodasbr @revistafullpower em Autódromo de Interlagos https://t.co/4gXRzg47AT
40,585726008,1545912807337639943,2022-07-09,"Ferrari SF90 hoje em Interlagos, que carro hein em Autódromo de Interlagos https://t.co/7O6HDh67B0"
41,585726008,1545906519480336386,2022-07-09,Drift da galera do @ultimatedriftbr hoje em Interlagos em Autódromo de Interlagos https://t.co/SisayIjFrY
42,585726008,1545896757820809216,2022-07-09,Carros expostos no Festival Interlagos @revistafullpower @duasrodasbr em Autódromo de Interlagos https://t.co/6HDmZ6Nz0I
43,585726008,1545893101134299137,2022-07-09,"@ultimatedriftbr, fotos de todos os carros em Interlagos hoje em Autódromo de Interlagos https://t.co/TrAQcPJAbG"
44,55356202,1545888022780121095,2022-07-09,Enjoying a Finito IPAtagônia - IPA com Lúpulos Argentinos — https://t.co/evHOkJPogz
45,55356202,1545887493278531586,2022-07-09,Drinking a Finito India Brown Ale by @cerveja_invicta @ Condomínio Forest Hills — https://t.co/0QPXM2Pt6R #photo
46,55356202,1545887180316459009,2022-07-09,Drinking a Hilda Session IPA by @eisenbahn @ Condomínio Forest Hills — https://t.co/K4IVDYVL42 #photo
47,55356202,1545886657341177857,2022-07-09,Drinking a Paniza Premium Pilsner by @panizabrewing @ Condomínio Forest Hills — https://t.co/Poxz1v6b2J
48,161894073,1545843439312437248,2022-07-09,"Está bem que você acredite em Deus. Mas vai armado 🫡

#taurus #ts9 #380taurus em Clube De Tiro https://t.co/7VcSgEvXHE"
49,255019727,1545812823804182528,2022-07-09,Comemorando niver do nosso Pedro💙💙💙💙 em Parque da Mônica https://t.co/M9XdTGSyyY
50,585726008,1545795765196541958,2022-07-09,Dodge Viper em Autódromo de Interlagos https://t.co/rrD1MKvgGs
51,42899313,1545766963120672768,2022-07-09,Acabou de publicar uma foto em Autódromo de Interlagos https://t.co/iRnGB18LQ1
52,24683934,1545751396758200320,2022-07-09,Acabou de publicar uma foto em Autódromo de Interlagos https://t.co/JAHkKYVgW5
53,1047151406199840768,1545749035713269765,2022-07-09,Verdade! em Núcleo Espírita Paulo de Tarso https://t.co/faEcIxCY0u
54,1047151406199840768,1545665276380954626,2022-07-09,Bom dia! em Núcleo Espírita Paulo de Tarso https://t.co/EWemp3jCA0
55,59664961,1545546588604563458,2022-07-08,Acabou de publicar uma foto em Autódromo de Interlagos https://t.co/ffApERtk0C
56,1272907131293970442,1545517270335627264,2022-07-08,"Tudo pronto pra segunda-feira 

@niposantoamaro  #vempralocatudo🔝 em NIPO Santo Amaro https://t.co/Yq7mXd9Rwa"
57,1535046142832017416,1545507607649157123,2022-07-08,#pumpndump #empinabumbum https://t.co/OpKSpz6Omm
58,1374104063986520064,1545506120248197123,2022-07-08,"AMÉM IRMÃOS!!!!!!!!!!!!!!
@Joaoxd2_ @swinkajou275 @Handiro_I @drbellsbr https://t.co/0lKd3qfPdI"
59,69801904,1545475229539045376,2022-07-08,"Treinando em horário diferente
Excepcionalmente hoje 🥱 em Smart Fit https://t.co/ZlfRyjkr05"
60,185064519,1545454203748753408,2022-07-08,Acabou de publicar uma foto em Shopping SP Market https://t.co/vfcfBsYjMo
61,24683934,1545383171050520577,2022-07-08,Acabou de publicar uma foto em Autódromo de Interlagos https://t.co/n4rYWzOMIZ
62,175268383,1545342834580066304,2022-07-08,Agradeço por mais um dia! Boraaaaa! em Interlagos https://t.co/w3syP4Tlhr
63,1047151406199840768,1545295083078987776,2022-07-08,Bom dia! em Núcleo Espírita Paulo de Tarso https://t.co/zZxY8jhQMB
64,69801904,1545222447250788352,2022-07-08,"Boa noite!
Good evening! em Smart Fit https://t.co/9VSy2vD1dE"
