,author_id,tweet_id,created_at,text
0,138950210,1546607668781109253,2022-07-11,Acabou de publicar uma foto em Autódromo de Interlagos https://t.co/YK2jxADeVt
1,32935648,1546505230975922176,2022-07-11,Acabou de publicar uma foto em Igreja Betesda https://t.co/e8RjnqPzRL
2,162476497,1546489478415618048,2022-07-11,"O resultado não foi qual gostaríamos, mas nada perdido. É buscar nas próxs! 💆🏽‍♂️💆🏽🙏🦅⚽️🖤✊🙌 em Cdc Vila Anhanguera https://t.co/scXJbLgFBX"
3,1047151406199840768,1546381738015956997,2022-07-11,Bom dia! em Núcleo Espírita Paulo de Tarso https://t.co/IXTDW5kAds
4,75946968,1546289883689492480,2022-07-11,Esse ama dinossauro em Shopping SP Market https://t.co/jMFzmgVh7G
5,2366101488,1546256638079819777,2022-07-10,🤙🏼👊🏼 em Mahalo https://t.co/ibZB6SNzMf
6,15410917,1546231580682747904,2022-07-10,"Rumo as compras! (at @LeroyMerlinBra in São Paulo, SP) https://t.co/t18QW3EDP2"
7,331268697,1546176273139089409,2022-07-10,vou por ai
8,55356202,1546140728283250688,2022-07-10,Drinking a Tangará by OCA Cervejaria @ Condomínio Forest Hills — https://t.co/cIjW2tqhYJ
9,1047151406199840768,1546071993535139840,2022-07-10,Bom dia! em Núcleo Espírita Paulo de Tarso https://t.co/IvtkdA5K7t
10,315490988,1545959256628903938,2022-07-10,"Charles Perrault,  Wilhelm e Jacob Grimm, galos que chegaram pintainhos e hoje pesam mais de 5 Kg cada!!😍 em Instituto Edukaleidos https://t.co/6nFJvvB6eZ"
11,41880014,1545958497694625792,2022-07-10,Acabou de publicar uma foto em Condomínio Portal do Brooklin https://t.co/hojVJzNZuJ
12,315490988,1545957298752950283,2022-07-10,"Olha as policiais do galinheiro aqui!! Quando vêem confusão elas logo correm atrás dos encrenqueiros como que dizendo ""vamos circulando ai rapaziada"" rss e saem todos correndo🤣 em Instituto Edukaleidos https://t.co/c8txZEtzKm"
13,315490988,1545954221832404992,2022-07-10,Frida Kalo.  A galinha D'Angola mais temida do galinheiro 😅 em Instituto Edukaleidos https://t.co/3FYJZzEorU
14,315490988,1545946883637579776,2022-07-10,"Conde de Monte Cristo,  Falada e Vítor Hugo são os gansos de nosso projeto permacultura TERAPÊUTICA 🤩 em Instituto Edukaleidos https://t.co/P3p67I2z3P"
15,315490988,1545936637758214148,2022-07-10,Olha o Gato de Botas tirando um cochilo no consultório depois do atendimento😍 em Instituto Edukaleidos https://t.co/z4EVmgR28W
16,585726008,1545936413887238148,2022-07-10,"@_tiagoromano lenda do drift, gente boa demais, vários papos sobre os carros japoneses. em Autódromo de Interlagos https://t.co/7FL54KaiDh"
17,585726008,1545936192465690624,2022-07-10,@thiagoroman em Autódromo de Interlagos https://t.co/StcMm0Yx52
18,315490988,1545929008822603776,2022-07-10,Falada (a gansa) pensa que é namorada do Wilhelm Grimm (galo branco) em Instituto Edukaleidos https://t.co/6hPScM4BUS
19,585726008,1545916618357628928,2022-07-09,Chevrolet Corvette em Autódromo de Interlagos https://t.co/Ex5qY7XgIq
20,1520020871213207552,1545916312714706945,2022-07-09,@Beto1967B @trocafone @TrocafoneTech Acabei de passar em 1. Não compensa não.
21,585726008,1545916118853996547,2022-07-09,Ferrari SF90 @duasrodasbr @revistafullpower em Autódromo de Interlagos https://t.co/4gXRzg47AT
22,585726008,1545912807337639943,2022-07-09,"Ferrari SF90 hoje em Interlagos, que carro hein em Autódromo de Interlagos https://t.co/7O6HDh67B0"
23,585726008,1545906519480336386,2022-07-09,Drift da galera do @ultimatedriftbr hoje em Interlagos em Autódromo de Interlagos https://t.co/SisayIjFrY
24,585726008,1545896757820809216,2022-07-09,Carros expostos no Festival Interlagos @revistafullpower @duasrodasbr em Autódromo de Interlagos https://t.co/6HDmZ6Nz0I
25,585726008,1545893101134299137,2022-07-09,"@ultimatedriftbr, fotos de todos os carros em Interlagos hoje em Autódromo de Interlagos https://t.co/TrAQcPJAbG"
26,55356202,1545888022780121095,2022-07-09,Enjoying a Finito IPAtagônia - IPA com Lúpulos Argentinos — https://t.co/evHOkJPogz
27,55356202,1545887493278531586,2022-07-09,Drinking a Finito India Brown Ale by @cerveja_invicta @ Condomínio Forest Hills — https://t.co/0QPXM2Pt6R #photo
28,55356202,1545887180316459009,2022-07-09,Drinking a Hilda Session IPA by @eisenbahn @ Condomínio Forest Hills — https://t.co/K4IVDYVL42 #photo
29,55356202,1545886657341177857,2022-07-09,Drinking a Paniza Premium Pilsner by @panizabrewing @ Condomínio Forest Hills — https://t.co/Poxz1v6b2J
30,161894073,1545843439312437248,2022-07-09,"Está bem que você acredite em Deus. Mas vai armado 🫡

#taurus #ts9 #380taurus em Clube De Tiro https://t.co/7VcSgEvXHE"
31,255019727,1545812823804182528,2022-07-09,Comemorando niver do nosso Pedro💙💙💙💙 em Parque da Mônica https://t.co/M9XdTGSyyY
32,585726008,1545795765196541958,2022-07-09,Dodge Viper em Autódromo de Interlagos https://t.co/rrD1MKvgGs
33,42899313,1545766963120672768,2022-07-09,Acabou de publicar uma foto em Autódromo de Interlagos https://t.co/iRnGB18LQ1
34,24683934,1545751396758200320,2022-07-09,Acabou de publicar uma foto em Autódromo de Interlagos https://t.co/JAHkKYVgW5
35,1047151406199840768,1545749035713269765,2022-07-09,Verdade! em Núcleo Espírita Paulo de Tarso https://t.co/faEcIxCY0u
36,1047151406199840768,1545665276380954626,2022-07-09,Bom dia! em Núcleo Espírita Paulo de Tarso https://t.co/EWemp3jCA0
37,59664961,1545546588604563458,2022-07-08,Acabou de publicar uma foto em Autódromo de Interlagos https://t.co/ffApERtk0C
38,1272907131293970442,1545517270335627264,2022-07-08,"Tudo pronto pra segunda-feira 

@niposantoamaro  #vempralocatudo🔝 em NIPO Santo Amaro https://t.co/Yq7mXd9Rwa"
39,1535046142832017416,1545507607649157123,2022-07-08,#pumpndump #empinabumbum https://t.co/OpKSpz6Omm
40,1374104063986520064,1545506120248197123,2022-07-08,"AMÉM IRMÃOS!!!!!!!!!!!!!!
@Joaoxd2_ @swinkajou275 @Handiro_I @drbellsbr https://t.co/0lKd3qfPdI"
41,69801904,1545475229539045376,2022-07-08,"Treinando em horário diferente
Excepcionalmente hoje 🥱 em Smart Fit https://t.co/ZlfRyjkr05"
42,185064519,1545454203748753408,2022-07-08,Acabou de publicar uma foto em Shopping SP Market https://t.co/vfcfBsYjMo
43,24683934,1545383171050520577,2022-07-08,Acabou de publicar uma foto em Autódromo de Interlagos https://t.co/n4rYWzOMIZ
44,175268383,1545342834580066304,2022-07-08,Agradeço por mais um dia! Boraaaaa! em Interlagos https://t.co/w3syP4Tlhr
45,1047151406199840768,1545295083078987776,2022-07-08,Bom dia! em Núcleo Espírita Paulo de Tarso https://t.co/zZxY8jhQMB
46,69801904,1545222447250788352,2022-07-08,"Boa noite!
Good evening! em Smart Fit https://t.co/9VSy2vD1dE"
47,41838450,1545149720141643776,2022-07-07,Acabou de publicar uma foto em Autódromo de Interlagos https://t.co/XRTF4hHGdJ
48,32935648,1545105486093160451,2022-07-07,Acabou de publicar uma foto em Igreja Betesda https://t.co/UuRREoYCkG
49,65503972,1545080363642396672,2022-07-07,Acabou de publicar uma foto em Aquarius Sabará Bar https://t.co/qM2k3brqkd
50,1421505300784373771,1545048650279137283,2022-07-07,"Bom dia Seus lindos !!
Chama o bombeiro 🚒 que meu pré treino bateu num grau hoje 🔥🔥🔥"
51,32130620,1545033475895484419,2022-07-07,Acabou de publicar uma foto em Ambrosia Doces Artesanais por Aline Sartor https://t.co/fIyKR4XQLh
52,175268383,1544995794377383938,2022-07-07,Obrigado por mais uma manhã! em Interlagos https://t.co/YWy5mtiUuK
53,836084679002447873,1544991363154038788,2022-07-07,Minha princesas❤️❤️😍 em Cinemark Shopping SP Market https://t.co/hxqxBsb9CC
54,1047151406199840768,1544988599048978435,2022-07-07,Reflexão. em Núcleo Espírita Paulo de Tarso https://t.co/keb2Eq01dI
55,69801904,1544883374040522752,2022-07-07,"Treino de quarta-feira
Peitoral 1 + tríceps @ Smart Fit https://t.co/sCLj5UBRxV"
56,1047151406199840768,1544880697038487559,2022-07-07,Bom dia! @ Núcleo Espírita Paulo de Tarso https://t.co/P1etoftHDn
57,282760088,1544850617453223936,2022-07-07,Sobre o último sábado #volleyball @ Rolleyball Esportes https://t.co/quhSU1x8il
58,1412583346639626243,1544789969021341696,2022-07-06,enjoying a picnic @ Vancouver - Canada https://t.co/YFUPjwpe46
59,32130620,1544667146139082752,2022-07-06,Acabou de publicar uma foto em Ambrosia Doces Artesanais por Aline Sartor https://t.co/cCjfhhysxZ
60,32130620,1544666848335101952,2022-07-06,Acabou de publicar uma foto em Ambrosia Doces Artesanais por Aline Sartor https://t.co/ra6rzUalyc
61,1047151406199840768,1544621307287031808,2022-07-06,Preces... em Núcleo Espírita Paulo de Tarso https://t.co/FOFdrVyQa5
62,1047151406199840768,1544556402483630080,2022-07-06,Bom dia! em Núcleo Espírita Paulo de Tarso https://t.co/cXqr0i45bw
63,69801904,1544514313708347392,2022-07-06,Cansaço bom... esse pelo menos tem resultado 🤣🤣🤣🤣🤣 em Smart Fit https://t.co/PtkCoUTQkK
64,69801904,1544493651509891072,2022-07-06,"Terças-feiras
Treino de ombros 😁💪 em Smart Fit https://t.co/TmK1qMLQOk"
