,author_id,tweet_id,created_at,text
0,1047151406199840768,1530767239057756160,2022-05-29,Bom dia! em Núcleo Espírita Paulo de Tarso https://t.co/2ojY4HfKfq
1,142048515,1530746363008495616,2022-05-29,Na madrugada fria com @sotrackboa em Autódromo de Interlagos https://t.co/zf0AhQB3me
2,942333025,1530714447081312256,2022-05-29,Só Track Boa 🔥 #2022 em Autódromo de Interlagos https://t.co/TpOjRcan7F
3,1314752544355373059,1530683369717219329,2022-05-28,Chegouuuuuuu crlh ❤️‍🔥 sotrackboazinha https://t.co/1eJSrt2mDY
4,58244220,1530680330130276353,2022-05-28,"Hoje fui prestigiar o @FestRGB pela tarde. Muita gente bacana se reencontrando nesse retorno de eventos presenciais, coleções incríveis de games, palestras esclarecedoras e gameplay EXCLUSIVO de TMNT: Shredder's Revenge. Mais um momento icônico do cenário retrô nacional. Foda! 💙 https://t.co/Q4ZILeh7Lx"
5,1697271211,1530673698318917634,2022-05-28,Rolando agora um painel com o @Arnitrololo da @Dotemu sobre o novo jogo das Tartarugas Ninja. Moderação dos incríveis @FabioSantana79  e @horokeu https://t.co/C18S1SmNfR
6,1697271211,1530670369115254786,2022-05-28,"Grande alegria de ver o incrível trabalho que o time do Festival Retro Games preparou nessa segunda edição presencial do evento. Conteúdo excelente e muito relevante para o fomento da cena de desenvolvimento nacional, orgulho demais! Parabéns a todos os envolvidos no projeto 👏👏 https://t.co/BMY7PwizZ9"
7,1521957630473736192,1530636172300636160,2022-05-28,"#planetaterratur
#planetaterrafestas 
#tiojack2 https://t.co/UKJOidn3I5"
8,1218264471367561217,1530584496524886017,2022-05-28,No tesão aqui zona sul https://t.co/GVrqTtrsOG
9,184600052,1530559503959310336,2022-05-28,Dia 03 | @lollapaloozabr | @martingarrix | @alesso em Autódromo de Interlagos https://t.co/wnpKw4DRJ9
10,184600052,1530558875904221184,2022-05-28,Dia 03 | @lollapaloozabr | @martingarrix | @alesso em Autódromo de Interlagos https://t.co/a25Dc7Gvcl
11,184600052,1530557138476716032,2022-05-28,Dia 03 | @lollapaloozabr | @martingarrix | @alesso em Autódromo de Interlagos https://t.co/OtXWXWKbUi
12,44300313,1530551390531207168,2022-05-28,"I'm at Academia Showa in São Paulo, SP https://t.co/wVfXav8qTD"
13,1047151406199840768,1530405268097409024,2022-05-28,Bom dia! em Núcleo Espírita Paulo de Tarso https://t.co/ZqOqEibjfH
14,175268383,1530382257231302656,2022-05-28,Treino realizado na @cristal.interlagos.sp 1.6km em Cristal Academia - Interlagos https://t.co/HpMF508a6g
15,175268383,1530380410244386816,2022-05-28,Mais um treino realizado na @cristal.interlagos.sp em Cristal Academia - Interlagos https://t.co/H8b6s2dZdi
16,15410917,1530364941970157568,2022-05-28,I'm at Smart Fit in São Paulo https://t.co/WX4v0WMeKZ
17,121481243,1530351488710721537,2022-05-28,🤤 https://t.co/Du7rilrsyj
18,3374951309,1530251880621920256,2022-05-27,"Treino Livre @oldstockraceoficial 
Etapa Interlagos em Autódromo de Interlagos https://t.co/WcX0Wk9CP6"
19,32935648,1530191641214128128,2022-05-27,Acabou de publicar uma foto em Igreja Betesda https://t.co/yur5DnYvV2
20,76257183,1530179750395781120,2022-05-27,Vamos ver como está esse pulmão pós Covid-19? 🫁👩🏻‍⚕🩺⚕️😍😘❤️ em Hospital São Gabriel https://t.co/Qw8N6IW8Cd
21,85834455,1530141937990193152,2022-05-27,#bomdia #sextou #suculentas #minhasplantasEmVaso #succulents #cactuslover #suculentasbrasil #succulentlove em Jd.Marajoara https://t.co/tHESEsF1aI
22,1047151406199840768,1530075246576824322,2022-05-27,Bom dia! em Núcleo Espírita Paulo de Tarso https://t.co/IJRA5B1PYO
23,69801904,1530029542080921604,2022-05-27,"Treino de quinta-feira... Peitoral ❤️
#pecsworkout #treinodepeitoral em Smart Fit https://t.co/HUKyFtwQXv"
24,712803270155235328,1530004655471722498,2022-05-27,"Mais uma sacada articulada. Condomínio Praça Marajoara.

#proglass #condominio #praçamarajoara #zonasul #envidraçamentodesacada em Praça Marajoara https://t.co/V8SxVXASeq"
25,1504453765335760898,1529904406153637888,2022-05-26,"da série: foto perdida na galeria hahaha 
obs: os números errados é o charme hahahaha, tbt desse diaaaa! 🥳 https://t.co/lZztRJSvjP"
26,3374951309,1529894777755357184,2022-05-26,4 Etapa Campeonato Paulista de Automobilismo @rallye_classicos em Autódromo de Interlagos https://t.co/bf0toXtUI5
27,90533220,1529881080899190784,2022-05-26,Comprei… foda-se rsrs. Só espero que minha esposa não descubra que eu refinanciei o carro p comprar essa blusa. #VaiCorinthians #jaquetahino #Corinthians #timao #nike #sccp https://t.co/fMovseyDP6
28,1477440766460977156,1529867830677618690,2022-05-26,"Vindo pra academia com a mesma vontade que vou em um rodízio, só que suando a camisa e não abrindo o zíper da calça. 5/7 https://t.co/XD9OxxbHd9"
29,1419142043985719300,1529866073708843012,2022-05-26,+1-1🤜🤛 https://t.co/cUoCa0Sblz
30,144811662,1529862998009028613,2022-05-26,Acabou de publicar uma foto em Estação Pinheiros - Cptm https://t.co/YZ4bETqUma
31,1280313912437755905,1529852883637633024,2022-05-26,Acabou de publicar uma foto em Interlagos https://t.co/nyFvldzePL
32,1463599973191274503,1529847471844761606,2022-05-26,Acabou de publicar uma foto em Jd. Primavera - Z/S https://t.co/xjuntFxIgl
33,44300313,1529810644651892738,2022-05-26,"I'm at Academia Showa in São Paulo, SP https://t.co/63DbMYDMoo"
34,1047151406199840768,1529713425617629184,2022-05-26,Bom dia! em Núcleo Espírita Paulo de Tarso https://t.co/mfqD0EZcXH
35,1207824480199946241,1529667539718090752,2022-05-26,what about that day...🥤 em Shopping Interlagos https://t.co/0wolSQdg4q
36,69801904,1529659296287322113,2022-05-26,O treino de quarta-feira... #triceps em Smart Fit https://t.co/C1ckDg8sLO
37,32935648,1529585826207870979,2022-05-25,Acabou de publicar uma foto em Igreja Betesda https://t.co/265tX97Xxd
38,47172916,1529570419904233473,2022-05-25,"Ela me presenteou da melhor forma possível, com a companhia dela e com muita comida ♥️🤣 
(Pra não passar o 3.1 em branco) em Outback Shopping SP Market https://t.co/AtqV9Zzci1"
39,1272907131293970442,1529528791546089472,2022-05-25,#vempralocatudo🔝   Locação de #extratora  #niposantoamaro  #aluguelextratora   #limpezaestofados  #limpezasofa em NIPO Santo Amaro https://t.co/fKB9h6Xytb
40,4130852296,1529485264749572097,2022-05-25,Acabou de publicar uma foto em Grêmio Esportivo Campo Grande https://t.co/xAEMTsaM15
41,32130620,1529475187778912257,2022-05-25,Acabou de publicar uma foto em Ambrosia Doces Artesanais por Aline Sartor https://t.co/Si6lkFmnQM
42,356650866,1529462983226806272,2022-05-25,Muito fofo na academia https://t.co/0zp6fKvYuJ
43,32935648,1529453352458887168,2022-05-25,Acabou de publicar uma foto em Igreja Betesda https://t.co/TrudzGMNHV
44,69801904,1529330062662639619,2022-05-25,"Boa noite e uma excelente quarta-feira
Good night and an excellent Wednesday em Smart Fit https://t.co/hzYLCngETQ"
45,1047151406199840768,1529314729084063744,2022-05-25,Bom dia! em Núcleo Espírita Paulo de Tarso https://t.co/yYzoiC3eJK
46,69801904,1529299113371648000,2022-05-25,"Treino de ombros
Shoulders working out em Smart Fit https://t.co/yxATdJzhti"
47,712803270155235328,1529275959509192706,2022-05-25,Acabou de publicar uma foto em Praça Marajoara https://t.co/z07yH4MaL6
48,490792751,1529251527365472256,2022-05-25,"“@SF_Moro virou réu”.

Aí vc vai ver é uma ação cível, que o juiz deu um “cite-se o réu”, pq é quase obrigado a fazê-lo!

Kkkkkkkk"
49,32935648,1529117162031308801,2022-05-24,Acabou de publicar uma foto em Igreja Betesda https://t.co/GwCAxsmtyQ
50,1416915625499414529,1529104578817720320,2022-05-24,me empodero https://t.co/Mny0ZENCaR
51,1392070573480628231,1529024130456199168,2022-05-24,Bom  dia  pessoal  do #BDSP  olha  esse  dia  começando com  esse  alinhamento  tirei a  foto  da  minha janela agora ao  amanhecer https://t.co/d0cerXw6L6
52,1047151406199840768,1528971500153409536,2022-05-24,Bom dia! em Núcleo Espírita Paulo de Tarso https://t.co/DbONoUI74a
53,69801904,1528915197234233346,2022-05-24,"Boa noite
Good evening
.
Treino de costas
Back workout em Smart Fit https://t.co/eKHESl9WSA"
54,75946968,1528891948588752898,2022-05-24,Cansei de só cagar regra nas cervejas dos outros e resolvi fazer a minha. em Campo Grande -Interlagos https://t.co/xqjPRICikn
55,126303589,1528864348721930240,2022-05-23,Acabou de publicar uma foto em Esconderijo Do Dj Morro Da Macumba https://t.co/EY2j6pethz
56,1092955945674649600,1528744073611329543,2022-05-23,Comemoração dessa lindeza que trabalha comigo ! https://t.co/ymFiIBlxKj
57,1092955945674649600,1528743172066758656,2022-05-23,https://t.co/Mowl0NMfry
58,933852319283851265,1528708849229758465,2022-05-23,"Turista Aprendiz 

A Região Sul tem as piores escolas da
capital.

O governo do PSDB
só tem olhos para
as escolas da
classe média.

Qdo um garoto vira
bandido e assalta
na rua.

Saiba que ele nunca
teve uma chance de
um futuro melhor.

Prof.s são alienados
e dirigentes fingidos. https://t.co/491d3Pu9c0"
59,1047151406199840768,1528611989265727488,2022-05-23,Bom dia! em Núcleo Espírita Paulo de Tarso https://t.co/MVSJWKs23l
60,1525258815817584640,1528554215475396608,2022-05-23,☺️ https://t.co/9WC7UJp0yl
61,3363253035,1528480149708079109,2022-05-22,Acabou de publicar uma foto em Jd.Marajoara https://t.co/FO3Tqg4zDN
62,981333167515881472,1528470879146893312,2022-05-22,"Aquele papo antes da largada @wesleylima121 .

Gostaram do nosso box de corrida? em Autódromo de Interlagos https://t.co/iRvmFY9cxs"
63,85834455,1528467072170217475,2022-05-22,#suculentas #suculentasbrasil #cactus #cactuslover #succulents #MinhasPlantasEmVaso em Jd.Marajoara https://t.co/VqsFMxmQwu
64,206502111,1528438305120976896,2022-05-22,Primeira CÃOrrida a gente nunca esquece  🐕‍🦺🐾😉 #spdogrun #dogrunsp #dogrunspmarket #dogrun #dog #instadog #pinshcer #pinscherlove #pinscherlover em Shopping SP Market https://t.co/xsTTog9SwO
65,32935648,1528394530390790146,2022-05-22,Acabou de publicar uma foto em Igreja Betesda https://t.co/zFCYsoBxjM
66,1348680193104338945,1528386971554430978,2022-05-22,"Bom dia amigos, abençoado domingo pra todos nós...🙏🙏🙏 https://t.co/BVOvzuLHfd"
