,author_id,tweet_id,created_at,text
0,173819903,1547006295303245825,2022-07-12,"Pensa num #Beirute #BentoFreitas #Top e o atendimento sensacional, super recomendo @lanchonete.e.rest.dacidade 
#Show em Lanchonete E Restaurante Da Cidade De Sao Paulo https://t.co/AbDLdGCTCr"
1,1543982499247824896,1547006259152711680,2022-07-12,Acabou de publicar uma foto em Santa Efigênia https://t.co/IgynDhaQgY
2,946332907056005120,1547005564177289216,2022-07-12,Acabou de publicar uma foto em Paróquia Nossa Senhora Achiropita https://t.co/qLLh6acrfk
3,1069224860528840704,1547004910620708864,2022-07-12,"Acabou de publicar uma foto em São Paulo, Brazil https://t.co/r76uoVun8G"
4,44300313,1546990286592688129,2022-07-12,"I'm at SP @EscoladeTeatro in São Paulo, SP https://t.co/zSOoMZewc3"
5,52058931,1546985772548505600,2022-07-12,https://t.co/zQFpIJvleg
6,829360890944315392,1546978614515843072,2022-07-12,Acabou de publicar uma foto em Dominatrix https://t.co/IwqKn66Ugx
7,1444321046,1546978235010977792,2022-07-12,Sonhos foram feitos para serem realizados 🥰 #Bombonera #Argentina  #Corinthians https://t.co/8hAGj9BWh4
8,115146921,1546975622475415555,2022-07-12,Visita do querido amigo @djtonyy_ . Sempre agradável e divertida! em Baixo Augusta https://t.co/l1KPerBs1X
9,56476092,1546957382734979073,2022-07-12,Acabou de publicar uma foto em Centro Paulista de Nefrologia &amp; Acupuntura https://t.co/vqKtuqhTrN
10,2425756175,1546943383108820992,2022-07-12,Teste... https://t.co/KL32GG7NyM
11,76481710,1546933802420903936,2022-07-12,Acabou de publicar uma foto em Hey Hey Club &amp; Eventos https://t.co/nJ69f0K6k6
12,1390016160918294529,1546925463318106112,2022-07-12,Foto appena pubblicata @ Lago Di Lecco https://t.co/TlDqLVhYSH
13,77233601,1546920942227578880,2022-07-12,""" O caminho para a felicidade está em vivermos o presente. Não volte ao passado, nem fique tentando adivinhar o futuro."" em República, São Paulo https://t.co/yMqBLr2mU8"
14,97047212,1546894511363788801,2022-07-12,"Almoçando pois eu amo este lugar. Arroz e feijão do MST. Preço justo, gente bonita e inteligente. (@ Prato Feito PPD in São Paulo) https://t.co/XWNggb4tEQ https://t.co/9qSV4gcVl5"
15,94150452,1546888461919178752,2022-07-12,Acabou de publicar uma foto em Guarapiranga https://t.co/R6lmSsX8SU
16,2517036677,1546888435104989184,2022-07-12,"alguns cliques dessa viagem.. 📸 em São Paulo, Brazil https://t.co/6ZhWvJRojT"
17,1404968615447781381,1546876603870973954,2022-07-12,"Nunca será só futebol. 
Tô arrepiada!"
18,1522691205410308096,1546864859924635657,2022-07-12,"Sentado no banco de concreto no meio da Santa Casa. Marcello aparece e bibicua dizendo não entender o ser/espécie humana, dou uma risada sem graça, ele vira o rosto e bate asa rumo ao ponto de ônibus. Penso, Esse seria, talvez, o famoso ""um passarinho me contou""? #SantoPássaro https://t.co/BCJS7Gjyqi"
19,193498856,1546855826450677761,2022-07-12,Acabou de publicar uma foto em Smart Fit https://t.co/wkKnB0g1n8
20,1347077785,1546842104080617479,2022-07-12,Artificialmente baixado conta mais para votar do que a vida e a dignidade humana. Não percamos isso de vista
21,1347077785,1546842102566473729,2022-07-12,Bom dia. Só passando pra lembrar que tem grande parcela da sociedade que é sim muito egoísta e alienada e está cagando e andando para as tragédias diárias como o estupro da mulher em Meriti ou o assassinato do tesoureiro do PT…pra essa gente o fato dos combustíveis ter
22,41934128,1546838329286660098,2022-07-12,Acabou de publicar uma foto em Centro de Eventos São Luís https://t.co/KwWy4mITvE
23,28356964,1546832608662851587,2022-07-12,"I'm at Bar e Lanches Pombalense in são paulo, sp https://t.co/uGOJHzbRxZ"
24,53587588,1546822741298331654,2022-07-12,"Acabou de publicar uma foto em São Paulo, Brazil https://t.co/E2SwL1XMPM"
25,948981006559842304,1546817683139731456,2022-07-12,Acordando aos Pouco ! Daqui a Pouco tá de Pé … https://t.co/5iQNcnGYGN
26,23579118,1546807576884641793,2022-07-12,Acabou de publicar uma foto em Buraco da Paulista https://t.co/7zhkbX9ksT
27,1295383206825545730,1546804822040510464,2022-07-12,"To com calor, deixa eu fazer seu p#u de picolé? 😈
 Disponível Virtual e Presencial SP
🌹
@Meggyapadilha
@As_Pretas_hot
   11*91326-8603 https://t.co/87SxrGLhQo"
28,15384035,1546685373652377600,2022-07-12,Finalmente voltamos a fazer fotos sem máscaras com os alunos! Aulão show de Dropshipping e Crossdocking na ComSchool. Bora vender! em ComSchool https://t.co/6rZyJ8ectM
29,164796545,1546672871380078592,2022-07-12,🏨 https://t.co/i0aSmRoPiZ
30,125864433,1546668128700141568,2022-07-12,🙌🏽 em Riqueza que fala https://t.co/vWlAtj8E0s
31,27991603,1546662298353184769,2022-07-12,Nessa quinta eu toco no Soda Pop! Te vejo lá! em Soda Pop Bar https://t.co/zzIxU5LCF8
32,1546498676381589506,1546656306395811842,2022-07-12,"Essa é minha… paguei de Uber pra menina, esperei ela duas horas e recebi esse muito bom. 🤷🏾‍♂️ https://t.co/SUb0qoNWFL"
33,780822022020472833,1546654333667667969,2022-07-12,"Acabou de publicar uma foto em São Paulo, Brazil https://t.co/BFqmGcoJTL"
34,81593903,1546650598916882433,2022-07-12,Drinking a Gonna Make Time by Cervejaria Octopus @ Tap Tap Centro — https://t.co/a11805jy7T
35,1498363951222083595,1546647882136264704,2022-07-12,Chega por hoje!! L L L https://t.co/MIPetE80Ud
36,30376292,1546647489461248001,2022-07-12,"Hoje, é dia de conferir “Crimes of The Future”, na pré-estreia a convite da @mubibrasil e da @O2Playfilmes 🔥 https://t.co/HmYdzaj4Lw"
37,81593903,1546647049113931776,2022-07-12,Drinking a Dock Mild by Fermentaria Local @ Tap Tap Centro — https://t.co/6PwHUdL91C
38,1452115072789237764,1546646839721607168,2022-07-12,"Acabou de publicar uma foto em São Paulo, Brazil https://t.co/K9USbCx1dm"
39,30326203,1546646321687298053,2022-07-12,"Pré estreia ""CRIMES OF THE FUTURE"" no Cine Marquise, São Paulo. #CrimesoftheFuture #Cinema #PreEstreia https://t.co/xVtvb0lYAd"
40,81593903,1546645297513857025,2022-07-11,Drinking an Outside the Box by Cervejaria Dilema @ Tap Tap Centro — https://t.co/iVncThj4UK
41,81593903,1546644799389835271,2022-07-11,Drinking a Lobos Porter by Cervejaria Lobos @ Tap Tap Centro — https://t.co/dw5ArbN7N6
42,306307341,1546643270457069570,2022-07-11,Alguém tá servido? Vamos comer um pirarucu com molho. #jantar #comida #delicia #obrigadodeus #baxaaguiaqueamodaemuitoboa em Almanara Shopping Higienopolis https://t.co/a4LHXkOrOA
43,1500611297167220738,1546642272481075201,2022-07-11,Evento sobre segurança pública realizado pelo ptbmulhersp e UND https://t.co/7B0KUOaDz6
44,1069224860528840704,1546635794982526978,2022-07-11,"Acabou de publicar uma foto em São Paulo, Brazil https://t.co/TIIiXO5t0F"
45,244593450,1546628596004970498,2022-07-11,Segundou https://t.co/RQHBVXtbVb
46,1256096582,1546627550352478210,2022-07-11,Um brinde meu amooor ❤️🥂 https://t.co/HQK3CmxCUW
47,137547006,1546625397206536192,2022-07-11,"I'm at Bar da Dona Onça in São Paulo, SP https://t.co/W2R4UXMDOn"
48,84241251,1546610790391861251,2022-07-11,Acabou de publicar uma foto em The Wall Café https://t.co/r4wGTlTUCd
49,65480733,1546609703735771138,2022-07-11,Acabou de publicar uma foto em The Wall Café https://t.co/CfpqoPNmii
50,45847677,1546609434251726852,2022-07-11,Acabou de publicar uma foto em The Wall Café https://t.co/y81I5nAE31
51,84241251,1546608982239969281,2022-07-11,Acabou de publicar uma foto em The Wall Café https://t.co/Er5OzktxMN
52,65480733,1546608698000384000,2022-07-11,Acabou de publicar uma foto em The Wall Café https://t.co/a0WpLCr3K2
53,45847677,1546608431418773506,2022-07-11,Acabou de publicar uma foto em The Wall Café https://t.co/Qgjpx2zQfM
54,1326946766583951360,1546606818515996677,2022-07-11,"Muito boa noite a vocês, atendendo em casa essa semana

@RuivoMedieval @FAcompanhantes https://t.co/9j5QGQQvE1"
55,1461666037838098432,1546606258333130753,2022-07-11,"Acabou de publicar uma foto em São Paulo, Brazil https://t.co/r99Jn2FyJc"
56,829360890944315392,1546604909650403330,2022-07-11,Acabou de publicar uma foto em Dominatrix https://t.co/g56pdPZ0EW
57,201519238,1546604296891813888,2022-07-11,Uma cara fechada não significa um coração ruim 😝 em Tokyo 東 京 https://t.co/9RM0TZajge
58,15430166,1546588806844915724,2022-07-11,"I'm at ACM/YMCA in São Paulo, SP https://t.co/FdXwg2b1E1 https://t.co/vdDpqODXfs"
59,133068269,1546586382998446080,2022-07-11,"#Repost @rafaelkoff 
@papodepm
• • • • • •
Tira
#rafaelkoff #quadrinhos #tirinhas #humor #hq #humor #policia #policial #tira #tirinhas #policial #papodepm #tira #Mike #policial em São Paulo, Brazil https://t.co/Zyam5uZufJ"
60,289063916,1546552280199172096,2022-07-11,"I'm at Novotel São Paulo Jaraguá Convention - @novotelbr in São Paulo, SAO PAULO https://t.co/Y3boarc59i"
61,53587588,1546546292146388992,2022-07-11,"Acabou de publicar uma foto em São Paulo, Brazil https://t.co/8kAdn7906h"
62,33195813,1546531039245475847,2022-07-11,"Junto ao CB-032 atuamos para desenvolver e/ou atualizar normas técnicas de fabricação alinhadas aos padrões internacionais para que o EPI brasileiro garanta a qualidade e seja competitivo em âmbito global. 
Quer saber mais? Acesse: https://t.co/UmbCoJA8wr 👇 https://t.co/FmhZLvQE02"
63,1103096280530726912,1546528890734133249,2022-07-11,Pensando se o petit gâteau seria bom ou não em Ça-va Erick Jacquin https://t.co/5uNhpbB82g
64,34123254,1546526484281581569,2022-07-11,Não almocei ontem então hj pode https://t.co/5GTqTiJjyc
65,1431275220,1546522461197307904,2022-07-11,cuuUuute em Sucesso's Bar https://t.co/Y5Sa3MCtEf
66,3638069663,1546516523585519621,2022-07-11,Acabou de publicar uma foto em Rio de Janeiro - RJ https://t.co/aIRuTLUKqU
67,3638069663,1546513740945936385,2022-07-11,Acabou de publicar uma foto em Rio de Janeiro - RJ https://t.co/7ini8tzpb2
68,829360890944315392,1546512728155627521,2022-07-11,Acabou de publicar uma foto em Dominatrix https://t.co/HOta0kwm9q
69,1041139561496104960,1546494881811546112,2022-07-11,"foto + foto da foto
pião de domingo da melhor forma, em duas rodas 🚲 https://t.co/F62l84c2ni"
70,41934128,1546467714880913410,2022-07-11,Acabou de publicar uma foto em Centro de Eventos São Luís https://t.co/GNuicZ6XIO
71,236421159,1546466443046313984,2022-07-11,Just posted a photo @ Méqui Mil https://t.co/KNtweP0PET
72,302971809,1546465906867535872,2022-07-11,"Acabou de publicar uma foto em São Paulo, Brazil https://t.co/ECQq1VN18O"
73,14827952,1546449544124289028,2022-07-11,Acabou de publicar uma foto em Teatro Mars https://t.co/eTmd5bdGEq
74,1185223084623708162,1546448970649636865,2022-07-11,"Acabou de publicar uma foto em São Paulo, Brazil https://t.co/AmudbC6d2n"
75,1185223084623708162,1546448525755617281,2022-07-11,"https://t.co/shvvOOkVWF
Zap 21 989338581 em São Paulo, Brazil https://t.co/GmLsZXIbKJ"
76,1185223084623708162,1546447966340358144,2022-07-11,"Acabou de publicar uma foto em São Paulo, Brazil https://t.co/n9kemQwiOq"
77,1185223084623708162,1546446768681889792,2022-07-11,"Acabou de publicar uma foto em São Paulo, Brazil https://t.co/uhVihuhIKB"
78,1185223084623708162,1546443180802981888,2022-07-11,"Acabou de publicar uma foto em São Paulo, Brazil https://t.co/NOi8IYPfUb"
79,921197448885886977,1546402230080884737,2022-07-11,"Taco Bell - São Paulo - Comi um combo no dia 02/07/22 na Taco Bell da Paulista Center 3. Já na madrugada comecei a apresentar os sintomas: vômito intenso, diarrei... Food Poisoning https://t.co/RIvPxhBtq7 #tacobell #nausea #diarrhea #vomiting #gas #fever #bodyache"
80,3409299071,1546361157769904129,2022-07-11,"Acabou de publicar uma foto em São Paulo, Brazil https://t.co/Ce9QbJdzer"
81,3409299071,1546359375115145217,2022-07-11,"Acabou de publicar uma foto em São Paulo, Brazil https://t.co/Ywjbp4j7uj"
82,3409299071,1546357627977977856,2022-07-11,"Acabou de publicar uma foto em São Paulo, Brazil https://t.co/ROQ4XQFDet"
83,3409299071,1546355002930855936,2022-07-11,"Acabou de publicar uma foto em São Paulo, Brazil https://t.co/2P7FLgWSMP"
84,3409299071,1546353489756004352,2022-07-11,"Acabou de publicar uma foto em São Paulo, Brazil https://t.co/DzF5Ge9UJO"
85,101355768,1546338365934637056,2022-07-11,☺️📱 em Bráz Elettrica https://t.co/b7aqgcGtgV
86,1498363951222083595,1546330995498024962,2022-07-11,Sunny day ☀️ https://t.co/IWldz9vKmz
87,1093169613662244864,1546328814862622721,2022-07-11,Tamo em Tokyo em Tokyo 東 京 https://t.co/UwZ78Jy7Jr
88,48825283,1546305469207252992,2022-07-11,Vamos orar para não ter ninguém ferido nesse incêndio aqui no centro de São Paulo https://t.co/9nYjbiOhKT
89,59800068,1546303785512869888,2022-07-11,só pq tá bonita 🤗 https://t.co/A83OEzeHpE
90,56699915,1546293892898852869,2022-07-11,Acabou de publicar uma foto em NDH Waleska Farias https://t.co/C0dxvYQwBG
91,129978662,1546284411028652032,2022-07-11,EXISTE AMOR EM SP SIM https://t.co/6l3oUvxRYJ
92,23510793,1546282611202465794,2022-07-10,https://t.co/wptM6fy5w7
93,1185223084623708162,1546276805413306368,2022-07-10,"Acabou de publicar um vídeo em São Paulo, Brazil https://t.co/CkwKKv94uy"
94,573309143,1546276537028280320,2022-07-10,Acabou de publicar uma foto em Parque Minhocão https://t.co/KACdjZdbaY
95,1185223084623708162,1546275422790471682,2022-07-10,"Acabou de publicar um vídeo em São Paulo, Brazil https://t.co/paRGJtdHyb"
96,1526769531779268609,1546272453017608197,2022-07-10,Com eles na vive https://t.co/7mbyLShKGJ
97,1185223084623708162,1546270743981281280,2022-07-10,"Acabou de publicar um vídeo em São Paulo, Brazil https://t.co/ssHqRYRYEq"
98,906695341810098178,1546269146756923403,2022-07-10,Teatro no final de tarde peça  @ometodogronholm em Teatro Unimed https://t.co/uBJ8JgDAwy
99,53587588,1546265352551763968,2022-07-10,"Acabou de publicar uma foto em São Paulo, Brazil https://t.co/iwdnJmqKF3"
100,164796545,1546263773287178241,2022-07-10,I'm at Comfort Inn in São Paulo https://t.co/hs43OxOZGu
101,293825688,1546256770515013632,2022-07-10,"09/07 - Selfen de aniversário 
🥳♋️🥳 em Casa Fluida https://t.co/rSIwzIdjlC"
102,164796545,1546256435616649218,2022-07-10,I'm at Estacionamento Trevo in São Paulo https://t.co/Tn3DMGWGPO
103,94221894,1546254616844767234,2022-07-10,"Chorei horrores! Coisa mais linda...
Quanta potência, quanto amor!
🥰🥰🥰 em Teatro Sérgio Cardoso https://t.co/dPyi4WZq92"
104,221759428,1546252190540611588,2022-07-10,Direita - Drinking a From Rejection To Oblivion N6 by @cervejariadogma @ Cervejaria Dogma  — https://t.co/G0KOG2eyvR
105,221759428,1546251225187901440,2022-07-10,Meio — Drinking a Huaka'i po by @cervejariadogma @ Cervejaria Dogma  — https://t.co/QepTuxQ6GB #photo
106,221759428,1546250984233603072,2022-07-10,Esquerda — Drinking a Winternator by @cervejariadogma @ Cervejaria Dogma  — https://t.co/dgXNINdQyL #photo
107,8958492,1546247783576903681,2022-07-10,Pôsteres do @simpleplan próximos a Praça Roosevelt! 🔥🔥🔥 https://t.co/ML1oRe8ahu
108,9358142,1546247408199385089,2022-07-10,que saudade que eu tava de vir aqui https://t.co/L7AlnfQt5x
109,1126117993715576833,1546243880705720320,2022-07-10,"#domingo 
Domingo de leve 
#piscina https://t.co/7TjNokqmRY"
110,221759428,1546243395143847936,2022-07-10,Drinking a Sourmind Morango e Abacaxi by @cervejariadogma @ Cervejaria Dogma — https://t.co/mxXTgIWaQc
111,221759428,1546242932776353793,2022-07-10,Direita — Drinking a Strata Blast by @cervejariadogma @ Cervejaria Dogma  — https://t.co/07I9FWCrdc #photo
112,209685597,1546242382693294080,2022-07-10,Acabou de publicar uma foto em Galeria Metrópole https://t.co/JmIE6Ytmac
113,221759428,1546242069835964417,2022-07-10,Esquerda — Drinking a Citra Blast by @cervejariadogma @ Cervejaria Dogma  — https://t.co/pBoFfLLj1s #photo
114,221759428,1546241313640792071,2022-07-10,Esquerda — Drinking an Amante de Lúpulo by @cervejariadogma @ Cervejaria Dogma  — https://t.co/LDSrruuHzQ #photo
115,221759428,1546240637820968965,2022-07-10,Direita - Drinking a Huaka'i po by @cervejariadogma @ Cervejaria Dogma  — https://t.co/V91kpg45Ce
116,221145198,1546238273621819394,2022-07-10,♥️♥️♥️ https://t.co/ZZGgZomwbh
117,18688345,1546234793624494081,2022-07-10,Acabou de publicar uma foto em Colégio Sion https://t.co/PtSBGT7446
118,18688345,1546234340039876612,2022-07-10,Com os queridos do @magnificatcoral em Colégio Sion Higienópolis https://t.co/H5FCoQwZjQ
119,82914576,1546229331512418305,2022-07-10,⛩️ em Liberdade- São Paulo https://t.co/NIOSHYGTYg
120,1423115178762293249,1546228358685622276,2022-07-10,"Características: povo animado
Reprodução: baixa (ainda que o índice de tentativas seja o mais elevado)
Peso: Qualquer resposta é sujeita a cancelamento
Comportamento: Sociável 
Espécie endêmica: Não https://t.co/pQeiwx2oDp"
121,221145198,1546227103753961475,2022-07-10,"I'm at Parque Augusta in São Paulo, SP https://t.co/S48vbJEYvs"
122,354011427,1546219777689001984,2022-07-10,e disseram que São Paulo não tinha praia 🗣🗣🗣🗣 https://t.co/hhe7VNXSBG
123,67895112,1546217098669707270,2022-07-10,https://t.co/FKGruLIRFZ
124,33932726,1546215442578014208,2022-07-10,Acabou de publicar uma foto em Abbraccio Restaurante https://t.co/voi29tA4IS
125,15165399,1546213952610127874,2022-07-10,eu e a minha terrorista 😍🤣 em Parque Augusta https://t.co/Uu9BhqI88E
126,1304509993358708739,1546204653448224771,2022-07-10,Acabou de publicar uma foto em Gabinete Deputado Federal Abou Anni https://t.co/bb5qlNzkd5
127,1242959027518275587,1546202302046150656,2022-07-10,Boiolíssima tomando meu sol de domingo no Parque Augusta após comer de graça na casa de minha amiga pessoal João Rodrigo! https://t.co/QetCE29TJt
128,164796545,1546193861948702721,2022-07-10,"I'm at Atlantica Hotels in Sao Paulo, São Paulo https://t.co/WRGLofmdkE https://t.co/0uBgM8spKg"
129,164796545,1546193766331072518,2022-07-10,"I'm at Secretaria Municipal da Saúde - Prefeitura De São Paulo in São Paulo, SP https://t.co/4AdShJt0Co"
130,78099686,1546193677223137282,2022-07-10,Acabou de publicar uma foto em Praça Franklin Roosevelt https://t.co/VDgr2hae0c
131,164796545,1546193631731654657,2022-07-10,Ufaaaaa (@ Nobile Downtown in São Paulo) https://t.co/pBI651925R https://t.co/qktGsY9xXe
132,166634136,1546193263786217472,2022-07-10,Rolezin top na madruga com minha linda @nathikage em Frango Com Tudo Dentro https://t.co/zqZW6Jo0iF
133,168504921,1546192206284955655,2022-07-10,costumo postar foto de comida não mas pqp isso aqui tá uma obra de arte https://t.co/EePGLp1uGm
134,85642174,1546188886937845760,2022-07-10,🍸 em Riviera Bar e Restaurante https://t.co/YfRAkxzqa7
135,78099686,1546179829208342529,2022-07-10,Acabou de publicar uma foto em Praça Franklin Roosevelt https://t.co/NgwWS1jj5L
136,3020591703,1546176187868790784,2022-07-10,Vai ter bolo https://t.co/KBqHxNfpYR
137,215289169,1546174118759907333,2022-07-10,😛 https://t.co/c23utWvenz
138,78099686,1546173421150564357,2022-07-10,#solminhocao em Parque Minhocão https://t.co/6PT6AtIlAY
139,78099686,1546173218666463233,2022-07-10,Acabou de publicar uma foto em Paróquia Nossa Senhora da Consolação https://t.co/7eYwYXIXWL
140,59874425,1546170743041433601,2022-07-10,❤️❤️ em CASACOR https://t.co/0Qr2U4ksjR
141,370796645,1546168529854005250,2022-07-10,Comendo igual uma cachorra desvairada
142,78099686,1546166572670193666,2022-07-10,Acabou de publicar uma foto em Parque Minhocão https://t.co/8EwxZ23uNM
143,34779125,1546165421186990080,2022-07-10,“Bolsonaro roubou da Educação” https://t.co/CjoG74nP8C
144,53587588,1546164157510213634,2022-07-10,"Acabou de publicar uma foto em São Paulo, Brazil https://t.co/hpimEtSULn"
145,765913081088241664,1546153831733645312,2022-07-10,Acabou de publicar uma foto em Casa Da Música https://t.co/gb25ZhrnHK
146,201519238,1546131277006372866,2022-07-10,Existe amor e muitos sorrisos em éssipê! 🏢☀️ em Tokio Karaokê https://t.co/L7WnMfpSRc
147,402255750,1546130262639185920,2022-07-10,"Se pede beijo, eu te dou um carinho.
#drdeolane sua #linda encantadora.
@dra.deolanebezerra em São Paulo, Brazil https://t.co/p2j03cZQ3L"
148,27921417,1546129690808782848,2022-07-10,US ❤️💍 #casamentobelethi #belethi #familia #amor ph: @lecanovo em Higienópolis https://t.co/rRgE3clFGJ
149,164142088,1546119279371747328,2022-07-10,Acabou de publicar uma foto em Blue Note SP https://t.co/mkPrPstRxj
150,1053256480068169728,1546114572150607874,2022-07-10,"Remova o ódio do seu coração, a vida é curta. @ República, São Paulo https://t.co/jRPDc0tGi9"
151,13821652,1546112138825142272,2022-07-10,"Picnic no parque.
📸 @estelavilasboas em Parque Augusta https://t.co/fxBSqIrFzP"
152,1206053026890493952,1546029817874743296,2022-07-10,4 da manhã eu meto o pé https://t.co/pjGQuZnnyo
153,825337360292442116,1546002064131518464,2022-07-10,"Aqui, dançando até morrer 😬 https://t.co/rF4ZNIMwyI"
154,57469889,1545993316352901121,2022-07-10,Meu espaço na @casacor_oficial by @romulofialdini no hall dos homenageados !!!! #adddoroooo #brunetefraccaroli #brunetefraccaroliinteriores #brunetefraccaroliarquitetura #brunetefraccaroliofficial  #casacor2022 https://t.co/YPfwBDvGQx
155,35088563,1545990593842761728,2022-07-10,Acabou de publicar uma foto em Casa Galeria https://t.co/U8gkHj5mrs
156,27008217,1545980714008674304,2022-07-10,Usei o @Shazam para descobrir Ceremony de New Order. https://t.co/mdTnXrNw5B
157,98699049,1545975786510946305,2022-07-10,postei essas pra engajar o público gls do meu perfil do Instagram e comparar meu corpo quando eu ficar gostoso https://t.co/043YCynyis
158,1500160402897973252,1545967751696715776,2022-07-10,"Chegueiiiiii...
Quem vem?
Já começou e vai até as 5:00. Muita putaria e muito leite.
Vem pra @upgradesxclub 
Produção @rohcamillo 

#boydotado #TheBoys #gay @ADUFF_NET @boyzspace @_divulga_boys_ @centralmachos @_K_A_I_R_O_S @FrenchGaymer @new_gaywanking https://t.co/JkASDZ8iCk"
159,78632358,1545966330410663936,2022-07-10,Drinking a Central De Caquinho Colab 2 by Cervejaria Central @ Cervejaria Central — https://t.co/oBTrjAarTf
160,78632358,1545961288144134145,2022-07-10,Drinking a Central #1 by Cervejaria Central @ Cervejaria Central — https://t.co/rgVqyLjpIO
161,78632358,1545960764862767105,2022-07-10,Drinking a Panorama by Cervejaria Central @ Cervejaria Central — https://t.co/eqqJvWcmtV
162,78632358,1545960516866154497,2022-07-10,Drinking a Cecitra by Cervejaria Central @ Cervejaria Central — https://t.co/kBYpj8KCiw
163,58612090,1545952816925216770,2022-07-10,Acabou de publicar uma foto em Baron Rock Bar https://t.co/WXqJzEosQe
164,1185223084623708162,1545952402687160320,2022-07-10,"Revista eletrônica e The Future tudo sobre a cena musical brasileira . em São Paulo, Brazil https://t.co/GoXl0C5vL6"
165,58070434,1545943648814055424,2022-07-10,"São Paulo, terra da garoa, Victor meu filho, @hmsbo minha irmã,  muito grato por existirem na minha vida!! ❤❤❤❤ em São Paulo, Brazil https://t.co/PUJaGbEg3s"
166,873538518634688513,1545940358873464833,2022-07-10,e sobe balãozinho aí 🎈 https://t.co/X3U43Hd3bP
167,27008217,1545924666652491779,2022-07-10,Usei o @Shazam para descobrir Long Live Rock 'N' Roll de Rainbow. https://t.co/O6yFF0O18z
168,176943108,1545919287403085829,2022-07-09,"#esquadraonigthrun #nightrun2022 #strava #eufui #Kwai812106600 #Kwaivaldir72  #KwaiConquistar100k   
Raspe aqui ▒▒▒▒▒▒▒▒▒▒▒▒▒▒ para ver a minha biografia. em Pacaembu https://t.co/yxBBk1rtty"
169,37793342,1545917695459213312,2022-07-09,Vinho sem frescura. em Los Perros - Vinho no Boteco https://t.co/6u9WiAvP6b
170,237877163,1545917520376365057,2022-07-09,"Repitam comigo: eu lacro, tu lacras e nos lacramos! Kkkkkkkk #sabadou em Housi https://t.co/3e1pIAwxp6"
171,37793342,1545917195250675712,2022-07-09,Vinho sem frescura. em Los Perros - Vinho no Boteco https://t.co/snBjc6INrH
172,55563197,1545915715563229185,2022-07-09,Amizade de centavos… mas são bilhões de centavos 😙✌️ em Bar do Urso - Paulista https://t.co/BCH7cPSKGn
173,294946677,1545914372660379649,2022-07-09,I'm at Rap Burguer in São Paulo https://t.co/ybWhft89LB
174,61116586,1545913376794185729,2022-07-09,"#NigthRun 4K em 22min! 🙏🏾 (@ Estádio Municipal Paulo Machado de Carvalho (Pacaembu) in São Paulo, SP) https://t.co/gulPtexAXw"
175,40146795,1545906855158890499,2022-07-09,"Acabou de publicar uma foto em Bixiga, Bela Vista https://t.co/Xm0WqTSxo7"
176,1478192195240960001,1545899938382495748,2022-07-09,"#esquadraonightrun

Primeira de muitas!!! https://t.co/hzHKaMQ703"
177,899448709838241792,1545891282622550023,2022-07-09,"Lançamento em São Paulo, Brazil https://t.co/dJ9vVMIgmT"
178,18293936,1545887374701469703,2022-07-09,Moonchild em Madame https://t.co/7r2IzJQ5Xn
179,8205502,1545886836404457474,2022-07-09,Acabou de publicar uma foto em Conjunto Nacional Na Av Paulista - Sp https://t.co/692EoNI6l1
180,213769407,1545881558757691392,2022-07-09,"Acabou de publicar uma foto em São Paulo, Brazil https://t.co/HJPEGbvzSj"
181,15052095,1545881467053641728,2022-07-09,"Do nada, eles vieram pra São Paulo pra passar uns dias comigo e dar colinho e cafuné. Família ❤️ em Parque Augusta https://t.co/jjHjGgO3Wy"
182,3288782332,1545862215584055297,2022-07-09,"Se o seu brilho não brilha, não venha me  desbrilhar o meu brilho brilhante.
Brasil, Mari em Vertta Desenvolvimento Humano https://t.co/yoPLKLywkm"
183,176943108,1545858040372424704,2022-07-09,"#esquadraonigthrun #nightrun2022 #strava #eufui #Kwai812106600 #Kwaivaldir72  #KwaiConquistar100k   
Raspe aqui ▒▒▒▒▒▒▒▒▒▒▒▒▒▒ para ver a minha biografia. em Estádio do Pacaembú https://t.co/6O2Mb6cPqc"
