,author_id,tweet_id,created_at,text
0,114936069,1624910076300460034,2023-02-12,"A picanha veio, já beijei na boca esse ano...
Fazendo o L feliz! https://t.co/ODE2QMzJon"
1,1099364058,1624907943958151168,2023-02-12,"Milhares no bloco e eu só pensando em 1, como pode?"
2,87548842,1624901408649625606,2023-02-12,"Hygge, the ritual of enjoying life's simple pleasures. Probably the best moment 🫶🏻 #lifedump em São Paulo, Brazil https://t.co/Jv6Lb8O6ko"
3,715191572850147328,1624899287111938049,2023-02-12,Eu ❤️ São Paulo. em Avenida Paulista SP https://t.co/uIFbGqf93M
4,391688865,1624896114867552256,2023-02-12,Antes do dilúvio 🤡 https://t.co/DrkMjnCvC2
5,1103370507070726144,1624893685270827011,2023-02-12,"Não sou único na multidão, apenas mais um em busca do impossível...

Encontros e despedidas no Baixo Augusta mesmo embaixo de chuva 💦💦

#Carnavrau
#BaixoAugusta 
#PreCarnaval em Av Consolação 222 https://t.co/6AqdvMVC56"
6,27008217,1624891439757897728,2023-02-12,#sindaynight #saopaulo #nofilter em Bia Hoi SP https://t.co/lXpxW4g2DA
7,15349705,1624886675082977280,2023-02-12,Acabou de publicar uma foto em Higienópolis (bairro de São Paulo) https://t.co/zOUWahsE9c
8,27008217,1624886141471141889,2023-02-12,"I'm at Bia Hoi SP in São Paulo, SP https://t.co/badNuHmcoD"
9,1120180404965838849,1624884885205704704,2023-02-12,"Gosto muito de passar um tempinho nesse Starbucks em específico, do lado do Conjunto Nacional

Um lugar calmo e tranquilo, principalmente quando ficava estressado com minha facul, que era no prédio ao lado https://t.co/Bz7KfXIqsl"
10,1488517548513677312,1624883797366919170,2023-02-12,O baixo Augusta entregou o que tinha e o que não tinha de baixo de chuva 🙌🏻
11,41958045,1624880348298371075,2023-02-12,"Ficções by Yuval Noah Arari, um monólogo com @veraholtz para fechar o domingo em Teatro Faap https://t.co/gRIATUHapr"
12,1290741585563484165,1624872540895166464,2023-02-12,"Acabou de publicar uma foto em Bixiga, Bela Vista https://t.co/o2YJuTipc4"
13,2500629679,1624871650280804355,2023-02-12,gente essa coisa de beijar na boca no carnaval não é pra mim não! Eu só quero uma cervejinha e cantar junto com o trio 🥳
14,751696398,1624871153977241601,2023-02-12,Carnaval look..sad Pierrot a procura da Columbina @ Hotel Heritage https://t.co/j3REc8wGdE
15,1359002871568728065,1624866604231057410,2023-02-12,Baixo Augusta antes da chuva. https://t.co/ERiBbVGhs6
16,33932726,1624865642238058499,2023-02-12,"Recebi do @andreacioli77 
Repasso e peço que repassem, compareçam, participem.
A Cultura é muito mais do que uma livraria. em Livraria Cultura Conjunto Nacional Av. Paulista https://t.co/vi77iLy59R"
17,1552112744,1624864907563761669,2023-02-12,"@Kaluan_ Nossa, uns 90% das pessoas que eu conheço xovens que tavam em SP foram em blocos.

Minha bolha, claro. Mas chuva, roubos e tal tão dando uma cansada"
18,27008217,1624860467704344582,2023-02-12,Boa tarde:  📸🌧 #AvPaulista #IMS #contatos #sampa #nofilter em Instituto Moreira Salles https://t.co/oiLYUOrscE
19,1120180404965838849,1624859665015226371,2023-02-12,"Eu realmente não podia deixar de vir aqui, na Livraria Cultura do Conjunto Nacional, nesse domingo

Já passei tantas horas aqui... Vi, li e comprei vários livros desse lugar tão mágico e tão bonito, que agora tem um futuro tão incerto...

Vou sentir muito sua falta :'( 🖤 https://t.co/88Ov3Mah9s"
20,25574151,1624858526400102400,2023-02-12,I'm at @CinemarkOficial in São Paulo https://t.co/28oNjBq1Am
21,25574151,1624858326268882944,2023-02-12,"I'm at Shopping Pátio Higienópolis - @_higienopolis in São Paulo, SP https://t.co/0jRw6AR9pc"
22,751696398,1624857564155461637,2023-02-12,Having breakfast with mom and   a ling time friend. @ Hotel Heritage https://t.co/wdCAS1w4U9
23,57531053,1624855391489097739,2023-02-12,A árvore hoje! em Haddock Lobo https://t.co/T0oGeOyb2l
24,57531053,1624853604854272011,2023-02-12,A árvore 5 de fevereiro! em Haddock Lobo https://t.co/FGg14fc7LC
25,57531053,1624852185719660545,2023-02-12,Árvore em 15 de janeiro em Haddock Lobo https://t.co/V4Zqi5tN2P
26,73284427,1624843765352394752,2023-02-12,"Deu certo esse almoço hein! Que beleza poder levar vocês para a vida. Quem disse que o trabalho não rende amizade, tá esquecendo de viver. Obrigado Carol foi sinixxxxtro em Higienópolis https://t.co/1GBIwjMsot"
27,106859192,1624842072980348928,2023-02-12,🎊🎊🎊 em Bloco Academicos Do Baixa Augusta https://t.co/foEf3eNfBO
28,4819512868,1624840839879958529,2023-02-12,"Acabou de publicar uma foto em São Paulo, Brazil https://t.co/iOWgoSIELo"
29,817432833601994752,1624837493060251648,2023-02-12,"Independente do que aconteça, seja sempre você, e se ame acima de tudo 💞 em Liberdade- São Paulo https://t.co/xRoZgW6fGj"
30,1243426227597139969,1624834293586337792,2023-02-12,"Bloco das CDzinhas na Vieira de Carvalho - República SP 
Bora curtir 🥳 https://t.co/KiWrlImlW5"
31,132909997,1624828515622215681,2023-02-12,"Acabou de publicar uma foto em São Paulo, Brazil https://t.co/g0EiNgGkQE"
32,376934289,1624824760558555136,2023-02-12,Acabou de publicar uma foto em Big Kahuna Hamburgueria https://t.co/Z0ALS0o8Ig
33,55310560,1624824181572669440,2023-02-12,As PAKITASSS atacando no Baixo Augusta! ❤️✨🖖🏼 em Bloco Academicos Do Baixa Augusta https://t.co/xQyN3LaorO
34,151725277,1624819430352994306,2023-02-12,"Olha a cobra 🐍. em São Paulo, Brazil https://t.co/yE4j9Ue7ts"
35,1103370507070726144,1624818084916654080,2023-02-12,"Como num Encontro Marcado esbarro com @nelidacapela  cidadã carioca em Sampa!

#BlocoBaixoÂgusta
#carvavral em Rua Da Consolação https://t.co/ingWIkBpdc"
36,1103370507070726144,1624810973780447234,2023-02-12,"Meu Nome è Gal...com @eugavil  no Baixo Augusta

#Carnavral
#BaixoAugusta 
#CarnavalPaulistano
#Verao2023 em Bloco Academicos Do Baixa Augusta https://t.co/CxEdFMIvGI"
37,45691554,1624798676294959108,2023-02-12,"daqui pra cima é só ladeira abaixo vamo que vamo 🐆 #carnaval #carnaval2023 #precarnaval #animalprint #glitter #boy #carnasp #saopaulo #sp em São Paulo, Brazil https://t.co/vKpFAb3GRr"
38,21242707,1624798659329097733,2023-02-12,Acabou de publicar uma foto em Alameda Editorial https://t.co/imw7xpau9N
39,49053242,1624796132118347776,2023-02-12,"Um lugar especial para pessoas especiais.

Comemorando o aniversário da @loydedenise em Cantina e Pizzaria Piolin https://t.co/0ZQH6DeHCf"
40,1174059294473539584,1624788702122676225,2023-02-12,"Estantes vazias! O fechamento da Livraria Cultura não deixa de guardar também um sentido simbólico da destruição imposta ao Brasil. Sequelas do que o país tem enfrentado desde a ascensão da extrema-direita, com seu total desprezo por tudo que manifesta arte e cultura! https://t.co/8dKiCPQ5qA"
41,58827022,1624786149972623361,2023-02-12,Acabou de publicar uma foto em Livraria Cultura Conjunto Nacional Av. Paulista https://t.co/g7cT1BkvT2
42,957950249926086656,1624782651113578498,2023-02-12,Acabou de publicar uma foto em Bela Vista (district of São Paulo) https://t.co/Y60hSgxEWF
43,51263763,1624775838066438145,2023-02-12,Acaba de publicar una foto en Meliá Paulista https://t.co/wTHgN0r9dD
44,21242707,1624758709086744576,2023-02-12,Acabou de publicar uma foto em Alameda Editorial https://t.co/HBTSBf9E8a
45,15281396,1624755292033482754,2023-02-12,Just posted a photo @ Shopping Pátio Higienópolis https://t.co/rzHzzSPXlF
46,20113972,1624728356179832832,2023-02-12,Acabou de publicar uma foto em Cemitério da Consolação https://t.co/xjI3RRoXwK
47,167620020,1624712513542582275,2023-02-12,https://t.co/6QAX5v8VUK
48,14827952,1624700841511862273,2023-02-12,PRINCESA NÃO DEIXE A COROA CAIR !!??? KKKKK @festadando #festadando @teatromars #teatromars #zezearaujo #host #hostess #door em Teatro Mars https://t.co/76WsTTdmCb
49,14827952,1624700293186199554,2023-02-12,ENTÃO KKKKKKKK @festadando #festadando @teatromars #teatromars #zezearaujo #host #hostess #door em Teatro Mars https://t.co/Tvs6zLHtip
50,14827952,1624699284816904193,2023-02-12,MOÇO É AKI O AFTER HOURS ????? @festadando #festadando @teatromars #teatromars #moçoéaquioafterhours #zezearaujo #host #hostess #door em Teatro Mars https://t.co/gALbjILeQW
51,1461171534454788096,1624661886636621825,2023-02-12,✨ https://t.co/BwCb6Sa2xM
52,2716711203,1624637223508344832,2023-02-12,Acabou de publicar uma foto em Teatro Opus https://t.co/lmyPo2I1tG
53,940379690216443904,1624623575192727552,2023-02-12,SÓ UM POUQUINHO DESSE DIA Q EU AMOOOO🤍✨ https://t.co/LrBAkLLfRy
54,151540195,1624610165965070336,2023-02-12,Eu estava muito GATA ontem no bloquinho. https://t.co/1Rw4mRb38V
55,14827952,1624608424372715520,2023-02-12,OLARRRR @festadando #festadando @teatromars #teatromars #zezearaujo #host #hostess #door em Teatro Mars https://t.co/u1G6lV7e7r
56,4855694277,1624605105176674306,2023-02-12,"É complicado dizer o que sinto mas de alguma forma, esse lugar sempre vai fazer parte das minhas melhores memórias! A gente se divertiu e aprendeu tanto aqui né amigo… @tgomota quantos finais de semana incríveis… 💭 📚 é triste ver como tudo acaba https://t.co/QJNir7qHGX"
57,2716711203,1624593438174838784,2023-02-12,Acabou de publicar uma foto em Teatro Opus https://t.co/FLpBTjmdcw
58,14400616,1624581435897118720,2023-02-12,XIi em Rosewood São Paulo https://t.co/3KMc1TSjZl
59,335718230,1624580962196635650,2023-02-12,De volta ao Piu Piu! em Café Piu Piu https://t.co/rix23BQQpg
60,1524115098666782723,1624575959432065027,2023-02-12,#hotelrenaissance #teatrorenaissance #teatro https://t.co/lGLzVNxRsm
61,14400616,1624565590563094528,2023-02-12,"Da série, Ele e Eu!!
Agora nos 12 anos!!!! em Rosewood São Paulo https://t.co/qLmrTOquu2"
62,27850924,1624564922368593920,2023-02-12,"Minha carne é de Carnaval, por @ninaschubart em Point do Gordoboy https://t.co/GGjtQ3hzEr"
63,45691554,1624552084527009793,2023-02-11,"animal print leva salgado, fundo do mar leva refri 🐯🐠🧜‍♂️ 🐆 #carnaval #precarnaval #carnaval2023 #carnavalsp #bagaceira #bloquinho #bloco #animalprint #fundodomar #saopaulo #sp em São Paulo, Brazil https://t.co/zsDK41yDP7"
64,1524115098666782723,1624547709444136961,2023-02-11,Noite com ele 😍🥰 https://t.co/cXijNV5Cbg
65,14503489,1624544856679890945,2023-02-11,Acabou de publicar uma foto em Bela Vista - São Paulo https://t.co/xVJHBtchS5
66,15454050,1624543045495492609,2023-02-11,"“Eu quero gibi!”, dizia uma garotinha para a mãe, de forma incessante, quando cheguei na tarde de hoje na Livraria Cultura. Foi estranho. 

Segue o fio 🧶👇 https://t.co/LsNKJSl8c1"
67,142463461,1624536987473530881,2023-02-11,"Acabou de publicar uma foto em São Paulo, Brazil https://t.co/KuOZInjQqd"
68,151540195,1624534612373372928,2023-02-11,"Esse look está tudooooooo!

#LGBT #batekoosp #carnaval2023 #fy #explore #look #make em República (São Paulo Metro) https://t.co/Q45Rni6Stt"
69,1515567949091901441,1624521651369943040,2023-02-11,Sobre um rolê aleatório aí …. em Pink Lab Club https://t.co/p8K2KT4At7
70,1427316595433553920,1624513067231899657,2023-02-11,Acabou de publicar uma foto em Hospital Sirio Libanes Sao Paulo https://t.co/A0WmM9jMDW
71,1442629809784381440,1624509940604760064,2023-02-11,"Carnaval chegou! 
Desculpa qualquer coisa 🎭 https://t.co/G4IMVkrksH"
72,15454050,1624508977433178122,2023-02-11,"Tchau, @CulturaLivros. https://t.co/Ix1DSkisVe"
73,289063916,1624506828703899648,2023-02-11,I'm at Swift in São Paulo https://t.co/zuTcx52Zcn
74,1106419478,1624504068692475905,2023-02-11,"Livraria cultura vai deixar saudades...😭

Lançamento Gears of War Ultimate Edition 25/08/2015 https://t.co/kyIvjNT86B"
75,751696398,1624491893517172736,2023-02-11,"One of the tallest skylines buildings downtown Sao Paulo. #edificioitalia was Built in 1965 to honor Italian immigrants, this 168-m tower has a 46th-floor piano bar &amp; restaurant @ Edificio Itália São Paulo https://t.co/eekcYAhiZJ"
76,95433357,1624491762956869632,2023-02-11,"Iniciando os trabalhos de FDS, afinal Carnaval esta chegando. Rsrs em Higienópolis https://t.co/lscAsmXtzN"
77,136118232,1624472912378863617,2023-02-11,Acabou de publicar uma foto em Consolação https://t.co/TxBVIvX609
78,1515704887996293128,1624471097495126024,2023-02-11,'cause i'm hot and cold ❄️ https://t.co/oen8YRT0ab
79,14099402,1624457184108072961,2023-02-11,"Vamo' allá... #SaoPaulo #Brasil en São Paulo, Brazil https://t.co/9TRmHZjqj6"
80,68819250,1624455422542331905,2023-02-11,"Carnaval tá chegando, né? 👀
.
.
.
.
.
#carnaval #festa #folia #holiday #party #humor #app #estamosdeolho #camiseta #look em Bixiga, Bela Vista https://t.co/OpXfQI59rE"
81,142325755,1624447284195864579,2023-02-11,"I'm at Pick Your Beer in São Paulo, SP https://t.co/y4DxKqduQ8"
82,28346086,1624438321655971841,2023-02-11,"Acabou de publicar uma foto em São Paulo, Brazil https://t.co/vaAacLdWGD"
83,142325755,1624437941098405888,2023-02-11,I'm at Serra &amp; Sertão in São Paulo https://t.co/UnQgweSCWl
84,460278928,1624436518403145728,2023-02-11,cat festival https://t.co/YXQlpFibzO
85,1326011333813424128,1624436081964851201,2023-02-11,Lindo Grafite https://t.co/wAW3usBJuU
86,4608008475,1624433952378302466,2023-02-11,A parte mais difícil de uma experiência prazerosa é quando ela deixa de existir pra se tornar lembrança ☹️ https://t.co/auEf00H0oV
87,15454050,1624430238947065856,2023-02-11,Vim me despedir da @CulturaLivros https://t.co/17XyCjZWMX
88,1305290834259193856,1624430033602240513,2023-02-11,"Acabou de publicar uma foto em São Paulo, Brazil https://t.co/K5OXxtM5d1"
89,34123254,1624422260135145474,2023-02-11,@falagbrlsns To exatamente nessa função
90,876205295126622209,1624416880667549696,2023-02-11,Acabou de publicar uma foto em UP Cozinha&amp;bar https://t.co/R3AlUIw9Dj
91,85299365,1624398199736737792,2023-02-11,"Grande Dr @drdeodato sempre um prazer revê-lo. Obrigado mestre. 🙏🙋‍♂️☕️ em São Paulo, Brazil https://t.co/DaRN7daKOw"
92,14827952,1624397625142448132,2023-02-11,"É OFICIAL  @festadando NO SABADO DE CARNAVAL, 18 DE FEVEREIRO , JA ARRASA NO MODELO PRA FERVER NO NOSSO GRITO DA FESTA DA CARNE , INGRESSOS A VENDA NO @shotgun.br #festadando #teatromars @teatromars em Teatro Mars https://t.co/qvzVBcmpAp"
93,14827952,1624397414395424768,2023-02-11,Acabou de publicar uma foto em Teatro Mars https://t.co/Iahe4Rjo6S
94,14827952,1624397212775071745,2023-02-11,Acabou de publicar uma foto em Teatro Mars https://t.co/VtwNKD0HLM
95,1620366916278960128,1624369322016772096,2023-02-11,"Como crescer sem enfrentar vento e chuva, você deve aprender a se desafiar e desafiar o limite https://t.co/ghIXtZDurU"
96,1081345345349668869,1624304253543018496,2023-02-11,Acabei de ver aquele otário do tiktok que faz lista de 5 coisas
97,1235646481622855688,1624295702145773568,2023-02-11,"Delicia de festa.  A melhor que eu fui nos últimos 10 anos. Só tenho a agradecer ao @CahPutao e o @rohcamillo  pelo convite e por serem os realizadores de um espaço tão  bacana,  diverso e inclusivo! Quando  puderem vão aproveitar  dessa delicia!! Fotos virão! Aguardem! https://t.co/8jNSIQr4mp"
98,1511058555985702912,1624270784125456384,2023-02-11,🔞Hum quero vê em só a trabalho ok🔞🔥 https://t.co/sW6awkaey0
99,132471365,1624259557965938689,2023-02-11,"Nesta sexta assisti ao espetáculo “Nasci Pra Ser Dercy”. Que peça sensacional, que direção, que atuação! Humor e drama muito equilibrado. Do jeito que gosto! Não conhecia a história da Dercy Gonçalves, não é à toa que ela era quem era. Se estiver em São Paulo, fica a fica. https://t.co/4WjCbiAmJ2"
100,9358142,1624257608302428160,2023-02-11,🥰 https://t.co/Uct9R634gB
101,62257886,1624236065606475776,2023-02-11,Às 11hs Sesc Consolação aos sábados em Sesc Consolação https://t.co/FFsFJokg6m
102,41177838,1624230895283568645,2023-02-11,Acabou de publicar uma foto em Teatro Italia Bandeirantes https://t.co/FgtnRM15Hb
103,14827952,1624228274741051392,2023-02-11,CLUBE A LOCA #aloca #zezearaujo #acervozezearaujo em A Lòca https://t.co/Qq5cC2CvNp
104,215824171,1624227762264211459,2023-02-11,"Acabou de publicar uma foto em São Paulo, Brazil https://t.co/Qg2mnq2bGY"
105,9254922,1624206267651706880,2023-02-11,noites legais✨
106,79717192,1624206171274969089,2023-02-11,Acabou de publicar uma foto em Centro de Pesquisa e Formação - Sesc em São Paulo https://t.co/zYnKV46iKh
107,81593903,1624204009744596998,2023-02-11,Drinking a Bioma Com Café by Cervejaria Dádiva @ Tap Tap Centro — https://t.co/8Jy0VTLoQA
108,81593903,1624198985408827400,2023-02-11,Drinking an Anthropophagism Part III by Cervejaria Escafandrista @ Tap Tap Centro — https://t.co/cg8F8gazNM
109,294946677,1624195824929456130,2023-02-10,"I'm at Outback Steakhouse - @outbackbrasil in São Paulo, SP https://t.co/j5sMdAGr5D"
110,76203465,1624187521763622913,2023-02-10,"Acabou de publicar uma foto em São Paulo, Brazil https://t.co/nTrIcMmGkg"
111,803067272466153476,1624183067299442688,2023-02-10,"Tamo Junto família ✊🏿❤️👊🏿

Foto : @WillMeireles 

Look : Berimbau Brasil https://t.co/zyogmWn2ty"
112,15430166,1624170509251272716,2023-02-10,"Last X-Tudo (@ Padaria Docemar in São Paulo, SP) https://t.co/1qyvhsLqIt"
113,41384930,1624157865748357120,2023-02-10,"I'm at Livraria Cultura in São Paulo, SP https://t.co/kReBl7Ykyf"
114,380455851,1624156497667321856,2023-02-10,💙 em Banco Safra https://t.co/uCwFrq6exe
115,75022159,1624151260709687296,2023-02-10,"Estou adorando a  temporada aqui em São Paulo, com a  peça Uma Relação Tão Delicada . Um pouco do que o publico  está falando …. @umarelacaotaodelicada @teatrouol #ritaguedes em Teatro UOL https://t.co/L3mVHVwnpb"
116,1503924414278160389,1624148226889637889,2023-02-10,e a cabeça bem rosinha! 👩🏻‍🎤 em Barbearia Black Zone https://t.co/wFCfAgUdPN
117,233032751,1624147027901747225,2023-02-10,"Tava com saudade de uma telona neh minha filha? SIM E TÔ VOLTANDO COM TUDO! “Tá Escrito” que final do ano a gente se vê nos cinemas ✏️🎬🎥🪐✨ Ansiosos? em São Paulo, Brazil https://t.co/sSkt2X7Gm3"
118,1430363674309533700,1624135443615735813,2023-02-10,"Tem um  mendigo gritando repetidamente ""Nesse bairro só tem viado, sapatão, puta e travesti!""
Mentindo não tá!"
119,57100510,1624135274606301198,2023-02-10,"I'm at Copanzinho Bar in São Paulo, SP https://t.co/C4IkKF1MoR"
120,41650084,1624126059829465113,2023-02-10,✊️ Ato em defesa da democracia no Peru! https://t.co/OT5KlnW5sU
121,1305290834259193856,1624123578869219340,2023-02-10,"Acabou de publicar uma foto em São Paulo, Brazil https://t.co/Ajd1j2ZcZl"
122,558212587,1624114738765365257,2023-02-10,🧡 SEXTOU❣😃 https://t.co/Yvkn7lsoIb
123,367270447,1624112119787421706,2023-02-10,I'm at A Casa do Porco in São Paulo https://t.co/hfgHxHCycv
124,81593903,1624108155515830272,2023-02-10,Drinking a West End by Cervejaria Octopus @ Tap Tap Centro — https://t.co/PPiLEYi2f5
125,289063916,1624092995107663882,2023-02-10,"I'm at @Santander_br in São Paulo, SP https://t.co/h9Rh2EjeuB"
126,21415271,1624083815684624388,2023-02-10,I'm at Clubinho do Pet - Higienópolis in São Paulo https://t.co/aYq1QrjHAV
127,21242707,1624075865616273416,2023-02-10,Acabou de publicar uma foto em Alameda Editorial https://t.co/8zwYy8ayMV
128,3434584691,1624065486345367552,2023-02-10,Todo trabalho tem a parte chata. Até aquele que você é sua própria patroa. https://t.co/yctVgFlTWh
129,1470857820316868608,1624058496995020806,2023-02-10,"Este é o típico conjuntinho básico indispensável, com calça flare, é super confortável e veste bem. 

#conjuntosfemininos #streetwear #roupanova #estilourbano #lookdodia #oquevestir #roupabarata em São Paulo, Brazil https://t.co/owM07HUlXC"
130,150413399,1624056940711100418,2023-02-10,"Frame do vídeo porque esqueci de tirar foto kkkk

Com o ídolo do @charlesivanribeiromendes o @marchwill do Looping Infinito!

Breve posto o vídeo, gente fina demais, obrigado Will!

#loopinginfinito #serielab https://t.co/vMJT06zMKb"
131,614710137,1624056363633500161,2023-02-10,"Sobre realização de sonhos 🇰🇷💙🇧🇷 em São Paulo, Brazil https://t.co/bgGgA0dyVw"
132,2176108014,1624048698756849670,2023-02-10,I'm at Skinlaser Angélica in São Paulo https://t.co/9u0BKZilGw
133,207624102,1624048437464375296,2023-02-10,Acabou de publicar uma foto em Hospital Sirio Libanes Sao Paulo https://t.co/KV0zqGReCV
134,1373950792483414019,1624041740545007617,2023-02-10,"Hora de assistir Endiabrado 2.

Digo, A Baleia. https://t.co/bI7JCitRAx"
135,749062187927343105,1624039382221987842,2023-02-10,"Bom dia Odisseiers!

A convite da @CaliforniaFilme estamos na cabine de ""A Baleia"", filme que pode dar o Oscar de Melhor Ator a Brendan Fraser 🏆

#TheWhale #Oscars #OscarNoms https://t.co/N2w2FwjFLr"
136,14827952,1624034206631297024,2023-02-10,"É OFICIAL  @festadando NO SABADO DE CARNAVAL, 18 DE FEVEREIRO , JA ARRASA NO MODELO PRA FERVER NO NOSSO GRITO DA FESTA DA CARNE , INGRESSOS A VENDA NO @shotgun.br #festadando #teatromars @teatromars em Teatro Mars https://t.co/vTM2HxvunU"
137,14827952,1624033855777697794,2023-02-10,"É OFICIAL  @festadando NO SABADO DE CARNAVAL, 18 DE FEVEREIRO , JA ARRASA NO MODELO PRA FERVER NO NOSSO GRITO DA FESTA DA CARNE , INGRESSOS A VENDA NO @shotgun.br #festadando #teatromars @teatromars em Teatro Mars https://t.co/IVKJrH2JG1"
138,14827952,1624033658603446280,2023-02-10,Acabou de publicar uma foto em Teatro Mars https://t.co/PndOxKhBvx
139,1295383206825545730,1624029357348888579,2023-02-10,"DISPONÍVEL SP
CHAMADA DE VIDEO, PACS,  VIDEOS PERSONALIZADOS E FETICHES VARIADOS 

 🌹

11* 952106661 https://t.co/6lKuF4Xazj"
140,44948170,1624022035973242884,2023-02-10,"caixotes de gavetinhas de gentes
ou depósito de trabalho em Copanzinho Bar https://t.co/tkM1Ns255L"
141,65049622,1624006246494789639,2023-02-10,"Parabéns Gabriel, hoje ele faz 2 anos, a chegada dele mudou tudo em nossas vidas.
Como nas fotos ele é nossa alegria junto aos irmãos.
#happybirthday em Avenida Paulista https://t.co/2J2zpKIdE5"
142,104202366,1624005834882547713,2023-02-10,Ontem foi dia de reunião da Comissão Editorial da Revista da Cirurgia Dermatológica da SBCD. Muitas novidades no ar. Preparado para mais um novo desafio. em Sociedade Brasileira de Cirurgia Dermatológica (SBCD) https://t.co/zKrcNajAnd
143,1205266233161064462,1623971880939008000,2023-02-10,Shopping for my women vs Shopping for myself. 🤣🤣🤣🤣 https://t.co/4toGEKZXCv https://t.co/Lx96s4osho
144,1190685918941843456,1623900886542983175,2023-02-10,Treininho https://t.co/Uk8Z34a2SA
145,148573210,1623890224286687233,2023-02-10,"..direto das beiras
do bixiga   oh nem me diga q bela vista.. 
.  
dois
white horses
..
em seu habitat ape officina manjedoura.. 
NATURAL
mente..

..as bikes estao cada x + 
in.. 
invisiveis.. 
.. em Bixiga, Bela Vista https://t.co/G06BJyB5gG"
146,25577896,1623885646610804738,2023-02-10,Sucesso total . em Gula Gula São Paulo https://t.co/2bmlSS05VM
147,25577896,1623883346840375296,2023-02-10,Acabou de publicar uma foto em Gula Gula São Paulo https://t.co/qYm7tLtb0t
148,25577896,1623883050684653575,2023-02-10,Acabou de publicar uma foto em Gula Gula São Paulo https://t.co/AfyUQuGrfx
149,25577896,1623883035195195393,2023-02-10,Nhammmmiiiii em Gula Gula São Paulo https://t.co/3ECMTYPSZS
150,25577896,1623882864877002752,2023-02-10,Nhammmmmiiiii em Gula Gula São Paulo https://t.co/H3uKlTHQjn
151,25577896,1623882539021762562,2023-02-10,Refrescante !!! em Gula Gula São Paulo https://t.co/38QGfXbFam
152,198599260,1623871243412811777,2023-02-10,"Super Junior simplesmente não decepciona,que show PERFEITO!Fiquei colada no palco e vi os meninos tão de pertinho, eles interagiram tanto!Saí emocionada 💜 https://t.co/ZfF87tEQMZ"
153,1586618717353435136,1623864015012110336,2023-02-10,"@bruxaodasruas Vem pra k vem ...
Meu @bruxaodasruas https://t.co/gq7zhvyuNB"
154,58634680,1623854622606520320,2023-02-10,"""A Justiça de São Paulo decretou, nesta quinta-feira (9), a falência da Livraria Cultura, uma das redes mais tradicionais do país...""

Uma das notícias mais tristes dos últimos anos...😢

Um dos lugares mais queridos de São Paulo...😢

Que pena 😢 https://t.co/1Duj1FjGiF"
155,1586618717353435136,1623851172300836865,2023-02-10,@eucljunior Bate + https://t.co/5IXu1eHfah
156,349189269,1623845896726237184,2023-02-10,Fun!! https://t.co/zim3D9mf5n
157,150413399,1623843946253422592,2023-02-10,"Mesa do @narratologia que fala?
Mais um dia de @serielab 
#serielab #felipesimmonsmendes #narratologia #beagoes em Serie_lab https://t.co/Hi2x14DXHb"
158,349189269,1623843845745131521,2023-02-10,Fun @!! https://t.co/Sv6dOtHAeR
159,962878861812944897,1623837334251663362,2023-02-10,"‘_exposição Japonesa 🇯🇵 @ Av. Paulista, São Paulo https://t.co/P4VOXJV2Cf"
160,135692805,1623835112243712005,2023-02-10,Acabou de publicar uma foto em Livraria Cultura Conjunto Nacional Av. Paulista https://t.co/3PD9IRsq4F
161,1409474119872176130,1623832474894708740,2023-02-09,"Estou aqui na ""Livraria Cultura"" e soube que hoje foi decretada sua falência. Triste notícia! https://t.co/MBWLeJiiY2"
162,1577213985660747777,1623831945686679553,2023-02-09,🌪️ https://t.co/hN3Ag5cL8h
163,21242707,1623825045637439489,2023-02-09,Acabou de publicar uma foto em Alameda Editorial https://t.co/yuMWFae270
164,96876429,1623821579363704832,2023-02-09,Bora pro teatro 🎭 ❤️ https://t.co/xveDjWi64v
165,1553971429665898497,1623821159526539264,2023-02-09,"Cheguei São Paulo.
Quem quer 🎥 comigo? https://t.co/UYdXqWgo6u"
166,1581776192851566598,1623819516563099648,2023-02-09,@MattWallace888 I think the globalists of the West will use Elon Musk’s technology for us to do harm. We will be marked and watched and forced to do what we don’t want. Globalists want a global government and economic reset. https://t.co/M6Jw3EX6vz
