,author_id,tweet_id,created_at,text
0,148573210,1532248627699122178,2022-06-02,"HUM BRÔ
NÃO EH HUM BRÔ
SEM HUM BRÔ..
..
ARTI5TA de 5@
.. em Bixiga, Bela Vista https://t.co/VRxGdE6ECX"
1,38164758,1532201218264670211,2022-06-02,@richardsakamoto em Bixiga Comedy https://t.co/aulOeqGtBR
2,1185223084623708162,1532193599365988354,2022-06-02,"Acabou de publicar uma foto em São Paulo, Brazil https://t.co/s88dZuxxlj"
3,324675661,1532186696833548288,2022-06-02,https://t.co/RJ6RaT9HhJ
4,81593903,1532186526859264000,2022-06-02,Drinking a Why So Serious? by Los Forajidos Brewing Co. @ Tap Tap Centro — https://t.co/ptW9vfhTz0
5,81593903,1532186514578362369,2022-06-02,Drinking an Alcatraz Escape by Los Forajidos Brewing Co. @ Tap Tap Centro — https://t.co/19zxXVkNNC
6,81593903,1532186497566261249,2022-06-02,Drinking a Speakeasy by Los Forajidos Brewing Co. @ Tap Tap Centro — https://t.co/78WHa1SCT4
7,81593903,1532186491513978881,2022-06-02,Drinking a Sam Crow by Los Forajidos Brewing Co. @ Tap Tap Centro — https://t.co/ReDYkNEaF1
8,81593903,1532186262790098945,2022-06-02,Drinking a Prohibition by Los Forajidos Brewing Co. @ Tap Tap Centro — https://t.co/yFDrykpkGU
9,83594684,1532179456189669377,2022-06-02,Biscoitei 🍪🍪 https://t.co/7wUEbzhbwL
10,1069224860528840704,1532155075724025857,2022-06-02,"Acabou de publicar uma foto em São Paulo, Brazil https://t.co/rvFK6l4AVl"
11,46726346,1532148697277968384,2022-06-01,Keep it Cuuuute! ✌️✨ em Z Deli Sandwich Hamburgueria https://t.co/LBiUvCHJqv
12,189336240,1532148366561402880,2022-06-01,E se não soltar um puta que pariu entro em órbita... https://t.co/E67DjA2US1
13,1059736961307545602,1532137097443803138,2022-06-01,"QUEM VEM COM NÓS, CHAVOSIDADES??? (ps: O @studiospaugusta abre ás 20h)

#BarrosoEus #culturasp #studiosp #leyllahdivablack #queenstars @ Studio SP https://t.co/ecviAPJkuO"
14,189336240,1532113228267929601,2022-06-01,Uma pra cada dia do mês... https://t.co/3snJxStaEn
15,1528126280,1532112146254819329,2022-06-01,Acabou de publicar uma foto em Teatro Commune https://t.co/aA5yt6d7QD
16,155337308,1532105193126387712,2022-06-01,"New Profile! em São Paulo, Brazil https://t.co/O4z2GHxfzX"
17,1527814337062129664,1532089717226971138,2022-06-01,"Acabou de publicar uma foto em São Paulo, Brazil https://t.co/yV5fVGZ2XK"
18,64631305,1532083409555693568,2022-06-01,"A última vez que toquei lá, desliguei o som às 6 da manhã! Então vem que prometo que você vai dançar MOOOITO!! Vemmmm! https://t.co/Z6ykHmltIP"
19,1488551832095973381,1532080104360271872,2022-06-01,"Dá uma ligada no naipe estiloso do @cabelogamer aí tropa! 😎😎❤ em São Paulo, Brazil https://t.co/y9dxOIeTzN"
20,1531306770295140353,1532067906833743872,2022-06-01,Parada para #STARBUCKSCOFFEE https://t.co/a3b5Aaj0Ay
21,27008217,1532062259576721410,2022-06-01,"I'm at Mercadinho Superação in São Paulo, SP https://t.co/N2t0UbhkDM"
22,1305290834259193856,1532055618089017345,2022-06-01,"Acabou de publicar uma foto em São Paulo, Brazil https://t.co/p4rFRxNjwS"
23,289063916,1532040707854172160,2022-06-01,"I'm at Santa Efigênia Pão &amp; Cia in São Paulo, SP https://t.co/zig7RAAKNU"
24,41454280,1532029007822307330,2022-06-01,"Trabalhando pesado na @kissfm92.5 
Todo dia as 13h #BemQueSeKiss em Rádio Kiss FM - 92,5 https://t.co/93umV2VKUj"
25,1074715205639303169,1532021751235940353,2022-06-01,@monark Passando aqui pra desejar uma ótima tarde a todos e para informar minha pré -candidatura a deputado estadual de São Paulo. https://t.co/ww97HTt0ZG
26,765913081088241664,1532020237683593219,2022-06-01,Acabou de publicar uma foto em Casa Da Música https://t.co/Bl0cYbPLjR
27,829360890944315392,1532013401676783622,2022-06-01,"Hoje Tem!! Quem vem tomar bons drinks e curtir a casa de fetiche mais badalada de São Paulo!!

Show com Núbia Ferro.
Promoter Víbora. 

A partir das 18 horas. em Dominatrix https://t.co/FZ4gJP3DxX"
28,84481975,1532010441597132801,2022-06-01,Acabou de publicar uma foto em Estudio Guto Requena https://t.co/NmGXOEy4IV
29,17230271,1532008573752033283,2022-06-01,"Bom dia, queridxs, com o fantástico Joan Miró e seu ""Carnaval do Arlequim"", de 1925. em Bixiga https://t.co/Tsn7ytRvSu"
30,2663965709,1532000281176809475,2022-06-01,"Sindicalizado em República, São Paulo https://t.co/LSXXhatGPq"
31,58852093,1531987528458285057,2022-06-01,Acabou de publicar uma foto em Bar Do Netão! https://t.co/BBiuIXRMHJ
32,302971809,1531985843614797828,2022-06-01,"Acabou de publicar uma foto em São Paulo, Brazil https://t.co/jvvfrUAQid"
33,53837522,1531983300172070912,2022-06-01,"Aquele friozin!!!
🙏🏽🙏🏽🙏🏽 em Butantã https://t.co/GzavSifHwH"
34,147770692,1531976836535697408,2022-06-01,Acabou de publicar uma foto em Teatro Faap https://t.co/9frCOzQ3GA
35,1197158166242484225,1531974721595645953,2022-06-01,"O cifrão entre camadas de abandono com aparente destruição. @ República, São Paulo https://t.co/2YMR482D7P"
36,44993096,1531971943238443011,2022-06-01,"Acabou de publicar uma foto em São Paulo, Brazil https://t.co/WrB1NPmGqv"
37,1370176264821219328,1531964118214795264,2022-06-01,"Acabou de publicar uma foto em São Paulo, Brazil https://t.co/V50VtPdBrp"
38,1127989784792772608,1531963315152363521,2022-06-01,Localiza aiií.... https://t.co/QfGLQW8wbt
39,1497317681388830727,1531962492485783554,2022-06-01,I'm back #NoPainNoGain #SaúdeNaRotina https://t.co/Gnn9fqSU3s
40,1327365418722484225,1531946797135962114,2022-06-01,@viatrolebus Não tem como pagar esses valores
41,84241251,1531872626351542272,2022-06-01,Acabou de publicar uma foto em The Wall Café https://t.co/A2cfisNToV
42,65480733,1531872283228131328,2022-06-01,Acabou de publicar uma foto em The Wall Café https://t.co/YOu6NH6GaC
43,67700289,1531872238995120130,2022-06-01,Acabou de publicar uma foto em Higienópolis (bairro de São Paulo) https://t.co/jL4TEnNikQ
44,65480733,1531871436188667904,2022-06-01,Acabou de publicar uma foto em The Wall Café https://t.co/kdyIy4d7bz
45,84241251,1531870991412076544,2022-06-01,Acabou de publicar uma foto em The Wall Café https://t.co/EwV3YoA9Sv
46,84241251,1531870576335368193,2022-06-01,Acabou de publicar uma foto em The Wall Café https://t.co/tvtvLjNAhp
47,67700289,1531870211686731777,2022-06-01,Acabou de publicar uma foto em Higienópolis (bairro de São Paulo) https://t.co/3INvoJ9wYy
48,65480733,1531869463859146752,2022-06-01,Acabou de publicar uma foto em The Wall Café https://t.co/57i0zljchS
49,45847677,1531868936693760001,2022-06-01,Acabou de publicar uma foto em The Wall Café https://t.co/lLv3GfS2Yu
50,45847677,1531868486640603138,2022-06-01,Acabou de publicar uma foto em The Wall Café https://t.co/dhzkpfd6SK
51,45847677,1531867555622789120,2022-06-01,Acabou de publicar uma foto em The Wall Café https://t.co/2R0gC8o3z8
52,148573210,1531836029170335746,2022-06-01,"Acabou de publicar uma foto em Bixiga, Bela Vista https://t.co/i66JA2QFpz"
53,120956551,1531830390218018817,2022-06-01,Um novo espetáculo com o mesmo elenco delicioso de “Pousada Refúgio” e com a chegada da grande Clara Carvalho como matriarca. Primeira leitura do novo texto “Veraneio” de Leonardo Cortez 🌊❤️ em Pequeno Ato https://t.co/GJAcf8WaVE
54,118925906,1531824477885149184,2022-06-01,🍹 🏨 https://t.co/0rYmOc7BDz
55,765913081088241664,1531809094897545216,2022-06-01,Acabou de publicar uma foto em Casa Da Música https://t.co/FBIJn5QeMS
56,78997743,1531799674604118016,2022-06-01,E essa querida @littmannveronique toda trabalhada na Balenciaga !!!???  Adoro 🖤 #spfwn53 #spfw #alagarçonne em MAB FAAP https://t.co/ZMntJflkhu
57,1069224860528840704,1531794436526641153,2022-06-01,"Acabou de publicar uma foto em São Paulo, Brazil https://t.co/W9LJzLKBys"
58,148573210,1531781588001882113,2022-05-31,"CARLOS ZOFFO
eh hum
""ARTI5TA de 5@""
.. em Bixiga, Bela Vista https://t.co/UlGK7Rx6YZ"
59,148573210,1531778807748734976,2022-05-31,"ROGÉRIO PADIAL
eh hum
""ARTI5TA de 5@""
.. em Bixiga, Bela Vista https://t.co/w5qmzBs2IX"
60,166671180,1531771701549322240,2022-05-31,📷 dia 15/05 em Liberdade- São Paulo https://t.co/oGiiofKTuA
61,52742556,1531769926284984320,2022-05-31,"Cata a pipoquinha e vem pra pré-estreia de milhões 😝🍿

#UmBrotoLegal #CulturaSP #PetraBelasArtes https://t.co/oOCBCvZSux"
62,1185223084623708162,1531764787268427779,2022-05-31,"Acabou de publicar um vídeo em São Paulo, Brazil https://t.co/eoXxaDZM5n"
63,52742556,1531764552857276416,2022-05-31,"É uma mostra inédita online (@culturaemcasasp) e presencial (no Petra) com 200 filmes nacionais🇧🇷

A galera já está chegando animada para conferir a estreia de hoje, 'Um Broto Legal', que conta a história da primeira cantora de rock nacional, Celly Campello 📽🍿

#CulturaSP https://t.co/566IKJBG31"
64,52742556,1531764533181972480,2022-05-31,"Hoje eu tô aqui em um dos cinemas mais charmosos de SP, o Petra Belas Artes, pro lançamento da Mostra: 200 anos da Independência em 200 filmes 🤩📽 https://t.co/9FZQ5fuCj7"
65,14503489,1531756615082205184,2022-05-31,Acabou de publicar uma foto em Consolação https://t.co/UYpQHHm864
66,289063916,1531752501090959360,2022-05-31,"I'm at Bluefit in São Paulo, SP https://t.co/tiqkPzYNb5"
67,76481710,1531751953788637184,2022-05-31,Acabou de publicar uma foto em Hey Hey Club &amp; Eventos https://t.co/PxB3KwfrDT
68,15430166,1531747543360720905,2022-05-31,"I'm at ACM/YMCA in São Paulo, SP https://t.co/2PfIuODLSZ"
69,829360890944315392,1531747177311023104,2022-05-31,Acabou de publicar uma foto em Dominatrix https://t.co/sIcIW8B2L9
70,45937238,1531746663538171905,2022-05-31,Acabou de publicar uma foto em TUSP - Teatro da Universidade de São Paulo https://t.co/LMcOQYzxon
71,1435573528259174405,1531740644598759424,2022-05-31,Pra variar SP está: https://t.co/YEzQF7dDML
72,44300313,1531738219502501888,2022-05-31,"I'm at Escola de Atores Wolf Maya - @escolawolfmaya in São Paulo, SP https://t.co/z9mwWS4TlJ"
73,59883726,1531737760884838402,2022-05-31,"Acabou de publicar uma foto em São Paulo, Brazil https://t.co/wJVatvA9UE"
74,148573210,1531736327892324352,2022-05-31,"Acabou de publicar uma foto em Bixiga, Bela Vista https://t.co/FBLiqe3fJ0"
75,29502075,1531735492827312128,2022-05-31,Últimos dias de inscrição. Gratuito. Uma investigação decolonial. em SP Escola de Teatro https://t.co/6so8spregY
76,148573210,1531732232704077826,2022-05-31,"Acabou de publicar uma foto em Bixiga, Bela Vista https://t.co/6ufFki70oV"
77,1185223084623708162,1531729044424622080,2022-05-31,"Acabou de publicar uma foto em São Paulo, Brazil https://t.co/iKiliZuh9N"
78,1185223084623708162,1531728444651933696,2022-05-31,"Acabou de publicar uma foto em São Paulo, Brazil https://t.co/V2oODMl6ev"
79,52089108,1531728278414835712,2022-05-31,"89fm! 
Yes, We Will Rock You!
#caan #kameleonbags @kameleonbags em A Rádio Rock https://t.co/OPOW1Ds8Xo"
80,1053315827481698310,1531727632760455168,2022-05-31,Começou a promoção DIA DOS NAMORADOS  RICOK 40% de desconto em todo site avisa os amigos já mostra pro Mozao e já fala fica dica !!! Arrasem!!! em Ricok Couture https://t.co/sjU2hdEtAq
81,148573210,1531725370612805632,2022-05-31,"Acabou de publicar uma foto em Bixiga, Bela Vista https://t.co/bwx4007MC9"
82,56035594,1531719936606969858,2022-05-31,Acabou de publicar uma foto em Hospital Nove de Julho https://t.co/X4kCLNQL9n
83,1512246921641041920,1531700817983688707,2022-05-31,Sexto sentido de mãe não mente.
84,324643939,1531697237398519810,2022-05-31,Acabou de publicar uma foto em Hospital Sirio Libanes Sao Paulo https://t.co/IHLt0R5fvS
85,1529216812059185152,1531696264001343489,2022-05-31,"Batatas assada com alecrim,bacom,alho e manteiga. https://t.co/sNBpttsfaH"
86,15165399,1531687374580760577,2022-05-31,"Fui. Aleluia, senhor!

____
minha singela homenagem a @korolova.dj — a ucraniana que me surpreendeu no @sotrackboa 😎 em Bluefit https://t.co/DnGPmcHeSs"
87,1305290834259193856,1531687080627122178,2022-05-31,"Acabou de publicar uma foto em São Paulo, Brazil https://t.co/iGoi64S6xn"
88,307655659,1531683288741445633,2022-05-31,"Acabou de publicar uma foto em São Paulo, Brazil https://t.co/R8RuganhIF"
89,176277837,1531668036809379840,2022-05-31,"tokyopalooza dump @tokyo.sp 

#mondayvibes @ Tokyo 東 京 https://t.co/S33VqFIN2z"
90,68088445,1531655348687355904,2022-05-31,"Acabou de publicar uma foto em São Paulo, Brazil https://t.co/3A53cy7iwB"
91,235231869,1531615644592087040,2022-05-31,"Acabou de publicar uma foto em São Paulo, Brazil https://t.co/QB723jLrvg"
92,17230271,1531608432570163201,2022-05-31,"Bom dia com ""A Fonte"" de R. Mutt, de 1917. Quer dizer, do genial Marcel Duchamp. Ou seria de Elsa Von Freytag Loringhoven? Sei lá, só sei que é uma ""obra pronta"" sensacional! em Bixiga https://t.co/CIfmEV604F"
93,51929469,1531607160978911233,2022-05-31,Pros home officers de plantão: trabalhar em casa ou nos cafés da vida? 🧑‍💻 https://t.co/9sy6kd9Xg3
94,169665020,1531602159653072896,2022-05-31,Acabou de publicar uma foto em Deserto Do Atacama https://t.co/ofJZWQdKHB
95,1185223084623708162,1531599703573516288,2022-05-31,"Acabou de publicar uma foto em São Paulo, Brazil https://t.co/6lt23RmaPL"
96,1390016160918294529,1531563983055953921,2022-05-31,Foto appena pubblicata @ Lago Di Lecco https://t.co/d3QpsjwUUt
97,263542568,1531493213940457472,2022-05-31,"Acabou de publicar uma foto em São Paulo, Brazil https://t.co/TZDZQ91Le8"
98,274270441,1531473747181305857,2022-05-31,"Acabou de publicar uma foto em São Paulo, Brazil https://t.co/SCunIcD75d"
99,81593903,1531462222907592705,2022-05-31,Drinking a Spinning Wheel by Cervejaria Octopus @ Tap Tap Centro — https://t.co/Ow8WhYR7QN
100,1185223084623708162,1531459035999903745,2022-05-31,"Acabou de publicar uma foto em São Paulo, Brazil https://t.co/ZZS1j2xepZ"
101,1185223084623708162,1531458359731589120,2022-05-31,"Acabou de publicar uma foto em São Paulo, Brazil https://t.co/yZKj9Ud4zl"
102,1185223084623708162,1531457289043034113,2022-05-31,"Acabou de publicar uma foto em São Paulo, Brazil https://t.co/YN7cvYMwhh"
103,100596591,1531455237290082304,2022-05-31,"Amor e companheirismo.

... é dar ao outro a permissão de não precisar ser perfeito.

Celebração do casamento da Thays e Igor.

@thaysfernandez &amp; @igorgrohmann 

@casinhaquintal em Casinha Quintal https://t.co/LgwYMIHYTc"
104,1185223084623708162,1531454942979948544,2022-05-31,"Acabou de publicar uma foto em São Paulo, Brazil https://t.co/g1B17n1x4m"
105,1521625431639736320,1531453317100052480,2022-05-31,Por obséquio. Grato. Boa noite. https://t.co/1WL9ZM8fC8
106,148573210,1531450409574928386,2022-05-31,"""arti5ta de 5@""
..
Quinta-feira, 
02 de JUNHO de 2022
..
happy hour &amp; lounge
.. em Bixiga, Bela Vista https://t.co/bYhnnz8JkS"
107,81593903,1531448895674499072,2022-05-31,Drinking a Conjuntinho Verde by Máquina do Tempo Cervejaria @ Tap Tap Centro — https://t.co/3wUOnz2OH6
108,81593903,1531443346450919424,2022-05-31,Drinking a Moderne Dansk (Blend #3) by @jesterkingbeer @ Tap Tap Centro — https://t.co/RlmcuZYNuF
109,81593903,1531433309842116609,2022-05-31,Drinking a Mineshaft Gap (2020) by @revbrewchicago @ Tap Tap Centro — https://t.co/SCnMTV92HT
110,67966935,1531431387819085826,2022-05-31,Acabou de publicar uma foto em Instituto Locomotiva https://t.co/LI7aCclSeY
111,72601613,1531429714027585540,2022-05-31,Acabou de publicar uma foto em Interamerican Network https://t.co/wG9HV2duoL
112,81593903,1531428769034121217,2022-05-31,Drinking an All That I Have Learned [Maple Bourbon BA] (Ghost 987) by @AdroitTheory @ Tap Tap Centro — https://t.co/ImQyk6PzX6
113,70509209,1531427064611487744,2022-05-31,jantar com amigos 🥰 em Athenas Café e Restaurante https://t.co/9z3asUux5S
114,81593903,1531424475874578432,2022-05-30,Drinking a Funky Foeder by Russian River Brewing Company @ Tap Tap Centro — https://t.co/zBeT1fCJkB
115,81593903,1531420960099815427,2022-05-30,Drinking a Supermassive Café Deth (2021) by @revbrewchicago @ Tap Tap Centro — https://t.co/d54ErXy3Qw
116,1057088755318906885,1531419510288404481,2022-05-30,@MoaTurnblad Ansiosaaaaah pra esse encontrinho. Hoje mw trouxe ao cinema &lt;3
117,81593903,1531414420974346240,2022-05-30,Drinking an Arketype: Chocolate Churro (2021) by @MoreBrewing @ Tap Tap Centro — https://t.co/6gfsKl1WgV
118,72601613,1531407392788848640,2022-05-30,Acabou de publicar uma foto em Interamerican Network https://t.co/KgJNXdF7io
119,15430166,1531406638757908481,2022-05-30,"I'm at ACM/YMCA in São Paulo, SP https://t.co/ecY2Dz2I1A"
120,829360890944315392,1531400968755109889,2022-05-30,Acabou de publicar uma foto em Dominatrix https://t.co/SHeZW9S4Iu
121,128124649,1531398715558068224,2022-05-30,Acabou de publicar uma foto em La Salsa Discotek https://t.co/UfFtVrYYaK
122,177629082,1531396463686733828,2022-05-30,Ivan Santana https://t.co/P17JjksxNt
123,336199865,1531390979231518721,2022-05-30,Acabou de publicar uma foto em Liberdade- São Paulo https://t.co/Tl99QhWUpv
124,1069224860528840704,1531390289373327360,2022-05-30,"Acabou de publicar uma foto em São Paulo, Brazil https://t.co/97ZBC1QMik"
125,1527814337062129664,1531381913369321472,2022-05-30,"Acabou de publicar uma foto em São Paulo, Brazil https://t.co/RjzULgRnKF"
126,199249109,1531379332131831813,2022-05-30,Day off!!! em Liberdade- São Paulo https://t.co/IuDUFTYAiN
127,75306168,1531376843877765124,2022-05-30,"só pra fechar a sequência de SP, ok? 🤙🏻 em América - Avenida Paulista https://t.co/U7wUHpCOaR"
128,1121631714382503937,1531371194993221632,2022-05-30,🐈‍⬛ em Kat Klub https://t.co/nOmGb3ONJd
129,1226381700168474624,1531360023040839681,2022-05-30,unthaw mah heart ❄🧊🌬 @ Freezer https://t.co/CR36JBMdRW
130,2469896996,1531349818366234624,2022-05-30,"A @aradiorock trocou de roupa, e tá ainda mais bonita decorada de novo com a arte de @marina_yoshie usando minhas fotos. Quem for visitar, tira fotos e me marca \m/ em A Rádio Rock https://t.co/THtrSQsd7s"
131,81424424,1531336967585161217,2022-05-30,"Sábado fomos conhecer o instituto Moreira Salles que fica na Avenida Paulista.
🎟️Entrada gratuita https://t.co/h5POjc5bHP"
132,72601613,1531332315707854848,2022-05-30,Acabou de publicar uma foto em Interamerican Network https://t.co/F2MGxWhTlo
133,822929250437177345,1531323599197446144,2022-05-30,Hoje o dia ta suave
134,74288525,1531319776210997248,2022-05-30,"Homenagem do artista @kobrastreetart aos trabalhadores dos Correios na avenida Paulista.

#sintectspsemprepresente em Conjunto Nacional Na Av Paulista - Sp https://t.co/mt4GAtkBAV"
135,307655659,1531314554327678976,2022-05-30,"Desenhos feito no carinho que estou muito afim de tatuar ❤️ mas sua ideia também e bem vinda, se você tem interesse de tatuar comigo escreve via direct ❤️ em São Paulo, Brazil https://t.co/RuCIIJ9jTQ"
136,1053315827481698310,1531303571081289733,2022-05-30,"Nosso BODY RICOK  é uma peça super versátil que vc pode montar vários looks alem de usar na sua intimidade pq fica super sexy e ela vira jock ou fio dental duas peças em uma 🤷🏻‍♂️✅
.
#bodyricok #body #ricokcouture https://t.co/VlYd3u7agR"
137,51421519,1531301261122977793,2022-05-30,Acabou de publicar uma foto em Higienópolis (bairro de São Paulo) https://t.co/xCy42dR0Lb
138,1181938948702162945,1531301055933423617,2022-05-30,sweet dreams (are made of this) - funk version https://t.co/ViESChAeCz
139,11351602,1531287990063988741,2022-05-30,Just posted a photo @ Santa Cecília /Higienópolis/República/Vila Buarque https://t.co/QqFExIQv4A
140,1518606114597871617,1531275429985800193,2022-05-30,Saudar o sol 🌞 https://t.co/dkFVlbBT9G
141,1361821886104092682,1531274135665524736,2022-05-30,🇧🇷 Nossa FAAP em 3D no GPS do carro… coisa da  #tecnologia ✔️ @nafaap @antigosalunosfaap @faapbhub em FAAP - Fundação Armando Alvares Penteado https://t.co/bH54Sp4z07
142,1135954054675410945,1531256046647377926,2022-05-30,"Yakuy é tupinambá, ciberativista, pensadora, escritora, comunicadora, educadora e idealizadora do Útero Amotara Zabelê -  primeira escola de filosofia dos povos originários no mundo 🏹✨ 

Juntas estamos refundando o Brasil 🤜🏽🤛🏼 #SPQuerCoragem #LuteComoQuemCuida #CarmenSilva"
143,1135954054675410945,1531256044168663045,2022-05-30,Ontem foi dia de visita dos nossos parentes na Cozinha da Ocupação 9 de Julho. A ativista @yakuytupinamba preparou delícias e compartilhou os sabores de sua cozinha sagrada para nós 🧡+ https://t.co/mwqvxlJbDk
144,36764360,1531247193084121088,2022-05-30,Acabou de publicar uma foto em Hemocentro Santa Casa https://t.co/G5kSRBxdbB
145,36764360,1531244452563632129,2022-05-30,"Subiram os balões pra comemorar meu aniversário, mas quem ganhará o presente serão pelo menos 4 pessoas que irão receber este sangue.
Os bancos de sangue estão cada vez mais escassos, então para que mais pessoas possam comemorar mais aniversários: 
Doe Sangue, Salve Vidas https://t.co/T9rTOB5YIA"
146,35291115,1531235673323208704,2022-05-30,Animado eu não estou... Mas vim!!!
147,934879761956065281,1531227226699616257,2022-05-30,"A melhor torcida do mundo @torcidamv83 passou por aqui , banco de sangue da Santa Casa 🩸 https://t.co/YRvmtKzdl6"
148,55970374,1531224133962440704,2022-05-30,Acabou de publicar uma foto em Higienópolis (bairro de São Paulo) https://t.co/fGvjjVqGJ9
149,3291424611,1531212896080109568,2022-05-30,Uma satisfação imensa louvar ao Senhor e aprender mais dele com esses elevados senhores e senhoritas. Certamente sou imensamente honrado pela vida de vocês! https://t.co/MCO6tkK2Ez
150,70509209,1531099831090954240,2022-05-30,art. em Av. Paulista 1745. São Paulo https://t.co/tt6k8IBtvD
151,1463385409338023941,1531097651080568832,2022-05-30,primeira cerimônia que acompanho com voz e piano. muito feliz :) #vozepiano #casamento https://t.co/vjuGBjsSkS
152,626237487,1531079779796910081,2022-05-30,Dia de solzinho ☀️🍃 em Parque Augusta https://t.co/P9Kv3waYhG
153,302971809,1531070240142000128,2022-05-30,"Acabou de publicar uma foto em São Paulo, Brazil https://t.co/v3KSk3Ke0W"
154,843616776,1531065483298017282,2022-05-30,Fim de domingo 😋 https://t.co/xiqgv9lTmr
155,2912213903,1531063995511189504,2022-05-30,Dumb. em Tokyo 東 京 https://t.co/hk7cxHN4w8
156,2912213903,1531063050228350976,2022-05-30,Dumb 🇯🇵 em Tokyo 東 京 https://t.co/SX01WxehC6
157,2912213903,1531061858005917697,2022-05-29,Dumb 🍣 em Tokyo 東 京 https://t.co/YzMdxqvMH0
158,76257183,1531060396546633728,2022-05-29,Amo tanto!!! 😍😘❤️ #MyFriends #AmoTanto #DeOntem em Bella Augusta Bar e Restaurante https://t.co/oNjrF5iKdV
159,1218263233590710273,1531056000031129603,2022-05-29,"Tacaram uma torta na Monalisa! Mas o besouro Callytron monalisa segue muito bem. Na verdade, mais ou menos. Esta espécie rara que habita o Golfo Pérsico sofre com o boom da ocupação costeira em Abu Dhabi, seu local de origem https://t.co/j9Tw0w9ZXD"
160,27355168,1531055698615861248,2022-05-29,Ca sis @Lucasbas11 https://t.co/JuF8nENWzk
161,3634982781,1531051300409966592,2022-05-29,De ontem com a melhor amiga @oli_ci ♥️ https://t.co/ek8reF2JEE
162,1069224860528840704,1531039054757625856,2022-05-29,"Acabou de publicar uma foto em São Paulo, Brazil https://t.co/4UKF9Y8Upa"
163,56699915,1531036108880060416,2022-05-29,Acabou de publicar uma foto em NDH Waleska Farias https://t.co/QXDb5pCCJG
164,112726540,1531031869550116866,2022-05-29,"Sunny Sunday 

#loveislove #pictureoftheday #gaybrasil #boysp #instagood em São Paulo, Brazil https://t.co/EiqvVuwEG8"
165,64550233,1531022603925737475,2022-05-29,Estamos abertíssimos em Japan Tower https://t.co/W8Y9QmzPgJ
166,36786658,1531020795543269382,2022-05-29,I can't take my eyes off of you https://t.co/06qHVtm65z
167,1521625431639736320,1531014823999307777,2022-05-29,Se tivesse uma gafieira eu teria a roupa 😅👒🇵🇦 https://t.co/3a0Mswy0f9
168,1509120854239723521,1531013247830315011,2022-05-29,Acabou de publicar uma foto em Centro de Convenções Rebouças https://t.co/TRttlbTdVb
169,1463438926232887299,1531003253479055361,2022-05-29,Uma terapia https://t.co/S903BjN391
170,907308025777713156,1530995012762312704,2022-05-29,Será que gostou??? em Teatro Opus https://t.co/WGi6A7Rxy3
171,1288887885333172228,1530985784463044610,2022-05-29,Domingo de menino pré niver https://t.co/OVz5TAYnjm
172,1288887885333172228,1530984745080868865,2022-05-29,No filter... sun'day https://t.co/Wdv8SPc6Ev
173,1185223084623708162,1530982544547713026,2022-05-29,"Acabou de publicar uma foto em São Paulo, Brazil https://t.co/WZH4lM8VkE"
174,1185223084623708162,1530982060038316033,2022-05-29,"Acabou de publicar uma foto em São Paulo, Brazil https://t.co/oXCKG07gz1"
175,1509120854239723521,1530977484920868866,2022-05-29,2º Dia de Curso de Certificação em Medicina da Obesidade 🙏🏼 em Centro de Convenções Rebouças https://t.co/AR6jZOpbio
176,847753393900666880,1530975343317766146,2022-05-29,About last night 🌃 https://t.co/jSmJlalXUU
177,108637786,1530974570651340800,2022-05-29,"“…Mas trago de cabeça uma canção do rádio, em que um antigo compositor baiano me dizia: Tudo é divino tudo é maravilhoso!”

#sampa em República, São Paulo https://t.co/1yCdwFzasc"
178,202808816,1530972249712369665,2022-05-29,"AMANHÃ tem #pegadaBRAVAnoEXECUTIVO!
SET TIME 🕦 11h30"
179,1305290834259193856,1530968894323703811,2022-05-29,"Acabou de publicar uma foto em São Paulo, Brazil https://t.co/IqJrObLsxY"
180,298757506,1530961415971909638,2022-05-29,Que alegria!!!!! O almoço de domingo!!!!! em Cantina Mamma Celeste https://t.co/3si9gwYrIJ
181,134649778,1530959683833446400,2022-05-29,https://t.co/wGItrRw3AF
182,49627554,1530958819769065472,2022-05-29,"Acabou de publicar uma foto em São Paulo, Brazil https://t.co/gjUQrOw11a"
183,56119495,1530955802768334848,2022-05-29,Acabou de publicar uma foto em Bela Vista (district of São Paulo) https://t.co/7KUssJ0PMK
