,author_id,tweet_id,created_at,text
0,4580783727,1536491475990728710,2022-06-13,Faça dinheiro se mantenha vivo em Aonde Os Fracos Nao Tem Vez https://t.co/wHgbCdeK1D
1,1517912604638908416,1536211757114568706,2022-06-13,"Eu sofri para fazer essa foto hahahaha!
I suffered to make this photo hahahaha! em Dor https://t.co/l0RO3Tt0zy"
2,1525489716510052352,1536207792800993280,2022-06-13,Eu odeio muito tudo isso. em Hell https://t.co/dBT4KOfwit
3,1040808864940281856,1535968664633098241,2022-06-12,"1o Encontro do Núcleo de Pesquisa em Economia e Administração do Turismo (NEAT-USP), realizado neste sábado (11/06) na EACH-USP. Agradecemos a participação de todas e todos! em EACH-USP https://t.co/LYhvK6o2CL"
4,1387216514248593416,1535793935016157187,2022-06-12,Acabou de publicar uma foto em Igreja Evangélica Missionária Santidade e Poder https://t.co/fq173C97RM
5,1204803284789342210,1535660121828761602,2022-06-11,Acabou de publicar uma foto em Angra dos Reis-RJ https://t.co/OPS60SqbiW
6,981327746,1535377650931605504,2022-06-10,SKY on the beach 🇩🇴❤️ https://t.co/Aa9gVbUqiD
7,47832422,1535313353169678338,2022-06-10,Bora queimar 🔥 https://t.co/EC6MxuBG8D
8,4853982353,1535298970435604489,2022-06-10,Chegamos! Daqui a pouco tem coletiva de imprensa com Roberto de Andrade e Alessandro. https://t.co/gXyF1DLtkQ
9,1405610534968385551,1535244407859040256,2022-06-10,"E bem é meme 😂😍
#ateliedosbaloesoficial
#florkmemes em Ateliê dos Balões https://t.co/5dBDWqUzi6"
10,929117191370412032,1535083987630178321,2022-06-10,Perdido na z/l https://t.co/vQ3vbfw3BF
11,53371678,1535073516315361292,2022-06-10,Acabou de publicar uma foto em Neres Shows Bar https://t.co/qkq7DoTXnP
