,author_id,tweet_id,created_at,text
0,402688868,1558900490565521413,2022-08-14,Jonas! em Jardim Ver칪nica https://t.co/feolk4tEsT
1,402688868,1558896222026379264,2022-08-14,Jonas! em Jardim Ver칪nica https://t.co/lhXl1aJG8Y
2,402688868,1558877803805700098,2022-08-14,Jonas! em Jardim Ver칪nica https://t.co/3th1P6tUjJ
3,402688868,1558869361657614338,2022-08-14,Jonas! em Jardim Ver칪nica https://t.co/HmWe9Wx3xm
4,71437422,1558829879302438914,2022-08-14,"Dia dos Pais com direito a presente do meu amorzinho游봃

Filha Papai te ama e pode ter certeza que poder치 contar comigo para tudo nessa vida.
#papaiteama #paideprincesa #paidemenina仇벒잺 #aylameuamor #filhateamo https://t.co/cRhF2nwmMP"
5,1280893000609083394,1558801788173787142,2022-08-14,Acabou de publicar uma foto em Martinelli &amp; Figueiredo Advocacia e Assessoria Juridica https://t.co/qSrmUmgjJe
6,55619560,1558791986169118730,2022-08-14,Dia dos paia칞os (pai com a칞o) em Padaria Uni칚o Da Ponte Rasa https://t.co/80gDroK9Ni
7,1387216514248593416,1558668252401831937,2022-08-14,Acabou de publicar uma foto em Igreja Evang칠lica Mission치ria Santidade e Poder https://t.co/Te1KKmiYfK
8,43089906,1558131672679387137,2022-08-12,"I'm at CT Joaquim Grava - Corinthians in Guarulhos, S칚o Paulo/Brasil https://t.co/DpUOd3NvQd https://t.co/7BPQxVP5iG"
9,1549374935637938176,1558028965209579532,2022-08-12,"Pregui칞a de levantar...

Bom dia gurizada https://t.co/c4rYSbdtTQ"
10,1280893000609083394,1557955630241030145,2022-08-12,Acabou de publicar uma foto em Martinelli &amp; Figueiredo Advocacia e Assessoria Juridica https://t.co/CjoG37Qd0q
11,63240588,1557746730589978625,2022-08-11,"#PartiuMiss칚o游댠 
Neste S치bado em Angra dos Reis RJ na Par칩quia Nossa Senhora Aparecida, Balne치rio, a partir das 18h00.
7춿 Dia do Cerco de Jeric칩 2022 九덢잺
@jovenssaradosangra em Angra dos Reis-RJ https://t.co/taCXReQxdD"
12,3685487001,1557178953181401088,2022-08-10,"Aula de atabaque particular ou grupo. 
Venha aprender a tocar atabaque!
Aula de atabaque para todas as idades, venha aprender a tocar atabaque para louvar seu Orix치. 
Estamos localizados na zona leste de SP, Ponte Rasa,  chama no WhatsApp   +55 11 96576-2348 https://t.co/LngZClV5WJ"
