,author_id,tweet_id,created_at,text
0,1519041825574694920,1550955462819971073,2022-07-23,https://t.co/DUzlo4lbts
1,193784534,1550881862708609028,2022-07-23,O bracinho 🤏🏼🥹 https://t.co/GClZtCrvNd
2,75562956,1550857965661560833,2022-07-23,"Acabou de publicar uma foto em Vila Industrial, São Paulo-Sp https://t.co/ywmp0YUbWV"
3,75562956,1550846868850188289,2022-07-23,"Acabou de publicar uma foto em Vila Industrial, São Paulo-Sp https://t.co/zUJZ5ZEuaP"
4,312699472,1550476151105245184,2022-07-22,Começa hoje nosso congresso Mocidade Maranata vem em ADF-Jd.Grimaldi https://t.co/TIQNE7srxR
5,352732194,1550210573358465024,2022-07-21,😏🤙🤙 https://t.co/JW97ZkOfpS
6,1545351713921679362,1550158847473508352,2022-07-21,"Kihon Mikalkenas. Tatame cheio. 
Adultos e crianças do Projeto Jiu Jitsu Kids. https://t.co/PBMY846bMm"
7,2501785851,1550020046747013122,2022-07-21,"Obrigada por esse dia e por serem amigos perfeito também… Amo vocês 
#barracos_de_familia❤️🫶🏽🌈 em Av. Do Oratório https://t.co/0izQPg1LOv"
8,517407592,1549923537334390786,2022-07-21,Just posted a photo @ Sapopemba https://t.co/z8zcvNL8s5
9,1515376600510091275,1549471980075843586,2022-07-19,https://t.co/aj91botsi1
10,857624090936528898,1549407929996034049,2022-07-19,Acabou de publicar uma foto em Jardim Guairaca https://t.co/nuAgthhDSC
11,217581868,1549085044043419648,2022-07-18,Acabou de publicar uma foto em Cdm Madalena https://t.co/dZvxLm2WEM
12,137207381,1549050480461955072,2022-07-18,Just posted a photo @ Cohab Teotônio Vilela https://t.co/SoZWF3hXjM
13,1146050531326078977,1548783264348966912,2022-07-17,🦇 https://t.co/mgeogwDY8W
14,3638069663,1548763718888001536,2022-07-17,"Acabou de publicar uma foto em Valinhos, São Paulo https://t.co/zk9udvzTMD"
