,author_id,tweet_id,created_at,text
0,78097690,1529586340828160000,2022-05-25,Sr. Horácio e a sua expressão de preocupação com os boletos que chegam todo mês. A gente que lute @deborarosene em Venit Residencial https://t.co/rS3ivzRJM6
1,1039209306015588359,1529443140322705408,2022-05-25,Acabou de publicar uma foto em Localiza Se for Possivel https://t.co/jRtViua1Cp
2,1488275421976223749,1529306878077210624,2022-05-25,nada não só queria ter oq postar mesmo https://t.co/joMRD5dNLe
3,75562956,1529186681433227268,2022-05-24,"Just posted a photo @ Vila Industrial, São Paulo-Sp https://t.co/kP54eS1bAD"
4,75562956,1529186488965115907,2022-05-24,"Just posted a photo @ Vila Industrial, São Paulo-Sp https://t.co/faeIXgh6kg"
5,1502435750096392194,1528905822130032640,2022-05-24,Quem curte pegação entre ativos?? https://t.co/GAahlxmf8R
6,240009102,1528877477568954371,2022-05-23,"Rico, bonito e mentiroso!!! 🤩🤣 em Vila Ema https://t.co/qQdvx7Er4j"
7,217581868,1528815129365577728,2022-05-23,Acabou de publicar uma foto em CDC Jardim Planalto https://t.co/zh5ZYEo4Hj
8,1502435750096392194,1528761141874376704,2022-05-23,Aliviando o tesão https://t.co/rtbKwSIQh1
9,1528004226747711490,1528737203265888256,2022-05-23,Grau de automatica https://t.co/iZYKDd2Tvk
10,1528004226747711490,1528736578117459968,2022-05-23,Nmax https://t.co/0FlRGixplw
11,2763944991,1528430390616027136,2022-05-22,🍀 em Vila Ema https://t.co/lVM4cpa3pu
12,1528177812,1528349149246197761,2022-05-22,"Tô aqui perto da Arena, Teotônio Vilela??"
13,1502435750096392194,1528165469416456193,2022-05-22,Alguém afim?? https://t.co/PQsI0J9QtF
14,344495889,1528080193583300608,2022-05-21,Drinking a Gold Premium Lager by Cerveja Therezópolis at @portalcoop — https://t.co/6GsG9M1hiq
15,33932726,1528024825645518849,2022-05-21,"Acabou de publicar uma foto em Valinhos, São Paulo https://t.co/JjHJkK8jsA"
16,1356096757,1527995902207479808,2022-05-21,Atualizando 🦁🦁🦁🦁🦁🦁🦁🦁🦁 em Parque Bancario https://t.co/6cXoWuhZ8N
17,880350901,1527995363508080642,2022-05-21,@mayumiihiga A piada já vem pronta https://t.co/oAyGiE0OuT
18,318228108,1527796779378429953,2022-05-20,Acabou de publicar uma foto em Vila Tolstoi https://t.co/sH8Mj1dSqD
19,1288888019685183491,1527703246747455488,2022-05-20,📏📏 https://t.co/dToS9ygWPV
20,46138265,1527454828481466378,2022-05-20,Pra que tanta ignorância? em JR Lan House - Multi Serviços https://t.co/PJ67S9Q3oF
21,1502435750096392194,1527445330605793285,2022-05-20,Rabo apertado https://t.co/OSi9WMKi5J
