,author_id,tweet_id,created_at,text
0,3127024384,1531575054907105280,2022-05-31,causando na farmácia kkkkkk
1,1390016160918294529,1531563983055953921,2022-05-31,Foto appena pubblicata @ Lago Di Lecco https://t.co/d3QpsjwUUt
2,1132133699741454337,1531543448662298626,2022-05-31,Acabou de publicar uma foto em Click Palestrino https://t.co/GRALeptsGf
3,2965095953,1531523494734970881,2022-05-31,Acabou de publicar uma foto em Bourbon Shopping https://t.co/3cxpnSmjy0
4,1832686855,1531497861828993025,2022-05-31,Eu tenho um irmão que… 🫣 https://t.co/HEMosqIVsU
5,1103370507070726144,1531474702568398849,2022-05-31,Acabou de publicar uma foto em Selva De Pedra https://t.co/XsUZGZ4Ggj
6,207600220,1531470366480207874,2022-05-31,Trabalho e novidades... e você o que esconde? https://t.co/9CCn2gyRZ3
7,153008689,1531458869930565632,2022-05-31,"Eu tô muito feliz!
@edrenekivitz em ibab - igreja batista de água branca https://t.co/Oj24b30eZ0"
8,342815291,1531458127148769282,2022-05-31,Primeira apresentação presencial pós pandemia Covid… show!!! em Faculdade Santa Marcelina - Oficial https://t.co/jnS0QjsZPb
9,100596591,1531455237290082304,2022-05-31,"Amor e companheirismo.

... é dar ao outro a permissão de não precisar ser perfeito.

Celebração do casamento da Thays e Igor.

@thaysfernandez &amp; @igorgrohmann 

@casinhaquintal em Casinha Quintal https://t.co/LgwYMIHYTc"
10,342815291,1531453954189578240,2022-05-31,"Primeira apresentação pós pandemia!!!
Show!!! em Faculdade Santa Marcelina - Oficial https://t.co/uKzHpdTiVf"
11,1521625431639736320,1531453317100052480,2022-05-31,Por obséquio. Grato. Boa noite. https://t.co/1WL9ZM8fC8
12,249916641,1531453178268594180,2022-05-31,Drinking a Hops To Go by Croma @ Croma — https://t.co/vr5cYYffvL
13,14357628,1531440944691781633,2022-05-31,"Onça geométrica

#grafite #graffiti #urbanart #arteurbana #streetart #artederua #saopaulo #saopaulocity #terradagaroa #sp #sampacity #sampalovers #sampa #instagrafite #instastreetart #arte #art em Parque da Água Branca https://t.co/hkMdrNTupD"
14,51644295,1531435916870488064,2022-05-31,"🥳 Uma tarde deliciosa com pessoas maravilhosas que me fazem muito feliz ! Obrigado amigos, vcs são incríveis 🥳🎈 #BirthdayDoTih  desliza pra ver esses lindos, eu amo cada um ❤️ em FRÊ https://t.co/VXQYdfdEip"
15,249916641,1531433777159098368,2022-05-31,Drinking a Rebu by Trilha Cervejaria @ TRILHA Cervejaria — https://t.co/Ha8p0CD46r
16,73002111,1531432120132018179,2022-05-31,"O nosso amor não é normal, mas as nossas loucuras não fazem mal. ❤️ em Praça Marechal Deodoro (São Paulo) https://t.co/DEy8Bl1N4d"
17,249916641,1531431261209866243,2022-05-31,Drinking a Pils! by Trilha Cervejaria @ TRILHA Cervejaria — https://t.co/CjamRmDFNW
18,35331454,1531429244731015168,2022-05-31,"@cyndilauper ""The Goonies are Good Enough"", no @autobahn_anos80 , a melhor balada do mundo, com pessoas maravilhosas!
#CyndiLauper em Projeto Autobahn - de volta aos Anos 80 https://t.co/FXhFINSTa0"
19,43156886,1531421289201680386,2022-05-30,Acabou de publicar uma foto em Espaço ao Cubo https://t.co/RkHR1rsWQg
20,3292622114,1531413830651195393,2022-05-30,Acabou de publicar uma foto em Allianz Parque https://t.co/dlRpC6e5KG
21,67648961,1531413041568436225,2022-05-30,Just posted a photo @ Ct Palmeiras-Academia 1 https://t.co/aQUYtJbjAV
22,1480278191835123725,1531403198568726532,2022-05-30,☺️ https://t.co/MvwC1s3Vzv
23,829360890944315392,1531400968755109889,2022-05-30,Acabou de publicar uma foto em Dominatrix https://t.co/SHeZW9S4Iu
24,125825848,1531399212251987975,2022-05-30,como é bom conhecer minha casa https://t.co/kBSl2xHRGi
25,51581270,1531393606577160195,2022-05-30,Acabou de publicar uma foto em Marco Tattoo e Body Piercing https://t.co/bLR75YcIm0
26,44948170,1531390603329691649,2022-05-30,"Face do abandono.
#saopaulo #aporofobia em Barra Funda, Sao Paulo https://t.co/801ryfG8Qc"
27,1495837679715590145,1531383111816192006,2022-05-30,Acabou de publicar uma foto em Allianz Parque https://t.co/RfF2CGzdfV
28,848205260451696641,1531380493480087553,2022-05-30,Acabou de publicar uma foto em Ricardo Alexandre &amp; Advogados https://t.co/6HFscSJRzH
29,848205260451696641,1531380282934403072,2022-05-30,Acabou de publicar uma foto em Ricardo Alexandre &amp; Advogados https://t.co/zH6qVxUwYc
30,1530654401483923458,1531376087032274945,2022-05-30,@fbadaui Aí sim!!!
31,1121631714382503937,1531371194993221632,2022-05-30,🐈‍⬛ em Kat Klub https://t.co/nOmGb3ONJd
32,81593903,1531369451299414017,2022-05-30,"Drinking a Dude, Where’s My Magic Wand? by Hocus Pocus @ Tap Tap Perdizes — https://t.co/TDlcODiAth"
33,1492839562967760900,1531366836339613696,2022-05-30,❤️ https://t.co/YfwD9RXnux
34,2902371155,1531362064547078148,2022-05-30,"hoje eu conheci o pato donald, que é um fofo, e o pateta, que é um pateta. 

o pateta me odiou, pisou no meu pé e escondeu o símbolo do corinthians. um feio. 

conte comigo para tudo pato donald https://t.co/EXeelE9XAC"
35,1226381700168474624,1531360023040839681,2022-05-30,unthaw mah heart ❄🧊🌬 @ Freezer https://t.co/CR36JBMdRW
36,68189371,1531358348188082176,2022-05-30,"Olha, que ódio,  viu! 
O importante é que nós meus olhos ele estava em Full HD . em Espaço Unimed https://t.co/kQTLUXQp0h"
37,51810728,1531356418619604992,2022-05-30,NOBODY CAN DRAG ME DOoOoOoOoOOwN 🧩🧞‍♂️ em Espaço das Américas https://t.co/d5WcuLdfnM
38,1529406853087735808,1531355923171753986,2022-05-30,✋ula ✋ivre https://t.co/8pYToWOAFU
39,1519662321102209024,1531343914904453120,2022-05-30,https://t.co/UmppGRnK7b
40,1530654401483923458,1531337902566817794,2022-05-30,@Dra_Deolane Boa tarde doutora!!! Deus abençoe grandemente 🙏🏻🙏🏻🙏🏻
41,1687330716,1531333021441347584,2022-05-30,"Obrigada por tudo, obrigada por ser o maior amor da minha vida e me proporcionar tamanha felicidade. Obrigada por ser tão maravilhoso, atencioso, cuidadoso, você é o brilho que faltava na minha vida! @Louis_Tomlinson te amo infinito e além ✨💙🇧🇷 https://t.co/WnkWKmGSEt"
42,1183280252325453824,1531331237679276033,2022-05-30,"28.05.2022
#LouisTomlinsonWorldTour2022 em Espaço Unimed https://t.co/38QS5RLPht"
43,70837769,1531329976926195713,2022-05-30,Acabou de publicar uma foto em REDEVIDA de Televisão https://t.co/5Ry7HZ1Dga
44,1103370507070726144,1531324215340765185,2022-05-30,"Limpeza d'alma....

AYRSON HERÁCLITO
Yorùbáiano

#AyrsonHeraclito
#Yorubaiano
#LimpezaDalma
#Pina em Selva De Pedra https://t.co/OGNniRJexs"
45,1530654401483923458,1531324113205313540,2022-05-30,Poemas em Marte - Realidade Inversa @taygalega https://t.co/WdfdcmBMGo
46,822929250437177345,1531323599197446144,2022-05-30,Hoje o dia ta suave
47,68189371,1531321575949090819,2022-05-30,Acabou de publicar uma foto em Espaço Unimed https://t.co/MSFcdTrCui
48,1339305917158989825,1531314595163512842,2022-05-30,Oieee! 💁🏻‍♀️ a semana por aqui começou agitada. Meus meninos já estão a todo vapor dando aquela recauchutada necessária depois de um final de semana animado. 😋 então… let’s simbora. https://t.co/kbbLJc32zg
49,21189671,1531310679960993794,2022-05-30,"Olá, internautas. em Parque da Água Branca https://t.co/SkdNtlFgM6"
50,1053315827481698310,1531303571081289733,2022-05-30,"Nosso BODY RICOK  é uma peça super versátil que vc pode montar vários looks alem de usar na sua intimidade pq fica super sexy e ela vira jock ou fio dental duas peças em uma 🤷🏻‍♂️✅
.
#bodyricok #body #ricokcouture https://t.co/VlYd3u7agR"
51,70837769,1531302405412769792,2022-05-30,Acabou de publicar uma foto em REDEVIDA de Televisão https://t.co/jQjsNrUE4w
52,51421519,1531301261122977793,2022-05-30,Acabou de publicar uma foto em Higienópolis (bairro de São Paulo) https://t.co/xCy42dR0Lb
53,848205260451696641,1531300254183718913,2022-05-30,Acabou de publicar uma foto em Ricardo Alexandre &amp; Advogados https://t.co/JKRCY94gRj
54,848205260451696641,1531300013363679232,2022-05-30,Acabou de publicar uma foto em Ricardo Alexandre &amp; Advogados https://t.co/AC16vo8IuY
55,290737036,1531291294949048320,2022-05-30,"Melhor dia da minha vida 🏳️‍🌈💙 @Louis_Tomlinson te amo

o chão podre 🇧🇷 https://t.co/qbmU0vXD4p"
56,11351602,1531287990063988741,2022-05-30,Just posted a photo @ Santa Cecília /Higienópolis/República/Vila Buarque https://t.co/QqFExIQv4A
57,1058570406175694848,1531286766929453058,2022-05-30,Ainda rindo com amor desse bolo! 🥰🎂 https://t.co/b2B24L4yUR
58,70837769,1531284537103093760,2022-05-30,Acabou de publicar uma foto em REDEVIDA de Televisão https://t.co/teg1bEOecK
59,51581270,1531281456722350081,2022-05-30,Acabou de publicar uma foto em Marco Tattoo e Body Piercing https://t.co/nbsgTyNqtX
60,51810728,1531276664172421122,2022-05-30,Acabou de publicar uma foto em Espaço das Américas https://t.co/oGoSWsVZJs
61,64550233,1531276095756066816,2022-05-30,Estamos abertíssimos!! em Santa Cecília https://t.co/Y3IpRz4GvU
62,776422210630250496,1531276054203088896,2022-05-30,"Aquele bom dia diferenciado, com essa vista de SP. https://t.co/FvXIlOtftF"
63,1518606114597871617,1531275429985800193,2022-05-30,Saudar o sol 🌞 https://t.co/dkFVlbBT9G
64,1361821886104092682,1531274135665524736,2022-05-30,🇧🇷 Nossa FAAP em 3D no GPS do carro… coisa da  #tecnologia ✔️ @nafaap @antigosalunosfaap @faapbhub em FAAP - Fundação Armando Alvares Penteado https://t.co/bH54Sp4z07
65,1462057532348944388,1531265460192387072,2022-05-30,"Acabou de publicar uma foto em Avenida Pacaembu, São Paulo, Brasil https://t.co/FZAjpcYVOF"
66,36764360,1531247193084121088,2022-05-30,Acabou de publicar uma foto em Hemocentro Santa Casa https://t.co/G5kSRBxdbB
67,36764360,1531244452563632129,2022-05-30,"Subiram os balões pra comemorar meu aniversário, mas quem ganhará o presente serão pelo menos 4 pessoas que irão receber este sangue.
Os bancos de sangue estão cada vez mais escassos, então para que mais pessoas possam comemorar mais aniversários: 
Doe Sangue, Salve Vidas https://t.co/T9rTOB5YIA"
68,305758981,1531241234731126784,2022-05-30,"📷🚶🚶

.
.
#spmano #splovers #vscon #urbanart #spdagaroa #ig_brail #ig_saopaulo #city #sponeway #olharesdesampa #art em Minhocão https://t.co/tUwVvmKDxS"
69,35291115,1531235673323208704,2022-05-30,Animado eu não estou... Mas vim!!!
70,51810728,1531228700624277505,2022-05-30,Every broken heart as far as your eye can see is a copy of a copy of a copy ❤️‍🔥 em Espaço das Américas https://t.co/P5iAcyjr0A
71,3990209381,1531227902712467458,2022-05-30,https://t.co/yLqH02Cmby
72,934879761956065281,1531227226699616257,2022-05-30,"A melhor torcida do mundo @torcidamv83 passou por aqui , banco de sangue da Santa Casa 🩸 https://t.co/YRvmtKzdl6"
73,848205260451696641,1531224644140908548,2022-05-30,Acabou de publicar uma foto em Ricardo Alexandre &amp; Advogados https://t.co/JtHj012xiP
74,848205260451696641,1531224142468587521,2022-05-30,Acabou de publicar uma foto em Ricardo Alexandre &amp; Advogados https://t.co/Tqmygr1pAT
75,55970374,1531224133962440704,2022-05-30,Acabou de publicar uma foto em Higienópolis (bairro de São Paulo) https://t.co/fGvjjVqGJ9
76,3291424611,1531212896080109568,2022-05-30,Uma satisfação imensa louvar ao Senhor e aprender mais dele com esses elevados senhores e senhoritas. Certamente sou imensamente honrado pela vida de vocês! https://t.co/MCO6tkK2Ez
77,39936067,1531116895075803137,2022-05-30,Mais dessa tarde linda !! em Allianz Parque https://t.co/hV27a6Xa6M
78,39936067,1531116557371379715,2022-05-30,Acabou de publicar uma foto em Nagairô Sushi https://t.co/RCyZStQTkD
79,78632358,1531116363485483008,2022-05-30,"Primeiro choque de gerações em casa: Martín querendo saber quem eram os personagens da minha camiseta....

Ps. Teremos uma semana Grafooreia em casa (ok, vou pular ""Colégio Interno"")... em Perdizes, São Paulo, Brasil https://t.co/UFBaHUgjtl"
80,790449313,1531100384944607232,2022-05-30,"@eladaninha Aqui teremos 6. Até meu neto tequila é lula . Mas contanto com a família , acho que uns 25 https://t.co/oifPlJRhgr"
81,1530654401483923458,1531100362752643072,2022-05-30,@chinaina @pamellagachido @coligadigital @OEIBrasil Como funciona? Posso participar? Ajudar de alguma forma?
82,1463385409338023941,1531097651080568832,2022-05-30,primeira cerimônia que acompanho com voz e piano. muito feliz :) #vozepiano #casamento https://t.co/vjuGBjsSkS
83,227921988,1531094128674603008,2022-05-30,"Nosso Sobrado, nosso PALMEIRAS https://t.co/6nw9UBK9SC"
84,107866461,1531094109875838976,2022-05-30,"Tchau 👋 irmã 
Obrigada pela visita 
Volte sempre em Barra Funda, Sao Paulo https://t.co/1KKRyh4SWS"
85,1301041602,1531092223688941571,2022-05-30,"o melhor não é só o show do louis, o fandom inteiro é maravilhoso ❤️ 
eu me senti numa família na fila, todo mundo super atenciosa e fofas umas com as outras, a vibe das pessoas, as amizades que eu fiz, eu me sentia tão bem o tempo todo 
até o ceu ficou feliz (28.05.22) https://t.co/FMACd1gx3y"
86,1107437488279379968,1531084849762643972,2022-05-30,Just posted a photo @ Espaço Unimed https://t.co/CDkOcR8jXr
87,1288161986396725248,1531083656370036737,2022-05-30,"Obg louis, foi incrível!! Eu te amo. https://t.co/F8GYKZ0yBH"
88,53179056,1531081363427692545,2022-05-30,Acabou de publicar uma foto em Allianz Parque https://t.co/GRHLrKPG08
89,626237487,1531079779796910081,2022-05-30,Dia de solzinho ☀️🍃 em Parque Augusta https://t.co/P9Kv3waYhG
90,1530654401483923458,1531078683775180803,2022-05-30,@oserginho Oi Serginho! Beleza? Conheça o Poemas em Marte!! Obrigado 🤝🏻 https://t.co/Tmf0DrNbqO
91,111400798,1531077298006409224,2022-05-30,"é isso gente, oficialmente acabou! 3/3 completo dele aqui no Brasil, sem palavras, só agradecer por tudo que aconteceu esses dias! 🥺💗 @Louis_Tomlinson #LouisTomlinsonWorldTour2022 #LTWTSaoPaulo https://t.co/vlFkHgkQXc"
92,58759505,1531076798125064192,2022-05-30,"Obrigado Senhor!
Obrigado Simone e Marcela.
Obrigado IBAB Criança.🥰 em ibab - igreja batista de água branca https://t.co/ApOkLXMjIC"
93,1264351463326789634,1531074918850482183,2022-05-30,@Louis_Tomlinson no Brasil que lindo esse coral https://t.co/9D1TNv5YtY
94,1681894717,1531073944803057664,2022-05-30,Locação de geradores Casa das Caldeiras Evento Avell Computadores #casadascaldeiras em Casa das Caldeiras https://t.co/gEIPqdaFd1
95,166634136,1531072367035879426,2022-05-30,"Tem que gostar muito...Vai Corinthians!!!
Sofrendo sempre... em Fatiado Discos e Cervejas Especiais https://t.co/BFZ63sh6JV"
96,427074908,1531072194834579457,2022-05-30,#VCTBR https://t.co/wWQN9SYadD
97,1267645293761368067,1531067686310002688,2022-05-30,Veja como é o Santos e freguês desde a era do Pelé 😂💚🇳🇬 #Palmeiras https://t.co/sDMrD9WQ5q
98,119103924,1531067639807844354,2022-05-30,"Ontem final da Champions e encontro do peladinha, tive o prazer de conhecer o @principevidane , que tem sido minha companhia toda quinta feira desde 2015. Tamo junto príncipe e continue fazendo esse trabalho foda 🤘🏼🤙🏼 https://t.co/FaQb3G4PRp"
99,843616776,1531065483298017282,2022-05-30,Fim de domingo 😋 https://t.co/xiqgv9lTmr
100,1472395025166352391,1531064698271154176,2022-05-30,O LOUIS É MUITO MARAVILHOSO 💙💙💙 https://t.co/mFqKKnb6kN
101,76257183,1531060396546633728,2022-05-29,Amo tanto!!! 😍😘❤️ #MyFriends #AmoTanto #DeOntem em Bella Augusta Bar e Restaurante https://t.co/oNjrF5iKdV
102,22248152,1531056143736397829,2022-05-29,Acabou de publicar uma foto em RecordTV São Paulo https://t.co/Kri5ze8h2d
103,41614620,1531055452695453698,2022-05-29,only for the brave #ltwt @ Espaço Unimed https://t.co/XlFuYwBIUn
104,47107831,1531054637058379777,2022-05-29,Acabou de publicar uma foto em Teatro Viradalata https://t.co/D2yqU0N49g
105,3634982781,1531051300409966592,2022-05-29,De ontem com a melhor amiga @oli_ci ♥️ https://t.co/ek8reF2JEE
106,230378182,1531049588391432192,2022-05-29,"Na nossa casa do jeitinho que a gente gosta 💚🐷

📸 @rebecareisfoto | @staff_images_woman @ Allianz Parque https://t.co/dE4kQWfvry"
107,3291345878,1531048242049327105,2022-05-29,Acabou de publicar uma foto em AutoAba Acessorios Especialistas em Acessórios https://t.co/vlK5ExIwIe
108,86360922,1531043744371421188,2022-05-29,"World Tour Louis Tomlinson
Abertura: Banda Sun Room
Porque se ela está feliz eu estou muito feliz.. em Espaço Unimed https://t.co/TaCRqILpSr"
109,47107831,1531031843180810240,2022-05-29,Só na espera… vamos começar @ojoaovitormelo !! em Teatro Viradalata https://t.co/bk39jXQNEB
110,1317688433448570880,1531030968953348096,2022-05-29,LUISA SEU CARTÃO FOI ENCONTRADO!!!!!!!!!!! https://t.co/vTvqzHbHp8
111,47107831,1531030806361251840,2022-05-29,Ansioso pelo espetáculo do @ojoaovitormelo 🤩🤩 em Teatro Viradalata https://t.co/fSQxw8mMd5
112,44408875,1531029810180509699,2022-05-29,May I use this dress everyday? 💚 em Pompéia https://t.co/kLGOBjxlBt
113,1452476314569564162,1531029584019349505,2022-05-29,gostaram do look beninas? https://t.co/93sm16wmp1
114,1157005495808471040,1531024832451821569,2022-05-29,"Domingo, dois jogos duas vitórias 🚀 AVANTI 💚 https://t.co/WkdBTTsNpv"
115,47107831,1531024392779665409,2022-05-29,Acabou de publicar uma foto em Teatro Viradalata https://t.co/HFBl5WOubx
116,64550233,1531022603925737475,2022-05-29,Estamos abertíssimos em Japan Tower https://t.co/W8Y9QmzPgJ
117,47107831,1531021430401409024,2022-05-29,"1ª vez no teatro 🎭 
Prestigiando o “amigo” @ojoaovitormelo !! em Teatro Viradalata https://t.co/2Vdi2dE0LV"
118,36786658,1531020795543269382,2022-05-29,I can't take my eyes off of you https://t.co/06qHVtm65z
119,1157005495808471040,1531019362936709125,2022-05-29,"Por do sol no Xixo + 3 ✅🐷 
FESTA LINDA 🚀 https://t.co/tu24gyRmDq"
120,209685597,1531016758680862720,2022-05-29,Acabou de publicar uma foto em Capitão Barley Cervejas Especiais https://t.co/YL53H3DnM1
121,1452476314569564162,1531015517879902208,2022-05-29,Tietando https://t.co/wY1smmYeYw
122,1521625431639736320,1531014823999307777,2022-05-29,Se tivesse uma gafieira eu teria a roupa 😅👒🇵🇦 https://t.co/3a0Mswy0f9
123,22248152,1531013738769395713,2022-05-29,Acabou de publicar uma foto em RecordTV São Paulo https://t.co/EaEUr2NxY4
124,488580912,1531008976648818688,2022-05-29,❤️‍🔥 em Vila Madalena https://t.co/qQWc2RhbPh
125,96413099,1531006566912217088,2022-05-29,"I'm at Espaço das Américas - @speventos for Louis Tomlinson in São Paulo, SP https://t.co/TEL3i2y0qW"
126,2777309558,1531006497714589706,2022-05-29,1️⃣9️⃣🐷 @car9l_ #AvantiPalestrinas 🐷💚 https://t.co/MZn05ufSws
127,166634136,1531006031479947264,2022-05-29,"Das 14 até quase meia noite daquele jeito...
Pra cima deles! em Fatiado Discos e Cervejas Especiais https://t.co/yZxsh0mpd2"
128,1521625431639736320,1531005219030564864,2022-05-29,#ProtejamOsAnimais https://t.co/P4EZRwEvQG
129,1463438926232887299,1531003253479055361,2022-05-29,Uma terapia https://t.co/S903BjN391
130,55970374,1530999197360607236,2022-05-29,Acabou de publicar uma foto em Santa Cecília https://t.co/MXhXCdS3CK
131,2777309558,1530997093434793985,2022-05-29,"Apenas 2 torcedores do melhor time te olhando! @oti_ 
#AvantiPalestrinas 🐷💚 @Palmeiras_FEM https://t.co/e9IFkg2YMq"
132,23216247,1530996674671280128,2022-05-29,5–0! e semana que vem tem derby! bora lotar o allianz! https://t.co/RVPVPnGwVW
133,209685597,1530995275308879873,2022-05-29,Acabou de publicar uma foto em Capitão Barley Cervejas Especiais https://t.co/fTvnXV3jGl
134,1321152828153466883,1530995222544535552,2022-05-29,"AINDA NÃO ACREDITO QUE VI ELE ONTEM 🥺🇧🇷 

#LouisTomlinsonWorldTour2022 https://t.co/Ogh16yQQyq"
135,907308025777713156,1530995012762312704,2022-05-29,Será que gostou??? em Teatro Opus https://t.co/WGi6A7Rxy3
136,3292622114,1530986822817423360,2022-05-29,Acabou de publicar uma foto em Allianz Parque https://t.co/3eiK9ksUMI
137,3033714922,1530985214331215872,2022-05-29,"Jogo mais importante de Marcelo Lomba até agora na SEP.

Que todos os Santos o abençoem. https://t.co/CnXpoWjYbp"
138,3292622114,1530984864547217409,2022-05-29,"G⚽⚽⚽⚽⚽⚽⚽⚽⚽⚽⚽⚽⚽⚽⚽⚽⚽⚽⚽LLLLLLLLLLL DO PALMEIRAS 

É DA PATRÍCIA SOCHOR

SEP 5X0 SJO

#AvantiPalestrinas #PALxSJO em Allianz Parque https://t.co/diZYmUQaNV"
139,2777309558,1530984660016238592,2022-05-29,"É Bia… Agora a Sochor tá junto com você de novo na artilharia do @Palmeiras_FEM na temporada, 5 gols pra cada"
140,209685597,1530979526288609280,2022-05-29,Acabou de publicar uma foto em Garagem da Pompéia https://t.co/tyrl58lloR
141,37257701,1530977546610917378,2022-05-29,O VERDÃO VAI GOLEAR https://t.co/pNsqU12Jak
142,3292622114,1530977473948594176,2022-05-29,"G⚽⚽⚽⚽⚽⚽⚽⚽⚽⚽⚽⚽⚽⚽⚽⚽⚽⚽⚽LLLLLLLLLLL DO PALMEIRAS 

É DA BYANCA BRASIL

SEP 4X0 SJO

#AvantiPalestrinas #PALxSJO em Allianz Parque https://t.co/O2ANu2WQag"
143,2777309558,1530977314795933699,2022-05-29,Acabou de entrar e já deixou o dela! A rainha das lambretas tá on Fire hoje! Bem demais @byancabrasil09 ! https://t.co/tIFIMtgXn4
144,2777309558,1530974563487686657,2022-05-29,"Tava me esquecendo, esse vigésimo gol da @biazaneratto também colocou ela no topo da artilharia do @Palmeiras_FEM na temporada, com 5 gols"
145,1179823147496943617,1530974443962519553,2022-05-29,"Escalação definida do @palmeiras para mais um jogo do campeonato brasileiro! 

#porcolandia1914 
#brasileirao em Porcolândia 1914 - O Mundo Dos Nossos Sonhos https://t.co/hViRMyyloM"
146,209685597,1530973287706148866,2022-05-29,"@cervejataru 
Tudo sempre ótimo!
#sour maravilhosa #redale e #stout também!
Vale visitar!
.
#ruaclelia #pompeiaperdizes #vilaromana #sescpompeia #cervejaartesanal #cervejaartesanalbrasileira #fabricacaopropria https://t.co/t2ARVbNVdS"
147,51581270,1530972668870156295,2022-05-29,Acabou de publicar uma foto em Marco Tattoo e Body Piercing https://t.co/rzv3SPO0n0
148,2777309558,1530967508404031490,2022-05-29,Saiu o vigésimo! Vinte gols da @biazaneratto pelo @Palmeiras_FEM ! Que momento! https://t.co/ItTY3YnPkl https://t.co/MYuFBeqSTc
149,3292622114,1530967270947708933,2022-05-29,"G⚽⚽⚽⚽⚽⚽⚽⚽⚽⚽⚽⚽⚽⚽⚽⚽⚽⚽⚽LLLLLLLLLLL DO PALMEIRAS 

É DA BIA ZANERATTO

SEP 3X0 SJO

#AvantiPalestrinas #PALxSJO em Allianz Parque https://t.co/xkTxmCXjRA"
150,3292622114,1530966355792474112,2022-05-29,"G⚽⚽⚽⚽⚽⚽⚽⚽⚽⚽⚽⚽⚽⚽⚽⚽⚽⚽⚽LLLLLLLLLLL DO PALMEIRAS 

É DA CAROL RODRIGUES

SEP 2X0 SJO

#AvantiPalestrinas #PALxSJO em Allianz Parque https://t.co/qeWf0miHiz"
151,92010174,1530965689388900355,2022-05-29,"Palmeiras x São José, 10ª rodada do Brasileirão Feminino. Um lindo dia ensolarado na primeira vez que vejo as Palestrinas no @AllianzParque (o outro jogo foi no Canindé). A @torcidasavoia presente como sempre. https://t.co/Mc4HEoVevH"
152,477313835,1530963386250436614,2022-05-29,Mais uma tarde das palestrinas em campo @Palmeiras_FEM https://t.co/pGiytc6tEC
153,3292622114,1530960278887706625,2022-05-29,"G⚽⚽⚽⚽⚽⚽⚽⚽⚽⚽⚽⚽⚽⚽⚽⚽⚽⚽⚽LLLLLLLLLLL DO PALMEIRAS 

É DA DUDA SANTOS

SEP 1X0 SJO

#AvantiPalestrinas #PALxSJO em Allianz Parque https://t.co/psKoidmH67"
154,2777309558,1530959897952673794,2022-05-29,Golaço da melhor camisa 7 do Brasil! Vai @duda17_santos ! https://t.co/AmRISuaCHz
155,3350065960,1530955046120263682,2022-05-29,"@Palmeiras_FEM x @saojoseecfem 14h @BRFeminino 

💻 https://t.co/csmZHrH5K4 https://t.co/KROLOVB5OR"
156,22248152,1530950842945347585,2022-05-29,Acabou de publicar uma foto em RecordTV São Paulo https://t.co/L9HxTCBV4N
157,3291345878,1530950208351354881,2022-05-29,Acabou de publicar uma foto em AutoAba Acessorios Especialistas em Acessórios https://t.co/cLpq0Twdy9
158,2777309558,1530949168444887044,2022-05-29,Passando aqui pra dar sorte e o vigésimo gol sair! #HojeTemGolDaBiagol #ZanerattoDay #AvantiPalestrinas 💚🐷 https://t.co/byr1cmOt4z
159,2777309558,1530948649865420800,2022-05-29,Ficaram vários dias fazendo um baita frio em São Paulo pra no dia do jogo do Palmeiras feminino fazer um calor de desde o verão não fazia… vou derreter aqui
160,513468715,1530947383378452480,2022-05-29,Te vejo aqui daqui 102 dias 🦋💜 @DUALIPA https://t.co/A6kE1Pvzob
161,2777309558,1530944172643037186,2022-05-29,Cheguei @AllianzParque! Saudades que eu tava de ver um jogo das Palestrinas aqui… VAMOOO! #AvantiPalestrinas 🐷💚 https://t.co/BqQQjEYJ08
162,58921547,1530944153718337536,2022-05-29,Confraria realizada com sucesso mais um FDS graças lord. https://t.co/jmkIds2Rra
163,3292622114,1530942484339167233,2022-05-29,"PALESTRINAS ESCALADAS PARA O CONFRONTO DE HOJE! 🐷👊 

#AvantiPalestrinas #PALxSJO em Allianz Parque https://t.co/ezO2BiZHlc"
164,55970374,1530933356489330689,2022-05-29,Acabou de publicar uma foto em Santa Cecília https://t.co/kaBdRaa6Ss
165,2762393855,1530933080990568451,2022-05-29,Mais uma pra conta https://t.co/b3S6NPzv6n
166,1477798897829482503,1530932449903005698,2022-05-29,.@Louis_Tomlinson thank u for one of the best weekends of my life 💙 ilysm https://t.co/8e038LmFRC
167,78099686,1530932085212471297,2022-05-29,💪💪 em Minhocão https://t.co/dp3qhKLmAC
168,78099686,1530930909364510721,2022-05-29,Vai devagar mas vai …. 💪💪🏃‍♂️🏃‍♂️ em Minhocão https://t.co/LZGwF3hXX0
169,78099686,1530930691181101060,2022-05-29,Acabou de publicar uma foto em Minhocão https://t.co/e0nFcWiygg
170,78099686,1530930000932835330,2022-05-29,Tá pago a caminha de hoje 💪💪 em Minhocão https://t.co/NBMcGyqW1L
171,1530249863732023303,1530921927958835206,2022-05-29,"Ai gente, eu não aguentoo 🥺

#LouisTomlinsonWorldTour2022 #LouisTomlinson #louisbr https://t.co/Utlm1ItmpR"
