,author_id,tweet_id,created_at,text
0,55858152,1567995406084186112,2022-09-08,"昨夜（9月7日）の演奏風景。
Atividade de ontem (07/09/2022) 場所: Ramen K https://t.co/XugOsXWDhG"
1,162191550,1567979311189327872,2022-09-08,Mais foto de avião no feed ✈️ #EventoSmiles @ Gol Linhas Aereas inteligentes Headquarters https://t.co/7xfF376DXa
2,203973686,1567956055321083906,2022-09-08,I'm at Llinha 5022 Jabaquara Santa Margarida https://t.co/T3W8RUEqlf
3,203973686,1567955857052413953,2022-09-08,"I'm at Jabaquara - @sp_prefeitura in São Paulo, SP https://t.co/jlETlU66wT"
4,497367354,1567940961048891397,2022-09-08,Acabou de publicar uma foto em Vila Santo Estefano https://t.co/DhJfrPg2YD
5,1017138708,1567937639445311489,2022-09-08,"#Moovit acaba de ganhar o #NPS Award 2022 na #ABX22, na categoria #mobtech. O prêmio representa a satisfação dos usuários, o que nos deixa imensamente felizes

Agradecemos a toda equipe do Moovit, à comunidade #Mooviter e, principalmente, a todo mundo que usa o app! https://t.co/C5FHv220Wr"
6,904265844468920320,1567933964291121158,2022-09-08,Gratidão sempre meu irmão Marcos Basílio humildade pura gente da gente 🎼👊 em Moleque Travesso https://t.co/qMheQ2FhWq
7,635784580,1567921155524407296,2022-09-08,"Aí @avioesemusicas, embarcando agora pra Salvador no avião do Harry Potter... https://t.co/JYdUHqTs5d"
8,44470239,1567898207916531712,2022-09-08,#r1audiovisual em São Paulo Expo https://t.co/6ezDeydxMV
9,3005977091,1567896907413856258,2022-09-08,"Boa tarde #SaoPaulo (@ Aeroporto de São Paulo / Congonhas (CGH) in São Paulo, SP) https://t.co/9IT7LZVnbY"
10,3139886019,1567867394508443648,2022-09-08,Evento ABX22 https://t.co/wZO1qlbqLm
11,14633401,1567854954320199683,2022-09-08,De volta aos eventos presenciais! em São Paulo Expo https://t.co/9buL8djiyX
12,203973686,1567852351830069250,2022-09-08,"I'm at Estação Jabaquara (Metrô) in São Paulo, SP https://t.co/e5R0YJGmTK"
13,497367354,1567851001176006656,2022-09-08,Acabou de publicar uma foto em Vila Santo Estefano https://t.co/lQkEPgffwb
14,99162230,1567847139664961538,2022-09-08,"Embarcado com sucesso. 

Bora ir ali.

#partiu @latamairlines em Aeropuerto de Congonhas https://t.co/v2g8Dl5Myj"
15,179191729,1567846316721455104,2022-09-08,"Na bocha, conhecendo os adversários antes das provas. 🧐 https://t.co/iSlmkasMVG"
16,179191729,1567845384315195393,2022-09-08,"Na natação, atletas no aquecimento! 🏊🏻 https://t.co/V8rUtXTkip"
17,179191729,1567844896618184704,2022-09-08,"Bom dia, Paralimpíadas Escolares! 

Acorda que hoje tem campeonato. Vem torcer comigo! 😝 

No atletismo, as provas estão à todo vapor! https://t.co/eUL0q3nyyF"
18,2636196581,1567842220543188993,2022-09-08,"I'm at São Paulo Expo Exhibition &amp; Convention Center - @saopauloexpo in São Paulo, SP https://t.co/ydpPF55pm4"
19,1390931250,1567835758702264320,2022-09-08,Bíblia Verso do Dia (Eclesiastes 5:15)... - 08/09/2022 em Condominio Residencial Castelo Branco https://t.co/j0QPXMIl2X
20,1390931250,1567832991199551488,2022-09-08,Imagem do versículo do dia (Efésios 5:1 NVI)... - 08/09/2022 em Condominio Residencial Castelo Branco https://t.co/jNZFc9hTVd
21,195039517,1567832458636267522,2022-09-08,#BomDia #quintafeira #Meta #Sonho #foco #objetivo #força #determinação #empenho #resultado  #fé #realização #Sp #Brasil #Investimento em Danilo Souza - Consultor Financeiro https://t.co/998wNBOe8W
22,104813010,1567827614231822336,2022-09-08,Just another day in paradise 😁 https://t.co/kr3LMJgKIT
23,736680582822907904,1567798478067171329,2022-09-08,"Uma ótima quinta-feira a todos! #bomdia🌞 #quintafeira em Vila Guarani, Zona Sul - Sp https://t.co/9o7eeizKNO"
24,736680582822907904,1567797343830802433,2022-09-08,"Uma quinta-feira abençoada a todos! #bomdia #quintafeira em Vila Guarani, Zona Sul - Sp https://t.co/V3k7v2hYgv"
25,41267822,1567683085956775938,2022-09-08,Acabou de publicar uma foto em Plaza Sul Shopping https://t.co/0jCRVfm0AA
26,736680582822907904,1567672884335722499,2022-09-08,"Uma ótima noite de quarta-feira a todos! #boanoite #quintafeira #deusefiel em Vila Guarani, Zona Sul - Sp https://t.co/TeSPYzb2eD"
27,736680582822907904,1567668157426573313,2022-09-08,"Uma noite abençoada a todos! #boanoite🌙 #quintafeira #deusnocomando em Vila Guarani, Zona Sul - Sp https://t.co/684SAmXs4m"
28,1567643638305366016,1567645133310509056,2022-09-07,Olha minha princesa bacci o nome dela é Maddona https://t.co/ea33ZDHDvJ
29,1372686793162776577,1567628478563893249,2022-09-07,@Diegor_Barros @putariaon01 @travestis_Sp_Zs @Skokka_BR @Vivalocal  @cameraprive Segui lá Amores ❤ https://t.co/RXj2wKwBW0
30,1303344888109555712,1567624630906634246,2022-09-07,🔵 Vamos de ponte área com a #Azul? Dia de #voar no #Embraer E195 de São Paulo para o Rio no espaço Azul! Link na bio. ✈️ São Paulo (#CGH) to Rio (#SDU) onboard Azul’s Embraer #E195. Link in bio. https://t.co/gcHaAjsZ9S #Avgeek #Aviation https://t.co/pmHSKYwUlN
31,117569261,1567604204197273607,2022-09-07,Acabou de publicar uma foto em Mecânica hidráulica de cadeiras de cabelereiro https://t.co/Ogoq7PpmWr
32,106774618,1567603815016239106,2022-09-07,"I'm at Latitude Workspaces in São Paulo, SP https://t.co/l16IW3pvDe"
33,106774618,1567588505546625030,2022-09-07,"I'm at Aeroporto de São Paulo / Congonhas in São Paulo, SP https://t.co/RwBbHfGfM3"
34,83681351,1567570233132548097,2022-09-07,"Acabou de publicar uma foto em Tatit, Grande &amp; Macedo Leme Sociedade de Advogados https://t.co/mD34FeIhz9"
35,83681351,1567569717384155136,2022-09-07,"Acabou de publicar uma foto em Tatit, Grande &amp; Macedo Leme Sociedade de Advogados https://t.co/GD3TI1cJUP"
36,44470239,1567552128146673665,2022-09-07,R1 Audiovisual em São Paulo Expo https://t.co/9cOXUnD2zl
37,316072613,1567551993752715265,2022-09-07,"Acabou de publicar uma foto em Espaço das Americas, Sao Paulo https://t.co/b3zUGVX59W"
38,3352644125,1567545582389960708,2022-09-07,Acabou de publicar uma foto em Zona Sul de São Paulo https://t.co/6rcuAc6Ajl
39,203973686,1567545500152258562,2022-09-07,"I'm at Terminal Metropolitano Jabaquara (EMTU) in São Paulo, SP https://t.co/I0WJzDDU1o"
40,203973686,1567533072647602177,2022-09-07,"I'm at Jabaquara - @sp_prefeitura in São Paulo, SP https://t.co/ZmQXqnwKrX"
41,203973686,1567532868494131200,2022-09-07,"I'm at Estação Jabaquara (Metrô) in São Paulo, SP https://t.co/cQxvR2QFjP"
42,37676691,1567524083570544641,2022-09-07,"Bora dar um pulinho em Tambaba - PB 
IX ENNN e 13° Surf Nu em Aeroporto De Congonhas, São Paulo - SP https://t.co/svz856Ucxt"
43,778002775581962241,1567522103087316994,2022-09-07,Depois de 15 horas de viagem + jet lag. Pra mim o melhor remédio é treinar ainda mais com o paizão junto❤️. Já cheguei tocando o terror no Deadlift. @ Circulo Militar - Pq Ibirapuera https://t.co/zm1L1KHGjX
44,904265844468920320,1567516996287217664,2022-09-07,Acabou de publicar uma foto em Moleque Travesso https://t.co/feMEMwjZNc
45,1439439505061203972,1567515279860678656,2022-09-07,Cheguei São Paulo 😌
46,89255134,1567514606217617409,2022-09-07,"Bom dia ☕

Ontem o Programa VIVIANE VIDMAR pela TV CINEC foi um sucesso!!! Muito obrigada às convidadas, aos patrocinadores e todos vocês  pelo carinho! Gratidão! ❤🙏 em Tv Cinec https://t.co/181ou0zfh9"
47,1390931250,1567501717704507392,2022-09-07,Bíblia Verso do Dia (Salmo 130:5)... - 07/09/2022 em Condominio Residencial Castelo Branco https://t.co/ajwar9wCM7
48,52058931,1567488084857561088,2022-09-07,"✈️ Já estou pronto e preparado pra partir a Bahia de todos os Santos… e a Bahia já está em Festa, porque o seu Santo preferido está chegando no próximo voo 🙏🌴✈️🇧🇷🔥🍀🎯👍 https://t.co/cE4zB24sWY"
49,1390931250,1567481637524443142,2022-09-07,Imagem do versículo do dia (Romanos 10:9 NVI)... - 07/09/2022 em Condominio Residencial Castelo Branco https://t.co/dDIfk8LaNe
50,497367354,1567481070165131266,2022-09-07,Acabou de publicar uma foto em Vila Santo Estefano https://t.co/XHR0xn9o0v
51,2151841804,1567455474089435137,2022-09-07,"I'm at Aeroporto de São Paulo / Congonhas in São Paulo, SP https://t.co/0LCHdIMNc7"
52,68251300,1567441896485560322,2022-09-07,"Bom dia, Essepê. Comemorando a Independência bem verde e amarelo 💞 
#BDSP @rodrigobocardi @sabinasimonato_ https://t.co/2VvmiEex8b"
53,68251300,1567441405047459842,2022-09-07,"Bom dia, Essepê. Comemorando a Independência bem verde e amarelo 💞 
#BDSP @rodrigobocardi @sabinasimonato_ https://t.co/KWW6sq2sOp"
54,68251300,1567441169738522627,2022-09-07,"Bom dia, Essepê. Comemorando a Independência bem verde e amarelo 💞 
#BDSP @rodrigobocardi @sabinasimonato_ https://t.co/ipGhdc2BUv"
55,68251300,1567440837050499072,2022-09-07,"Bom dia, Essepê. Comemorando a Independência bem verde e amarelo 💞 
#BDSP @rodrigobocardi @sabinasimonato_ https://t.co/WesvLc9F7b"
56,774469015,1567435184156610560,2022-09-07,Acabou de publicar uma foto em Sao Paulo Capital https://t.co/KMiGDX0HVj
57,49370468,1567428464420032512,2022-09-07,"I'm at Aeroporto de São Paulo / Congonhas in São Paulo, SP https://t.co/ar0ulkW2hz"
58,1558428703494914048,1567424242811011075,2022-09-07,@Lucas__CAP Voltando classificado pra casa! ✈️🔴⚫️🌪🙏🏻 https://t.co/FRo9Dky352
59,1558428703494914048,1567396033193189376,2022-09-07,https://t.co/wO07la49rU
60,904265844468920320,1567349195857698816,2022-09-07,Acabou de publicar uma foto em Arnaldo Faria de Sá https://t.co/76PC4dhDwJ
61,2251138838,1567322309861732352,2022-09-07,Acabou de publicar uma foto em São Paulo Expo https://t.co/2zdRBwNkPa
62,203973686,1567280858616266753,2022-09-06,"I'm at Jabaquara - @sp_prefeitura in São Paulo, SP https://t.co/qDrKw4MKp5"
63,203973686,1567280305836376064,2022-09-06,"I'm at Terminal Metropolitano Jabaquara (EMTU) in São Paulo, SP https://t.co/LFVcuXLxcV"
64,497367354,1567272951199694848,2022-09-06,Acabou de publicar uma foto em Vila Santo Estefano https://t.co/HtIb2AW9cB
65,41286470,1567241746974736392,2022-09-06,"I'm at Ford Caoa in São Paulo, SP https://t.co/9lPzrqmqHW"
66,115055242,1567199321522593801,2022-09-06,"Amanhã, venha lindamente 4.0! 
#GratidãoSenhor https://t.co/eQJXvBCtWE"
67,1344528424442994688,1567197469800292359,2022-09-06,Acabou de publicar uma foto em Jabaquara https://t.co/k4TtJYlgnA
68,2170052662,1567184140105129984,2022-09-06,Acabou de publicar uma foto em Sao Paulo Capital https://t.co/mvoLBC2EGu
69,22197767,1567176401001783301,2022-09-06,"I'm at Vet Quality in São Paulo, SP https://t.co/APE29joaNw"
70,749451860092878848,1567164615393525764,2022-09-06,De volta para minha terra https://t.co/NTdYrUAeXf
71,832608640087498753,1567152911632703490,2022-09-06,Cheguei. Amanhã Av. Paulista
72,141783919,1567136028305289217,2022-09-06,"Job na área da beleza com @oficialadcos @adcosprofissional 

#job #jobs #eventos #evento #beleza #estetica #adcos #adcosprofissional #expo #saopauloexpo #cosmeticos #modelos #influencerdigital #influencers #influencer https://t.co/aBzdW5WL3R"
73,1390931250,1567122802615918592,2022-09-06,Bíblia Verso do Dia (Lucas 6:30)... - 06/09/2022 em Condominio Residencial Castelo Branco https://t.co/gsp8vsexxr
74,1390931250,1567119484305154048,2022-09-06,Imagem do versículo do dia (Salmo 119:11 NVI)... - 06/09/2022 em Condominio Residencial Castelo Branco https://t.co/FvrlpfSd2x
75,37512033,1567117765596651520,2022-09-06,"Largada no Shimano Short Track 2022

#shimanoshorttrack #shimanofest #shimanobrasil #andremeloracing #mtb #xcc em Memorial da América Latina, São Paulo https://t.co/NSaxdW7hlq"
76,141055108,1567112130582683653,2022-09-06,"Rock in rio estamos chegando!!!!
@crissakura https://t.co/waT69Ngw0r"
77,89255134,1567105636931887111,2022-09-06,Acabou de publicar uma foto em Tv Cinec https://t.co/237ziPBKzZ
78,203973686,1567100228938891264,2022-09-06,"I'm at Estação Jabaquara (Metrô) in São Paulo, SP https://t.co/xM43iE8jiV"
79,203973686,1567099997577003008,2022-09-06,"I'm at Jabaquara - @sp_prefeitura in São Paulo, SP https://t.co/yBvuRO1erT"
80,203973686,1567099815489667072,2022-09-06,"I'm at Padaria Trevo in São Paulo, SP https://t.co/iFpD7Buk08"
81,195039517,1567094732353855489,2022-09-06,Acabou de publicar uma foto em Danilo Souza - Consultor Financeiro https://t.co/4LUGUknNJR
82,736680582822907904,1567076337025785857,2022-09-06,"Uma terça-feira abençoada a todos! #bomdia #tercafeira #gracasadeus em Vila Guarani, Zona Sul - Sp https://t.co/CDzGizU4xu"
83,736680582822907904,1567073070958911488,2022-09-06,"Uma terça-feira abençoada a todos! #bomdia🌞 #tercafeira #diaabençoado em Vila Guarani, Zona Sul - Sp https://t.co/HVpm8Z03da"
84,172466232,1567066536296480768,2022-09-06,"Bom dia ! 
Estou de olho ,só de speedy go 🤞 👁👁 em Zona Sul de São Paulo https://t.co/hv2NgoAkKG"
85,919008620,1567055591461326848,2022-09-06,tô chegando RIO 🤟🏻 https://t.co/tcp6suUUFL
86,736680582822907904,1566944570750943234,2022-09-06,"Uma ótima noite a todos! #boanoite #tercafeira em Vila Guarani, Zona Sul - Sp https://t.co/zKtv8Y6RH5"
87,736680582822907904,1566943248299528192,2022-09-06,"Uma noite abençoada pra todos! #boanoite🌙 #tercafeira em Vila Guarani, Zona Sul - Sp https://t.co/Bsxj6B9BZe"
88,153639579,1566909830270443521,2022-09-05,Acaba de publicar una foto en Sao Paulo Capital https://t.co/yIw3f5gyOO
89,203973686,1566869322596769792,2022-09-05,"I'm at Jabaquara - @sp_prefeitura in São Paulo, SP https://t.co/V4qw7hLBXf"
90,203973686,1566869067247525890,2022-09-05,"I'm at Jabaquara/Diadema - Trólebus 290 in São Paulo, SP https://t.co/S3GwaMqJa3"
91,203973686,1566868865463754752,2022-09-05,"I'm at Terminal Metropolitano Jabaquara (EMTU) in São Paulo, SP https://t.co/P6FpNuixCk"
92,203973686,1566866818853109760,2022-09-05,"I'm at Estação Jabaquara (Metrô) in São Paulo, SP https://t.co/cGzEF12KOe"
93,172466232,1566859416686706688,2022-09-05,Gratidão!! kolofe meu Babálawo @paifabiodeoxossi 🏹💚💚asé ohh 👐🙌🧎‍♂️ em Zona Sul de São Paulo https://t.co/5HlFrwroDQ
94,340611708,1566835532231225344,2022-09-05,Acabou de publicar uma foto em Ehab Gadalla - Escola de Dança https://t.co/mQMqvJj262
95,1435191416775393286,1566818229204426754,2022-09-05,"ST Burger Stackhouse
Av mascote 151 - Jabaquara
Burger Vegetariano com falafel.
#burguer #falafel #stackhouse #chef #gastronomía #ifoodbrasil em VILA MASCOTE https://t.co/VqMMEF3exz"
96,1565382569130090497,1566800961401659394,2022-09-05,Meu primeiro tweet é sobre minha primeira viagem de avião. Já foram tantas emoções hoje... #CBFV2022 estou chegando. https://t.co/ULise2agpY
97,2379457845,1566790221198417920,2022-09-05,Oportunidade de negócio. em Campo Belo (district of São Paulo) https://t.co/tPS9etVedI
98,904265844468920320,1566783221370691586,2022-09-05,Acabou de publicar uma foto em Vila Guarani - Jabaquara https://t.co/k1A8g6pu9x
99,904265844468920320,1566782473324744704,2022-09-05,Acabou de publicar uma foto em Arnaldo Faria de Sá https://t.co/5rmeUPtNTA
100,904265844468920320,1566782188351361026,2022-09-05,Acabou de publicar uma foto em Arnaldo Faria de Sá https://t.co/DGC4vG8gzH
101,1390931250,1566779198890717184,2022-09-05,Bíblia Verso do Dia (Romanos 5:5)... - 05/09/2022 em Condominio Residencial Castelo Branco https://t.co/OuX58POlOE
102,1390931250,1566775227081957377,2022-09-05,Imagem do versículo do dia (Mateus 11:28-29 NVI)... - 05/09/2022 em Condominio Residencial Castelo Branco https://t.co/cyLeyOHpu9
103,42468986,1566763785150513152,2022-09-05,Bom dia mêo! https://t.co/7dpAFKpQDp
104,51538765,1566762351457697794,2022-09-05,Acabou de publicar uma foto em Reatech https://t.co/x8c6LEBGUD
105,41286470,1566753418244497408,2022-09-05,"I'm at Ford Caoa in São Paulo, SP https://t.co/NZzZDRofdp"
106,35962917,1566751831652450306,2022-09-05,"I'm at Aeroporto de São Paulo / Congonhas in São Paulo, SP https://t.co/u9Ptmm4wAx"
107,115055242,1566730886267244548,2022-09-05,Molequinhazinhaaaaaaa https://t.co/da5BJrZaQH
108,291869927,1566713464160133124,2022-09-05,Encontro De Grandes Feras na @reatechbrasil em São Paulo EXPO https://t.co/B1AHSy50ef
109,203973686,1566574361322131456,2022-09-04,"I'm at Jabaquara - @sp_prefeitura in São Paulo, SP https://t.co/vLCKOCHqbd"
110,2149499377,1566569624765976577,2022-09-04,Acabou de publicar uma foto em São Paulo Expo https://t.co/dXffTNoOCd
111,203973686,1566554286066225152,2022-09-04,I'm at Trólebus 288 - Jabaquara/Ferrazópolis in São Paulo https://t.co/zC8yEQfO7L
112,203973686,1566554068775993345,2022-09-04,"I'm at Terminal Metropolitano Jabaquara (EMTU) in São Paulo, SP https://t.co/sBkBffWRuy"
113,904265844468920320,1566536581866987520,2022-09-04,Acabou de publicar uma foto em Arnaldo Faria de Sá https://t.co/0gPhl2maGK
114,1290049409993117696,1566522575638958081,2022-09-04,"É impossível qualquer instituição desfazer todos os abusos e ilegalidades cometidas por ministros do STF, que esgarçaram nossa lei e ordem. Tudo é pastoso e incerto e o estrago já é grande demais. É preciso refundar o Brasil urgentemente. Que o 7 de setembro seja este começo!🇧🇷"
115,2342241168,1566515073820016642,2022-09-04,Acabou de publicar uma foto em Igreja De Cristo do MetrôSul https://t.co/ykQPAhD1Ge
116,203973686,1566483514480119809,2022-09-04,"I'm at São Paulo Expo - @saopauloexpo in São Paulo, SP https://t.co/jziQ94G1Vp"
117,904265844468920320,1566482542517166081,2022-09-04,Acabou de publicar uma foto em Praça São Paulo https://t.co/qxTe9sUjbm
118,904265844468920320,1566476412223102976,2022-09-04,Acabou de publicar uma foto em Praça São Paulo https://t.co/27RZCMQtLf
119,203973686,1566464706470084609,2022-09-04,"I'm at Pão de Açúcar - @paodeacucar in São Paulo, SP https://t.co/2pTWMMVzaD"
120,904265844468920320,1566462606147297281,2022-09-04,"DEPUTADO ESTADUAL FÁBIO FARIA DE SÁ 1️⃣9️⃣2️⃣5️⃣2️⃣👊
DEPUTADO FEDERAL ANTÔNIO CARLOS RODRIGUES 2️⃣2️⃣1️⃣1️⃣💡 em Vila Guarani - Jabaquara https://t.co/8VvnePfCP5"
121,203973686,1566459585988280321,2022-09-04,"I'm at Creche Tiãozinho in São Paulo, SP https://t.co/6iEWTOLCuI"
122,203973686,1566459208459030530,2022-09-04,"I'm at Jabaquara - @sp_prefeitura in São Paulo, SP https://t.co/yuwbgS943z"
123,203973686,1566459033992798209,2022-09-04,"I'm at Estação Jabaquara (Metrô) in São Paulo, SP https://t.co/679uZ2hTtZ"
124,1209651130755620866,1566450242052030466,2022-09-04,Acabou de publicar uma foto em Sao Paulo Capital https://t.co/dlxYVarHA0
125,497367354,1566408041813114880,2022-09-04,Acabou de publicar uma foto em Vila Santo Estefano https://t.co/HXYNQWCYWk
126,1390931250,1566383351438934016,2022-09-04,Bíblia Verso do Dia (Provérbios 4:7)... - 04/09/2022 em Condominio Residencial Castelo Branco https://t.co/W84SGFiUyN
127,1390931250,1566381426815156224,2022-09-04,Imagem do versículo do dia (Salmo 100:2 NVI)... - 04/09/2022 em Condominio Residencial Castelo Branco https://t.co/5wlc6ysGSs
128,736680582822907904,1566349288678227968,2022-09-04,"Um ótimo domingo a todos! #bomdia🌞 #domingo #gracasadeus em Vila Guarani, Zona Sul - Sp https://t.co/2BJ3KnbqGV"
129,736680582822907904,1566346650884472842,2022-09-04,"Um domingo abençoado a todos! #bomdia #domingo #deusnocomando em Vila Guarani, Zona Sul - Sp https://t.co/6S98Ha85nS"
130,712098467699662849,1566260520818286592,2022-09-04,"Minha eterna n(AMOR)ada 💍 ♥️ 👩🏽‍❤️‍👩🏻  

_ TE AMO MÔAMOR 

 #lesbians #lesbianpride #lgbtqi #elenão em Zona Sul de São Paulo https://t.co/AmQMKJ5HKw"
131,36289190,1566258111748374528,2022-09-04,"Enquanto isso na bat-caverna...

#timejomarunning @jomasportbr 
#SempreCorrendo

Corrida Batman e Batgirl em Memorial da América Latina, São Paulo https://t.co/1rf9B1CB06"
132,37512033,1566249667620388866,2022-09-04,"Shimano Short Track 2022

Foto: @jjeducruz 

@shimanofest 
#shimanofest #shimanoshorttrack #shimanobrasil #caloiperformance #caloi #andremeloracing #mtb #xcc #sampa em Memorial da América Latina, São Paulo https://t.co/pxaQTXDcVG"
133,115055242,1566223088789880834,2022-09-04,Bora esquentar o corpo neste frio de 12°C https://t.co/yVHRl1ctEb
134,363978885,1566221182441066501,2022-09-04,Acabou de publicar uma foto em Jardim Jabaquara https://t.co/bL0foE6AT1
135,203973686,1566213913305309189,2022-09-03,"I'm at Terminal Metropolitano Jabaquara (EMTU) in São Paulo, SP https://t.co/e4P9i1cS4L"
136,117569261,1566213397624279040,2022-09-03,Gratidão 🥳👏🏾👏🏾👏🏾🌹 em Mecânica hidráulica de cadeiras de cabelereiro https://t.co/nNOYP5pvzt
137,203973686,1566212885491187712,2022-09-03,"I'm at Jabaquara - @sp_prefeitura in São Paulo, SP https://t.co/iZ4Lp6Sf0S"
138,203973686,1566212669312466945,2022-09-03,"I'm at Estação Jabaquara (Metrô) in São Paulo, SP https://t.co/AAPYlhAGFy"
139,298083501,1566196826394460161,2022-09-03,"Acabou de publicar uma foto em Avenida General Valdomiro De Lima, Jabaquara, Sao Paulo, Sp, Brasil https://t.co/XXa9o3EtkF"
140,119032434,1566185285079252993,2022-09-03,Acabou de publicar uma foto em Vila Alexandria https://t.co/sNrEjVEgcF
141,497367354,1566180446018355201,2022-09-03,Acabou de publicar uma foto em Vila Santo Estefano https://t.co/I8KKdzIdnq
142,33924730,1566155657174212609,2022-09-03,Vivendo! ❤️🙌🥂 em Na Farra! https://t.co/Pwmpgt0zEY
143,151725277,1566103629895028737,2022-09-03,Hoje teve 🏊🏽‍♂️♥️. em Academia Raia Livre https://t.co/RLhasBQmFk
144,74256272,1566099518847852545,2022-09-03,Quem caiu de bunda e teve que parar? 🙋🏻‍♀️ (@ Clube Escola Vila Guarani) https://t.co/pRZxQ5T9O9 https://t.co/A3gSOf7OtX
145,1515105811210678276,1566074094923177987,2022-09-03,CHEGUEI SÃO PAULO 🙏🏼 https://t.co/ottXLTLMcc
146,1390931250,1566057571680911360,2022-09-03,Bíblia Verso do Dia (Deuteronômio 6:25)... - 03/09/2022 em Condominio Residencial Castelo Branco https://t.co/hCbd1JCVvK
147,1390931250,1566053814385483777,2022-09-03,Imagem do versículo do dia (1 Tessalonicenses 5:15 NVI)... - 03/09/2022 em Condominio Residencial Castelo Branco https://t.co/rW0vkVAwXg
148,177743869,1566033877017280514,2022-09-03,Bom dia com Jesus Cristo no seu Coração 🙏🏼 em Zona Sul de São Paulo https://t.co/BvViON98vc
149,1207152562081804288,1566029858152583168,2022-09-03,https://t.co/6Zjx7rYq8s
150,497367354,1566022623519297537,2022-09-03,Acabou de publicar uma foto em Vila Santo Estefano https://t.co/UeNys4nBMJ
151,106774618,1566001080957374465,2022-09-03,"I'm at São Paulo Airport / Congonhas in São Paulo, SP https://t.co/2YYIGxo8MI"
152,117569261,1565888649073418241,2022-09-03,Acabou de publicar uma foto em Mecânica hidráulica de cadeiras de cabelereiro https://t.co/IoOIBBgxG0
153,148478983,1565873062335102977,2022-09-03,Cheguei fml https://t.co/lxJF8AiCBV
154,74350552,1565865662773432321,2022-09-03,Acabou de publicar uma foto em São Paulo Expo https://t.co/xGh5MdSqnt
155,1426362379772760065,1565843950870695936,2022-09-02,"#cabelocolorido com @kamaleaocolor 
Agendamentos via WhatsApp: 
https://t.co/AkYPtnqf9K https://t.co/ECRCoAXT1F"
156,103143875,1565828008430247938,2022-09-02,@Galez_SCCP @Luiz_fe009 Kkkkkkkkkkkkkk
157,304513033,1565826171429965830,2022-09-02,#Sextando! 💪💪💪💪 https://t.co/ZaxTOj3sA1
158,44636743,1565814447343603713,2022-09-02,"I'm at Jabaquara Bus Terminal in São Paulo, SP https://t.co/JCyf0qFl1k"
159,1513286037191155721,1565814231236329473,2022-09-02,Boa noite ☺️ https://t.co/qRZwFXYmSu
160,1519066099031195651,1565803712089653248,2022-09-02,@cristinagraeml O Lula não tem essa % de votos...
161,203973686,1565800177390288896,2022-09-02,"I'm at Jabaquara/Diadema - Trólebus 290 in São Paulo, SP https://t.co/kFwdIznYTA"
162,203973686,1565800012117852161,2022-09-02,"I'm at Terminal Metropolitano Jabaquara (EMTU) in São Paulo, SP https://t.co/K2bd39eLJh"
163,115055242,1565793123774652417,2022-09-02,"Estava desejando! 
😋😋😋😋😋😋😋 https://t.co/S4hl4ODQTu"
164,465343541,1565755272013938688,2022-09-02,Partiu! É o Grêmio! https://t.co/IHwEynQM7W
165,497367354,1565742110975954946,2022-09-02,Acabou de publicar uma foto em Vila Santo Estefano https://t.co/oInEOb7zXP
166,1390931250,1565727093039796226,2022-09-02,Bíblia Verso do Dia (Provérbios 16:9)... - 02/09/2022 em jardim Oriental jabaquaraS.P https://t.co/UoYvOdZKCM
167,35962917,1565719808636846081,2022-09-02,"I'm at Aeroporto de São Paulo / Congonhas in São Paulo, SP https://t.co/ZBsLoKOlVx"
168,294968433,1565717915944603653,2022-09-02,"I'm at Aeroporto de São Paulo / Congonhas in São Paulo, SP https://t.co/MzOhhNklGJ"
169,792829361007259649,1565713982463397889,2022-09-02,"O encontro de casais padrão da sociedade paulistana  bem na minha frente, vivendo um experimento social e tanto"
170,195039517,1565710733693837312,2022-09-02,#BomDia #sextaferia #meta #sonho #objetivo #foco #determinação #realização #força #resultado #fé #Investimento #Sp #Brasil em Danilo Souza - Consultor Financeiro https://t.co/5jSOijrNco
171,206486174,1565708482132824064,2022-09-02,"""Adoro"" conexão longa."
172,1390931250,1565706584059256832,2022-09-02,Imagem do versículo do dia (Filipenses 4:9 NVI)... - 02/09/2022 em jardim Oriental jabaquaraS.P https://t.co/vsf2GJTtOX
173,151725277,1565692437355429891,2022-09-02,"Vamos que hoje é sexta-feira ✌🏽😵‍💫.

BOX @crossfit_saude Fagundes Filho 💚 em CrossFit Saúde Fagundes https://t.co/EmLwhJ1Fy5"
