,author_id,tweet_id,created_at,text
0,250186577,1528148799323090945,2022-05-21,Escreva uma legenda... em Sao Paulo Capital https://t.co/pryKGIVtYv
1,497367354,1528125114746777601,2022-05-21,Acabou de publicar uma foto em Vila Santo Estefano https://t.co/NovNh2RnVt
2,497367354,1528124382161342465,2022-05-21,Acabou de publicar uma foto em Vila Santo Estefano https://t.co/HhlUHbHQcY
3,113614714,1528113979360411648,2022-05-21,#mexicano #food #sabadou em Campo Belo (district of São Paulo) https://t.co/zo1SD9TIo8
4,146220493,1528107088827756545,2022-05-21,😎❤🙏 en Hospitalar https://t.co/XgRMTNC25q
5,15120800,1528089748904022018,2022-05-21,#ultron #homemdeferro #tonystark #ccxp #ccxp2015 #vingadoreseradeultron #ironman em São Paulo Expo https://t.co/uFFrOAEuyf
6,61850588,1528087912838967296,2022-05-21,Acabou de publicar uma foto em Campo Belo (district of São Paulo) https://t.co/FSzM7cmOpz
7,203973686,1528076770716655616,2022-05-21,"I'm at Jabaquara/Diadema - Trólebus 290 in São Paulo, SP https://t.co/cq485ukT0x"
8,203973686,1528076598552952832,2022-05-21,"I'm at Terminal Metropolitano Jabaquara (EMTU) in São Paulo, SP https://t.co/mLbbbzB2YB"
9,151725277,1528060611669725186,2022-05-21,"Hoje o time estava maior 🫶🏽💚.

BOX: @crossfitsaudefagundes | @crossfit_saude ♥️🥹. em CrossFit Saúde Fagundes https://t.co/8iAzgj6Z4U"
10,203973686,1528056044857040898,2022-05-21,"I'm at Estação Jabaquara (Metrô) in São Paulo, SP https://t.co/EfQQDOpdkM"
11,225000120,1528043004690300929,2022-05-21,Acabou de publicar uma foto em Zona Sul de São Paulo https://t.co/a8YNrGabRQ
12,497367354,1528042014947921921,2022-05-21,Acabou de publicar uma foto em Vila Santo Estefano https://t.co/gqglMyNgZU
13,826411640002330624,1528029764648177664,2022-05-21,"Acabou de publicar uma foto em Espaço das Americas, Sao Paulo https://t.co/ygOONfb7a9"
14,380041281,1528022211730321408,2022-05-21,Acabou de publicar uma foto em São Paulo Expo https://t.co/spEaHWA9O1
15,146220493,1528015440328400897,2022-05-21,❤🙏 en Hospitalar https://t.co/1UgWbTpxd0
16,17792010,1528014676742791169,2022-05-21,"Felipe: onde vai todo arrumado? 
Eu: No posto falar o carro em Campo Belo (district of São Paulo) https://t.co/aUXEI6sSTP"
17,1390931250,1528004692206313472,2022-05-21,Bíblia Verso do Dia (João 7:37)... - 21/05/2022 em Condominio Residencial Castelo Branco https://t.co/ZxdNrPYLd5
18,1390931250,1528003695912398851,2022-05-21,Imagem do versículo do dia (Hebreus 4:16 NVI)... - 21/05/2022 em Condominio Residencial Castelo Branco https://t.co/jyZZc7oe5x
19,168346921,1527987711704936448,2022-05-21,"Escolha o bem
Escolha a vida
@diasderock em Parque do Chuvisco https://t.co/qmnmhS2UCs"
20,497367354,1527967858453630978,2022-05-21,Acabou de publicar uma foto em Vila Santo Estefano https://t.co/ViDEVxhsdL
21,497367354,1527966912864473089,2022-05-21,Acabou de publicar uma foto em Vila Santo Estefano https://t.co/aic6tPQeOW
22,195039517,1527939429335187458,2022-05-21,Acabou de publicar uma foto em Danilo Souza - Consultor Financeiro https://t.co/4OEmPHmD4S
23,304147865,1527828816713883648,2022-05-21,"Depois de dois anos de pandemia, @hospitalaroficial evento importante da área.
Seguimos trabalhando e nos conectando em busca de melhorias sempre.
 #hospitalar #ortomedicgroup #surgicol #otima em Hospitalar https://t.co/3TY2P60UmY"
24,89255134,1527813118029594627,2022-05-21,Acabou de publicar uma foto em Tv Cinec https://t.co/p1QJ72iugU
25,1240688418809679872,1527796659014492167,2022-05-20,12 fucking graus 🥶
26,3409727230,1527796594061500416,2022-05-20,Boa noite meus amores ❤️‍🔥🏁 https://t.co/kGwDpjQWTZ
27,77844663,1527791247426998273,2022-05-20,~ tarde botânica no @jardimbotanicosp ~ em Jardim Botânico de São Paulo https://t.co/UZm499ANdQ
28,1504969424612335626,1527768123075592193,2022-05-20,"Avião GOL/CBF em CGH, agora q fretamos Avião, não deveria ter um com o escudo do FOGÃO na cauda? @_thiagofranklin @Botafogo @JohnTextor @setorvisitante https://t.co/wVOXI3ToFq"
29,3129086403,1527764908254892033,2022-05-20,A Denise nas fotos do show da @luisasonza / Eu nas fotos https://t.co/Gp5j87zTqd
30,203973686,1527750401965142017,2022-05-20,"I'm at Terminal Metropolitano Jabaquara (EMTU) in São Paulo, SP https://t.co/aD6fElVIXB"
31,10226052,1527739482102964225,2022-05-20,"I'm at Sala VIP Latitude Workspace in São Paulo, SP https://t.co/xSqk0XoHbe"
32,15120800,1527730632633331718,2022-05-20,#coringa #comissáriogordon #batsinal #bane #jimgordon #ghotam #dccomics em São Paulo Expo https://t.co/mtNDg80vcA
33,203973686,1527710534015062018,2022-05-20,"I'm at Estação Jabaquara (Metrô) in São Paulo, SP https://t.co/QdbafbFLSU"
34,56807544,1527696967198973953,2022-05-20,"Excelente tarde pea você!
#carpediem 
#sextou🔥 
#party 
#flashmix 
#poolfm em Rhythm Audio Produções https://t.co/RwuXiGfGg6"
35,61691896,1527682324636237824,2022-05-20,Colecionando momentos! ✈️🌎 #viagem #mundo #aeroporto #rj #sp #deusnocomando em Aéroport international de Congonhas https://t.co/9erCeMyaa9
36,66707806,1527676088972984325,2022-05-20,Parabéns Lulanja que seja só o começo de uma vida melhor para todos. Desejo ao casal muitas felicidades Presidente Lula agora  chegou sua vez  estamos na torcida para próxima etapa da sua vitória. https://t.co/cVYPsQxHv2
37,1455276900004286467,1527629770514739201,2022-05-20,Já estou esperando  @elonmusk.... https://t.co/fcsKq1YinP
38,2342241168,1527626580196990977,2022-05-20,Acabou de publicar uma foto em Igreja De Cristo do MetrôSul https://t.co/KwpsUdg6Vq
39,1390931250,1527625735258525696,2022-05-20,Bíblia Verso do Dia (1 Pedro 4:8)... - 20/05/2022 em Condominio Residencial Castelo Branco https://t.co/QJeXpWusHc
40,2828720748,1527625028405166081,2022-05-20,Solzinho 😌 https://t.co/NJrI75j71Z
41,1390931250,1527622278468538368,2022-05-20,Imagem do versículo do dia (Filipenses 4:19 NVI)... - 20/05/2022 em Condominio Residencial Castelo Branco https://t.co/XpmEHNSAfG
42,37755734,1527607865111887872,2022-05-20,Viciada em Pop Funko? Quem...eu??? (Esses são só alguns da minha coleção) em Eskudeiro's Bar https://t.co/2CZxF80GfI
43,857624090936528898,1527603613455077376,2022-05-20,"Acabou de publicar uma foto em Vila Guarani, Zona Sul - Sp https://t.co/32j3bAxL6x"
44,497367354,1527603569855168513,2022-05-20,Acabou de publicar uma foto em Vila Santo Estefano https://t.co/39hyfrHSQE
45,195039517,1527602820878319621,2022-05-20,#BomDia #sextaferia #fé #determinação #força #resultado #foco #Sp #Brasil em Danilo Souza - Consultor Financeiro https://t.co/PltGVIaq1T
46,56807544,1527548594345201665,2022-05-20,Acabou de publicar uma foto em Rhythm Audio Produções https://t.co/gCFXBIxHQR
47,712803270155235328,1527475919924887555,2022-05-20,"Bom dia. 💪🙌🤜🤛 Ótima Sexta-feira. 

#proglassvidros #bomdiasp #forçafocoefé #whatsapp📲1135305500 em Vidraçaria Proglass Temperados e Laminados https://t.co/S0AQgaQdPu"
48,119032434,1527469118164697097,2022-05-20,Acabou de publicar uma foto em Vila Alexandria https://t.co/7szxfLjL1v
49,73422860,1527449561991680000,2022-05-20,Voo bem tranquilo e rápido! #CGH @LATAM_BRA https://t.co/ApLiK1dsiO
50,1521532089522348034,1527432921971408905,2022-05-19,Agenda Aberta ☺️ https://t.co/IIb2xYMd47
51,2539116365,1527414856470732801,2022-05-19,@doldiarioonline Essa é a manchete do Diário do Pará de hoje... há algo errado né...o jornal circula todos os dias com 8 páginas só de crimes ...e a violência diminuiu...Vai entender https://t.co/Mh7Mw71gfD
52,65781145,1527408985250353152,2022-05-19,"@mcflymusic day 02 ✅✨ 
#mcfly #mcflysp #galaxydefenders #galaxydefendersstayforever em Espaço das Americas, Sao Paulo https://t.co/rhnw3ksLJT"
53,864583851527598081,1527408403718492171,2022-05-19,"Hoje apresentei o Congresso de Atenção Domiciliar na Hospitalar. #mestredecerimonias 
#apresentadora #jornalista https://t.co/Rm2VifTh9y"
54,65781145,1527407638027325440,2022-05-19,Esses vídeos são icônicos de mais para deixar guardado! Toda oportunidade de mandar o g3n0c1d4 tomar no c&lt; e pedir cerveja será utilizada 🫰🏽✨ #mcfly #mcflysp #galaxydefenders #galaxydefendersstayforever https://t.co/4F3Dt8VKxH
55,100353774,1527380048533135360,2022-05-19,"Missão cumprida, agora vamos para casa 🙌🏻🙏🏻✈️ ""Seu crescimento assusta pessoas que não planejam mudanças."" em Aeroporto De Congonhas, São Paulo - SP https://t.co/ZvYxR4TEQP"
56,2539116365,1527364008969633792,2022-05-19,@diariodopara A manchete do Diário do Pará hoje não condiz com o caderno diário do jornal de 8 páginas que só pública crimes e assassinatos...tem algum erro hem https://t.co/gPcX7KtRWc
57,1303877860969644040,1527353418674688009,2022-05-19,"Atendimentos no
SPA MARIA PADILHA em Maria Padilha https://t.co/8ckT04eKi1"
58,1227247794009837569,1527345992407822336,2022-05-19,"Agora: programação especial do SindHosp para o 3º dia da Feira Hospitalar. Estamos reunindo em nossa Sala dos Parceiros, nº 208, importantes players do setor para apresentação de pautas estruturantes e condições especiais para nossos visitantes. Contamos com a sua participação! https://t.co/zurAwI839F"
59,193777167,1527339974911152132,2022-05-19,"I'm at Aeroporto de São Paulo / Congonhas in São Paulo, SP https://t.co/0Hw0dCk7RK"
60,29720850,1527309366294384641,2022-05-19,"Gastronomia mineira é uma coisa deliciosa 🙌🏻 (@ Dona Naná Gastronomia Mineira in São Paulo, SP) https://t.co/JadgpACM1X https://t.co/Qf3j0rSZ7H"
61,15120800,1527292613438496768,2022-05-19,#batman #mulhergato #brucewayne #dccomics #selinakyle #catwoman #nolan em São Paulo Expo https://t.co/muNtGg33ZT
62,1518031674407374850,1527284810632204288,2022-05-19,"Nada de mudar de cep, tenho o endereço certo! 💐"
63,1349767438729142272,1527274550609731584,2022-05-19,nunca passei tanto frio
64,1390931250,1527269323361746944,2022-05-19,Bíblia Verso do Dia (1 Reis 8:57)... - 19/05/2022 em Condominio Residencial Castelo Branco https://t.co/uS7HnW1tf6
65,1390931250,1527265487469559813,2022-05-19,Imagem do versículo do dia (Apocalipse 4:11 NVI)... - 19/05/2022 em Condominio Residencial Castelo Branco https://t.co/MkujBleRqx
66,497367354,1527251914584256514,2022-05-19,Acabou de publicar uma foto em Vila Santo Estefano https://t.co/iVFQk78xyp
67,89255134,1527251065757786112,2022-05-19,Acabou de publicar uma foto em Tv Cinec https://t.co/42acUgaYsM
68,203973686,1527248842827214855,2022-05-19,"I'm at Estação Jabaquara (Metrô) in São Paulo, SP https://t.co/cx1p173vAx"
69,497367354,1527244803183988740,2022-05-19,Acabou de publicar uma foto em Vila Santo Estefano https://t.co/g7CW9dMKYL
70,195039517,1527243851571896320,2022-05-19,Acabou de publicar uma foto em Danilo Souza - Consultor Financeiro https://t.co/PPbVVKX0cm
71,736680582822907904,1527224934015156228,2022-05-19,"Uma ótima quinta-feira a todos!!! em Vila Guarani, Zona Sul - Sp https://t.co/zRpY8cVTKd"
72,736680582822907904,1527218968452268032,2022-05-19,"Uma quinta-feira abençoada a todos!!! em Vila Guarani, Zona Sul - Sp https://t.co/rqQ8iSEetn"
73,1422152505128112132,1527120025290694658,2022-05-19,"Faz frio em sp🥶 
Quase congelando no trampo slk 9°"
74,84979022,1527105495974023170,2022-05-19,"Hoje estivemos na feira hospitalar, em breve teremos muitas novidades para a podologia com avanços super positivos. em São Paulo Expo https://t.co/VLly6AKDgt"
75,363978885,1527082402106966016,2022-05-19,Acabou de publicar uma foto em Jabaquara https://t.co/BfrVjxUZJx
76,1625302800,1527073519896604673,2022-05-18,"Me identifiquei com essa frase!🙋‍♂️😁

@expohospitalar
@enfermagemporamor_ofc
@senac_rj em São Paulo Expo https://t.co/DRZVKFinbu"
77,30705548,1527067246337708033,2022-05-18,Tá feliz @AthleticoPR https://t.co/7mEV1zQiZk
78,50851280,1527064704744624128,2022-05-18,"I'm at Aeroporto de São Paulo / Congonhas in São Paulo, SP https://t.co/6iV352e31b"
79,2787216415,1527050006800236545,2022-05-18,"Acabou de publicar uma foto em Espaço das Americas, Sao Paulo https://t.co/Y2Ib2F7Ckp"
80,2539116365,1527029655923998720,2022-05-18,Tá frio aqui viu...8 graus aqui na Zona Sul da capital https://t.co/QUIFXlciJS
81,1227247794009837569,1527028909853794305,2022-05-18,"Estamos no 2• dia da Feira Hospitalar. Hoje realizamos em parceria com a Enconsad a Arena de Conteúdo, com o tema Atenção Domiciliar. A plateia, engajada no tema, esclareceu dezenas de dúvidas e interagiu com os palestrantes. Obrigado pela presença de todos! https://t.co/xdEGIgTeeJ"
82,854904895517974529,1527001909206425601,2022-05-18,Você se lembra quando começou a fazer parte do Twitter? Eu me lembro! #MeuAniversárioDoTwitter https://t.co/meNU6EXary
83,173819903,1526992859261435905,2022-05-18,"E hoje visitando a @hospitalaroficial #2022 
#Networking #Negócios #SoluçõesCompletas 
#Ceramfix #Ardex @ceramfix em Hospitalar https://t.co/hfe2DNLLv2"
84,15120800,1526987960742289415,2022-05-18,#patodonald #mickey #olaf #pinocchio #grilofalante #darthvader #stormtrooper em São Paulo Expo https://t.co/jtVxbPfY9a
85,3138934131,1526981864237551618,2022-05-18,Só queria entender como a juma faz toda essa safadeza e não tá grávida ainda.
86,94150452,1526954422680571908,2022-05-18,Boa tarde!!! Precisando de guincho solicite orçamento preços justos 📱97999-6529 #zonasulguincho #guincho24horas #autosocorro #guinchoplataforma #guinchomoto #guincho24hs #vilasantacatarina em Avenida Santa Catarina https://t.co/Oal6xzk5tQ
87,167051866,1526946089252884482,2022-05-18,"Preparados pro frio.
Banho, só se for de gato!
KKK 😹 em Consultora de beleza Wilma https://t.co/Gzm91N5hMC"
88,89255134,1526930239934320640,2022-05-18,"Bom dia ☕

Ontem o Programa VIVIANE VIDMAR pela TV CINEC foi um sucesso!!! 

Para você participar pessoalmente ou por vídeo, mande whats para (11) 95034-2028 Viviane Vidmar Produções. 

Gratidão ❤🙏 em Tv Cinec https://t.co/lldtiPVRRw"
89,1417517436400721922,1526921782426484736,2022-05-18,https://t.co/c8o4ltwbDz
90,1417517436400721922,1526921722636685314,2022-05-18,Feira hospitalar 2022 https://t.co/9mMGKsx3Kf
91,1509234946682109959,1526919806380871682,2022-05-18,"Acabou de publicar uma foto em Aeroporto De Congonhas, São Paulo - SP https://t.co/fMWkQNtX93"
92,151269084,1526916395543535617,2022-05-18,"❤️❤️❤️ em Aeroporto De Congonhas, São Paulo - SP https://t.co/1PV5IDX9Pv"
93,15120800,1526910183699582978,2022-05-18,#batman #superman #flash #robin #lanternaverde #robocop #transformers em São Paulo Expo https://t.co/eo5SRHvDBp
94,1390931250,1526908000472121346,2022-05-18,Bíblia Verso do Dia (Isaías 40:8)... - 18/05/2022 em Condominio Residencial Castelo Branco https://t.co/0SR3IIMC9m
95,1390931250,1526906386835296257,2022-05-18,Imagem do versículo do dia (2 Coríntios 7:10 NVI)... - 18/05/2022 em Condominio Residencial Castelo Branco https://t.co/6uBWTC9yYG
96,195039517,1526872466525659136,2022-05-18,#BomDia #QuartaFeira #meta #sonho #objetivo #realização #foco #determinação #fé #resultado #força #sp #Brasil em Danilo Souza - Consultor Financeiro https://t.co/Fsi1XZ2NTI
97,336550037,1526869001380454401,2022-05-18,"Here we go !! (@ Aeroporto de São Paulo / Congonhas in São Paulo, SP) https://t.co/aCsHAiJvho"
98,904265844468920320,1526792995206483969,2022-05-18,Acabou de publicar uma foto em Arnaldo Faria de Sá https://t.co/EeyjkNUNYn
99,904265844468920320,1526792724875251714,2022-05-18,Acabou de publicar uma foto em Vila Guarani - Jabaquara https://t.co/QzvNreJCHZ
100,65781145,1526781123186917377,2022-05-18,"@mcflymusic day 01 ✅🫰🏽✨ em Espaço das Americas, Sao Paulo https://t.co/FslUrh6sSp"
101,2539116365,1526719029871788033,2022-05-18,Hoje tem.... Vaiiiiiiiiiiiiiiiiiiiiiiiiiiiiiiiiiii Corinthianssssssss https://t.co/Bh5QWyjAkr
102,2342241168,1526716108908072960,2022-05-18,Acabou de publicar uma foto em Igreja De Cristo do MetrôSul https://t.co/82YmWrQnf5
103,904265844468920320,1526698302355423233,2022-05-17,"Alô Família Vila Guarani, Jabaquara e Região! Nosso samba de sexta feira foi transferido para sábado dia 21 Maio… a partir das 16:30h
Será um enorme prazer estarmos juntos tirando essa onda💃🕺🪕🎤 em Praça São Paulo https://t.co/q9QgzPKxhZ"
104,34365712,1526682659128168448,2022-05-17,"My new, bright side!

#solarguitars
#deathmetal #brutaldeathmetal #technicaldeathmetal #heavymetal #guitar #eletricguitar #vocal #vocalist #studio
#evilriseband #heavymetal #powertrio #guitarrist #guitarplayers https://t.co/pujGNQaDos"
105,15120800,1526641075573739529,2022-05-17,#hulkbuster #hulk #brucebanner #tonystark #vingadores #vingadoreseradeultron #marvel em São Paulo Expo https://t.co/qTkGdkNJbq
106,167051866,1526600930841575424,2022-05-17,Mickey adora uma caixa em Consultora de beleza Wilma https://t.co/b1E4PPPHqE
107,184982763,1526600581745364992,2022-05-17,"Começa daqui a pouco, às 14 horas, a participação da diretora médica do GRUPO GERIATRICS, dra. Rafaela Pinaud, na Feira Hospitalar;
Cuidados de Transição: Solução de efetividade e sustentabilidade.

I-61 – Pavilhão C

Desafios regulamentares dos serviços de transição no Brasil."
108,1469555778474418182,1526599602757066754,2022-05-17,De novo eu na casa da minha vo
109,1508080429,1526596484090716161,2022-05-17,"Saudades que a gente NÃO tem do aeroporto... Falta de opção e o que tem, é absurdo... https://t.co/MRiGt5HEXN"
110,869551189310025728,1526585220727808002,2022-05-17,Acabou de publicar uma foto em In Musica Records - Audio &amp; Vídeo https://t.co/37jLhq3gQE
111,61850588,1526582496934121472,2022-05-17,Acabou de publicar uma foto em Campo Belo (district of São Paulo) https://t.co/dOiXGF86az
112,841772182338449409,1526579698926555136,2022-05-17,Ô trabalhinho enjoado esse de epidemiologia viu 😒
113,123610288,1526552504208596995,2022-05-17,Acabou de publicar uma foto em Audere Comercio em TI https://t.co/icSsO3L2WF
114,305066003,1526542290491043841,2022-05-17,"Parabéns meu filho!
Deus te conceda saúde , paz e muitos anos de vida.
Te amo infinito! ❤️👏 em Aeroporto De Congonhas, São Paulo - SP https://t.co/aXhLbkCB48"
115,1390931250,1526540706831015938,2022-05-17,Bíblia Verso do Dia (Romanos 15:2)... - 17/05/2022 em Condominio Residencial Castelo Branco https://t.co/M6v2FeCcF3
116,1390931250,1526538770954260483,2022-05-17,Imagem do versículo do dia (Miqueias 6:8 NVI)... - 17/05/2022 em Condominio Residencial Castelo Branco https://t.co/j7qm9GIBIr
117,497367354,1526526543698198530,2022-05-17,"17 de maio 
Dia internacional do combate à LGBTKI+ 

#diainternacionaldocombatealgbtfobia #todaformadeamar #empatia #maisamor #bdsp #clubedamassagem #saopaulo #brasil #chile #argentina #australia em Vila Santo Estefano https://t.co/2jZR9YKy2U"
118,736680582822907904,1526502939895795713,2022-05-17,"Uma ótima terça-feira a todos!!! em Vila Guarani, Zona Sul - Sp https://t.co/UB1Cx4kBS5"
119,736680582822907904,1526498159467253760,2022-05-17,"Uma terça-feira abençoada a todos!!! em Vila Guarani, Zona Sul - Sp https://t.co/9TTf7EuiqO"
120,50851280,1526473170538094593,2022-05-17,"I'm at Aeroporto de São Paulo / Congonhas in São Paulo, SP https://t.co/jheA05AqsJ"
121,34628000,1526408534786822144,2022-05-17,Minha flor! em Zona Sul de São Paulo https://t.co/4XQtWm0S2p
122,3129086403,1526374998893645824,2022-05-17,"Quando a @luisasonza  disse:

muito barulho pra Clara (@claragnds) e pro NÃO, EU QUE TO MANDANDO PORRA! 

Deu um fecho na segurança ch4t0n4!

#luisasonza #bailedabraba https://t.co/oFoK2XeY6D"
123,927579295266037760,1526355143616352256,2022-05-17,"Dorzinha no peito voltando pra casa, receio das coisas que preciso me esforçar mais. Será que eu vou conseguir? 😐"
124,858889322577133569,1526353673663684609,2022-05-17,A fobia à sinfonia de pessoas 'fungando' dentro de um avião é uma das heranças mais irritantes da pandemia 😥
125,712803270155235328,1526350054138650625,2022-05-16,"Box em vidro temperado incolor com estrutura em alumínio branco. 
#proglassvidros #boxbanheiro #boxdevidro #contato #whatsapp📲1135305500 em Zona Sul de São Paulo https://t.co/xntGczLlwp"
126,712803270155235328,1526348911404793856,2022-05-16,"Fechamento de Sacada articulada. 

#proglassvidros #envidraçamentodesacada #whatsapp📲1135305500 #fechamentodesacada em VILA MASCOTE https://t.co/1eZQ3m0XZo"
127,2158024799,1526324897223434240,2022-05-16,Acabou de publicar uma foto em Zona Sul de São Paulo https://t.co/T1jKHrzX4c
128,1483517965593190406,1526290505985712129,2022-05-16,E-trip poco com os parceiros 🧘🏽‍♀️🧙🏽 https://t.co/Ar06c6J7Y3
129,59303623,1526285075834458118,2022-05-16,Retornando... https://t.co/EI0D9T02jx
130,825770295164272640,1526256397087821825,2022-05-16,"Carinha de cansada, mas sensação de dever cumprido 🙌.
Mais uma vez saindo de SP levando na bagagem muitos momentos inesquecíveis, experiências e muita gratidão a todos que me apoiam diariamente e acreditam no meu trabalho e no meu pontecial❤️
Que venha o proximo e ate logo SP☺️ https://t.co/T7XWXR3KBd"
131,363978885,1526253171483496448,2022-05-16,Acabou de publicar uma foto em Jardim Jabaquara https://t.co/9tlXG6yG3X
132,2828720748,1526249635987214336,2022-05-16,https://t.co/svdHIwQ50G
133,3394227016,1526234770400845824,2022-05-16,Acabou de publicar uma foto em Meias Elite https://t.co/mcv3BkAnxz
134,3394227016,1526234368733085698,2022-05-16,Acabou de publicar uma foto em Meias Elite https://t.co/JTlTNKCZkv
135,1287167909215776774,1526195228859826179,2022-05-16,Acabou de publicar uma foto em Zona Sul de São Paulo https://t.co/w8t1TR26Tk
136,15120800,1526190694028566529,2022-05-16,#hulk #hulkbuster #brucebanner #tonystark #vingadores #marvel #ccxp em São Paulo Expo https://t.co/xL30GWqbia
137,3138934131,1526187010729328643,2022-05-16,https://t.co/Yheq38ayWl
138,1390931250,1526185735400873986,2022-05-16,Bíblia Verso do Dia (Salmo 94:18)... - 16/05/2022 em Condominio Residencial Castelo Branco https://t.co/K3gm7XpbK8
139,1390931250,1526184252328529922,2022-05-16,Imagem do versículo do dia (Romanos 8:1 NVI)... - 16/05/2022 em Condominio Residencial Castelo Branco https://t.co/foTDoyTU7k
140,497367354,1526163209144631297,2022-05-16,"Promoção da Semana.

#massagemsensual

AGENDE seu Horário

WhatsApp 11 946304131

#promoção #promoçãodasemana #promocaodasemana #clubedamassagem #aquitemmassagemdeverdade #vemproclube #exclusivodoclubedamassagem https://t.co/5st1q3EsEx"
141,52833087,1526158034505965570,2022-05-16,"I'm at Aeroporto de São Paulo / Congonhas in São Paulo, SP https://t.co/3fRYbnq7T5"
142,195039517,1526148974523973632,2022-05-16,"Condições especiais para a compra do seu imóvel! - Danilo Souza 11 97966-8347
.
#sonho #meta #objetivo #força #determinação #foco #resultados #fé #realização #Investimento #casa #imovel #BomDia #segundafeira #Sp #Brasil https://t.co/ZoNiHpXAjY"
143,46383721,1526119465150296065,2022-05-16,"Acabou de publicar uma foto em Aeroporto De Congonhas, São Paulo - SP https://t.co/exkmDIhihR"
144,2342241168,1526108358981337089,2022-05-16,Acabou de publicar uma foto em Igreja De Cristo do MetrôSul https://t.co/HeisX51Jc2
145,1163801704858562560,1526060040809066498,2022-05-16,💙💙 https://t.co/5QeGosqUUe
146,318701247,1526026522464616448,2022-05-16,O fim é triste 🤖 em Congonhas https://t.co/CtVJUDoCTK
147,2798606261,1526020424466931712,2022-05-16,"@Astronomiaum 🌚
📍São Paulo, SP. https://t.co/BsUA3YN0kl"
