,author_id,tweet_id,created_at,text
0,1240471874003484672,1540827582173782017,2022-06-25,https://t.co/9jbuwSQezC
1,1732887494,1540822375251550210,2022-06-25,"Mais uma feira para a conta. Muito trabalho, e muitas oportunidades! em Analitica Latin America https://t.co/eKHb4dLn17"
2,1540785746436579328,1540789230812573697,2022-06-25,🍾🥂 https://t.co/2j0Qnd44jO
3,73264143,1540784043377041414,2022-06-25,"E hoje foi dia de colocar o crachá no pescoço, e rever essa equipe que eu amooooooo. Depois de mais de 2 anos de pandemia nos reencontramos saudáveis graças a Deus! #Gol #TimedeAguias #SangueLaranja #accd https://t.co/hmektJcIaw"
4,19383548,1540759339568402432,2022-06-25,"Almoço com contra-filé
Espetinho de coração de frango 
Espetinho de pancetta 
#foodbullying @ Rei do Atropelado https://t.co/6kxoAqXZZA"
5,3127024384,1540753161383714816,2022-06-25,indo bem ali fazer um negocinnnn
6,193469588,1540751848088358912,2022-06-25,Festa junina do EMIA em Emia Escola Emia https://t.co/nd7ybThgRA
7,203973686,1540747239013814275,2022-06-25,"I'm at Terminal Metropolitano Jabaquara (EMTU) in São Paulo, SP https://t.co/5CYPW0Onxz"
8,56807544,1540740167316541445,2022-06-25,"Ótima tarde! Terminando a aula de hoje com meu aluno
@rogerio.caetano.9 , let's party! 
#carpediem em Rhythm Audio Produções https://t.co/unixvDxQrr"
9,904265844468920320,1540732244158844930,2022-06-25,Acabou de publicar uma foto em Praça São Paulo https://t.co/EJ8Y8od18m
10,93976087,1540728240016433152,2022-06-25,"Vem vem vem , ajudar as obras de São Judas Tadeu em São Paulo. 

#QuermesseSãoJudasTadeu
#Quermesse https://t.co/910BgpjsCJ"
11,35787594,1540725458609745921,2022-06-25,"Etapa 1 completa. Agora transfer para Guarulhos e de lá Lisboa!!!! em Aeroporto De Congonhas, São Paulo - SP https://t.co/dQvVvn3TSx"
12,258560123,1540718161846075394,2022-06-25,"R$20,00 pau em um chopp no aeroporto.
Cara, onde vamos parar? https://t.co/DrBIejNgM5"
13,70013520,1540714714040152068,2022-06-25,"Acabou de publicar uma foto em Aeroporto De Congonhas, São Paulo - SP https://t.co/XJb6KB5Xju"
14,203973686,1540694713291878401,2022-06-25,"I'm at Estação Jabaquara (Metrô) in São Paulo, SP https://t.co/gU2mWSJ8n7"
15,715191572850147328,1540685476385828870,2022-06-25,"FISPAL 2022

O PRINCIPAL EVENTO PARA AS INDUSTRIAS DE ALIMENTOS,
BEBIDAS, PROTEINAS
E EMBALAGENS. em Fispal Tecnologia https://t.co/HEHrJw5Zdp"
16,106774618,1540682549457915904,2022-06-25,"I'm at Sala VIP Latitude Workspace in São Paulo, SP https://t.co/z48hsIHZvA https://t.co/LUZnNV0Mku"
17,417657549,1540680536108044290,2022-06-25,"Acabei de conhecer aqui no aeroporto de Congonhas, essa cubana linda, inteligente e simpatissíssima!
@zoebmartinez fiquei ainda mais seu fã! 💜 em São Paulo–Congonhas Airport https://t.co/hnCHgWbjv4"
18,497367354,1540679335077548032,2022-06-25,Acabou de publicar uma foto em Vila Santo Estefano https://t.co/8uNr2z3gbc
19,1390931250,1540649029482291200,2022-06-25,Bíblia Verso do Dia (Provérbios 27:19)... - 25/06/2022 em Condominio Residencial Castelo Branco https://t.co/zlYWGwYNs7
20,1390931250,1540646918459514880,2022-06-25,Imagem do versículo do dia (1 Pedro 5:7 NVI)... - 25/06/2022 em Condominio Residencial Castelo Branco https://t.co/cUfLaJvLpF
21,497367354,1540451661025579009,2022-06-24,Acabou de publicar uma foto em Vila Santo Estefano https://t.co/2NElKaBhwg
22,22197767,1540434118764380163,2022-06-24,Primeiro pastel e açaí pós Covid acredite ou não (@ Pastelaria Verde Cana in São Paulo) https://t.co/xrKjT3BWZB
23,203973686,1540434064376795138,2022-06-24,"I'm at Jabaquara/Diadema - Trólebus 290 in São Paulo, SP https://t.co/t3JwUmLLNm"
24,203973686,1540433895543525377,2022-06-24,"I'm at Terminal Metropolitano Jabaquara (EMTU) in São Paulo, SP https://t.co/Rc5krsfDbp"
25,59005499,1540376225293541376,2022-06-24,Acabou de publicar uma foto em Zona Sul de São Paulo https://t.co/uHQYC1oLd3
26,904265844468920320,1540352923384922118,2022-06-24,"*SEXTOUUU FAMÍLIA VILA GUARANI JABAQUARA E REGIÃO 🪕 VEM COMIGO TIRA ESSA ONDA 💃🕺*
 *CHAMA GERAL*
                *TODOS VIP👇👇👇* em Praça São Paulo https://t.co/AQQcYRDEvr"
27,309691828,1540334038111731712,2022-06-24,Acabou de publicar uma foto em Ellegancy Costuras https://t.co/7IqijnTwJ3
28,203973686,1540326107500666885,2022-06-24,"I'm at Estação Jabaquara (Metrô) in São Paulo, SP https://t.co/g1tJRRNsJD"
29,817882111868805120,1540320149772935168,2022-06-24,"Evolua tanto que os outros precisarão te conhecer de novo! em Aeroporto De Congonhas, São Paulo - SP https://t.co/3y4zSibE0I"
30,56807544,1540309809244737536,2022-06-24,Acabou de publicar uma foto em Rhythm Audio Produções https://t.co/dYSkguVCdz
31,1390931250,1540308282799263745,2022-06-24,Bíblia Verso do Dia (Mateus 6:33)... - 24/06/2022 em Condominio Residencial Castelo Branco https://t.co/ESyOLQl1Tu
32,1390931250,1540305098768879621,2022-06-24,Imagem do versículo do dia (Salmo 100:5 NVI)... - 24/06/2022 em Condominio Residencial Castelo Branco https://t.co/76zA9qC4oy
33,1648057244,1540302361704501248,2022-06-24,Acabou de publicar uma foto em São Paulo Expo https://t.co/Bw732Y2DuI
34,713415429029552129,1540287696731512833,2022-06-24,#BomDia em Nobile Suítes Congonhas https://t.co/RvxFZqTIvx
35,497367354,1540285485808988160,2022-06-24,Acabou de publicar uma foto em Vila Santo Estefano https://t.co/KoS2eKCTcV
36,195039517,1540282845121462274,2022-06-24,Acabou de publicar uma foto em Danilo Souza - Consultor Financeiro https://t.co/C47mw89uNc
37,30404697,1540282216554663936,2022-06-24,Acabou de publicar uma foto em Campo Belo (district of São Paulo) https://t.co/a6DK1zLzcf
38,459068565,1540280699722293249,2022-06-24,Festival do Japãoに写真を投稿しましたhttps://t.co/9a3VjIjDji
39,736680582822907904,1540264435079602176,2022-06-24,"Uma sexta abençoada cheia de coisas boas 🙏😇 em Vila Guarani, Zona Sul - Sp https://t.co/ie2IjTud2c"
40,736680582822907904,1540262135531352064,2022-06-24,"Uma ótima sexta-feira a todos! em Vila Guarani, Zona Sul - Sp https://t.co/RFTPWkl9yn"
41,73135603,1540199310800945153,2022-06-24,"Passei pra avisar... que hoje tem!
PONTO DE ENCONTRO BIRU'S 🎶
Vamossss?? 🎵🎤🎶
.
.
@faclubechiquinhodossantos
@chiquinhodossantos
@birodocavaco
@zero8bar
@zabumbeuro em Zero 8 Bar https://t.co/JeuklAsjxK"
42,19572422,1540160014228377601,2022-06-24,Meu amorzinho! em Campo Belo (district of São Paulo) https://t.co/obgqP741aJ
43,736680582822907904,1540139875567124480,2022-06-24,"Uma noite de quinta-feira abençoada a todos 🙏😇 em Vila Guarani, Zona Sul - Sp https://t.co/ahuubjwRL8"
44,363978885,1540128630847815681,2022-06-24,Acabou de publicar uma foto em Jardim Jabaquara https://t.co/rSsGIOASYt
45,840290730,1540123857515954178,2022-06-24,Meu orgulho em disse dupla em Circulo Militar - Pq Ibirapuera https://t.co/F2RzRE1imt
46,203973686,1540110917031034882,2022-06-23,"I'm at Jabaquara/Diadema - Trólebus 290 in São Paulo, SP https://t.co/WrS2rdIuF3"
47,203973686,1540110712915329028,2022-06-23,"I'm at Terminal Metropolitano Jabaquara (EMTU) in São Paulo, SP https://t.co/JlFiNHvNuk"
48,1215341028351389701,1540104292673245189,2022-06-23,Acabou de publicar uma foto em Zona Sul de São Paulo https://t.co/VM77VRSE3V
49,21653078,1540097080122802177,2022-06-23,Acabou de publicar uma foto em Guaratinguetá/SP https://t.co/pFOraDPFHB
50,1350058172459982849,1540069659717812224,2022-06-23,Quintou pra quem tem put https://t.co/sX6nbKAgZ6
51,79495209,1539998889864036358,2022-06-23,Acabou de publicar uma foto em WF_BikeMeter https://t.co/QK3hAhdXLq
52,203973686,1539957750775545857,2022-06-23,"I'm at Estação Jabaquara (Metrô) in São Paulo, SP https://t.co/gQQu6CoUNj"
53,1390931250,1539951942327103490,2022-06-23,Bíblia Verso do Dia (Isaías 55:8)... - 23/06/2022 em Condominio Residencial Castelo Branco https://t.co/6FBpDCjI6B
54,1390931250,1539949317934530562,2022-06-23,Imagem do versículo do dia (Mateus 7:8 NVI)... - 23/06/2022 em Condominio Residencial Castelo Branco https://t.co/sMY27o0osK
55,70837769,1539942764435181573,2022-06-23,Acabou de publicar uma foto em Diocese de Santo Amaro https://t.co/6Yf7gzJI1v
56,145095920,1539928286720958464,2022-06-23,Ser feliz é simples❤️ em Rua Do Céu https://t.co/d01m5WKRPe
57,318178951,1539924052772528130,2022-06-23,"Segundo dia de @abrafatishow 
#feira #congresso #fotocorporativa #fotodecongresso #eventoscorporativos em São Paulo Expo https://t.co/AbrAa1GC9c"
58,38160791,1539904393025404929,2022-06-23,"Dia de reunião com as meninas da @imatextil #tecidoslindos #inverno23 #bh em Aeroporto De Congonhas, São Paulo - SP https://t.co/hmzqwLPhp6"
59,38160791,1539885600450428928,2022-06-23,"Preparados para o festival de Glastonbury?? Relembre os looks de outras edições 😉 #festival #glastonburyfestival #england em Aeroporto De Congonhas, São Paulo - SP https://t.co/V6ljr2oa3w"
60,1413000893264449537,1539854996203864064,2022-06-23,✌ https://t.co/tcvlk9dKTo
61,1420927006535995398,1539777320675934215,2022-06-23,"I'm at Aeroporto de São Paulo / Congonhas in São Paulo, SP https://t.co/wqFT9ytizP"
62,712803270155235328,1539755180241129473,2022-06-22,"Modelos de box em vidro temperado incolor. Orçamentos através de nosso WhatsApp Comercial 11 35305500 

#proglassvidros #boxbanheiro #boxemvidro #zonasul #contato #whatsapp📲1135305500 https://t.co/AIkIXSNZMZ"
63,832847128997289984,1539733586382684165,2022-06-22,Feira Fispal. em São Paulo Expo https://t.co/47r4uqvBas
64,203973686,1539704229933096961,2022-06-22,"I'm at Terminal Metropolitano Jabaquara (EMTU) in São Paulo, SP https://t.co/VsS18kU1Ks"
65,203973686,1539703938164867073,2022-06-22,"I'm at Estação Jabaquara (Metrô) in São Paulo, SP https://t.co/rpTCWXQsDG"
66,14452348,1539673864132771842,2022-06-22,"It is hard to stop loving the ocean, even after it has left you gasping
…
…
#symmetry #contrast #LIV4NATGEO
#standuppaddle #sup #seaside @ Barra do Sahy https://t.co/WfEBInrgbO"
67,1449587426104578048,1539648347572580352,2022-06-22,@goneprodsuga BUENWSSSSSSS TARDESSSSSSSSSSSS
68,131494231,1539645457734975488,2022-06-22,"Querida rede! Divulgue, encomende, fique feliz! 
#chefnanacampello #NanaCampello #chefemcasa #refeiçõesdiferenciadas #cozinhaautoral em Conceição Zona Sul https://t.co/b7yG1rFsYy"
69,3240827291,1539639217034330116,2022-06-22,Acabou de publicar uma foto em Carro 0 https://t.co/Jw6QkWJaAd
70,381667552,1539617280887324676,2022-06-22,Acabou de publicar uma foto em Fispal Tecnologia https://t.co/QR9PweU1Qx
71,497367354,1539597183577620480,2022-06-22,Acabou de publicar uma foto em Vila Santo Estefano https://t.co/vMc8dUfDTB
72,89255134,1539595172853547008,2022-06-22,"Bom dia ☕

O Programa VIVIANE VIDMAR pela TV CINEC de ontem foi um sucesso!!!

Gratidão ❤🙏 em Tv Cinec https://t.co/xxUt11njvx"
73,94150452,1539594876299247616,2022-06-22,Acabou de publicar uma foto em Akira Motors Preparações https://t.co/BvJFR7JCR4
74,1390931250,1539584637789519874,2022-06-22,Bíblia Verso do Dia (1 Timóteo 2:5)... - 22/06/2022 em Condominio Residencial Castelo Branco https://t.co/S3qwXn3JE7
75,203973686,1539578686181150721,2022-06-22,"I'm at Estação Jabaquara (Metrô) in São Paulo, SP https://t.co/O32KMhWnUM"
76,1390931250,1539572777425960962,2022-06-22,Imagem do versículo do dia (Provérbios 9:10 NVI)... - 22/06/2022 em Condominio Residencial Castelo Branco https://t.co/ytmWqWOiSJ
77,195039517,1539566009044144128,2022-06-22,#BomDia #QuartaFeira #meta #sonho #obejtivo #foco #determinação #força #resultado #fé #Sp #Brasil em Danilo Souza - Consultor Financeiro https://t.co/h7CswLsg2W
78,91103142,1539559683689746435,2022-06-22,Acabou de publicar uma foto em Zona Sul de São Paulo https://t.co/i3NvOMoiLR
79,713415429029552129,1539540629079859200,2022-06-22,"Recarregando as energias 😀 em Aeroporto De Congonhas, São Paulo - SP https://t.co/bxmKTkNlyJ"
80,736680582822907904,1539533419884994561,2022-06-22,"Uma ótima quarta-feira pra todos! em Vila Guarani, Zona Sul - Sp https://t.co/dE0HhlJPqd"
81,736680582822907904,1539527551562940416,2022-06-22,"Uma quarta-feira abençoada pra todos 🙏😇 em Vila Guarani, Zona Sul - Sp https://t.co/N5SnZyqOQl"
82,1413000893264449537,1539473475781394432,2022-06-22,✌ https://t.co/c3am8Ehkdn
83,736680582822907904,1539438717764444160,2022-06-22,"Uma ótima noite de terça-feira a todos! em Vila Guarani, Zona Sul - Sp https://t.co/Pb9399jaok"
84,920102627211382784,1539426724848582656,2022-06-22,Acabou de publicar uma foto em Esmalteria Vivian Sampaio https://t.co/LLf7ZqAlrv
85,920102627211382784,1539425949187309569,2022-06-22,Acabou de publicar uma foto em Esmalteria Vivian Sampaio https://t.co/bmYV8itSFr
86,920102627211382784,1539425203343835141,2022-06-22,Acabou de publicar uma foto em Esmalteria Vivian Sampaio https://t.co/YNXXlhK8yn
87,920102627211382784,1539423920192905216,2022-06-22,Acabou de publicar uma foto em Esmalteria Vivian Sampaio https://t.co/y8HCDL4eQx
88,736680582822907904,1539419636579508224,2022-06-22,"Uma noite abençoada a todos! 🙏 em Vila Guarani, Zona Sul - Sp https://t.co/ojm7DwfLBo"
89,904265844468920320,1539374724119240705,2022-06-21,Acabou de publicar uma foto em Vila Guarani - Jabaquara https://t.co/JEDHaoTtI1
90,309691828,1539358354790879232,2022-06-21,Acabou de publicar uma foto em Ellegancy Costuras https://t.co/ByKkAGEjhZ
91,34176667,1539354276182597634,2022-06-21,"Mon cœur qui bat em Aeroporto De Congonhas, São Paulo - SP https://t.co/AyZZmpxjUE"
92,203973686,1539280260667260929,2022-06-21,"I'm at Terminal Metropolitano Jabaquara (EMTU) in São Paulo, SP https://t.co/P2hSzgPBIP"
93,4774985296,1539269741025628161,2022-06-21,Na Fispal / São Paulo!! Venham nos visitar!! https://t.co/d9spI6GmgV
94,203973686,1539258506628452352,2022-06-21,"I'm at Estação Jabaquara (Metrô) in São Paulo, SP https://t.co/2yYb58xzxM"
95,61850588,1539241721241927683,2022-06-21,Acabou de publicar uma foto em Campo Belo (district of São Paulo) https://t.co/H2N3mEd7a3
96,61850588,1539240214354444291,2022-06-21,Acabou de publicar uma foto em Campo Belo (district of São Paulo) https://t.co/oU76ln9m53
97,56807544,1539237947874082817,2022-06-21,"Excelente dia pra você!
#carpediem em Zona Sul de São Paulo https://t.co/u7KvVlq47Y"
98,1390931250,1539226338166550530,2022-06-21,Bíblia Verso do Dia (Romanos 15:13)... - 21/06/2022 em Condominio Residencial Castelo Branco https://t.co/okdQqTkQLH
99,1390931250,1539224657680814086,2022-06-21,Imagem do versículo do dia (Provérbios 4:23 NVI)... - 21/06/2022 em Condominio Residencial Castelo Branco https://t.co/7HSMx7MKXi
100,497367354,1539220289866846210,2022-06-21,Acabou de publicar uma foto em Vila Santo Estefano https://t.co/bTA3moistg
101,904265844468920320,1539210876716195840,2022-06-21,Acabou de publicar uma foto em Vila Guarani - Jabaquara https://t.co/zovG1fJQcz
102,195039517,1539201224196493313,2022-06-21,#BomDia #terçafeira #meta #sonho #objetivo #foco #determinação #fé #resultado #força #Investimento #imovel #Sp #Brasil em Danilo Souza - Consultor Financeiro https://t.co/e4IJAGsnyn
103,1154204226299551745,1539174673094791168,2022-06-21,"Tudo caro no aeroporto, ao menos a água é de graça"
104,420277730,1539096929988235266,2022-06-21,Acabou de publicar uma foto em Sao Paulo e Rio De Janeiro https://t.co/1qTfueYenX
105,3127024384,1539005573177430018,2022-06-20,cada uma q eu me meto uauauaua
106,304513033,1539002975548489729,2022-06-20,🏃🏃🏃🏃 https://t.co/ONIE50M0Lx
107,1472632533489700874,1538983300689235974,2022-06-20,"Business woman, ok?! ✈️ https://t.co/c2EO3S1sUI"
108,47767246,1538970373186015232,2022-06-20,"I'm at Aeroporto de São Paulo / Congonhas in São Paulo, SP https://t.co/7XWX49a7dV"
109,1472632533489700874,1538965710818484226,2022-06-20,"Viajada família, esqueça tudo 🙅🏼‍♀️ https://t.co/2gqMsrDBrY"
110,232619032,1538962235090821120,2022-06-20,Acabou de publicar uma foto em Campo Belo (district of São Paulo) https://t.co/9A9Kwmcwxb
111,900895731166228480,1538942010912133120,2022-06-20,Just posted a photo @ Catland https://t.co/HAHgIjZlsz
112,66783903,1538932757170073601,2022-06-20,Acabou de publicar uma foto em Centro De Treinamento Paralímpico Brasileiro https://t.co/KHjjceB3XC
113,71149377,1538928125689700353,2022-06-20,"Ficar muito na matrix fez mal mesmo pro Neo
O brother até esqueceu que sabe voar https://t.co/PGAXstjbwy"
114,203973686,1538918780818100224,2022-06-20,"I'm at Terminal Metropolitano Jabaquara (EMTU) in São Paulo, SP https://t.co/gs6gEtA7v2"
115,86539609,1538905729754619904,2022-06-20,Essa folgada dessa humana não aparece a uma semana e acha que está tudo bem???? Não vamos deixar ela trabalhar!!! em Bello Zapte Advogados https://t.co/jUfPsoQJHd
116,128124649,1538903485806166016,2022-06-20,"Exercendo o meu papel de tio da Mel, filhotinha do @mauricioamaralaraujo e da @janajanasoares 

Ela foi a melhor notícia desse período de pandemia, um raio de sol nesse período nebuloso. ❤️ em Conceição Zona Sul https://t.co/y4D0SfMCWK"
117,203973686,1538880642506706945,2022-06-20,"I'm at Estação Jabaquara (Metrô) in São Paulo, SP https://t.co/UKDlz2jVVc"
118,1532438593137954827,1538874287020462080,2022-06-20,"Vanny Ferro A Vauqueira Soberana - No Programa do Amigo Miguel e Convidados TV Cinec  São Paulo.
Participação Anna Clara. ( Mãe e Filha) #programabutecodosabadoshow #vaqueirasoberana #apresentadoravanyferro #annaclara #tvcinec https://t.co/QvpF6Lr6JM"
119,1390931250,1538862694077321216,2022-06-20,Bíblia Verso do Dia (Efésios 4:15)... - 20/06/2022 em Condominio Residencial Castelo Branco https://t.co/BtDGzgnwPA
120,1390931250,1538860618765189120,2022-06-20,Imagem do versículo do dia (Salmo 113:3 NVI)... - 20/06/2022 em Condominio Residencial Castelo Branco https://t.co/ZCyg84TRGq
121,33386496,1538858247733452801,2022-06-20,Acabou de publicar uma foto em Festival do Japão https://t.co/IcyGsdjFyZ
122,167051866,1538855033617399808,2022-06-20,Acabou de publicar uma foto em Estação São Judas https://t.co/PMN7KcuJ9l
123,736680582822907904,1538807412303482882,2022-06-20,"Uma ótima semana a todos! em Vila Guarani, Zona Sul - Sp https://t.co/1tM9rX4g12"
124,736680582822907904,1538805777351069696,2022-06-20,"Uma semana abençoada a todos! em Vila Guarani, Zona Sul - Sp https://t.co/svmGk7qLZl"
