,author_id,tweet_id,created_at,text
0,41267822,1539734226760777728,2022-06-22,"Acabou de publicar uma foto em Jardim Da Saude, Sao Paulo, Brazil https://t.co/wMHrJWmaJr"
1,1535350372428042242,1539636089916358657,2022-06-22,"- fazer massagens é minha especialidade 🍃🙏💫🔥 
#massagens  #massagem #erotico  #sensual  #sexo  #prazer  #orgasmo  #sensação https://t.co/d8BLFGqP8U"
2,1613027815,1539615414983983106,2022-06-22,"Se coloque em destaque !

Adquira seu Plano de Saúde e  tenha autonomia para cuidar do que você tem de mais precioso, sua Vida !

Temos Planos de Saúde e Odontológicos: (Individual / Familiar / Adesão / MEI / Empresas)

Saiba Mais, nos Contacte já!

Robson Pereira Consultor ! https://t.co/j2erc4BeKm"
3,280194491,1539615155893555201,2022-06-22,"#vivaosus 
#4dose 
#lula2022 
#foragenocida
#50anos
#BRASIL
#brasillivredebolsonaro
Finalmente #imunizada!! em Ubs Vila Das Merçes https://t.co/3IsUwfgdCc"
4,981333167515881472,1539603685029953537,2022-06-22,"Seja humilde ao ver seus erros, corajoso para admiti los e sábio o suficiente para corrijo los.

Borá pra cima 🚀🚀🚀 em Clube Trackday https://t.co/vNmbY1rK2V"
5,16816428,1539584272062988289,2022-06-22,https://t.co/u7YyxaIA2F
6,3788815469,1539563327818551298,2022-06-22,Acabou de publicar uma foto em Camila's Cake Dog - Bolo pra Cachorro https://t.co/UNydx3PapS
7,78108494,1539560993034059777,2022-06-22,Acabou de publicar uma foto em Jardim Botânico de São Paulo https://t.co/WCAjkcXkyP
8,41267822,1539440098353336322,2022-06-22,"Acabou de publicar uma foto em Jardim Da Saude, Sao Paulo, Brazil https://t.co/aeAboGBMeo"
9,1580111216,1539403546717786113,2022-06-22,Acabou de publicar uma foto em Poetas Do Século 21 https://t.co/SFiwvAXU3c
10,41267822,1539350393842413568,2022-06-21,"Acabou de publicar uma foto em Jardim Da Saude, Sao Paulo, Brazil https://t.co/VwyZrGSdB0"
11,1613027815,1539249446504079360,2022-06-21,"Conquiste seu Plano de Saúde, ele é seu passaporte para curtir a Vida Plena!

Temos Planos de Saúde e Odontológicos: (Individual / Familiar / Adesão / MEI / Empresas)

Saiba Mais, nos Contacte já!

Robson Pereira Consultor Planos de Saúde e Odontológicos 
Whats (11) 96641-5887 https://t.co/x4gm4W4mfI"
12,981333167515881472,1539236183082840064,2022-06-21,Acabou de publicar uma foto em Clube Trackday https://t.co/gNMMnHizXZ
13,981333167515881472,1539218995919958017,2022-06-21,"O sucesso não vem para você porque você o quer.
O sucesso vem a você porque você fez as coisas certas.

@sadhguru @sadhgurubrasil 

Boa time que final de semana incrível. em Clube Trackday https://t.co/IFDnmu30Og"
14,3788815469,1539208679743946753,2022-06-21,Acabou de publicar uma foto em Camila's Cake Dog - Bolo pra Cachorro https://t.co/QJuuBlJQf7
15,41267822,1539162774215041025,2022-06-21,"Acabou de publicar uma foto em Jardim Da Saude, Sao Paulo, Brazil https://t.co/l6KLb2GvfW"
16,41267822,1539072100463521792,2022-06-21,"Acabou de publicar uma foto em Jardim Da Saude, Sao Paulo, Brazil https://t.co/Eu5WuYF3Wz"
17,41267822,1538912643930521601,2022-06-20,"Acabou de publicar uma foto em Jardim Da Saude, Sao Paulo, Brazil https://t.co/MFvVtYMAqD"
18,3788815469,1538834417610899456,2022-06-20,Acabou de publicar uma foto em Camila's Cake Dog - Bolo pra Cachorro https://t.co/H30RulAWOa
19,3788815469,1538486252332359681,2022-06-19,Acabou de publicar uma foto em Camila's Cake Dog - Bolo pra Cachorro https://t.co/HTPSR7cp7a
20,736511804323581952,1538334095310262277,2022-06-19,"Quase um Jeca Tatu em Moinho Velho, São Paulo - SP https://t.co/gDOwPFY0W6"
21,736511804323581952,1538207627246809088,2022-06-18,"Acende a fogueira! em Moinho Velho, São Paulo - SP https://t.co/SXCU9HYQsz"
22,397615222,1538186939131731969,2022-06-18,Um dia frio! Um bom lugar pra ler um livro... ❄️❄️☕🍷🍫 em Vila das Mercês https://t.co/vzeWasrM0g
23,41267822,1538157695286517760,2022-06-18,"Acabou de publicar uma foto em Jardim Da Saude, Sao Paulo, Brazil https://t.co/dJ75bbV2i5"
24,340611708,1538156016826732544,2022-06-18,Acabou de publicar uma foto em Conservatorio Musical Jardim America https://t.co/nTgfNoH9Mi
25,3788815469,1538150692074004480,2022-06-18,Acabou de publicar uma foto em Camila's Cake Dog - Bolo pra Cachorro https://t.co/iHDbCt70gm
26,227078929,1538138171258548225,2022-06-18,Fique perto de quem transmite paz! em Piracaia https://t.co/7qMVzeakRC
27,227078929,1538136894734798849,2022-06-18,Almoço com o Senhor e Senhora Aranega Moretto ♥️ em Piracaia https://t.co/GH0dlCUdnn
28,227078929,1538135760821428224,2022-06-18,E o rolê que vínhamos combinando a anos saiu! Amo vocês meus lindos. em Piracaia https://t.co/beeUh6gTMh
29,981333167515881472,1537943628286291968,2022-06-17,"Começamos o dia bem hoje.
Uma correria danada.
Mal consegui fazer os posts.
Amanhã gero mais conteúdo para a galera nos aguarde. em Clube Trackday https://t.co/xBHA0eyinE"
30,35540986,1537926121567571970,2022-06-17,"Dia lindo e ensolarado no Jardim Botânico de São Paulo, com direito a macaquinhos macios pulando nas árvores ☀🍃🐒 em Jardim Botânico de São Paulo https://t.co/GzwuaU7d0c"
31,41267822,1537873040696279040,2022-06-17,"Acabou de publicar uma foto em Jardim Da Saude, Sao Paulo, Brazil https://t.co/0RdQQDT6YN"
32,1139855955951329282,1537805222520795137,2022-06-17,Meu e esse frio em SP o bico do peito roçando na camiseta e o tesao só aumenta caramba que tesão pra ser chupado vem... #peitodehomem #peitinho #chupameupeito #urso #tesaozinho https://t.co/oxRscr7pJe
33,1613027815,1537803389215690755,2022-06-17,"Ainda que parecendo contrário, ter um Plano de Saúde é a opção mais econômica.

Consultas, Exames particulares se tornam muito custoso, sem falar em Internações e Cirurgiãs.

A comodidade, tranquilidade, segurança em ter atendimento no momento que precisar! https://t.co/9pBUE09mhD"
34,3788815469,1537758545306861568,2022-06-17,Acabou de publicar uma foto em Camila's Cake Dog - Bolo pra Cachorro https://t.co/cEIRhsYy7f
35,1537690708894797825,1537693866844880897,2022-06-17,https://t.co/IeulnKwjdg
36,41267822,1537604906227486721,2022-06-17,"Acabou de publicar uma foto em Jardim Da Saude, Sao Paulo, Brazil https://t.co/o1xcEpnsoL"
