,author_id,tweet_id,created_at,text
0,48161519,1536065299027468288,2022-06-12,"Demorou, mas saiu o churras ""pós"" pandemia hahaha
Já podemos repetir!!
Foto perdida na galeria.
De abril/maio hahaha
.
.
.
#churrasco #churras #unifesp #unifesppravida #tchurma #farmacia #nakamas #pandemia https://t.co/mhTqkLZ5tR"
1,312699472,1536041078163382272,2022-06-12,Parabéns a todos os companheiros de ministério em ADF-Jd.Grimaldi https://t.co/qoJQy8WRyV
2,128124649,1536023385578295298,2022-06-12,Melhor época do ano! Festas juninas rules! em Colorado City https://t.co/UOcmqYgVHQ
3,1440604975311122434,1535949998571102210,2022-06-12,@thicico @Fabiomarbinho Minha musa d Twitter  ....kkkkk  bora
4,1444686556850237449,1535949122959646720,2022-06-12,Alguém está moça 🥱😌 em Mc Donalds https://t.co/MWkYU9U5v3
5,1448607396843200512,1535945135401230337,2022-06-12,"Feliz dia dos Namorados para nós minha gata @jessyholanda7 

12 anos comemorando essa e todas as outras data com prazer de te ter ao meu lado.

Gratidão por ter você ao meu lado ❤️ em Aricanduva https://t.co/mlvAdm33tY"
6,1440604975311122434,1535944894614749184,2022-06-12,@esquerdeando Bd    com certeza    Pena  não vai ser ...na  Zl  Paulista  ....
7,1380246692046512130,1535623468263395328,2022-06-11,Olha esse corte de milhões antes e depois super recomendo  👌 https://t.co/FXbAud6qRw
8,175234504,1535407662367662081,2022-06-10,Meu amigo Buzz Lightyear e eu ❤️✨ em Cinemark Aricanduva https://t.co/q6Fa7veExc
9,1678847384,1535393166874099715,2022-06-10,Just posted a video @ Marrocos https://t.co/QOvmKymeTu
10,1448607396843200512,1535226388210364417,2022-06-10,Acabou de publicar uma foto em Aricanduva https://t.co/8tnba0WQlX
11,131846639,1535210364924723200,2022-06-10,Assaí sempre pensando na gente e hoje é dia Proteína #somostodosassai em Central Administrativa Assaí https://t.co/W7J8rz49zJ
12,1448607396843200512,1534870603613757440,2022-06-09,"O que mais chama a sua atenção nessa tattoo?

Diga aqui pra mim.

E se gostou dessa tattoo compartilha com quem você conhece q irá pirar em ter uma tattoo nesse nível em Aricanduva https://t.co/fXwSkMfnkd"
13,221156709,1534525981414891520,2022-06-08,Acabou de publicar uma foto em Templo Zulai https://t.co/MWx9YMxAEp
14,320445568,1534353974089986049,2022-06-08,"A empresa EQC Confecções moda praia, fitness e esportiva, localizada n ZL próximo do shopping Aricanduva.

Está contratando:

“COSTUREIRA” E “PILOTEIRAS”

Venha fazer parte do nosso time ? Vem ? https://t.co/TlBgwppddI"
15,1276860184560914432,1534327495297728513,2022-06-08,Acabou de publicar uma foto em Jardim Sinhá https://t.co/UqpDtkMbIW
16,1276860184560914432,1534327045047582722,2022-06-08,Acabou de publicar uma foto em Jardim Sinhá https://t.co/RAA3QSXXL2
17,1276860184560914432,1534326817334738944,2022-06-08,Acabou de publicar uma foto em Jardim Sinhá https://t.co/iWFnX8Dulf
