,author_id,tweet_id,created_at,text
0,1519778644733968385,1534634665482637317,2022-06-08,17h34 e a capital paulista está assim... https://t.co/SeLws6RjH7
1,1454532585355366413,1534537523640385538,2022-06-08,Veja essa postagem de Bianco Despachante no Alto da Lapa no Google: https://t.co/CuaLhP86QN
2,1454532585355366413,1534537065890725888,2022-06-08,Veja essa postagem de Bianco Despachante no Alto da Lapa no Google: https://t.co/2g2fUEPd0s
3,1454532585355366413,1534536817202044928,2022-06-08,"Confira a empresa Bianco Despachante no Alto da Lapa no Google!
https://t.co/HiCpLPLbcQ"
4,1454532585355366413,1534536407880019970,2022-06-08,Bianco Despachante no Alto da Lapa no Google: https://t.co/B2husahKXO
5,59619515,1534484614756040704,2022-06-08,Bom dia para alguns 😌🤭
6,209026290,1534382061129281536,2022-06-08,Acabou de publicar uma foto em SERVA - Sociedade Esportiva e Recreativa de Vila Anastácio https://t.co/3jfGEVDgOG
7,1400518632002699270,1534346114182402049,2022-06-08,Acabou de publicar uma foto em Renault Itavema France - Guarulhos https://t.co/5IyPLnofEq
8,280705494,1534233438592458752,2022-06-07,Acabou de publicar uma foto em São Paulo Fashion Week https://t.co/2pZ0T4OU0h
9,92743535,1534223328239566855,2022-06-07,"All black 
#usemascara em Vila Leopoldina https://t.co/jEWt0QUN8w"
10,15997446,1534213581608259585,2022-06-07,"Martin Passion é um cantor e compositor de reggae roots, da Baixada Fluminense-RJ, com influência de grandes nomes como Bob Marley, Gregory Isaacs, Jimmy Cliff, Burning Spear, Alpha Blondy, dentre outros.

Garanta já seu acesso e assista em https://t.co/mZUNMWa6sD https://t.co/ODPklw9zKU"
11,1521167272760512517,1534170889411084289,2022-06-07,Massagem no jaguare Osasco são paulo https://t.co/dzY7iJ0Hgg
12,143919568,1534113561101930496,2022-06-07,Just posted a photo @ Afresp Guarulhos https://t.co/vBUw5Pd2VP
13,14409620,1534053382767394816,2022-06-07,Acabou de publicar uma foto em São Paulo Fashion Week https://t.co/HQqqHDGg06
14,1400518632002699270,1533886779358519296,2022-06-06,"ESCOLHA A VERSÃO QUE MAIS COMBINA COM VOCÊ!!!
Venha Realizar seu Sonho.
Financiamento 100% s/entrada. em Renault Itavema France - Guarulhos https://t.co/uMuVQDs7up"
15,209026290,1533861598179254279,2022-06-06,"Futsal Masculino Adulto - 07/06  Próxima Terça-feira às 20:30 horas.
Venha Torcer e Prestigiar !

🇧🇷Não é uma fase, é historia.
🇭🇺Ez nemcsak egy időszak, ez történelem. https://t.co/6ZR49Q4ikS"
16,107866461,1533767741072605184,2022-06-06,Iniciando preparação pro dia 12/06 em Vila Leopoldina https://t.co/34HClgNUXU
17,196780891,1533608277937999872,2022-06-06,I'm at Festival de Sopas CEAGESP in São Paulo https://t.co/w2MFAQkKRF
18,36289190,1533597257416814593,2022-06-05,Acabou de publicar uma foto em Vila Leopoldina https://t.co/mIwglWnHjn
19,147349751,1533597245966262272,2022-06-05,@tarcisiogdf @P62minutos @JovemPanNews @augustosnunes @silvionavarro @roserochabr @realpfigueiredo Quero saber como vc vai resolver isso aqui (favela São Remo no Jaguaré): https://t.co/nJ0IwiqInO
20,984563504,1533580882283376640,2022-06-05,"Gratidão por essa conquista que, mesmo após mais de 2 anos, aconteceu e foi incrível graças a vocês. Gratidão por ter vocês. 🎓💚 em Vila dos Ipês https://t.co/4OPFX3119r"
21,209026290,1533520055715221505,2022-06-05,"Domingo na SERVA,  é dia de rever amigos !

🇧🇷Não é uma fase, é historia.
🇭🇺Ez nemcsak egy időszak, ez történelem. em SERVA - Sociedade Esportiva e Recreativa de Vila Anastácio https://t.co/2ZIqqJ2Ico"
22,821748708,1533519858763288576,2022-06-05,Acabou de publicar uma foto em YAH Church https://t.co/7wZsuvvMAI
23,58622902,1533498968449196033,2022-06-05,"Dia Mundial do Meio Ambiente. Preserve hoje e sempre. Da praça que adotamos até o plantio de cada semente de fruta consumida. Preserve. Nosso futuro merece e precisa. 
🌳👧🏾👦🏼🐾🦜🌍 em Alto da Lapa https://t.co/AVxykdZwwb"
24,107866461,1533477957494112257,2022-06-05,Começando preparativos 5.2 turbinado em Martese Alto da Lapa https://t.co/jYj5d7JQti
25,1512944124504293382,1533235890964905984,2022-06-04,https://t.co/xpGiZPLecl
26,714530250747674624,1533132711082315776,2022-06-04,Sorrir aguça a alma https://t.co/noTRtCLB9C
27,14409620,1533085064732545025,2022-06-04,Acabou de publicar uma foto em São Paulo Fashion Week https://t.co/5fo6jRuQaQ
28,14409620,1533077888303566849,2022-06-04,#SPFWn53 Três looks que amei e usaria do @rociocanvas na @spfw em São Paulo Fashion Week https://t.co/agx3SXR0TO
29,1549123820,1533073883070402565,2022-06-04,"Fim do job 
Muito obrigado a todos que fizeram parte deste projeto maravilhoso .
Que venha os próximos em Studio Pier 88 https://t.co/kfbgCUgoC0"
30,19153554,1532937915009048577,2022-06-04,"Vendido em 49 dias | Cond. Alto do Bosque - V. Leopoldina | Apto 117m2, 3 dorms, 1 suíte, varanda gourmet, 2 vagas, depósito, andar alto | Busca do imóvel no perfil desejado e parceria na viabilização do negócio | WhatsApp 11-9-9882-4334 | Vagner Vichiesi | CRECI 225.195-F https://t.co/NtQOKpbDBw"
31,1508233160240373770,1532870795323752448,2022-06-03,Menina risonha que rir e que sonha 🥰 https://t.co/xTomDbI7UO
32,15997446,1532811079428067335,2022-06-03,Lançamento! Caburé Canela foi atração do Estúdio Showlivre e o álbum já está disponível nas principais plataformas de streaming https://t.co/bHVglz2Yeu e a apresentação no YouTube https://t.co/DQcCI0fSF7 🎶 https://t.co/uqeUXfd8lz
33,15997446,1532756790374502402,2022-06-03,"Jean Tassy será atração do Palco Showlivre 25/06, em São Paulo. Evento será no City Lights Music Hall e terá formato híbrido, com transmissão via ShowlivrePlay.

https://t.co/enIqezvcd4"
34,1098372563279982592,1532748294480445444,2022-06-03,"#always🧙 

Afinal, aquilo que amamos sempre será parte de nós.

#potterhead #harrypotter #griffyndor #wizard #happy #love #pride #gaysp #instagay #pride em Grifinnória Café &amp; Afins https://t.co/OlKRtAfTmo"
35,1113438091396689920,1532668667028185088,2022-06-03,https://t.co/aqw38Vv1Lx
36,1113438091396689920,1532668622186889216,2022-06-03,Tc cenográfia https://t.co/HgNbKOh7ZO
37,60149264,1532555882013368323,2022-06-03,Just posted a photo @ YAH Church https://t.co/xGKiVyoevz
