,author_id,tweet_id,created_at,text
0,209026290,1622724882952773632,2023-02-06,Acabou de publicar uma foto em SERVA - Sociedade Esportiva e Recreativa de Vila Anastácio https://t.co/VlHnNMYba8
1,1076106932807708673,1622687631023738896,2023-02-06,Acabou de publicar uma foto em Rodoviária Tietê https://t.co/hKbiLJuVHG
2,209026290,1622635401386098691,2023-02-06,Acabou de publicar uma foto em SERVA - Sociedade Esportiva e Recreativa de Vila Anastácio https://t.co/73UufMRtpz
3,260414894,1622566429802344450,2023-02-06,Acabou de publicar uma foto em 42studio https://t.co/WRc7uWLB3x
4,1482218364739231744,1622561848020140036,2023-02-06,"Bom dia.
Como estamos nesse dia?
https://t.co/7VrHVY9AU8 https://t.co/5XMG3FuEen"
5,376488056,1622414020287373313,2023-02-06,Final de tarde com os migos que sp nos presenteou.. 🤍🫶🏻 https://t.co/bEGA0aLLyB
6,803614325516763136,1622373551960428552,2023-02-05,https://t.co/f1tETmOimv
7,1403137449069531142,1622344208504823809,2023-02-05,Alguém de perto ? https://t.co/RPiKZH7EOg
8,2180286736,1622342193422778371,2023-02-05,"Cara! Como eu amo ir em eventos da PlayStation. Cá estou no Parque Villa Lobos ""cobrindo"" essa campanha sensacional que a @PlayStation_BR está promovendo para nós jogadores!
Obrigado mais uma vez pessoal PS por mais essa experiência incrível!!! 💙💙💙
#LiveFromPS5 #PlayStation https://t.co/XyQRzRuS4A"
9,1511426793781268487,1622335988960739330,2023-02-05,Mood de hoje: Um pouco de treino um pouco de breja https://t.co/Fe9Db2KM8B https://t.co/rEgvt9HRDR
10,36407991,1622322201906057226,2023-02-05,Pronto para Worka! em Villa Lobos Office Park https://t.co/qEZHrVD0P8
11,286239066,1622319049886818307,2023-02-05,Perdemos mas tá safe 🏆🎮 @ CBLOL https://t.co/q1bst4DEl8
12,31882425,1622251499500740608,2023-02-05,"Resolvi respirar um pouco. Acabei encontrando um certo martelo...
Será que sou digna?
 #GoW #GodOfWarRagnarok #playstation5 #PS5 em Parque Villa-Lobos https://t.co/BOAS3YMYZp"
13,209026290,1622208553015545857,2023-02-05,"Ontem (04/02) tivemos a visita do Sr. Lendres Nagy, mora em Chapecó e está conhecendo SP, e aproveitou pra conhecer a SERVA e retirar sua camisa,  e trouxe várias delícias da Culinária Húngara. https://t.co/euGvSheVmV"
14,2741840722,1622169358423437312,2023-02-05,"Bom dia 
Mais um dia de trabalho com muita alegria 😁

☕❤️🇧🇷🦅 em Ceasa https://t.co/lUAYDvUwn3"
15,1097557838690426881,1622054768502882304,2023-02-05,"Graças a Deus que agora a gente pode comer muita ""picanha"" já que o ""amor venceu""👹👺 em Jumentolandia https://t.co/Jbq6vPvOfm"
16,67924410,1621953490770608128,2023-02-04,"É claro que iria visitar o ""Live From PS5"" no Parque Villa Lobos, em São Paulo, junto da @paulapt2k e também das crianças. Muito bacana ver o Marketing criativo da PlayStation. É ON FIRE! 😀 
#PS5 #PlayStation #LiveFromPS5 https://t.co/JHl5gKzpi2"
17,1618625541459902465,1621941920623730688,2023-02-04,Visitei esse Playstation gigante hahaha sensacional 👏🏼😍 #PS5 #saopaulo https://t.co/45s9X1FSfE
18,1322352224991879169,1621928700706017283,2023-02-04,"Semana passada alguém nesse site não recomendou este parque porque ele é um ""parque sem árvores""

Isso aqui deve ser tudo pôster https://t.co/t2OnarXzWc"
19,2835503128,1621852330361749504,2023-02-04,"Instalação de Fita de Led e Eletrofita para tomadas de sobrepor,cliente na Região de Domingos de Moraes,(Terá cimento queimado para esconder a eletrofita) contato para Orçamentos e parcerias (11) 98749-6712. https://t.co/RfqjBmivlz"
20,1076106932807708673,1621840500616470530,2023-02-04,Acabou de publicar uma foto em Rodoviária Tietê https://t.co/w69BH9CaMN
21,267293166,1621600299885404161,2023-02-03,"I'm at APAS - Associação Paulista de Supermercados in São Paulo, SP https://t.co/8UZFFOvu2V"
22,161410511,1621555844344061952,2023-02-03,"Massagem no jaguare Osasco são paulo 
https://t.co/P6GzcdOmk4 
11 95038 3489 https://t.co/27ZRgvZ9AG"
23,192795109,1621533455380283392,2023-02-03,"Socorro @PlayStation_BR  👀 #PlayHasNoLimits #PlayStation #PlayStation5  #PS5
#Gaymer #Games #Gay #LGBTQ🌈 https://t.co/mGBHsSbMic"
24,823513031636385792,1621512755428884481,2023-02-03,"Ok, até agora hj já foi muito legal.
A biblioteca do Villa Lobos definitivamente foi uma surpresa. https://t.co/EsKaeD6vRF"
25,703052556868689920,1621510215102500866,2023-02-03,Acabou de publicar uma foto em Vila Leopoldina https://t.co/BGqQkKrcWJ
26,63830471,1621460103789686784,2023-02-03,Just posted a photo @ Trilopez Assessoria Esportiva - Praça Barão Pinto Lima https://t.co/q2eeasTfhz
27,703052556868689920,1621248133194719233,2023-02-02,#livesonorização em Vila Leopoldina https://t.co/hywbkzLY6w
28,1076106932807708673,1621228495677591552,2023-02-02,Acabou de publicar uma foto em Rodoviária Tietê https://t.co/xZWqMpY242
29,1076106932807708673,1621191994331512832,2023-02-02,Acabou de publicar uma foto em Rodoviária Tietê https://t.co/mNHE9gHU8w
30,266953436,1621152058106843140,2023-02-02,Acabou de publicar uma foto em Teleperformance Crm https://t.co/SsU2LlbYvK
31,1076106932807708673,1621148928170414080,2023-02-02,Acabou de publicar uma foto em Rodoviária Tietê https://t.co/F3g8QaQcpg
32,1076106932807708673,1621128417235111937,2023-02-02,Acabou de publicar uma foto em Rodoviária Tietê https://t.co/2sdKtPM21Z
33,1076106932807708673,1621090699159429121,2023-02-02,Acabou de publicar uma foto em Rodoviária Tietê https://t.co/lGVvEbJIYd
34,1097557838690426881,1621078572533436416,2023-02-02,💸💸💸💸💸💸 em Jumentolandia https://t.co/816eeUzO6t
35,1076106932807708673,1620959849801449472,2023-02-02,Acabou de publicar uma foto em Rodoviária Tietê https://t.co/kwhVLDXiDU
36,43121095,1620926073494986753,2023-02-01,"Japa de noite... (@ Kaishi Sushi in São Paulo, SP) https://t.co/IFF3Bl3Jbq https://t.co/pKm7fG4N3K"
37,1076106932807708673,1620917884800081920,2023-02-01,Acabou de publicar uma foto em Rodoviária Tietê https://t.co/YNNxYpxi9e
38,1097557838690426881,1620909135205384203,2023-02-01,brasil em Jumentolandia https://t.co/WxzvHi4WIg
39,1076106932807708673,1620887762114166784,2023-02-01,Acabou de publicar uma foto em Rodoviária Tietê https://t.co/HwkH7nikXn
40,1076106932807708673,1620832985758171136,2023-02-01,Acabou de publicar uma foto em Rodoviária Tietê https://t.co/ZpQdX8Y4mo
41,59161686,1620821606393155588,2023-02-01,"Novos cursos / Workshops para esse ano de 2023
Confira!

Uma parceria Sincaesp e
@meiredenisetreinamentos em CEAGESP - Companhia de Entrepostos e Armazéns Gerais de São Paulo https://t.co/x6NC8GGOTG"
42,82940542,1620802272195235840,2023-02-01,"A melhor época do ano começa mais uma vez !!!

VIVA A MAIOR FESTA POPULAR DO BRASIL .
O MAIOR ESPETÁCULO DO MUNDO !!!
O CARNAVAL 😍
.
.
.
BATERIA SWING DA MADÁ em GRES Pérola Negra https://t.co/8RYYx1Ksjd"
43,1608207774613213184,1620707688035545089,2023-02-01,As madrugadas nesse ps não são mais as msm
44,55467929,1620613677001883650,2023-02-01,Estação Domingos de Morais 😊 em Estação Domingos de Morais - CPTM https://t.co/ZaxvvDqSdD
