,author_id,tweet_id,created_at,text
0,1507476252080459778,1547728042495119360,2022-07-14,A vida não ensina a ser forte ! Ela Obriga !! https://t.co/sRRQRTSJSx
1,1309849690947702785,1547710783244492800,2022-07-14,"Que tal aquele loiro de tirar o fôlego🤩

Já agendou seu horário ?
Corre link na bio 💁🏻‍♀️ em Ke Corazza Studio Hair https://t.co/YcTYHBLkFp"
2,1538284880538247175,1547663960903626752,2022-07-14,#tbt e saudades desse calor! https://t.co/OKdsBFwenT
3,407054185,1547640330723348487,2022-07-14,Fui ali almoçar e me deparei… https://t.co/lWIin6viUZ
4,1346299951572283393,1547419064972230659,2022-07-14,Padrinhos dos nossos queridos amigos Joyce e Gustavo. Que Deus abençoe essa união 💓 https://t.co/JJSO7BNx6a
5,267293166,1547394203008770049,2022-07-14,"Pré niver a gente tbm treina (@ Pro 3 Academia in São Paulo, SP) https://t.co/1TL344gq6b"
6,1403792579263672330,1547303259882328064,2022-07-13,"🖤 🤍 🦅
#sccp em Mooca https://t.co/01EGR6EaLN"
7,3350065960,1547275399087984643,2022-07-13,"Dia de Paulista Sub-20!
Vamos de Transmissão de Ibrachina x Assisense pela segunda rodada da segunda fase! https://t.co/iTs4EI22wM"
8,4715652562,1547251076721680384,2022-07-13,Acabou de publicar uma foto em Clube Atlético Juventus https://t.co/Uf1vr4ri5q
9,14418146,1547227366337953795,2022-07-13,"mystreetview project 
_
About the project (photographs of my view of city, click by cellphone)

#mystreetview #cellphoneproject em Mooca https://t.co/wPUl4uvWgA"
10,53929018,1547204621331988480,2022-07-13,Acabou de publicar uma foto em Buffet Planeta Kids Mooca https://t.co/9STmGVF4H5
11,1309849690947702785,1547186079337517056,2022-07-13,Acabou de publicar uma foto em Ke Corazza Studio Hair https://t.co/SQLybUgHzr
12,1527082163908317185,1547176409155751943,2022-07-13,50% quero dormir 50% quero morrer
13,333632346,1547070904730918913,2022-07-13,Acabou de publicar uma foto em Radio Tatuape FM https://t.co/Z08p9RQTAy
14,333632346,1547070164243562496,2022-07-13,Acabou de publicar uma foto em Radio Tatuape FM https://t.co/VB9Z73ARPI
15,1446203339507654660,1546951246149328896,2022-07-12,Acabou de publicar uma foto em COMIC BOOM https://t.co/g354ntbSzh
16,333632346,1546935837245538306,2022-07-12,Acabou de publicar um vídeo em Radio Tatuape FM https://t.co/z7hf0SmB14
17,18202406,1546921579065606147,2022-07-12,🙏
18,1440604975311122434,1546860651204812801,2022-07-12,"@RomuloBDias Ser muito canalha  esse velho escroto  ....foi o verme genocida  por uma grana p globosta  ...as cadelinhas   começaram  ...chamar Lula de violento  ...não sei como um bosta desse tá na ABL  
Inacreditável"
19,1309849690947702785,1546852397439483906,2022-07-12,Acabou de publicar uma foto em Ke Corazza Studio Hair https://t.co/K9pXhNA4B2
20,171481011,1546780118563045377,2022-07-12,Acabou de publicar uma foto em Mooca https://t.co/shvJgvFjNn
21,298757506,1546625671627247616,2022-07-11,"Encontros da vida !!!!!!
 na Vila Prudente em Vila Prudente https://t.co/vv2yqXvExz"
22,173957663,1546585301363179520,2022-07-11,Acabou de publicar uma foto em Mooca https://t.co/dxp1LGyGrt
23,4715652562,1546518470304468992,2022-07-11,Acabou de publicar uma foto em Clube Atlético Juventus https://t.co/lFHr8I07vc
24,171481011,1546441816454692866,2022-07-11,Acabou de publicar uma foto em Mooca https://t.co/u9cn1FcuJ0
25,1392139123968946184,1546290941383716865,2022-07-11,"Fomos à estréia do espetáculo teatral “O Muro de Sam”, no SESC Belenzinho. Produção impecável da Catarsis. Sou suspeito para falar mas não tenho como não dizer que está sensacional. Parabéns queridos. em Sesc Belenzinho https://t.co/fXdrM7wZvz"
26,60407664,1546283702300413952,2022-07-11,Celebrating my boss's 40th birthday and his son's 4th birthday. 🎂🎈🎉🥳 https://t.co/TOA0ummQqu
27,59038937,1546280505993216000,2022-07-10,"Meu adolescente,
Você falou hoje?
Te amo meu pivete,
😍😍😍 em Mooca é mooca, O Resto É Bairro. https://t.co/3tagx7dHPN"
28,714516409259335681,1546262260741439488,2022-07-10,"Final de semana de muito aprendizado 
 Seminário de Jiu Jitsu infantil 

Sempre evoluindo para trazer o melhor para nossa escola @ubatubatopteamoficial em Alliance Mooca https://t.co/hQXsERtmhR"
29,1253405977992445954,1546217659100008448,2022-07-10,esse lugar 🤍 (estava à espera das minhas melhores amigas estarem todas em são paulo pra irmos juntinhas) https://t.co/atlzbzLhXi
30,872998338328748032,1546183192880758784,2022-07-10,https://t.co/p5zgtApvH3
31,333632346,1546179441008599041,2022-07-10,Acabou de publicar um vídeo em Radio Tatuape FM https://t.co/JDFYPRhh0o
32,333632346,1546175234017054723,2022-07-10,Acabou de publicar um vídeo em Radio Tatuape FM https://t.co/qR1hYTlTgT
33,17724563,1546172046522163204,2022-07-10,Gatos. em Casarão Do Vinil https://t.co/dOsK5leF5f
34,2429206439,1546123240564719616,2022-07-10,Missa de domingo do @pejulio  com o sheikh Kaabi representante do Ayatollah Yakoubi do Iraque em vista ao Brasil https://t.co/5sqB0Y9eUV
35,78717458,1546107383499440129,2022-07-10,Pra mostrar o look https://t.co/EI6ZXJXyBn
36,171481011,1546081330961719297,2022-07-10,Acabou de publicar uma foto em Mooca https://t.co/8STcMB1SRR
37,1360083179428798464,1546042701661016066,2022-07-10,https://t.co/YtmWTdtbUx
38,333833257,1545987221399945216,2022-07-10,"Maratona Stranger Things
@aylalinda.8 
Yasmin em Mooca https://t.co/w13bSA6EZf"
39,1360083179428798464,1545982393974128641,2022-07-10,https://t.co/h5WRqT3doc
40,333632346,1545931549111046147,2022-07-10,Acabou de publicar um vídeo em Radio Tatuape FM https://t.co/zHFV99xUll
41,333632346,1545927312042065920,2022-07-10,😱 em Radio Tatuape FM https://t.co/TPTjHVdlI2
42,16169263,1545913973144489989,2022-07-09,Curtindo o Circo do Chaves 😃 https://t.co/3tx38Pmv91
43,767552771390316544,1545905513170337793,2022-07-09,E quem disse que não nos divertimos a noite #bakery #SaturdayNight https://t.co/3cmP7s9iqV
44,1478114393217024004,1545874402042167297,2022-07-09,"Andar de patins é muuuuuuito difícil, fica aqui a minha admiração para quem consegue"
45,333632346,1545836523446276099,2022-07-09,Robert De Niro on the set of Mean Streets (1973) em Radio Tatuape FM https://t.co/HsYUyDUL9a
46,54546952,1545832676187332611,2022-07-09,Cosmopolita! https://t.co/649E2qm7df
47,556230341,1545790844002652161,2022-07-09,"Acredito que em algum lugar desse extenso horizonte existam pessoas reais.
Pessoas que abracem com o coração, e que dancem com a alma.
Pessoas que não acreditem só nos sonhos, mas também na realizações deles. https://t.co/atHzZNQMLY"
48,90679489,1545788402095849473,2022-07-09,Fiquei mais jovem ao lado de dois jovens pastores! @felipeflnunes @raphael.abdalla em Pizzaria Bendita Maria https://t.co/WEmPoR98nT
49,47966229,1545757969031258112,2022-07-09,🦖🦕😍 em Jurassic Safari Experience https://t.co/CAD7IEtgkR
50,161709441,1545750002429005825,2022-07-09,Acabou de publicar uma foto em Mooca https://t.co/Occhui8Zqf
51,171481011,1545723017568845827,2022-07-09,Acabou de publicar uma foto em Mooca https://t.co/WX8aU4AgfI
52,47966229,1545589043085418499,2022-07-09,🦖🦕🥰😍 em Jurassic Safari Experience https://t.co/v6uWWInDSU
