,author_id,tweet_id,created_at,text
0,161709441,1554860036249239552,2022-08-03,Acabou de publicar uma foto em Mooca https://t.co/4fa5U8stgI
1,55748108,1554798682515460097,2022-08-03,Acabou de publicar uma foto em Vila Prudente https://t.co/zTffdebicH
2,596519318,1554792704885784576,2022-08-03,Acabou de publicar uma foto em Mooca Z-L https://t.co/xAGjNVefs5
3,596519318,1554658708180836357,2022-08-03,Acabou de publicar uma foto em Mooca Z-L https://t.co/TTw8NiQlRE
4,3539614648,1554584160957857792,2022-08-02,"Mais comida do final de semana: filé de peixe (zero ideia qual, não especificado) ao molho de camarões, farofa de banana, pirão, arroz e salada 🤤🤤🤤 https://t.co/PJPplhe10P"
5,596519318,1554534744729190400,2022-08-02,"Feliz aniversário Virgínia, prima linda! Que os anjos do Senhor estejam todo tempo guardando sua vida, seus projetos, seus sonhos. Parabéns pela dádiva de mais um ano de vida! em Mooca Z-L https://t.co/pPBSY1aSwI"
6,596519318,1554421623121379328,2022-08-02,Acabou de publicar uma foto em Mooca Z-L https://t.co/oN815rHC64
7,333632346,1554409643564310528,2022-08-02,"#Repost @vivatatuape with @let.repost 
• • • • • •
Terça Feira é dia de Feira Orgânica na Rua Valter Gazarra, Jardim Anália. 
#vivatatuape #tatuape #analiafranco em Radio Tatuape FM https://t.co/JucCsPjX5l"
8,333632346,1554393335581876226,2022-08-02,Acabou de publicar uma foto em Radio Tatuape FM https://t.co/yimafoHD8G
9,333632346,1554384361138622466,2022-08-02,Acabou de publicar uma foto em Radio Tatuape FM https://t.co/SCdaeFvgKH
10,333632346,1554382338964045825,2022-08-02,Acabou de publicar uma foto em Radio Tatuape FM https://t.co/sM7bNeCYF2
11,4438462828,1554335779220033536,2022-08-02,https://t.co/m8jqpC4czW
12,4438462828,1554335772752449537,2022-08-02,"Traumas intra-uterinos são mais comuns do que se imagina,e afetam toda a vida. O instintodeautoproteção é mais forte que a razão, e ainda que aparentemente não haja perigo, se para o incoerente há sinal de alerta, ele prepara o sujeito para se defender. É instintivo e irracional https://t.co/jrVCS2ATlV"
13,1369968971513016320,1554330439044792323,2022-08-02,"Se até as estações mudam, qual a razão de permanecermos iguais? 🍃✨ #fypシ https://t.co/WdVQBiTFB3"
14,2510988508,1554281041254400006,2022-08-02,"Não é possível que vão reeleger um atormentado desse, um insano doente!!!
#EleNao #ForaBolsonaro #doente #Eleicoes2022 #votocosciente #pracimaBrasil #Boanoite https://t.co/Q6zlIMCwla"
15,359647331,1554193057314111491,2022-08-01,"Ciao, Mooca Querida... até breve ! https://t.co/z193Voihmm"
16,1315675731574300672,1554138411866505216,2022-08-01,RUMO 😍 AO AEROPORTO DE GUARULHOS --SP ❤️ SÃO PAULO ❤️PARA VIAJAR A OLÍMPIA-SP ❤️ BRASIL ❤️ 01/08//22 em Vila Prudente https://t.co/yEIpvkKCq4
17,333632346,1554136085332099072,2022-08-01,Acabou de publicar uma foto em Radio Tatuape FM https://t.co/hpFwUB5bMA
18,1519388465128947712,1554136056949514240,2022-08-01,@ArthurLira_ foi bom estar com nobre deputado federal https://t.co/ARZhatKsIl
19,333632346,1554135761510752256,2022-08-01,"#Repost @liberationmcofficial with @let.repost 
• • • • • •
Atenção, Minas Gerais! 70% dos ingressos para o show do Black Label Society no @misterrockbar já foram vendidos! Teremos casa lotada! em Radio Tatuape FM https://t.co/6CDiiThsuj"
20,333632346,1554135409298399232,2022-08-01,"#Repost @liberationmcofficial with @let.repost 
• • • • • •
Bom dia, São Paulo! Estão acabando os ingressos de Camarote para o show do Exodus, no @cariocaclub , em dezembro! em Radio Tatuape FM https://t.co/UGJVZG87la"
21,333632346,1554134768484245506,2022-08-01,Acabou de publicar uma foto em Radio Tatuape FM https://t.co/ezjxddHoVx
22,333632346,1554134123496648704,2022-08-01,Acabou de publicar uma foto em Radio Tatuape FM https://t.co/i276mi1Cg2
23,333632346,1554133511853973506,2022-08-01,Acabou de publicar uma foto em Radio Tatuape FM https://t.co/AxCptX4Xgr
24,333632346,1554132830552195079,2022-08-01,Acabou de publicar uma foto em Radio Tatuape FM https://t.co/EpZKvubvKi
25,333632346,1554128230872907778,2022-08-01,Acabou de publicar uma foto em Radio Tatuape FM https://t.co/WbH77R0mIb
26,596519318,1554114052015542274,2022-08-01,Acabou de publicar uma foto em Mooca Z-L https://t.co/KVGcAPLoe5
27,1309849690947702785,1554084403562831874,2022-08-01,Acabou de publicar uma foto em Ke Corazza Studio Hair https://t.co/kfvuIhvj2Q
28,1969021752,1554060154085294081,2022-08-01,"Eu vivo assim, quem me conhece sabe! em Radial Leste https://t.co/QWpWMrmDDu"
29,596519318,1553937646908411905,2022-08-01,Feliz nova semana! em Mooca Z-L https://t.co/3OUpHr98F8
30,333632346,1553932803418513409,2022-08-01,Acabou de publicar uma foto em Radio Tatuape FM https://t.co/KWSnnrpj4z
31,333632346,1553923460577038336,2022-08-01,Acabou de publicar uma foto em Radio Tatuape FM https://t.co/KhauEE3bix
32,333632346,1553922835827101696,2022-08-01,Acabou de publicar uma foto em Radio Tatuape FM https://t.co/HCUAnGQC8J
33,333632346,1553915709528444928,2022-08-01,Acabou de publicar uma foto em Radio Tatuape FM https://t.co/7Q5cIcKxms
34,526528864,1553896902139191298,2022-08-01,"Acabou de publicar uma foto em Novo Templo, Assembleia De Deus, Belém https://t.co/u8zfe6AQcv"
35,907346179167588353,1553869320312201220,2022-07-31,Acabou de publicar uma foto em Clube Atlético Juventus https://t.co/4v62AgMuSS
36,2669823832,1553867654519193603,2022-07-31,"Acabou de publicar uma foto em Lar, Doce Lar https://t.co/U8c2LVK5Vn"
37,869207509906710529,1553838285671243776,2022-07-31,"Louco de amor 

❤️ em Mooca https://t.co/qagXDApZbn"
38,59038937,1553831191626846212,2022-07-31,"Affff #InimigosdoFim huahuahuahuahua
#Domingão #TocouLdOéGol #AEstrelhaBrilha #ReidosDesarmes 🚀🚀🚀 em Clube Futebol Society https://t.co/8rEKopJ7tS"
39,15410917,1553823864307814401,2022-07-31,"I'm at No Carvão in São Paulo, SP https://t.co/kG2Rt4x5zC"
40,35131751,1553780218745290752,2022-07-31,"Planting trees is good for health, watching them is good for the soul. #natural #photograph #photo #photographer #streetphotography #blackandwhitephoto #PHOTOS #blackandwhitephotography 
📷 © Jose Alberto Moraes https://t.co/eiK2kXGcTi"
41,596519318,1553743853366157315,2022-07-31,#NewProfilePic https://t.co/o21lFkkUQo
42,1309849690947702785,1553726459017105409,2022-07-31,"Bom diaaaa para esse loiro lindo chegando na sua tela

Bora reagir 😍

Quem aqui ama um loiro 🙋🏻‍♀️ em Ke Corazza Studio Hair https://t.co/RgUUeR413Y"
43,333632346,1553627836744974337,2022-07-31,Acabou de publicar uma foto em Radio Tatuape FM https://t.co/bTreVSQs36
44,333632346,1553621849698869248,2022-07-31,"#Repost @oficialguitarrero with @let.repost 
• • • • • •
#Repost @azeoluthieria with @let.repost 
• • • • • •
Faça a manutenção periódica no seu instrumento de cordas aqui na Azeo Luthieria. em Radio Tatuape FM https://t.co/Eql4NAHI1E"
45,68175604,1553495111698374659,2022-07-30,"Tio
Parabéns pelo seu dia. 
Que esse novo ano em sua vida seja repleto de prosperidade, amor e sabedoria. 
Parabéns 
Feliz Aniversário
A festa tava linda 🥰
💛😍🎂🙏🏻👏🏻🍻🎈🎉🎊❤ em Vila Prudente https://t.co/GgPvV6h6K3"
46,186524011,1553494029064626176,2022-07-30,Êxodo 33:14 https://t.co/ERigqlc2nB
47,161709441,1553484725725155331,2022-07-30,Acabou de publicar uma foto em Mooca https://t.co/07LEBJ06z1
48,185691811,1553478612921319424,2022-07-30,Acabou de publicar uma foto em Mooca https://t.co/Cr43WuE6Ty
49,57528814,1553447846791319552,2022-07-30,show da Banda Nenhum Mal Nada Imoral no Cerveja Azul dia 18 10 2013 em Cervejazul Music Club https://t.co/09rp0JTNrN
50,66571468,1553399343671119873,2022-07-30,I'm at Tati Barbi Balas Caramelizadas in São Paulo https://t.co/ZKv1lsgVob
51,56851995,1553371845117841409,2022-07-30,I'm at Hospital Veterinário Fratelli in São Paulo https://t.co/a9PsrhKesi
52,333632346,1553369835412852738,2022-07-30,40 anos ♠️♠️♠️ em Radio Tatuape FM https://t.co/gWf9KuTPI6
53,185064519,1553275138375929856,2022-07-30,Acabou de publicar uma foto em Copacabana bar https://t.co/M5K9Te2XHq
54,39773060,1553175910987300864,2022-07-30,Tá no ponto @chefdangalhardo ? https://t.co/5lbTydpszf
55,76022404,1553125547647148033,2022-07-29,Acabou de publicar uma foto em Museu Do Amanhã - Rio De Janeiro https://t.co/FiqyVSI7PX
56,203809353,1553062901925257216,2022-07-29,I'm at Super Grill Express in São Paulo https://t.co/Tw4SNS91fr https://t.co/qjoSfjQ0C8
57,907346179167588353,1553018369686790144,2022-07-29,Acabou de publicar uma foto em Clube Atlético Juventus https://t.co/gbicq4Cyck
58,55748108,1552992805559099393,2022-07-29,Acabou de publicar uma foto em Vila Prudente https://t.co/tJTLVbhbpm
59,1309849690947702785,1552980211033063429,2022-07-29,"Vamos iluminar esse dia 🤩

Quem aqui ama um iluminado suave cheio de sofisticação 👆 em Ke Corazza Studio Hair https://t.co/q8ZAHXQ1a1"
60,179141510,1552865804894347265,2022-07-29,"“I Feel So Free 🍃”

#tbt❤️ #streetart #vscobrasil em Burguer Espacial https://t.co/FREBgQoP9O"
61,185691811,1552822511070367744,2022-07-29,Acabou de publicar uma foto em Mooca https://t.co/FXBEJBCmZz
