,author_id,tweet_id,created_at,text
0,177743869,1550957918752841735,2022-07-23,BRINCANDO DE SER CRIANÇA E MUITO BOM E APRAZÍVEL ❤️❤️❤️ @ Mooca https://t.co/Vtc8HQacHU
1,57528814,1550943223060873217,2022-07-23,Show da Banda Nenhum Mal Nada Imoral no Cerveja Azul dia 18 10 2013 @ Cervejazul Music Club https://t.co/6fZDFqhlxq
2,56248472,1550942814472732679,2022-07-23,"Parece montagem, mas é só o por do sol! ☀️ @ Vila Prudente https://t.co/Lb1SgoaJGm"
3,37416391,1550941771340840961,2022-07-23,Delícias da #mooca 🇮🇹🍖🍜🥘😋 @ Cozinha dos Ferrari https://t.co/vBe8psAzzZ
4,83720016,1550916866880708615,2022-07-23,"I'm at Mooca Plaza Shopping in São Paulo, SP w/ @fcterras https://t.co/IDpArhDfdC"
5,116282396,1550894775825481728,2022-07-23,Acabou de publicar uma foto em Rancho Urbano SP https://t.co/rPgh7AnpSv
6,53929018,1550863031701086208,2022-07-23,Acabou de publicar uma foto em Vila Prudente https://t.co/akuffpsxlE
7,48492119,1550794382575534082,2022-07-23,"Feliz sábado, partiu estudar 📚 @ Escola Senai Morvan Figueiredo https://t.co/tUIk7BMtds"
8,1522405187369017347,1550693506661990404,2022-07-23,#อภิปรายไม่ไว้วางใจ #แฉxพีพี #VuelveBelen #antireport #BOROOM #elezionianticipate https://t.co/eEq0N1MQjp
9,201967265,1550649176341479424,2022-07-23,Família 😉 (@ Empório Rancho Urbano in São Paulo) https://t.co/1VW5zflu6Z https://t.co/Uc4LMBB3Cs
10,114936069,1550627720614350849,2022-07-22,""" Do nada, do nadão"" @jaoseupimenta em SP ❤️. https://t.co/SfRhZwaB9H"
11,2328084887,1550547002768773120,2022-07-22,"Boa tarde a!!!!
Á gente demora mais aprende , só não posso perder minha essência !!! em Mooca https://t.co/GCRnK96ziN"
12,54778366,1550541021687455744,2022-07-22,Da Série Estádio Históricos. Vila Belmiro - Santos - SP. @pele em Vila Belmiro Santos https://t.co/3Tw2bZfj0M
13,550611367,1550517298829864960,2022-07-22,Saímos pra almoçar fora hoje porque mamãe queria comer peixe !! #sextou https://t.co/tCS3gCnPiH
14,153008689,1550450613091180545,2022-07-22,Numanice#2 shreds em Museu Do Amanhã - Rio De Janeiro https://t.co/3tonEP5YhO
15,55748108,1550440602680139776,2022-07-22,Acabou de publicar uma foto em Vila Prudente https://t.co/aR7vdJKett
16,1309849690947702785,1550437542876643328,2022-07-22,Acabou de publicar uma foto em Ke Corazza Studio Hair https://t.co/8SWOCnA4Z2
17,3416908168,1550263357726408704,2022-07-21,Dia de @corinthiansftsl https://t.co/TUxWmAwcOZ
18,261801470,1550251431256539138,2022-07-21,@corinthiansftsl !! #VaiCorinthians !! 3 do @DeivesFutsal hoje!!! https://t.co/KqItN4jkgq
19,27152664,1550224975528853506,2022-07-21,Just posted a photo @ Rua Alabastro https://t.co/pvzRLQn4PH
20,1383195265503531009,1550198934647218183,2022-07-21,A Lacoste é o Alvo 🎯🇧🇷 @ Mooca Z-L https://t.co/9NPKUvmyAA
21,161709441,1550198533311156224,2022-07-21,A Mooca e suas cores 💗💐 @ Mooca https://t.co/BIY4BxjgSz
22,1440604975311122434,1550143872034013184,2022-07-21,@PotamusGloria Bora ..... https://t.co/4Y8MIpPJB5
23,53929018,1550141660906020865,2022-07-21,Just posted a photo @ Buffet Planeta Kids Mooca https://t.co/EZUUWUUhXc
24,3820831775,1550110501530738688,2022-07-21,Just posted a photo @ Iron Wraps https://t.co/2AZbiYesHA
25,3820831775,1550106619651862533,2022-07-21,Just posted a photo @ Iron Wraps https://t.co/arwoq5dmpd
26,2719823406,1549931937145528320,2022-07-21,Daqui a pouco tô morando na paulista https://t.co/30cOmoa3on
27,1339966377726275586,1549857287476477973,2022-07-20,Aqui comendo um Jr. pra mais tarde um Jr. me comer hahahahaha 🤭😍
28,55748108,1549792506459594753,2022-07-20,Acabou de publicar uma foto em Vila Prudente https://t.co/PTUZVoyKSL
29,4715652562,1549769153044590593,2022-07-20,Acabou de publicar uma foto em Clube Atlético Juventus https://t.co/xKz9Ruf4lU
30,331191479,1549651771710050304,2022-07-20,Acabou de publicar uma foto em Mooca https://t.co/B6jmea2IFU
31,2983019729,1549593141451243521,2022-07-20,Acabou de publicar uma foto em Vila Prudente https://t.co/gpzDJdcpW3
32,738484040882343941,1549584361820921857,2022-07-20,"Tio e os Xóvens
#fatboyburger 
#tocoymevoy em Cadillac Burger https://t.co/gfO8Aznua6"
33,4715652562,1549547634238652416,2022-07-20,Acabou de publicar uma foto em Clube Atlético Juventus https://t.co/ERAkexVgLF
34,1047614019509657602,1549501656185810944,2022-07-19,"Curtindo uma vista maravilhosa do mirante SESC Belenzinho depois de desfrutar de uma piscina aquecida, oh Benção em Sesc Belenzinho https://t.co/7pjxJYm2UL"
35,203809353,1549427492716527621,2022-07-19,"I'm at @Spoleto Culinária Italiana in São Paulo, SP https://t.co/E10Mp2T7K7 https://t.co/Kd1vMQ5KsS"
36,1445743452004618245,1549387777262977025,2022-07-19,Acabou de publicar uma foto em Cervejazul Music Club https://t.co/IHB5vYR9Sg
37,1969021752,1549142592557686785,2022-07-18,Minha pergunta ao Ministro Alexandre de Moraes do STF. em Radial Leste https://t.co/6UxT7IUBu8
38,1440604975311122434,1549104251766554627,2022-07-18,Cara tava numa  BMW   X6 ..... tds jogadores d  Milan recebem  1 .....  tá explicado   .....
39,1440604975311122434,1549103565624557569,2022-07-18,Então esculacho no negao  ...arma na cara  ...foram ver era um jogador d Milan ...olhem cara d verme fardado  quando  soube...... https://t.co/Mr9qDToiup
40,25921665,1549038032308736005,2022-07-18,"Autoestima pra cima, meu cabelo pra cima.

Os 30 tão batendo na porta e acho que posso dizer que tô envelhecendo como um belo vinho, puta merda. em Mooca https://t.co/4lvoGmn56G"
41,1309849690947702785,1548993591556689923,2022-07-18,Acabou de publicar uma foto em Ke Corazza Studio Hair https://t.co/vhxQcdhUcn
42,388331867,1548785238196867073,2022-07-17,"A Million Dreams aconteceu. 
15 da Princesa Gloria em Mansão Victoria https://t.co/b2S9iX7wNQ"
43,305183087,1548774453357805577,2022-07-17,"Taça SP de futebol de mesa!! 
Feliz com a participação, com a evolução e com o 7° lugar na 7° divisão!!
@cisplatinafc_futmesa em Sociedade Amigos da Dalmácia - Croácia https://t.co/VSHq4EfUdt"
44,1081903915816443904,1548762025018286080,2022-07-17,"Treino de domingo no parque! 🥋👊🌳
______

Sunday training in the park! 🥋👊🌳 em Parque Sabesp Mooca https://t.co/4v9pjer7TV"
45,224648416,1548743416741105664,2022-07-17,"E pra completar, a sobremesa: Havanna Thunder… em Outback Mooca Plaza Shopping https://t.co/WTiWdkH9wA"
46,224648416,1548732062978285569,2022-07-17,"Agora, o prato completo: Junior Ribs on The Barbie, batata frita, Kookaburra Wings e Bloomin’ Onion… em Outback Mooca Plaza Shopping https://t.co/B0IXhtabdD"
47,224648416,1548728014011338756,2022-07-17,Começando o almoço pela bebida! em Outback Mooca Plaza Shopping https://t.co/wxDMheoTx9
48,59038937,1548716433919463424,2022-07-17,"#Churras futebol do #Domingão !!!
Mais de 12 anos e somando...
#AEstrelhaBrilha #TocouLdOéGol 
#ReidosDesarmes 
🚀🚀🚀 em Clube Futebol Society https://t.co/1Hh1INzHn2"
49,325854544,1548695249777840128,2022-07-17,"Aquela noite top com eles. 
Maxilar, doe quando estamos juntos. Kkkk

Deus, abençoe meus amigos.

Amamos estar com vocês. 😍😍😍
Que não nos faltem momentos assim .
🙏🏼🙏🏼🙏🏼 em Mundo Animal https://t.co/PFZW299YaI"
