,author_id,tweet_id,created_at,text
0,596519318,1565773052104826880,2022-09-02,Camisetas 'promocionais' do NS em Mooca Z-L https://t.co/eapUNkm57x
1,1524904996843802630,1565733623206223872,2022-09-02,Acabou de publicar uma foto em Rua Augusta (São Paulo) https://t.co/yEDiLPEww8
2,1555491326904385538,1565728961598050304,2022-09-02,Toma cuidado  Barba  ...  @LulaOficial    num mosca.... https://t.co/sCMaHSSL6F
3,596519318,1565707588435677184,2022-09-02,NS é a cara da ladroagem! em Mooca Z-L https://t.co/AhWcGAmQTm
4,596519318,1565650248344682500,2022-09-02,Acabou de publicar uma foto em Mooca Z-L https://t.co/bUnDJnrPsy
5,891671153395339264,1565518200711806982,2022-09-02,"São os ciclos que nos transformam. 
Vem #sectember#virgo
#conexão em Mooca https://t.co/GEHaZ00jR8"
6,1496842349695188995,1565517055662727169,2022-09-02,México 🇲🇽 https://t.co/y2pXGwlRYh
7,1402999849197314069,1565497241678368768,2022-09-02,Mooca Bello! 🤌🏼 https://t.co/Sxsa6otkGf
8,1425475714170691590,1565466475799904256,2022-09-01,"Hoje as 20h tem um podcast com este grande artista representante do Forró!
@zeduarteoficial 
Link na bio! 

https://t.co/xvfCLGbY97

#zéduarte #forro #forrouniversitario #podcast #entrevista em Pontual Duplicação https://t.co/kviohJleUN"
9,89313278,1565440004314533888,2022-09-01,#lunapicheli #vilaprudente #ruadoorfanato #zonaleste #zl #capitalpaulista em Vila Prudente https://t.co/qCDKkrAoUt
10,3820831775,1565435498612531203,2022-09-01,Acabou de publicar uma foto em Iron Wraps https://t.co/Q7pzzMSo2U
11,3820831775,1565420588625461248,2022-09-01,Acabou de publicar uma foto em Iron Wraps https://t.co/blE1EziFHv
12,3820831775,1565418159221473283,2022-09-01,Acabou de publicar uma foto em Iron Wraps https://t.co/HE1cwlZ4PS
13,1524904996843802630,1565386644093812736,2022-09-01,Acabou de publicar uma foto em Rua Augusta (São Paulo) https://t.co/JJ7XLfa0pp
14,596519318,1565365808385204225,2022-09-01,"Por vezes é difícil e doloroso se afastar de vez do que e de quem te faz mal. 
É preciso um longo caminho para libertar-se das amarras, dos vínculos, e compreender a si mesmo ... daí sim, agir rumo ao próprio bem estar. https://t.co/TjfrihL5eP"
15,596519318,1565359306224058369,2022-09-01,"""de brinde"" ainda mandamos o fígado e o 'caráter' do sapo barbudo (ou bode velho, como preferirem...) em Mooca Z-L https://t.co/q2qF6n875b"
16,596519318,1565342526592421888,2022-09-01,Acabou de publicar uma foto em Mooca Z-L https://t.co/F7ze4oUtww
17,1402607206915321857,1565336425507467266,2022-09-01,Minhas paixões kk https://t.co/lz1FqSzoSq
18,333632346,1565186627080691714,2022-09-01,Robert Smith and David Bowie em Radio Tatuape FM https://t.co/UN1mlg216p
19,158160208,1565171332463329280,2022-09-01,Just posted a photo @ Flow https://t.co/pIwbpTuIfr
20,2946035369,1565159155308142593,2022-09-01,bye august 👋🏼 https://t.co/A3UGuL4dlv
21,1564222440204558340,1565155875102277638,2022-09-01,"faith, focus and march ✨ https://t.co/NkdSo3iRjZ"
22,267293166,1565155020743614465,2022-09-01,"I'm at Pro 3 Academia in São Paulo, SP https://t.co/YfzKQJpptS"
23,1527814337062129664,1565133187491237888,2022-09-01,"“Enquanto você não libera a palavra, você domina ela.

Quando você libera, ela domina você”. em Mooca https://t.co/jGX1SogrwV"
24,120544109,1565116853713788932,2022-08-31,"Eu amei esse bar, rolê calminho pra morrer velhinho https://t.co/OtcH1169Fk"
25,55748108,1565092511521054720,2022-08-31,Acabou de publicar uma foto em Vila Prudente https://t.co/ScviijdM8p
26,1524904996843802630,1565076657928552454,2022-08-31,Acabou de publicar uma foto em Rua Augusta (São Paulo) https://t.co/hKLDGHBhj8
27,3820831775,1565076243329851392,2022-08-31,Acabou de publicar uma foto em Iron Wraps https://t.co/PXiFFSAiEs
28,203809353,1565024092041904129,2022-08-31,"I'm at Deck Lounge Bar in São Paulo, SP https://t.co/PoTMVyaY28"
29,128124649,1565006308855762946,2022-08-31,"Hoje é o aniversário do meu titio querido @pardalchimello lenda do @anthares_metal 

Feliz aniversário tio, te amo! Felicidades! 

📸: Dani Moreira em Sesc Belenzinho https://t.co/nigsB8FFFs"
30,56851995,1565004591888056326,2022-08-31,"I'm at Academia Ultra in 聖保羅, SP https://t.co/rWmDJwYImI"
31,1309849690947702785,1564932640653852672,2022-08-31,Acabou de publicar uma foto em Ke Corazza Studio Hair https://t.co/GHIftSfjaY
32,336117114,1564803412784562179,2022-08-31,"@paomorejon Yo que agradezco amiga, la medicina inunda nuestras vidas de Guayaquil a São Paulo. Nos veremos para volver a Buenos Aires. Abrazos desde la Mooca. https://t.co/yKKzYf2lBI"
33,90432796,1564706897160290304,2022-08-30,De uns dias 🍹🎉💫 em Caô Bar https://t.co/0XQKr9bMoZ
34,1524904996843802630,1564678622228652035,2022-08-30,Acabou de publicar uma foto em Rua Augusta (São Paulo) https://t.co/DiFCSvv1WW
35,1031612925885276161,1564666908087033858,2022-08-30,"Prefeitura de Setubinha MG
Renault Master 16 lugares poltrona móvel 
Parabéns pela sua conquista.SUCESSO 
#renaultmaster #renault #master #acessibilidade #inclusaosocial em Radial Leste https://t.co/BizAV48Pja"
36,69362233,1564629604308058121,2022-08-30,Acabou de publicar uma foto em Teatro Municipal da Mooca Arthur Azevedo https://t.co/R8zFrIAK06
37,56851995,1564566263795425281,2022-08-30,"I'm at Academia Ultra in 聖保羅, SP https://t.co/vv8eWPKzMs"
38,267293166,1564425326930927617,2022-08-30,"I'm at Pro 3 Academia in São Paulo, SP https://t.co/a1oz6FCiN2"
39,206388461,1564415120121466880,2022-08-30,Acabou de publicar uma foto em Pelas Ruas De Sampa https://t.co/sJdXYdKwsC
40,499153720,1564399644142075904,2022-08-29,Quem não conhece tá sem internet 🚀🎶 em Tatuapé Conceito https://t.co/Xbc5J6XGB3
41,280194491,1564362812876623877,2022-08-29,Acabou de publicar uma foto em Sesc Belenzinho https://t.co/NSsQ0KMXH7
42,1524904996843802630,1564328882370936832,2022-08-29,Acabou de publicar uma foto em Rua Augusta (São Paulo) https://t.co/Pn7hmX9K8r
43,47669029,1564327150102134786,2022-08-29,"Hoje a FAPCOM visitou a ETEC Prof. Camargo Aranha, no Bairro da Mooca. https://t.co/4So5NUBok0"
44,55748108,1564312139854217224,2022-08-29,Acabou de publicar uma foto em Vila Prudente https://t.co/MXIU797ME0
45,1560843066738712576,1564310482756018178,2022-08-29,O alerta do General Heleno. O recado está dado. https://t.co/fxKSkgAZXC
46,195562928,1564272553883058178,2022-08-29,Acabou de publicar uma foto em Mooca https://t.co/LfKyVwm0dA
47,596519318,1564263738827452421,2022-08-29,Acabou de publicar uma foto em Mooca Z-L https://t.co/h5Y5logqOY
48,596519318,1564262452669333505,2022-08-29,"Desejo que o Eterno continue abençoando cada dia seu, por toda vida! em Mooca Z-L https://t.co/fYgOO4MjtP"
49,596519318,1564253385427230730,2022-08-29,E bora prá mais uma semana produtiva e plena de bençãos! em Mooca Z-L https://t.co/9Mu2gr6Qqy
50,333632346,1564211331615563776,2022-08-29,"#Repost @vansiart with @let.repost 
• • • • • •
“Ewan McGregor” #trainspotting #ewanmcgregor #dannyboyle #soundtracks #iggypop #lustforlife #soundtracks #alcoholink #cinema #popart #popculture #artpop  #painting https://t.co/aCv8dyJdJr"
51,596519318,1564151268175925249,2022-08-29,Dona Soraya devia ter ficado quieta... em Mooca Z-L https://t.co/9h2Kq7q0mK
52,336117114,1564109031635050497,2022-08-29,"Ecuador.Guayas. Candidata a prefecta Marcela Aguiñaga de Revolución Ciudadana abiertamente elogia a los evasores Uribe Schwarkopf identificados por el Observatorio Dolarización @dolarizacionEc. Igual que Susana González PSC. Mismo evento. No  hay disputa, ideologías, ni ética. https://t.co/KSmdOwtF5H"
53,124879030,1564081222976000000,2022-08-29,Acabou de publicar uma foto em Mooca https://t.co/LIZxExjeyQ
54,328700491,1564064674165006339,2022-08-29,@ThiagoNigro Amei.
55,596519318,1564058003200155648,2022-08-29,"Esse é um coronel igualzinho o bode velho.... 
#ptnuncamais❌ 
#foracirogomes em Mooca Z-L https://t.co/DvMqgFTKKq"
56,333632346,1564051831659298816,2022-08-29,"#Repost @projetoaltashorasrockbar with @let.repost 
• • • • • •
Pesado em Radio Tatuape FM https://t.co/btbVT63C66"
57,333632346,1564051068551663616,2022-08-29,"#Repost @vivatatuape with @let.repost 
• • • • • •
Pelas ruas do Tatuapé...O @dckburger na Demétrio Ribeiro.
#vivatatuape #tatuape #analiafranco #burger em Radio Tatuape FM https://t.co/3aDQZU4B7L"
58,76548213,1564049350661410818,2022-08-29,"Fechando mês de Agosto com chave de ouro, estreia do novo cenário e uma energia incrível no Teatro  do SESC Belenzinho, nosso muito obrigado a todos que curtiram com a gente!!😉🙏🎶😀💙 em Sesc Belenzinho https://t.co/Cm8ubCIng3"
59,336117114,1564045587640713216,2022-08-29,Debate histórico. Ahora en São Paulo me siento en la historia de Brasil. La que Lula va a cerrar de una vez acabando con la basura de una vez por todas. Por el futuro de América Latina. https://t.co/RRq8NH6kom
60,59850664,1564042262115409925,2022-08-29,Vai começar! #DebateNaBand em Assistindo debate presidêncial na Band https://t.co/TUALoZKHcV
61,333632346,1564038529386258433,2022-08-28,Acabou de publicar uma foto em Radio Tatuape FM https://t.co/56pg1s71Co
62,596519318,1564019420472942593,2022-08-28,rsrsrsrs em Mooca Z-L https://t.co/PZEuf8DSQO
63,596519318,1563977418674683904,2022-08-28,Acabou de publicar uma foto em Mooca Z-L https://t.co/50tIjK6PxY
64,596519318,1563905042851266560,2022-08-28,Acabou de publicar uma foto em Mooca Z-L https://t.co/2rj2nQBj9O
65,1495726521746661376,1563896596433182726,2022-08-28,"Oi amores hoje vou atender na Mooca na parte da tarde
Rua do Oratório 622 suíte 40,00"
66,176221743,1563874848207691779,2022-08-28,"Bastante tempo depois fiz uma corrida de rua … o resultado foi o que menos importou … valeu pela curtição, integração com bastante gente, clima de esporte é sempre bom demais … https://t.co/KGOUWr2DCg"
67,1495158768576995331,1563871205739753474,2022-08-28,"Sobre o final de semana…😍🎭

Prestigiando “As Meninas Velhas” ♥️ https://t.co/CdeZJqEajb"
68,2750393776,1563850751927017474,2022-08-28,"Noite incrível! Aniversário da Isabela, nossa sobrinha... parabéns @isacabrelli Deus te abençoe sempre! Felicidades! 🙏🏼🎊🎁🥳 em Mooca https://t.co/xHOsoxTAEw"
69,333632346,1563831640731820033,2022-08-28,Acabou de publicar uma foto em Radio Tatuape FM https://t.co/Xm4qnudbhO
70,203809353,1563755277052219394,2022-08-28,"Aniversário dela 🎉❤️ (at @HoccaBarOfamoso in São Paulo, SP) https://t.co/Q9enIEvOVs https://t.co/30WvMAw9og"
71,596519318,1563732120417214469,2022-08-28,Acabou de publicar uma foto em Mooca Z-L https://t.co/vb7baTbH5m
72,3187652103,1563681076240941058,2022-08-28,Acabou de publicar uma foto em A Bela e a Fera Experience - Diner &amp; Show https://t.co/oYSwae9g4N
73,1524904996843802630,1563649221277978627,2022-08-27,Acabou de publicar uma foto em Rua Augusta (São Paulo) https://t.co/vvu2F4cPg7
74,96347605,1563645847669202944,2022-08-27,"Circo do Chaves (@ Mooca Plaza Shopping in São Paulo, SP) https://t.co/lWqq1TwEOq https://t.co/nvsCcEBFia"
75,1341406621658963968,1563616043016359936,2022-08-27,Tomahawk muito bem executado..🔪💕 https://t.co/jm9WUdSKuO
76,336117114,1563614297447473154,2022-08-27,"Here comes the sun, little darlin… https://t.co/FsLUTfHc0Z"
77,551303416,1563584964805140485,2022-08-27,Just posted a photo @ Festa Italiana https://t.co/cEEAyYgmM3
78,596519318,1563577955288489986,2022-08-27,É tanto filtro sendo usado que a gente nem reconhece as pessoas... em Mooca Z-L https://t.co/iaMThEKBZq
79,2983019729,1563568843368198144,2022-08-27,https://t.co/UxGOhT11GS em Vila Prudente https://t.co/rH8sS1TbZQ
80,2983019729,1563567893597392897,2022-08-27,https://t.co/UxGOhT11GS em Vila Prudente https://t.co/k9hz5Imgb2
81,596519318,1563553374762459136,2022-08-27,Meu partido é qualquer um ANTI-PT em Mooca Z-L https://t.co/itA4dxeFcE
82,596519318,1563551126766907393,2022-08-27,Acabou de publicar uma foto em Mooca Z-L https://t.co/XLvYdmLnHz
83,55310560,1563546129043955719,2022-08-27,foto de buenas no sábado✨ 👨🏻 em Vila Prudente https://t.co/Ui4SeZodpu
84,596519318,1563537997735538689,2022-08-27,Acabou de publicar uma foto em Mooca Z-L https://t.co/5ZXc5fLKwz
