,author_id,tweet_id,created_at,text
0,167471254,1532191189654548481,2022-06-02,"Tão doce é o amor que sinto por você.
Tão puro, verdadeiro e eterno.
Querido,
Te amo mais que tudo!
Obrigada por existir,
Te amo meu irmão ❤️🥁 em Sendo Feliz https://t.co/worybadRXj"
1,727083578278993920,1532157129716551684,2022-06-02,Boa noite em Jaçanã https://t.co/TMrB5sVQna
2,43470333,1532050123416653830,2022-06-01,Acabou de publicar uma foto em Vila Nivi https://t.co/gZBStbyzzC
3,168304770,1532036788436475904,2022-06-01,"Verdade verdadeira.
#odontologia
#sorriso
#saudeoral em Dra. Celia Grilli Barral - Dentista https://t.co/W6vTzYARH0"
4,15443874,1532002275543158787,2022-06-01,Acabou de publicar uma foto em Continental 2 -Guarulhos https://t.co/1ejBGz2A6c
5,1252020106990944256,1531821179023024128,2022-06-01,Acabou de publicar uma foto em Tyson Academia - Mazzei https://t.co/LFT5DQo4CE
6,1354581612567080961,1531658660748873728,2022-05-31,Aquela caipira perfeita 🖤 https://t.co/Y7EgXLDuwm
7,1531621040593506305,1531622491344588801,2022-05-31,Tem cachorro que é tão feio que chega a ser bonitinho.😜🐾 https://t.co/18Jt5QfgUy
8,727083578278993920,1531555640023437313,2022-05-31,"Bom dia em Tucuruvi, São Paulo, Capital https://t.co/8puzkiaW3k"
9,727083578278993920,1531432832190521344,2022-05-31,Boa noite em Jaçanã https://t.co/SFhHpnvFyy
10,41233357,1531400760508010498,2022-05-30,"Opa, hoje o paizão faz 80 aninhos, parabéns véio, felicidade sempre!!! em Auto Moto e Cia https://t.co/dzoI22Oh45"
11,727083578278993920,1531053589355012096,2022-05-29,Boa noite em Jaçanã https://t.co/0O3va8BCZM
12,3053988135,1530966617806540802,2022-05-29,Acabou de publicar uma foto em Vila Nova Galvão https://t.co/sgFfaP4YQh
13,727083578278993920,1530884854312730624,2022-05-29,Bom dia em Jaçanã https://t.co/WtVV411Oxj
14,727083578278993920,1530870574616129536,2022-05-29,Bom dia em Praça Memorial do Jaçanã https://t.co/0XxnXKmlAM
15,143707556,1530726919989346304,2022-05-29,Fechado a noite! Rsrs em Paróquia São Pedro Apóstolo https://t.co/YHoZUIFcV8
16,49053242,1530701691934359556,2022-05-29,Acabou de publicar uma foto em Bairro Jaçana Sao Paulo https://t.co/dE1F5b3OAv
17,143707556,1530698609825656834,2022-05-28,Coragem! em Paróquia São Pedro Apóstolo https://t.co/sfBxSSFU34
18,43470333,1530576510662361089,2022-05-28,Acabou de publicar uma foto em Vila Nivi https://t.co/M5M3IJM1tD
19,219177143,1530555686081351680,2022-05-28,"#sabadou 📷😎✌⏳🙏
Em casa, dia de clássico 
🐷 X 🐟

#Sabado #saturday #Palmeiras #DiaDeJogo #Palestra #carpediem #vamosganharporco #goodvibes #bomdia🌞 #goodmorning #Sabadão #selfie #Instagram #Mv #ZonaNorteSp https://t.co/PWaH5Ah1Hb"
20,41233357,1530547300208152576,2022-05-28,"Sorte do dia, céu de brigadeiro!

#automotoecia em Auto Moto e Cia https://t.co/PLotS7vTA1"
21,83508645,1530546592796667905,2022-05-28,"Um sábado alegre e acolhedor para nós, muito sol na sua alma, espirito forte e coração agradecido.

Bom dia!

#umdiadecadavez #dialindo #viveravida #bomdia🌞 #felicidade em Pra Quê Vc Quer Saber? https://t.co/aX5FAQyGFQ"
22,727083578278993920,1530508468733431808,2022-05-28,Bom dia em Praça Memorial do Jaçanã https://t.co/sZYrnXX9aL
23,122231964,1530229446531227648,2022-05-27,"#tbt Desde 2013 @godbrasil @globaloutreachday

Dia 28 de maio tem mais um Dia de Evangelização Global

#godbrasil #diaglobaldeevangelizacao #gomovement #godecade #goaction #setebarras https://t.co/WfMN3KqYha"
24,143707556,1530171677467987971,2022-05-27,Acabou de publicar uma foto em Paróquia São Pedro Apóstolo https://t.co/baSa0VZ2eP
25,727083578278993920,1529964340178214921,2022-05-26,Boa noite em Jaçanã https://t.co/bnP3vtU0Sq
26,15430166,1529822313763393538,2022-05-26,"O moço disse que o combo era mais em conta, então não me contive 🍿

@cinemarkoficial em Cinemark Shopping Metrô Tucuruvi https://t.co/5eZOeuZloo"
