,author_id,tweet_id,created_at,text
0,94453606,1527781168191528961,2022-05-20,"I'm at Empório Lopes in Guarulhos, São Paulo https://t.co/G1KJuqiiHM https://t.co/A0jAbHsoRC"
1,316776058,1527740104470581250,2022-05-20,Acabou de publicar uma foto em Estádio Municipal Cícero Miranda https://t.co/7h0lVADd5b
2,897835101786132480,1527664363934466048,2022-05-20,Acabou de publicar uma foto em Jiu Jitsu Bollacha Grapplers/ Barbosa 9 https://t.co/IWoblqkKRl
3,2915356960,1527625252989243392,2022-05-20,"#cantareira #letmeuseyou #girls #SaoPaulo #fuck #suckme #rockandroll 
Let me use you??? https://t.co/v7KXdfPakD"
4,727083578278993920,1527434385976442887,2022-05-19,Boa noite em Jaçanã https://t.co/pUUBzlv6Ms
5,59629234,1527412102167678986,2022-05-19,"Já que hoje é dia de #TBT e amanhã faremos 3 meses desse dia maravilhoso. Nada mais justo que lembrar né? 💖

#wedding #bride #casamentoLeBru em Espaço Villa Borghese https://t.co/wU8M8viJUT"
6,1106611231362871297,1527364542082297856,2022-05-19,Mais paulistaner que eu mêo ? https://t.co/OBQnF5fwiH
7,1511486788254187523,1527342341669146625,2022-05-19,Faz 13 graus na zona norte de São Paulo jd Brasil #EntraNoGau https://t.co/6fBLS7MAye
8,727083578278993920,1527061603761389568,2022-05-18,Boa noite em Jaçanã https://t.co/6FUIGlSLiB
9,3237120995,1527049284562059264,2022-05-18,@Myth1calThing va po caraio te perguntei nd tiw
10,167471254,1526767063796174854,2022-05-18,Acabou de publicar uma foto em Sendo Feliz https://t.co/AU9mxiMgot
11,167471254,1526657212290154496,2022-05-17,Acabou de publicar uma foto em Sendo Feliz https://t.co/hJX1b2Zy9H
12,1526400983835844610,1526411032159309824,2022-05-17,Faz frio em SP e eu só queria um love pra dormir junto..😮‍💨 Tá difícil essa vida https://t.co/miBuMOBOAf
13,727083578278993920,1526369324537110528,2022-05-17,Boa noite em Jaçanã https://t.co/6V1554cFxV
14,59355021,1526346053649408001,2022-05-16,"Pior do que ficar sem luz é fazer papel de otaria, vendo caminhão da @edpbrasil passar várias vezes na rua escura sem parar, acho q mandaram eles passearem por aqui pra gnt ligar lá e eles dizerem que já estão a caminho, q tem mta solicitação pra região. Vergonha heim #EDP #gru"
15,80628503,1526335589741641728,2022-05-16,Que batata simplesmente incrível 😍😋 https://t.co/DrTDj0u7VA
16,727083578278993920,1525999376765706240,2022-05-16,Boa noite em Jaçanã https://t.co/pTLqseOTXS
17,3407539978,1525996158375677953,2022-05-16,"dom., 15 de mai. em Jardim Brasil Sp https://t.co/Ezz3JBB6k5"
18,38707582,1525815356140445696,2022-05-15,"Batismo nas águas 15/05/2022. 
Domingo - 10h. 

#imwtucuruvi 
Rua Parambu, 82 Pq. Vitória - SP. 

Acompanhe em nossas redes. 

#batismo #águas #aguas #imw #imw3 #jesus #cristo #silmar #eduardomrfilho em IMW Tucuruvi https://t.co/Nf0Bo2DPaD"
19,727083578278993920,1525786501728153602,2022-05-15,Bom dia em Jaçanã https://t.co/2zjYDNIVoD
20,1312850924587671552,1525634515347156992,2022-05-15,"Que possamos passar mais momentos como esses juntos meu irmão!!!

#irmaos #l4likes #f4follow em Museo Felicia Leirner https://t.co/N4hFD9I93r"
