,author_id,tweet_id,created_at,text
0,1365365852539940865,1529032334728732673,2022-05-24,Aquele tesão as 5:00 da manha.. https://t.co/oi5OAR4fiF
1,143707556,1528936237821841409,2022-05-24,Acabou de publicar uma foto em Paróquia São Pedro Apóstolo https://t.co/oRFSKpanRh
2,1365365852539940865,1528922462943051781,2022-05-24,@arabesafadozl
3,1365365852539940865,1528922460682321925,2022-05-24,Sentando gostoso no maridão... Quer? 😏 https://t.co/1zv6FqOBFR
4,727083578278993920,1528867369099182080,2022-05-23,Boa noite em Jaçanã https://t.co/S0XvS5FvHU
5,1521831401825480707,1528816819879936004,2022-05-23,",,, SENHOR eu sei o q faço mais me dá um abração me chama de canto conversa comigo ,SENHOR vem ser eu amigo , SENHOR  vem ser !!!

#mc_kadu_medley_so_pedradaa https://t.co/VF4vVVThV8"
6,124440750,1528728418132578304,2022-05-23,Acabou de publicar uma foto em Teatro Nelson Rodrigues https://t.co/pabgw0gswF
7,727083578278993920,1528539509767303168,2022-05-23,Boa noite em Jaçanã https://t.co/PIAwjLhMv5
8,1485098599755173894,1528441046056767494,2022-05-22,"Comece onde você está, use o que você tem e faça o que você pode.

#viral #explorar #photography #me #frasesmotivacionais #frases em Sp-Z/n https://t.co/hdwNF8MHL8"
9,41724125,1528401583121346563,2022-05-22,Hoje o boteco tá diferenciadíssimo https://t.co/gnf9rca6BR
10,704853313410473984,1528394732543651843,2022-05-22,Acabou de publicar uma foto em Marte https://t.co/AfYzrZ1AYU
11,1365365852539940865,1528386210795864065,2022-05-22,@arabesafadozl
12,1365365852539940865,1528386208547618818,2022-05-22,Vem sentar no Mozão 😏 https://t.co/kRtECZhfLh
13,1365365852539940865,1528385820213841921,2022-05-22,Mamando gostoso o rolão grosso do Mozão https://t.co/Ssa9lwFfN0
14,727083578278993920,1528345549811982336,2022-05-22,Bom dia em Jaçanã https://t.co/aEUCz9XUjm
15,727083578278993920,1528199489088999426,2022-05-22,Boa noite em Jaçanã https://t.co/Wzx0Sbf2l7
16,3237120995,1528139195700723713,2022-05-21,entrando em modo de Grindset🧠 https://t.co/U1Hj0pv4g8
17,1365365852539940865,1528126558283743232,2022-05-21,Descanso bom entre 4 😏 https://t.co/B3eorqmw5z
18,94453606,1528090997825077250,2022-05-21,"I'm at Vila Galvão in Guarulhos, SP https://t.co/JDk4aWdLuL https://t.co/lbYUghE9qz"
19,24987794,1528010796210454528,2022-05-21,"Acabou de publicar uma foto em Casa de Caridade Irmãos de Fé - Baianos Zé da Pinga, Rendeira e Roda Saia https://t.co/yNUxxARhTY"
20,727083578278993920,1527955990775218176,2022-05-21,Bom dia em Jaçanã https://t.co/40VLRPTIUO
21,727083578278993920,1527814813967163392,2022-05-21,Boa noite zapp em Jaçanã https://t.co/WU59f5vGfm
22,1426502283869802497,1527806186774470656,2022-05-21,Alguém pra deixar eu mamar
23,94453606,1527781168191528961,2022-05-20,"I'm at Empório Lopes in Guarulhos, São Paulo https://t.co/G1KJuqiiHM https://t.co/A0jAbHsoRC"
24,316776058,1527740104470581250,2022-05-20,Acabou de publicar uma foto em Estádio Municipal Cícero Miranda https://t.co/7h0lVADd5b
25,897835101786132480,1527664363934466048,2022-05-20,Acabou de publicar uma foto em Jiu Jitsu Bollacha Grapplers/ Barbosa 9 https://t.co/IWoblqkKRl
26,2915356960,1527625252989243392,2022-05-20,"#cantareira #letmeuseyou #girls #SaoPaulo #fuck #suckme #rockandroll 
Let me use you??? https://t.co/v7KXdfPakD"
27,727083578278993920,1527434385976442887,2022-05-19,Boa noite em Jaçanã https://t.co/pUUBzlv6Ms
28,59629234,1527412102167678986,2022-05-19,"Já que hoje é dia de #TBT e amanhã faremos 3 meses desse dia maravilhoso. Nada mais justo que lembrar né? 💖

#wedding #bride #casamentoLeBru em Espaço Villa Borghese https://t.co/wU8M8viJUT"
29,1106611231362871297,1527364542082297856,2022-05-19,Mais paulistaner que eu mêo ? https://t.co/OBQnF5fwiH
30,1511486788254187523,1527342341669146625,2022-05-19,Faz 13 graus na zona norte de São Paulo jd Brasil #EntraNoGau https://t.co/6fBLS7MAye
31,727083578278993920,1527061603761389568,2022-05-18,Boa noite em Jaçanã https://t.co/6FUIGlSLiB
32,3237120995,1527049284562059264,2022-05-18,@Myth1calThing va po caraio te perguntei nd tiw
33,167471254,1526767063796174854,2022-05-18,Acabou de publicar uma foto em Sendo Feliz https://t.co/AU9mxiMgot
