,author_id,tweet_id,created_at,text
0,1319341609767653376,1549535411831074817,2022-07-19,Acabou de publicar um vídeo em Condominio Isla Lago Dos Patos https://t.co/3bMEevGuQQ
1,2405282319,1549396960897110018,2022-07-19,"Noite abençoada pelo Espírito Santo!
Meu coração transbordando de gratidão vendo minha família servindo ao Rei do universo, Jesus Cristo!🙌🏻🙏🏻❤️🖐🏻🖐🏻🖐🏻🖐🏻 em IASD Tucuruvi Oficial https://t.co/zkAg6I8bXe"
2,162029205,1549396645347049472,2022-07-19,Não me acompanha que não sou novela em SkalFit Academia https://t.co/zxnsvLvMWi
3,1546470345967812609,1549362148408795137,2022-07-19,"Bom dia terça-feira!!!
Bora lá tomar café nessa manhã fria de inverno??? https://t.co/2pPXAuo9C1"
4,43470333,1549348326297849856,2022-07-19,Acabou de publicar uma foto em Vila Nivi https://t.co/xVBPECuyGc
5,43470333,1549348008323694593,2022-07-19,Acabou de publicar uma foto em Vila Nivi https://t.co/ZpsiBUnAMP
6,1124741493418332165,1549218652024709120,2022-07-19,BH https://t.co/Jj8wyh47pF
7,45462135,1549191583609798661,2022-07-19,Acabou de publicar uma foto em Clube de Campo Associação Atlética Guapira https://t.co/ZoUvmPvgAw
8,727083578278993920,1549181729025449984,2022-07-18,Boa noite em Jaçanã https://t.co/Wy2T3evFfG
9,49053242,1549070292240125952,2022-07-18,Acabou de publicar uma foto em Bairro Jaçana Sao Paulo https://t.co/bMNXAxdYxZ
10,727083578278993920,1548834399193554944,2022-07-18,Boa noite em Jaçanã https://t.co/lUVZFylCiq
11,43470333,1548822340254851072,2022-07-18,"Fermentar na geladeira pelas próximas 18h...

#fermentacaonatural #panificacaoartesanal em Vila Nivi https://t.co/Cq8fl0tqky"
12,311157473,1548745382217261057,2022-07-17,"Já formei a minha quadrilha, vou dançar Meu São João! 🔥🌽🥜

#ArraiaDoGabi #FestaJulina #ArraiaJulino em Residencial Horto https://t.co/jzmcYPF5wJ"
13,232330396,1548658857957662721,2022-07-17,Trouxemos uma imagem de Nossa Senhora de Aparecida para zelar por nossa casa. em Santuario Aparecida do Norte https://t.co/DIyDzgzDcy
14,727083578278993920,1548637688194076674,2022-07-17,Bom dia em Jaçanã https://t.co/zHmePIhb0c
15,252806783,1548545757661351939,2022-07-17,Pit stop  🍟🍔🍟🍔 https://t.co/86p4CxN9VJ
16,1437872423718768647,1548470986982375426,2022-07-17,"@dewbigodi Sou craque do comunismo

📍- bar do Augusto"
17,727083578278993920,1548470553702330368,2022-07-17,Boa noite em Jaçanã https://t.co/zZMgylsQ5A
18,1437872423718768647,1548469820449886209,2022-07-17,"@dewbigodi Vai Corinthians

📍- Paraíso motel"
19,1437872423718768647,1548469240084045825,2022-07-17,"@dewbigodi Vai Chimbote

📍 - Kiosque do bitonho"
20,252806783,1548466022729932802,2022-07-17,🤪 https://t.co/aFpmGeSunY
21,23260002,1548429542884122625,2022-07-16,the best people in life are free em Outback Shopping Tucuruvi https://t.co/HyO5IoGKac
22,1416800098793762818,1548411637631111171,2022-07-16,"@BombeirosPMESP boa tarde. Avisei no 193, https://t.co/OpFot3wWle"
23,232330396,1548404577312968705,2022-07-16,Em um dos belos espaços do Santuário de Aparecida do Norte. em Santuario Aparecida do Norte https://t.co/kEC1jiQskm
24,4280297357,1548353099625951235,2022-07-16,https://t.co/fgZuVVzQCg
25,753426005000413185,1548349209086009346,2022-07-16,Acabou de publicar uma foto em Cesar De Souza https://t.co/Ty1AaofHRw
26,232330396,1548337077367894021,2022-07-16,Agradecendo bênçãos de Nossa Senhora Aparecida. em Santuario Aparecida do Norte https://t.co/L6xfb6FRuz
27,43470333,1548328089158963204,2022-07-16,"Pão Dia!

#bomdia #panificacaoartesanal #fermentacaonatural em Vila Nivi https://t.co/TlxaCkQsUo"
28,60547295,1548225770853519360,2022-07-16,OBSERVANDO E SENTINDO AS PLANTAS AS FLORES E O AMOR EM MEU CORAÇÃO ! COMO A VIDA É BELA E DELICADA E PASSAGEIRA ! #love #flowers em Praça Ulisses Guimarães https://t.co/tGykH2gacm
29,1317879399576993793,1548123937321586689,2022-07-16,Acabou de publicar uma foto em Jardim Jaçanã / Zona Norte SP https://t.co/QKT3myeS7o
30,43470333,1548114214710956032,2022-07-16,"Pão quentinho saindo... Mmmmmm

#fermentacaonatural
#lovebakes
#panificacaoartesanal #fazerpaoemassa 

@annariccio 

Feito com @nitaalimentosoficial em Vila Nivi https://t.co/jH0fyfwPx1"
31,727083578278993920,1548081367505723395,2022-07-15,Boa noite em Study Company https://t.co/ecJ3BPtj9x
32,222295580,1548078243974000640,2022-07-15,Acabou de publicar uma foto em Jardim Brasil Sp https://t.co/t1Ch5KJnfN
33,1136723095295791104,1548041441317777409,2022-07-15,Horizonte em Parque Vitória https://t.co/JhjoJlZVz2
34,1136723095295791104,1548040586745155590,2022-07-15,De uns dias atrás ❤️✨ em Parque Vitória https://t.co/LUHmeffhgj
35,49053242,1548029239630315521,2022-07-15,"Pensa no silêncio que está aqui em casa hoje? Kkkk 
#Familia #fériasescolares em Bairro Jaçana Sao Paulo https://t.co/EZQbspPq7B"
36,2405282319,1548028596005965825,2022-07-15,Acabou de publicar uma foto em IASD Tucuruvi Oficial https://t.co/8UJH4LJKjl
37,1546470345967812609,1547957961368014850,2022-07-15,Conta pra gente: Qual foi o alimento   que você fez recentemente usando #Café ??? https://t.co/lBvAbD63IJ
38,43470333,1547750647415525377,2022-07-15,"Guardei o meme que a prima @ritadecassia_mr mandou para o fim de semana de temperaturas melhores hehehe 

Finalmente um tempinho melhor pra fermentar a massa

Bora fazer pao com @nitaalimentosoficial em Vila Nivi https://t.co/mpQ371IDZj"
39,727083578278993920,1547701025796042753,2022-07-14,"Estou esperando vcs, a partir das 21 horas, eu e o DJ Valdeci para escutar o programa Dreams of Love, Acesse  https://t.co/q7hXKokagd em Jaçanã https://t.co/Pc1EV4akdv"
40,1238944145118580737,1547631742663634944,2022-07-14,"Saí para almoçar e fiz o meu pedido sem dó pq to com fome e com vontade. O garçom “é tudo pra senhora?!” 😒

Pessoal precisa normatizar a comilança e o date de uma pessoa só 🙄"
41,1546470345967812609,1547617024251027457,2022-07-14,"Só aqui no Felicittá Caffé!!!
Av. Mém de Sá, 66 - Jd. Vila Galvão 
Guarulhos/SP. https://t.co/wDy9ArpwFR"
42,1193949410050347010,1547379531497062402,2022-07-14,Tô no shopping
43,15443874,1547378458082553856,2022-07-14,Acabou de publicar uma foto em Continental 2 -Guarulhos https://t.co/KcY5E3kHLL
44,2157693788,1547268998827544580,2022-07-13,Kkkkkk
