,author_id,tweet_id,created_at,text
0,1502403102359629826,1566537936912646144,2022-09-04,"Ela acha que manda em casa,
Eu finjo que obedeço haha.
E ta tudo certo 😃😃 em Onde Deus Está Presente https://t.co/rjNpedqOp3"
1,2149085621,1566522911724343298,2022-09-04,Acabou de publicar uma foto em Condomínio Green Hill https://t.co/dB2r1vFxmT
2,100560298,1566482123548426240,2022-09-04,"🤗 +1 semana de escolinha 👦🏫✔️
#escolinha #meufilhominhavida em Escola Calovini https://t.co/siuxcNvEDV"
3,352594856,1566241580972900353,2022-09-04,"Acabou de publicar uma foto em Jaragua, Zona Oeste, São Paulo Capital https://t.co/cvFi4v7Mpa"
4,338086978,1566237174005104641,2022-09-04,Acabou de publicar uma foto em Onde Deus Está Presente https://t.co/CS3KfShhbG
5,338086978,1566233445864439814,2022-09-04,Acabou de publicar uma foto em Onde Deus Está Presente https://t.co/dCmvPQ9DXH
6,32640324,1566210332716056577,2022-09-03,"Foto muito linda pra ficar na galeria 

Por vcs e pra vcs sempre em Pirituba https://t.co/fCxm2vf3sF"
7,215596444,1566134378249568259,2022-09-03,Tá olhando o que! 🙏🏿🙏🏿🙏🏿🙏🏿😭😭😭 #sjcausa #porraí #amizade https://t.co/WY4ZK6dNVb
8,1164150904121114629,1566128699795193858,2022-09-03,Você se lembra de quando ingressou no Twitter? Eu me lembro! #MeuAniversárioNoTwitter https://t.co/3TCTIuytPY
9,39267584,1566114404277567490,2022-09-03,"I'm at Quadra da Escola de Samba Dragões da Real in São Paulo, SP https://t.co/aqKHB54ZRQ"
10,77802114,1566101635784650754,2022-09-03,"@tilt_uol X, mas https://t.co/kfYXijozll"
11,352594856,1566079375807844354,2022-09-03,"Acabou de publicar uma foto em Jaragua, Zona Oeste, São Paulo Capital https://t.co/ZLI118SqLe"
12,367127755,1566038028996546560,2022-09-03,Acabou de publicar uma foto em Alphaville 3 https://t.co/GSdoVqrc26
13,1191808401325666305,1565910923415527425,2022-09-03,como sempre 😌😌😌 em Fenda Do Biquini https://t.co/YBNnLHg5yy
14,24987794,1565897560145162241,2022-09-03,"Hoje é Seu Dia @criscampoi 

🎂FELIZ ANIVERSÁRIO 🎉

❤️ Me sinto privilegiado em ter você ao meu lado hoje e sempre ❤️

💓Te Amo 💞 em Vila Mangalot https://t.co/BdQv8jie2r"
15,964949259773759488,1565871029045661696,2022-09-03,Acabou de fazer 18 anos e agora já posso postar os vídeos dele se masturbando e gozando 🍆👅🔞 22 Cm @divulgandonudes @DotadosPintocom https://t.co/uw3ebcZceG
16,338086978,1565847455488425984,2022-09-02,Acabou de publicar uma foto em Onde Deus Está Presente https://t.co/UUqBvzTdtG
17,150413399,1565817350062055425,2022-09-02,Acabou de publicar uma foto em Resort &amp; Convention Tauá Atibaia https://t.co/5wYobmafj8
18,1546741641414844417,1565775820177694721,2022-09-02,E sei edileusa rodrigues santos
19,1546741641414844417,1565775816604221440,2022-09-02,É sei https://t.co/GZchXC0c9b
20,38635921,1565750871790878720,2022-09-02,Just posted a photo @ Autódromo José Carlos Pace https://t.co/IfChHw1UO0
21,240800341,1565692768260947969,2022-09-02,"Vamos entrar às 10:30 horas

https://t.co/jkLwi8EhKW em Pirituba https://t.co/WLmVcbUHoE"
22,1482432073919082505,1565543897937453059,2022-09-02,Babando aqui 🤤 https://t.co/P5UtRto8SJ
23,217871086,1565510995249881089,2022-09-02,"🤗 @tico.srd em Vila Anastácio, Sao Paulo, Brazil https://t.co/XUrWVcnIM8"
24,2149085621,1565470789994168322,2022-09-01,Acabou de publicar uma foto em Condomínio Green Hill https://t.co/0qgfDhLXAS
25,1676923554,1565434661089714176,2022-09-01,Acabou de publicar uma foto em Rocca Eventos https://t.co/VQtliVwOhL
26,203973686,1565427197216784387,2022-09-01,"I'm at Estação Jaraguá (CPTM) - @cptm_oficial in São Paulo, SP https://t.co/oq9RugGblv"
27,138710056,1565413522951077888,2022-09-01,"E hoje comemoramos formalmente o nascimento do ser vivo mais de boa que mora lá em casa! Veio medrosa, acanhada, fraquinha…. Hoje tá aí, pagando de madame :-)

Parabéns pelos 8 anos Katara! (Sim, inspirada no Avatar) https://t.co/EvskREEx2o"
28,338086978,1565380322451419136,2022-09-01,"Quando tudo parece errado, tudo está correto aos olhos de Deus.
À Ele toda honra e toda glória. em Onde Deus Está Presente https://t.co/gU84BSQfrc"
29,203973686,1565342426218512384,2022-09-01,I'm at Colégio Morales Lopes https://t.co/NDHDaBiL3j
30,203973686,1565341362110619655,2022-09-01,"I'm at Estação Jaraguá (CPTM) - @cptm_oficial in São Paulo, SP https://t.co/Ui93AzCI0x"
31,2669823832,1565335509639077894,2022-09-01,Acabou de publicar uma foto em Onde Deus Está Presente https://t.co/bIcqR0Hssl
32,352594856,1565318221900677120,2022-09-01,"Acabou de publicar uma foto em Jaragua, Zona Oeste, São Paulo Capital https://t.co/ZC1kG6bfwS"
33,338086978,1565300110493634560,2022-09-01,Acabou de publicar uma foto em Onde Deus Está Presente https://t.co/rf8m3mD5fQ
34,4484332348,1565182246591635456,2022-09-01,Just posted a photo @ ADM Família em Cristo https://t.co/JWETFPecMj
35,338086978,1565153655841587201,2022-09-01,Just posted a photo @ Onde Deus Está Presente https://t.co/ZgPN61xm1z
36,215596444,1565104441233137666,2022-08-31,#porraí #sjcausa @randonneurs_sp https://t.co/VUpYJRpT08
37,338086978,1564984244589543424,2022-08-31,Acabou de publicar uma foto em Onde Deus Está Presente https://t.co/bMOwmhlOwq
38,338086978,1564961949313826816,2022-08-31,"O processo de avaliação é complexo e exige engajamento e responsabilidade do avaliador.
Ferramentas que auxiliam na modelagem dos dados e compartilhamento são essenciais neste processo. 
Um pouco da minha manhã ❤️😍✨️❤️😍 https://t.co/pHi4HPHBSh"
39,2669823832,1564954669830520832,2022-08-31,Acabou de publicar uma foto em Onde Deus Está Presente https://t.co/TcnuS7uQS7
40,2149085621,1564939008907816961,2022-08-31,Acabou de publicar uma foto em Condomínio Green Hill https://t.co/Aa6q89ujZJ
41,2149085621,1564795058670501890,2022-08-31,Acabou de publicar uma foto em Condomínio Green Hill https://t.co/5h4vSAs3rm
42,2149085621,1564794046899519489,2022-08-31,Acabou de publicar uma foto em Condomínio Green Hill https://t.co/KY6GIQqD58
43,2149085621,1564737563222773760,2022-08-30,Acabou de publicar uma foto em Condomínio Green Hill https://t.co/LSN48Pnbqi
44,4484332348,1564701248573657097,2022-08-30,Acabou de publicar uma foto em ADM Família em Cristo https://t.co/klKdxSFErQ
45,2149085621,1564673206686027782,2022-08-30,"O meu muito obrigado à todos que nos ajudaram...
#acaosocialnavquerubin 
#igrejanascentedeaguaviva em Condomínio Green Hill https://t.co/moBu1ROpgc"
46,1535071416055382028,1564627813650599936,2022-08-30,"MODA Masculina no @enjoei: camisa slim fit 100% algodão com manga curta.

Quem vai querer desconto? Whatsapp 11 99168-8262 
https://t.co/vk5SEvAVZe"
47,59855164,1564588986798166016,2022-08-30,Vim parar num fim de mundo
48,2149085621,1564432843912142848,2022-08-30,Acabou de publicar uma foto em Condomínio Green Hill https://t.co/BYCefG61QT
49,42518664,1564369944325783561,2022-08-29,"@ReginaldoYeoman Boa, Reginaldo! Sempre ouvi falar da Comedoria Gonzales e de uma pizza que tem ali no mercadão também, mas nunca fui. Adoro empanadas e quase sempre que a vontade bate acabamos indo, a namorada e eu no La Guapa mesmo. Mas isso agora vai mudar! 
Valeu a dica!
@nadiaelassal"
