,author_id,tweet_id,created_at,text
0,42518664,1564369944325783561,2022-08-29,"@ReginaldoYeoman Boa, Reginaldo! Sempre ouvi falar da Comedoria Gonzales e de uma pizza que tem ali no mercadão também, mas nunca fui. Adoro empanadas e quase sempre que a vontade bate acabamos indo, a namorada e eu no La Guapa mesmo. Mas isso agora vai mudar! 
Valeu a dica!
@nadiaelassal"
1,78507844,1564349241668997120,2022-08-29,Acabou de publicar uma foto em Onde Deus Está Presente https://t.co/X6VKVdmXkn
2,954143404753113089,1564344457385984004,2022-08-29,"It means being myself because I feel very good and happy being a fan of Louis, the songs calm me in an inexplicable way and being able to hear them live was one of the best things in my life. I love being part of this fandom #LT369"
3,1090022231927914497,1564258467128434691,2022-08-29,eu vou parar de tomar gin em Onde Deus Está Presente https://t.co/5JJetHR0nq
4,588417680,1564216513653256193,2022-08-29,"Venha nos conhecer ♡

Whats : 11 97203-5066 

#casamento #noivos #noiva  #alegria em Brazilian Show https://t.co/rqiz7VFZMl"
5,1676923554,1564215615392546816,2022-08-29,Acabou de publicar uma foto em Rocca Eventos https://t.co/8wC4xLgDcP
6,209026290,1564088768390365186,2022-08-29,Acabou de publicar uma foto em Vila Mangalot https://t.co/oRcx5cVjLy
7,2149085621,1564078969934290946,2022-08-29,Acabou de publicar uma foto em Condomínio Green Hill https://t.co/Juw3BjH99Z
8,1506998859053998083,1564008469006516225,2022-08-28,"Acabou de publicar uma foto em São Paulo, Capital https://t.co/uLjP7azEaq"
9,1246072929772646401,1563925672019492873,2022-08-28,#top🔝 linda @prycylla 👑🍷🇧🇷❤️👏 em Moura Cabeleireiros https://t.co/pDAZm8JlY4
10,2149085621,1563889999413641217,2022-08-28,Acabou de publicar uma foto em Condomínio Green Hill https://t.co/d4mGeIdeO6
11,2149085621,1563884463767126016,2022-08-28,Acabou de publicar uma foto em Condomínio Green Hill https://t.co/PrWNzgO8Ov
12,2149085621,1563883508371783680,2022-08-28,"Vou devolver com algo a mais...
#catrynelion 
#miahcatryneelion em Condomínio Green Hill https://t.co/XKFdw7rJS0"
13,2149085621,1563876521034612736,2022-08-28,Nós ajudem com qualquer doação para continuarmos este maravilhoso trabalho. em Condomínio Green Hill https://t.co/ThBlxWN6xz
14,131494231,1563720839757021185,2022-08-28,Acabou de publicar uma foto em Pq São Domingos https://t.co/ODhRYKH61L
15,287979370,1563713106102173696,2022-08-28,"Hoje é aqui na @dragoescarnaval, define seu samba enredo para 2023.

Samba 3 já fez sua apresentação na quadra. Samba 4 em preparação! https://t.co/B0tS46Hx7w"
16,3216267458,1563634192814149634,2022-08-27,Com minha rainha te amo mãe em Jardim Regina https://t.co/9N6ELBp1Pk
17,352594856,1563621036444291073,2022-08-27,"Acabou de publicar uma foto em Jaragua, Zona Oeste, São Paulo Capital https://t.co/JbKvFK2K1A"
18,2149085621,1563592591899508741,2022-08-27,Nós ajudem a continuar este trabalho... em Condomínio Green Hill https://t.co/8FzHf8YPjW
19,209026290,1563555084318830600,2022-08-27,Acabou de publicar uma foto em Vila Mangalot https://t.co/Dfp3fB8cbl
20,53266199,1563520819862843392,2022-08-27,Acabou de publicar uma foto em Onde Deus Está Presente https://t.co/IpzCv918lW
21,338086978,1563363616887570437,2022-08-27,Acabou de publicar uma foto em Onde Deus Está Presente https://t.co/NwkmxVHbAz
22,338086978,1563317748469403648,2022-08-27,Acabou de publicar uma foto em Onde Deus Está Presente https://t.co/pm2GYA2yKE
23,338086978,1563258244381831170,2022-08-26,Meus amores em Onde Deus Está Presente https://t.co/kFbJ2x1j71
24,903110053179392000,1563175430093279239,2022-08-26,"Quadrangulaguai Brasil X Uruguai.
Parabéns Maurício Lima pelo evento. 
Presença confirmada do Time Brasil Vôlei Master em Instituto Madre Mazarello https://t.co/YguA2Nny2D"
25,1251166912492515328,1562828689829531648,2022-08-25,"SAVE THE DATE 07-SETEMBRO
😭😭😭😭😭"
26,1267628653325795330,1562823188492746757,2022-08-25,"Oi  gente 
Tudo bem? https://t.co/iUJISsXJe8"
27,2669823832,1562813409523286019,2022-08-25,Acabou de publicar uma foto em Onde Deus Está Presente https://t.co/CblSosvhNN
28,2615619241,1562810993348030464,2022-08-25,"Faz tempo que não posto nada pra vocês… Então toma essas duas fotos do final de semana que fui no shopping assistir Thor haha achei um máximo, assistam!

Segunda foto eu amooo demais esse homem minha gente! 😍🫶🏻 https://t.co/FZFyWv9jAK"
29,352594856,1562803837382959111,2022-08-25,"Acabou de publicar uma foto em Jaragua, Zona Oeste, São Paulo Capital https://t.co/QJ3U4UTtv9"
30,1676923554,1562800356945305603,2022-08-25,Acabou de publicar uma foto em Rocca Eventos https://t.co/90xOgUWfCS
31,2149085621,1562620432393506816,2022-08-25,Acabou de publicar uma foto em Condomínio Green Hill https://t.co/MeKTTfx5Cm
32,2149085621,1562461262638104581,2022-08-24,Acabou de publicar uma foto em Condomínio Green Hill https://t.co/Dc9HFcKeK2
33,170497442,1562431668757360640,2022-08-24,Pedal Noturno Urbano. em parque Leopoldina villas boas https://t.co/U6Wt2A3Fpn
34,215596444,1562411769179643904,2022-08-24,#porraí https://t.co/GR3POhVBC8
35,170497442,1562410828510679045,2022-08-24,"Pedal Noturno Urbano.
Passando pelo Parque Leopoldina Vila Lobos na região da Marginal Tietê SP. em parque Leopoldina villas boas https://t.co/IrtozdGcUX"
36,1513647676059000834,1562400188916023296,2022-08-24,Q odioooooo https://t.co/D27xFBYBYh
37,2669823832,1562285286641397760,2022-08-24,Acabou de publicar uma foto em Onde Deus Está Presente https://t.co/LPQB5XfIpX
38,588417680,1562276382104645635,2022-08-24,"Eita alegria !!
Venha conhecer nosso trabalho,  vc vai amar !!

#noiva2023 #casamento #festa em Brazilian Show https://t.co/1mXH1rTia1"
39,4484332348,1562272814471815169,2022-08-24,Congresso de jovens https://t.co/0Vc7K9OZP7
40,4484332348,1562272521671557120,2022-08-24,Boa noite a todos vocês
41,588417680,1562270293548494848,2022-08-24,"Com bateria nota 10, lindas dançarinas e um repertório super animado vamos fazer o diferencial da sua festa.

#festa #alegria #casamento #noiva #noivo #noiva2023 em Brazilian Show https://t.co/osV1I9fTDa"
42,203973686,1562156131916681216,2022-08-23,"I'm at Estação Jaraguá (CPTM) - @cptm_oficial in São Paulo, SP https://t.co/X2yXc7Z95J"
43,103638498,1562122572501852160,2022-08-23,Tomei a 4a dose na empresa. &lt;3 https://t.co/aBclUXSOIJ
