,author_id,tweet_id,created_at,text
0,2149085621,1562461262638104581,2022-08-24,Acabou de publicar uma foto em Condomínio Green Hill https://t.co/Dc9HFcKeK2
1,170497442,1562431668757360640,2022-08-24,Pedal Noturno Urbano. em parque Leopoldina villas boas https://t.co/U6Wt2A3Fpn
2,215596444,1562411769179643904,2022-08-24,#porraí https://t.co/GR3POhVBC8
3,170497442,1562410828510679045,2022-08-24,"Pedal Noturno Urbano.
Passando pelo Parque Leopoldina Vila Lobos na região da Marginal Tietê SP. em parque Leopoldina villas boas https://t.co/IrtozdGcUX"
4,1513647676059000834,1562400188916023296,2022-08-24,Q odioooooo https://t.co/D27xFBYBYh
5,2669823832,1562285286641397760,2022-08-24,Acabou de publicar uma foto em Onde Deus Está Presente https://t.co/LPQB5XfIpX
6,588417680,1562276382104645635,2022-08-24,"Eita alegria !!
Venha conhecer nosso trabalho,  vc vai amar !!

#noiva2023 #casamento #festa em Brazilian Show https://t.co/1mXH1rTia1"
7,4484332348,1562272814471815169,2022-08-24,Congresso de jovens https://t.co/0Vc7K9OZP7
8,4484332348,1562272521671557120,2022-08-24,Boa noite a todos vocês
9,588417680,1562270293548494848,2022-08-24,"Com bateria nota 10, lindas dançarinas e um repertório super animado vamos fazer o diferencial da sua festa.

#festa #alegria #casamento #noiva #noivo #noiva2023 em Brazilian Show https://t.co/osV1I9fTDa"
10,203973686,1562156131916681216,2022-08-23,"I'm at Estação Jaraguá (CPTM) - @cptm_oficial in São Paulo, SP https://t.co/X2yXc7Z95J"
11,103638498,1562122572501852160,2022-08-23,Tomei a 4a dose na empresa. &lt;3 https://t.co/aBclUXSOIJ
12,203973686,1562088213241630720,2022-08-23,I'm at Colégio Morales Lopes https://t.co/YxfT7aAeNh
13,203973686,1562087993325805568,2022-08-23,"I'm at Estação Jaraguá (CPTM) - @cptm_oficial in São Paulo, SP https://t.co/tYTBk9LWWB"
14,352594856,1562071685234401281,2022-08-23,"Acabou de publicar uma foto em Jaragua, Zona Oeste, São Paulo Capital https://t.co/oiPtBiEhs5"
15,2149085621,1562041704819044352,2022-08-23,Acabou de publicar uma foto em Condomínio Green Hill https://t.co/0pRVkSKYnp
16,1441770051263078402,1562021648731185154,2022-08-23,"Qual a necessidade de sentar desse jeito?

Fora o inchaço dos testículo devido a um  câncer, não entendo.

E ainda acham ruim de alguém dizer algo a eles.

O sexo forte 🙄

@CPTM_oficial @DiariodaCPTM https://t.co/Kqq2Zi4jVK"
17,1101524097060745218,1561903595083153408,2022-08-23,"“Às vezes dá vontade de largar tudo, mas a graça de Deus que nos sustenta…” https://t.co/ILxyrYHgHi"
18,2149085621,1561895069954752515,2022-08-23,Dispensa legendas... em Condomínio Green Hill https://t.co/znN34DcXGm
19,1497281568305524743,1561784012695273478,2022-08-22,Love ❤️ https://t.co/cLv7FbW2BO
20,53266199,1561682785143623680,2022-08-22,Acabou de publicar uma foto em Onde Deus Está Presente https://t.co/7rrNh99n1A
21,1369623308728172545,1561542124633464832,2022-08-22,"#VIENNA: When will you realize, Vienna waits for you?
 “um dia, em algum momento, por algum motivo…”
texto: “carolyna” de @gabisteca2 recitado por @bcarolynaa https://t.co/ut74PvAcIk"
22,42395056,1561540682015051777,2022-08-22,Acabou de publicar uma foto em Onde Deus Está Presente https://t.co/uoRtY22RYF
23,42518664,1561476870461239296,2022-08-21,"@rodcasarin Boa, meu amigo! Parabéns pela conquista!
Feliz por você! 🤘🏼👏"
24,215596444,1561472761499123712,2022-08-21,my friend #porraí #sjcausa https://t.co/87Dpv0NdFy
25,255310121,1561356940743254021,2022-08-21,"Deus te vê, Deus te ouve, Deus te conhece e te chama pelo nome. 🙌🏾 Deus SABE. Deus OUVE. Deus VÊ. 🧡 em Onde Deus Está Presente https://t.co/lQB7ibXkai"
26,2806251105,1561292462307540992,2022-08-21,Os seus pensamentos não denunciam os meus atos. em Caism Philippe Pinel https://t.co/2OHmrIc3a3
27,1440093031068176390,1561210980943667200,2022-08-21,"Filha, quando me tornei sua mãe, eu conheci o verdadeiro amor da minha vida: você! 💝 https://t.co/ZhbcEYMGno"
28,149574537,1561161431634137090,2022-08-21,"⚠️GATINHO NA ZO DE SP⚠️
resgatado em frente à estação pirituba, hoje por volta de 20:40h. macho dócil de porte médio. por conta do frio está na minha casa! você sabe de quem possa ser???
você pode dar um lar temporário a ele?
RT RT RT RT RT RT RT https://t.co/7mUb9XWtwV"
29,188090798,1561154358875631617,2022-08-21,"My car, rock'n roll, the 50's, we complete each other! em Jardim Santo Elias, Pirituba https://t.co/Nr0rrezJRH"
30,215596444,1561131976232411137,2022-08-20,#porraí https://t.co/u9c7fsnHAx
31,52751599,1561102312298381317,2022-08-20,#fl7 #interlagos #f1600 #mastertv #racetv #broadcasting #take #film #action em Autódromo José Carlos Pace https://t.co/3Eh7Zg978T
32,708065550426054656,1561081519409692672,2022-08-20,"É preciso viver malandro, assim não dá pra se, se, se segurar, não
A cana tá brava e a vida tá dura
mas um tiro sá não vai me derrubar não
- @lobaoeletrico"
33,27886961,1560995068953108480,2022-08-20,"Numa esquina qualquer na Vila dos Remédios, tremulando. https://t.co/nXLN0sC2Rq"
34,100560298,1560944845341859841,2022-08-20,"👶🎒 +1 semana de escolinha 🏫
#escolinha #meufilhominhavida em Escola Calovini https://t.co/9UXs5S6qPd"
35,1560760530360492032,1560762084157276162,2022-08-19,Pipoca minha lindinha.bjs Bacci https://t.co/sZKGsfCvrR
36,2982764477,1560761133207900164,2022-08-19,#meupetnocidadealerta Lara e o Gustavo... ❤ ❤ demais https://t.co/T9w5VbVOUU
37,1560735094129713162,1560758769453338625,2022-08-19,"@cidadealerta Bacci esse é o Batman, ele parece com o Percival com esse olhar qdo vc pergunta algo pra ele.  😻 Estamos no Jaraguá SP

#petnocidadealerta https://t.co/fuIEdPXXvD"
38,1560735094129713162,1560745700283015175,2022-08-19,"@cidadealerta Esse é o Batman.... muito frio aqui. Jaraguá SP

#meupetnocidadealerta https://t.co/Y5ON0o6ISo"
39,1560733566857879554,1560735672574455808,2022-08-19,"meus bebês Beckie,Mihaji e Honda#meupetnocidadealerta https://t.co/41ZdbryGJi"
40,1560650835268251654,1560656984818749440,2022-08-19,"Quem Se Afastou De Mim Continua Assim, Quando O Progresso For Aparecendo Não Quero Sorrisinho Falso Não.☯🎭 https://t.co/qdOMvnebTa"
41,1560650835268251654,1560655694365265921,2022-08-19,"Antes era quarteto, trio e dupla, hoje é só eu, com o tempo eu percebi que é melhor sozinho do que mal acompanhado.🤝🏽☯️ https://t.co/NmxLq7Rizc"
42,58324893,1560632288404279296,2022-08-19,"Hoje é um dia muito especial! É o dia dela! 👏🏽👏🏽👏🏽
@prirsanches @nutripriscilasanches ♥️♥️♥️
Parabéns pelo seu aniversário! Eu e as meninas te desejamos muita paz e alegria!
Te amamos! em Parque Maria Domitila https://t.co/cETd4rFu7O"
43,1388503503648219140,1560441327262830592,2022-08-19,https://t.co/qaD38XHjdo
44,338086978,1560419357921923072,2022-08-19,Acabou de publicar uma foto em Onde Deus Está Presente https://t.co/jccCnw292H
45,961663380,1560414200077459458,2022-08-18,"O cansaço olha pra mim e ri, mas a gratidão dá gargalhada. em Pirituba https://t.co/dEFfvaizrO"
46,42518664,1560398619143979008,2022-08-18,"@LeviTrindade Que legal lembrar desse dia, Levi. Eu estava lá e o Boss fez o melhor show que eu já vi na vida. Passou de 3h em cima do palco e não saiu em momento algum!
Grande dia!!"
47,1541381394722693121,1560375617857748997,2022-08-18,Odeio ficar sem luz https://t.co/boitVToR8t
48,1299879679504142336,1560273682638856192,2022-08-18,Machetaria para frente de gaveta by Nó na Madeira em Pirituba https://t.co/7VUz1yv82O
