,author_id,tweet_id,created_at,text
0,217543875,1547706081748459529,2022-07-14,Aulas de Guitarra 🎸    11 97125-5932 WhatsApp https://t.co/vpLgT87q2D
1,2149085621,1547694611757379585,2022-07-14,Acabou de publicar uma foto em Condomínio Green Hill https://t.co/8FBQOBTKpk
2,1456417849447178243,1547632593507475459,2022-07-14,"Ser criança preta e ter autoestima é uma construção necessária de base. Que nos possibilitemos nessa construção nas escolas, em casa, nas bibliotecas… https://t.co/cZ9wS9hhOu"
3,2149085621,1547521606322454529,2022-07-14,Acabou de publicar uma foto em Condomínio Green Hill https://t.co/WAdqlExDpw
4,3297852068,1547456124781318144,2022-07-14,Esboço… em Condomínio Bosque Jaraguá https://t.co/sS2SV2hPkC
5,41395586,1547300126040854530,2022-07-13,Acabou de publicar uma foto em Onde Deus Está Presente https://t.co/ATXocbmG8X
6,62119963,1547271257376395269,2022-07-13,Acabou de publicar uma foto em Banheirooooooo https://t.co/q1JwEqD9ut
7,94150452,1547226951240204288,2022-07-13,Bom dia!!! Precisando de guincho solicite orçamento 📱97999-6529 #zonasulguincho #guincho24horas #autosocorro #guinchosp #guinchomoto #guinchoplataforma #guincho24hrs #santana #vilajaguara em Vila Jaguara https://t.co/zgJ53AuLpu
8,41395586,1547198322506551296,2022-07-13,Acabou de publicar uma foto em Onde Deus Está Presente https://t.co/8xcmQoOPbv
9,1130257727933091848,1547176431112912896,2022-07-13,#bdsp dia do Rock 🎸 mais que especial no “quintal de casa” https://t.co/Ns53HeJp5w
10,28554800,1546965431604461568,2022-07-12,"Sem internet desde as 11:00 da manhã, previsão de retorno só amanhã? Obrigado @ClaroBrasil pela qualidade do serviço prestado https://t.co/wdHucZfRVi"
11,100560298,1546960173440311296,2022-07-12,"😅🥋 treino de Jiu Jitsu tradicional do meio-dia, quem é sabe como são esses treinos de meio-dia né uhauhauhauha 😂

Seguimos trabalhando 😅⚒️
OSS 🥋🦁
#jiujitsu #jiujitsuparatodos em MG Personal Training https://t.co/4IhHALw9dL"
12,100560298,1546957551245201408,2022-07-12,"😉⚒️ dia de se destruir para se tornar mais forte!
Porque força só é ruim pra quem não tem 😂
#preparacaofisica #levantamentodepeso em MG Personal Training https://t.co/S0Vez9fvsq"
13,50213510,1546905829026168832,2022-07-12,"Vendo assim, nem parece o Taz-Mania que não deixa a gente nem dormir a noite. em Condomínio Grand Reserva Paulista - MRV https://t.co/1XECIBSOfh"
14,41395586,1546829692967084037,2022-07-12,Acabou de publicar uma foto em Onde Deus Está Presente https://t.co/ajI6v7Xh69
15,1191808401325666305,1546690340844802049,2022-07-12,"podia ser a gente, né? mas você não gosta do Bob Esponja 💔😔 em Fenda Do Biquini https://t.co/61pLN6XcV9"
16,636324633,1546683306665803776,2022-07-12,Acabou de publicar um vídeo em Autódromo José Carlos Pace https://t.co/6ozAVSZ0P5
17,82245238,1546524265406574597,2022-07-11,Meu lugar é aqui ❤️ em Onde Deus Está Presente https://t.co/2Hf7OC96VR
18,170497442,1546453403580203012,2022-07-11,"Pedal a Longa Distância.
Qth de destino Jaguariúna SP. 
Recordação. em Rodovia dos Bandeirantes https://t.co/vm4EcC2MUO"
19,503910942,1546279748648800257,2022-07-10,https://t.co/TrIb0HX08G
20,503910942,1546279629312466947,2022-07-10,https://t.co/ahuj9QMvPZ
21,2149085621,1546222465659150338,2022-07-10,Acabou de publicar uma foto em Condomínio Green Hill https://t.co/nfGFCxCPMs
22,215596444,1546192139419357188,2022-07-10,#porraí #amizade https://t.co/VoaA1WEsv2
23,61850588,1546191351016046594,2022-07-10,Acabou de publicar uma foto em Cyrela Mond https://t.co/nJW9WpgyJz
24,3157625183,1546171970164858880,2022-07-10,Acabou de publicar uma foto em São Paulo https://t.co/omwJSxF3cJ
25,42395056,1546171677976961027,2022-07-10,#domingouu 💕 em Onde Deus Está Presente https://t.co/JjzcSyrfwj
26,1351173937770725382,1546171296261849088,2022-07-10,On feet em Estação Pirituba https://t.co/DIWvCnhVuQ
27,2149085621,1546074689818312704,2022-07-10,Bom dia! em Condomínio Green Hill https://t.co/gcBiyRGbxB
28,1304509993358708739,1546031398821273600,2022-07-10,Acabou de publicar uma foto em Viação Gato Preto - G1 https://t.co/3BfZPWz9qJ
29,39267584,1545903246358839297,2022-07-09,"I'm at Quadra da Escola de Samba Dragões da Real in São Paulo, SP w/ @satojeff https://t.co/qxzPQyiFk2"
30,62678617,1545844844798656513,2022-07-09,Acabou de publicar uma foto em Villa do Lago https://t.co/rtw7CJrxpz
31,240814091,1545732894039195648,2022-07-09,"Drop 🎬

#professorkauesimioni #educacaofisica #sindronemetabolica #exerciciofisico #atividadefisica #hipertensão #resistenciaainsulina #diabetestipo2 #dislipidemia #obesidade https://t.co/urUu45QHjT"
32,77919101,1545611636421132288,2022-07-09,21km serra do mar em Serra Do Mar - Estrada velha De Santos https://t.co/x07hNOAyJj
