,author_id,tweet_id,created_at,text
0,1250726909513797632,1645547703349268481,2023-04-10,"Páscoa já passou mais a ainda e tempo de como chocolate servidos.
@Eiwalt3 https://t.co/P5csofK7pi"
1,2893437569,1645515590885408770,2023-04-10,Era cego e nem percebia😅 https://t.co/g34aAQnTQz
2,1250726909513797632,1645212824598192133,2023-04-09,Após o banho bora descansar q amanhã e outro dia. https://t.co/gk4dojAk7J
3,1250726909513797632,1645212567864766471,2023-04-09,"Gozei bem no banho em será q estavana vontade .
@Eiwalt3 https://t.co/bLhIUfhkaB"
4,1549526825889677317,1645209268964978688,2023-04-09,SALÃO DE FESTAS ALUGO ZS https://t.co/lx1hEdJGfv
5,1250726909513797632,1644407432062410753,2023-04-07,Quinta rosa estava por TD caralho   véspera de feriado com show desse maravilhoso Dito amo adoro sua humildade  e seu carisma sou seu fãs sei lindo https://t.co/3Q4q2se0Al
6,1460078754521305092,1643800129034485767,2023-04-06,favela que paz.🕊️
7,1643449202830200839,1643456650471264258,2023-04-05,Pião na comunidade de SP tmj Bigode !! https://t.co/SoPoUH6wUs
