,author_id,tweet_id,created_at,text
0,89541789,1541879533737230336,2022-06-28,Qdo eu virar um Super Sayajin eu paro… (talvez assim cresça cabelo)… #muscle #musculção #estilodevida #smartfit #smartfitcapelinha em Smart Fit Capelinha https://t.co/VqK23mk8xY
1,1262087647037739009,1541871334141165569,2022-06-28,"Whatsapp: 11 4385 1957 💞

#Maiô #Biquini #SexShop #Lingerie #Sutiã #Calcinha #Pijamas #PlusSize #Mulher 
#ModaFeminina #Fantasia #EmbuDasArtes #SantoEduardo 

Consulte disponibilidade das peças 💞 em Espaço com Você https://t.co/5TtCsIfqaJ"
2,1262087647037739009,1541870917399224325,2022-06-28,"Whatsapp: 11 4385 1957 💞

#Maiô #Biquini #SexShop #Lingerie #Sutiã #Calcinha #Pijamas #PlusSize #Mulher 
#ModaFeminina #Fantasia #EmbuDasArtes #SantoEduardo 

Consulte disponibilidade das peças 💞 em Espaço com Você https://t.co/9X3QfAbMiH"
3,463352084,1541826881242144769,2022-06-28,Acabou de publicar uma foto em Jd Santo Eduardo Embú Das Artes https://t.co/OJssXpCnNx
4,1527082163908317185,1541823339571908610,2022-06-28,https://t.co/T07v2TKD8r
5,1250726909513797632,1541786524773228544,2022-06-28,Fotinha na academia https://t.co/RwI9pv7gom
6,142325755,1541729035516010498,2022-06-28,"I'm at Padaria Nova Juliana in São Paulo, SP https://t.co/dQiB2l2VRA"
7,104021345,1541687981420847104,2022-06-28,Acabou de publicar uma foto em Primeira Igreja Batista em Pq. Fernanda https://t.co/otak9fKF8H
8,1207039370018119682,1541624076963151872,2022-06-28,"Um ano especial onde todos perdemos algo, vamos fazer a diferença na vida dessas crianças. em Futuro Certo https://t.co/NeG8XUQLRt"
9,922136860444459008,1541617342584848385,2022-06-28,Acabou de publicar uma foto em Extremo Sul - De São Paulo https://t.co/CAOgUEp4rA
10,463352084,1541608070131769344,2022-06-28,Acabou de publicar uma foto em Jd Santo Eduardo Embú Das Artes https://t.co/mYTQSi1yQL
11,35823935,1541606253746475011,2022-06-28,"Meu pai todo elegante em sua roupa de trabalho juntamente com Zé Alegre, seu guarda-costas , no final dos anos 50.
#fazendaborami#valedoribeira em Vale Do Ribeira https://t.co/DoOBgmxmfK"
12,1250726909513797632,1541543214682865666,2022-06-27,...Banho tomado Ja já academia... https://t.co/B7F586qCKm
13,339183004,1541468027446763520,2022-06-27,"Os #Caranguejeiros !
#CachaçaCaranguejo ,é boa demais!

@cachacacaranguejo em Jd. Macedônia https://t.co/9HwbhIYIWL"
14,1250726909513797632,1541427420615540736,2022-06-27,....Uma foto assim mais simples.... https://t.co/8vxSuSqHAp
15,463352084,1541413836175151105,2022-06-27,Acabou de publicar uma foto em Jd Santo Eduardo Embú Das Artes https://t.co/7DgTIEqit3
16,104021345,1541331010045956097,2022-06-27,Acabou de publicar uma foto em Primeira Igreja Batista em Pq. Fernanda https://t.co/wtNJmQea0F
17,761332360168214530,1541296324854706181,2022-06-27,Qual seria o gamer favorito do mercenário Jr !? 🤔🤔🤔 em Capão Redondo https://t.co/QXUiFSluS9
18,339183004,1541237400512372743,2022-06-27,Acabou de publicar uma foto em Jd. Macedônia https://t.co/nWkidapp9h
19,339183004,1541236888132288512,2022-06-27,Acabou de publicar uma foto em Jd. Macedônia https://t.co/RjOoQ3k0Wp
20,339183004,1541236579141820416,2022-06-27,Acabou de publicar uma foto em Jd. Macedônia https://t.co/xXLCHs7orj
21,339183004,1541115493297393669,2022-06-26,"#SãoJoãoNaFavela 
#SãoJoãoNasQuebradasDeSãoPaulo . em Jd. Macedônia https://t.co/Pk4DSfGnyC"
22,1522974934800252933,1541110939113508865,2022-06-26,Meu eterno princepizinho em Capão City https://t.co/ybchohBfsA
23,206514765,1541072231412838402,2022-06-26,Acabou de publicar uma foto em Sara Nossa Terra Embu https://t.co/OJJmdYcCvs
24,104021345,1541024033323491328,2022-06-26,"DEUS é bom o tempo todo, o tempo todo DEUS é bom. em Primeira Igreja Batista em Pq. Fernanda https://t.co/kdsjv3L1yj"
25,747577257795985409,1541019931042385920,2022-06-26,"Apto a Venda Jd Dom José  R$ 230 Mil  9-7643-7370 Luis Abbade Watts App em Jardim Dom José, Capão Redondo, Extremo Sul https://t.co/OVJPhpjqbn"
26,339183004,1541011120328085504,2022-06-26,"#OsmarGás (11)97241-7002
Qualidade, melhor preço sempre, ligou, pediu, chegou!

#jdeledy #JdMitsutani ,#jdmacedonia #JdRosana e muito mais , zona sul de São Paulo

#bomdia em Jd. Macedônia https://t.co/tfeEQIri0c"
27,104021345,1540969484667740161,2022-06-26,Acabou de publicar uma foto em Primeira Igreja Batista em Pq. Fernanda https://t.co/inrNfSoRNd
28,1250726909513797632,1540935605298790401,2022-06-26,Precisando  de mais amigos assim pra cria conteúdo heheh quem se habilita
29,1250726909513797632,1540933505982648320,2022-06-26,Madruga de sábado após banho bora dormir só falto compainha a noite ser mais animada https://t.co/I5W9RAcdVv
30,727399495,1540909009544388609,2022-06-26,"Ele nos ama amados !!!! 
🎶🎶🎶🎶🎶🎶 https://t.co/BUGDoCFMw7"
31,463352084,1540868524356370432,2022-06-26,Acabou de publicar uma foto em Jd Santo Eduardo Embú Das Artes https://t.co/vtcsVGXact
32,1242073489152057345,1540846831759925250,2022-06-25,Acabou de publicar uma foto em Rua Adoasto De Godói https://t.co/7yKKmqbSkj
33,760242512,1540845489981198340,2022-06-25,Acabou de publicar uma foto em Instituto Antônio Geração do Bem https://t.co/KBCOJcApfI
34,1533985741424009216,1540802216847560705,2022-06-25,"Elias demorou pra restaurar o altar, mas quando terminou e sacrificou, foram apenas segundos para o fogo descer. 🙌🏻🔥"
35,463352084,1540796804496752640,2022-06-25,"Delicioso sequilhos de churros.
Quer fazer uma degustação? Venha nos visitar. em Jd Santo Eduardo Embú Das Artes https://t.co/ohfo4JHd10"
36,162937441,1540737607394627584,2022-06-25,I'm at Habib's in São Paulo https://t.co/sx1SMmfsSA
37,108376328,1540733755605880835,2022-06-25,"Posso resumir tudo o que aprendi sobre a vida: ela continua.
Apaixonar-me por mim foi a melhor queda que já sofri.❣️ em Narnia City https://t.co/7Xcq0EwHI5"
38,339183004,1540729629861748737,2022-06-25,#SãoJoão sem Milho não é São João! em Estrada Pirajussaravalo V https://t.co/hFTYbctVrR
39,104021345,1540608264181690370,2022-06-25,Acabou de publicar uma foto em Primeira Igreja Batista em Pq. Fernanda https://t.co/isjqjnBArF
40,1296722762040397825,1540590466256625665,2022-06-25,"Front seat💺💺💺 in exam😂😂🤣

#explorepage #exam #urdu 
#jawwadakbar03 @ Just Now https://t.co/JyTsFHgekj"
41,192283229,1540519803022090241,2022-06-25,"Farei uma dessa vestida 
com minha  
bem grande  
e colocar 
um banner na 
porta do meu quarto . 
NUNCA LI TANTA 
VERDADE NUMA FRASE SÓ 
 Q SE LIGA A TODOS
 NUM SÓ VOZ KKKKkkkk. https://t.co/7eDUc8kaid"
42,55495952,1540515777811562497,2022-06-25,Acabou de publicar uma foto em Academia Blessed Health https://t.co/je3x4EI5nq
43,760242512,1540515383538499585,2022-06-25,Acabou de publicar uma foto em Instituto Antônio Geração do Bem https://t.co/Wbs4C53J9w
44,339183004,1540471921892069378,2022-06-24,"""Faça tudo o que quiser, só não me deixe ficar sem o amor de uma mulher"".❤️

#boanoite , agora vamos trabalhar Pião!
#caldeirao #maeeutonaglobo #mamaeeutonaglobo #issoaglobomostra #issoaglobonãomostra em Jd. Macedônia https://t.co/GJFZW0lhJs"
45,1246513922150141952,1540465461883699204,2022-06-24,💜 https://t.co/jPU5BCFWdc
46,995002436241719296,1540390943899230210,2022-06-24,Acabou de publicar uma foto em King Lub Lubrificantes https://t.co/a3Fu6Uncwi
47,995002436241719296,1540387801723801600,2022-06-24,Acabou de publicar uma foto em King Lub Lubrificantes https://t.co/IkbOuDSbSV
48,1175913098357694464,1540264742656348161,2022-06-24,"#bdsp  Bom dia!!! Rodrigo o dia nasceu radiante , e Viva São João https://t.co/yVDbaRFjAV"
49,339183004,1540258985743376384,2022-06-24,"#bdspvoltajá 
Tomando banho no trabalho pra economizar a água de casa 😅.
#bdsp #bdspvoltaja

@sabespcia #Sabesp em Jd. Macedônia https://t.co/IImPWQYXSy"
50,104021345,1540242003413405698,2022-06-24,Acabou de publicar uma foto em Primeira Igreja Batista em Pq. Fernanda https://t.co/r9AuP25Eyb
51,463352084,1540159892459339776,2022-06-24,Acabou de publicar uma foto em Jd Santo Eduardo Embú Das Artes https://t.co/RISFGiz1HZ
52,463352084,1540151812711497733,2022-06-24,Acabou de publicar uma foto em Jd Santo Eduardo Embú Das Artes https://t.co/nwcXNJNzG8
53,89541789,1540137823663276032,2022-06-24,O treino hj foi rápido… #muscle #musculação #smartfit #smartfitcapelinha #dc #dccomics #flash em Smart Fit Capelinha https://t.co/UsOS98vkbI
54,463352084,1540131066408828928,2022-06-24,Acabou de publicar uma foto em Jd Santo Eduardo Embú Das Artes https://t.co/zaLXkzJMUZ
55,463352084,1540117079386472449,2022-06-23,Bolo de Baunilha em Jd Santo Eduardo Embú Das Artes https://t.co/JLmyJCHGmw
56,596644061,1540068503520247808,2022-06-23,Boa Tarde...😛😛😛 https://t.co/Gbybvw3zTa
57,463352084,1539976359568502784,2022-06-23,Acabou de publicar uma foto em Jd Santo Eduardo Embú Das Artes https://t.co/Yq1kFF5eHw
58,995002436241719296,1539914224457187328,2022-06-23,Acabou de publicar uma foto em King Lub Lubrificantes https://t.co/suUt1I3W0j
59,104021345,1539881263066136577,2022-06-23,Acabou de publicar uma foto em Primeira Igreja Batista em Pq. Fernanda https://t.co/lUnp9Gi1Km
60,1250726909513797632,1539862454359957505,2022-06-23,Uma fotinha aleatória de vez em quando e bom https://t.co/L2AEkJVuOb
