,author_id,tweet_id,created_at,text
0,1242073489152057345,1540846831759925250,2022-06-25,Acabou de publicar uma foto em Rua Adoasto De Godói https://t.co/7yKKmqbSkj
1,760242512,1540845489981198340,2022-06-25,Acabou de publicar uma foto em Instituto Antônio Geração do Bem https://t.co/KBCOJcApfI
2,1533985741424009216,1540802216847560705,2022-06-25,"Elias demorou pra restaurar o altar, mas quando terminou e sacrificou, foram apenas segundos para o fogo descer. 🙌🏻🔥"
3,463352084,1540796804496752640,2022-06-25,"Delicioso sequilhos de churros.
Quer fazer uma degustação? Venha nos visitar. em Jd Santo Eduardo Embú Das Artes https://t.co/ohfo4JHd10"
4,162937441,1540737607394627584,2022-06-25,I'm at Habib's in São Paulo https://t.co/sx1SMmfsSA
5,108376328,1540733755605880835,2022-06-25,"Posso resumir tudo o que aprendi sobre a vida: ela continua.
Apaixonar-me por mim foi a melhor queda que já sofri.❣️ em Narnia City https://t.co/7Xcq0EwHI5"
6,339183004,1540729629861748737,2022-06-25,#SãoJoão sem Milho não é São João! em Estrada Pirajussaravalo V https://t.co/hFTYbctVrR
7,104021345,1540608264181690370,2022-06-25,Acabou de publicar uma foto em Primeira Igreja Batista em Pq. Fernanda https://t.co/isjqjnBArF
8,1296722762040397825,1540590466256625665,2022-06-25,"Front seat💺💺💺 in exam😂😂🤣

#explorepage #exam #urdu 
#jawwadakbar03 @ Just Now https://t.co/JyTsFHgekj"
9,192283229,1540519803022090241,2022-06-25,"Farei uma dessa vestida 
com minha  
bem grande  
e colocar 
um banner na 
porta do meu quarto . 
NUNCA LI TANTA 
VERDADE NUMA FRASE SÓ 
 Q SE LIGA A TODOS
 NUM SÓ VOZ KKKKkkkk. https://t.co/7eDUc8kaid"
10,55495952,1540515777811562497,2022-06-25,Acabou de publicar uma foto em Academia Blessed Health https://t.co/je3x4EI5nq
11,760242512,1540515383538499585,2022-06-25,Acabou de publicar uma foto em Instituto Antônio Geração do Bem https://t.co/Wbs4C53J9w
12,339183004,1540471921892069378,2022-06-24,"""Faça tudo o que quiser, só não me deixe ficar sem o amor de uma mulher"".❤️

#boanoite , agora vamos trabalhar Pião!
#caldeirao #maeeutonaglobo #mamaeeutonaglobo #issoaglobomostra #issoaglobonãomostra em Jd. Macedônia https://t.co/GJFZW0lhJs"
13,1246513922150141952,1540465461883699204,2022-06-24,💜 https://t.co/jPU5BCFWdc
14,995002436241719296,1540390943899230210,2022-06-24,Acabou de publicar uma foto em King Lub Lubrificantes https://t.co/a3Fu6Uncwi
15,995002436241719296,1540387801723801600,2022-06-24,Acabou de publicar uma foto em King Lub Lubrificantes https://t.co/IkbOuDSbSV
16,1175913098357694464,1540264742656348161,2022-06-24,"#bdsp  Bom dia!!! Rodrigo o dia nasceu radiante , e Viva São João https://t.co/yVDbaRFjAV"
17,339183004,1540258985743376384,2022-06-24,"#bdspvoltajá 
Tomando banho no trabalho pra economizar a água de casa 😅.
#bdsp #bdspvoltaja

@sabespcia #Sabesp em Jd. Macedônia https://t.co/IImPWQYXSy"
18,104021345,1540242003413405698,2022-06-24,Acabou de publicar uma foto em Primeira Igreja Batista em Pq. Fernanda https://t.co/r9AuP25Eyb
19,463352084,1540159892459339776,2022-06-24,Acabou de publicar uma foto em Jd Santo Eduardo Embú Das Artes https://t.co/RISFGiz1HZ
20,463352084,1540151812711497733,2022-06-24,Acabou de publicar uma foto em Jd Santo Eduardo Embú Das Artes https://t.co/nwcXNJNzG8
21,89541789,1540137823663276032,2022-06-24,O treino hj foi rápido… #muscle #musculação #smartfit #smartfitcapelinha #dc #dccomics #flash em Smart Fit Capelinha https://t.co/UsOS98vkbI
22,463352084,1540131066408828928,2022-06-24,Acabou de publicar uma foto em Jd Santo Eduardo Embú Das Artes https://t.co/zaLXkzJMUZ
23,463352084,1540117079386472449,2022-06-23,Bolo de Baunilha em Jd Santo Eduardo Embú Das Artes https://t.co/JLmyJCHGmw
24,596644061,1540068503520247808,2022-06-23,Boa Tarde...😛😛😛 https://t.co/Gbybvw3zTa
25,463352084,1539976359568502784,2022-06-23,Acabou de publicar uma foto em Jd Santo Eduardo Embú Das Artes https://t.co/Yq1kFF5eHw
26,995002436241719296,1539914224457187328,2022-06-23,Acabou de publicar uma foto em King Lub Lubrificantes https://t.co/suUt1I3W0j
27,104021345,1539881263066136577,2022-06-23,Acabou de publicar uma foto em Primeira Igreja Batista em Pq. Fernanda https://t.co/lUnp9Gi1Km
28,1250726909513797632,1539862454359957505,2022-06-23,Uma fotinha aleatória de vez em quando e bom https://t.co/L2AEkJVuOb
29,123530548,1539596484076634112,2022-06-22,"Mais um dia de trabalho fazendo o que gosto, cálculos e planejamento Previdenciário. #dicasdodoutor #inss2022 #aposentadorias em Rivaldo Emmerich Sociedade Individual de Advocacia https://t.co/jHzPf1FMfQ"
30,463352084,1539567382544257024,2022-06-22,Frito na hora em Jd Santo Eduardo Embú Das Artes https://t.co/eRjI67ikjS
31,104021345,1539516726001512448,2022-06-22,Acabou de publicar uma foto em Primeira Igreja Batista em Pq. Fernanda https://t.co/l5EzN5GS9v
32,896447564077289472,1539457492589084672,2022-06-22,Acabou de publicar uma foto em Universal Jardim Macedônia https://t.co/3GuOlXijV0
33,124879030,1539416284366086145,2022-06-22,Acabou de publicar uma foto em Shopping Santa Cruz https://t.co/BjGOrD3tQm
34,463352084,1539404766962401282,2022-06-22,Acabou de publicar uma foto em Jd Santo Eduardo Embú Das Artes https://t.co/pH38kLKZzc
35,339183004,1539401691799465984,2022-06-22,"#CachaçaChoraNoPau 
Meu primo Renato chorou no Pau!

#boanoite #caldeirão #maeeutonaglobo #mamãeeutônaglobo #issoaglobomostra #issoaglobonãomostra #perrenguenaband em Jd. Macedônia https://t.co/k2ruCmC7j2"
36,339183004,1539399207890698243,2022-06-22,"#OsChifrudos
#boanoite #caldeirão #maeeutonaglobo #mamãeeutônaglobo #issoaglobomostra #issoaglobonãomostra #perrenguenaband em Jd. Macedônia https://t.co/nHeTutCC1p"
37,55495952,1539366539320860673,2022-06-21,"3 publicações que vi, nesse último fds, que me chamaram atenção...

Fiz questão de compartilhar com vcs tbm!!!

#VerdadesDaVida.

🙌🏾🙏🏾❤🙏🏾🙌🏾 em Academia Blessed Health https://t.co/F1LTyK3e43"
38,60174364,1539310721804079104,2022-06-21,Acabou de publicar uma foto em Santa Breja Bar https://t.co/as8ddaSTZI
39,339183004,1539284837948858370,2022-06-21,"Um Banho pra despertar para um novo dia!
#bomdia #balançogeralsp em Jd. Macedônia https://t.co/qpyFnOLzJA"
40,2693227454,1539278704345587716,2022-06-21,"Rango de hoje
Picadinho, arroz, feijão, anéis de cebola, batata palha e abóbora cabotia.
Bom demais da conta

#vegan #vegano #vegetariano #govegan https://t.co/orxHjaFDG8"
41,339183004,1539277313438691330,2022-06-21,"#BomDia , #VamosAcordar  !

#maeeutonaglobo #mamaeeutonaglobo #issoaglobomostra #issoaglobonãomostra #caldeirao em Jd. Macedônia https://t.co/Gl2IDC7dgO"
42,463352084,1539251982728417284,2022-06-21,Acabou de publicar uma foto em Jd Santo Eduardo Embú Das Artes https://t.co/hoLmtmQS4G
43,463352084,1539192115158302721,2022-06-21,Acabou de publicar uma foto em Jd Santo Eduardo Embú Das Artes https://t.co/B0PGQGTpCt
44,463352084,1539187760766017536,2022-06-21,Frito na hora. em Jd Santo Eduardo Embú Das Artes https://t.co/zOWOyXhagG
45,43089906,1539181628169265153,2022-06-21,"I'm at Estação Campo Limpo (Metrô) - @metrosp_oficial in São Paulo, SP https://t.co/myHr2IWCOM"
46,104021345,1539156624182501378,2022-06-21,Acabou de publicar uma foto em Primeira Igreja Batista em Pq. Fernanda https://t.co/4roO3assqL
47,932429052035526656,1539141896634880001,2022-06-21,Just posted a photo @ Just Now https://t.co/qchBoR6RVI
48,463352084,1539090211904290817,2022-06-21,Acabou de publicar uma foto em Jd Santo Eduardo Embú Das Artes https://t.co/naPty7VTZ5
49,339183004,1539009979910324225,2022-06-20,Acabou de publicar um vídeo em Jd. Macedônia https://t.co/4OTEHbQdEZ
50,60174364,1538962447448539136,2022-06-20,"Bloody Pleasures 🍷
#santabreja #alternation #blutengel #blutengeltribute #blutengelcover #chrispohl #ulrikegoldmann #vikiscarlet #vampire #bloodypleasures #vamp #blood #gothicmusic #gothic #goth em Santa Breja Bar https://t.co/BtAKZGkXze"
51,1272907131293970442,1538949316592680962,2022-06-20,"Alguém sabe que máquina é essa é para que serve ?

#vemprasaoroque  #vempramairinque  #vempralocatudo🔝 em Condomínio Residencial Porta Do Sol https://t.co/EdVzVejh1s"
52,339183004,1538914390069624836,2022-06-20,Acabou de publicar uma foto em Supermecado Vencedor Atacadista https://t.co/UXQwRTgK2L
53,339183004,1538912799979626499,2022-06-20,"#SãoJoãoNasQuebradasDeSãoPaulo .

#SãoJoãoNaFavela #saojoaodecaruaru #saojoaodanadodebom #saojoao2022  #saojoaodebananeiras #osaojoaodebananeiras #saojoaodenoistudim em Jd. Macedônia https://t.co/j6BzT9u1bD"
54,339183004,1538910621604904961,2022-06-20,"#AguardenteDeCanaLevantaPau 
#levantapau #issoaglobomostra #issoaglobonãomostra #maeeutonaglobo #mamaeeutonaglobo #caldeirao #bomdia em Jd. Macedônia https://t.co/CzUwh43IIU"
55,339183004,1538909978655875072,2022-06-20,"Tomando na Quenga!
#boatarde #maeeutonaglobo #issoaglobomostra #issoaglobonãomostra #mamaeeutonaglobo em Jd. Macedônia https://t.co/EEYN6mNpSD"
56,142325755,1538830376440823809,2022-06-20,"I'm at Padaria Nova Juliana in São Paulo, SP https://t.co/ZpwgCpTZq3"
57,104021345,1538794668992999426,2022-06-20,Acabou de publicar uma foto em Primeira Igreja Batista em Pq. Fernanda https://t.co/bxbsjfkDAd
58,148883648,1538688738217365505,2022-06-20,Acabou de publicar uma foto em Paraíso https://t.co/LBAprKJYeH
