,author_id,tweet_id,created_at,text
0,32130620,1546915357721501696,2022-07-12,Acabou de publicar uma foto em Ambrosia Doces Artesanais por Aline Sartor https://t.co/yLtzvrJQpx
1,32130620,1546915159050010624,2022-07-12,Acabou de publicar uma foto em Ambrosia Doces Artesanais por Aline Sartor https://t.co/YnoNiY0gJv
2,91103142,1546891874467602432,2022-07-12,Acabou de publicar uma foto em Zona Sul de São Paulo https://t.co/lmnxaKT4vZ
3,85382677,1546812185820684293,2022-07-12,"Arrastadaaaaaaaa, mas foi!🤘🏻
Bora pra mais um dia… 
Bom dia, saite"
4,2306470621,1546661786455347200,2022-07-12,Realizar! Jô eu te amo e amo tudo o que você me proporciona 😭♥️ NÓS CONSEGUIMOS 🥇🏆 https://t.co/0qeu9Tn4pV
5,68795532,1546660076798328838,2022-07-12,Acabou de publicar uma foto em Zona Sul de São Paulo https://t.co/HblUBHDQ3U
6,2628977602,1546641480646889473,2022-07-11,#signodeleao♌ em Americanópolis-Zona Sul https://t.co/3Rna6wBwzt
7,2628977602,1546617265205952512,2022-07-11,"Se a luz apagar, acenda.... em Americanópolis-Zona Sul https://t.co/Hyc1YU38D9"
8,203973686,1546574408038367233,2022-07-11,"I'm at Creche Tiãozinho in São Paulo, SP https://t.co/qb6hq7BCqr"
9,207552047,1546534074147254272,2022-07-11,Acabou de publicar uma foto em Sao Paulo Capital https://t.co/ow4H9iKHt1
10,1436660029,1546499908986933249,2022-07-11,"11 Julho 2012

@palmeiras BICAMPEÃO Copa do Brasil. https://t.co/EcePjFC9Bu"
11,91103142,1546443894841278464,2022-07-11,Acabou de publicar uma foto em Cidade Ademar https://t.co/juhzguIFeF
12,84202338,1546318175888986118,2022-07-11,O que é belo e verdadeiro. em Vila Santa Catarina https://t.co/MIKICcTGpq
13,68795532,1546302053902868481,2022-07-11,Acabou de publicar uma foto em Zona Sul de São Paulo https://t.co/BPGhFOgakP
14,172466232,1546301807172911104,2022-07-11,Acabou de publicar uma foto em Zona Sul de São Paulo https://t.co/lrPUNbBlI2
15,54647342,1546268835514302465,2022-07-10,#animefriends2022 em Pavilhão de Exposições Anhembi https://t.co/zBbBAjwkfJ
16,91103142,1546247807828377600,2022-07-10,The place is shit but the view is grate em Cidade Ademar https://t.co/UrVty41T3E
17,15410917,1546231580682747904,2022-07-10,"Rumo as compras! (at @LeroyMerlinBra in São Paulo, SP) https://t.co/t18QW3EDP2"
18,1172915028,1546215372076072963,2022-07-10,😎 em Vila Marari https://t.co/8dvRQdRLeA
19,39267584,1546194941134643200,2022-07-10,"E lá vou eu… (@ Plataforma Breda in Sao Paulo, Sao paulo) https://t.co/Qn4BIMxHGI"
20,91103142,1546191664187723776,2022-07-10,Acabou de publicar uma foto em Cidade Ademar https://t.co/mAR7xKt0dN
21,1172915028,1546124921188876289,2022-07-10,Como eu esperava por dias assim…Em que ele pudesse tomar sol na calçada olhando a vida alheia tranquilamente…Passamos dias difíceis… em Vila Marari https://t.co/lHbh06VhP6
22,1520020871213207552,1545916312714706945,2022-07-09,@Beto1967B @trocafone @TrocafoneTech Acabei de passar em 1. Não compensa não.
23,102462023,1545916131222888448,2022-07-09,😗✌️ em Anime Friends https://t.co/3zYypdPuOE
24,240800341,1545873763387838464,2022-07-09,"Segundo tempo, começando a semana bem! em Cidade Ademar https://t.co/ElRSLGVfy6"
25,1172915028,1545844123994935297,2022-07-09,Eu preciso do soooolll e do barulho da chuva ❤️🎈 em Vila Santa Catarina https://t.co/1lh25LGIPs
26,203973686,1545827170257444864,2022-07-09,"I'm at Creche Tiãozinho in São Paulo, SP https://t.co/flwdQcNvTX"
27,240800341,1545826611798368256,2022-07-09,"Como ninguém é de ferro, sobremesa de pudim e sagu! em Cidade Ademar https://t.co/9cb5nri084"
28,240800341,1545808501724921856,2022-07-09,"Almoço com a família da nossa querida amiga Vanda. Estávamos com o Marcelo, Tânia e a Magaly! em Cidade Ademar https://t.co/aIvG0EfURd"
29,573309143,1545776339042684929,2022-07-09,Acabou de publicar uma foto em Jardim Italacomi https://t.co/P3BnZJUiM6
30,18464533,1545753685975867392,2022-07-09,Ahhhh @MaiaraMeM! Ahhhhhhhh! 🥵 https://t.co/BhaiSICDva
31,1098591459798892545,1545743088534134784,2022-07-09,Acabou de publicar uma foto em Cidade Ademar https://t.co/A3l92qUvEV
32,177743869,1545649286981058560,2022-07-09,PRETÉRITO E SUAS BOAS RECORDAÇÕES 🔥🔥🔥🔥 em Zona Sul de São Paulo https://t.co/clo9x3GZ0h
33,1098591459798892545,1545613425430171648,2022-07-09,Acabou de publicar uma foto em Cidade Ademar https://t.co/fNDWYlMQiv
34,1098591459798892545,1545612760972681218,2022-07-09,Acabou de publicar uma foto em Komback Casual Food https://t.co/5Tc5o2K5NH
35,1098591459798892545,1545612568672321538,2022-07-09,Acabou de publicar uma foto em Komback Casual Food https://t.co/AunEdZW5n0
36,1172915028,1545574126198444034,2022-07-09,Experiências científicas no Shopping! Lindeza da tia! Mas eu tive que implorar para ele parar de falar um pouquinho 🥲 em Vila Marari https://t.co/EQuj1miWa0
37,193927064,1545523791174029320,2022-07-08,"as noites com vocês são boas

(pronto, completei a fileirinha kk em Espaço das Americas, Sao Paulo https://t.co/HxZtDBTfgd"
38,190291491,1545513211889434625,2022-07-08,Acabou de publicar uma foto em VILA MASCOTE https://t.co/PcOMPQ5nil
39,152311321,1545506643978244096,2022-07-08,"Evita estos errores y comienza a ver resultados 😎✍️🏼

#gutytips en Sao Paulo Capital https://t.co/iboqrd3A4m"
40,970077257212538880,1545312525683662849,2022-07-08,"Ensaio do Drops de inverno..
#usefishmen #fishing #fishingislife https://t.co/rEWR4Y5F4L"
41,1364715298834833412,1545309599141662720,2022-07-08,@isanavass perdoada
42,23539355,1545228050413109249,2022-07-08,"Momento #tbt com o nosso único registro fotográfico aqui em minha casa no ano de 2019.

In memoriam @georgegandhirosa @georgeogandhi (1981-2021). em VILA MASCOTE https://t.co/soydk1HHuH"
43,1010349492036624385,1545223355615350787,2022-07-08,Tudo laddrão! em Sao Paulo Capital https://t.co/CNiHmKT3uJ
44,14503489,1545185345612173312,2022-07-07,"Bacana essa mesa lateral, hein ?! 🤗

Foi fabricada para nosso cliente Guilherme. 

Ferro em preto fosco e madeira na tonalidade castanheira. em Zona Sul de São Paulo https://t.co/FmULelrXZA"
45,21091150,1545080284776898563,2022-07-07,Trabalhando e estudando em Zona Sul de São Paulo https://t.co/idlsQT0L47
46,32130620,1545033475895484419,2022-07-07,Acabou de publicar uma foto em Ambrosia Doces Artesanais por Aline Sartor https://t.co/fIyKR4XQLh
47,21091150,1545017781720162306,2022-07-07,Sabe aquele livro que você compra baratinho e não dá nada para ele. Mas aí você começa a lê-lo e expande a sua mente. É esse! em Zona Sul de São Paulo https://t.co/f0MFXF5PkM
48,921197448885886977,1544989355776811015,2022-07-07,"McDonald's - São Paulo - Local pequeno para a quantidade enorme de clientes, sujo, atendentes claramente sobrecarregados. Banheiro uma desgraça: ao da... Food Poisoning https://t.co/5eBi2K5CgB #mcdonalds #nausea #diarrhea #vomiting #bloating #sweating #stomachpain"
49,271629865,1544986524281888769,2022-07-07,"#bdsp #trabalhoamador #prefeiturasp #faltadesenso #RecapeamentoGeorgeCorbisier
Absurdamente a prefeitura faz o que quer e quando quer sem se preocupar com os cidadãos, estacionando veículos e equipamentos em rua com mão dupla com apenas 01 via para cada sentido? Falta de senso... https://t.co/Fjo3JP0UWY"
50,85382677,1544983496153874432,2022-07-07,"Hoje foi na força do ódio, mas vambora https://t.co/YvkQzUhwow"
51,904265844468920320,1544853566359326721,2022-07-07,Acabou de publicar uma foto em Arnaldo Faria de Sá https://t.co/uCAReCSSWu
