,author_id,tweet_id,created_at,text
0,32130620,1544667146139082752,2022-07-06,Acabou de publicar uma foto em Ambrosia Doces Artesanais por Aline Sartor https://t.co/cCjfhhysxZ
1,32130620,1544666848335101952,2022-07-06,Acabou de publicar uma foto em Ambrosia Doces Artesanais por Aline Sartor https://t.co/ra6rzUalyc
2,91103142,1544618794227843072,2022-07-06,Acabou de publicar uma foto em Zona Sul de São Paulo https://t.co/LQM6jX1ejb
3,1486746692695298050,1544482843400835076,2022-07-06,Essa madrugada Tive um Sonho de Sonhador! Sonhei que esse camarada chamado @neymarjr @NeymarJrSite chegava no mais querido nosso @Flamengo... Nem pra se tornar real kkk. https://t.co/x5Sj04VnwL
4,1380387465756819456,1544323231309611012,2022-07-05,2 x 0 Vai timao e nois cara https://t.co/ggpvjk5zDJ
5,85382677,1544290434725416962,2022-07-05,"Ta pago (@ Templo Pilates in São Paulo, SP) https://t.co/F85qa6Xgoo"
6,84979022,1544284601962618880,2022-07-05,Acabou de publicar uma foto em IPESE Instituto Pró Essence de Ensino em Saúde e Estética https://t.co/FzIbtqrZH4
7,41709648,1544221478073384960,2022-07-05,Acabou de publicar uma foto em Onde Mora A Felicidade https://t.co/rRl6tqvhbX
8,1191808401325666305,1544055262029414401,2022-07-04,"""como é ser adm de uma página de memes no Instagram?""

eu: em Fazendo Arte https://t.co/tFTU8bZHIw"
9,76369244,1544020608954109953,2022-07-04,Longe para um caraliiio
10,32130620,1544013831021572096,2022-07-04,Acabou de publicar uma foto em Ambrosia Doces Artesanais por Aline Sartor https://t.co/eBWLWzB3RX
11,363978885,1544006483892994050,2022-07-04,"Segunda-feira: café fresco pra acordar e bom humor para recomeçar! ☕️

#coffeetime #segundafeira #novasemanacomeçando #digasimavida #sejaforteecorajoso em Jardim Jabaquara https://t.co/P5zi3OqvqZ"
12,438473416,1544005243368775685,2022-07-04,Acabou de publicar uma foto em Flor de Liz Escola de Samba https://t.co/fwJuWbmF4K
13,1492925601472262144,1543982114307280896,2022-07-04,Até o dia de hoje eu só tive boas recordações na minha Igreja ♱ (IPBCA). em Igreja Presbiteriana de Cidade Ademar https://t.co/4LBzmVkqjz
14,1492925601472262144,1543976235415511042,2022-07-04,Só cargueiro de qualidade 😎 em Avenida Cupecê https://t.co/umC7GOhwc0
15,91103142,1543941297752444930,2022-07-04,Acabou de publicar uma foto em Zona Sul de São Paulo https://t.co/eM1PKvQKid
16,91103142,1543916980633305088,2022-07-04,Acabou de publicar uma foto em Cidade Ademar https://t.co/NDAjHsmHtJ
17,438473416,1543733622083145728,2022-07-03,"Agradecemos a todos pela presença!!
Obrigado @dnielsou 
@pinhapresidente  tiramos onda 
Tmj até uma próxima em Flor de Liz Escola de Samba https://t.co/gScTq1orXr"
18,438473416,1543677049583304704,2022-07-03,Acabou de publicar uma foto em Flor de Liz Escola de Samba https://t.co/6snYLgdESI
19,438473416,1543675170958692352,2022-07-03,Acabou de publicar uma foto em Flor de Liz Escola de Samba https://t.co/yE1Ok7gTPA
20,53179056,1543584080138186752,2022-07-03,Olha a cara da felicidade que agora ela tem um cadeirão. Já que vai começar a comer. Muito amor minha princesa Catarina 💚💚💚💚💚 em Insanolândia https://t.co/QfNxLjqUUt
21,719932016360337408,1543545334172901386,2022-07-03,viciados em espelhos 💢 em Zona Sul de São Paulo https://t.co/t24cDRoaKF
22,94150452,1543431236936294400,2022-07-03,Acabou de publicar uma foto em Vila Marari https://t.co/6O6wNWZIIc
23,715919246052737024,1543327333758763009,2022-07-02,Bora pro Arraiá em Zona Sul de São Paulo https://t.co/5rDDISmfT0
24,2539116365,1543259238893486084,2022-07-02,Olha minha participação hoje no SP1...falando da leitura...com a excelente @sabina_simonato https://t.co/3AGyW1e6xM
25,53179056,1543235503188754432,2022-07-02,"Dia de fazer o curso para o Batizado, e olha quem foi junto . A coelhinha Catarina em Paróquia Nossa Senhora Do Perpétuo Socorro e Santa Rosalia https://t.co/hqiUemkQ0R"
26,854401910836690944,1543232238053105664,2022-07-02,Acabou de publicar uma foto em Sao Paulo Capital https://t.co/c6OEjuyKOF
27,2539116365,1543202364177489920,2022-07-02,"@chefdangalhardo Chef...batata rosti com bacon,peito de peru e mussarela que minha esposa faz e é maravilhosa https://t.co/tt85Fmfq5B"
