,author_id,tweet_id,created_at,text
0,1540785746436579328,1540789230812573697,2022-06-25,🍾🥂 https://t.co/2j0Qnd44jO
1,1120376289683214337,1540525587512676352,2022-06-25,Adriano excelente pessoa agradeço a Deus por sua vida meu camarada e prazer conhecer e poder trabalhar ao seu lado. Muito obrigado pelos toques e por não deixar eu sair correndo pelo Templo com câmera kkkkkk. https://t.co/boemq3uwqN
2,432816064,1540439423720067078,2022-06-24,17:52 https://t.co/DZpPLHXYFb
3,59005499,1540376225293541376,2022-06-24,Acabou de publicar uma foto em Zona Sul de São Paulo https://t.co/uHQYC1oLd3
4,309691828,1540334038111731712,2022-06-24,Acabou de publicar uma foto em Ellegancy Costuras https://t.co/7IqijnTwJ3
5,32130620,1540313191745470465,2022-06-24,Acabou de publicar uma foto em Ambrosia Doces Artesanais por Aline Sartor https://t.co/xRwyrlglU0
6,1098591459798892545,1540163730117275648,2022-06-24,"Vamos nessa?! Nossa comemoração continua! Pensa num Bar Top!!!!
#sextaferia 
#tirols 
#cidadeademar 
#zonasul em Tirol's Bar https://t.co/U83T0kp99F"
7,363978885,1540128630847815681,2022-06-24,Acabou de publicar uma foto em Jardim Jabaquara https://t.co/rSsGIOASYt
8,1215341028351389701,1540104292673245189,2022-06-23,Acabou de publicar uma foto em Zona Sul de São Paulo https://t.co/VM77VRSE3V
9,21653078,1540097080122802177,2022-06-23,Acabou de publicar uma foto em Guaratinguetá/SP https://t.co/pFOraDPFHB
10,1520020871213207552,1540086637417340934,2022-06-23,Tem que aguentar esse palmeirenses FDP na academia falando merda.
11,85317206,1540002934393634820,2022-06-23,"Vamos combinar de ser feliz?

Unhas a 4 mãos que duram uma vida e não quebram. Banho de gel pela @soraia73naildesigner e cuticulagem e esmaltação pela @carla_brandenburger 
Anéis @semijoias.kim em No Ar https://t.co/uF1URwXtIU"
12,1468413394097442819,1539964366736527361,2022-06-23,https://t.co/gmna6fzLZe
13,70837769,1539942764435181573,2022-06-23,Acabou de publicar uma foto em Diocese de Santo Amaro https://t.co/6Yf7gzJI1v
14,145095920,1539928286720958464,2022-06-23,Ser feliz é simples❤️ em Rua Do Céu https://t.co/d01m5WKRPe
15,94150452,1539594876299247616,2022-06-22,Acabou de publicar uma foto em Akira Motors Preparações https://t.co/BvJFR7JCR4
16,32130620,1539586417826873347,2022-06-22,Acabou de publicar uma foto em Ambrosia Doces Artesanais por Aline Sartor https://t.co/OtJv63ubnS
17,32130620,1539586211509067777,2022-06-22,Acabou de publicar uma foto em Ambrosia Doces Artesanais por Aline Sartor https://t.co/3sZQ5ChqCU
18,64727308,1539571295100231680,2022-06-22,Bom dia ☕️ em Zona Leste Vila Matilde https://t.co/e9XhZmHxhw
19,91103142,1539559683689746435,2022-06-22,Acabou de publicar uma foto em Zona Sul de São Paulo https://t.co/i3NvOMoiLR
20,1172915028,1539558996255952896,2022-06-22,Acabou de publicar uma foto em Vila Marari https://t.co/Km6QwmWbis
21,363978885,1539401083944050690,2022-06-22,Acabou de publicar uma foto em Cidade Ademar https://t.co/gibwFN4al8
22,309691828,1539358354790879232,2022-06-21,Acabou de publicar uma foto em Ellegancy Costuras https://t.co/ByKkAGEjhZ
23,277757351,1539279323500269569,2022-06-21,"trintei e como diria o poeta Emicida: “sucesso na missão, parceiro, é ter paz quando por a cabeça no travesseiro e conseguir manter quem te faz bem perto. Parabéns mamãe, seu projeto de MULHER feliz tá dando certo!” 🌿 https://t.co/rpohNAN7yU"
24,56807544,1539237947874082817,2022-06-21,"Excelente dia pra você!
#carpediem em Zona Sul de São Paulo https://t.co/u7KvVlq47Y"
25,420277730,1539096929988235266,2022-06-21,Acabou de publicar uma foto em Sao Paulo e Rio De Janeiro https://t.co/1qTfueYenX
26,1463599973191274503,1538920259649953792,2022-06-20,Acabou de publicar uma foto em Shopping Interlagos - Oficial https://t.co/KKeUQhFiyV
27,1515068567166857217,1538894193522778112,2022-06-20,Acabou de publicar uma foto em Rio De Janeiro - Ponte Rio Niterói https://t.co/AHz5aHqEHi
28,1172915028,1538879488544612353,2022-06-20,Acabou de publicar uma foto em Vila Marari https://t.co/KwQUtfoLfU
29,32130620,1538867010033045505,2022-06-20,Acabou de publicar uma foto em Ambrosia Doces Artesanais por Aline Sartor https://t.co/qkNWQik3sq
