,author_id,tweet_id,created_at,text
0,1516181275178119171,1533952394207416321,2022-06-06,"https://t.co/DP3a9CCMwO 
📌 Faça já o seu pedido 
📌Aceitamos cartão 
📌Entrega discreta https://t.co/XIKWrM24PW"
1,1516181275178119171,1533951046556467207,2022-06-06,@SexyShop14 https://t.co/MIfVKboLpn
2,199310784,1533917865958641666,2022-06-06,Acabou de publicar uma foto em Advec Vila Mascote https://t.co/tuzxdyDT5n
3,208555685,1533878532945895424,2022-06-06,Acabou de publicar uma foto em Zona Sul de São Paulo https://t.co/M1nbuKZkki
4,1172915028,1533854718849699840,2022-06-06,Acabou de publicar uma foto em Vila Marari https://t.co/yfhDdIfmhK
5,84979022,1533817411924901890,2022-06-06,Turma presencial de Fototerapia clínica em São Paulo no @ipeseinstituto em IPESE Instituto Pró Essence de Ensino em Saúde e Estética https://t.co/bboKBiPfZm
6,1523447132241473537,1533816221983989761,2022-06-06,que cheiro de peido esse hospital tem
7,1172915028,1533769893740437506,2022-06-06,Voltamos a programação normal…Café com Processo Civil! Hj tem prova🥹 em Vila Marari https://t.co/UlNKTWIbWM
8,1295409492688023558,1533664980943388672,2022-06-06,Se liga meu povo em Vila Santa Catarina https://t.co/Rka0eYLPPl
9,191577392,1533636001737875457,2022-06-06,"Tentamos, mas dessa vez não deu... ☣☢ em Zona Sul de São Paulo https://t.co/O84ep5Ocvl"
10,21653078,1533634285206269952,2022-06-06,Acabou de publicar uma foto em Guaratinguetá https://t.co/hcx8LVM1wL
11,363978885,1533590659331809280,2022-06-05,Acabou de publicar uma foto em Cidade Ademar https://t.co/GYm41sS5bY
12,1611630548,1533590418750832642,2022-06-05,"Finalmente fui a #camposdojordão 😆 hehehe e simplesmente ameiii💜

Voltaremos com certeza✅️🙏 em Campos Do Jordão/ Centro Capivari https://t.co/7KO6ukuqt9"
13,1363359051757875203,1533519532156928001,2022-06-05,to bonito
14,1363359051757875203,1533519349528526850,2022-06-05,jaja eu to chegando
15,1363359051757875203,1533519205806526464,2022-06-05,que fome
16,105494659,1533511114213974018,2022-06-05,Que doguinho sério rs... 🙈🐶 em Condomínio Villaggio Di San Remo https://t.co/dENM3uqeXS
17,23539355,1533490643724554240,2022-06-05,"Omelete de atum com batatas chips.

Acompanha suco de laranja.

Servido(a)?

#Domingou 
#almocodedomingo 
#comidadesolteiro 
#cozinhaemcasa 
#comidacaseira 
#cozinhasaudavel
#omelete em VILA MASCOTE https://t.co/kkfcBXeCot"
18,85382677,1533466365943861248,2022-06-05,"I'm at Salamanca in São Paulo, SP https://t.co/D7GqUfpSj2"
19,37755734,1533264564510498818,2022-06-05,"Testando perucas e maquiagem...
Pra que dormir se a gente pisca né?
#cosplay #WandaVision #WandaMaximoff em Eskudeiro's Bar https://t.co/NdFH7kqeb0"
20,747577257795985409,1533188149542653952,2022-06-04,Acabou de publicar uma foto em Jardim Macedonia https://t.co/YbWJloG4R0
21,4005745996,1533184507490230274,2022-06-04,Vou surfar no baile tipo kelly slater 🏄🏻‍♀️ em SUAVE https://t.co/i7w33PkYS2
22,20140329,1533167467706695685,2022-06-04,@mano_oreia33 Isso
23,3927849683,1533106782410792960,2022-06-04,"A SUA RENUNCIA HOJE VAI TE TRAZER O RESULTADO QUE VOCE TANTO QUER!
O SEGREDO É  FAZER AQUILO QUE NÃO  QUER AGORA , PARA AMANHÃ  TER O QUE SEMPRE SONHA"
24,73493771,1533091550699438081,2022-06-04,"I'm at Shopping Interlagos - @shop_interlagos in São Paulo, SP https://t.co/rSIjFWQ3ic"
25,1172915028,1533091383690424321,2022-06-04,Dia da família em Vila Marari https://t.co/sHitZjHXZt
26,1172915028,1533050599683530752,2022-06-04,"Pode mini pizza no café da manhã? Você pode tudo miga, a casa é sua e você merece tudo o que você quiser! 🥰❤️ em Vila Marari https://t.co/CMwWzIHsi1"
27,1303109617241731074,1532849374736306176,2022-06-03,é o nargas https://t.co/vmZfMN0GPL
28,1375175286778691593,1532815685386227712,2022-06-03,"""Quando Você Constrói Em Silêncio 🤫,As Pessoas Não Sabem O Que Atacar. em Shopping Interlagos https://t.co/BXtNynPXc7"
29,1191808401325666305,1532801777862590464,2022-06-03,"a vida privada da privada brisada

#memes #memepage
#funny #memesengraçados #memesbrasil #memester #funnymemes #memesdaily em Fazendo Arte https://t.co/hAijgY6ncB"
30,1463438926232887299,1532752373554241536,2022-06-03,Bora ali https://t.co/CHJVsJ5sps
31,363978885,1532728456848371712,2022-06-03,Just posted a photo @ Cidade Ademar https://t.co/DJYlMUWUEa
32,177743869,1532617371319316481,2022-06-03,VIVA LÁ VIDA ♥️♥️♥️ em Zona Sul de São Paulo https://t.co/1eTmNksAsF
33,91103142,1532516742626410514,2022-06-03,Acabou de publicar uma foto em Bluefit https://t.co/LBgWOmhxKg
34,1494400383762018306,1532512107597529096,2022-06-02,"Rolou turismo Glorioso em Curitiba também, já com saudade de ver meu @Botafogo 🖤🤍🔥 https://t.co/u6BneUIRYb"
35,1172915028,1532388216485052416,2022-06-02,A Gabi arrasa! Eu amei o resultado! Obrigada por cuidar de mim com carinho e elevar minha auto estima @studiosalimadesign em Vila Marari https://t.co/OKTS0fji5j
36,722638869175365632,1532333772921663491,2022-06-02,Acabou de publicar uma foto em Zona Sul de São Paulo https://t.co/om7SURXEpd
37,946183106,1532153084499091456,2022-06-02,"29/05 
Impossível escolher melhores momentos desse dia então vou ser breve @ Espaço das Americas, Sao Paulo https://t.co/ADe9xHyGXc"
38,37755734,1532147461967552513,2022-06-01,A cara de alegria (sqn) de quem tem que dividir minha perna com as irmãs humanas... 😅 em Eskudeiro's Bar https://t.co/UMzr7stgpW
39,363978885,1532145555606056960,2022-06-01,Acabou de publicar uma foto em Jardim Jabaquara https://t.co/NiD8tO7SRl
40,1513286037191155721,1532145005464281089,2022-06-01,Tu gosta não gosta ? https://t.co/f7xvBJkmqI https://t.co/cqhR2fbd6C
41,32130620,1532117113598578688,2022-06-01,Acabou de publicar uma foto em Ambrosia Doces Artesanais por Aline Sartor https://t.co/5sw79gdmPy
42,455654239,1532016719606185985,2022-06-01,"Na caminhada ontem (31) pelo #CapãoRedondo, tive a oportunidade de encontrar o genial artista @manobrown.

Para mim, é claro que a luta por um futuro melhor passa pelo incentivo à cultura, pelo combate ao racismo e pela valorização das periferias.

Juntos na luta! https://t.co/BnK5w8wXUt"
